|character|text|type|character_clean|gender
767|DAPHNE|Just park behind the Studebaker.|speech|DAPHNE|F
768||53   EXT. RICHARD'S CABIN / INT. EASY'S PONTIAC                      53|unknown||
769||"The Studebaker is parked at a deadend in the street.    Easy
pulls in behind.
The cabin is so overgrown with ivy that all this is visible
is the mailbox and address."|stage direction||
770|DAPHNE|Did you bring a gun or something?|speech|DAPHNE|F
771||EASY|unknown||
772|DAPHNE|What?   No.|speech|DAPHNE|F
773|DAPHNE|"Easy, that's not very smart.
Everybody carries a weapon now a
days."|speech|DAPHNE|F
774||(defensively)|unknown||
775|EASY|Well then where's yours?|speech|EASY|M
776|DAPHNE|"Search me sometime.   You'll find
it."|speech|DAPHNE|F
777||She gets out of the car.|stage direction||
778||EASY|unknown||
779|DAPHNE|Damn...|speech|DAPHNE|F
780||He frowns and gets out of the car.|stage direction||
781||"54   OMIT                                                            54
55   EXT. RICHARD'S CABIN - NIGHT                                    55"|unknown||
782||"Daphne waits, clutching her suitcase and lets Easy lead the
way.
They get to the door and find it ajar.    Easy takes a look
inside and then cautiously steps in."|stage direction||
783||"53.
56   INT. RICHARD'S CABIN - NIGHT                                        56"|unknown||
784||"He flicks on the wall switch. It's a typical little
hideaway that the rich kept for summer use. The living
room, dining room, and kitchen are all in one with a long
counter separating the kitchen.
On the left is a wooden couch with a Mexican rug thrown
across it and a metal chair with tan cushions for the seat
and back. The opposite wall is all glass with the city
lights blinking in the distance."|stage direction||
785||DAPHNE|unknown||
786|DAPHNE|Mr. McGee...|speech|DAPHNE|F
787||No answer.   Easy leads them to a door and opens it.|stage direction||
788||57   BEDROOM                                                             57|unknown||
789||"Another wall of glass and
A DEAD MAN spread out on the king-sized bed, with the
contents of the dresser and closet strewn all over the room."|stage direction||
790||DAPHNE|unknown||
791|DAPHNE|Oh, my God!|speech|DAPHNE|F
792||"She gags and backs out of the room with her hand over her
mouth in case she throws up.
Easy takes out a handkerchief and holds it over his mouth
and nose as he gets a closer look at the body.
It's the drunk white man he had seen at John's Speakeasy in
the same blue suit. He's lying on his back like a crucifix
with a butcher knife buried in his chest. There's blood
that has drained from his chest and gathered around his face
and hair so dark and thick you could scoop it up like Jello.
Easy actually does throw up and doubles over, dropping to a
knee to keep his balance and some control. He stays there
for several moments regaining his composure and then spots a
spilled ashtray and a cigarette butt. He lifts it off the
floor and smells it. He wipes his mouth with the
handkerchief and then wraps the butt inside and puts it in
his pocket. He gets up."|stage direction||
793||EASY|unknown||
794|DAPHNE|Daphne!|speech|DAPHNE|F
795||"He hears a CAR ENGINE start up and GEARS SHIFTING.     Then
runs out the door."|stage direction||
796||"54.
58   EXT. RICHARD'S HOUSE - NIGHT                                       58"|unknown||
797||"A pink Studebaker whips backward out the driveway. Easy
runs alongside trying to stop Daphne as she screeches into
the street."|stage direction||
798||EASY|unknown||
799||Hey, wait a minute!|location||
800||She speeds off down the canyon.|stage direction||
801||EASY|unknown||
802||Dammit!|location||
803||He stands in the middle of the street, watching her go.|stage direction||
804||59   INT. EASY'S CAR - SUNRISE                                          59|unknown||
805||"Fiery orange light bounces off the hood of the car into
Easy's face as he turns the corner onto his block. He is
surprised to see
A WHITE CADILLAC parked in front of his house.      And now it's
his front door that's open.
BACK TO EASY
He pulls in behind the Caddy and gets out."|stage direction||
806||60   INT. EASY'S HOUSE                                                  60|unknown||
807||"He pushes open the door. Shariff loiters just inside,
grinning at him, and Manny stands in the middle of the
living room looking at the floor. From a RADIO in another
room Tommy Dorsey plays ""Blue Skies"" with Frank Sinatra out
front. And so Easy walks past the two hoods into
THE KITCHEN
Albright turns from looking out the backyard window with a
porcelain coffee cup cradled in his right hand."|stage direction||
808||ALBRIGHT|unknown||
809||Easy.|location||
810||"Easy looks at the coffee pot on the stove and again at
Albright, smiling loose and friendly but looking tired in
the same clothes he had on at the pier."|stage direction||
811||EASY|unknown||
812||What you doin' in my house, man?|location||
813||ALBRIGHT|unknown||
814||"I expected you to be home, so Manny
used a screwdriver on the door.
What happened to your face?"|location||
815||"55.
60   CONTINUED:                                                      60"|unknown||
816|EASY|"You got no excuse to be breakin'
into my house -- What if I broke
into your place?"|speech|EASY|M
817||(still smiling)|unknown||
818|ALBRIGHT|"I'd tear your nigger head out by
its root."|speech|ALBRIGHT|M
819||"Easy boils inside and then goes over to the counter to pour
himself a cup of coffee."|stage direction||
820|EASY|So what do you want?|speech|EASY|M
821|ALBRIGHT|"Where have you been this time of
morning, Easy?"|speech|ALBRIGHT|M
822|EASY|"I went to see a girl. Don't you
get none, Mr. Albright?"|speech|EASY|M
823||"The smile leaves Albright's face and his eyes turn even
colder."|stage direction||
824|ALBRIGHT|"I didn't come here to play, boy.
You got my money in your pocket and
we've been over at that address
waitin' all night for Frank Green
and now we've found out that he
moved from there over a year ago."|speech|ALBRIGHT|M
825||Easy is scared and confused but he plays it off.|stage direction||
826|EASY|"So what do you want me to do about
it? You don't think I did my job.
Shit, I give you the money back."|speech|EASY|M
827||"And he reaches for his pocket, but Albright reaches too --
and suddenly, Manny and Shariff are in the room and on Easy
like a vice. Albright presses the barrel of the .45 against
Easy's forehead."|stage direction||
828|ALBRIGHT|"Do you believe in God, Easy?
'Cause I'm curious to see if death
is any different for a religious
man."|speech|ALBRIGHT|M
829||Easy looks down, away from the gun, and swallows hard.|stage direction||
830||"56.
60   CONTINUED:   (2)                                                60
EASY"|unknown||
831|ALBRIGHT|I seen her.|speech|ALBRIGHT|M
832||"After a moment, everyone relaxes and Easy sags out from
under their grip and staggers into"|stage direction||
833||61   THE LIVING ROOM                                                 61|unknown||
834||"Manny and Shariff surround him as he sits down in a chair
and Albright stalks in holstering his gun."|stage direction||
835||ALBRIGHT|unknown||
836|ALBRIGHT|Where?|speech|ALBRIGHT|M
837|EASY|"She called me. Had me drive up to
the Hollywood Hills."|speech|EASY|M
838|ALBRIGHT|How'd she know about you?|speech|ALBRIGHT|M
839|EASY|"I guess Coretta... the girl that
told me about Daphne and Frank
Green."|speech|EASY|M
840|ALBRIGHT|Why didn't you call me?|speech|ALBRIGHT|M
841|EASY|"I couldn't. She threatened to tell
the cops that I had killed
Coretta..."|speech|EASY|M
842||Albright looks over at his henchmen.|stage direction||
843||ALBRIGHT|unknown||
844|EASY|Where is she?|speech|EASY|M
845||EASY|unknown||
846|EASY|She took off.|speech|EASY|M
847||"ALBRIGHT
(dangerously)"|unknown||
848|EASY|Where is she?|speech|EASY|M
849|EASY|"I don't know! While I was looking
at the body she split."|speech|EASY|M
850||(nodding)|unknown||
851|ALBRIGHT|Uh-hunh.|speech|ALBRIGHT|M
852||"57.
61   CONTINUED:                                                       61"|unknown||
853||"Albright looks around the room as if answers lie in the
corners, but he is not surprised to hear about a body."|stage direction||
854|ALBRIGHT|You call the cops?|speech|ALBRIGHT|M
855|EASY|"I tried my best to keep in the
speed limit. That's all I did."|speech|EASY|M
856|ALBRIGHT|What'd she do, take his car?|speech|ALBRIGHT|M
857||EASY|unknown||
858|ALBRIGHT|Hunh?|speech|ALBRIGHT|M
859||ALBRIGHT|unknown||
860|ALBRIGHT|McGee.   Did she take his car?|speech|ALBRIGHT|M
861||"Easy hesitates, ""How did Albright know his name?"""|stage direction||
862||EASY|unknown||
863|ALBRIGHT|Uh... Yeah...|speech|ALBRIGHT|M
864|ALBRIGHT|Where'd you pick her up at?|speech|ALBRIGHT|M
865|EASY|She left that place--|speech|EASY|M
866|ALBRIGHT|--Write it down!|speech|ALBRIGHT|M
867||"To his shame Easy flinches and gets paper from his end
table, then scribbles down the address and hands it to
Albright who takes Easy's seat and examines the note."|stage direction||
868|ALBRIGHT|Get me some whiskey, Easy.|speech|ALBRIGHT|M
869||"Easy studies Albright who sits knees wide apart, now the
master of the house, and he can't help himself."|stage direction||
870|EASY|"Get it yourself... Bottle's in the
cabinet."|speech|EASY|M
871||"Albright looks up and Easy braces himself for Albright to
bring on the end, all at once. But slowly a smile spreads
across Albright's face and he laughs, stamping his foot."|stage direction||
872||"58.
61   CONTINUED:   (2)                                               61"|unknown||
873|ALBRIGHT|"Well, I'll be damned. Get us a
drink, Manny... Easy, you're a
brave man. I need a brave man
working for me... But you gotta
find Frank Green, so he can lead us
to her."|speech|ALBRIGHT|M
874|EASY|"No, thanks, Mr. Albright. People
are gettin' killed all around me...
You never said anything about all
this..."|speech|EASY|M
875|ALBRIGHT|"Easy, you're connectable to two
murders. You'll do whatever I tell
you to do."|speech|ALBRIGHT|M
876||"Manny brings Albright's drink and the captain turns it up
and gives Manny back the glass."|stage direction||
877||"ALBRIGHT
(continuing)"|unknown||
878|ALBRIGHT|"Now you got three days to find him.
And you make sure you count 'em
right."|speech|ALBRIGHT|M
879||"He walks out the screen door with Manny and Shariff
following."|stage direction||
880||62   KITCHEN                                                        62|unknown||
881||"Easy grabs the bottle from the counter, where Manny has left
it, and pours himself a stiff one. But he only stares into
the glass.
FLASHBACK:"|stage direction||
882||63   EXT. BATTLEFIELD - DAY                                         63|unknown||
883||"Dense black smoke masks everything but two vague figures in
a struggle. The BOOM of heavy artillery gives way only to
the deafening CHATTER of automatic fire.
We are hurtling forward into a horror-stricken Easy in
combat gear, repeatedly stabbing an already lifeless German
soldier. Tears are streaming down Easy's face, his mouth
gaped open in an inaudible SCREAM."|stage direction||
884||64   BACK TO SCENE                                                  64|unknown||
885||He studies the glass and pushes it away.   Then looks|stage direction||
886||"59.
65    OUT THE WINDOW                                                  65
Albright and his two goons get in the white Caddy and cruise
away.
66    BEDROOM                                                         66
He dials the operator."|unknown||
887|EASY (V.O.)|"I needed help... Albright didn't
flinch at hearing that Coretta was
dead and he seemed to know all
about Richard McGee too..."|speech|EASY|M
888|OPERATOR (O.S.)|Number please...|speech|OPERATOR|M
889|EASY|Raymond Alexander on...|speech|EASY|M
890||"He pauses, speechless as
OPERATOR (O.S.)"|unknown||
891|EASY|Yes?|speech|EASY|M
892||(after a moment)|unknown||
893|EASY|Forget about it, operator.|speech|EASY|M
894||"He hangs up, his eyes trained in thought.
A67   EXT. JOPPY'S BAR - DAY                                         A67
A crowd has gathered along the street to watch a three
convertible car caravan: the first car bearing a four-place
band playing ""Happy Days Are Here Again""; the second with
someone who could be Lana Turner holding up a ""Teran for
Mayor"" placard with a man in the front passenger seat
announcing through a megaphone; and last, but hardly least,
Matthew Teran blowing kisses and waving two small American
flags.
Easy looks up for a moment as he closes the trunk of his car
to watch the parade. Then stuffs a ball peen hammer in the
waistband at the small of his back, under his jacket.
He walks with a purpose into the open door next to the
butcher shop.
B67   INT. JOPPY'S BAR                                               B67
Easy stops in the doorway, seeing
JOPPY as usual buffing the marble top of his bar. T-Bone
Walker's ""They Call It Stormy Monday"" is on the jukebox.
60.
B67   CONTINUED:                                                    B67
BACK TO EASY
He scans the bar and sees that there are no customers, and
walks in.
JOPPY"|unknown||
895||Hey, Easy.|location||
896||"Easy stops at the bar and stares at Joppy.
EASY"|unknown||
897||That girl called me last night.|location||
898||JOPPY|unknown||
899||What girl is that?|location||
900||EASY|unknown||
901||The one your friend is lookin' for.|location||
902||JOPPY|unknown||
903||"Uh, huh.   That's pretty lucky,
hunh?"|location||
904||EASY|unknown||
905||"No, Joppy... Wasn't no luck at all.
It was you."|location||
906||"Joppy inadvertently clenches his fists and notices Easy's
aggressive stance.
EASY"|unknown||
907||"You and Coretta was the only ones
that had my phone number who knew I
was lookin' for her. And Coretta
was busy scammin' Daphne so she
wouldn't have done it... It was
you, man."|location||
908||JOPPY|unknown||
909||Maybe she looked in the phone book.|location||
910||EASY|unknown||
911||I ain't in the phone book, Joppy...|location||
912||"Joppy's eyes narrow.
JOPPY"|unknown||
913||"What the hell you mean, coming up
here all mad like you gonna do
something?!..."|location||
914||"61.
B67   CONTINUED:   (2)                                              B67
EASY
(yelling)"|unknown||
915||"You damn right! Coretta's dead!
Your friend Albright is on my ass.
The cops done brought me down once
-- Why didn't you just tell
Albright your damn self?"|location||
916||"JOPPY
(yelling back)"|unknown||
917||"What did I tell you? To just take
that man's money! I didn't tell
you to do nothin'! I call myself
trying to help you save your
house... Don't come up in here
startin' no shit with me."|location||
918||"And he pulls a baseball bat from behind the bar, but Easy
has pulled his hammer and SMACKS it down hard, cracking the
beveled wood that frames the marble.
JOPPY
(continuing; panicked)"|unknown||
919||"Easy, wait! Watch my marble! My
uncle left me that when he died!"|location||
920||EASY|unknown||
921||"And goddammit, he's about to get it
back."|location||
922||"He draws back for the downswing, and Joppy drops the
baseball bat, holding up his hands.
JOPPY"|unknown||
923||Let's talk.   Let's just talk.|location||
924||EASY|unknown||
925||What you got me into, Joppy?!|location||
926||"Joppy inhales, forcing himself to be calm.
JOPPY"|unknown||
927||"She asked me to help her 'cause I
told her that Albright was lookin'
for her. And I figured I could
help you make a few bucks and throw
Albright off the trail too. She
wanted to know something about you
so I told her... I guess I must've
give her your phone number..."|location||
928||EASY|unknown||
929||Where is she, man?|location||
930||"62.
B67   CONTINUED:   (3)                                                B67
JOPPY"|unknown||
931||I don't know...|location||
932||EASY|unknown||
933||Don't lie to me, Joppy!|location||
934||JOPPY|unknown||
935||"I ain't lyin'... I don't even know
her that good. She just asked me
to help her. And she asked me not
to tell nobody... I guess 'cause of
her and Frank Green."|location||
936||EASY|unknown||
937||What's she runnin' from Joppy?|location||
938||JOPPY|unknown||
939||"I swear I don't know. She didn't
tell me. I didn't mean to get you
into nothin', Easy... I just... she
just... I mean you seen her,
Easy... Man, she's something else."|location||
940||"Easy can see ""sucker"" written all over Joppy as he fumbles
for a cigarette with one hand and shakes his head with
disgust as he lights up.
EASY"|unknown||
941||"Damn, Joppy. Is there any white
woman that ever gave you the time
of day that you wasn't a sucker
for?"|location||
942||"Joppy frowns painfully and continues to wipe the bar.
67    EXT. T. CARTER FOUNDATION - DAY                                 67
Easy turns into the winding driveway through the stone
entrance way that bears the name of this distinguished
institution on a bronze plate.
He parks the car and gets   out, adjusting his dark brown
Stetson which matches his   pin-stripped suit. He looks
around at the massive and   well manicured grounds and walks
into a patio area of this   Spanish-style complex.
EASY (V.O.)"|unknown||
943||"Albright had said that when you're
mixed up in something it's best to
be mixed up to the top. I could
see his point. So that's where I
was going... all the way to the
top."|location||
944||"63.
68   EXT. CARTER FOUNDATION PATIO                                   68"|unknown||
945||"An ELDERLY SECRETARY descends an outdoor curved stairway
carrying a file. She spots Easy looking around confused and
immediately becomes annoyed."|stage direction||
946||"SECRETARY
May I help you?"|unknown||
947||"Uh... yes.   I came to see Mr.
Carter.
SECRETARY
Do you have an appointment?
EASY
No, I don't.
SECRETARY
Well, I'm sorry, but Mr. Carter is
a very busy man."|unknown||
948||Easy pulls out Albright's business card and hands it to her.|stage direction||
949||"EASY
Well, tell him Mr. Albright sent
me, and it's real important."|unknown||
950||"She looks at the card and then up at Easy with annoyed
superiority."|stage direction||
951||"SECRETARY
May I ask the nature of your call,
Mister...?
EASY
Rawlins. But I'm not so sure he'd
want me to tell you.
SECRETARY
I'm quite sure, Mr. Rawlins, that
whatever you know is nothing I
can't know as well.
EASY
Okay. Well, anyway, tell him I'm
here with information about that
little chippy of his that dumped
him.
SECRETARY
Is this some sort of joke?
O.S. VOICE
Uh... Excuse me...
64.
68   CONTINUED:                                                     68"|unknown||
952||"Easy and the secretary turn to see a TALL MAN in a dark grey
suit with bushy black hair and thick eyebrows standing in
the doorway. He forces a smile and comes out."|stage direction||
953|BAXTER|Mr. Rawlins was it?|speech|BAXTER|M
954||He holds out his hand and Easy shakes it.|stage direction||
955||EASY|unknown||
956|BAXTER|Yes.   Mister...|speech|BAXTER|M
957|BAXTER|Baxter.|speech|BAXTER|M
958||(to the secretary)|unknown||
959|BAXTER|I'll take care of this.|speech|BAXTER|M
960||(and back to Easy)|unknown||
961|BAXTER|Why don't you come with me, sir?|speech|BAXTER|M
962||They walk through the door into|stage direction||
963||69   A HALLWAY                                                      69|unknown||
964|BAXTER|"Not very smart talking about Mr.
Carter's business to a secretary."|speech|BAXTER|M
965|EASY|"I don't wanna hear it, man. It's
too much goin' on for me to give a
damn about what you think is smart."|speech|EASY|M
966||"Baxter bristles up and slows down his walk, about to put
Easy in his place. But Easy slows down too and squares up
on him. Baxter reconsiders and leads the way up a stone
staircase."|stage direction||
967||70   INT. CARTER'S OFFICE                                           70|unknown||
968||"Baxter ushers Easy into a huge elegantly furnished room more
closely resembling a hall than an office with large arched
doors and windows leading out onto a stone veranda
overlooking a canyon.
Alone looking out at the greenery on the opposite hillside
is TODD CARTER.
Baxter walks out and speaks with Carter, while Easy watches
them from inside the office. The rich man perks up with
interest and hurries inside with Baxter who throws Easy a
dirty look on his way out. He pauses uncertainly wearing a
simple Sears Roebuck-looking tan suit with a plain open-
collared white shirt. The dark circles under his eyes show
nights without sleep."|stage direction||
969||"65.
70   CONTINUED:                                                    70
CARTER"|unknown||
970|EASY|Mr. Rawlins.|speech|EASY|M
971||"He runs a hand through his thinning red hair, and offers an
overstuffed sofa. They sit on either end."|stage direction||
972||(distraught)|unknown||
973|CARTER|Has something happened to Daphne?|speech|CARTER|F
974|EASY|"The last time I saw her she looked
fine."|speech|EASY|M
975||CARTER|unknown||
976|EASY|You saw her?|speech|EASY|M
977||EASY|unknown||
978|EASY|Yeah.   Last night.|speech|EASY|M
979|CARTER|She's still in town?|speech|CARTER|F
980|EASY|She was last night.|speech|EASY|M
981|CARTER|"What did she say -- what was she
wearing?"|speech|CARTER|F
982||EASY|unknown||
983|CARTER|A blue dress.    Blue heels.|speech|CARTER|F
984|CARTER|And a pin on her chest?|speech|CARTER|F
985|EASY|Yeah, on the left side.|speech|EASY|M
986||"CARTER
(carried away)"|unknown||
987|EASY|"Oh yes, that's her. That's her.
You know I've never known a woman
who could wear perfume so slight
that--"|speech|EASY|M
988|EASY|--Mr. Carter, Mr. Carter--|speech|EASY|M
989|CARTER|"What did she say? What did she
say?... Oh, I'm sorry. Brandy?"|speech|CARTER|F
990||"66.
70   CONTINUED:   (2)                                              70"|unknown||
991||"He points to a crystal decanter near Easy. Easy pours
himself a drink and takes in Carter as he wrings his hands
to keep from going to pieces. This guy's got it bad."|stage direction||
992||EASY|unknown||
993|CARTER|"Mr. Carter. I came here to get
some answers."|speech|CARTER|F
994|CARTER|Yes...?|speech|CARTER|F
995|EASY|"I don't know... I'm takin' a
helluva chance..."|speech|EASY|M
996||"Carter runs his hand through his hair again, the suspense
killing him."|stage direction||
997||(continuing)|unknown||
998|EASY|"I guess it's just that when I'm
working for somebody, I wanna know
what I'm gettin' myself into..."|speech|EASY|M
999||Carter leans in as if he missed something.|stage direction||
1000|CARTER|I beg your pardon.|speech|CARTER|F
1001|EASY|"Well, I'd like to know the real
reason why Mr. Albright hired me."|speech|EASY|M
1002||"CARTER
(after a moment)"|unknown||
1003|EASY|Mr. Albright?|speech|EASY|M
1004||EASY|unknown||
1005|EASY|"Yeah. The man you hired to find
Daphne."|speech|EASY|M
1006|CARTER|"There must be some mistake... I'm
sorry, busy... Who are you talking
about?"|speech|CARTER|F
1007||"Easy and Carter stare at each other, not sure how to
proceed."|stage direction||
1008|EASY|"You didn't hire somebody to find
your girlfriend?"|speech|EASY|M
1009||"67.
70   CONTINUED:   (3)                                                 70"|unknown||
1010|CARTER|"No... Until just now I was sure
that she was hundreds of miles away
from here... You say someone is
looking for her?"|speech|CARTER|F
1011||"Easy nods, his brow furrowed in thought. Carter gets up and
walks to the door, looking out into the canyon."|stage direction||
1012||(half to himself)|unknown||
1013|CARTER|Someone is looking for her.|speech|CARTER|F
1014|EASY|What's goin' on between you two?|speech|EASY|M
1015||Carter shrugs and stammers nervously.|stage direction||
1016|CARTER|"Uh... I don't know... We were going
to be married... We had a fight..."|speech|CARTER|F
1017||(then recovering)|unknown||
1018|CARTER|"Uh... that's none of your concern,
Mr. Rawlins."|speech|CARTER|F
1019||"He stops and looks to the floor, the gravity pulling him
down... way down."|stage direction||
1020||(continuing)|unknown||
1021|CARTER|"Someone's... after her? A Mr.
Albright? And he said he's working
for me?"|speech|CARTER|F
1022|EASY|"Yeah... Do you know a man named
Richard McGee?"|speech|EASY|M
1023|CARTER|No... I can't say that I do.|speech|CARTER|F
1024|EASY|"Why would someone be after her, Mr.
Carter?"|speech|EASY|M
1025|CARTER|"Uh... I can't say -- I don't
know..."|speech|CARTER|F
1026||He's lying and Easy knows it.|stage direction||
1027||"68.
70   CONTINUED:   (4)                                              70
CARTER
(continuing)"|unknown||
1028|CARTER|"Do you think you could find her
again?"|speech|CARTER|F
1029||EASY|unknown||
1030|CARTER|I don't know.|speech|CARTER|F
1031|CARTER|"It's important, Mr. Rawlins, for
her sake... I'm willing to pay you."|speech|CARTER|F
1032|EASY|Mr. Carter, why did she leave?|speech|EASY|M
1033|CARTER|"I can't tell you any more Mr.
Rawlins -- I'll pay you to find
her..."|speech|CARTER|F
1034||Easy thinks about it, and then nods.|stage direction||
1035|EASY|Okay... a thousand dollars.|speech|EASY|M
1036|CARTER|A thousand dollars?!|speech|CARTER|F
1037||EASY|unknown||
1038|CARTER|"Yeah.   I'll take two hundred right
now."|speech|CARTER|F
1039|CARTER|"Mr. Rawlins. I think you're trying
to take advantage of me. But left
me inform you that the incumbent
mayor and the chief of police eat
at my house regularly."|speech|CARTER|F
1040||EASY|unknown||
1041|CARTER|Good.   Then they can help us--|speech|CARTER|F
1042||CARTER|unknown||
1043|CARTER|--No.   They can't!|speech|CARTER|F
1044||"Carter is too emphatic and Easy waits for him to give more,
but instead he turns and gazes out again at the canyon."|stage direction||
1045|BAXTER|"I'll have Baxter write you out a
check."|speech|BAXTER|M
1046||"69.
70    CONTINUED:   (5)                                               70
EASY
(after a moment)"|unknown||
1047||"Mr. Carter, why'd you stop runnin'
for mayor?"|location||
1048||"CARTER
(terse)"|unknown||
1049||I'll have Baxter write you a check.|location||
1050||EASY|unknown||
