|character|text|type|character_clean|gender
471||"For some reason this is hilarious to Albright. He throws
his head back and wheezes out an almost silent belly laugh,
then winds down."|stage direction||
472||"35.
36   CONTINUED:   (2)                                                 36
ALBRIGHT"|unknown||
473|EASY|Take it easy.|speech|EASY|M
474||"He disappears into the hamburger joint and Easy walks away
back toward his car."|stage direction||
475||37   EXT. EASY'S HOUSE - NIGHT                                        37|unknown||
476||"Easy pulls in front of his house and notices a dark Ford
parked across the street as he gets out of his car.
A tall, skinny white MAN in a dark blue suit gets out just
ahead of his slightly shorter and heavyset FRIEND.
Easy watches them as he moves toward his walkway."|stage direction||
477||SKINNY MAN|unknown||
478|EASY|Mr. Rawlins.|speech|EASY|M
479||EASY|unknown||
480|EASY|Yeah.|speech|EASY|M
481||"They approach fast but cautiously, the fat one with a hand
in his pocket."|stage direction||
482|SKINNY MAN|"Mr. Rawlins, I'm Miller and this is
my partner, Mason."|speech|SKINNY MAN|?
483||"They both hold out badges. Mason is a slob with grease
spots on his wrinkled tan suit."|stage direction||
484|MILLER|We want you to come with us.|speech|MILLER|M
485||EASY|unknown||
486|MILLER|Where?|speech|MILLER|M
487||MASON|unknown||
488|MILLER|You'll see.|speech|MILLER|M
489||And he takes Easy by the arm.|stage direction||
490|EASY|You arresting me?|speech|EASY|M
491||MASON|unknown||
492|EASY|You'll see.|speech|EASY|M
493||And he starts pulling Easy toward the street.|stage direction||
494|EASY|"I got a right to know why you're
taking--"|speech|EASY|M
495||"36.
37   CONTINUED:                                                      37"|unknown||
496||"WHOMP! Easy takes one to the diaphragm, and as he doubles
over the fat detective slips the handcuffs on behind his
back."|stage direction||
497||MASON|unknown||
498|EASY|"You got a right to fall down and
break your face, nigger. You got a
right to die."|speech|EASY|M
499||"The two cops drag Easy to the car and dump him into the back
seat where he lies gagging as the car whisks away."|stage direction||
500||38   INT. POLICE STATION                                             38|unknown||
501||"Easy's head sags down as he's dragged through the front door
past blurred blue bodies that talk."|stage direction||
502|POLICEMAN (O.S.)|You got 'im, huh, Miller?|speech|POLICEMAN|?
503|MILLER (O.S.)|"Yeah, we got him coming home.
Nothing on 'im."|speech|MILLER|M
504||A door opens and Easy finds himself being flung inside.|stage direction||
505||39   INT. INTERROGATION ROOM                                         39|unknown||
506||"On his knees he hears the door close and looks up at a
single, bare wooden chair resting on the corroded linoleum
floor.
He crawls to one of the urine-stained corners, and looks down
on a dry, flat corpse of a mouse. He pushes his shoulder
against the unpainted plaster until he's standing and then
stumbles over to the chair and sits. He looks up at the
bare pipes that run along the ceiling, dripping water, and
at a window with criss-cross chairs instead of glass framing,
overgrown branches and leaves pushing their way in.
THE DOOR opens and Miller comes in first carrying a
notebook."|stage direction||
507|MILLER|Ezekiel Rawlins.|speech|MILLER|M
508|EASY|Yes, sir.|speech|EASY|M
509||Mason follows and closes the door.|stage direction||
510|MILLER|"We can take off the cuffs if you
wanna cooperate."|speech|MILLER|M
511||"37.
39   CONTINUED:                                                     39"|unknown||
512|EASY|I'm cooperating.|speech|EASY|M
513||Miller motions to Mason and he removes the cuffs.|stage direction||
514|MILLER|"Where were you this morning at
about five A.M.?"|speech|MILLER|M
515||(stalling)|unknown||
516|EASY|What do you mean?|speech|EASY|M
517|MASON|He means--|speech|MASON|M
518||"He plants his foot in Easy's chest and pushes him over
backwards."|stage direction||
519|MASON|--this morning.|speech|MASON|M
520||Easy has caught himself and stands back up.|stage direction||
521|EASY|"I don't know... I was out drinkin'
and I helped carry a friend home.
I could've been on my way home... I
don't know... I didn't look at a
clock..."|speech|EASY|M
522||(wandering over)|unknown||
523|MASON|He didn't look at a clock.|speech|MASON|M
524||"WHOCK! Easy takes a fist to the ear and struggles to keep
his balance, wiping away blood streaming down."|stage direction||
525|MILLER|"You were drinkin' down on Eighty-
ninth and Central... At an illegal
club called John's, weren't you?"|speech|MILLER|M
526||"Mason moves again but this time Easy turns to face him and
the fat man looks back with an innocent face, his palms
turned up."|stage direction||
527|MILLER|"You may as well answer 'cause you
got bigger troubles than us bustin'
an illegal bar, Ezekiel."|speech|MILLER|M
528|EASY|What do you mean?    What's goin' on?|speech|EASY|M
529||"38.
39   CONTINUED:   (2)                                              39"|unknown||
530||"Mason has taken off his shoe and is swatting it against the
palm of his hand."|stage direction||
531|MASON|"Means we can take your black ass
out behind the station and put a
bullet in your head."|speech|MASON|M
532|MILLER|"Now. What time did you leave
Coretta James' house this morning?"|speech|MILLER|M
533|EASY|"I guess about five... five-
thirty..."|speech|EASY|M
534||"Miller and Mason glance at each other, and Mason kicks the
chair over toward Easy."|stage direction||
535||MASON|unknown||
536|EASY|Sit down.|speech|EASY|M
537|EASY|"Why, I'm gonna sit down and you
keep trying to knock me down?"|speech|EASY|M
538||But he sits down anyway.|stage direction||
539|MILLER|"Did you go back and see Miss James
later in the day?"|speech|MILLER|M
540||EASY|unknown||
541|MILLER|No, sir.|speech|MILLER|M
542|MILLER|"Did you and Dupree Brouchard have
words over Miss James?"|speech|MILLER|M
543||EASY|unknown||
544|MILLER|Huh?|speech|MILLER|M
545|MASON|"You heard 'im. Did you two argue
over Coretta James?"|speech|MASON|M
546||EASY|unknown||
547|MASON|Naw.   He was asleep.|speech|MASON|M
548|MILLER|"She went to sleep too, Ezekiel.
But she won't be waking up..."|speech|MILLER|M
549||Easy's face goes sick...|stage direction||
550||"39.
39   CONTINUED:   (3)                                                39
MILLER
(continuing)"|unknown||
551|MILLER|"Where'd you go when you left Miss
James' house?"|speech|MILLER|M
552||Easy is too stunned to answer.|stage direction||
553|MASON|You heard him, where'd you go?|speech|MASON|M
554||Easy stares into space, answering in barely a whisper.|stage direction||
555|EASY|I went home with a hangover...|speech|EASY|M
556||"CHOONK! CHOONK! Mason fires off two punches and Easy grabs
his wrists and pulls him down to the floor, swinging around,
straddling Mason sitting on his ass...
Miller's police special presses into Easy's temple and
Miller speaks to him quietly, deadly."|stage direction||
557|MILLER|"Get up slow... Real fuckin' slow or
you know what's gonna happen."|speech|MILLER|M
558||"Easy raises his hands and uncoils to his feet, backing away
cautiously.
Mason is winded and furious."|stage direction||
559||MASON|unknown||
560|MILLER|Okay.   Let's take him out back.|speech|MILLER|M
561||"He gets to his feet and reaches for his gun, but Miller
stops his hand."|stage direction||
562||MILLER|unknown||
563|MILLER|No.   Let's go.|speech|MILLER|M
564|MASON|Bullshit, I'm gonna blow his--|speech|MASON|M
565||MILLER|unknown||
566|MASON|Let's go!|speech|MASON|M
567||He pushes Mason toward the door.|stage direction||
568|MASON|Son-of-a-bitch! Son-of-a-bitch!|speech|MASON|M
569||They exit the door and Easy rubs at his bloody ear.|stage direction||
570||"40.
40   EXT. L.A. CITY JAIL - NIGHT                                     40"|unknown||
571||"Easy walks down the steps of the station buttoning up his
top shirt button, his hand cupped to his aching ear to keep
out the chill of the night air.
The street is dark and deserted like a giant black alley
except for the black and white patrol car that sits at the
curb. A taut-faced officer leans out the window."|stage direction||
572||"OFFICER
Hey, Buddy!... It's a long walk...
why don't you let us give you a
ride?"|unknown||
573||Easy walks across the street off into the darkness...|stage direction||
574||41   EXT. FOURTH STREET BRIDGE - NIGHT                               41|unknown||
575||"A snatch of MUSIC and LAUGHTER startles Easy as he trudges
home and a car full of teenagers shoots by. And then...
A BLACK CADILLAC LIMOUSINE
cruises up behind and drives alongside."|stage direction||
576||Hey, you!   Ezekiel Rawlins!|unknown||
577||"The window rolls down all the way and a white face in a
black cap appears in the window."|stage direction||
578||"CHAUFFEUR
Ezekiel, hold on."|unknown||
579||Easy keeps walking.|stage direction||
580||"CHAUFFEUR
Come on, fella. Somebody in the
back wants to talk to you.
EASY
I don't have time right now."|unknown||
581||He doubles his pace, almost running.|stage direction||
582||"CHAUFFEUR
Jump in. We'll take you.    My boss
wants to talk to you."|unknown||
583||"Easy cuts behind the limo and into the street headed for the
other side of the bridge but"|stage direction||
584||"41.
41   CONTINUED:                                                      41"|unknown||
585||"The Cadillac whips a U-turn blocking his way in the middle
of the street while cars pass, honking, on either side. The
tall angular chauffeur gets out of the car and holds up his
hands as if making peace.
Easy starts to make another move to escape but:"|stage direction||
586||(continuing)|unknown||
587|CHAUFFEUR|"Come on. If we wanted to hurt you
it would have already happened..."|speech|CHAUFFEUR|?
588||"He opens the back door and after a few moments, Easy gets
in."|stage direction||
589||42   INT. LIMOUSINE - NIGHT                                          42|unknown||
590||"Easy settles into the seat with his back to the driver.
Edith Piaf's ""Parles Moi D'Amour"" adds sugar to the strong
smell of cologne and the portly form of Matthew Teran sits
across from him with a small MEXICAN BOY in pajamas seated
next to him holding a small elephant."|stage direction||
591|TERAN|"I can see that the police roughed
you up a bit... That's a terrible
practice of theirs which has to
change, Mr. Rawlins... Has to
change."|speech|TERAN|F
592||"He opens his gold cigarette case and offers Easy a
cigarette. Easy accepts and Teran lights them both up."|stage direction||
593||(continuing)|unknown||
594|TERAN|"She was beaten. And died from a
heavy blow to the back of the head,
Mr. Rawlins."|speech|TERAN|F
595||Easy begins to feel nauseous.|stage direction||
596|TERAN|"The evening's events have caught my
adopted son and I quite off
guard... My household was asleep
when we got the call that the
police had a suspect in Coretta
James' murder... Did you know that
she was a friend of mine, Mr.
Rawlins!?"|speech|TERAN|F
597|EASY|No I didn't, Mr. Teran.|speech|EASY|M
598||"42.
42   CONTINUED:                                                    42"|unknown||
599|TERAN|Oh, you know who I am?|speech|TERAN|F
600|EASY|"I read the papers.   You're runnin'
for mayor."|speech|EASY|M
601||(correcting)|unknown||
602|TERAN|"I am the next mayor, Mr. Rawlins...
And luckily for you, a friend of
the Negro... When I arrived at the
station I knew right off that you
were being improperly detained as
is Coretta's boyfriend, Dupree
Brouchard. It's this sort of thing
that my administration will not
tolerate, Mr. Rawlins. Absolutely
will not..."|speech|TERAN|F
603||"He sits back in his seat self righteously and offers a nod
of assurance and awaits Easy's gratitude... Then after a
moment..."|stage direction||
604||(continuing)|unknown||
605|TERAN|"Yes... Coretta answered phones for
a while in my campaign office on
103rd and Western. In fact my
people got her a job in the phone
company. So when I heard what had
happened I got out of bed
immediately, personally because of
my concern... Was anyone there with
you Mr. Rawlins besides Mr. Dupree
Brouchard?... Any... other friends
of Coretta's?"|speech|TERAN|F
606|EASY|No, sir...|speech|EASY|M
607|TERAN|No young lady perhaps?|speech|TERAN|F
608|EASY|Nobody...|speech|EASY|M
609|TERAN|"Of course not, Mr. Rawlins. And
why should you tell a man whom
you've only just met. But, believe
me, Mr. Rawlins. You can trust me."|speech|TERAN|F
610||"43.
42   CONTINUED:   (2)                                                 42"|unknown||
611||(shrugging)|unknown||
612|EASY|There was no one else.|speech|EASY|M
613||Teran's face sags with disappointment and then...|stage direction||
614|TERAN|"Well don't worry, Mr. Rawlins... I
won't tolerate your being
harassed... You or any of my
constituency -- I was a city
councilman in the Watts area for
two terms with a large contingent
of colored -- I value all of my
supporters equally... humble though
they may be -- where can we drop
you, Mr. Rawlins?"|speech|TERAN|F
615|EASY|You can let me out here.|speech|EASY|M
616|TERAN|"Are you sure, Mr. Rawlins? This
must be quite out of your way."|speech|TERAN|F
617|EASY|It's okay.|speech|EASY|M
618||"The little boy stares up at Easy through big, dark almond-
shaped eyes in the silence that follows. And then, Teran
picks up the ivory horn that hangs next to his head."|stage direction||
619|TERAN|Norman, pull the car over.|speech|TERAN|F
620||43   EXT. WAREHOUSE AREA - NIGHT                                      43|unknown||
621||"The limousine stops and Easy pushes the door open and gets
out."|stage direction||
622|TERAN|"Mr. Rawlins, may I offer you cab
fare?"|speech|TERAN|F
623||Teran's stubby fingers hold out crumpled bills.|stage direction||
624|EASY|No thanks.|speech|EASY|M
625||"Easy closes the door and watches the long Cadillac glide
away."|stage direction||
626||"44.
43   CONTINUED:                                                      43"|unknown||
627|EASY (V.O.)|"There had been nights during the
war that I still had trouble
claiming as part of my life...
Insane nights I wasn't sure ever
really happened. And here I was
again... Had I really just gotten
out of a rich man's car who was
runnin' for mayor?.. Running
against the man I was supposed to
be working for... Was he really
lookin' for the same woman I was
trying to find? My ear was killin'
me and the buses had stopped
running. And I was feeling sick...
Sick from wondering if I had really
hard that Coretta was dead."|speech|EASY|M
628||44   INT. EASY'S HOUSE - BEDROOM                                     44|unknown||
629||"The room is a mess; trousers strewn here, shirt and shoes
over there. And from the corners are haunting, ghostly
whispers."|stage direction||
630|CORETTA'S VOICE|You be sorry if you go...|speech|CORETTA'S VOICE|?
631||(heavy breathing)|unknown||
632|CORETTA'S VOICE|"I can't give up that much love,
daddy, not the way things is."|speech|CORETTA'S VOICE|?
633||"A PINT OF BOURBON, 3/4 full, sits atop the cherry wood
nightstand. Another empty bottle lies next to it on its
side, in front of a water glass with 1/2 inch of liquor at
the bottom.
EASY'S HEAD rests on a pillow on the bed behind it,
sweating, tossing and turning as the ghost gets louder."|stage direction||
634|CORETTA'S VOICE|"Oh yeah, daddy. You hittin' my
spot... Oh yeah... oh yeah..."|speech|CORETTA'S VOICE|?
635||The voice of the ghost is reaching closer for his ear.|stage direction||
636|CORETTA'S VOICE|"Oh, that's just too good, Easy.   Oh
daddy... oh yeah..."|speech|CORETTA'S VOICE|?
637||The voice is right up in his face.|stage direction||
638||CORETTA'S VOICE|unknown||
639|CORETTA'S VOICE|"Oh, baby. Oh, daddy, yeah... Oh
yeah!! Oh Yea-a-h!!"|speech|CORETTA'S VOICE|?
640||"45.
44   CONTINUED:                                                     44"|unknown||
641||"SCREAM. He jerks up, awake, and the phone is RINGING.    It
jingles a couple more times and Easy almost knocks the
receiver out of its cradle reaching for it."|stage direction||
642||EASY|unknown||
643|CORETTA'S VOICE|Huh?|speech|CORETTA'S VOICE|?
644||(a woman's)|unknown||
645|VOICE|Hello? Is this Mr. Rawlins?|speech|VOICE|M
646||EASY|unknown||
647|VOICE|Who is this?|speech|VOICE|M
648|VOICE|Daphne... Daphne Monet...|speech|VOICE|M
649||He sits straight up.|stage direction||
650|DAPHNE|You're looking for me.|speech|DAPHNE|F
651||A pause on the line.|stage direction||
652|DAPHNE|"I think you should come and talk to
me, Mr. Rawlins... alone."|speech|DAPHNE|F
653|EASY|Look, it's late--|speech|EASY|M
654|DAPHNE|"Mr. Rawlins, Coretta has been
killed..."|speech|DAPHNE|F
655||Another pause.|stage direction||
656|DAPHNE|"And if you don't want any trouble
from the police then you'll come...
And you won't tell anyone that
you're coming."|speech|DAPHNE|F
657|EASY|"Now wait a minute, Daphne. I don't
know nothin' about all this
stuff..."|speech|EASY|M
658|DAPHNE|"I'm at the Sunridge Motel on 112th
and Grand, Room 102."|speech|DAPHNE|F
659||"46.
44   CONTINUED:   (2)                                                 44"|unknown||
660||"Easy holds his hands up, helplessly -- ""what do you want
from me?"" -- but no one can see and she has hung up the
phone."|stage direction||
661||45   EXT. SUNRIDGE MOTEL - NIGHT                                      45|unknown||
662||"It's a Spanish-style set of rooms with tile roofs set around
a square parking lot.
Easy's car pulls into the alley behind it.
He gets out and scans the area looking down from a rise at
the back entrance to the parking lot. And then walks down."|stage direction||
663||"46   OMIT                                                             46
47   EXT. SUNRIDGE MOTEL - ROOM 102 - NIGHT                           47"|unknown||
664||Before Easy can knock, he hears:|stage direction||
665||DAPHNE (O.S.)|unknown||
666|DAPHNE|Mr. Rawlins?|speech|DAPHNE|F
667||EASY|unknown||
668|DAPHNE|Yeah.|speech|DAPHNE|F
669||"The door opens and she's standing there, more beautiful than
the photograph. They take each other in for a moment before
she steps back from the door."|stage direction||
670|DAPHNE|Please come in.|speech|DAPHNE|F
671||48   INT. MOTEL ROOM                                                  48|unknown||
672||"It's a regular drab, cheap motel that she has given a warmer
touch with colorful scarves draped over the two lamps."|stage direction||
673|DAPHNE|Would you like a drink?|speech|DAPHNE|F
674||"She indicates a pint of scotch on the dresser with an empty
glass and one that she's been drinking from."|stage direction||
675||EASY|unknown||
676|DAPHNE|No, thanks.|speech|DAPHNE|F
677||She indicates the chair.|stage direction||
678|DAPHNE|Please sit down.|speech|DAPHNE|F
679||"She's wearing a blue dress that's plain, cutting just below
her knee with a ceramic pin just over her left breast."|stage direction||
680||"47.
48   CONTINUED:                                                     48"|unknown||
681|DAPHNE|"What happened to you?   Have you
been fighting?"|speech|DAPHNE|F
682||Easy stubs out his cigarette in an ashtray and sits down.|stage direction||
683|EASY|"Why don't you just tell me what you
want?"|speech|EASY|M
684||"She sits down too, her calm but brittle exterior betrayed at
the hands. She stops wringing them when she sees that he
notices and takes a drink -- more medicine than pleasure."|stage direction||
685|DAPHNE|"I should be asking you that
question. Why have you been asking
about me?"|speech|DAPHNE|F
686|EASY|"I heard about you. Fellas at
John's said you were something to
see."|speech|EASY|M
687||DAPHNE|unknown||
688|EASY|So...?   You've found me.|speech|EASY|M
689|EASY|"Uh... yeah... Guess I have. But
you got a boyfriend I don't want no
part of... Frank Green."|speech|EASY|M
690||She lights a cigarette.|stage direction||
691|DAPHNE|"You can stop pretending, Mr.
Rawlins. I know someone hired you
to look for me. In fact I had to
pay Coretta not to tell you where I
was... you know how Coretta is..."|speech|DAPHNE|F
692||(forces a weak smile)|unknown||
693|DAPHNE|"She told me you two became 'good
friends' yesterday..."|speech|DAPHNE|F
694||"(tears gather in her
eyes)"|unknown||
695|DAPHNE|"I talked to her this morning before
she died."|speech|DAPHNE|F
696||(regaining control)|unknown||
697|DAPHNE|"I... uh... need to go across town
to see someone. It's very
important... I can't seem to reach
him by phone. I'm afraid I'd
better have someone go with me."|speech|DAPHNE|F
698||"48.
48   CONTINUED:   (2)                                                 48"|unknown||
699|EASY|Uh... Miss Monet--|speech|EASY|M
700|DAPHNE|Call me Daphne.|speech|DAPHNE|F
701|EASY|Daphne--|speech|EASY|M
702|DAPHNE|"I can understand why you'd be
nervous... because I threatened you
with Coretta... I'm very sorry, but
I couldn't think of any other way
to get you to come."|speech|DAPHNE|F
703||"She takes another drink and stubs out her cigarette though
it's less than a third gone."|stage direction||
704|EASY|I can't -- why don't you ask Frank?|speech|EASY|M
705||She gets up and starts to pace nervously about the room.|stage direction||
706|DAPHNE|"He's out of town -- I... I'm
willing to pay you."|speech|DAPHNE|F
707|EASY|"That's nice of you but, see, I'm
not really a detective--"|speech|EASY|M
708|DAPHNE|--I know that.|speech|DAPHNE|F
709|EASY|"I was just hired to ask around to
try to find you for a man--"|speech|EASY|M
710|DAPHNE|I know all about that, Mr. Rawlins.|speech|DAPHNE|F
711|EASY|"But this is a gettin' a little out of
hand--"|speech|EASY|M
712|DAPHNE|--Mr. Rawlins--|speech|DAPHNE|F
713|EASY|--Easy.|speech|EASY|M
714||"49.
48   CONTINUED:   (3)                                                48"|unknown||
715|DAPHNE|"Easy... If you don't help me, then
I'll call the police and tell them
that you were with Coretta before
she died and that you've been after
me too."|speech|DAPHNE|F
716||That stops Easy.|stage direction||
717|EASY|You'd do that?|speech|EASY|M
718||DAPHNE|unknown||
719|EASY|"Yes, I would.    I don't want to but
I would."|speech|EASY|M
720||"She hates herself for threatening and decides to change
direction, moving in close."|stage direction||
721|DAPHNE|Please let me pay you.|speech|DAPHNE|F
722||EASY|unknown||
723|DAPHNE|No.    I can't do that.|speech|DAPHNE|F
724||DAPHNE|unknown||
725|DAPHNE|Why?|speech|DAPHNE|F
726|EASY|I don't want no part of all this.|speech|EASY|M
727|DAPHNE|"Please, I'll pay you twenty
dollars."|speech|DAPHNE|F
728||EASY|unknown||
729|DAPHNE|No dice.|speech|DAPHNE|F
730|DAPHNE|"Thirty... or even more.    Name your
price."|speech|DAPHNE|F
731||She moves in closer, massaging with her voice.|stage direction||
732||(continuing)|unknown||
733|DAPHNE|"Go ahead. There's gotta be
something that you want."|speech|DAPHNE|F
734||"Her eyes make an offer, but he's a better man than me and
he's not taking."|stage direction||
735||"50.
48   CONTINUED:   (4)                                               48"|unknown||
736||"(angrily,
sarcastically)"|unknown||
737|DAPHNE|"What? Are you afraid I'll yell
rape or something?"|speech|DAPHNE|F
738||"She walks away and turns up her glass, her desperation, raw,
unguarded."|stage direction||
739|EASY|"Uh, Miss Monet... Daphne, I'm sorry
but I really better be goin'."|speech|EASY|M
740||He starts out and she runs to stop him.|stage direction||
741|DAPHNE|Easy, don't touch that door--|speech|DAPHNE|F
742||"He opens it and
SCREAM!   Like an alarm, she's SHRIEKING all of the scale."|stage direction||
743||49   He looks out and sees                                          49|unknown||
744||LIGHTS GOING ON in other rooms.|stage direction||
745||50   BACK TO SCENE                                                  50|unknown||
746||He looks back frantically and grabs her by the shoulders.|stage direction||
747|EASY|"Crazy assed broad!   What the hell
are you doing?!"|speech|EASY|M
748|DAPHNE|"I'm really very sorry.   I really
am."|speech|DAPHNE|F
749||She pulls on a coat and grabs her purse.|stage direction||
750||(continuing)|unknown||
751|DAPHNE|"I didn't want to do this but...
Shall we?"|speech|DAPHNE|F
752||She grabs an already packed suitcase and is out the door.|stage direction||
753||51   EXT. LAUREL CANYON - NIGHT                                     51|unknown||
754||"Easy's Pontiac snakes up the winding road, city lights
glimmering in flashes below as it rounds the curves."|stage direction||
755||"51.
52   INT. EASY'S CAR - NIGHT                                         52"|unknown||
756||"Ben Webster's ""I've   Got It Bad"" plays on the road as Easy
shifts nervously in   his seat, his eyes searching in the
rearview mirror and   all around for headlights that might be
unfriendly. Daphne    leans back against the passenger door,
taking him in.
Easy passes a police car pulled over to the side.
He looks in the rearview mirror and its headlights go on.
He takes a deep breath, bracing for the worst and Daphne
looks back concerned.
But the lights arch a U-turn and head back the other way."|stage direction||
757||"DAPHNE
They must not have seen us that
well... God, Frank and I have been
pulled over so many times I
thought--"|unknown||
758||She catches herself and looks over at Easy.|stage direction||
759||"DAPHNE
(continuing)
Easy, I'm sorry... Don't be mad at
me."|unknown||
760||Easy keeps his eyes on the road.|stage direction||
761||"DAPHNE
(continuing)
Come on."|unknown||
762||She tries to touch his arm and he pulls away.|stage direction||
763||"DAPHNE
(continuing)
You really hate me, don't you?
EASY
How much further is it?"|unknown||
764||"Around the next bend...
(she grins)
You remind me of Frank when he gets
angry.
EASY
Ain't nothin' about me like Frank.
DAPHNE
Your jaw sets just like his when--
52.
52   CONTINUED:                                                      52"|unknown||
765|EASY|"I don't get no kick outta risking
my life for some white woman's
entertainment."|speech|EASY|M
766||(sighing)|unknown||
