|character|text|type|character_clean|gender
890||"He opens an untouched box of Healthy Bran and fills a bowl.
He watches cartoons as he heaps sugar on the healthy cereal
and then checks his phone. ""No Missed Calls.""
3) He surfs the web. He reads info on the Hair Club For Men
site. He moves to Hot_or_Not.com. The first woman is very
pretty. He rates her a seven, the next is also pretty and
gets another seven, the next girl is very unattractive. Her
score is three. Kirk feels bad for her and rates her a ten.
He checks his phone. He moves on to ""BackDoorAsians.com.""
4) Kirk watches a Connery James Bond movie on TV. The lower
third reads, ""AMC's 24 Hours of Bond."" No Missed Calls. The
sun is setting and Bond is now Roger Moore - No Missed Calls.
Kirk digs a box of Ding Dongs out of the trash and eats them
as he watches. It's dark outside and Kirk is in bed watching
Timothy Dalton - No Missed Calls. The morning light is
creeping in as Pierce Brosnan does the driving and Kirk is
still awake looking devastated - No Missed Calls.
5) Kirk is at a convenience store buying milk. He is a mess -
tired, unshaven, wearing a frumpy sweatsuit. He passes the
magazine rack and something catches his eye. It's a gorgeous
picture of Molly on the cover of Phoenix Entrepreneur
Magazine. Kirk holds up the magazine and then catches his
own reflection in a mirror on a sunglasses rack.
6) Kirk is walking home. Every street sign, billboard and T-
shirt he sees reads, ""NO MISSED CALLS.""
MUSIC FADES OUT"|stage direction||
891||INT. KIRK'S APARTMENT BATHROOM - DAY|location||
892||"He stands in the shower sulking. He hears the phone ring in
the next room. He jumps out, grabs a small towel and starts
to dry off as he runs into the bedroom. He reaches the
charger base but the phone is not there. He stands and
listens hard to the ringing. He runs into the living room.
Angle on the phone. It's hiding under a pillow on the couch.
In the background, Kirk rushes around the room flipping up
papers and magazines. The phone keeps ringing and Kirk's
panic increases until he finally spots the phone. Kirk dives
for it, losing his towel in the process."|stage direction||
893||KIRK|location||
894|KIRK (CONT'D)|Hello!?   Hello!?|speech|KIRK|M
895|STAINER (V.O.)|"Took you long enough. What were
you doing, taking a growler?"|speech|STAINER|M
896||"Kirk notices a woman on the landing outside behind him.   She
can see his ass through the window. He covers up."|stage direction||
897||54.|unknown||
898|KIRK|Sorry, Mrs. Nuesbaum.|speech|KIRK|M
899||EXT. DOWNTOWN SHOPPING DISTRICT - DAY|location||
900||"Kirk and Stainer come out of a record store and walk past the
shops and restaurants. Kirk holds a stack of flyers for
Stainer's band. As they walk, Kirk hands flyers to Stainer
who posts them on walls and kiosks with a staple hammer."|stage direction||
901|STAINER|"Kirk, it's a simple rule of life.
Look around. People are pretty
evenly matched."|speech|STAINER|M
902||"Kirk and Stainer look at the couples that stand at the bus
stop, sit in the outdoor cafes and walk down the sidewalk.
Each couple is fairly closely matched - pretty with pretty,
ugly with ugly, heavy with heavy, fit with fit."|stage direction||
903|KIRK|"Yeah, but Stainer, she was the one
who asked me out. So, why..."|speech|KIRK|M
904|STAINER|"That first night, were you
intimidated by her?"|speech|STAINER|M
905|KIRK|No, I didn't think I had a chance.|speech|KIRK|M
906||STAINER|unknown||
907|KIRK|"Exactly. So you were relaxed and
funny. You were on."|speech|KIRK|M
908||"Stainer posts several ""Wheel in the Sky"" flyers on a kiosk."|stage direction||
909|KIRK|So I gotta get back to that.|speech|KIRK|M
910|STAINER|"That's just it, Kirky. Now that
she's opened the door, you can't
get back to that."|speech|STAINER|M
911|KIRK|So I'll have to fake it?|speech|KIRK|M
912|STAINER|"Forget it. You can't fake that
far. A broad like her - she'll
smell that horseshit a mile away."|speech|STAINER|M
913||55.|unknown||
914||Kirk and Stainer enter a...|stage direction||
915||EXT. CAFE FRONT PATIO|location||
916||...and take a table on the crowded patio.|stage direction||
917|STAINER|"Can we get a couple of menus?
(then to Kirk) You eating?"|speech|STAINER|M
918|KIRK|Maybe just a salad.|speech|KIRK|M
919|STAINER|"Dude, one salad ain't going make up
for thirty years of chili dogs."|speech|STAINER|M
920|KIRK|"I know. But I got dinner with my
folks later."|speech|KIRK|M
921|STAINER|"Fun. Be sure and stab your brother
in the eye with a fork for me."|speech|STAINER|M
922|KIRK|Sorry, Eric's not coming tonight.|speech|KIRK|M
923||"Kirk motions toward a mismatched couple (nerdy guy with
knockout girl) who pass Kirk and Stainer's table on their way
to the valet stand. Stainer rolls his eyes."|stage direction||
924|KIRK (CONT'D)|"You know what - this is ridiculous.
I'm just going to call her."|speech|KIRK|M
925|STAINER|"Fuck you are! Put that thing away.
You do not call her. Don't you get
it? Talon is back in town."|speech|STAINER|M
926|KIRK|No, she broke up with him.|speech|KIRK|M
927|STAINER|"So, you're telling me you were
sitting there, a sweating,
quivering stutter-bucket and when
you came back from the can, Molly's
hugging a guy who's so good looking
you'd probably fuck him. What do
you think she's doing this weekend?"|speech|STAINER|M
928||56.|unknown||
929|KIRK|So what am I supposed to do?|speech|KIRK|M
930|STAINER|"What can you do? She hasn't called
- she's not going to."|speech|STAINER|M
931|KIRK|You're probably right.|speech|KIRK|M
932|STAINER|"Just count yourself lucky. You got
to kiss a goddess and you got out
before she recalibrated your
hardware. A chick like that can
raise the bar too high and then
once she dumps you, nobody else
measures up."|speech|STAINER|M
933|KIRK|"No, you're right. You know what -
it's good. It's better. I'm
actually relieved. You should have
seen this Talon guy. Man! All
I've been thinking about is having
to be naked in front of her. I
don't need that kind of pressure."|speech|KIRK|M
934||"The valet pulls a red Ferrari up to the mismatched couple and
the nerdy guy opens the door for her. Stainer shakes his
head as if to say, ""Was there even a doubt?""
Kirk's phone is sitting on the table - it rings.   Kirk and
Stainer can see Molly's name on the caller ID."|stage direction||
935|STAINER|Don't do it!|speech|STAINER|M
936||"The phone rings again. Kirk glances down at the phone.
Stainer keeps a stern eye on Kirk. RING! Close on Kirk's
eyes turning weak. RING! Close on Stainer's threatening
eyes. RING! Kirk gives up and looks away. Stainer's eyes
calm. Kirk snatches the phone but Stainer grabs Kirk's
wrist, pinning it to the table. RING!"|stage direction||
937|KIRK|Cut it out!|speech|KIRK|M
938||STAINER|unknown||
939|KIRK|Let it go!|speech|KIRK|M
940||57.|unknown||
941||"RING! Kirk reaches for the phone with his other hand but
Stainer's free hand intercepts it and these arms flail around
like battling snakes. Kirk presses the button to answer the
call and, instead, moves his head down to the phone."|stage direction||
942|KIRK|"Hello!?... Oh, no problem! Yeah I
was super busy yesterday anyway."|speech|KIRK|M
943|STAINER|Would you look at yourself?|speech|STAINER|M
944||Stainer lets go and Kirk sits up and backs away.|stage direction||
945|KIRK|"Well, I have dinner with my folks
tonight... Oh, I wouldn't want to
subject you to them... Okay. If
you want to. I can pick you up..."|speech|KIRK|M
946||"Kirk gives a confident smile and an ""I told you she'd call""
nod. Stainer crosses his arms and shakes his head."|stage direction||
947|KIRK (CONT'D)|"Oh, sure. Well then let me call
you back in a few minutes and I'll
give you directions. Alrighty.
Yeah. Buh-bye."|speech|KIRK|M
948|STAINER|"Well, I guess you just solved that.
An hour with your family and she'll
file for a restraining order."|speech|STAINER|M
949|KIRK|"No. Eric's not going to be there.
It's going to be good. You might
be wrong about Molly. She might..."|speech|KIRK|M
950||"Stainer spots a round little boy posting a ""Lost Puppy"" flyer
over one of the ten he just posted on the kiosk."|stage direction||
951||(to the boy)|unknown||
952|STAINER|"Whoa! I don't think so Spanky!   A
little lower!"|speech|STAINER|M
953||"The boy instead posts it over a ""Walk For a Cure"" poster."|stage direction||
954||EXT. KIRK'S PARENTS' HOME - EVENING|location||
955||"Molly drives up and stops in front of a small home on a
quaint residential street."|stage direction||
956||58.|unknown||
957||"She climbs out of her car, checking the address on a small
sheet of paper. She sees Kirk sitting on the front porch."|stage direction||
958|KIRK|You found it!|speech|KIRK|M
959|MOLLY|I had good directions!|speech|MOLLY|F
960||"She steps up the front walk toward Kirk, who points to a
little yellow note taped to the front door."|stage direction||
961|KIRK|"I'm sorry. My folks aren't back
yet. We're locked out."|speech|KIRK|M
962|MOLLY|You don't have a key?|speech|MOLLY|F
963|KIRK|"No. My dad's kind of obsessed with
home-security. Like someone's
going to break in and steal his
Reader's Digest collection."|speech|KIRK|M
964||"A very old man wobbles out of the house next door with a
beagle on a leash. The man struggles a bit with the dog."|stage direction||
965|KIRK (CONT'D)|Hi, Mr. Riley!|speech|KIRK|M
966|MR. RILEY|Well, howdy Kirk!|speech|MR. RILEY|?
967|KIRK|"Hey, what do say you take the night
off and I'll take Noodle around the
block for you? (to Molly) Are you
up for a walk?"|speech|KIRK|M
968|MOLLY|That sounds great.|speech|MOLLY|F
969|MR. RILEY|Geeze Kirk, that's mighty nice.|speech|MR. RILEY|?
970||"Kirk jogs over to take the leash.   Noodle jumps up on Kirk.
He and Molly pet the excited dog."|stage direction||
971||(baby talk)|unknown||
972|KIRK|"Yes! Always happy to see you,
pretty girl! Yes you are a pretty
girl! Yes you are!"|speech|KIRK|M
973||59.|unknown||
974||Molly takes note - animal lover - big points.|stage direction||
975|MR. RILEY|You're a good boy, Kirk.|speech|MR. RILEY|?
976|KIRK|It's no trouble at all.|speech|KIRK|M
977||"Molly and Kirk start down the sidewalk with Noodle. An old
woman comes out of the next house with her dog on a leash."|stage direction||
978||OLD WOMAN|location||
979|KIRK|Honey!?   Are you back in business!?|speech|KIRK|M
980||(To Molly)|unknown||
981|KIRK|"I had a little neighborhood dog-
walking service when I was a kid .
(to the woman) No problem, Mrs. D,
we can take Norton along too!"|speech|KIRK|M
982||"Several soft-faded cuts as Kirk and Molly move through the
neighborhood. Soon they have a third dog. Kirk points out
landmarks as they talk and laugh. Now they have a fourth
dog. Molly takes his arm.
The evening light is a bit dimmer as they give Noodle back to
Mr. Riley. Kirk turns toward his parents' house. Now
there's a car parked in the driveway and a jacked-up, knobby-
tired pick-up parked out front. The truck has two bumper
stickers (""One Nation Under GOD!"" and ""No Fat Chicks!"")
flanking a vanity license plate that reads, ""ERIX-TOY.""
Kirk's shoulders slump at the sight of it."|stage direction||
983|KIRK (CONT'D)|"Hey, you know what I'm thinking,
let's go get Chinese."|speech|KIRK|M
984|MOLLY|"What are you talking about?   I want
to meet your family."|speech|MOLLY|F
985||They start toward the door.   Molly's cell phone rings.|stage direction||
986|MOLLY (CONT'D)|"I'm so sorry. It's Patty. I've
got to take this. Go ahead. I'll
be right in."|speech|MOLLY|F
987||INT. KIRK'S PARENTS' HOME - EVENING|location||
988||"Kirk comes through the front door to find his father in the
living room watching a hockey game."|stage direction||
989||60.|unknown||
990||KIRK|location||
991|MOLLY (CONT'D)|Hey dad.|speech|MOLLY|F
992||(without looking up)|unknown||
993|MR. KETTNER|Kirk.|speech|MR. KETTNER|F
994|MRS. KETTNER (O.S.)|Hi sweetie!|speech|MRS. KETTNER|?
995||Eric steps out of the kitchen with three beers.|stage direction||
996|ERIC|Close the door, fucknut.|speech|ERIC|F
997|KIRK|"Hey Eric. I thought you were
hanging drywall tonight."|speech|KIRK|M
998|ERIC|"Nah. Fuckin' Leroy fired me again.
Like that dick never came to work
with a little buzz on."|speech|ERIC|F
999|KIRK|"Okay, listen, I brought a date
tonight. I really like her.
Please don't embarrass me in front
of her. I'll do anything you want."|speech|KIRK|M
1000|ERIC|"I promise I won't mention her
goiter."|speech|ERIC|F
1001||"Eric and Dad crack up.
A flushing sound and then Ron comes out of the bathroom.
He's buckling up. Kirk's shoulders drop again."|stage direction||
1002|RON|I did like you said Mr. K.|speech|RON|F
1003||Eric tosses Ron and Mr. Kettner each a beer.|stage direction||
1004|KIRK|Oh, hey Ron. So Marnie's here?|speech|KIRK|M
1005||"Marnie appears in the door of the kitchen. She's holding a
corningware pot filled with mashed potatoes.
Molly finishes her call. She's up the front steps and Kirk
lets her in. Eric, Ron and Mr. Kettner are stunned. Marnie
drops the pot and it smashes on the floor in front of her."|stage direction||
1006||61.|unknown||
1007||"Mrs. Kettner and Debbie rush out to see what Marnie is gaping
at. Debbie (still pregnant) is immediately threatened by the
way Eric is looking at Molly."|stage direction||
1008|KIRK (CONT'D)|Everyone, this is Molly McCall.|speech|KIRK|M
1009||"Kirk's never seen his family so impressed. He can't hide his
grin. Ron pops the cap off his beer and it overflows a bit."|stage direction||
1010||INT. KIRK'S PARENTS' KITCHEN - NIGHT|location||
1011||"Kirk, Molly, Mr. & Mrs. Kettner, Marnie, Ron and Debbie sit
around the kitchen table and feast on a meatloaf dinner.
Eric is at the fridge grabbing a beer. Marnie is angrily
watching Ron whose eyes are all over Molly."|stage direction||
1012|ERIC|You want another one Dad?|speech|ERIC|F
1013|MR. KETTNER|You read my mind.|speech|MR. KETTNER|F
1014|MRS. KETTNER|"You two take it easy now. We have
guests. (THEN) Eric honey, I'm
sure if you apologize to Leroy,
he'll take you back."|speech|MRS. KETTNER|?
1015||Eric returns to the table with the beers.|stage direction||
1016|ERIC|"Nah, fuck him. Anyways, Leroy ain't
payin' shit ever since he trucked
in all those spics from Fresno."|speech|ERIC|F
1017|KIRK|Geeze Eric!|speech|KIRK|M
1018||Ron looks offended and raises a palm to indicate that...|stage direction||
1019|RON|"I got this, Kirk. Eric, before you
go bad-mouthin' a whole group of
people, you should know that my
grandmother on my father's side is
from Fresno."|speech|RON|F
1020|ERIC|"Hey, I'm sorry. I didn't know.
(THEN) So, Molly. What do you do?"|speech|ERIC|F
1021|MOLLY|I'm an event planner.|speech|MOLLY|F
1022||62.|unknown||
1023|ERIC|"You see? That's using your head.
That's a business to get into."|speech|ERIC|F
1024|MOLLY|Well, thank you Eric.|speech|MOLLY|F
1025|ERIC|"Book a band, blow up a few balloons
and people pay out the ass for it."|speech|ERIC|F
1026|KIRK|"There's a little more to it than
that, Eric. Molly handles some big
events. She's even doing a benefit
with Billy Joel next month."|speech|KIRK|M
1027||(PLAYFULLY)|unknown||
1028|MOLLY|"Actually, Eric's right.   Just a few
balloons."|speech|MOLLY|F
1029||Molly smiles to reassure Kirk that she can handle herself.|stage direction||
1030|RON|"You know, Molly, I'm a business
owner myself. A little restaurant."|speech|RON|F
1031|MARNIE|"I wouldn't really call it a
restaurant, Ron."|speech|MARNIE|F
1032|RON|"We serve food that people eat.   So -
restaurant."|speech|RON|F
1033|MARNIE|"It's a Pizza Hut with no tables.
It's a take out place."|speech|MARNIE|F
1034|ERIC|"So, Molly, me and Debbie here are
getting hitched. What do you get
for a wedding job?"|speech|ERIC|F
1035||"Kirk raises his eyebrows into ""please-behave-yourself"" puppy
dog eyes. Eric shoots back an ""oh whatever"" sneer."|stage direction||
1036|MOLLY|"Hmmm. Honestly, I don't really do a
lot of weddings. I specialize more
in fund-raisers, corporate events,
that kind of thing."|speech|MOLLY|F
1037||63.|unknown||
1038|(MORE)|MOLLY (CONT'D)|speech||
1039||"Right now I'm working on the annual
benefit for the Children's Cancer
Center."|stage direction||
1040|(MORE)|ERIC|speech||
1041||But you've done weddings.|stage direction||
1042|(MORE)|MOLLY|speech||
1043||I've done a few.|stage direction||
1044|(MORE)|ERIC|speech||
1045||So, what do you get for one?|stage direction||
1046|(MORE)|KIRK|speech||
1047||Dad, could you...|stage direction||
1048|(MORE)|DEBBIE|speech||
1049||"Don't get your panties in a wad,
Kirk. He's just making
conversation."|stage direction||
1050|(MORE)|MOLLY|speech||
1051||"Geeze, there are so many factors
that affect the cost of a wedding."|stage direction||
1052|(MORE)|ERIC|speech||
1053||"We're looking at about two hundred
people and we're gonna do this
whole Nascar theme."|stage direction||
1054|(MORE)|DEBBIE|speech||
1055||"I'm getting a kick-ass dress made
out of actual checkered flags and
Eric is going to be in an orange
tux with a big Home Depot logo on
the back and Tony Stewart's number
20 on the shoulders."|stage direction||
1056|(MORE)|MOLLY|speech||
1057||Oh, how fun!|stage direction||
1058|(MORE)|ERIC|speech||
1059||"So what's the damage for
supervising something like that?"|stage direction||
1060|(MORE)|KIRK|speech||
1061||Eric, please.|stage direction||
1062|(MORE)|ERIC|speech||
1063||"I'm just talkin' ballpark. I'm
ain't gonna try and Jew her down."|stage direction||
1064||64.|unknown||
1065|MOLLY|"Okay. Before expenses, my base fee
for a non-charity event is fifteen
thousand. So, I'd ballpark that
somewhere around twenty-five grand."|speech|MOLLY|F
1066||(STUNNED)|unknown||
1067|ERIC|Fuck a duck.|speech|ERIC|F
1068||"For a moment everyone is chewing and there is a break in the
conversation. Kirk is getting wound up tighter and tighter."|stage direction||
1069|ERIC (CONT'D)|"So you're making a comfortable
living, you seem like you got your
head together more or less and
Christ, look at ya. What the hell
you doing with numbnuts here?"|speech|ERIC|F
1070|MRS. KETTNER|Eric!|speech|MRS. KETTNER|?
1071|ERIC|Come on, Ma - we're all thinking it.|speech|ERIC|F
1072|MRS. KETTNER|Molly, I'm so sorry.|speech|MRS. KETTNER|?
1073|MOLLY|"No, it's fine. The truth is, Kirk
and I are just getting to know one
another but so far, I think he's
decent, he's funny and... You
know, when we first met, Kirk asked
me in all sincerity if I knew how
to do an oil change."|speech|MOLLY|F
1074||"Eric, Ron and Mr. Kettner each let out a quick burst of ""yeah
right"" laughter."|stage direction||
1075||MOLLY (CONT'D)|unknown||
1076|MOLLY|"I know! And, you're right, I don't
but... I just love that he asked."|speech|MOLLY|F
1077||"A moment passes as they all process this. The women at the
table all know exactly what Molly means. The men are simply
confused."|stage direction||
1078|ERIC|"Funny? Kirk is funny?    Tell us a
joke there Sinbad."|speech|ERIC|F
1079||65.|unknown||
1080|MRS. KETTNER|"(to Kirk) Well I hope you can hold
onto this one pumpkin. (to Molly)
When Marnie broke up with him he
was devastated for months, the poor
little guy."|speech|MRS. KETTNER|?
1081||"Marnie looks up, surprised and touched by the comment.   Kirk
is mortified."|stage direction||
1082|ERIC|"No shit, when you dump him, he's
liable to kill himself."|speech|ERIC|F
1083||"Kirk rubs his own head to keep it from exploding. Molly calms
him with a hand on his back. This move isn't lost on Marnie."|stage direction||
1084||INT. KIRK'S PARENTS' BATHROOM - LATER|location||
1085||"Kirk splashes water on his face and then looks for a towel
but can't find one. He's forced to use his sleeve. He is a
wreck. He takes a deep breath and steps out into..."|stage direction||
1086||INT. KIRK'S PARENTS' HOME ENTRY HALL|location||
1087||...to find Marnie at the front door putting her coat on.|stage direction||
1088|KIRK|Are you heading home?|speech|KIRK|M
1089|MARNIE|"Got to get home and let Peanut out.
(she wipes some lint off of Kirk's
shirt sleeve.) Kirk, you look
really good."|speech|MARNIE|F
1090||KIRK|location||
1091|MARNIE|Thanks.   You do too.|speech|MARNIE|F
1092||Marnie smiles a sad smile.|stage direction||
1093||MARNIE|location||
1094|MARNIE|Ron!   Let's go!|speech|MARNIE|F
1095|RON|"I'm coming! It was really
fantastic to meet you Molly.   If
you ever need a pizza..."|speech|RON|F
1096||"Ron gives Molly a hug that makes Marnie as uncomfortable as
it does Molly. He then passes Kirk as he crosses to the
front door, carrying a pile of foiled over paper plates."|stage direction||
1097||66.|unknown||
1098|RON (CONT'D)|"Cripes Kirk! Crack a window in
there pirate! HAHAHA!"|speech|RON|F
1099||Ron and Marnie exit.   Kirk walks back into...|stage direction||
1100||INT. KIRK'S PARENTS' KITCHEN|location||
1101||Mrs. Kettner and Molly are cleaning up.|stage direction||
1102|KIRK|Molly, you don't have to do that.|speech|KIRK|M
1103|MOLLY|No, It's fine.|speech|MOLLY|F
1104|MRS. KETTNER|"You let us have some girl time.
Take these downstairs to your dad."|speech|MRS. KETTNER|?
1105||"She hands Kirk a bag of Fritos and shoes him through the
basement door."|stage direction||
1106||INT. KIRK'S PARENTS' BASEMENT - NIGHT|location||
1107||"Kirk's father has built a tacky little basement bar decorated
with neon beer signs and Eric's old trophies and ribbons.
Mr. Kettner and Debbie sit at the bar and smoke as Eric
stands behind the bar and serves them cocktails. Kirk comes
down the basement stairs and joins them. The hockey game
wrap-up highlights are running on a TV mounted above the bar."|stage direction||
1108|KIRK|So, what was the final score?|speech|KIRK|M
1109|ERIC|"You think you're hot shit now?    Is
that it?"|speech|ERIC|F
1110|KIRK|"Look, Eric, you've had a lot to
drink tonight and..."|speech|KIRK|M
1111|DEBBIE|"Don't tell him what to do. (to
Eric) You're doing fine, baby."|speech|DEBBIE|F
1112|ERIC|"You think you're better than me.
Say it. Well take a look around,
Big Slick. (re: trophies) Every
one of these says Eric. First
place! First Place! M.V.P.!"|speech|ERIC|F
1113||67.|unknown||
1114|ERIC (CONT'D)|"Winner! Winner! You think you're
the winner now? Well forget it,
man! I don't buy this for a second."|speech|ERIC|F
1115||(STANDING)|unknown||
1116|KIRK|Well, it's been fun.|speech|KIRK|M
1117|MR. KETTNER|"Now don't be that way, boy. All
your big brother is trying to say
is that we're worried about you."|speech|MR. KETTNER|F
1118|ERIC|"You show up here with that piece of
ass!? Either you're fucking with
us or she's fucking with you so
which is it?"|speech|ERIC|F
1119|KIRK|"Look, I know she's a little out of
my league but..."|speech|KIRK|M
1120|ERIC|"A little!? Are you shitting me?
Alright, alright! I think we can
all agree that Debbie here is one
wicked hot box."|speech|ERIC|F
1121||"Debbie smiles and squeezes Eric's hand. Mr. Kettner nods and
raises his glass."|stage direction||
1122|KIRK|She's um... very attractive.|speech|KIRK|M
1123|ERIC|"Yeah, and this Molly makes her look
like a pig."|speech|ERIC|F
1124||Debbie lets go of Eric's hand and storms upstairs.|stage direction||
1125|ERIC (CONT'D)|"You see? This girl of yours is
already startin' shit. (Calling
after Debbie) Come on baby! Kirk
didn't mean nothing by that!"|speech|ERIC|F
1126|KIRK|"Look, I don't know what's going on
either but..."|speech|KIRK|M
1127|ERIC|"I'm goin' upstairs and gettin' to
the bottom of this."|speech|ERIC|F
1128||"68.
KIRK"|unknown||
1129|ERIC|Eric!   No!|speech|ERIC|F
1130|ERIC|"I think this gal is messing with my
little brother and I'm not going to
sit still for it."|speech|ERIC|F
1131|KIRK|"Eric! Okay! I know! I'm sure
she's just slumming or something
and it's all going to be over any
minute but, Jesus Christ! She'll
come to her senses without any help
from you! She's up there with..."|speech|KIRK|M
1132||"Kirk turns to point up the stairs. As he glances back, he
finds Molly standing on the steps listening and frowning down
at him. Before Kirk can get a word out, Molly storms out of
the house. Kirk runs upstairs but she's in her car before he
can get out the front door. Eric appears behind him."|stage direction||
1133|ERIC|"Way to go numbnuts. You should
have let me handle it."|speech|ERIC|F
1134||INT. AIRPORT SECURITY CHECKPOINT - DAY|location||
1135||"Kirk stands at work, searching Habib's bag and looking
grouchy. Fuller monitors Kirk, arms crossed. Habib lets out
a long irritated sigh."|stage direction||
1136||KIRK|location||
1137|ERIC|I know.   I'm sorry, man.|speech|ERIC|F
1138||"Kirk hands the bag back to Habib and sends him on his way.
Randy, another agent, hands Kirk a note.
INSERT: The note reads, ""Kirk, We need to talk.     I'm in the
food court. -M.""
Kirk sighs.   Stainer is now reading over Kirk's shoulder."|stage direction||
1139|STAINER|"Well, I guess this is it. I'm
surprised she even bothered."|speech|STAINER|M
1140||INT. AIRPORT FOOD COURT|location||
1141||"The food court is crowded.     Kirk looks around for Molly but
does not see her."|stage direction||
1142||69.|unknown||
1143|MARNIE (O.S.)|Good, you got my note.|speech|MARNIE|F
1144||"Kirk turns to find Marnie sitting at a table working on a
Burrito Supreme."|stage direction||
1145||KIRK|unknown||
1146|MARNIE (O.S.)|Oh.     Yeah.     Hi.|speech|MARNIE|F
1147|MARNIE|"I'm sorry to bug you at work but
this couldn't wait."|speech|MARNIE|F
1148||Kirk sits down.|stage direction||
1149|MARNIE (CONT'D)|"Kirk, I think I messed up. I see a
change in you and I like it. So, I
was thinking that we should
maybe... get back together. Just
to try it out, you know?"|speech|MARNIE|F
1150||KIRK|unknown||
1151|MARNIE (CONT'D)|Wow.    I don't know, Marnie.|speech|MARNIE|F
1152|MARNIE|"Why not? Please don't say it's
because of this Molly person."|speech|MARNIE|F
1153||KIRK|location||
1154|MARNIE|"No, I think I already screwed that
up anyway."|speech|MARNIE|F
1155|MARNIE|"Good. I was really worried about
you with her. She seems like kind
of a bitch."|speech|MARNIE|F
1156||KIRK|unknown||
1157|MARNIE|What?    She is not.|speech|MARNIE|F
