|character|text|type|character_clean|gender
1158|MARNIE|"Well, she acts like she's better
than everyone with her hybrid car
and her la-de-da charity work."|speech|MARNIE|F
1159|KIRK|"She doesn't do that at all, Marnie.
You're just putting that on her."|speech|KIRK|M
1160||70.|unknown||
1161|MARNIE|"Okay, maybe so. See? This is what
I mean. You never argued with me
before. You're really growing."|speech|MARNIE|F
1162|KIRK|What about Ron?|speech|KIRK|M
1163|MARNIE|"If you want to get back together,
of course, I'll break up with Ron."|speech|MARNIE|F
1164|KIRK|You mean you're still with him?|speech|KIRK|M
1165|MARNIE|"I'm not going to risk being all
alone just because you don't know
what's good for you. Come on,
Kirk. Deep down, you know where
you belong."|speech|MARNIE|F
1166|KIRK|"You're right, I think I do.   Say hi
to Ron for me."|speech|KIRK|M
1167||Kirk stands and walks away.|stage direction||
1168||EXT. AIR SHOW ENTRANCE - DAY|location||
1169||"Kirk and Stainer are at the ticket gate. Kirk pays for his
ticket but Stainer stands staring at him."|stage direction||
1170|KIRK|What?|speech|KIRK|M
1171|STAINER|"This wasn't my idea. I ain't
dropping twenty bucks to go in
there. God-damned planes are in
the sky. I can see 'em just fine
from the parking lot for free."|speech|STAINER|M
1172||Kirk begrudgingly buys Stainer a ticket.|stage direction||
1173||EXT. AIR SHOW|location||
1174||"Kirk and Stainer move through the crowd. Stainer now carries
a corn dog, a giant soda and an armload of Air Show
memorabilia, including an inflatable F/A-18 Hornet."|stage direction||
1175||71.|unknown||
1176|KIRK|"She's working one of the kids'
charities. I'm guessing they might
be down by the rides."|speech|KIRK|M
1177|STAINER|"Whoa dude, check it out.   The Blue
Angels!"|speech|STAINER|M
1178||"Five men in flight suits and aviator sunglasses strut through
the crowd in slow motion. They exude masculine confidence."|stage direction||
1179|STAINER (CONT'D)|"Those are the coolest guys in the
entire world. Think about it -
George Clooney or Derek Jeter would
trade places with those guys in a
second. Can you imagine the sheer
magnitude of puss those fuckers tag?
I'm gonna get 'em to sign my Hornet!"|speech|STAINER|M
1180||"Stainer runs toward them. He joins some kids and beautiful
women who are already getting autographs.
Kirk spots Molly working a charity booth. He crosses to her.
She turns to him with a this-better-be-good stance."|stage direction||
1181|KIRK|Molly.|speech|KIRK|M
1182|MOLLY|Kirk.|speech|MOLLY|F
1183|KIRK|"I just wanted to apologize for last
night... for my family."|speech|KIRK|M
1184|MOLLY|Your family I can deal with.|speech|MOLLY|F
1185|KIRK|And for me... For what I said.|speech|KIRK|M
1186|MOLLY|"Do you really think I'm that
shallow? You think I need to slum?"|speech|MOLLY|F
1187|KIRK|"No. I don't know what to think.
You just have to understand that
this is a new area for me. Believe
it or not, I don't have gobs of
experience with beautiful women."|speech|KIRK|M
1188||72.|unknown||
1189|MOLLY|Is that all I am to you?|speech|MOLLY|F
1190|KIRK|"No, but I don't have much
experience with brilliant,
successful, wonderful women either."|speech|KIRK|M
1191||This melts Molly a bit.|stage direction||
1192|MOLLY|"Kirk, this can't work if you put me
up on some kind of pedestal."|speech|MOLLY|F
1193|KIRK|"It's not that I... Okay, look...
When I was a kid, we played a lot
of baseball in my neighborhood.
The worst part was picking teams
because I was always picked last.
Every time. Like they couldn't
start a friggin' game without first
establishing how much I sucked.
So, now you come along and make me
feel like the first pick. But...
what if I can't hit?"|speech|KIRK|M
1194||Molly softens and smiles.|stage direction||
1195|MOLLY|"You already got to first base.
Just keep your eye on the ball."|speech|MOLLY|F
1196||Kirk nods and smiles back.   Molly steals a quick kiss.|stage direction||
1197|MOLLY (CONT'D)|"Let me tie up a couple things and
I'll show you around the grounds."|speech|MOLLY|F
1198|KIRK|Sounds good.|speech|KIRK|M
1199||"Molly goes into a tent to speak to Patty.    Kirk watches her
with a calm, relieved smile."|stage direction||
1200|VOICE (O.S.)|Boy, she sure is something, huh?|speech|VOICE|M
1201||"Kirk turns toward the imposing Blue Angel pilot standing
behind him. The pilot removes his shades - it's Talon."|stage direction||
1202||73.|unknown||
1203|TALON|"It's Kirk right? (firm handshake)
Excellent to see you again, sir."|speech|TALON|M
1204||KIRK|unknown||
1205|TALON|Oh, Talon.     You're a Blue Angel?|speech|TALON|M
1206|TALON|Yes sir, a Naval Aviator.|speech|TALON|M
1207|KIRK|"Perfect. Okay, I get it - Talon is
what - your call-sign?"|speech|KIRK|M
1208|TALON|No, it's my name.|speech|TALON|M
1209|KIRK|Then what's your call-sign?|speech|KIRK|M
1210|TALON|"Oh, I'd rather not say. It's
embarrassing. Just something the
guys gave me..."|speech|TALON|M
1211||"Talon puts his arm around Kirk and walks him away from the
booth."|stage direction||
1212|TALON (CONT'D)|"Anyway listen Kirk, is it fair to
say that you and Mol are close?"|speech|TALON|M
1213|KIRK|Yeah, I guess.|speech|KIRK|M
1214|TALON|"Well, I understand that fellas like
yourself tend to have uniquely
candid relationships with the women
they befriend. Am I right?"|speech|TALON|M
1215|KIRK|Fellas like myself?|speech|KIRK|M
1216|TALON|"Don't get me wrong. I have no
problem with your lifestyle. What
grown men do in the privacy of
their homes is none of my concern."|speech|TALON|M
1217|KIRK|Talon, I'm not...|speech|KIRK|M
1218||74.|unknown||
1219|TALON|"Hey, I'm in the Navy. I don't ask
and I don't expect you to tell."|speech|TALON|M
1220||Talon looks over his shoulder to confirm they are alone.|stage direction||
1221|TALON (CONT'D)|"Now, I don't know what Molly's told
you about me, but anything bad - I
deserve. I hurt that girl. I hurt
one of God's own angels and I've
regretted it every minute since."|speech|TALON|M
1222||KIRK|location||
1223|TALON (CONT'D)|No.   She speaks very highly...|speech|TALON|M
1224|TALON|"God as my witness, I WILL make it
right. I WILL get her back. Can I
count on you to put in the good
word for me, Poncho?"|speech|TALON|M
1225|KIRK|Um... Sure.|speech|KIRK|M
1226|TALON|You're the man. Come here.|speech|TALON|M
1227||Talon embraces Kirk in a tight hug.|stage direction||
1228|TALON (CONT'D)|There you go. Feel the tolerance.|speech|TALON|M
1229||Another Blue Angel calls over while signing Stainer's plane.|stage direction||
1230||BLUE ANGEL #2|unknown||
1231|TALON (CONT'D)|"Yo! Foot-Long! We scramble in
ten."|speech|TALON|M
1232||TALON|location||
1233|TALON (CONT'D)|Roger!|speech|TALON|M
1234||"Talon finishes the long hug. He and the other Blue Angels
walk off in formation. Stainer rejoins Kirk."|stage direction||
1235|KIRK|That was Talon.|speech|KIRK|M
1236|STAINER|"Who? The Blue Angel guy?    (cracking
up) Duuuuude!"|speech|STAINER|M
1237||Molly joins them.|stage direction||
1238||75.|unknown||
1239||"MONTAGE OVER LOUD CATCHY TUNE:
1) Kirk and Molly walk arm in arm through the air show crowd.
Kirk's POV as every guy that passes checks her out. Close on
Kirk's proud expression. The Blue Angels take flight. Close
on the planes as they weave in and out of an intricate
formation. A wider shot reveals that their jet trails spell
out ""MOLLY"" inside a heart. Reverse to pan across Molly
(worried about Kirk's reaction), Kirk (trying not betray his
insecurity) and Stainer (trying to hold back his laughter.)
2) Kirk and Molly in a crowded movie theatre. She squeezes
his hand and he smiles back at her. Molly turns back to the
screen and Kirk's smile quickly degrades into a dirty look.
The shot widens to reveal who Kirk is glaring at - another
man (also with a date) sits on Molly's opposite side and
stares down at her cleavage. The man looks up to meet Kirk's
gaze and smiles back. He offers Kirk a fist-tap behind
Molly's head. Annoyed, Kirk doesn't tap back. Molly is
oblivious to this exchange.
3) As Molly walks down a city sidewalk at night, Kirk has
stopped to tie his shoe. When he trots after her to catch up,
he is tackled by two cops."|stage direction||
1240||"COP
Nice try pervert!"|unknown||
1241||Molly spins around, horrified.|stage direction||
1242||"COP (CONT'D)
It's okay ma'am. This fat tub of
shit was following you but we got
him."|unknown||
1243||"Molly angrily grabs Kirk by the arm and frees him from the
cop's grasp.
4) Kirk, in his TSA uniform, addresses a group of patients at
the Children's Cancer Center. He demonstrates a metal
detector wand. Molly sits with the kids who look bored out
of their minds. Suddenly, the kids light up and Kirk feels
he's making an impression until he realizes that Talon has
come up behind him. Talon is dressed in his flight suit and
carrying an arm-load of toy jets. The kids excitedly jump up
and gather 'round Talon; some even hug him.
FADE MUSIC"|stage direction||
1244||INT. RESTAURANT - NIGHT|location||
1245||"Dressed up and wearing party hats, Kirk, Stainer, Devon, Jack
and about thirty others stand in a small, classy restaurant."|stage direction||
1246||76.|unknown||
1247||"The place is decorated with balloons and streamers.   A huge
banner reads, ""HAPPY BIRTHDAY KATIE!"""|stage direction||
1248|STAINER|"Seriously, what's with the banner?
She's blind, right? Seems like
they could have saved a few bucks
there."|speech|STAINER|M
1249||Patty runs in.|stage direction||
1250|PATTY|Here they come! Everybody hide!|speech|PATTY|F
1251|STAINER|Is that really necessary?|speech|STAINER|M
1252||KIRK|location||
1253|STAINER|Stainer!   Just hide.|speech|STAINER|M
1254||"They hide. Molly leads her sister, KATIE, into the
restaurant. ""Surprise!"" Molly hugs Katie."|stage direction||
1255||(to Stainer)|unknown||
1256|KIRK (CONT'D)|Still think she's Al Qaeda?|speech|KIRK|M
1257||Stainer brushes off the comment.   Molly waves Kirk over.|stage direction||
1258|MOLLY|Katie, I'd like you to meet Kirk.|speech|MOLLY|F
1259|KATIE|"It's so nice to meet you, I've
heard great things."|speech|KATIE|F
1260|KIRK|"Oh, thank you. Molly raves about
her big sister non-stop."|speech|KIRK|M
1261||KATIE|unknown||
1262|KIRK|May I?|speech|KIRK|M
1263||"Katie reaches out to feel Kirk's face. She's a bit perplexed
by the result. Two blind teenaged boys approach."|stage direction||
1264|BLIND TEEN|Mrs. McCall?|speech|BLIND TEEN|?
1265||KATIE|unknown||
1266|BLIND TEEN|Robert!    Is Jerry with you?|speech|BLIND TEEN|?
1267|JERRY|Yes, ma'am. Happy Birthday.|speech|JERRY|?
1268||77.|unknown||
1269|KATIE|"It's so nice you came. (to Molly)
These are two of my star pupils,
Robert and Jerry. Boys, this is my
sister, Molly."|speech|KATIE|F
1270|JERRY|It's nice to meet you.|speech|JERRY|?
1271||"They each feel Molly's face and then start elbowing one
another like a couple of horny construction workers.
A cake is brought in as everyone sings an unrecognizable but
uncopyrighted birthday song. Katie blows out her candles."|stage direction||
1272|MOLLY|What's your wish, Katie?|speech|MOLLY|F
1273|KATIE|"I wish Kirk would play the piano
for me."|speech|KATIE|F
1274||"Kirk's face drops. Molly kisses her sister on the forehead
as she has obviously coached the response. Immediately Patty
is behind Kirk, pushing him. Kirk tries to politely decline
but now Katie has him by the hand and is leading him to the
piano bench. Everyone applauds and cheers for him to play."|stage direction||
1275||KIRK|location||
1276|KATIE|Really.   I can barely play.|speech|KATIE|F
1277|KATIE|Come on, Kirk! For my birthday?|speech|KATIE|F
1278||"Kirk is sweating. He reaches for the keys but he is now
white as a ghost. Molly watches in suspense, rethinking
what she's done. Kirk's hands shake. He moves them around,
hunting for a place to begin. The party-goers stare and the
room gets quiet. Kirk puts his hand over his mouth as though
he might vomit.
Molly presses play on a CD player behind the bar. Suddenly,
a Cheap Trick song kicks in over the restaurant's sound
system. Katie jumps up to dance with her friends.
Kirk gets up from the piano and tries to laugh it off.    Talon
appears behind him and puts a hand on his shoulder."|stage direction||
1279|TALON|"It's okay Kirk. You'll rock us
next time right chief?"|speech|TALON|M
1280||78.|unknown||
1281|KIRK|Oh, hey Talon. Thanks.|speech|KIRK|M
1282|TALON|"I'm glad you're here. I feel
terrible about our little
misunderstanding. I don't know
what had me thinking you were a gay
fella. Molly tells me you two have
been seeing each other."|speech|TALON|M
1283||Patty passes between them and gives Talon a dirty look.|stage direction||
1284|TALON (CONT'D)|"She's got every right. I'd hate me
too. (THEN) I want to congratulate
you, Poncho. You're the better man.
Now, I'll step aside and truly wish
you the best of luck. I wouldn't
wish losing that girl on my worst
foe. But, make no mistake, you blow
it and I'll be waiting in wings.
Love and war, right chief?"|speech|TALON|M
1285||"Talon gives Kirk a respectful military salute. Kirk holds
his forced confidence until Talon departs. Once alone,
Kirk's poise deflates and he plops down into a chair.
The party goes on and Katie opens a small present."|stage direction||
1286|MOLLY|Oh, it's a DVD.|speech|MOLLY|F
1287|KATIE|Who's this from?|speech|KATIE|F
1288||Nobody claims it but Jack and Devon look at Stainer.|stage direction||
1289||STAINER|location||
1290|KATIE|What?   It's closed captioned.|speech|KATIE|F
1291||"Patty and Kirk are sitting and talking at a table that is
away from the group. Across the room, Talon raises a glass
to them. Patty gives Talon the finger."|stage direction||
1292|KIRK|What did he do?|speech|KIRK|M
1293|PATTY|"Listen, Molly would kill me if she
knew I was telling you this but I'm
trying to do you a favor."|speech|PATTY|F
1294||79.|unknown||
1295||KIRK|location||
1296|PATTY|Okay.|speech|PATTY|F
1297|PATTY|"Molly has this physical...um issue.
You know, kind of like a birth
defect?"|speech|PATTY|F
1298|KIRK|Oh, my God.|speech|KIRK|M
1299|PATTY|"It's not a big deal but she's
really self-conscious about it.
Talon and some other guys she's
dated have been weirded out and
made her feel like a freak."|speech|PATTY|F
1300|KIRK|What is it?|speech|KIRK|M
1301|PATTY|"It's better if she tells you but if
you can't deal with it, just get
lost now and don't put her through
that heartbreak again."|speech|PATTY|F
1302||KIRK|location||
1303|PATTY|No, no.   I wouldn't do that.|speech|PATTY|F
1304|PATTY|"Good. 'Cause if you do, it'll be
your last conscious act... (she
stands) Cake?"|speech|PATTY|F
1305||"Patty heads off to get some cake. Kirk sits, considering
this information. He looks at Molly. She is wearing a small
black dress. She looks perfect in every way. Kirk crosses
the room and walks out to the..."|stage direction||
1306||EXT. RESTAURANT FRONT SIDEWALK|location||
1307||"He throws his hands up in the air and does a happy dance
similar to the one he had done after their first kiss.
Stainer, Devon and Jack are around the corner as Stainer and
Jack are smoking a bowl. Devon hears Kirk's celebration and
peers around the corner. He waves the others over. The guys
come around the front to join Kirk."|stage direction||
1308||STAINER|location||
1309|PATTY|Dude?|speech|PATTY|F
1310||80.|unknown||
1311||(playfully chipper)|unknown||
1312|KIRK|My friends! Whassup Bitches!|speech|KIRK|M
1313||DEVON|location||
1314|KIRK|What?   What's going on?|speech|KIRK|M
1315|KIRK|"My troubles are over boys! It's
all going to work out! Check it
out - Molly has... Wait for it..."|speech|KIRK|M
1316||Kirk pauses for dramatic effect and then puts his thumbs up.|stage direction||
1317|KIRK (CONT'D)|...a birth defect!|speech|KIRK|M
1318||DEVON|unknown||
1319|KIRK (CONT'D)|Excuse me?|speech|KIRK|M
1320|JACK|That's terrible.|speech|JACK|M
1321||KIRK|location||
1322|JACK|"No.   That's awesome!   Don't you get
it?"|speech|JACK|M
1323||DEVON|unknown||
1324|JACK|Ahhhh No.|speech|JACK|M
1325|STAINER|"Sure, I get it. She needs a good
guy like Kirky 'cause the guys she
dates can't handle it, right?"|speech|STAINER|M
1326|KIRK|It sent Talon packing.|speech|KIRK|M
1327||Kirk and Stainer high five.    Jack and Devon look disturbed.|stage direction||
1328|DEVON|Well, what's wrong with her?|speech|DEVON|M
1329|KIRK|"I don't know yet. Patty just said
she had a physical issue."|speech|KIRK|M
1330|DEVON|"Well that could be anything. Did
she say it was a birth defect?"|speech|DEVON|M
1331||81.|unknown||
1332|KIRK|"She said it was, ""something like a
birth defect."""|speech|KIRK|M
1333|JACK|What if it's something really bad?|speech|JACK|M
1334|KIRK|"I hope it is. I hope it's
something that would make most guys
run screaming. It won't matter to
me. I love her."|speech|KIRK|M
1335|JACK|"That's cool that you love her but
it's pretty fucked up to be rooting
for a harsh deformity."|speech|JACK|M
1336|DEVON|"Oh, wow. What if this is Patty's way
of telling you that Molly is a man?"|speech|DEVON|M
1337|STAINER|"Hey, if that chick has a dick, I'll
suck it!"|speech|STAINER|M
1338||INT. RESTAURANT - LATER|location||
1339||"Kirk and Molly are cleaning up after the party. Kirk is
relaxed and in a fantastic mood. Patty gets her coat and
hugs Molly before exiting. Molly sheepishly approaches Kirk."|stage direction||
1340|MOLLY|"Kirk, I'm so sorry about the piano
thing. It was stupid of me."|speech|MOLLY|F
1341|KIRK|"No. I know what you were trying to
do. It's okay. I wish I could
have played for her but..."|speech|KIRK|M
1342|MOLLY|"Well, anyway, thanks for all your
help with Katie's party. I know it
meant a lot to her."|speech|MOLLY|F
1343||"Molly kisses Kirk. Now he's calm and kisses her back
passionately. She smiles a naughty smile at him."|stage direction||
1344||MOLLY (CONT'D)|location||
1345|MOLLY|Tonight?|speech|MOLLY|F
1346||82.|unknown||
1347||KIRK|location||
1348|MOLLY|Tonight.|speech|MOLLY|F
1349||They start cleaning up as fast as they can.   Kirk is beaming!|stage direction||
1350||INT. MOLLY'S CONDO - NIGHT|location||
1351||"MONTAGE OVER LOVE SONG:
Kirk and Molly enter her modern, luxurious condo.   Kirk takes
her coat. They kiss.
Kirk opens a bottle of wine.   He pours one glass to share.
They sit on the couch talking. Kirk is on!    He is confident
and silly and Molly is eating it up.
They are making out passionately on the couch.
Molly stands and extends her hand to Kirk. Kirk stands and
his boner is impossible to miss. This time he looks down at
it as if to say, ""How 'bout them apples!?"" Molly laughs and
leads him into the bedroom.
Kirk sits on the bed and Molly goes into the bathroom. He
lights a candle. He is now in a normal state of nervousness
but nothing like he had been before. He pulls out a stick of
gum. He chews it quickly and spits it out.
Kirk lies down and then sits up and then repeats this.   He
decides to sit.
Molly opens the door. She is wearing sexy ligerie and
slippers. She looks perfect. She crosses to the bed and
sits down next to Kirk. They kiss but Molly stops.
MUSIC REDUCED TO BACKGROUND"|stage direction||
1352|MOLLY|"Kirk, before we do this, there's
something I'm really insecure about
and you're going to see it sooner
or later so..."|speech|MOLLY|F
1353|KIRK|Hey, take a look at me.|speech|KIRK|M
1354||"Molly smiles nervously. She stands in front of him, Crying
Game style. She removes her feet from her slippers and looks
down at them. Kirk looks down. Even her feet are fantastic."|stage direction||
1355||KIRK (CONT'D)|location||
1356|KIRK|What?|speech|KIRK|M
1357||83.|unknown||
1358|MOLLY|Don't rush me... Okay, look.|speech|MOLLY|F
1359||She parts her toes.    They are webbed.   Kirk's face drops.|stage direction||
1360||KIRK|unknown||
1361|MOLLY|That's it?|speech|MOLLY|F
1362||Kirk jumps up and paces around.|stage direction||
1363|KIRK (CONT'D)|"That's it? That's the best you can
do? This is your big flaw?"|speech|KIRK|M
1364|MOLLY|If you can't handle it...|speech|MOLLY|F
1365|KIRK|"Jesus Christ! I can't! I thought
you were going to show me some kind
of hairy growth or a third nipple or
something I could work with!"|speech|KIRK|M
1366|MOLLY|What the hell is wrong with you!?|speech|MOLLY|F
1367|KIRK|"You know what's wrong with me!?
I'll tell you! I'm fat! I'm bald!
I'm ugly! I'm hairy! I'm
uncoordinated! I'm uncreative! I'm
not a college graduate! I've never
been to Europe! I have a shitty
job! I drive a shitty car! You
want me to go on!? Because I can!"|speech|KIRK|M
1368||MOLLY|unknown||
1369|KIRK|No.|speech|KIRK|M
1370|KIRK|"So, here I think that the perfect
Molly McCall is finally going to
show me a good reason why she's
messing around with the likes of
me! And this is all you got!? You
can't wear friggin' flip-flops!?"|speech|KIRK|M
1371|MOLLY|"Kirk, I've given you plenty of good
reasons."|speech|MOLLY|F
1372||84.|unknown||
1373|KIRK|"Oh, yeah! I'm nice! I'm funny! I
ask cute, stupid questions! Right!
That doesn't get a three hooked up
with a ten! Not in this world!"|speech|KIRK|M
1374|MOLLY|"A three what?   What are you
talking about!?"|speech|MOLLY|F
1375||KIRK|unknown||
1376|MOLLY|"Look! What the hell is going on
here!? What are you up to!?"|speech|MOLLY|F
1377|MOLLY|What am I up to!?    Good God!|speech|MOLLY|F
1378|KIRK|"Please, tell me you're a terrorist!
Tell me you're on a scavenger hunt!
Just tell me something that makes
sense because all you're doing is
driving me nuts!"|speech|KIRK|M
1379||(hurt and resigned)|unknown||
1380|MOLLY|"The only thing I'm going to tell
you is that I'd like you to leave."|speech|MOLLY|F
1381|KIRK|"Fine! I'm going! Webbed feet!?
Are you fucking kidding me!?"|speech|KIRK|M
1382||"Kirk grabs his coat and heads out the door.    Molly slumps
onto her bed and cries as the door slams."|stage direction||
1383||INT. AIRPORT SECURITY CHECKPOINT - DAY|location||
1384||"Kirk is at his post looking terribly sad. Stainer is working
at the same lane and is obviously feeling bad for his friend.
Fuller taps Kirk on the shoulder to alert him that Habib is
coming through. Habib sees this and takes his bag straight
to the search table, where he opens it for Kirk. Kirk
doesn't look inside."|stage direction||
1385|KIRK|Go on, Habib. You're good.|speech|KIRK|M
1386||HABIB|location||
1387|KIRK|Really!?   Great!|speech|KIRK|M
1388||Habib steps off to his gate.   Fuller gets in Kirk's face.|stage direction||
1389||85.|unknown||
1390|FULLER|"You think you're pretty smart don't
you Kettner. Thin ice mister!"|speech|FULLER|F
1391||Kirk stomps away from the checkpoint.|stage direction||
1392|FULLER (CONT'D)|"Good! Don't come back, Kettner!
America is safer without you!"|speech|FULLER|F
1393||Stainer goes after Kirk.|stage direction||
1394||EXT. AIRPORT CURB|location||
1395||"Kirk walks out the doors. Stainer catches up to him and they
walk down the busy curb at a quick, angry pace."|stage direction||
1396||STAINER|location||
1397|FULLER (CONT'D)|"Kirky! Hold up, man! What are you
doing!? You can't let her screw up
your life!"|speech|FULLER|F
1398|KIRK|Get away from me Stainer!|speech|KIRK|M
1399|STAINER|"Whoa! Don't take it out on me! We
both knew this Molly thing wasn't
going to work out! It ain't my
fault!"|speech|STAINER|M
1400|KIRK|"You're right. It's not your fault.
It's my fault for listening to all
your... pernicious advice."|speech|KIRK|M
1401|STAINER|What the fuck you talkin' about?|speech|STAINER|M
1402|KIRK|"All you did was fill my head with
all this crap about threes and tens
and how I'm not worthy."|speech|KIRK|M
1403|STAINER|"Are you worthy of a chick like
that?"|speech|STAINER|M
1404|KIRK|"Maybe! I don't know. But that's
not the point! You're supposed to
be my God damned best friend. You
know what!?"|speech|KIRK|M
1405||86.|unknown||
1406|KIRK (CONT'D)|"I think you were jealous and you
set out to sabotage us from the
start!"|speech|KIRK|M
1407|STAINER|That is total bullshit!|speech|STAINER|M
1408|KIRK|"Then why weren't you there for me?
What if she actually liked me!?
Maybe with a little help, I could
have pulled it off!"|speech|KIRK|M
1409||Kirk steps onto an...|stage direction||
1410||INT. AIRPORT SHUTTLE BUS|location||
1411||"Willy (the Russian) is behind the wheel and as happy as ever.
A few others are seated on the bus. Stainer follows Kirk on
board. They remain standing, holding onto poles."|stage direction||
1412|WILLY|"It is Kirk and his crazy friend
Stinker and they are most upset!"|speech|WILLY|F
1413||"Willy steps on it and drives like a maniac, knocking Kirk and
Stainer around as they argue."|stage direction||
1414|STAINER|Kirk, she was going to hurt you.|speech|STAINER|M
1415|KIRK|Look at me! I'm hurt now!|speech|KIRK|M
1416||"Willy occasionally blurts out mindless echoes of their
argument, which Kirk and Stainer mostly ignore, like..."|stage direction||
1417|WILLY|He's hurting now!|speech|WILLY|F
1418|STAINER|"The longer this went on the worse it
would have been. I guarantee it!"|speech|STAINER|M
1419|KIRK|"You don't know what you're talking
about."|speech|KIRK|M
1420|WILLY|He does not know!|speech|WILLY|F
1421|STAINER|"Yes, I do, Kirk! I know exactly
what I'm talking about."|speech|STAINER|M
1422||87.|unknown||
1423|WILLY|Perhaps he does know after all!|speech|WILLY|F
1424|STAINER|"Remember last year when you hardly
saw me for about two months? I met
my own perfect ten. Tina Jordan.
Smart, cool and hot like you
wouldn't believe. Hotter than
Molly even."|speech|STAINER|M
1425|KIRK|"Yeah right. So how come I never
heard a word about her until now?"|speech|KIRK|M
1426|WILLY|Yes, how come no word of this Tina!?|speech|WILLY|F
1427|STAINER|"I didn't tell anyone. I didn't
want to jinx it. She was perfect.
I was spilling over with...with
fucking happy! You know?"|speech|STAINER|M
1428|WILLY|Fucking happy!|speech|WILLY|F
1429|STAINER|"Two months into it, she dumps me.
And I knew it was coming. A girl
like that. Sooner or later she was
bound to get a better offer. But
it kicked my ass, man. I was
depressed for months."|speech|STAINER|M
