|character|text|type|character_clean|gender
613|KIRK|"It's okay. Get it together. Guys
do this all the time. You can do
this. You can make it happen."|speech|KIRK|M
614||(from inside a stall)|unknown||
615|RANDOM MAN'S VOICE (O.S.)|"You better not be jerking off in
the sink, man!"|speech|RANDOM MAN'S VOICE|?
616||EXT. AIRPORT PARKING LOT - DAY|location||
617||"Kirk's Taurus pulls into a space. He climbs out and slams
the door. As it closes, he reaches but too late. He looks
through the window. The keys are hanging in the ignition."|stage direction||
618||INT. AIRPORT SHUTTLE BUS|location||
619||"WILLY, the Russian driver, is chipper and bubbly as he sings
along with ""I'm Like a Bird"" on the radio. Kirk is knocked
around by Willy's crazy driving. In the mirror, Willy
notices Kirk's dazed expression."|stage direction||
620||(thick accent)|unknown||
621|WILLY|"Kirk! You look like someone made a
second number in your breakfast
cereal. You are doing okay, yes?"|speech|WILLY|F
622|KIRK|"You know what Willy. I honestly
don't know how I'm doing."|speech|KIRK|M
623|WILLY|He does not know!|speech|WILLY|F
624|KIRK|"I should be doing awesome but I
don't know. Know what I mean?"|speech|KIRK|M
625|WILLY|Nope!|speech|WILLY|F
626||37.|unknown||
627|KIRK|How are you?|speech|KIRK|M
628|WILLY|"Perfect! Willy is having another
kick ass of a day."|speech|WILLY|F
629||Willy takes a hard left and some suitcases fall on Kirk.|stage direction||
630||INT. AIRPORT FOOD COURT - DAY|location||
631||"Kirk is picking up a coffee. As he walks on, he takes a sip.
The lid comes off and hot coffee spills on his shirt."|stage direction||
632|STAINER (O.S.)|Way to go, Big Slick.|speech|STAINER|M
633||"Stainer is now next to Kirk, who glares back at him as they
walk across the food court.
A short, plain girl behind the Orange Julius counter gives
them an apprehensive wave."|stage direction||
634||STAINER (CONT'D)|unknown||
635|STAINER (O.S.)|Oh, shit.    Let's go this way.|speech|STAINER|M
636||"Stainer returns an uncomfortable smile but then redirects
their path away from her. Kirk waves."|stage direction||
637|KIRK|Who's that?|speech|KIRK|M
638|STAINER|"Nobody. Just some chick I boned
once when I was drunk. You look
like shit, bro."|speech|STAINER|M
639|KIRK|"Thanks. I had trouble sleeping
last night. This Molly thing... I
don't want to want this, you know?
It just seems too good to be true.
I just don't get it."|speech|KIRK|M
640|STAINER|"I know what you mean.   There has to
be some explanation."|speech|STAINER|M
641|KIRK|"I can't think of one.   Not one that
makes any sense."|speech|KIRK|M
642||38.|unknown||
643|STAINER|"Well, let's spitball it a little.
You've got dick for money so she's
no gold digger. Oohh! Did you
ever see Double Indemnity?"|speech|STAINER|M
644|KIRK|"Please don't say she wants me to
kill someone."|speech|KIRK|M
645|STAINER|"Okay, then... maybe she's on a
scavenger hunt. You know, like
find a wagon wheel, a wiffle ball
bat and a fat, bald TSA agent -
that kind of thing."|speech|STAINER|M
646||Kirk is no longer responding.|stage direction||
647|STAINER (CONT'D)|"Oh, shit, dude. Al Qaeda. Think
about it. You're a TSA agent,
she's a terrorist..."|speech|STAINER|M
648||Kirk walks away.|stage direction||
649||EXT. OLD STRIP MALL - DAY|location||
650||"Kirk, still in his TSA uniform, walks past a large laundromat
to a small storefront next door. The chipped and faded
lettering on the glass reads, ""Maury Hammerstein, Attorney At
Law - Aggressive, Dynamic Representation Since 1942!"" As
Kirk reaches for the door, he notices a small hand-written
sign, ""I don't make change!"" He goes inside."|stage direction||
651||INT. LAW OFFICE|location||
652||"Wood paneling, buzzing fluorescent lights and furniture the
Salvation Army would sell only as firewood.
Eric and Debbie sit with Kirk's parents. There are two
elderly women and another middle aged man in the room as
well. Maury, who's about a hundred years old - cute and
meek, fusses with an ancient VCR while smoking a cigarette.
Kirk sits down next to Eric. Kirk notices a free bank
calender on Maury's desk - dated 1991."|stage direction||
653|ERIC|It's about time, numbnuts.|speech|ERIC|F
654|KIRK|I came right from work.|speech|KIRK|M
655||39.|unknown||
656|MR. KETTNER|Okay Maury - we're all here.|speech|MR. KETTNER|F
657|MAURY|"Oh! You bet! You betcha! Okay,
hi there Kirk. Firstly, let me
just say how awful sorry I am.
Stella was one heck of a gal and a
real dish. Anyhow, let me just..."|speech|MAURY|F
658||"Maury gets the VCR going.   ""Wheel of Fortune"" comes up on the
screen."|stage direction||
659|MAURY (CONT'D)|"Oh mercy. I didn't tape over her
with The Wheel did I?"|speech|MAURY|F
660||"The picture goes to snow and then stutters into a shot of
Grammy sitting in her kitchen. She has just clicked the
video camera on with a remote control."|stage direction||
661||MAURY (CONT'D)|unknown||
662|MAURY (CONT'D)|Oh, good.    There she is.|speech|MAURY|F
663|GRAMMY|"Testing. One, two, three, four.
Oh, this God damned thing!"|speech|GRAMMY|F
664||She gets up and fusses with the camera.|stage direction||
665|GRAMMY (CONT'D)|Jap piece of shit! Is it on!?|speech|GRAMMY|F
666||Cutaway to Kirk tearing up.   Grammy sits back down.|stage direction||
667|GRAMMY (CONT'D)|"Okay, my name is Stella Edith Dakin
and if you're watching this, I'm
dead as a doorknob and I ain't
spent all my money yet. I got shit
to do today so I'm going to get
right to it. This is my last will
and testament and if you miss
anything the old Jew's got the
paperwork. Okay, here's the
deal..."|speech|GRAMMY|F
668||"Everyone besides Kirk leans in, excited to hear what they
might get. A phone rings. Maury looks around but the
ringing is coming from the TV. Grammy answers the phone."|stage direction||
669||40.|unknown||
670|GRAMMY (CONT'D)|"Hello? I'm kind of busy right now
Eric... Oh, for God's sake, boy!
How can you be sure it's even
yours? It could be practically
anybody's!... No, I'm not paying
for that!... Well, then I guess
you're going to be a daddy.
Congratulations, now I gotta go!"|speech|GRAMMY|F
671||She hangs up, puts on her glasses and lights up a smoke.|stage direction||
672|GRAMMY (CONT'D)|"Anyway! I love all of you, despite
some of the shit you pulled, but I
spent my life a gambler and I always
put my money on the best bet. The
odds of any of you fish doing
anything worthwhile with my stack
are slim to none. So old Grammy's
going all in on Big Slick."|speech|GRAMMY|F
673||Everyone looks at Kirk who is stunned.|stage direction||
674|GRAMMY (CONT'D)|"I'm proud of you, Kirk. Don't let
your old Grammy down. Do something
good with it."|speech|GRAMMY|F
675||She blows a kiss, lifts the remote and aims it at the camera.|stage direction||
676|GRAMMY (CONT'D)|Oh, for Christ sakes!|speech|GRAMMY|F
677||She throws the remote at the lens.    The picture goes to snow.|stage direction||
678|ERIC|"So Kirk gets it all!?   That is
bullshit!"|speech|ERIC|F
679|KIRK|Eric, it can't be much.|speech|KIRK|M
680|ERIC|Well!?|speech|ERIC|F
681||"Maury digs into his desk and pulls out a mess of papers.    He
dons a pair of glasses that make his eyes look gigantic."|stage direction||
682|MAURY|"Let's see here... Looks like she
had herself six G's in savings."|speech|MAURY|F
683||41.|unknown||
684|MAURY (CONT'D)|"Um, another three grand in bonds,
give or take. Her life insurance
will pay pert-near seventy grand."|speech|MAURY|F
685||"He adds this up on an old adding machine (the kind with the
hand crank) and writes $77,800 on a chalk board, which is
mounted on the wall behind him."|stage direction||
686|ERIC|She left him eighty grand!?|speech|ERIC|F
687|MAURY|"Most of Stella's retirement home
expenses were covered by her reverse
mortgage. But, figure in thirty
thousand still due to Arborwood
Village. She racked up forty-seven
thousand in medical bills. And my
fee, of course, which now stands at
two thousand and change - which is
real reasonable, folks."|speech|MAURY|F
688||"He writes ""Liabilities = $79,000    Total -$1,200."""|stage direction||
689|ERIC|"So Kirk owes money!? HA! Shit,
man! That is God damn hilarious!"|speech|ERIC|F
690||INT. FRENCH RESTAURANT - NIGHT|location||
691||"The upscale restaurant is crowded. Kirk and Molly are eating
at a small table. Kirk is not relaxed like he had been the
last time they ate together. He is sweating and trying to
remain cool. The Maitre d is eyeing them suspiciously."|stage direction||
692|MOLLY|"But, you can't legally be held
responsible for her debt. What
kind of hack is this attorney?"|speech|MOLLY|F
693||KIRK|unknown||
694|MOLLY|It's okay.     I had it in savings.|speech|MOLLY|F
695||The waiter brings a drink to Molly.|stage direction||
696||WAITER|location||
697||(French accent)|unknown||
698|MOLLY|"Madame. From ze gentleman in ze
grey suit."|speech|MOLLY|F
699||"From his table, a good looking man smiles and raises a drink
to Molly. She nods back - polite but annoyed."|stage direction||
700||42.|unknown||
701|KIRK|"Anyway... Grammy hated owing anyone
money. I'm afraid she couldn't
rest if she wasn't square with the
house. It's the least I can do.
She practically raised me."|speech|KIRK|M
702|MOLLY|You're a good man, Kirk.|speech|MOLLY|F
703||"Molly smiles and takes his hands. The maitre d is watching
and getting angry. The waiter returns with another drink."|stage direction||
704|WAITER|From ze gentleman in ze purple tie.|speech|WAITER|F
705||"Another guy raises his glass to her from the bar. Molly is
getting irritated. Kirk is feeling smaller every minute."|stage direction||
706|MOLLY|Listen, no more drinks.    Please.|speech|MOLLY|F
707||WAITER|unknown||
708|MOLLY|Of course.     No more drinks, madame.|speech|MOLLY|F
709||MOLLY|unknown||
710|MOLLY|I'm sorry.     This happens sometimes.|speech|MOLLY|F
711|KIRK|"Yeah, I get that a lot too. I'm
sure the next one will be for me."|speech|KIRK|M
712||"Molly laughs. The best looking man Kirk has ever seen walks
up to the table. He and Molly hug."|stage direction||
713|MOLLY|"Oh, my gosh! Talon! I didn't
realize you were in town already."|speech|MOLLY|F
714|TALON|I just flew in this morning.|speech|TALON|M
715|MOLLY|"Kirk, this is Talon.    This is my
good friend, Kirk."|speech|MOLLY|F
716|TALON|Great to meet you, sir.|speech|TALON|M
717||Talon gives Kirk a winning handshake, complete with wink.|stage direction||
718||43.|unknown||
719|TALON (CONT'D)|"So, do we have you for our Disabled
Angels Program again this year?"|speech|TALON|M
720|MOLLY|Wouldn't miss it.|speech|MOLLY|F
721|TALON|"That's fantastic. (to Kirk) Mol is
always a big hit with the kids."|speech|TALON|M
722||MOLLY|location||
723|TALON|"Please. You're the one the kids go
crazy for."|speech|TALON|M
724|KIRK|So you two work together?|speech|KIRK|M
725|MOLLY|"Only once a year. Talon is our
charity liaison at the air show."|speech|MOLLY|F
726||TALON|unknown||
727|MOLLY|And?|speech|MOLLY|F
728|MOLLY|And my ex-boyfriend.|speech|MOLLY|F
729||"Kirk starts to choke. He grabs his water glass and takes a
swig but the ice collapses and the water pours all over him."|stage direction||
730||KIRK|location||
731|MOLLY|Oh, boy.   I guess I better...|speech|MOLLY|F
732||Kirk heads off to the bathroom, muttering to himself.|stage direction||
733||KIRK (CONT'D)|unknown||
734|MOLLY|Stupid.    Stupid. Stupid.|speech|MOLLY|F
735||INT. FRENCH RESTAURANT MEN'S ROOM|location||
736||"Kirk is drying his shirt. A man is still zipping up as he
takes the next sink. Before washing, he offers a handshake."|stage direction||
737|MAX|"Excuse me. My name is Max Fleming.
I'm a financial planner."|speech|MAX|?
738||"Kirk takes the handshake reluctantly and then gets a business
card. Max then starts to wash up - so does Kirk."|stage direction||
739||KIRK|unknown||
740|MAX|Oh, Hi.|speech|MAX|?
741||44.|unknown||
742|MAX|"Please forgive me but I'm curious.
Who manages your portfolio?"|speech|MAX|?
743|KIRK|My portfolio? I don't really...|speech|KIRK|M
744||Max takes the last paper towel - forcing Kirk to drip dry.|stage direction||
745|MAX|"It's okay if you'd rather not say. I
admit that selling my services in a
men's room is a tad aggressive but
isn't that what a man of your means
requires in his financial planner?"|speech|MAX|?
746||KIRK|unknown||
747|MAX|My means.|speech|MAX|?
748|MAX|"Judging by the company you're
keeping, I'd say that you're making
a handsome living. I can help you
do even better."|speech|MAX|?
749||INT. FRENCH RESTAURANT RESTROOM HALL|location||
750||"Kirk exits reading Max's card - somewhat bewildered. The
Maitre d stops Kirk and speaks in a French accent."|stage direction||
751|MAITRE D|"Excusez-moi Monsieur.   Might I have
a word?"|speech|MAITRE D|F
752||KIRK|unknown||
753|MAITRE D|Oh, sure.    Is everything all right?|speech|MAITRE D|F
754||"The Maitre d looks around and then leans in and speaks
quietly - now without the French accent."|stage direction||
755|MAITRE D|"My kids eat here. My mother's here
right now you son of a bitch."|speech|MAITRE D|F
756||KIRK|location||
757|MAITRE D|Okay.   Did I...|speech|MAITRE D|F
758|MAITRE D|"Look, I can appreciate that this is
not some common street-walker.
You're obviously willing to pay for
the best but we can't have this
kind of thing at my place."|speech|MAITRE D|F
759||45.|unknown||
760|KIRK|"What? I'm not paying anyone.
We're just on a date."|speech|KIRK|M
761|MAITRE D|"You are on a date with her? What
am I an idiot? Now, I don't wish
to embarrass you, sir, or make a
scene. So, enjoy your dinner but,
be warned, do not ever bring
another professional into my place.
(louder and back into the French
accent) Tres bien Monsieur!"|speech|MAITRE D|F
762||INT. FRENCH RESTAURANT|location||
763||"When Kirk rounds the corner, he sees that Molly and Talon are
still talking. Kirk hides behind a plant. Molly is beaming.
She stands to hug Talon and kiss his cheek before he exits
the restaurant. Kirk returns to the table."|stage direction||
764||KIRK|location||
765|MAITRE D|Oh, no.   Did I miss Talon?|speech|MAITRE D|F
766|MOLLY|"He had to go but he asked me tell
you how much he enjoyed meeting you."|speech|MOLLY|F
767||KIRK|location||
768|MOLLY|"Yeah. Super. He, uh, seems like a
great guy."|speech|MOLLY|F
769|MOLLY|"He is. He's wonderful. I know, I
know - the blue eyes and the rock
hard abs, right? But he's really
so much more than that. A gallery
in New York just opened an exhibit
of his photography. He's a genius."|speech|MOLLY|F
770||(to the waiter)|unknown||
771|KIRK|Can we get the check?|speech|KIRK|M
772|WAITER|"Madame, your bill has been covered
by ze woman in ze Raiders Jacket."|speech|WAITER|F
773||A butch woman in the bar raises a glass in Molly's direction.|stage direction||
774||INT. MOLLY'S CAR - NIGHT|location||
775||Molly and Kirk pull into a parking lot.|stage direction||
776||46.|unknown||
777|MOLLY|"Oh my gosh! This is your
apartment? I used to live in this
neighborhood back in college."|speech|MOLLY|F
778|KIRK|"Yeah, I'm gonna move to a better
place pretty soon."|speech|KIRK|M
779|MOLLY|"We used to come to parties over
here sometimes. Oooohh. Can I
come up and see your place?"|speech|MOLLY|F
780||EXT. KIRK'S APARTMENT|location||
781||"It's Friday night and several college parties are raging in
the complex. Kirk leads Molly up the stairs and down the
balcony hall toward his door. They pass a few college
students on the way; a couple making out, a guy vomiting in a
bush. Two apartment windows are covered with tapestries of
Bob Marley and a giant pot leaf."|stage direction||
782||INT. KIRK'S APARTMENT|location||
783||"Kirk and Molly enter.   The apartment is neat, clean and
fairly sparse."|stage direction||
784|KIRK|It's not much, I know.|speech|KIRK|M
785|MOLLY|No, I like it!|speech|MOLLY|F
786||"Molly walks around and examines certain items. Kirk quietly
hides a framed picture of Marnie. Molly passes his computer
desk where she coos at a screensaver of baby polar bears.
Just as she passes it, she bumps the mouse and the computer
comes to life, revealing a ""Hot Back-Door Asians"" website.
Molly didn't see it and Kirk scrambles to turn off the
monitor. She turns to see what he's doing. He smiles. She
moves on to a rack of DVDs."|stage direction||
787|MOLLY (CONT'D)|"Wow, we have a lot of the same
DVDs. Life of Brian, Cool Hand
Luke, Family Guy... Beaches, Kirk?"|speech|MOLLY|F
788||KIRK|location||
789|MOLLY (CONT'D)|What?   It's a good movie.|speech|MOLLY|F
790|MOLLY|I love that movie.|speech|MOLLY|F
791||47.|unknown||
792||She spots a crate full of vinyl records.|stage direction||
793|MOLLY (CONT'D)|"Wow, records. No Way! Look at all
this Cheap Trick!"|speech|MOLLY|F
794|KIRK|You like Cheap Trick?|speech|KIRK|M
795|MOLLY|"Are you kidding? Heaven Tonight is
the first album I ever owned! A
hand-me-down from my big sister.
She was the coolest person in the
whole world."|speech|MOLLY|F
796||She notices an upright piano in the corner.|stage direction||
797|MOLLY (CONT'D)|You play the piano?|speech|MOLLY|F
798|KIRK|"A little. My grandma taught me.
It was kind of our thing. She was
a great player. Ragtime, show
tunes, that kind of thing. I'm
really not very good."|speech|KIRK|M
799||She plops down on the couch.|stage direction||
800|MOLLY|"Oh, I'll bet you're great.   Play
something for me."|speech|MOLLY|F
801|KIRK|"No, I can't really play in front of
people."|speech|KIRK|M
802|MOLLY|"What, the stage fright thing?    Come
on it's just me. Please?"|speech|MOLLY|F
803|KIRK|"No, I really can't. Trust me,
you're not missing anything."|speech|KIRK|M
804||"Kirk decides to join her on the couch but then he balks into
a little dance of almost sitting. He finally commits to sit."|stage direction||
805|MOLLY|"So you've never played in front of
anyone?"|speech|MOLLY|F
806||48.|unknown||
807|KIRK|"Nope. Almost did once. A talent
show in high school. I just sat up
there drenched in sweat. I really
thought I could do it but then I
made my big mistake."|speech|KIRK|M
808|MOLLY|"Let me guess. You looked at the
audience."|speech|MOLLY|F
809|KIRK|"Yep. All these eyes on me. I'm
shaking, my head is spinning, I'm
trying to remember if I even play
the piano... and then, I puked."|speech|KIRK|M
810|MOLLY|Right there on the stage?|speech|MOLLY|F
811|KIRK|INTO the piano actually.|speech|KIRK|M
812|MOLLY|"Shut up! You're lying!      Why would
you do that?"|speech|MOLLY|F
813|KIRK|"It was a reflex. I was trying not
to barf on the floor. Turns out
it's a lot easier to clean puke off
a stage than out of a baby grand."|speech|KIRK|M
814|MOLLY|"Yeah, that has to be a real bitch.
Oh, I shouldn't be laughing. You
poor thing."|speech|MOLLY|F
815||"Molly brushes his hair back with her hand. Kirk is frozen
with fear. Molly leans in. Kirk also leans in but not too
far. Molly smiles, realizing that it's up to her to make
this official. She takes him by the collar, reels him in and
kisses him. They make out for a moment. Kirk is near panic
but he does his best to keep it together."|stage direction||
816|KIRK|"Sorry. I'm a little cotton-mouthed.
I'm going to get a glass of water.
How 'bout for you? Water? A nice
glass of, you know...water?"|speech|KIRK|M
817||MOLLY|location||
818|KIRK|Yeah.   That sounds good.|speech|KIRK|M
819||49.|unknown||
820||Kirk steps away from her and disappears into...|stage direction||
821||INT. KIRK'S APARTMENT KITCHEN|location||
822||"He pours a glass of water. He's about to return when he sees
his reflection in the window. The boner under his khakis is
not subtle. He looks down and starts to panic."|stage direction||
823|KIRK|Um... You want anything to eat?|speech|KIRK|M
824||MOLLY (O.S.)|unknown||
825|KIRK|No thanks.|speech|KIRK|M
826||"Kirk opens the fridge and thrusts his pelvis in. He takes a
few deep, calming breaths.   He closes the fridge - still at
full alert. Kirk searches the kitchen, his panic building.
He grabs a Time Magazine. He flips through frantically. He
turns to a bikini model in an ad, then a naked aboriginal
women, then bare breasts in a breast cancer article."|stage direction||
827|KIRK|Oh come on!|speech|KIRK|M
828||He is sweating like crazy.|stage direction||
829|MOLLY (O.S.)|Can I give you a hand?|speech|MOLLY|F
830||KIRK|location||
831|MOLLY (O.S.)|No.   I got it!|speech|MOLLY|F
832||"Kirk finally flips to a picture of Barbara Bush.   He stares
at it hard. His boner begins to retreat."|stage direction||
833||INT. KIRK'S APARTMENT|location||
834|MOLLY|"Listen Kirk, I want you to know
that I would really like to, you
know, to be with you tonight."|speech|MOLLY|F
835||KIRK (O.S.)|unknown||
836|MOLLY|Really?|speech|MOLLY|F
837||INT. KIRK'S APARTMENT KITCHEN|location||
838||"The boner pops back up. Kirk silently mouths, ""MOTHERFUCKER!""
at his mischievous little man."|stage direction||
839|MOLLY (O.S.)|"Well, sure. But... I just don't
think I'm ready yet."|speech|MOLLY|F
840||50.|unknown||
841||Kirk's reply is rushed with enthusiastic relief.|stage direction||
842||KIRK|unknown||
843|MOLLY (O.S.)|"Sure! Sure! Yeah! No problem!
Great! That's...that's great!
Ice!? You want some ice!?"|speech|MOLLY|F
844|MOLLY (O.S.)|Sure.|speech|MOLLY|F
845||"Kirk opens the freezer. He puts a few cubes in her water and
then grabs a fistful and shoves his hand in his pants."|stage direction||
846||INT. KIRK'S APARTMENT|location||
847||Molly gets cozy on the couch and looks even sexier.|stage direction||
848|MOLLY|"I mean, don't get me wrong. I want
to! Believe me - getting naked and
crazy sounds fantastic right now."|speech|MOLLY|F
849|KIRK (O.S.)|Shit!|speech|KIRK|M
850|MOLLY|Are you okay?|speech|MOLLY|F
851|KIRK (O.S.)|Yeah, fine.|speech|KIRK|M
852||INT. KIRK'S APARTMENT KITCHEN|location||
853||"Kirk runs the water while he digs under the sink. He finds
duct tape. He pulls some tape off the roll. It makes a loud
noise that causes Molly to pause and Kirk to tense up. Kirk
opens his pants and begins taping down the trouble-spot. He
coughs hard to cover each subsequent tug of the tape roll."|stage direction||
854|MOLLY (O.S.)|"I just think we should get to know
each other first.   I'm no prude.
I mean, I'm pretty generous in bed.
Once I trust a person, I like to
experiment and get pretty wild."|speech|MOLLY|F
855|KIRK|Oh, dear God.|speech|KIRK|M
856|MOLLY (O.S.)|"But, I just need to feel safe
first."|speech|MOLLY|F
857||51.|unknown||
858||"Kirk finishes taping up, zips his pants and checks his
profile in the reflection from the window."|stage direction||
859||INT. KIRK'S APARTMENT|location||
860||Kirk returns with two glasses of water and no visible boner.|stage direction||
861||KIRK|location||
862|MOLLY (O.S.)|Hey.   I'm totally fine with that.|speech|MOLLY|F
863|MOLLY|You're the best.|speech|MOLLY|F
864||"Kirk gives an ""aw-shucks"" head tilt.    Molly stands."|stage direction||
865|MOLLY (CONT'D)|Okay, well, I'd better go then.|speech|MOLLY|F
866||"They walk to the door. Molly leans in and they kiss a few
moments more. Kirk winces as the tape is getting a little
snug. She drops her keys and then goes down on one knee to
retrieve them. Suddenly she starts coughing. She puts her
fist over her mouth.
Kirk's POV:   As her head and fist bob in front of his crotch.
Kirk winces again. She hears the tape start to give way.
She looks up, slightly confused. Kirk looks around as though
he's looking for the source of the sound. Molly stands."|stage direction||
867|MOLLY (CONT'D)|"I had a really nice time.    I'll
call you tomorrow."|speech|MOLLY|F
868||KIRK|unknown||
869|MOLLY (CONT'D)|Great!|speech|MOLLY|F
870||Kirk opens the door for Molly.|stage direction||
871||EXT. KIRK'S APARTMENT|location||
872||"As Molly exits, she gives him one last kiss. Two studly male
college students are playing foosball on their patio. They
stop when one points out the hottie who's kissing Kirk.
Molly trots off."|stage direction||
873||COLLEGE STUDENT #1|unknown||
874|MOLLY (CONT'D)|Damn, man!     That chick is fine!|speech|MOLLY|F
875||"Kirk returns a cool ""whassup"" nod to the guys."|stage direction||
876|COLLEGE STUDENT #2|All right Mr. Kettner!|speech|COLLEGE STUDENT #2|?
877||52.|unknown||
878|COLLEGE STUDENT #1|You wanna play some foos!?|speech|COLLEGE STUDENT #1|?
879|KIRK|No thanks fellas.|speech|KIRK|M
880||Kirk beams from the attention as he goes back inside.|stage direction||
881||INT. KIRK'S APARTMENT|location||
882||"He drifts over to his piano and sits down. The joy of what
has just happened is plastered on his face. He launches into
a furiously happy Jerry Lee Lewis style romp. Soon a
neighbor is pounding on the wall. Kirk stops playing."|stage direction||
883|KIRK|Sorry, Mrs. Neusbaum!|speech|KIRK|M
884||"Kirk continues his celebration, dancing around the apartment.
He picks up the picture of Marnie and speaks to it."|stage direction||
885|KIRK (CONT'D)|"Ron seems like a swell guy. I love
Pizza Hut. What? Who's this?
Why, this is my girlfriend, Molly.
Oh, don't be that way. Oh, there,
there, now. Here's a tissue."|speech|KIRK|M
886||He drops the picture and continues the dance.|stage direction||
887||INT. KIRK'S APARTMENT BEDROOM - NIGHT|location||
888||"Kirk lies in bed staring at the ceiling fan. The smile
continues as he drifts off to sleep. Time lapses as Kirk
sleeps and the sun comes up. Still smiling, his eyes open
like a shot and he reaches for his phone - ""No Missed Calls.""
MONTAGE OVER MUSIC:
1) Kirk gets up and goes into the bathroom.   He checks his
gut and hairline in the mirror.
2) From under his bed, he pulls out a Total Gym still in the
box. It is dusty, unopened and has a ribbon still attached
along with a card that reads, ""Happy Graduation - Love Mom
and Dad."" He sits in the living room bewildered as he reads
the directions. The parts are spread out all over the floor.
He works out on the machine but it soon violently collapses
underneath him. He checks his phone. ""No Missed Calls.""
3) He throws away unhealthy snacks and treats from the
cupboards."|stage direction||
889||53.|unknown||
