|character|text|type|character_clean|gender
0||"THOR
Written by"|unknown||
1|Ashley Miller & Zack Stentz|"FADE IN:
On the blackness of SPACE, beautiful and mysterious, strewn
with a billion stars.
Atop a building, a wrought-iron sign -- a HAMMER-WIELDING
BLACKSMITH -- spins listlessly in the wind as a swirling
breeze kicks up. A hint of what's to come.
1 EXT. PUENTE ANTIGUO, NEW MEXICO - NIGHT 1
A main street extends before us in this one-horse town, set
amid endless flat, arid scrubland. A large SUV slowly moves
down the street and heads out of town.
2 EXT. SUV - NIGHT 2
The SUV sits parked in the desert. Suddenly, the roof panels
of the SUV FOLD OPEN. The underside of the panels house a
variety of hand-built ASTRONOMICAL DEVICES, which now point
at the sky.
JANE FOSTER (late 20's) pops her head through the roof. She
positions a MAGNETOMETER, so its monitor calibrates with the
constellations above. It appears to be cobbled together from
spare parts of other devices."|speech|Ashley Miller & Zack Stentz|?
2|JANE|"Hurry!
We hear a loud BANG followed by muffled CURSING from below.
Jane offers a hand down to ERIK SELVIG (60) who emerges as
well, rubbing his head.
JANE (CONT'D)
Oh-- watch your head."|speech|JANE|F
3|SELVIG|"Thanks. So what's this ""anomaly""ù
of yours supposed to look like?"|speech|SELVIG|M
4|JANE|"It's a little different each time.
Once it looked like, I don't know,
melted stars, pooling in a corner
of the sky. But last week it was a
rolling rainbow ribbon--"|speech|JANE|F
5|"SELVIG
(GENTLY TEASING)"|"""Racing ""òround Orion?""ù I've always
said you should have been a poet.
Jane reigns in her excitement. She tries for dignity.
4th BLUE REVISIONS 03-26-10 1A."|speech|SELVIG|M
6|JANE|"Hey, Darcy. Pass up the bubbly and
my gloves, will you?
Intern DARCY LEWIS (20) hands Jane a bottle of Champagne and
a pair of gloves through the window. Jane passes it to
Selvig to hold while she pulls on the old gloves -- too large
and masculine for her small hands. He starts to unwrap the
foil, and she stops his hand with an excited grin.
JANE (CONT'D)
Not until you see it!"|speech|JANE|F
7|SELVIG|"(re: the gloves)
I recognize those. Think how proud
he'd be to see you now.
Jane's grin fades to a sad smile."|speech|SELVIG|M
8|JANE|Thank you.|speech|JANE|F
9|SELVIG|For what?|speech|SELVIG|M
10|JANE|"The benefit of the doubt.
The two stare out at the sky expectantly. A long beat while
they scan the skies. Nothing. Jane's worried.
4th BLUE REVISIONS 03-26-10 2.
JANE (CONT'D)
It's never taken this long before.
Darcy calls up from the front seat.
DARCY (O.S.)
Can I turn on the radio?"|speech|JANE|F
11|JANE|"(an edge to her voice)
Sure, if you like rocking out to
KFRM, ""All agriculture, all the
time.""ù
Worried, Jane heads back down into the vehicle.
3 INT. SUV - NIGHT 3
The SUV is bathed in the glow of high-tech monitoring
equipment and laptops, some looking like they're held
together with duct tape. Jane opens a well-worn NOTEBOOK of
handwritten notes and calculations. Selvig watches the
frustrated Jane with sympathy."|speech|JANE|F
12|JANE|"The anomalies are always
precipitated by geomagnetic storms.
She shows him a complicated CHART she's drawn in the book,
tracking occurrences and patterns.
JANE (CONT'D)
The last seventeen occurrences have
been predictable to the minute... I
just don't understand.
Something catches Darcy's eye out the driver's side mirror.
She adjusts it. In the distance, ODD GLOWING CLOUDS form in
the skies over the Northeastern end of the desert."|speech|JANE|F
13|DARCY|"Jane?
Jane SHUSHES her, leafs through her notes. The bottle of
champagne begins to vibrate."|speech|DARCY|F
14|JANE|"There's got to be some new
variable... Or an equipment
malfunction...
The lights and equipment in the SUV begin to FLICKER around
them. The computer monitors SQUELCH with static.
4th BLUE REVISIONS 03-26-10 2A."|speech|JANE|F
15|DARCY|"I don't think there's anything
wrong with your equipment...
The champagne bottle starts to RATTLE noisily now as it
shakes more violently. Jane and Selvig notice.
4th BLUE REVISIONS 03-26-10 3.
They watch it curiously, pressure building up inside it, when
the cork EXPLODES out of it. Champagne goes spewing
everywhere -- over equipment, over Jane.
DARCY (CONT'D)
Jane?"|speech|DARCY|F
16|JANE|What?!|speech|JANE|F
17|DARCY|"I think you want to see this.
Darcy points out the window. Jane and Selvig look out. Over
the desert --
MASSIVE CLOUDS OF RAINBOW LIGHT
Churn in the sky. The three stare, dumbfounded."|speech|DARCY|F
18|JANE|Holy. Shatner.|speech|JANE|F
19|SELVIG|"That's your ""subtle""ù aurora?!"|speech|SELVIG|M
20|JANE|"No-- yes! Let's go!
4 EXT. DESERT - MOMENTS LATER 4
The roof panels still open, the SUV races towards the strange
event, Jane, amazed by the sight, stands with half her body
out the roof, taking video of the light storm before them.
The SUV hits a bump. Jane nearly flies out. Selvig grabs
her, yanks her back in.
5 INT. SUV 5
Jane grins, thrilled, pumped with adrenaline."|speech|JANE|F
21|JANE|"Isn't this great?!
A thought strikes her.
JANE (CONT'D)
You're seeing it too, right? I'm
not crazy?"|speech|JANE|F
22|SELVIG|"That's debateable. Put your seat
belt on!
4th BLUE REVISIONS 03-26-10 3A.
The SUV lurches.
6 EXT. DESERT 6
Winds HOWL around the SUV now. Up ahead, spiraling down from
out of the clouds comes --
AN ENORMOUS TORNADO
Suffuse with the strange rainbow light, ROARING like a
thousand freight trains as it touches down."|speech|SELVIG|M
23||4th BLUE REVISIONS 03-26-10 4.|stage direction||
24|SELVIG|"7 INT. SUV 7
Selvig looks up through the still-open sunroof at the
enormous glowing funnel cloud with wonder. Jane clambers
into the front seat, beside Darcy. She leans way out the
window, TAPING the storm."|speech|SELVIG|M
25|JANE|"You've gotta get us closer so I can
take a magnetic reading.
Darcy laughs."|speech|JANE|F
26|DARCY|"Yeah, right! Good one!
(then, realizing)
Oh God, you're serious..."|speech|DARCY|F
27|JANE|"You want those college credits or
not?
8 EXT. SUV 8
The SUV tears across a field towards the tornado, Jane
leaning out the window, taping the event. The SUV disturbs
two RAVENS perched on a cactus as they race past. The birds
take flight, when -- KRAKABOOM! A huge BOLT OF LIGHTNING
strikes down through the center of the funnel cloud before
them with a terrifying intensity.
9 INT. SUV 9
The SUV rocks from the blast. Darcy's had enough. She turns
the wheel, starts to head away."|speech|JANE|F
28|DARCY|"Keep the credits. I'll intern at
Burger King."|speech|DARCY|F
29|JANE|What are you doing?!|speech|JANE|F
30|DARCY|"Saving our lives!
Jane grabs the wheel, jerks it hard the other way. They
struggle for control, when the headlights fall on --"|speech|DARCY|F
31|A MAN|"4th BLUE REVISIONS 03-26-10 5.
Directly in their path, stumbling through the winds. Darcy
slams on the brakes, Jane turns the wheel hard to avoid him.
The SUV swerves -- but too late.
10 EXT. BIFROST LANDING SITE (EARTH) 10
The side of the SUV slams into the man with a THUD, sending
him flying. The car SKIDS to a stop.
11 INT. SUV 11
Jane, Darcy, and Selvig trade shocked looks, breathing hard.
They peer through the dust clouds, unable to see through.
A paralyzed moment, then they all leap out of the car.
12 EXT. BIFROST LANDING SITE (EARTH) 12
The three race from the SUV with flashlights. Jane spots the
man lying on the ground. He's dressed in tattered clothing,
charred and blackened."|speech|A MAN|M
32|DARCY|"I think that was legally your
fault."|speech|DARCY|F
33|JANE|"Get the first aid kit.
Darcy heads back inside the SUV as Jane, concerned, kneels
next to the man. Selvig hovers, protectively.
She gently turns his head to the light, and we see him
clearly for the first time. He is magnificently handsome,
long blonde hair flowing around his classically sculpted
features. She cups her hands around his face, as if willing
the life back into him.
JANE (CONT'D)
Come on, big guy. Do me a favor
and don't be dead, okay? Open your
eyes and look at me.
Suddenly, he GROANS, and she's startled, then relieved, as
his eyes flutter open. She looks deep into his confused,
azure eyes, which at last focus on her own. Locking onto
them.
For a moment, they each forget to breathe.
The connection is broken as Darcy returns with the kit. She
freezes when she sees how gorgeous the man is.
4th BLUE REVISIONS 03-26-10 5A."|speech|JANE|F
34|DARCY|"Wow. Does he need CPR? Because I
know CPR.
A flustered Jane smooths her hair and sits back on her heels.
She looks up at Selvig. Back to being a scientist."|speech|DARCY|F
35|"JANE
HIS EYES--
DARCY
(DREAMILY)"|--are beautiful.|speech|JANEHIS EYES--DARCY|?
36|JANE|"--are dilating. That's a good
sign."|speech|JANE|F
37|SELVIG|"We still have to get him to a
hospital."|speech|SELVIG|M
38|"JANE
(HOPEFULLY)"|"After we get a reading on the
storm?"|speech|JANE|F
39|SELVIG|"Immediately, Jane.
Jane sighs and nods, regretfully watching the storm EVAPORATE
above their heads. A thought strikes her."|speech|SELVIG|M
40|JANE|"Where did he come from?
They exchange puzzled looks, as we move up through the last
glowing remnants of the storm, and into:
13 EXT. SPACE 13
EARTH spins slowly before us as we hear a voice, deep and
resonant -- the voice of HEIMDALL, Gatekeeper of Asgard.
HEIMDALL (V.O.)
Questions, they've always asked
questions -- this race called man,
on this planet they call earth.
Passionately longing to know how
they are connected to the heavens.
4th BLUE REVISIONS 03-26-10 6.
We pull away from the planet, widening, past other worlds,
cosmic debris -- leaving first our solar system, then our
galaxy.
HEIMDALL (V.O.) (CONT'D)
In ages past, they looked to us as
gods, for indeed so many times we
saved them from calamity. We tried
to show them how their world was
but one of the Nine Realms of the
Cosmos, linked to all others by the
branches of Yggdrasil...
We pull back until we see it -- YGGDRASIL. Immense,
sprawling, like a quasar or a nebula twisted into the vague
shape of a TREE, its branches of glowing energy stretching
out into the black void of space.
HEIMDALL (V.O.) (CONT'D)
...the Worlds Tree. Nine Realms in
a universe of wonder, beauty, and
terror that they barely
comprehended.
We move in through Yggdrasil, until we reach what looks like
a galaxy, slowly spinning before us.
HEIMDALL (V.O.) (CONT'D)
But for all their thirst for
knowledge, they let our lessons
fall into myth and dreams.
Where did he come from? He came
from us, the proudest race of
warriors the Worlds have ever seen.
He came from this -- the greatest
Realm the universe has ever known.
We move through the galaxy's mists and astral matter, then
over and up, through a band of prismatic color to reveal
what's on the other side:
HEIMDALL (V.O.) (CONT'D)
He came... from Asgard!
14 EXT. ASGARD - DAY 14
Beautiful beyond imagination. We fly over the magnificent
landscape of the Realm, through the gleaming capital city,
modern yet timeless."|speech|JANE|F
41||4th BLUE REVISIONS 03-26-10 6A.|stage direction||
42|JANE|"15 EXT. ODIN'S PALACE - DAY 15
The palace rises countless stories tall, gleaming with an
other-worldly majesty, towering high above the Realm sprawled
out before it.
We move towards a large window of the palace, where a FIGURE"|speech|JANE|F
43|STANDS --|4th BLUE REVISIONS 03-26-10 7.|speech|STANDS --|?
44|ODIN ALLFATHER|"Stares out at his kingdom. The ravens fly up to the balcony,
land at his side.
16 INT. ODIN'S CHAMBERS - DAY 16
Odin turns away from the window. His wife FRIGGA sits at a
vanity and tries different earrings before the mirror."|speech|ODIN ALLFATHER|?
45|ODIN|Do you think he's ready?|speech|ODIN|M
46|FRIGGA|"He thinks he is. He has his
father's confidence."|speech|FRIGGA|F
47|ODIN|He'll need his father's wisdom.|speech|ODIN|M
48|FRIGGA|"And his humility?
Odin reacts.
FRIGGA (CONT'D)
Thor won't be alone. Loki will be
at his side to give him counsel.
Have faith in your sons."|speech|FRIGGA|F
49|ODIN|"Yes, but Thor's still a boy. He
could be a great King...
Odin stops, notices HIS HAND SHAKING. It seems to be out of
synch temporally with the rest of the world, leaving a trail
as it moves. He stares at it determinedly, concentrating,
trying to stop the strange event through the force of his
sheer will.
4th BLUE REVISIONS 03-26-10 8.
Finally, the occurrence subsides, his hand normal once more.
A worried Frigga covers his hand with her own.
ODIN (CONT'D)"|speech|ODIN|M
50|(QUIETLY)|...if we only had more time.|speech||
51|FRIGGA|"For once, our son needs something
we cannot provide."|speech|FRIGGA|F
52|ODIN|I can fight it a little longer...|speech|ODIN|M
53|FRIGGA|"No. You've put it off too long! I
worry for you.
He touches her cheek."|speech|FRIGGA|F
54|ODIN|"I've destroyed demons and monsters,
devastated whole worlds, laid waste
to mighty kingdoms, and still you
worry for me?"|speech|ODIN|M
55|FRIGGA|Always.|speech|FRIGGA|F
56|ODIN|"Not today. Now come kiss your
king... while I'm still king.
He pulls her close, and they kiss.
17 INT. PALACE ANTEROOM - DAY 17
Directly under the throne room, a gloomily lit hall. Banners
hang on either side to form a corridor down the middle of the
fire lit room.
Giant doors open at one end. A huge figure silhouetted
against the bright light beyond walks forward. In slo-mo, we
recognize the unmistakable shape of the God of Thunder.
Hammer in hand, he reaches the end of a raised platform.
An ATTENDANT hands the figure a goblet of wine.
He downs it quickly, hurls it towards the fire directly
below."|speech|ODIN|M
57|THOR|"Another!
4th BLUE REVISIONS 03-26-10 8A.
The cup smashes, the alcohol causes the fire to glow
intensely -- and, for a moment, brightly lit, and seen full
length, like a King to be, is THE MIGHTY THOR.
He proceeds down stops, past camera, and down the center of
the Hall.
We follow from behind and see at the other end, massively
shadowed on one of the great banners, the shape of two great
horns. As Thor approaches, the horn shapes move, and then,
from the shadows at the side, emerges LOKI, wearing his
horned headpiece.
Like Thor, he is dressed for a great ceremony. They stand by
a brazier at the foot of steps that lead up to the crowded
throne room."|speech|THOR|M
58|"LOKI
(TO THOR)"|"Nervous, brother?
4th BLUE REVISIONS 03-26-10 9."|speech|LOKI|M
59|THOR|"Have you ever known me to be
nervous?"|speech|THOR|M
60|LOKI|There was the time in Nornheim...|speech|LOKI|M
61|THOR|"That wasn't nerves, brother. It
was the rage of battle. How else
could I have fought my way through
a hundred warriors and pulled us
out alive?
The Attendant approaches with another goblet of wine for
Thor."|speech|THOR|M
62|LOKI|"As I recall, I was the one who
veiled us in smoke to ease our
escape."|speech|LOKI|M
63|THOR|"Some do battle, others just do
tricks.
The Attendant stifles a laugh. Loki notices, doesn't like
it. He gestures towards the goblet in the Attendant's hand.
EELS pour over the sides of the goblet, slithering out and
across the terrified Attendant's hand. He SCREAMS, hurls the
goblet to the ground. Loki chuckles.
THOR (CONT'D)
Loki...
Loki gestures to the writhing eels on the ground. They turn
back to spilled wine, the illusion shattered.
THOR (CONT'D)
Now that was just a waste of good
wine."|speech|THOR|M
64|LOKI|"Just a bit of fun.
(to the Attendant)
Right, my friend?
The Attendant isn't so sure. Thor dons his EAGLE-WINGED
HELMET.
LOKI (CONT'D)
(re: Thor's helmet)
Nice feathers.
4th BLUE REVISIONS 03-26-10 9A."|speech|LOKI|M
65|THOR|"You don't really want to start this
again, do you, Cow?"|speech|THOR|M
66|LOKI|I was being sincere!|speech|LOKI|M
67|THOR|You're incapable of sincerity.|speech|THOR|M
68|LOKI|"Am I?
He looks his brother in the eye, all pretense lost.
LOKI (CONT'D)
I've looked forward to this day as
long as you have. You're my
brother and my friend. Sometimes
I'm envious, but never doubt that I
love you.
4th BLUE REVISIONS 03-26-10 10.
Thor searches his brother's face, sees no trace of irony.
He's either speaking from his heart or he's a very, very good
liar. Maybe both. Thor puts an appreciative hand on his
brother's shoulder."|speech|LOKI|M
69|THOR|"Thank you.
The two brothers take in the moment a beat, then:"|speech|THOR|M
70|LOKI|Give us a kiss.|speech|LOKI|M
71|THOR|"Stop.
Thor makes the final adjustments to his ceremonial wear.
THOR (CONT'D)
How do I look?"|speech|THOR|M
72|LOKI|"Like a king.
They hear the blast of a CEREMONIAL HORN.
LOKI (CONT'D)
It's time."|speech|LOKI|M
73|THOR|"You go ahead.
Loki casts him a wary look.
THOR (CONT'D)
I'll be along. Go on.
Loki heads inside the palace without his brother.
17A INT. ANTECHAMBER - NIGHT 17A
VOLSTAGG combs his great beard in preparation for the big
event. As he does, he's surprised to find a stray GRAPE
stuck in the beard. He pulls it out, looks around, then
eagerly pops it into his mouth and gobbles it down.
FANDRAL checks his reflection in a mirror, smooths out his
moustache, gives himself a dashing smile. A PRETTY MAIDEN
holds the mirror before him, as other MAIDENS look on
dreamily."|speech|THOR|M
74|FANDRAL|"Thank you, love.
(to the Maidens)"|speech|FANDRAL|M
75|(MORE)|4th BLUE REVISIONS 03-26-10 10A.|speech||
76|FANDRAL (CONT'D)|"Now who'd like to polish my sword
for me?
The giddy Maidens eagerly raise their hands.
HOGUN stands staring ahead grimly, his hands folded in front
of him, amidst the hustle and bustle of the ATTENDANTS and
the ceremony preparations going on around him. A HELPFUL
ATTENDANT approaches him and starts to polish his armor.
Hogun turns his head, gives him a look. Intimidated, the
Attendant quickly backs away.
From behind, we see a WOMAN IN CEREMONIAL ARMOR take off her
SWORD and set it on a table, then her SHIELD, then several
HIDDEN DAGGERS and small, yet intimidating WEAPONS. We
reveal that it's SIF, looking radiant. She eyes the weapons
on the table."|speech|FANDRAL|M
77|SIF|"(to the weapons)
I'll miss you.
18 INT. THRONE ROOM - DAY 18
Colorful CEREMONIAL BANNERS of the Nine Realms adorn the
room, crowded with AESIR and REPRESENTATIVES from across
Yggdrasil, all BUZZING with excitement.
Thor's COMRADES enter and stride to their place of honor at
the front of the hall. They are:
THE WARRIORS THREE
VOLSTAGG has the girth and strength of a Sumo wrestler, with
oversized passions to match. FANDRAL, the consummate
swashbuckler, is agile, charismatic, and nattily dressed.
HOGUN -- dark, sullen, brooding -- a large MACE slung at his
side.
With them walks the warrior maiden SIF. She's clad in armor,
a shield and sword at her side -- a beauty not to be trifled
with.
4th BLUE REVISIONS 03-26-10 11."|speech|SIF|M
78|VOLSTAGG|"I hope this goes quickly. I'm
famished."|speech|VOLSTAGG|M
79|"FANDRAL
(FEIGNED DISBELIEF)"|Noooo!|speech|FANDRAL|M
80|VOLSTAGG|"Are you attached to that pretty
face of yours? Because one more
word, and you won't be."|speech|VOLSTAGG|M
81|FANDRAL|"(to the others)
My, we are hungry, aren't we?
The others laugh, save Hogun. Fandral turns to him.
FANDRAL (CONT'D)
Go on, Hogun. Smile. You can do
it. Even you, Hogun the Grim.
Just one smile.
Hogun stares at him grimly.
FANDRAL (CONT'D)
All right, half a smile. Look,
forget the smile, just show some
teeth."|speech|FANDRAL|M
82|SIF|"Fandral, is it true the famous
Warriors Three are ready to meet
any challenge?"|speech|SIF|M
83|FANDRAL|Name it, Lady Sif.|speech|FANDRAL|M
84|SIF|Keep your mouth shut.|speech|SIF|M
85||4th BLUE REVISIONS 03-26-10 12.|stage direction||
86|SIF|"19 INT. VAULT - DAY 19
Imposing EINHERJAR GUARDS clad in armor, swords at the ready,
stand watch inside the massive underground structure beneath
the palace.
A cold BREEZE blows past them.
19A INT. PALACE ANTEROOM - DAY 19A
Thor stands, his fingers nervously drumming the handle of his
hammer. Frigga approaches behind him, sees his anxiety."|speech|SIF|M
87|FRIGGA|It's all right to be nervous.|speech|FRIGGA|F
88|THOR|"Why does everyone keep saying that?
I'm not nervous!"|speech|THOR|M
89|FRIGGA|You may be able to fool the rest of|speech|FRIGGA|F
90|"ASGARD --
THOR"|...but never you. I know.|speech|ASGARD --THOR|?
91|FRIGGA|"Thor, just remember that you have
something even the great Allfather
never had."|speech|FRIGGA|F
92|THOR|And what is that?|speech|THOR|M
93|FRIGGA|"Me for a mother.
She smiles.
FRIGGA (CONT'D)
Now don't keep your father waiting.
Frigga leaves.
20 INT. THRONE ROOM - DAY 20
Sif and the Warriors Three still wait before the crowd. Loki
and Frigga enter. Loki takes his place at the front of the
hall alongside the others. With another blast of the horn,
the crowd goes silent as the EINHERJAR HONOR GUARD moves into
formation. They part to reveal --"|speech|FRIGGA|F
94|ODIN|"4th BLUE REVISIONS 03-26-10 12A.
Sitting atop his throne, clad in full ceremonial armor. He
holds his spear GUNGNIR before him. Any trace of weakness in
him is gone now. He exudes all the power and majesty of a
Ruler of Asgard.
Frigga joins him at his side. He looks around the hall,
casts a glance over to the Warriors. Thor is nowhere to be
seen. Odin looks to Loki. Loki shrugs. Odin isn't pleased.
A murmur spreads through the crowd."|speech|ODIN|M
95|VOLSTAGG|"(sotto, to Loki)
Where is he?"|speech|VOLSTAGG|M
96|LOKI|"He said he'd be along.
Sif realizes the truth, shakes her head in disapproval."|speech|LOKI|M
97|VOLSTAGG|What?|speech|VOLSTAGG|M
98|SIF|He wants to make an entrance.|speech|SIF|M
99|FANDRAL|"Well, if he doesn't show up soon,
he shouldn't bother. Odin looks
like he's ready to feed him to his
ravens."|speech|FANDRAL|M
100|LOKI|"I wouldn't worry. Father will
forgive him. He always does.
4th BLUE REVISIONS 03-26-10 13.
Just then, at the back of the hall, up the steps from the
lower level --"|speech|LOKI|M
101|MJOLNIR|"Roars up into the hall, Thor strides cockily into the hall
behind it, catching it behind his back. The CROWD erupts in
CHEERS. Thor spins his hammer with a flourish, holds it up
before the crowd, basking in the moment, relishing the
adoration, whipping his audience up into a frenzy."|speech|MJOLNIR|M
102|SIF|"Oh, please.
Odin watches from the front, not liking this showy display.
21 INT. VAULT - DAY 21
As the sound of the cheers echo from above, the odd, cold
breeze picks up in the Vault. The Guards rub their limbs to
warm themselves. They grow increasingly uneasy, sensing
something's not right.
They exchange a look, then walk the length of the Vault's
hallway to its end, where a CASKET sits undisturbed upon a
pedestal.
LARGE SHADOWS suddenly loom over them. They look up and
SHOUT in terror as they raise their weapons.
22 INT. THRONE ROOM - DAY 22
Thor finishes stirring up the crowd, then reaches the front
of the room, kneels on one knee before his mother and father.
Frigga casts him an admonishing glance. Thor winks up at
her. She can't help but smile.
Odin strikes Gungnir upon the ground with a deafening BOOM.
The crowd falls silent. Odin speaks with quiet, effortless
authority.
He raises Gungnir before him."|speech|SIF|M
103|ODIN|"Gungnir. Its aim is true, its
power strong. With it I have
defended Asgard and the lives of
the innocent across the Nine Realms
since the time of the Great
Beginning. And though the day has
come for a new King to wield his
own weapon -- that duty remains the
same. Thor Odinson, my heir, my
first-born."|speech|ODIN|M
104|(MORE)|4th BLUE REVISIONS 03-26-10 13A.|speech||
105|ODIN (CONT'D)|"So long entrusted with this mighty
hammer, Mjolnir. Forged in the
heart of a dying star, from the
sacred metal of Uru. Only one may
lift it. Only one is worthy. Who
wields this hammer commands the
lightning and the storm. Its power
has no equal -- as a weapon, to
destroy, or as a tool, to build.
It is a fit companion for a King."|speech|ODIN|M
106||4th BLUE REVISIONS 03-26-10 14.|stage direction||
107|ODIN (CONT'D)|"23 INT. VAULT - DAY 23
The bodies of the Guards are flung to the Vault's floor, now
strewn with ice. We don't see their attackers clearly, just
catch glimpses of them in the shadows -- but they are large
and BLUE-SKINNED.
One of the creatures lifts the Casket off its stand and turns
to go. But, as they do, the intricate latticework behind the
Casket starts to separate and retract, revealing something
standing in the shadows behind it.
As the creatures walk away, a fiery glow rises behind them.
They turn back around.
Now it's their turn to SCREAM.
24 INT. THRONE ROOM - DAY 24
The Ceremony continues."|speech|ODIN|M
108|ODIN|"Today I entrust you with the
greatest honor in all the Nine
Realms. The sacred throne of
Asgard. I have sacrificed much to
achieve peace. So, too, must a new
generation sacrifice to maintain
that peace. Responsibility, duty,
honor. These are not merely
virtues to which we must aspire.
They are essential to every soldier
and to every King.
The Crowd and the Warriors Three start to shiver and rub
their limbs for warmth in the increasingly cold air of the
hall.
Thor turns back to face his father. Odin looks upon his son
with pride.
4th BLUE REVISIONS 03-26-10 15.
ODIN (CONT'D)
Thor Odinson, do you swear to guard
the Nine Realms?"|speech|ODIN|M
109|THOR|I swear.|speech|THOR|M
110|ODIN|Do you swear to preserve the peace?|speech|ODIN|M
111|THOR|I swear.|speech|THOR|M
112|ODIN|"Do you swear to cast aside all
selfish ambition and pledge
yourself only to the good of all
the Realms?
Beat."|speech|ODIN|M
113|THOR|I swear.|speech|THOR|M
114|ODIN|"Then on this day, I, Odin
Allfather, proclaim you--
Odin hesitates, noticing a strange sight before him. ICE
creeps across the surface of the large banners around the
hall, making an eerie CRACKING sound. Thor, his comrades,
and the crowd see it too.
ODIN (CONT'D)"|speech|ODIN|M
115|(REALIZING)|"Frost giants...
The far-off sounds of a BATTLE echo in the depths of the
palace below. Sif and the Warriors Three reach for their
weapons, as Thor races from the hall.
24A OMITTED SCENE MOVED BELOW 24A
25 OMITTED SCENE COMBINED WITH SCENE 25B BELOW 25
25A OMITTED 25A"|speech||
116||4th BLUE REVISIONS 03-26-10 16.|stage direction||
