|character|text|type|character_clean|gender
693|COULSON|"It's not easy to do what you did.
You made us all look like a bunch
of mall cops. That's hurtful."|speech|COULSON|M
694|(THEN)|"The men you so easily subdued are
highly-trained professionals, and
in my experience, it takes someone
who's received similar training to
do what you did to them. Would you
like to tell me where you received
your training?
Thor sits silently.
COULSON (CONT'D)
Pakistan? Chechnya? Afghanistan?
Then again, you strike me more as
the soldier of fortune type. What
was it, South Africa?
Still no answer. Coulson leans in close to him.
COULSON (CONT'D)
Certain groups pay well for a good
mercenary. Especially HYDRA.
Coulson waits for a response, but gets none.
COULSON (CONT'D)
Who are you?
4th BLUE REVISIONS 03-26-10 72."|speech||
695|THOR|Just a man.|speech|THOR|M
696|COULSON|"One way or another, we find out
what we want to know. We're good
at that.
Coulson leaves the room. Thor lowers his head.
LOKI (O.S.)
I thought he'd never leave.
Thor looks up, shocked to find Loki standing there, dressed
in 21st century attire."|speech|COULSON|M
697|THOR|Loki? What are you doing here?|speech|THOR|M
698|LOKI|I had to see you.|speech|LOKI|M
699|THOR|"What's happened? Tell me! Is it
Jotunheim? Let me explain to"|speech|THOR|M
700|"FATHER--
LOKI"|"Father is dead.
Thor stares at him, stunned."|speech|FATHER--LOKI|?
701|THOR|What?|speech|THOR|M
702|LOKI|"Your banishment, the threat of a
new war, it was too much for him to
bear.
The implications of Loki's words dawn on Thor -- he's
responsible for his father's fate. Loki draws close to him,
looks in his eyes, consolingly.
LOKI (CONT'D)
You mustn't blame yourself. I know
that you loved him. I tried to
tell him so, but he wouldn't
listen."|speech|LOKI|M
703||"4th BLUE REVISIONS 03-26-10 73.
LOKI (CONT'D)"|stage direction||
704|(THEN)|"It was cruel to put the hammer
within your reach, knowing you
could never lift it.
Thor stares ahead, falling deeper into the abyss.
LOKI (CONT'D)
The burden of the throne has fallen
to me now."|speech||
705|THOR|Can I come home?|speech|THOR|M
706|LOKI|"The truce with Jotunheim is
conditional upon your exile."|speech|LOKI|M
707|THOR|But couldn't we find a way to--|speech|THOR|M
708|LOKI|"Mother has forbidden your return.
Thor nods, lowers his head, beaten.
LOKI (CONT'D)
This is goodbye, brother. I'm so
sorry."|speech|LOKI|M
709|THOR|"No, I'm sorry. Loki... thank you
for coming here."|speech|THOR|M
710|LOKI|"Nothing could have stopped me.
Coulson enters the room, but seems to take no notice of Loki.
LOKI (CONT'D)
Fare well, brother."|speech|LOKI|M
711|THOR|Good-bye.|speech|THOR|M
712|COULSON|"Good-bye? I just got back.
Thor looks up to see that Loki is gone.
COULSON (CONT'D)
Now. Where did we leave off?"|speech|COULSON|M
713||4th BLUE REVISIONS 03-26-10 73A.|stage direction||
714|COULSON|"90 EXT. CRATER - NIGHT 90
Agents and Scientists work to repair the damaged area around
Mjolnir. They take no notice of Loki as he steps up beside
the hammer. He stares at it -- intrigued, wondering. Can he
do it?
He reaches down, tries to lift it -- but can't. He lets it
go, eyes it with contempt, then steps away.
He gestures with his arms. An odd GREEN AND GOLD LIGHT rises
from the ground, enveloping him, then he disappears.
91 INT. HOLDING CELL - NIGHT 91
Sitwell enters and speaks sotto to Coulson."|speech|COULSON|M
715|"SITWELL
(RE: THOR)"|Sir... he's got a visitor.|speech|SITWELL|M
716||4th BLUE REVISIONS 03-26-10 74.|stage direction||
717|"SITWELL
(RE: THOR)"|"92 INT. SECURITY ROOM - MOMENTS LATER 92
Coulson and several other SHIELD AGENTS stand across from
Erik Selvig."|speech|SITWELL|M
718|COULSON|"""Donald Blake?""ù"|speech|COULSON|M
719|SELVIG|"Doctor Donald Blake. He's part of
our team."|speech|SELVIG|M
720|COULSON|"You have dangerous coworkers, Dr.
Selvig."|speech|COULSON|M
721|SELVIG|"Troubled, not dangerous. He was
distraught when he found out that
you'd taken all of our research.
It was years of his life, gone! He
got depressed, started drinking,
and... well, you know the rest."|speech|SELVIG|M
722|COULSON|"Uh-huh. You mind if we take a
moment to verify his identity?"|speech|COULSON|M
723|SELVIG|"Certainly.
The Techie at a computer nearby runs the name.
SELVIG (CONT'D)
You can understand how a man could
go off like that. I mean, a big,
faceless organization like yours,
coming in with their jack-booted
thugs and stealing private
property..."|speech|SELVIG|M
724|(THEN)|...is how he described it.|speech||
725|COULSON|"That doesn't explain how he managed
to tear through our security.
Selvig shrugs."|speech|COULSON|M
726|SELVIG|"Steroids. He's a bit of a fitness
nut.
4th BLUE REVISIONS 03-26-10 74A.
On the Techie's monitor, a DMV record from the State of New
York pops up reading ""DR. DONALD BLAKE""ù. The license photo
is indeed a picture of Thor -- the one Darcy took with her
cellphone.
4th BLUE REVISIONS 03-26-10 75.
The Techie hits a button, and a graphic reads, ""SHIELD
SECURITY ANALYSIS IN PROGRESS.""ù Coulson eyes the screen.
After a beat, he turns back to Selvig."|speech|SELVIG|M
727|COULSON|It says here he's an M.D.|speech|COULSON|M
728|SELVIG|"He is. That is, he was. He
switched careers and became a
physicist. He's quite brilliant,
really."|speech|SELVIG|M
729|(THEN)|"If you would just release him to
me, I promise to keep an eye on
him.
Coulson thinks, sizing Selvig up -- then smiles. He turns to
an AGENT nearby."|speech||
730|COULSON|"Release Dr. Blake to Dr. Selvig
here.
The Techie looks to him, surprised.
COULSON (CONT'D)"|speech|COULSON|M
731|(TO SELVIG)|"Make sure he stays in town for the
next few days in case we need to
talk to him again.
Selvig shakes his hand."|speech||
732|SELVIG|"Thank you.
92A INT. SHIELD HOLDING CELL - NIGHT 92A
Selvig bursts into the room with a SHIELD Agent to find a
seated Thor."|speech|SELVIG|M
733|SELVIG|"Donny, Donny, Donny! There you
are!
Thor looks up, unsure what the hell is going on. Selvig
pulls Thor to his feet, gives him a warm hug.
SELVIG (CONT'D)
It's going to be all right, my
friend. Come on, I'm taking you
home.
4th BLUE REVISIONS 03-26-10 75A.
He leads the bewildered Thor out the door.
92B EXT. COULSON'S TRAILER - NIGHT 92B
As Thor and Selvig make their way past the SHIELD Security
Room, Thor notices Jane's possessions and equipment from the
Smith Motors lab stacked under a tarp. He spots Jane's hand-
written journal among them. As he passes, he quickly takes
it from the pile and pockets it.
92C INT. SECURITY ROOM - NIGHT 92C
Coulson looks at the computer bearing Donald Blake's DMV
record. A security warning over the image clearly reads
""SECURITY ALERT: FALSIFIED DATA.""ù He knows it's been a ruse
all along.
He looks to Selvig and Thor heading away from the Security
Room, then follows them outside.
93 EXT. SHIELD DESERT BASE - NIGHT 93
Coulson and two SHIELD Agents watch as Selvig walks with Thor
away from the base to the SUV. Coulson calls to Selvig."|speech|SELVIG|M
734|COULSON|Just keep him away from the bars.|speech|COULSON|M
735|SELVIG|I will!|speech|SELVIG|M
736|"THOR
(TO SELVIG)"|"Where are we going?
Selvig drops his cool demeanor."|speech|THOR|M
737|SELVIG|"To get a drink.
Selvig and Thor climb into the SUV.
As they drive off, Coulson turns to the other two agents --
GARRETT and CALE."|speech|SELVIG|M
738|COULSON|Follow them.|speech|COULSON|M
739||4th BLUE REVISIONS 03-26-10 76.|stage direction||
740|COULSON|"94 EXT. JOTUNHEIM - DAY 94
Loki, looking apprehensive, walks alone across the icy
surface of the planet.
95 INT. LAUFEY'S TEMPLE - DAY 95
Darkness shrouds the ruined temple, save for the shafts of
light which knife their way in through the damaged ceiling.
Loki enters. Frost Giant guards surround him on all sides.
Laufey approaches, towers over him menacingly."|speech|COULSON|M
741|LAUFEY|Tell me why I shouldn't kill you.|speech|LAUFEY|M
742|LOKI|I've come alone and unarmed.|speech|LOKI|M
743|LAUFEY|To what end?|speech|LAUFEY|M
744|LOKI|To make you another proposition.|speech|LOKI|M
745|"LAUFEY
(REALIZING)"|"So you're the one who let us into
Asgard."|speech|LAUFEY|M
746|LOKI|You're welcome.|speech|LOKI|M
747|LAUFEY|"My men are dead, and I have no
Casket. You are a deceiver.
Laufey lashes out, grabs Loki around the throat, but Loki
calmly stands his ground."|speech|LAUFEY|M
748|LOKI|"You have no idea what I am.
The blueness spreads across his face, as Laufey and the
guards stare in shock. Loki grins.
LOKI (CONT'D)
Hello, Father.
Laufey releases him. Loki's body turns back to normal.
Intrigued, Laufey sizes up his son.
4th BLUE REVISIONS 03-26-10 76A."|speech|LOKI|M
749|LAUFEY|"Ah, the bastard son. I thought
Odin had killed you. That's what I
would have done. He's as weak as
you are."|speech|LAUFEY|M
750|LOKI|"No longer weak. I now rule Asgard,
until Odin awakens. Perhaps you
should not have so carelessly
abandoned me.
This gives Laufey pause."|speech|LOKI|M
751|LAUFEY|"Or perhaps it was the wisest choice
I've ever made. I will hear you.
4th BLUE REVISIONS 03-26-10 77."|speech|LAUFEY|M
752|LOKI|"I will conceal you and a handful of
your soldiers, lead you into his
chambers, and let you slay him
where he lies. I'll keep the
throne, and you will have the
Casket.
Laufey studies Loki's face."|speech|LOKI|M
753|LAUFEY|Why would you do this?|speech|LAUFEY|M
754|LOKI|"When all is done, we will have a
permanent peace between our two
worlds. Then I, the bastard son,
will have accomplished what Odin
and Thor never could."|speech|LOKI|M
755|LAUFEY|"This is a great day for Jotunheim.
Asgard is finally ours."|speech|LAUFEY|M
756|LOKI|"No. Asgard is mine. The rest of
the Nine Realms will be yours, if
you do as you're told.
Laufey considers the proposition."|speech|LOKI|M
757|LAUFEY|"I accept.
Loki turns to leave. As he goes, the slightest trace of a
smile crosses his face.
96 INT. HEIMDALL'S OBSERVATORY - DAY 96
Loki emerges out of the Bifrost, as Heimdall steps away from
his controls. Heimdall glares at Loki. Loki notices."|speech|LAUFEY|M
758|LOKI|"What troubles you, Gatekeeper?
4th BLUE REVISIONS 03-26-10 78."|speech|LOKI|M
759|HEIMDALL|"I turned my gaze upon you in
Jotunheim, but could neither see
nor hear you. You were shrouded
from me, like the Frost Giants who
entered this Realm."|speech|HEIMDALL|M
760|LOKI|"Perhaps your senses have weakened
after your many years of service."|speech|LOKI|M
761|HEIMDALL|"Or perhaps someone has found a way
to hide that which he does not wish
me to see.
Loki sizes him up, smiles."|speech|HEIMDALL|M
762|LOKI|"You have great power, Heimdall.
Tell me, did Odin ever fear you?"|speech|LOKI|M
763|HEIMDALL|No.|speech|HEIMDALL|M
764|LOKI|And why is that?|speech|LOKI|M
765|HEIMDALL|"Because he is my King, and I am
sworn to obey him."|speech|HEIMDALL|M
766|LOKI|"Exactly. Just as you're sworn to
obey me now. Yes?
A beat."|speech|LOKI|M
767|HEIMDALL|Yes.|speech|HEIMDALL|M
768|LOKI|"Good. Then you will open the
Bifrost to no one until I have
undone what my brother has started.
Loki heads out of the Observatory. Heimdall stares after
him."|speech|LOKI|M
769||4th BLUE REVISIONS 03-26-10 78A.|stage direction||
770|LOKI|"97 INT. BAR - NIGHT 97
Thor and Selvig sit at a booth at the back of the local dive.
The bartender sets down a couple mugs of beer and two shots
of whiskey. Selvig pours the shot into his mug and downs it.
Thor follows his example.
4th BLUE REVISIONS 03-26-10 79."|speech|LOKI|M
771|SELVIG|"Seems Darcy's a terrible intern,
but a talented hacker."|speech|SELVIG|M
772|THOR|Thank you for what you've done.|speech|THOR|M
773|SELVIG|"Don't thank me. I only did it for
Jane."|speech|SELVIG|M
774|THOR|Are you in love with her?|speech|THOR|M
775|SELVIG|"Of course not! Jane's like a
daughter to me. Her father and I
taught at University together. A
good man, but he never listened.
This registers with Thor."|speech|SELVIG|M
776|THOR|"Neither did I.
Selvig eyes him with interest."|speech|THOR|M
777|SELVIG|"I don't know if you're really
delusional, and I really don't care
at this point. I just care about
her. I've seen the way she looks
at you."|speech|SELVIG|M
778|THOR|I swear to you, I mean her no harm.|speech|THOR|M
779|SELVIG|"Good. If that's the case, then
I'll buy you one more drink, and
you'll leave town tonight.
A long pause, then Thor nods. He takes a drink.
4th BLUE REVISIONS 03-26-10 80."|speech|SELVIG|M
780|THOR|"I had it all backwards. I had it
all wrong.
Selvig watches him keenly. This is a different Thor than
he's seen before."|speech|THOR|M
781|SELVIG|"It's not a bad thing, finding out
that you don't have all the
answers. That's when you start
asking the right questions.
Thor takes this in."|speech|SELVIG|M
782|THOR|"For the first time in my life, I
have no idea what I'm supposed to
do."|speech|THOR|M
783|SELVIG|"Anyone who's ever going to find
their way in this world has to
start by admitting they don't know
where the hell they are.
Thor nods.
DRUNK TOWNIE (O.S.)
Hey, I know you, man...
An intimidating DRUNK TOWNIE nearby sizes up Thor. He is one
of the Townies from Isabela's Diner who saw Thor earlier. He
approaches, belligerent and looking for a fight.
DRUNK TOWNIE (CONT'D)
You were in the diner with that hot
girl.
Thor doesn't like where this is going.
DRUNK TOWNIE (CONT'D)
I wouldn't mind her doing a little
research on me.
He laughs. Thor is annoyed."|speech|SELVIG|M
784|THOR|"I have no quarrel with you. But
she's a lady. You should be more
respectful."|speech|THOR|M
785||4th BLUE REVISIONS 03-26-10 80A.|stage direction||
786||DRUNK TOWNIE|location||
787||"And you should shut the hell up,
princess.
Selvig looks to Thor, concerned that he's going to lose it.
But, to his surprise, Thor remains unaffected by the Townie's"|stage direction||
788|THOR|baiting.|speech|THOR|M
789||THOR|location||
790||I will not fight him.|stage direction||
791||DRUNK TOWNIE|location||
792||"Then it'll be easy to kick your
ass.
Selvig stands, steps between the two men."|stage direction||
793||SELVIG|location||
794||"Gentlemen, please. Let's keep our
heads."|stage direction||
795|THOR|"Just then, Selvig HEAD-BUTTS the Townie, knocking him out.
Thor's impressed. Selvig downs his drink, then hurls his
glass aside, SHATTERING it on the ground.
4th BLUE REVISIONS 03-26-10 81.
SELVIG (CONT'D)"|speech|THOR|M
796|(TO THOR)|"Another drink?
98 EXT. MAIN STREET - NIGHT 98
Thor and Selvig stumble down the street, singing a NORWEGIAN
FOLK SONG. They improvise an impromptu drinking song dance
routine involving side steps and happy slaps, optimistically
in time with the song."|speech||
797|"THOR/SELVIG
(SINGING)"|"""The mood is good, our hearts are
full, there's magic in the air. /
It's all because we're here
tonight, and haven't got a care. /
So raise a glass, and toast to
life, wherever it may lead / Tra-la-
la, tra-la-la, a friend is fine
indeed. / Tra-la-la, tra-la-la, a
friend is fine indeed!""ù
Thor holds up a hand for Selvig's last finishing slap.
Selvig misses it completely and falls out of frame like a
straight dead weight with a CLUNK.
WIDE SHOT. Emerging from behind the car where Selvig fell,
Thor stands up, Selvig slung over his shoulder, and starts to
walk up the street towards Jane's trailer.
99 INT. JANE'S TRAILER - NIGHT 99
The small trailer is in a state of perpetual disarray, strewn
with various books, old pizza boxes, etc. A worried Jane
lies on her bed, trying to read.
She's startled by the loud RAPPING on the door. She bolts to
the door and opens it to find --"|speech|THOR/SELVIG|?
798|THOR|"Standing there with the unconscious Selvig slung over his
shoulder."|speech|THOR|M
799|JANE|Erik!|speech|JANE|F
800|(TO THOR)|Is he all right?|speech||
801|THOR|"He's fine. Not injured at all.
4th BLUE REVISIONS 03-26-10 81A.
As Thor enters, he BANGS Selvig's head on the doorway.
Selvig GROANS.
THOR (CONT'D)
Sorry, my friend."|speech|THOR|M
802|JANE|What happened?|speech|JANE|F
803|THOR|"We drank. We fought. He made his
ancestors proud.
4th BLUE REVISIONS 03-26-10 82."|speech|THOR|M
804|JANE|"Put him on the bed.
Thor moves through the small trailer carrying Selvig, like a
bear lugging another bear, smashing into things along the
way, until he finally sets Selvig down on Jane's bed. Selvig
awakens groggily and looks up at him through bleary eyes."|speech|JANE|F
805|SELVIG|"I still don't believe you're the
God of Thunder."|speech|SELVIG|M
806|(THEN)|"But you ought to be.
Thor grins, pats him on the cheek. As Selvig drifts off to
sleep, Thor pulls a blanket over him.
Jane watches, stunned by their friendship, impressed by
Thor's tenderness. Thor turns back to her, looks around."|speech||
807|THOR|"These are your chambers?
Jane suddenly becomes self-conscious. She starts cleaning up
the mess around her."|speech|THOR|M
808|JANE|"Well, it's more of a temporary
living space, really. I don't
usually have visitors in here.
Actually, never...
Thor picks up a sock off the floor. She snatches it from
him, puts it away.
JANE (CONT'D)
Can we go outside?
100 EXT. SMITH MOTORS - ROOF - NIGHT 100
Thor steps off a ladder onto the roof of Smith Motors. He
offers Jane his hand, helps her up. There's a telescope set
up, a couple chairs, some blankets."|speech|JANE|F
809|JANE|"I come up here sometimes when I
can't sleep. Or when I'm trying to
reconcile particle data. Or when
Darcy's driving me crazy."|speech|JANE|F
810|(THEN)|"I come up here a lot, now that I
think about it.
Thor looks at the night sky, filled with stars.
4th BLUE REVISIONS 03-26-10 82A.
JANE (CONT'D)
I'm glad you're safe."|speech||
811|THOR|"You've been very kind. I've been
far less grateful than you deserve."|speech|THOR|M
812|JANE|"I also hit you with my car a couple
times, so it kind of evens out.
He grins, then reaches into his pocket and pulls out her
NOTEBOOK.
JANE (CONT'D)
I don't believe it...
She takes it from him, surprised and grateful."|speech|JANE|F
813|THOR|"It was all I could get back. Not
as much as I promised. I'm sorry."|speech|THOR|M
814|JANE|"No, this is good. Thank you. This
means I don't have to start from
scratch...
She sits down and opens the notebook eagerly, then stops, a
harsh realization clouding her face. Thor notices."|speech|JANE|F
815|THOR|What's wrong?|speech|THOR|M
816|JANE|"SHIELD, whatever they are. They're
never going to let this research
see the light of day."|speech|JANE|F
817|THOR|"You must do this. You must finish
what you've started."|speech|THOR|M
818|JANE|Why?|speech|JANE|F
819|THOR|"Because you're right. It's taken
so many generations for your people
to get to this point. You're
nearly there. You just need
someone to show you how close you
really are.
4th BLUE REVISIONS 03-26-10 83.
Thor moves beside her, opens her notebook, turns to the page
which bears a sketch of the Bifrost. He takes the pen from
the notebook, begins to add to the sketch, leading from one
point to another in space.
THOR (CONT'D)
Look -- your ancestors called it
magic. You call it science. I
come from a place where they're one
and the same thing.
We recognize that Thor is drawing the branches of Yggdrasil
as she looks on, amazed and intrigued."|speech|THOR|M
820|JANE|What is it?|speech|JANE|F
821|THOR|"This is how my father explained it
to me..."|speech|THOR|M
822|(THEN)|"Your world is one of the Nine
Realms of the Cosmos, linked to
each other by the branches of
Yggdrasil, the Worlds Tree. Now,
you see it every day, without
realizing. Images glimpsed through
-- what did you call it?...
(checks her notebook)
...this Hubble Telescope. So, Nine
Realms...
They look at each other. She nods. They smile. This is
going to be a long night.
101 EXT. SMITH MOTORS - ROOF - LATER 101
Jane sleeps beside Thor on the blankets on the rooftop. He
stares up at the night sky.
She rolls close to him, nuzzles against him in her sleep. He
looks down at her, beautiful in the moonlight, looks out at
the town beyond her.
102 INT. HEALING ROOM - DAY 102
Volstagg eats ravenously from a PLATTER OF FOOD. Sif stands
nearby, ill at ease. Fandral watches Volstagg incredulously
as the large warrior stuffs himself. Finally Fandral can
stand it no more.
4th BLUE REVISIONS 03-26-10 84."|speech||
823|FANDRAL|"Our dearest friend banished, Loki
on the throne, Asgard on the brink
of war, yet you manage to consume
four wild boar, six pheasant, a
side of beef, and two casks of ale.
Shame on you! Don't you care?!
Fandral moves to throw the platter in the fire, but Volstagg
pulls his weapon, stopping him."|speech|FANDRAL|M
824|VOLSTAGG|"Do not mistake my appetite for
apathy."|speech|VOLSTAGG|M
825|SIF|"Stop it, both of you! We all know
what we have to do, we're just too
damned afraid to do it!"|speech|SIF|M
826|"HOGUN
(DECIDES)"|"We must go. We must find Thor.
Hogun starts to pull the delicate HEALING STONES from the
fire, carefully putting them into a POUCH at his side."|speech|HOGUN|M
827|FANDRAL|It's treason, Hogun.|speech|FANDRAL|M
828|VOLSTAGG|To hell with treason, it's suicide.|speech|VOLSTAGG|M
829|(SUDDENLY NERVOUS)|"Now, shh! Heimdall may be
watching! It's said he can hear--"|speech||
830|FANDRAL|Yes, yes, we know!|speech|FANDRAL|M
831|SIF|"Thor would do the same for us.
An EINHERJAR GUARD enters. They tense."|speech|SIF|M
832|EINHERJAR GUARD|"Heimdall demands your presence.
Volstagg quickly drains his flagon of ale."|speech|EINHERJAR GUARD|M
833|VOLSTAGG|We're doomed.|speech|VOLSTAGG|M
834||4th BLUE REVISIONS 03-26-10 84A.|stage direction||
835|VOLSTAGG|"103 EXT. MAIN STREET - MORNING 103
Dawn breaks over the quiet town of Puente Antiguo.
104 EXT. SMITH MOTORS - ROOF - DAY 104
Thor awakens, looks down to see Jane still sleeping, nuzzled
against him. She opens her eyes, looks up at him and smiles.
4th BLUE REVISIONS 03-26-10 85.
He stands, offers his hand, helps her to her feet.
105 EXT. SMITH MOTORS - LAB 105
Thor helps Jane down off a ladder. A groggy, hungover Selvig
emerges from Jane's trailer. He sees Thor with Jane.
Selvig eyes the two of them together, then:"|speech|VOLSTAGG|M
836|SELVIG|"I need some coffee.
The three head inside Smith Motors.
FROM THE LIBRARY ROOFTOP ACROSS THE STREET
SHIELD Agents Garrett and Cale watch the scene, pointing a
small audio surveillance device towards the lab.
105A INT. SMITH MOTORS - LAB - DAY 105A
Darcy and Selvig sit at a card table, drinking coffee. Thor
holds a couple plates as Jane makes eggs on a hotplate. She
scoops them out onto the plates. Thor takes them over to the
table, sets them down before Selvig and Darcy."|speech|SELVIG|M
837|DARCY|Thanks.|speech|DARCY|F
838|THOR|"You're very welcome.
Jane joins them at the card table with a couple more plates.
She and Thor sit with the others and start to eat their
breakfast, looking like a little family."|speech|THOR|M
839||4th BLUE REVISIONS 03-26-10 86.|stage direction||
840|"106 OMITTED 106
107 OMITTED 107"|"108 EXT. MAIN STREET 108
On a roof across the street from Smith Motors, Agents Garrett
and Cale continue their surveillance, bored out of their
wits. Agent Cale watches the group through the lab window
with binoculars. Agent Garrett listens to his comm-link,
turns to Cale."|speech|106 OMITTED 106107 OMITTED 107|?
841|AGENT GARRETT|They want an update.|speech|AGENT GARRETT|?
842|AGENT CALE|Tell them he's eating eggs.|speech|AGENT CALE|?
843|AGENT GARRETT|"Scrambled or fried?
Cale glares at him."|speech|AGENT GARRETT|?
844|"AGENT CALE
(INTO COMM-LINK)"|"Target is eating eggs, sir.
We'll keep you posted.
108AA INT. SMITH MOTORS - LAB 108AA
As the group finishes breakfast, Thor looks at the mug in his
hand, gets an idea."|speech|AGENT CALE|?
845|"THOR
(RE: MUG)"|May I have this?|speech|THOR|M
846|DARCY|Sure.|speech|DARCY|F
847|THOR|"Thank you. Excuse me a moment.
Thor leaves.
108A EXT. MAIN STREET - MOMENTS LATER 108A
In front of her diner, Isabela prepares to open for the day.
(Through the window of Isabela's, we see chairs still atop
tables.) Isabela sweeps the front porch.
She looks up to see Thor approaching. She eyes him
suspiciously. He offers her a MUG."|speech|THOR|M
848|THOR|"To replace the one I broke. Please
forgive my behavior.
4th BLUE REVISIONS 03-26-10 86A.
She takes it, looks at it curiously, then smiles at him."|speech|THOR|M
849|ISABEL|Okay. Thank you.|speech|ISABEL|F
850|THOR|"If I may, I'd like to come back for
more of your ""coffee.""ù"|speech|THOR|M
851|ISABEL|"Any time.
He nods and walks away. She stares after him, smiling, and
shrugs.
ISABEL (CONT'D)
She could do worse.
109 INT. HEIMDALL'S OBSERVATORY - DAY 109
Sif and the Warriors Three enter warily to find the
intimidating Heimdall standing before the Observatory's
controls. He glares at them accusingly."|speech|ISABEL|F
852|VOLSTAGG|Good Heimdall, less us explain--|speech|VOLSTAGG|M
853|HEIMDALL|"You would defy the commands of Loki
our King, break every oath you have
taken as warriors, and commit
treason to bring Thor back?
The four exchange nervous glances."|speech|HEIMDALL|M
854|SIF|Yes, but--|speech|SIF|M
855|HEIMDALL|"Good.
The group looks puzzled. What did he just say?"|speech|HEIMDALL|M
856|VOLSTAGG|So you'll help us?|speech|VOLSTAGG|M
857|HEIMDALL|"I am bound by honor to our King. I
cannot open the Bifrost to you.
With that, Heimdall leaves them alone in the Observatory.
The others exchange puzzled looks.
4th BLUE REVISIONS 03-26-10 86B."|speech|HEIMDALL|M
858|FANDRAL|Complicated fellow, isn't he?|speech|FANDRAL|M
859|VOLSTAGG|"Now what do we do?
Sif glances at the control panel, notices something."|speech|VOLSTAGG|M
860|SIF|"Look!
The others turn to see HEIMDALL'S SWORD stuck into the
control panel. They exchange a grin. They have an ally.
Sif hits the controls, and the Bifrost apparatus fires up.
110 INT. SHIELD DESERT BASE - SECURITY ROOM - DAY 110
Coulson races in as a SHIELD TECHIE calls up satellite
footage of the Bifrost storm on a monitor."|speech|SIF|M
861|COULSON|"What the hell was that?
4th BLUE REVISIONS 03-26-10 87."|speech|COULSON|M
862|TECHIE|"I don't know, sir. We got massive
energy readings out of nowhere,
then they just disappeared.
Fifteen miles due northwest."|speech|TECHIE|M
