|character|text|type
549|DYLAN|"Chair throwing? Never heard of
it? You just pick up your chair
and throw it as far as you can."|speech
550||"The redneck nods, lifts up his chair and heaves it across
the bar.
OKAY, HERE'S AN OUTLINE OF WHAT WILL HAPPEN IN THE REST OF
THIS SCENE:
Dylan and Natalie create a distraction, while Alex sneaks
into the back office with Bosley to get the phone number
of the chalet."|stage direction
551||EXT. HIGH MOUNTAIN ROAD - NIGHT|location
552||"A VW van climbs the winding road.       As we get closer, we see the
side reads, ""Chalet Grams.""
A DING-DONG DING-DING-DONG doorbell rings."|stage direction
553||INT. MOUNTAIN HOUSE / GREAT ROOM - NIGHT|location
554||"TWO THUGS with shoulder holsters look up, hearing the bell.
One was tending to the fire."|stage direction
555|THUG ONE|We expecting somebody?|speech
556||(CONTINUED)|unknown
557||"CHARLIE'S ANGELS - 8/18/99                              33.
CONTINUED:
Thug Two shakes his head.
Checking his gun, Thug One grabs for his windbreaker.
Puts it on over."|stage direction
558||EXT. FRONT PORCH - NIGHT|location
559||"Thug One opens the door to find Dylan and Natalie dressed
in Swiss Miss outfits, complete with blonde braids."|stage direction
560|DYLAN|Guten Tag!|speech
561||(correcting Dylan)|unknown
562|NATALIE|Guten Morgen!|speech
563||(correcting Natalie)|unknown
564|DYLAN|Guten Nacht!|speech
565||(to each other)|unknown
566|DYLAN AND NATALIE|Guten Freund!|speech
567||"The girls lean in and hug each other, butts sticking out.
To the left, Bosley starts playing oommpa OOMMPA oommpa
OOMMPA on a wrap-around tuba. He's wearing lederhosen,
with a feather in his hat.
Natalie begins to YODEL.
Dylan hands a fancy envelope to the bewildered thug. Thug
Two is approaching from behind, curious what the hell is
going on.
Dylan begins to TALK-SING a song in German about a too-
curious goat and his worried mistress. Even with the pantomime,
we have no idea what's happening. It seems
wholesome, but occasionally one of the girls touches the
other in a weirdly coquettish, oddly sexual way.
Thug Two looks at the address on the envelope."|stage direction
568||(low)|unknown
569|THUG TWO|They got the wrong address.|speech
570|THUG ONE|Shut up.|speech
571||"As the angels continue their routine, the CAMERA RISES,
three quick cuts to take us to...
CHARLIE'S ANGELS - 8/18/99                               34."|stage direction
572||EXT. THE ROOF - NIGHT|location
573||"... where a black cat-suited Alex stands at the
chimney... A ribbon of smoke curls from the stack.
Pulling the pin from a canister, she drops it down the
chimney."|stage direction
574||INT. MOUNTAIN HOUSE GREAT ROOM - NIGHT|location
575||"A cheerful fire burns in the over-sized fireplace. The
canister drops into the flames from above, suddenly
venting a HISSING cloud of halon gas. The fire dies
immediately, the logs covered with a violent frost."|stage direction
576||INT. THE CHIMNEY - NIGHT|location
577||"Alex doesn't even need a rope. Her feet pressed to the
sooty walls, she expertly slides to the bottom."|stage direction
578||INT. GREAT ROOM - NIGHT|location
579||"Alex backs out of the fireplace to find a WAITING BAD GUY
swinging
A FIREPLACE POKER
at her head. She ducks just in time.     The poker CHINGS
against the stone, making a spark.
Rolling, jumping and diving, Alex scurries as Pokerman
slashes and stabs. She ducks behind a chair, which
Pokerman catches with the hook, winging it across the
room.
Backed against the wall, Alex yanks on the heavy
curtains, pulling them down, along with the wooden
curtain rod. A spin, a flourish of velvet and the
curtain rings drop off to leave her with a trusty
quarterstaff.
She goes on the offensive.    Thrust, parry, spin.
But he's a worthy adversary. One good karate kick breaks
her staff in two. She uses both pieces to club him in
the knees, then rolls back to the fireplace.
She grabs the remaining tool: the fireplace tongs.
Pokerman swings. Alex catches his weapon in the tong
scissors, yanking it free with such force the point sticks
in the wall.
A quick kick knocks Pokerman to the floor, where Alex
rolls on top of him. She catches his head in the tongs,
squeezing his temples. His eyes bulge."|stage direction
580||Where's Knox?|location
581||CHARLIE'S ANGELS - 8/18/99                                  35.|stage direction
582||INT. WINDOWLESS ROOM - NIGHT|location
583||"Young billionaire ERIC KNOX paces. He's grungy, with
two days of stubble, but still a darn attractive guy.
Hearing a KICK at the door, he turns.
A second KICK blows the door open.     It's Alex."|stage direction
584||Who are you?|location
585||"The calvary.     Giddy up.
EXT. FRONT PORCH - NIGHT"|location
586||"Bosley is about to hyper-ventilate on the tuba, sweaty
and a little blue.
Dylan and Natalie's new song has them sharing the saddle
of an imaginary horse. When Dylan reaches back to slap
the ""horse,"" she hits Natalie in the rump. Both women
tee-hee.
The thugs think it's pretty hot.
Dylan whispers a secret to Natalie.     Natalie WHISPERS
back.
Turning to the thugs, they each lean in to WHISPER into
a different thug's ear. As the men smile, the angels
suddenly BONK the two men's heads together. Both men
fall, knocked out.
Stepping over the bodies, Dylan heads inside."|stage direction
587||INT. MOUNTAIN HOUSE HALLWAY - NIGHT|location
588||"Looking for the way out, Alex leads Knox to a closed
door. She opens it to find..."|stage direction
589||INT. TV ROOM - NIGHT|location
590||"... TWO MORE THUGS sitting in front the big-screen TV,
watching a college basketball game (Duke vs. Maryland,
in case you care.) The guards look back, spotting Alex
with Knox.
That wouldn't be so bad, if it weren't for the
FIFTEEN OTHER THUGS
watching the game with them.
ANGLE ON Alex.   It's an oh-shit moment."|stage direction
591||(CONTINUED)|unknown
592||"CHARLIE'S ANGELS - 8/18/99                                   36.
CONTINUED:"|stage direction
593||ALEX|unknown
594|ALEX|Sorry.    Wrong room.|speech
595||(to Knox)|unknown
596|ALEX|Back!    Run!|speech
597||"The thugs are out of their seats a moment later, each of
them pulling out a firearm."|stage direction
598||EXT. FRONT PORCH - NIGHT|location
599||"Holding down three keys on the tuba, Bosley talks into
the mouthpiece. It has a secret radio."|stage direction
600|BOSLEY|Alex, what's your status?|speech
601||INT. STAIRCASE - NIGHT|location
602||"Running, Alex pushes Knox ahead of her, checking their
backs. She talks into a wrist-mic."|stage direction
603||ALEX|unknown
604|BOSLEY|Good news:   I found Knox.|speech
605||"Another THUG steps out in front of her.      She kicks him
down the steps."|stage direction
606||ALEX (CONT'D)|unknown
607|BOSLEY|Bad news:    I found company.|speech
608||"Reaching the bottom of the steps, Knox is surprised to be
grabbed by Dylan."|stage direction
609||DYLAN|unknown
610|BOSLEY|This way.|speech
611||At this point, he'll do whatever they say.|stage direction
612||EXT. FRONT OF MOUNTAIN HOUSE - NIGHT|location
613||"Dylan rushes Knox across the driveway to the waiting van
-- Natalie is pulling it around. Overhead, bright
security lights switch on.
Back at the front door, Alex pulls it shut. She attaches
a carabiner clip to the handle, running a thin steel cord
from it around the porch column."|stage direction
614||INT. FOYER - NIGHT|location
615||"The first of the thugs reaches the door, tries to pull it
open but can't. The next few guards try to help him,
while the rest start smashing through the windows.
CHARLIE'S ANGELS - 8/18/99                               37."|stage direction
616||EXT. FRONT OF MOUNTAIN HOUSE - NIGHT|location
617||"Running with the tuba, Bosley stops for a moment to catch
his breath, hands on his knees. Okay, ready to run
again.
He's the last to be pulled into the van.    A spray of
gravel and they're off."|stage direction
618||INT. THE VAN - NIGHT|location
619||"Everyone is piled on top of each other. Dylan and Knox
have a few awkward moments as they get untangled. Bosley
keeps making inappropriate TUBA NOISES.
At the wheel, Natalie is fierce and focused, in total
control.
Looking out the back windows, Alex sees the kidnappers
piling into jeeps to give chase. From the side of the
house, more thugs appear on motorbikes."|stage direction
620||ALEX|unknown
621||They're coming after us.|location
622||"DYLAN
(to Knox, confident)"|unknown
623||We were expecting that.|location
624||NATALIE|unknown
625||Okay, new problem.|location
626||"Everyone's attention WHIPS FORWARD to see the headlights of
GIANT LOGGING TRUCK
coming up the high mountain road. It straddles the
center line, blocking both directions. There's no way
around it."|stage direction
627||"NATALIE (CONT'D)
Thoughts, suggestions, points to
consider?
BOSLEY"|unknown
628||"I don't suppose giving up would
be a..."|location
629||No, it wouldn't.   Then --|stage direction
630||DYLAN|unknown
631||Right!|location
632||NATALIE|unknown
633||There is no right.|location
634||DYLAN|unknown
635||There!|location
636||(CONTINUED)|unknown
637||"CHARLIE'S ANGELS - 8/18/99                                   38.
CONTINUED:
She points to a faded ""CLOSED"" sign that hangs from a
chain. In the darkness, who knows what it's blocking.
But as we hear the THUNDEROUS HORN from the oncoming
truck, we know there's no choice.
Natalie cuts a hard right, SMASHING through the sign.
The van THUMPS AND BUMPS its way across the low grass,
its headlights only showing ten feet ahead. At any
moment, the ground could stop in a cliff.
Like now.
The van leaps into empty space.      Tires spin, helpless.
The van falls.
Everyone SCREAMS.    Bosley is the loudest.
And then, touchdown. The van hits the ground, hard but
not catastrophically. Natalie hits the brakes, cuts the
wheel hard to avoid hitting
A CONCRETE WALL
in front of them.    Everyone takes a beat to acknowledge
they're alive."|stage direction
638||DYLAN|unknown
639|BOSLEY|Where are we?|speech
640||Suddenly, a BRIGHT LIGHT goes on overhead.|stage direction
641||EXT. THE MOUNTAIN - NIGHT|location
642||"One by one, a series of arc lights switches on, forming a
snake all the way to the bottom of the mountain."|stage direction
643||INT. THE VAN - NIGHT|location
644||Looking out the back windows...|stage direction
645|ALEX|It's a bobsled run.|speech
646||"They're facing backwards.
Up ahead, the kidnappers are charging down the access roads.
The first of two jeeps makes the jump into the bobsled chute."|stage direction
647|NATALIE|"If it goes down the mountain,
that's all I need."|speech
648||"Throwing it into reverse, Natalie peels out.
The jeeps follow.
CHARLIE'S ANGELS - 8/18/99                               39."|stage direction
649||EXT. BOBSLED RUN - NIGHT|location
650||"The VW Van leads the way down the mountain, tail-first.
As it builds speed, it starts to climb the wall, each turn
getting steeper and steeper.
The two jeeps are following. Facing the right direction,
they have a much easier time of it."|stage direction
651||INT. VAN - NIGHT|location
652||Everything is shaking so violently, it looks like a NASA launch.|stage direction
653||"ALEX
(looking out the back)
Hard left! HARD LEFT!"|unknown
654||"Natalie makes the turn. The van rises up, nearly tilting
over. But they make it through the turn."|stage direction
655||"KNOX
(to Dylan)
Is this part of the plan?
DYLAN
Yes. Except for the bobsled run,
and the backwards part, it's
going exactly according to plan."|unknown
656||A beat.   He smiles at her.   He has a nice smile.|stage direction
657||EXT. BOBSLED RUN - NIGHT|location
658||"One of the jeeps makes a move, closing the distance to
the van. A RIFLEMAN leans out the passenger window,
lining up a shot. He FIRES."|stage direction
659||INT. THE VAN - NIGHT|location
660||"The shot blasts cleanly through the top of the windshield,
through the horn of Bosley's tuba, then out the back window.   It
missed hitting somebody by millimeters.
Natalie is still focused, making each turn as Alex calls it."|stage direction
661||EXT. BOBSLED RUN - NIGHT`|location
662||"The front jeep gets even more aggressive, building speed.
It hits the next turn too fast, rising up too high along
the wall. It tips further, and further, finally rolling
over onto its back. It SCRAPES across the concrete, a
shower of sparks as it slows down.
With nowhere to go, the second jeep brakes hard, but can't stop.
It SMASHES into the first jeep, a tangle of steel."|stage direction
663||(CONTINUED)|unknown
664||"CHARLIE'S ANGELS - 8/18/99                              40.
CONTINUED:
The combined mass continues sliding down the run, like a
jagged pinball in the chute."|stage direction
665||INT. THE VAN - NIGHT|location
666||"Dylan looks out through the windshield as the jeep combo recedes
farther and farther away."|stage direction
667|DYLAN|I think we're in the clear.|speech
668||"Just then, two MOTORBIKES race up along the chute walls, passing
the crippled jeeps. Two more MOTORBIKES jump in from above."|stage direction
669||DYLAN|unknown
670|DYLAN|Or maybe not.|speech
671||Suddenly, Natalie GASPS, remembering something.|stage direction
672||NATALIE|unknown
673|DYLAN|Oh God, no.|speech
674||DYLAN|unknown
675|DYLAN|What is it?|speech
676||WHIP CUT TO:|stage direction
677||EXT. EGYPTIAN THEATRE - NIGHT|location
678||"A dejected Pete stands in front of the sign for the anime
festival, two tickets in hand.
WHIP BACK TO:"|stage direction
679||INT. THE VAN - NIGHT|location
680|NATALIE|I have a date with Pete.   Right now.|speech
681||DYLAN|unknown
682|NATALIE|Ouch.|speech
683||ALEX|unknown
684|NATALIE|HARD RIGHT!|speech
685||"Natalie makes the hard right. The motorcycles are gaining on
them, but Natalie and Dylan have to talk through this first."|stage direction
686|DYLAN|Call him, he'll totally understand.|speech
687|NATALIE|"""Gee, sorry Pete. I had to rescue a
billionaire."""|speech
688||(CONTINUED)|unknown
689||"CHARLIE'S ANGELS - 8/18/99                                  41.
CONTINUED:"|stage direction
690|ALEX|Hard left!|speech
691||She makes the left.|stage direction
692|NATALIE|"I'll sound like a flake.   I can't
stand flakes."|speech
693|DYLAN|He will so give you the second chance.|speech
694|NATALIE|You think?|speech
695|DYLAN|Hello, I saw the way he looked at you.|speech
696||"One motorcycle charges, coming up just feet from the
windshield. Natalie taps on the brakes. The freaked out
guy can't slow down in time. He SMACKS into the windshield,
then goes flying."|stage direction
697|ALEX|We're at the bottom!|speech
698||"Indeed, we are. The concrete walls end, leaving open ground.
Slamming on the brakes, Natalie turns the van around.
Everyone goes flying. Bosley is still on the phone with
Charlie."|stage direction
699||EXT. BASE OF THE MOUNTAIN - NIGHT|location
700||"Back facing the right direction, the van charges onward.
The motorcycles race up to the passenger side, grabbing
for the door."|stage direction
701||INT. THE VAN - NIGHT|location
702||"Dylan SLAMS open the door, knocking one RIDER off.
The sliding door opens, another RIDER outside trying to get
in. Thinking fast, Knox grabs Bosley's tuba and shoves it
at the motorcyclist, who tumbles, taking out the fourth
rider in the process."|stage direction
703||(genuinely impressed)|unknown
704|DYLAN|Well done.|speech
705|KNOX|Thanks.|speech
706||CUT TO:|unknown
707||"CHARLIE'S ANGELS - 8/18/99                                42.
HELICOPTER
thunders over.    We are..."|stage direction
708||INT. THE HELICOPTER - NIGHT|location
709||"Natalie is at the controls, Bosley beside her.      Alex leans
forward from the second row."|stage direction
710|BOSLEY|"I think that went very well. Charlie
should send me on more missions."|speech
711|ALEX|"We couldn't have done it without
you, Bos."|speech
712||"Natalie pats him on the arm. She and Alex exchange a quick
glance. They have to just laugh.
In the back row, Knox is looking out over the gorgeous lights
of Aspen."|stage direction
713|DYLAN|Cocktail?|speech
714||"She offers him an airplane-sized bottle of Johnnie Walker
black. He takes it and toasts. They both down their drinks
in a single shot. A smile, and then...
MUSIC rises.
THE ANGELS TRIPTYCH descends.
The act is over.    After a beat, we
WIPE TO REVEAL:"|stage direction
715||EXT. CHARLES TOWNSEND DETECTIVE AGENCY - DAY|location
716||Re-establishing.|stage direction
717||INT. CHARLES TOWNSEND DETECTIVE AGENCY - (THE NEXT) DAY|location
718||"Charlie is on the speakerphone.      The angels are in their
usual lounging positions."|stage direction
719|CHARLIE'S VOICE|"Good work, Angels. Not only did you
save Knox, you saved his company as well."|speech
720|DYLAN|I think that earns us a vacation.|speech
721|NATALIE|Say, Fiji?|speech
722||(CONTINUED)|unknown
723||"CHARLIE'S ANGELS - 8/18/99                                 43.
CONTINUED:"|stage direction
724||(to Natalie)|unknown
725|ALEX|"Any special guy you were thinking
of inviting?"|speech
726||Natalie grins a guilty smile.|stage direction
727||CHARLIE'S VOICE|unknown
728|ALEX|"Sorry, Angels.     Our work is only
half-done."|speech
729||"Knox enters. Clean-shaven and neatly pressed, he's still a
darn good-looking man. Vivian Wu follows him."|stage direction
730|CHARLIE'S VOICE (CONT'D)|Meet your new client, Eric Knox.|speech
731|KNOX|"First off, thank you. You rescued
me, for which I am eternally grateful."|speech
732||"He's talking to all the angels, but his gaze seems to fall
most upon Dylan. She notices it."|stage direction
733|KNOX (CONT'D)|"But there's still a problem. Whoever
kidnapped me wasn't just trying to
screw up our IPO. They also stole
the proprietary software for our new
web browser. I'm sure it was Roger
Corwin, but I need proof."|speech
734|CHARLIE'S VOICE|That's where you come in, Angels.|speech
735||"CIRCLING AROUND, we see the video images of Corwin and the
Red Star Systems logo on the big screen."|stage direction
736|CHARLIE'S VOICE (CONT'D)|"We need to break into Red Star's computer
systems to see if Mr. Knox's software is
indeed being converted for Red Star's use."|speech
737|NATALIE|Sounds like a plan.|speech
738|CHARLIE'S VOICE|"Not as easy as that, Natalie. Red
Star's headquarters are as tightly
guarded as a military facility.
We're going to need reconnaissance
on their mainframe computer system,
and the best way to get that is
through Mr. Corwin himself."|speech
739||(CONTINUED)|unknown
740||"CHARLIE'S ANGELS - 8/18/99                                 44.
CONTINUED:
A video image of Corwin's Palm Pilot Schedule comes up the
bigscreen. The shot pulls in close on ""SAN DIEGO SPEEDWAY."""|stage direction
741|CHARLIE'S VOICE (CONT'D)|"We need to pin a camera on him to get
footage of the inside of the building.
Thanks to Alex's work at the health spa,
we know that Corwin will be at the San
Diego Speedway on Thursday. Get close to
him Angels, but don't tip your hand."|speech
742|ALEX|Consider it done.|speech
743|CHARLIE'S VOICE|"Dylan, I need you to arrange for Mr.
Knox's security. I'd hate to have him
kidnapped again."|speech
744|DYLAN|"Absolutely. But we'd all feel safer
if you could join us, Charlie."|speech
745||CUT TO:|unknown
746||"UNDERWATER
From Charlie's P.O.V., looking up at the sunlight.      Three
manta-rays swim above us.
We can hear the BUBBLES from Charlie's regulator."|stage direction
747|CHARLIE|"I'd love to Angels. But I'm in a
bit over my head at the moment."|speech
748||A manta-ray swims past, super-close, letting us...|stage direction
749||WIPE TO:|unknown
750||EXT. KNOX HOUSE - DUSK|location
751||"A majestic craftsman in the hills, Frank Lloyd Wright meets
conspicuous consumption."|stage direction
752||INT. KNOX HOUSE ATTIC - DUSK|location
753||"A flashlight beam sweeps past, revealing Dylan. With just
her shoulders above the rafters, she's checking a dusty
crawl space. She finds nothing suspicious."|stage direction
754||INT. KNOX'S WALK-IN CLOSET - DUSK|location
755||"Knox stands below, Dylan's boots on his shoulders. The heels
dig in a bit, but he's not complaining."|stage direction
756||(CONTINUED)|unknown
757||"CHARLIE'S ANGELS - 8/18/99                                45.
CONTINUED:"|stage direction
758|DYLAN|We're good.|speech
759||"He moves to help her down, but she does a reverse-pullup to
handle it by herself. She leads the way..."|stage direction
760||INT. KNOX'S BEDROOM - DUSK|location
761||"The room is huge. Through the floor-to-ceiling windows, we see
that we're up in the hills.
Knox follows her as she walks."|stage direction
762|DYLAN|"I've got surveillance on all the windows.
Don't answer the door, don't answer the phone."|speech
763||We continue...|stage direction
764||INT. KNOX LIVING ROOM - DUSK|location
765||"Just as big, just as beautiful. Knox, or his decorator, has
great taste. Everything is top quality, but unpretentious."|stage direction
766|DYLAN|Also, stay away from the windows.|speech
767|KNOX|"They're bullet-proof.   The last
owner was paranoid."|speech
768||(a smile)|unknown
769|DYLAN|Lucky for us.|speech
770||She takes a marker-sized device off the table.|stage direction
771|DYLAN (CONT'D)|This is a panic button.|speech
772||(tosses it to him)|unknown
773|DYLAN (CONT'D)|"Press it and one of us can be here
in ten minutes."|speech
774|KNOX|Which one of you?|speech
775|DYLAN|Whoever's closest.|speech
776||She takes her jacket off the couch, ready to go.|stage direction
777|KNOX|I have a better idea.|speech
778|DYLAN|What?|speech
779||(CONTINUED)|unknown
780||"CHARLIE'S ANGELS - 8/18/99                                 46.
CONTINUED:
He tosses her the panic button."|stage direction
781|KNOX|Stay for dinner.|speech
782||(preempting objections)|unknown
783|KNOX|I'm a pretty good cook.|speech
784|DYLAN|I can't Mr. Knox. I'm sorry.     If you...|speech
785||(quickly)|unknown
786|KNOX|I'm scared.|speech
787||Dylan is surprised by this.|stage direction
788|KNOX (CONT'D)|"Look, I didn't want to admit it, but I
am. I was kidnapped once, and it wasn't
fun. I know, you probably have other
plans, but it would be very reassuring."|speech
789||"Dylan looks him over. Normally, she'd be suspicious, but
the guy WAS just kidnapped, and he seems sincere."|stage direction
790|KNOX (CONT'D)|"Come on, don't make me beg. I'm
embarrassed already."|speech
791||She smiles.|stage direction
792||DYLAN|unknown
793|KNOX (CONT'D)|Don't be.|speech
794||She throws her coat back on the sofa.|stage direction
795||INT. KNOX LIVING ROOM - NIGHT|location
796||"We PAN OFF a half-played Scrabble game to find Dylan and
Knox at the windows. Dylan picks up a family photo, Knox
as a little boy with a father in a military uniform."|stage direction
797|DYLAN|"That's you, hunh? Cute kid.    Cute
family."|speech
798||KNOX|unknown
799|DYLAN|Thanks.|speech
800||(taking the photo)|unknown
801|DYLAN|"It's the only picture I have of me with
my parents. They died a week later."|speech
802||DYLAN|unknown
803|DYLAN|Oh.   Oh, I'm sorry. I had no idea...|speech
804||(CONTINUED)|unknown
805||"CHARLIE'S ANGELS - 8/18/99                                 47.
CONTINUED:"|stage direction
806|KNOX|"Please, don't apologize. I was too
young to understand."|speech
807||(looking at the photo)|unknown
808|KNOX|"I never knew how they died. When I
was a kid, when I got shuffled from
one foster home to another, I always
thought they just disappeared."|speech
809||DYLAN|unknown
810|KNOX|But...?|speech
811|KNOX|"I only found out later, my father was
in the military. He and my mother were
killed while he was on assignment,
somewhere in Eastern Europe."|speech
812||(mostly to himself)|unknown
813|KNOX|"The files were classified, but I
read enough to know that he was a
good man. Apparently, he was
betrayed by one of his own team."|speech
814||DYLAN|unknown
815|KNOX|Wow.   That's a lot for a kid to live with.|speech
816|KNOX|"Yeah, but it motivated me, losing my
family. It still does. I don't take
anything for granted."|speech
817||Dylan nods.|stage direction
818|DYLAN|Boy did I have you pegged wrong.|speech
819||(intrigued)|unknown
820|KNOX|How do you mean?|speech
821|DYLAN|"Well, to be honest, I thought you
were a rich kid who inherited
everything. But that's pretty typical.
I've got instincts for the job, but
when it comes to men? Well..."|speech
822|KNOX|I'm glad you don't see me as just a client.|speech
823||"He brushes his hand against hers.     She brushes back, fingers
against fingers. A long beat."|stage direction
824||(CONTINUED)|unknown
825||"CHARLIE'S ANGELS - 8/18/99                                   48.
CONTINUED:"|stage direction
826||DYLAN|unknown
827|KNOX|Oh.   Well, you ARE, so...|speech
828|KNOX|"Is there someone you need to be going
home to?"|speech
829||DYLAN|unknown
830|KNOX|No.|speech
831||(beat)|unknown
832|KNOX|But I...|speech
833||"He kisses her. After a moment, she breaks off. It's not that
it was a bad kiss. It was a damn good kiss. It's just..."|stage direction
834||DYLAN (CONT'D)|unknown
835|KNOX|I shouldn't.|speech
836||Knox moves towards her.|stage direction
837||KNOX|unknown
838|KNOX|Shouldn't you?|speech
839||Dylan holds him back.|stage direction
840||"DYLAN
(firmly)"|unknown
841|KNOX|No.   I shouldn't.|speech
842||She stands up.|stage direction
843|DYLAN (CONT'D)|"Thank you for dinner, Mr. Knox.    And
lock the door behind me."|speech
844||She gets up and leaves.|stage direction
845||CUT TO:|unknown
846||"FORMULA-ONE RACE CARS
ROARING past on the track.       It's all thunder, smoke and
asphalt. We are..."|stage direction
847||EXT. SAN DIEGO SPEEDWAY - DAY|location
848||"With a ROAR, another blur of racers whips past, with heat
and noise and speed. The lead car bears the familiar
markings of RED STAR INDUSTRIES. Roger Corwin is at the
wheel, steering calmly to a comfortable lead, when he is
suddenly BUMPED."|stage direction
849||CORWIN|unknown
850|DYLAN (CONT'D)|What the...?|speech
851||(CONTINUED)|unknown
