|character|text|type
852||"CHARLIE'S ANGELS - 8/18/99                                  49.
CONTINUED:
ANOTHER BUMP sends him screeching to the left. He almost
crashes, then gets back on course, just as he's passed by...
A SLEEK, BLACK CAR, sponsored by the SONY CORPORATION, and
manned by a mysterious driver with TEXAS TORNADO inscripted on
the helmet. We follow the black car as it pulls into the pit."|stage direction
853||EXT. FREEWAY PIT - DAY|location
854||"The racer pulls off her helmet as the pit crew surrounds her.
Of course, the racer is Natalie, aka BETTY LOU HOBERT, the Texas
Tornado."|stage direction
855||"(yelling over the
engine noise)"|unknown
856|PIT BOSS|NICE RACING!|speech
857||(beat)|unknown
858|PIT BOSS|"CAN'T BELIEVE YOU'VE NEVER RACED
THIS TRACK BEFORE!"|speech
859||(Texas accent)|unknown
860|NATALIE|"BACK WHERE AH'M FROM, WE RACE IN SWAMPS
AND BACK ROADS! THIS ALL'S A PIECE A CAKE!"|speech
861||"Natalie shakes out her hair, winks at the pit boss.
The Pit Crew races in to make repairs. DYLAN, dressed in a
pit suit, kneels by Natalie's front tire. Natalie crouches
down next to her so they can talk."|stage direction
862|NATALIE (CONT'D)|"I nicked him. Should give you
enough time to do the deed."|speech
863||DYLAN|unknown
864|NATALIE (CONT'D)|I'm on it.|speech
865||"Dylan steals away, heading for...
CORWIN'S PIT CREW --
Corwin is seething mad as he pulls into his pit."|stage direction
866||CORWIN|unknown
867|NATALIE (CONT'D)|LET'S GO!    WE'RE LOSING TIME HERE!|speech
868||"The pit repairs his car as Corwin is approached by another
racer, also wearing a Red Star racing suit. He leans into
Corwin's car and now we see that's it's... THE THIN MAN."|stage direction
869|THIN MAN|You okay, Boss?|speech
870||(CONTINUED)|unknown
871||"CHARLIE'S ANGELS - 8/18/99                                   50.
CONTINUED:"|stage direction
872|CORWIN|"No thanks to you! You're supposed
to be my head of security! Who is
that bitch?!"|speech
873||"The Thin Man peers over at Natalie, but she's got her
back to him."|stage direction
874||THIN MAN|unknown
875|CORWIN|Don't know.   I'll keep an eye out.|speech
876||CORWIN|unknown
877|CORWIN|Yeah.   You do that.|speech
878||"Corwin peels out onto the track again, almost crushing
the Thin Man in the process.
AS CORWIN PULLS OUT
Dylan sneaks in. In all the cacophony, no one notices
as she grabs CORWIN'S SUITCASE out of the back seat of
his regular car, a bitching Mercedes. She checks both
ways to see if she's being watched."|stage direction
879|BOSLEY (O.S.)|Coast is clear, Dylan.|speech
880||CUT TO:|unknown
881||EXT. THE WINNER'S CIRCLE|location
882||"Where Alex, dressed as a trophy girl, watches the race
through binoculars and keeps an eye on her pals. She
nods to BOSLEY, who is dressed as the Flag Waver. He
speaks into a walkie talkie."|stage direction
883|BOSLEY|Let's make the switch.|speech
884||"BACK IN THE PIT --
Dylan pulls a briefcase out of her jumpsuit, and swaps
it with one in Corwin's car. She carefully switches all
his files from the old briefcase to the new one, then
gives Alex a thumbs up.
MEANWHILE BACK IN THE RACE --
NATALIE roars back onto the track, keeping Corwin in her
sights. Then she spots another Red Star car, coming up
right next to her. She locks eyes with the Thin Man.
The two of them recognize each other at the exact same
instant."|stage direction
885||(CONTINUED)|unknown
886||"CHARLIE'S ANGELS - 8/18/99                                  51.
CONTINUED:
The Thin Man, realizing he's been made, jams on the
brakes and skids off to the right, which leads to a ramp
that heads out of the stadium.
Natalie, not wanting to lose him, does something crazy.
Even though she's at the front of the pack, she brakes
hard, swerves into a full 180 degree U-turn, and starts
heading the WRONG WAY on the race track.
Startled drivers pull off to the left and right as she
follows the Thin Man out of the racetrack."|stage direction
887||EXT. SPEEDWAY ACCESS ROAD - DAY|location
888||"To a chorus of CAR HORNS, the Thin Man's blue racer weaves
through the spectator traffic entering the speedway.
Looking back, we see Natalie is gaining on him.
Finally clear of the traffic, both cars let it rip."|stage direction
889||CUT TO:|unknown
890||"HELICOPTER VIDEO FOOTAGE
Looking down on a freeway, where a ubiquitous police
pursuit is in progress."|stage direction
891||TV ANCHOR VOICE|unknown
892|BOSLEY|"If you're just joining us, we're
approaching hour five of a pursuit
that has lead us all across the
Southland, at speeds up to 80
miles an hour."|speech
893||"A beat-up gray Chrysler leads a phalanx of police cars
down the empty freeway. It's oddly calm and hypnotizing."|stage direction
894|FEMALE ANCHOR VOICE|"Chuck, time and again we hear the
question, ""Why don't the police just
ram the other car, or shoot out the
tires?"" The LAPD has a policy of
hanging back and following unless..."|speech
895||"Suddenly, the blue Formula One car comes screeching past
the cops and the suspect, over 200 miles per hour."|stage direction
896||TV ANCHOR VOICE|unknown
897|FEMALE ANCHOR VOICE|What was that?|speech
898||INT. NATALIE'S RED CAR / ON THE FREEWAY - DAY|location
899||"Still hot on the Thin Man's tail, Natalie has the engine
ROARING."|stage direction
900||(CONTINUED)|unknown
901||"CHARLIE'S ANGELS - 8/18/99                               52.
CONTINUED:
As she passes the police cars, we see several OFFICERS
look over -- what the hell?
Natalie catches up to the gray Chrysler. Looks over to
see the WILD-EYED SUSPECT, hunched over the wheel.
He looks back at her. A beat later, she's passed him,
just taillights on the freeway."|stage direction
902||EXT. FREEWAY - DAY|location
903||"With the lanes cleared for the other chase, there is
nothing preventing the Formula One cars from hitting top
speed -- which they do.
Natalie is catching up to the Thin Man.
As they head under an overpass, we see KIDS CHEERING."|stage direction
904||INT. BLUE CAR - DAY|location
905||"The Thin Man checks his gauges. The gas dial is perilously
close to empty -- these cars are meant to be refilled often.
Up ahead, he sees an exit.   He starts to slow down..."|stage direction
906||EXT. FREEWAY - DAY|location
907||"... but when you're going 200 miles per hour, that can
take a while. He misses the exit.
Natalie is trying to match his speed.
The Thin Man pulls over to the side, stops fully.
Braking as hard as she can, Natalie still passes him.
The Thin Man throws a U-turn, heading up the freeway on-ramp.
Natalie follows."|stage direction
908||EXT. SAN DIEGO SHIPYARD - DAY|location
909||"We catch glimpses behind fences and between train cars --
the two racers gliding slowly down the narrow roads, like
lions pacing."|stage direction
910||INT. NATALIE'S RED CAR - DAY|location
911||"Pulling off her helmet, Natalie scans right and left for
the blue car -- she's lost sight of him. The narrow
windshields of these racers doesn't make it any easier."|stage direction
912||EXT. SHIPYARD - DAY|location
913||"We LOOK DOWN on Natalie's car as she rounds a corner,
still searching.
CHARLIE'S ANGELS - 8/18/99                               53."|stage direction
914||EXT. PIER - DAY|location
915||"Natalie spots the blue racer reaching the end of the
long pier. It pulls a U-turn to face her, then stops,
engine idling. There's only way off the pier, and it's
past Natalie.
The Thin Man REVS his engine.
Natalie REVS hers.
ANGLE ON a white seagull, pecking at something on the
pier, halfway between the two racers. The bird looks up,
hearing the engines.
ANGLE ON the Thin Man. He pulls his harness tighter.
REVS his engine higher.
ANGLE ON Natalie. If it's a game of chicken he wants,
she'll give it to him. She REVS her engine higher still.
The noise scares the bird, who suddenly flies off. Like
a flag being dropped, that's the signal for both racers
to peel out.
A cloud of SMOKE.    Rubber on asphalt.
Already reaching a tremendous speed, the racers are on a
collision course. The Thin Man isn't going to turn away.
Neither is Natalie.
Racing faster, and faster still, there's only one way
this can turn out. But then, at the very last moment,
the Thin Man wusses out. He cuts the wheel right,
missing Natalie and careening off the edge of the pier.
In SLOW MOTION, we watch as his racer hangs in mid-air,
wheels still spinning. Back-heavy, the tail hits the
water first.
Natalie brakes hard, cuts the wheel to avoid going off
the far end of the pier. She finally stops, the rear
tire just 1/4 inch from the edge.
CRANING UP along the side of the pier, we find Natalie
looking into the water where the blue racer went in.
There's just a slick of oil and a steady stream of bubbles."|stage direction
916||CUT TO:|unknown
917||"VIDEO / CAMERA'S P.O.V.
We see lots of hallways, doorways and security locks, all
from the POV of a man's hip.
The footage is from the camera in the switched briefcase
that Corwin is now carrying with him."|stage direction
918||(CONTINUED)|unknown
919||"CHARLIE'S ANGELS - 8/18/99                               54.
CONTINUED:
We PULL BACK from the video to see we are actually
watching it..."|stage direction
920||INT. CHARLES TOWNSEND AGENCY - DAY|location
921||"... on the big screen. The angels and Bosley watch the
footage, along with Knox and Vivian Wu. Vivian has
seated herself close to Natalie. So close, in fact, that
Natalie keeps having to shift a few inches.
Dylan, meanwhile, sits across the room from Knox,
deliberately avoiding eye contact.
ON THE BIG SCREEN: As the videocamera passes a room
marked with an intimidating warning sign..."|stage direction
922|KNOX|There!|speech
923||VIDEO FREEZES.|stage direction
924|KNOX (CONT'D)|"That's the room with the
mainframe. Everything at Red Star
goes through that system."|speech
925|CHARLIE'S VOICE|"So if we want to find proof that
Red Star stole Knox's technology,
that's the computer to tap."|speech
926|KNOX|"Exactly. But they have heavy firewalls
and encryption. You can't jack in from
outside. You'll have to physically be
in that room to get at the data."|speech
927|ALEX|"Even if we do get inside, there won't
be time to search for it. There's got
to be a hundred terabytes of
information there. It could take days."|speech
928|NATALIE|So you install a transmitter.|speech
929||All eyes go over to Natalie.|stage direction
930|NATALIE (CONT'D)|"Patch in directly to the relay,
broadcast on a high frequency.
That way, you can have access to
the mainframe from the comfort of
your own home. And they have no
idea that you can peek inside."|speech
931||(CONTINUED)|unknown
932||"CHARLIE'S ANGELS - 8/18/99                               55.
CONTINUED:
Knox is impressed.    The other angels nod.   It's a good idea."|stage direction
933|VIVIAN WU|"That's all fine in theory. But you
still have to get inside that room
to install it. What about security?"|speech
934|ALEX|"Red Star has a lot of Government
contracts, so security is tight. Key-
card badges throughout. Redundant
security at all red-line areas with
biometric scanners and weekly keycodes.
Pervasive video surveillance, lasers,
air-displacement sensors. Plus a hard-
wired fail-safe at the relay to prevent
exactly this kind of tapping."|speech
935|VIVIAN WU|It sounds impossible.|speech
936||Alex checks with her fellow angels.    They're in agreement.|stage direction
937|DYLAN|It sounds like fun.|speech
938||"With a subtle RUSH, we move into a stylized MONTAGE that
shows How They Do It. It features WHIP PANS, FREEZE
FRAMES and ZOOMS to show us only the highlights."|stage direction
939|NATALIE (V.O.)|"Only the two directors can disengage the
fail-safe. We have to get their keys."|speech
940||WHIP CUT TO:|stage direction
941||INT. NUDE NUDE NUDE GIRLS - DAY|location
942||"ANGLE ON DIRECTOR #1, 40's, part of the lunchtime crowd.
Alex and Natalie are on the catwalk, in the middle of a
grinding routine. Paying for his drink, he fumbles with
his wallet. His waitress helps him find the right bill.
As she walks away, we see the waitress is Dylan. FREEZE FRAME.
We ZOOM IN on the orange key-card she's grabbed from him."|stage direction
943||EXT. BACK YARD BIRTHDAY PART - DAY|location
944||"ANGLE ON Bosley, done up in full clown makeup. He tries
to twist a balloon animal, but no luck. Finally it POPS.
The CHILDREN CRY.
Entertaining the ADULTS, magician Alex whips open her silk
handkerchief to reveal that the ""item"" has disappeared."|stage direction
945||(CONTINUED)|unknown
946||"CHARLIE'S ANGELS - 8/18/99                                  56.
CONTINUED:
ANGLE ON DIRECTOR #2, who looks very worried. Magician's
assistant Dylan takes off her giant hat to reveal the director's
billfold is underneath. Getting it back, he's
relieved.
Passing behind Dylan, Natalie takes the orange keycard
Dylan hands off. FREEZE FRAME. ZOOM IN."|stage direction
947|ALEX (V.O.)|"Then we have to get back into Red
Star. Problem is, their biometric
sensors are too good."|speech
948|DYLAN (V.O.)|We need someone's help.|speech
949||WHIP TO:|unknown
950||EXT. STREET OFF MULHOLLAND - DAY|location
951||"ANGLE ON Roger Corwin, driving his Mercedes.     He slows,
a road crew working ahead.
ANGLE ON Dylan, dressed in an orange vest, manning the
slow/stop sign. She makes Corwin stop, leans in to
apologize for the delay.
Behind the Mercedes, Natalie sneaks up. She quickly
picks the trunk lock, then quietly climbs in. She hoists
in a large duffel bag, then shuts herself inside."|stage direction
952||INT. TRUNK OF CORWIN'S MERCEDES - DAY|location
953||"We HEAR the car moving again.
Stripped down to a bra, Natalie attaches an illuminated mirror
to the underside of the trunk lid. Starts to pull more items
from her duffel bag: black shoes, a dress shirt, a tie."|stage direction
954||EXT. RED STAR - DAY|location
955||"Establishing. We see Corwin's Mercedes pull into the
parking garage."|stage direction
956||INT. PARKING GARAGE / RED STAR - DAY|location
957||"Walking away from the car, Corwin hits the remote.    The
Mercedes BWOOPS.
A beat later, a hand comes out from under the trunk lid.
Natalie climbs out, only she's not Natalie anymore.
She's become Corwin -- identical to the last detail.
She tucks the last of the latex mask under her collar as
she walks. FREEZE FRAME.
CHARLIE'S ANGELS - 8/18/99                                 57."|stage direction
958||INT. SECURITY STATION - DAY|location
959||"Corwin puts his right hand on the sensor grid.    A laser
scans it. Approved.
The Security Guard hits the button, releasing the gate.
He goes back to his magazine as Corwin passes through.
A beat, then..."|stage direction
960||A VOICE|unknown
961||"Tommy? You gonna let me through
or what?"|location
962||"Tommy the Guard looks up, sees Corwin is still at the
counter."|stage direction
963||(confused)|unknown
964||Oh.     Yeah, sorry Mr. Corwin.|location
965||"He hits the button again, letting Corwin through. Tommy
goes back to his magazine, still a little perplexed."|stage direction
966||INT. SECURE HALLWAY - DAY|location
967||"The same places we saw on the videotape. Natalie-as-
Corwin swipes the two stolen failsafe cards in a reader,
sending the lights from red to green. FREEZE FRAME.
She splices in a transmitter the size of a cigarette pack.
Pulls up a tiny antenna. FREEZE FRAME."|stage direction
968||INT. SECURE HALLWAY - DAY|location
969||"Corwin walks down the hall, still talking with his
colleague. Natalie-as-Corwin is walking right towards
them. She turns away as she passes. He didn't even spot
her.
She smiles."|stage direction
970||CUT TO:|unknown
971||EXT. POSH BEVERLY HILLS HOTEL - DAY|location
972||Establishing...|stage direction
973||INT. RESTAURANT - DAY|location
974||"As a group, the angels move through the upscale lunch
crowd to find Knox and Vivian Wu at a booth.
Alex opens a slim Sony laptop, sets it on the table."|stage direction
975||ALEX|unknown
976||"It's done. Red Star's mainframe
is open for business."|location
977||(CONTINUED)|unknown
978||"CHARLIE'S ANGELS - 8/18/99                                  58.
CONTINUED:
Astonished, Vivian Wu hits some keys, checking that what
they say is true."|stage direction
979||(to a passing waiter)|unknown
980|DYLAN|Champagne, please. Your best.|speech
981||Smiling, Knox motions for them to take a seat.|stage direction
982|KNOX|"Now I know why I hired you.   You're
the best."|speech
983||A look between the angels.      They know it's true.|stage direction
984||(to Knox, re: laptop)|unknown
985|VIVIAN WU|"I'll have Systems get to work on
this right away."|speech
986||She reaches for the laptop.      Bosley snatches it away.|stage direction
987|BOSLEY|"Uh, actually Miss Wu, WE will get to
work on this right away. Any evidence
we find will be turned over to you AND
the proper authorities."|speech
988|VIVIAN WU|"I don't think you understand how
important that data is, Mr..."|speech
989|BOSLEY|"Oh, indeed I do. And that's why I'll
take very good care of it when I find it."|speech
990||"VIVIAN WU
(reaching for the laptop)"|unknown
991|BOSLEY|But...|speech
992|KNOX|Vivian, please. Do as the man says.|speech
993||"Reluctantly, Vivian Wu pulls her hand away. Bosley tucks
the laptop into a steel briefcase, then stands."|stage direction
994|DYLAN|Where you off to, Bos?|speech
995||BOSLEY|unknown
996|DYLAN|Vacation.|speech
997|NATALIE|"Uh oh, lemme guess. You're off to
chase bikinis at some tropical resort?"|speech
998||(CONTINUED)|unknown
999||"CHARLIE'S ANGELS - 8/18/99                                  59.
CONTINUED:"|stage direction
1000||BOSLEY|unknown
1001|NATALIE|Exactly!   Fire Island, here I come!|speech
1002||Dylan does a spit take, the other two Angels roll their eyes.|stage direction
1003||BOSLEY (CONT'D)|unknown
1004|NATALIE|Goodbye, Angels. Mr. Knox.|speech
1005||(coldly)|unknown
1006|NATALIE|Ms. Wu.|speech
1007||"As Bosley exits the restaurant, Vivian Wu eyes him
carefully. Knox raises a glass to toast the Angels."|stage direction
1008|KNOX|More champagne?|speech
1009||NATALIE|unknown
1010|KNOX|Have to go.   Plans tonight.|speech
1011||ALEX|unknown
1012|KNOX|Me too.|speech
1013||As they get up...|stage direction
1014||(to Dylan)|unknown
1015|KNOX|And you?|speech
1016||"She notices the other Angels staring at her.        She doesn't answer
at first."|stage direction
1017||DYLAN|unknown
1018|KNOX|Um... well...|speech
1019||"Natalie quickly picks up what's going on.        She glances at
Alex, then clears her throat."|stage direction
1020|NATALIE|"Hey Dylan, can we talk to you
for a second?"|speech
1021||"THE LADIES ROOM
Natalie, Alex, and Dylan kibbitz near the sinks."|stage direction
1022|NATALIE (CONT'D)|"There's something going on between
you and Knox. Isn't there?"|speech
1023|DYLAN|"So what, so I like him.   Is that
so wrong?"|speech
1024|NATALIE|Uh, yeah Dylan, it IS.    He's a client.|speech
1025||(CONTINUED)|unknown
1026||"CHARLIE'S ANGELS - 8/18/99                                     60.
CONTINUED:"|stage direction
1027||DYLAN|unknown
1028|NATALIE|WAS a client.    We finished the job.|speech
1029|ALEX|She's got a point.|speech
1030|NATALIE|"What? She doesn't have ANY point, Alex,
I can't believe you're siding with her."|speech
1031|ALEX|"I'm not siding with anyone, but
technically, he is no longer..."|speech
1032|NATALIE|"You know Charlie would NEVER
approve of this."|speech
1033|ALEX|"Oh come on, Charlie wouldn't care. I
think you're just being overly cautious."|speech
1034||DYLAN|unknown
1035|ALEX|Uh, guys?   GUYS!|speech
1036||They turn to look at her.|stage direction
1037|DYLAN (CONT'D)|"I'm a big girl. I make my own
decisions. I'm going out with him."|speech
1038||She walks out of the ladies' room.|stage direction
1039||CUT TO:|unknown
1040||INT. PARKING GARAGE / BEVERLY HILLS - DAY|location
1041||"Bosley hums ""In the Navy"" to himself as he walks through
a parking garage. He's alone in the echo-y garage, and
everything we know about movies tells us This Means Trouble.
BWEEP BWEEP as his alarm shuts off. Just as he's about
to lift the handle, he stops. Looks back over his shoulder.
Did he hear something? He scans the empty garage.         No
one in sight. Must've been his imagination."|stage direction
1042||INT. BOSLEY'S MERCEDES - DAY|location
1043||"Bosley climbs in, shutting the door behind him.        He's
putting the keys in the ignition, when...
A HAND clamps a chloroformed rag over his mouth. It's
the Thin Man. Bosley struggles, but in moments, he's
unconscious.
CHARLIE'S ANGELS - 8/18/99                                61.
OUTSIDE THE CAR
THE THIN MAN stuffs Bosley in the trunk, slams it shut,
revealing..."|stage direction
1044||VIVIAN WU (O.S.)|unknown
1045||Sweet dreams.|location
1046||"Vivian Wu, standing beside the Thin Man. She's holding
the case Bosley refused to give her before."|stage direction
1047||THE THIN MAN|unknown
1048||"So, now we have the transmitter, what
do we do with fat boy? Dirt nap time?"|location
1049||VIVIAN WU|unknown
1050||"NO! Not until I've got the
information I need. We'll take
him to the compound, hold him there."|location
1051||(beat)|unknown
1052||"In the meantime, we've got to tie
up some loose ends."|location
1053||THIN MAN|unknown
1054||"Whenever you say something like
that, it means more work for me."|location
1055||"VIVIAN WU
(ignoring him)"|unknown
1056||"The Angels will figure out they
were duped. We can't afford them
jeopardizing our plans."|location
1057||THE THIN MAN|unknown
1058||Here it comes...|location
1059||"VIVIAN WU
(coldly)"|unknown
1060||We have to Kill Charlie's Angels.|location
1061||The Thin Man sighs, whips out his cell phone.|stage direction
1062||THE THIN MAN|unknown
1063||Guess I'll cancel my weekend plans.|location
1064||And speaking of weekend plans...|stage direction
1065||CUT TO:|unknown
1066||EXT. ITALIAN STREET - NIGHT|location
1067||"Jason and Alex are walking down a beautiful, tree-lined
cobblestone street, holding hands. The buildings and
outdoor cafes are reminiscent of a quaint, vaguely
European town."|stage direction
1068||(CONTINUED)|unknown
1069||"CHARLIE'S ANGELS - 8/18/99                                   62.
CONTINUED:"|stage direction
1070|JASON|"Alex, I can't tell you how happy I
am you came."|speech
1071||ALEX|unknown
1072|JASON|Me too.|speech
1073|JASON|"No, I mean, it's weird. It's
weirding me out how happy I am when
you're around. Am I sick or something?"|speech
1074||"ALEX
(smiling)"|unknown
1075|JASON|Got me.|speech
1076|JASON|"The only bummer is, I start to
jones when you're not around.
What the hell am I gonna do this
weekend, if you're not with me?"|speech
1077|ALEX|"We'll get you some sedatives.
You'll be fine."|speech
1078||"He stops, takes her in his arms. With the moonlight
shining down, it's very romantic. They kiss. Then..."|stage direction
1079||JASON|unknown
1080|ALEX|Hey.   Wait a second.   Come with me!|speech
1081||ALEX|unknown
1082|ALEX|Come with you?|speech
1083|JASON|"Miami, on the Sony Jet. I've got
two tickets to the Final Four."|speech
1084|ALEX|Jason, I don't...|speech
1085|JASON|"Wait, before you say no, let me just
say something, okay? I'm sick of how
little we see each other. I'm sick of
stealing a day here, or a week there."|speech
1086|ALEX|"It's my job, Jason. I can't
explain it, but I have to be on
call, all the time, and..."|speech
1087|JASON|What if I changed all that?|speech
1088||(CONTINUED)|unknown
1089||"CHARLIE'S ANGELS - 8/18/99                                  63.
CONTINUED:"|stage direction
1090|JASON (CONT'D)|"What if I told you to quit your
job, and come live with me. What
I'm saying, Alex, is that I want
you to..."|speech
1091||BLAM!    BLAM!   Gunshots ring out!|stage direction
1092||ALEX|unknown
1093|JASON (CONT'D)|Gunfire!   Get down!|speech
1094||"Alex, in Angels mode, immediately throws him to the
ground and covers him. She feels something wet, looks
down to see Jason's chest, covered in blood."|stage direction
1095|ALEX (CONT'D)|My God, you're hit. You're...|speech
1096|JASON|Fine.  I'm fine.|speech
1097||(he laughs)|unknown
1098|JASON|They're squibs, it's fake.   See?|speech
1099||"He wipes off a little, puts it on her tongue.     Finally
convinced, she almost lets herself laugh.
REVEAL
that we are in a soundstage, the cobblestones street is
just a set. The gunfire was coming from some effects
guys, who are test firing guns for the upcoming action
scene just outside the soundstage, visible through the
open loading door."|stage direction
1100|JASON (CONT'D)|"Fake guns, too. They're just
setting up for the next scene."|speech
1101||He helps her up.|stage direction
1102|ALEX|Sorry about that, I...|speech
1103||(smiling)|unknown
1104|JASON|"God, I loved that. The way you
yelled and everything? Baby, you
been watching too many movies."|speech
1105||(he kisses her on the nose)|unknown
1106|JASON|"Alright, I gotta go reset these.
DON'T GO ANYWHERE. I want to
finish this conversation."|speech
1107||"As he walks out of the soundstage, Alex is left behind,
alone. She cleans herself off, shaking her head at her
own paranoia."|stage direction
1108||(CONTINUED)|unknown
1109||"CHARLIE'S ANGELS - 8/18/99                               64.
CONTINUED:"|stage direction
1110||ALEX|unknown
1111|JASON|Nice, Alex.   Real nice.|speech
1112||"THIPP!
A wall next to her sprays a cloud of plaster.     Alex looks
at the hole. That's strange.
THIP, THIP!
Two more little explosions, these barely missing her face."|stage direction
1113|ALEX (CONT'D)|"Hey, is someone firing more squibs
or..."|speech
