|character|text|type
0||by|unknown
1||Ed Solomon and John August|stage direction
2||"current revisions by
Zak Penn
EARLY DRAFT
August 11, 1999"|unknown
3||"CHARLIE'S ANGELS - 8/18/99
FADE IN:"|stage direction
4||EXT. THE BIG BLUE SKY - DAY|location
5||A VIRGIN AIR 747 bursts through the clouds and levels off.|stage direction
6||INT. VIRGIN AIR 747 - DAY|location
7||"We move through the FIRST CLASS CABIN. It's the regular
mix of first class people: OLD MONEY in Gucci enjoying
freshly baked cookies, a MILLIONAIRE in jeans and a T-
shirt, BUSINESS PEOPLE relaxing after a tough day, and...
...a very nervous MAN.
Shifty-eyed. Alone in an aisle seat, the emergency row.
We hold on him for a moment, but not for too long. Then
we continue moving into --
THE COACH SECTION
Stopping at the lavatory, the ""OCCUPIED"" sign switches to
""VACANT"" and...
JAMES EARL JONES
(or actually, a James Earl Jones type, who for ease of
description, we'll simply refer to as James Earl Jones)
steps out of the restroom, in full African regalia:
multi-colored dashiki, mufti (it's a kind of hat), the
works. He heads up the aisle towards --
THE FIRST CLASS CABIN
Where he is stopped by a --"|stage direction
8||"FLIGHT ATTENDANT
I'm sorry, sir. This cabin is
restricted to first cl..."|unknown
9||Mr. Jones now removes a FIRST CLASS TICKET.|stage direction
10||"JAMES EARL JONES
Is this what you're looking for?"|unknown
11||"She looks at it -- a little confused as to why he's just
handing it to her now -- but then she nods. As he passes:"|stage direction
12||"FLIGHT ATTENDANT
Oh, I'm sorry. Please. Is there
anything I can get you?
JAMES EARL JONES
Scotch, blended. Straight."|unknown
13||"He continues into the first class cabin and toward --
CHARLIE'S ANGELS - 8/18/99                              2.
THE FIRST CLASS EMERGENCY ROOM
Where he slides in past the nervous, shifty-eyed man (his
name is PASQUAL) and sits by the window.
After a moment, Pasqual quietly clears his throat and
leans, slightly, towards Jones."|stage direction
14||"PASQUAL
(tentatively)"|unknown
15||They say birds can't fly this high.|location
16||JAMES EARL JONES|unknown
17||They say only angels can.|location
18||"Now Pasqual nods. Nervously begins to remove something
from his pocket when they are interrupted by --"|stage direction
19||FLIGHT ATTENDANT|unknown
20||Shall I pour your scotch?|location
21||JAMES EARL JONES|unknown
22||No -- I'll take the bottle. Thank you.|location
23||"She hands him the airplane-sized bottle -- he waves off
the glass. She shrugs, leaving...
Pasqual to resume what he was doing. Slowly, he removes
a roll of Certs. He looks to Jones -- ""Well? What about
your end of the bargain?""
From within his dashiki, Jones pulls out a black velvet
pouch. He hands it to Pasqual, who opens it to find
diamonds. A helluva lot of diamonds. Pasqual smiles.
He hands the roll of Certs to Jones. It's not breath
candy at all, but a tiny roll of explosives, with a tiny,
high-tech triggering mechanism."|stage direction
24||JAMES EARL JONES|unknown
25||"Ah, c-5. The most dangerous
explosive material ever invented.
Hard to believe that this little
contraption could blow up ten city
blocks."|location
26||PASQUAL|unknown
27||Be careful with it, huh?|location
28||"Both men smile.   Pasqual's very relieved that the deal is
done.
Then suddenly, the lights blink out.
Pasqual looks around, nervous. But it's just the in-
flight movie beginning. Clouds, and a woman holding a
torch."|stage direction
29||(CONTINUED)|unknown
30||"CHARLIE'S ANGELS - 8/18/99                              3.
CONTINUED:
Columbia Pictures presents... David Spade and Adam
Sandler in ""BOSOM BUDDIES: THE MOVIE.""
James Earl Jones shakes his head, rolls his eyes."|stage direction
31|JAMES EARL JONES|Another movie from an old TV show?|speech
32|PASQUAL|Well, what're you gonna do?|speech
33||JAMES EARL JONES|unknown
34|PASQUAL|Walk out.|speech
35|PASQUAL|That's very funny.|speech
36||But James Earl Jones is dead serious.|stage direction
37||JAMES EARL JONES|unknown
38|PASQUAL|No.   It isn't.|speech
39||"Jones grabs Pascal in a headlock and turns toward the
back of the plane, shouting:"|stage direction
40||JAMES EARL JONES (CONT'D)|unknown
41|PASQUAL|EVERYONE!   FASTEN YOUR SEAT BELTS!|speech
42||"Now Jones does the unthinkable. Holding Pasqual tight,
he yanks open the emergency door release.
With a RUSH, the cabin decompresses.
Panic erupts as air, paper and everything not belted in
screams out of the open door, including --"|stage direction
43||EXT. THE BIG BLUE SKY - FALLING AWAY FROM THE 747 - DAY|location
44||"-- James Earl Jones, still holding Pasqual in a bear hug.
They plummet, wind violently tearing at them. Pasqual's
frantic SCREAMS doppler quite nicely.
DROPPING WITH THEM
They continue to fall, gaining speed. Pasqual is
terrified, but Jones doesn't seem worried. In fact,
casually, he glances at his watch, and then looks --
FAR BELOW THEM - ACROSS THE SKY
At the tiny black speck gradually grows larger in the
distance...
CHARLIE'S ANGELS - 8/18/99                               4.
CLOSER - ON THAT BLACK SPECK
It's a jet helicopter. Its door opens, and now a SKYDIVER leaps
out, helmet down, arms back, streaking across the
sky in aerodynamic perfection, heading directly towards
JONES AND PASQUAL
who are still plummeting toward the earth at terminal
velocity. Jones begins to let go of Pasqual, who SCREAMS
and tries to clutch onto him, desperate."|stage direction
45||"JAMES EARL JONES
(over the rushing wind)"|unknown
46||"PULL YOURSELF TOGETHER. WE HAVE
COMPANY."|location
47||PASQUAL|unknown
48||WHAT?|location
49||"Suddenly -- WHOMMPPPH!! -- the skydiver spread-eagles,
stopping the wild dive directly behind Pasqual, and
immediately binds his arms and straps a parachute on him.
All three are still free-falling.
James Earl Jones nods at the Skydiver who, even under the
helmet and goggles, is clearly a beautiful woman.
Meet ALEXANDRA ""ALEX"" MUNDAY, one of Charlie's Angels.
She's a sultry bombshell -- a classic femme fatale --
only she's playing for the good guys.
She gives James Earl Jones a wink, then jerks Pasqual's
rip cord and -- WHOOMPH. Pasqual's chute deploys. He
flies upward, leaving --
Alex and James Earl Jones, both still falling.    Below the
ocean screams up at them. Not much time left.
James Earl Jones pulls his belt -- and his mufti flies
up. It's actually a tiny drogue chute, deploying his
entire dashiki. His outfit hides a parachute rig.
Alex pulls her own rip cord and -- WHOOMPH -- her chute
unfurls, and now...
Alex and James Earl Jones gently float towards --"|stage direction
50||EXT. THE BIG BLUE SEA - DAY|location
51||"A cigarette boat floats through the choppy water, a
gorgeous young woman expertly throttling up the growling
V-8.
Say hello to NATALIE THOMPSON, Charlie's second angel.
At a glance, she's the brainy-shy girl next door."|stage direction
52||(CONTINUED)|unknown
53||"CHARLIE'S ANGELS - 8/18/99                                 5.
CONTINUED:
But put her behind the wheel of any vehicle, and she's
unstoppable.
Natalie glances ahead, maneuvering the boat perfectly under
Alex, who drops on deck. Alex gathers her chute, then whips off
her helmet to give her cascading mane a wild shake.
Here comes James Earl Jones. Natalie guns the boat
underneath...a perfect catch. Alex helps him with his
dashiki-chute, and then all three look up...
Here comes Pasqual. Natalie whips the boat around,
catching him as he helplessly drops into the seats, still
bound, still scared out of his wits. He gapes wild-eyed
at the two Angels, then whirls on James Earl Jones."|stage direction
54|PASQUAL|You crazy bastard!|speech
55|JAMES EARL JONES|I think you mean crazy bitch.|speech
56||"With that, James Earl Jones reaches up and pulls his face
off. Latex rips free, and standing there (without his
dashiki, James Earl Jones has a great figure) is...
... stunningly beautiful DYLAN SANDERS, angel number
three. She's the wild one.
Pasqual's jaw drops as Dylan shakes her hair free, then
reaches in her mouth --"|stage direction
57||(still with James Earl Jones' voice)|unknown
58|DYLAN|Don't need this anymore.|speech
59||-- and extracts a voice-modifying chip.|stage direction
60||(now in her real voice)|unknown
61|DYLAN (CONT'D)|But I sure could use this.|speech
62||"And she pulls from her pocket the airplane-size bottle of
Johnnie Walker Black. She twists it open and downs it."|stage direction
63|DYLAN (CONT'D)|Damn I hate to fly.|speech
64||EXT. BEACH DOCK - DAY|location
65||"Now, MEN IN ""FBI"" WINDBREAKERS haul Pasqual away, two of
them carefully handling the certs-explosive. A harmless
fellow pushes his way past them and onto the dock.
It's JOHN BOSLEY, Charlie's lieutenant."|stage direction
66||(CONTINUED)|unknown
67||"CHARLIE'S ANGELS - 8/18/99                                 6.
CONTINUED:
He reaches the boat, which Natalie ties off while Alex
and Dylan neatly fold their parachutes."|stage direction
68|BOSLEY|"Well, Angels, the experimental
explosives are back in the hands of
the government, and the free world
can breathe just a lit-tle bit
easier tonight, thanks to you three."|speech
69||"Alex, Natalie and Dylan stroll from the dock onto the sand,
each starting to unzip/unbutton/unsnap their action gear and
hand it to Bosley as they continue walking."|stage direction
70|NATALIE|And thanks to you, too, Bos.|speech
71|ALEX|"We couldn't have redirected the
flight path without your help."|speech
72||"Bosley puffs, proud. He speaks over the ever-growing
pile of chutes, body suits, goggles, the dashiki..."|stage direction
73|BOSLEY|"Nothing a little teamwork can't do.
At least, that's what Charlie's
always telling us, right ladies?"|speech
74|DYLAN|Charlie will be joining us, won't he?|speech
75|BOSLEY|"He sends his regrets. But he
wanted you to know that dinner is
on him, so feel free to celebrate."|speech
76||"By now, the Angels have stripped off all of their
equipment, revealing eye-popping evening gowns."|stage direction
77|ALEX|If it's on Charlie, we will.|speech
78||"The Angels share a laugh as they arrive in their sassy
duds at a private beach club, where a WAITER greets them
with a tray of champagne flutes.
They each take a glass, turn to each other and raise
them. Another Angels Mystery... Case Closed.
FREEZE FRAME.    And the TITLE SEQUENCE BEGINS..."|stage direction
79|CHARLIE (V.O.)|Once upon a time...|speech
80||(CONTINUED)|unknown
81||"CHARLIE'S ANGELS - 8/18/99                               7.
CONTINUED:
THREE FOURTH GRADE SCHOOL PHOTOS FILL THE FRAME, side by
side by side. These are three very different girls.
NATALIE, with a page-boy cut and wearing a Catholic
schoolgirl's uniform, sports glasses and braces; a bit
awkward and gangly, even shy.
ALEX, formally dressed with perfect pig-tails, is
sophisticated and self-possessed; a class act, even at ten.
DYLAN, wild blond hair and faded T-shirt, has a jaded,
street-wise smirk; even at this young age, her isolation
and disillusionment are masked by seeming confidence."|stage direction
82|CHARLIE (CONT'D)|"... there were three very
different little girls."|speech
83||"The triptych remains on screen.    Now it shifts into:
VIDEO TAPE - THE THREE GIRLS (STILL IN TRIPTYCH)
Now TEENAGERS, on HOME VIDEO.
NATALIE, working the A-V equipment at school, hides her
face in embarrassment, uncomfortable with the camera.
FREEZE.
ALEX, in riding gear, accepting her steeple-chase trophy.
She knows where to look for the camera. FREEZE.
DYLAN, smoking with her tough-girl friends in the girls'
room of her reform school, is caught on camera. She
flips it off. FREEZE."|stage direction
84|CHARLIE (CONT'D)|"Who grew up into three very
different women."|speech
85||"TRIPTYCH CONTINUES
They're all WOMEN now, in their early twenties.
NATALIE, a research fellow at MIT (and beautiful, but not
flaunting it) demonstrates a chess-playing computer
program to a room of impressed advisors.
ALEX, valedictorian at Oxford, passionately delivers her
address to a crowd of rapt students, faculty and parents.
DYLAN, in leather and a helmet, steps off a Harley. She
sees a punk with a mohawk slapping around his girlfriend.
She decks him, then enters the back door of a seedy punk bar."|stage direction
86|CHARLIE (CONT'D)|With three things in common...|speech
87||"CHARLIE'S ANGELS - 8/18/99                              8.
TRIPTYCH ENDS
With photographs again. The women, as they are now:
Natalie, Alex, Dylan. All gorgeous, all self-assured."|stage direction
88||"CHARLIE (CONT'D)
They're brilliant. They're
beautiful. And they work for me."|unknown
89||Now, FIREBALL EXPLOSIONS completely fill the screen.|stage direction
90||"CHARLIE (CONT'D)
My name is Charlie."|unknown
91||ANGEL SILHOUETTES appear, in flames.    New MUSIC kicks in.|stage direction
92||"""CHARLIE'S ANGELS"""|unknown
93||"...And a new title sequence takes over:
VARIOUS SHOTS:   MONTAGE (OVER MUSIC)
Credits continue as we watch the Angels in action (from,
presumably, previous adventures...)
-- A microscope-peering Natalie cuts a ruby, drops it in
a laser housing, shoots a red beam.
--   Dylan, wielding kendo sticks, spars with two Yakzuza.
-- Alex side-kicks two baddies, spins, drops a third.
ZOOM BACK: she is at the Parthenon.
-- A motocross race. Natalie digs in for the finish,
attacking the last jump with gusto.
-- Dylan, in traditional Islamic robes, finds a secret
switch. She pushes back a bookcase to reveal secret stairs.
-- At a ballroom dance competition, Alex wows the crowd
while keeping her eye on a nefarious couple.
-- Bosley, as ""Luka, the Bad Ass Pimp,"" bitch-slaps a
couple of ""ho's"" -- actually Dylan and Alex -- then winks
at them as unsuspecting drug dealers back off, scared.
--   Natalie bites into a messy hot-dog, has to just laugh.
-- The three angels elbow their way through a roller-
derby match.
-- In orange prison jumpsuits, Alex and Dylan work in
female chain-gang.
-- Window-washer Natalie peers into a skyscraper office,
surreptitiously photographing the meeting inside."|stage direction
94||(CONTINUED)|unknown
95||"CHARLIE'S ANGELS - 8/18/99                              9.
CONTINUED:
-- On an Italian street, the three Angels buy a paper,
grin at the headline, ""Mystery Women Save European
Union."" As they high-five, Dylan's cone of gelato drops
to the sidewalk. The Angels look at it, look at each
other...and just have to laugh.
TITLE SEQUENCE ENDS.
OVER BLACK we hear a DIGITAL RING..."|stage direction
96||INT. TINY HOUSEBOAT BEDROOM - DAY|location
97||"CLOSE ON Dylan as she wakes up in a tangle of ugly
sheets, disoriented and a bit hungover. She hears the
RINGING -- where is it coming from? Why is it drilling
into her head?
Checking the floor, she finds her jeans. Digs in the
pocket to find her cell phone. Answering..."|stage direction
98||DYLAN|unknown
99|CHARLIE (CONT'D)|Hi.|speech
100||(recognizing voice)|unknown
101|CHARLIE (CONT'D)|Hi.   Okay. I'll be right in.|speech
102||"She clicks the phone off, then starts looking around.
Where the fuck is she?
From the next room, we hear a male VOICE singing ""My
Sharona."" She checks under the sheets. Oh God. She's
naked. She pulls her shirt from the floor, puts it on.
Closing her eyes, she prays..."|stage direction
103||DYLAN (CONT'D)|unknown
104|CHARLIE (CONT'D)|Not him.   Not him, not him, not him.|speech
105|THE VOICE|'Morning starfish.|speech
106||DYLAN|unknown
107|THE VOICE|Oh God no.|speech
108||At the door, skinny shirtless CHAD holds a skillet of eggs.|stage direction
109||CHAD|unknown
110|THE VOICE|Hungry?|speech
111||EXT. CHAD'S CRAPPY BOAT - DAY|location
112||"Blinded by the daylight, Dylan emerges from below,
relieved to see the boat is docked. Chad follows her
outside, pleading..."|stage direction
113||CHAD|unknown
114||"C'mon Dylan. You + Me. It's
magic."|location
115||(CONTINUED)|unknown
116||"CHARLIE'S ANGELS - 8/18/99                                   10.
CONTINUED:"|stage direction
117|DYLAN|"It's a mistake. A horrible,
horrible mistake."|speech
118||She jumps onto the dock.|stage direction
119|CHAD|"Then how come we keep getting back
together? It's fate."|speech
120||Dylan just keeps walking.|stage direction
121||(yelling after)|unknown
122|CHAD|Is it because I live on a boat?|speech
123||WHIP TO:|unknown
124||"CLOSEUP - MAN'S FACE
This is Jason Gibbons, handsome, action-movie stud.       He's
concentrating fiercely."|stage direction
125|ALEX (O.S.)|"If you don't defuse this bomb,
Logan, L.A.'s going to be a new
underwater attraction."|speech
126||A bead of sweat drops down Jason's face.|stage direction
127|JASON|"Get off my back, Sanchez.   I know
what I'm doing."|speech
128||REVEAL ALEX, her face right next to his.|stage direction
129||ALEX|unknown
130|JASON|Which wire?   The red one or the blue one?|speech
131|JASON|"Marix has a thing for red. Red
cars, red boats, red-headed hookers."|speech
132|ALEX|So the red one.|speech
133|JASON|That's why I'm gonna say blue.|speech
134||"He makes a ""snip"" motion.     They both breathe a sigh of relief."|stage direction
135|ALEX|You saved the world again, Logan.|speech
136||She leans forward, closer and closer, right in his face.|stage direction
137||(CONTINUED)|unknown
138||"CHARLIE'S ANGELS - 8/18/99                                      11.
CONTINUED:"|stage direction
139||JASON|unknown
140|ALEX|That's my job.|speech
141||"Alex kisses him. It's a damn good kiss.          Jason's into
it, but pulls away for a second."|stage direction
142|JASON (CONT'D)|"I don't think Sanchez would kiss
me. He's a forty-year-old man."|speech
143||"Pull back to reveal...
ALEX and JASON are in a fully macked out Airstream,
sitting on a bed, leaning over an open screenplay. We
can tell from our surroundings that Jason is a big deal
Hollywood action star, and this trailer is his home away
from home.
She licks the bridge of his nose, then kisses him again."|stage direction
144|ALEX|Let's have it rewritten.|speech
145||"As she smiLes, a cell phone RINGS. Both Alex and Jason
reach for their phones. It's hers."|stage direction
146||ALEX (CONT'D)|unknown
147|ALEX|Hello?|speech
148||EXT. JASON'S AIRSTREAM - DAY|location
149||"Jason stands in the doorway in his robe as Alex tosses
her stuff in the back of a very excellent car."|stage direction
150|JASON|So when you coming back?|speech
151||ALEX|unknown
152|JASON|"Not sure.   Whenever I can.      I'll
call you."|speech
153|JASON|Oh, great, that's helpful.|speech
154||(watching her prepare to go)|unknown
155|JASON|"I don't get it, what kind of
executive assistant is on 24 hour call?"|speech
156|ALEX|A very good one.|speech
157|JASON|You ask me, your boss is an asshole.|speech
158||(beat)|unknown
159|JASON|"When do I get to meet this Charlie
guy, anyway?"|speech
160||(CONTINUED)|unknown
161||"CHARLIE'S ANGELS - 8/18/99                                  12.
CONTINUED:"|stage direction
162|ALEX|Charlie's not very social.|speech
163|JASON|"Yeah, well I think you should
quit."|speech
164|ALEX|Charlie needs me.|speech
165||JASON|unknown
166|ALEX|I need you.|speech
167||"Alex looks back -- that was more personally revealing
than she expected.
A P.A. comes up next to Jason."|stage direction
168||P.A.|unknown
169|ALEX|"Mr. Gibbons?   We're ready for you
on the set."|speech
170||Jason nods, then back to Alex.|stage direction
171|JASON|I gotta go save the world.|speech
172||Alex smiles at the irony of that.|stage direction
173||ALEX|unknown
174|JASON|My hero.|speech
175||She blows him a kiss and speeds off.|stage direction
176||EXT. BEACH APARTMENT WALKWAY - DAY|location
177||"Natalie KNOCKS on the door to 113.      A beat later, the
door swings open to reveal BOB.
Natalie SCREAMS in astonishment."|stage direction
178||"BOB
(freaked)"|unknown
179|JASON|What!   Natalie, what?|speech
180|NATALIE|I thought you were dead.|speech
181||She pushes past him.|stage direction
182||INT. BOB'S APARTMENT - DAY|location
183||"Natalie makes a beeline for his keys on the table.
Starts taking one key off the ring."|stage direction
184||(CONTINUED)|unknown
185||"CHARLIE'S ANGELS - 8/18/99                                     13.
CONTINUED:"|stage direction
186|NATALIE|"I thought the police might be here.
Or your neighbors. Or your parents,
here to identify your remains."|speech
187||"He has no idea what she's talking about.         She goes to
THE BATHROOM,
where she retrieves a toothbrush."|stage direction
188|NATALIE (CONT'D)|"I saw your car was here, so I knew
you weren't carjacked and brutally
beaten, left to die on the highway."|speech
189||Her cell phone RINGS.|stage direction
190||BOB|unknown
191|NATALIE (CONT'D)|I'm not...|speech
192||She holds up a finger, just a sec.|stage direction
193||(answering phone)|unknown
194|NATALIE|Hello. Absolutely. I'll be right in.|speech
195||She hangs up.|stage direction
196||BOB|unknown
197|NATALIE|I'm not dead.|speech
198|NATALIE|"But you can understand why I
thought so. You missed our date
last night. You didn't call or
anything. I was just sitting
there by myself."|speech
199||ANGLE ON Bob.    What can he say?|stage direction
200|NATALIE (CONT'D)|"I can tolerate a lot, but punctuality
and attendance, those rank very high
in my list of dating priorities."|speech
201||BOB|unknown
202|NATALIE (CONT'D)|I can explain.|speech
203||Behind Natalie, a door opens.          A topless BLONDE looks out.|stage direction
204||BLONDE|unknown
205|NATALIE (CONT'D)|Bobby?|speech
206||"BOB
(to Natalie)"|unknown
207|NATALIE (CONT'D)|I can explain.|speech
208||(CONTINUED)|unknown
209||"CHARLIE'S ANGELS - 8/18/99                                   14.
CONTINUED:
Behind the Blonde, ISAAC HAYES looks out.      He's also topless."|stage direction
210||ISAAC HAYES|unknown
211|NATALIE (CONT'D)|Bobby?|speech
212||BOB|unknown
213|NATALIE (CONT'D)|Damn.|speech
214||Beyond weirded out, Natalie just leaves.|stage direction
215||CUT TO:|unknown
216||EXT. SUNSET BOULEVARD - DAY|location
217||"Passing cars reveal the one and only CHARLES TOWNSEND
DETECTIVE AGENCY. That's what the sign says."|stage direction
218||INT. CHARLES TOWNSEND DETECTIVE AGENCY - DAY|location
219||"In foreground, a blender WHIRRS. Still hungover, Dylan
cringes from the sound. Natalie pours out three fruit
smoothies for the angels."|stage direction
220|NATALIE|"Just once, I want to date a normal
man, without a wife, or a drug
addiction, or bondage issues."|speech
221||DYLAN|unknown
222|NATALIE|Here here.|speech
223||She and Natalie toast.       Alex is only half-in. Off their look...|stage direction
224||ALEX|unknown
225|NATALIE|What?    I've got a great relationship.|speech
226|DYLAN|"Your boyfriend thinks you're a
secretary."|speech
227|ALEX|That way, he doesn't ask about my work.|speech
228||Bosley walks in with a folder.       He eyes their drinks.|stage direction
229|NATALIE|"I'm sorry, Bosley. I only made
enough for three."|speech
230|BOSLEY|No, that's...That's okay.|speech
231||"It's not okay, but that's our Bosley. He takes his seat
behind his desk. Now we see the biggest addition to the
office, the Angels Wall of Fame."|stage direction
232||(CONTINUED)|unknown
233||"CHARLIE'S ANGELS - 8/18/99                              15.
CONTINUED:
Pictures of every angel, from the original cast members to some
fictitious ones we've never seen before. The rest of the office
is exactly as we remember it, right down to the
SPEAKERPHONE."|stage direction
234|CHARLIE'S VOICE|Good morning, Angels.|speech
235||(sing-songy)|unknown
236|ANGELS|Good morning, Charlie.|speech
237||The angels take a seat on couches and chairs.|stage direction
238|CHARLIE'S VOICE|"I'm sorry to call you back from
vacation, but we've got a case
that just can't wait."|speech
239||"As he's talking, the far blinds close themselves. A white
screen lowers from the ceiling, ready to catch the
projected VIDEO:
A handsome MAN IN HIS 20'S in a CNN profile. The sound is
muted, be we see him attending a gala; in an office surrounded
by computers; rock climbing; smiling in a sit-down interview."|stage direction
240|CHARLIE'S VOICE (CONT'D)|Meet Eric Knox.|speech
241|NATALIE|He's cute.|speech
242|BOSLEY|He is.|speech
243||Oops, did Bosley say that out loud?|stage direction
244|CHARLIE'S VOICE|"He's 28-years old, and in three days
he'll be a billionaire, when his
company, Knox Technologies, goes public."|speech
245|DYLAN|It's good to be him.|speech
246|ALEX|So what's the catch?|speech
247|CHARLIE'S VOICE|"Last night, Knox was kidnapped
from his own office."|speech
248||"ON VIDEO: Surveillance camera footage of a parking
garage. Two MEN IN HOODS shove Knox into black car."|stage direction
249||(CONTINUED)|unknown
250||"CHARLIE'S ANGELS - 8/18/99                               16.
CONTINUED:"|stage direction
251|NATALIE|Any ransom?|speech
252|CHARLIE'S VOICE|"No one's heard a thing from the
kidnappers."|speech
253|A WOMAN'S VOICE|"They don't want money. They just
want to sink our company."|speech
254||A striking WOMAN IN A SUIT stands in the doorway.|stage direction
255|CHARLIE'S VOICE|"Angels, meet Vivian Wu, vice
president of finance for Knox
Technologies. She's hired us to
find Knox."|speech
256||(entering)|unknown
257|VIVIAN WU|"The initial public offering is in
three days. If we don't get Mr.
Knox back, or if word gets out
that he's missing, the company
stands to lose a billion dollars."|speech
258||She seems to direct this next sentence right to Natalie.|stage direction
259|VIVIAN WU (CONT'D)|We need your help.|speech
260|ALEX|Charlie, where do we start?|speech
261|CHARLIE'S VOICE|"Alex, I want you and Bosley to
stake out Roger Corwin."|speech
262||"Bosley is excited to hear his name mentioned.
ON VIDEO: Roger Corwin. He's an unpleasant-looking man,
who's even nastier when he tries to smile. We see logos
for his company, Red Star Systems"|stage direction
