|character|text|type|character_clean|gender
0||PAUL|unknown||
1||Written by|stage direction||
2||"Simon Pegg & Nick Frost
EXT. FARMHOUSE - NIGHT"|location||
3|unknown|"Caption: Bethlehem Creek, Wyoming 10:19pm 28/07/47
The air is filled with the sounds of a warm, summer night. A
light comes on in a FARMHOUSE window. The door opens, a small
dog and a young girl emerge."|speech|unknown|?
4|GIRL|"Go on now Paul, don't be long.
The dog trots out across the property. It stops to scratch.
The sounds of night cease. The dog stops scratching, sniffing
the air, cocking its head, sensing something. We hear a low
humming sounds. The dog looks up. We see a soft orange glow
reflected in its eyes. The dog whimpers
Back at the farmhouse, a deep, dull thud shakes the ground,
bringing the small girl back out onto the veranda. An orange
glow pulsates somewhere out in the darkness."|speech|GIRL|M
5|GIRL|"Paul... Paul?
The girl draws near, illuminated by the orange glow."|speech|GIRL|M
6|GIRL|"Paul?!
The glow fades again.
MUSIC: ""The Boy In The Bubble""ù by Paul Simon."|speech|GIRL|M
7||EXT. SAN DIEGO STREET. PRESENT - DAY|location||
8|TITLE: PAUL|"GRAHAM WILLY (32) and CLIVE GOLLINGS (33) stand in the
blazing San Diego sunshine, waiting to cross the road. GRAHAM
is thin but his clothes seem too small. He has long greasy
hair, buck teeth and thick glasses. CLIVE is bigger and wears
a long black leather coat, Red Dwarf T-shirt and boots. His
hair is densely curly and shaped like a pyramid.
Four people dressed as BORG from Star Trek pass by. GRAHAM
and CLIVE shrug derisively. The cross-walk beeps.
As the music kicks in, GRAHAM and CLIVE set off across the
road towards the San Diego Convention Centre. They make their
way through a throng of costumed Comic-Con attendees."|speech|TITLE: PAUL|?
9||INT. CONVENTION CENTRE. CONVENTION FLOOR - LATER|location||
10|TITLE: PAUL|"GRAHAM and CLIVE are at a fantasy weapons stand. CLIVE is
brandishing a KATANA SWORD. He test the balance, the weight,
the sharpness. He closes one eye and looks down the length of
the blade. He nods appreciatively.
2."|speech|TITLE: PAUL|?
11|CLIVE|Beautiful piece.|speech|CLIVE|M
12|VENDER|"Damn straight. Practical
performance. 100% Japanese, folded
steel. Real hero shit."|speech|VENDER|?
13|CLIVE|How much?|speech|CLIVE|M
14|VENDER|"$1,349.99.
CLIVE nods, puts the sword down and walks away."|speech|VENDER|?
15|GRAHAM|Aren't you gonna get it?|speech|GRAHAM|M
16|CLIVE|No, it's rubbish.|speech|CLIVE|M
17||INT. CONVENTION CENTRE. SIGNING PAVILLION - DAY|location||
18|CLIVE|"We see them on an escalator, walking down a wide corridor,
passing people in a variety of costumes. Finally, they join a
line of people waiting to meet the actor, MICHAEL BIEHN."|speech|CLIVE|M
19|GRAHAM|What are you going to ask?|speech|GRAHAM|M
20|CLIVE|"Do you feel that the killing of
Hicks and Newt in Alien 3,
invalidates Ripley's struggle at
the closed of the previous
installment?"|speech|CLIVE|M
21|GRAHAM|I was going to ask that!|speech|GRAHAM|M
22|"CLIVE
(IN KLINGON)"|Tough tits four eyes.|speech|CLIVE|M
23|SECURITY|"Alright, next!
Suddenly nervous, GRAHAM approaches. MICHAEL BIEHN is signing
pictures. He is pleasant, if business like."|speech|SECURITY|?
24|MICHAEL BIEHN|Hey there. Who's it to?|speech|MICHAEL BIEHN|M
25|GRAHAM|"Graham.
3."|speech|GRAHAM|M
26|MICHAEL BIEHN|Graham.|speech|MICHAEL BIEHN|M
27|GRAHAM|Uh... are you... did you?|speech|GRAHAM|M
28|MICHAEL BIEHN|"There you go.
SECURITY moves GRAHAM on. CLIVE approaches."|speech|MICHAEL BIEHN|M
29|MICHAEL BIEHN|Hey there. Who's it to?|speech|MICHAEL BIEHN|M
30|CLIVE|Clive.|speech|CLIVE|M
31|MICHAEL BIEHN|Clive.|speech|MICHAEL BIEHN|M
32|CLIVE|Uh... are you... did you?|speech|CLIVE|M
33|MICHAEL BIEHN|"There you go.
SECURITY moves CLIVE on. CLIVE scrambles for his camera."|speech|MICHAEL BIEHN|M
34|CLIVE|I... I need to photograph him.|speech|CLIVE|M
35|SECURITY|"You can take it from there.
CLIVE and GRAHAM huddle together and try to position
themselves with MICHAEL BIEHN in the background. CLIVE takes
the shot. We see a frozen image of CLIVE and GRAHAM, with
MICHAEL BIEHN barely visible in the background. The pair move
off, looking at their spoils."|speech|SECURITY|?
36|"GRAHAM/CLIVE
(HIGH FIVING)"|YES!|speech|GRAHAM/CLIVE|?
37|GRAHAM|"That was amazing. I was actually a
bit nervous."|speech|GRAHAM|M
38|CLIVE|Really? I wasn't.|speech|CLIVE|M
39|GRAHAM|Good egg, wasn't he?|speech|GRAHAM|M
40|CLIVE|"Yes, very unaffected. Damn, I
forgot to give him my card.
CLIVE points at SECURITY.
4."|speech|CLIVE|M
41|GRAHAM|Give it to Colossus.|speech|GRAHAM|M
42|CLIVE|Nah. Hey, Rosario Dawson's here!|speech|CLIVE|M
43|GRAHAM|She NEEDS to call me.|speech|GRAHAM|M
44||INT. CONVENTION CENTRE. SIGNING PAVILLION - LATER|location||
45|GRAHAM|"GRAHAM and CLIVE sit at a table fiddling nervously with pens.
On either side of them are stacks of their new book; JELVA -
ALIEN QUEEN OF THE VARVAK. A banner hangs behind, displaying
the tome's cover, a muscular green woman in a gold bikini
rides a blue rhino. She lashes at the beast with a laser
whip. She has three tits. A lanky publicist paces up and
down, making sure everything is in order."|speech|GRAHAM|M
46|PUBLICIST|Looks good, right?|speech|PUBLICIST|F
47|CLIVE|Yes, it's very impressive.|speech|CLIVE|M
48|PUBLICIST|"It really does the image justice. I
never noticed the third tit."|speech|PUBLICIST|F
49|CLIVE|That was Graham's idea.|speech|CLIVE|M
50|PUBLICIST|"Ladies man, huh? You guys happy?
You got enough pens? You wanna
Snapple? You wanna a Diet Coke?"|speech|PUBLICIST|F
51|CLIVE|I'll have a fat Coke please?|speech|CLIVE|M
52|PUBLICIST|A fat what?|speech|PUBLICIST|F
53|CLIVE|Coke.|speech|CLIVE|M
54|PUBLICIST|Oh you man a FAT Coke.|speech|PUBLICIST|F
55|CLIVE|A what?|speech|CLIVE|M
56|PUBLICIST|Fat coke.|speech|PUBLICIST|F
57|CLIVE|"Yes please.
5."|speech|CLIVE|M
58|GRAHAM|When do we start?|speech|GRAHAM|M
59|PUBLICIST|Ten minutes ago.|speech|PUBLICIST|F
60|CLIVE|Why is it so quiet?|speech|CLIVE|M
61|PUBLICIST|"Sylar's doing a Q and A in the main
pavillion."|speech|PUBLICIST|F
62|CLIVE|"Oh man! I wanted to go to that . I
wanted to find out if he actually
eats the brains."|speech|CLIVE|M
63|PUBLICIST|I can make a call.|speech|PUBLICIST|F
64|CLIVE|Please.|speech|CLIVE|M
65|PUBLICIST|It'll pick up when he's done.|speech|PUBLICIST|F
66|GRAHAM|I'm nervous.|speech|GRAHAM|M
67|CLIVE|"Don't be. The hard work's done, we
have a great story and as usual
your renderings jump from the page."|speech|CLIVE|M
68|PUBLICIST|Yeah man. Three tits. Awesome.|speech|PUBLICIST|F
69|GRAHAM|Thank you.|speech|GRAHAM|M
70|CLIVE|"All we have to do now is sit back
and enjoy.
A child approaches."|speech|CLIVE|M
71|CLIVE|Queen Jelva welcomes thee.|speech|CLIVE|M
72|CHILD|Do you know where Sylar's on?|speech|CHILD|M
73|CLIVE|Main pavillion.|speech|CLIVE|M
74|CHILD|"Thanks. Hey, three tits. Awesome.
6."|speech|CHILD|M
75||INT. CONVENTION CENTRE. SIGNING PAVILLION - LATER|location||
76|CHILD|"Caption: 50 MINUTES LATER
They are sat in exactly the same position as before. CLIVE
looks a little downbeat, GRAHAM fidgets with his pens."|speech|CHILD|M
77|PUBLICIST|Okay, that's the hour. How'd we do?|speech|PUBLICIST|F
78|CLIVE|Three copies.|speech|CLIVE|M
79|PUBLICIST|"Hey, one for each tit. Maybe you
should have given her four."|speech|PUBLICIST|F
80|GRAHAM|That's sick.|speech|GRAHAM|M
81|PUBLICIST|Don't sweat it. It's a sleeper.|speech|PUBLICIST|F
82|CLIVE|Yeah, but three copies?|speech|CLIVE|M
83|PUBLICIST|Better than Carl Weathers.|speech|PUBLICIST|F
84|CLIVE|YES!|speech|CLIVE|M
85|GRAHAM|Would you like a copy?|speech|GRAHAM|M
86|PUBLICIST|"Are you nuts? My office is full of
junk.
The PUBLICIST walks away chuckling."|speech|PUBLICIST|F
87|CLIVE|Graham, I need a drink.|speech|CLIVE|M
88||INT. HOTEL. BAR - NIGHT|location||
89|CLIVE|"GRAHAM and CLIVE are stood against the wall in a bar. GRAHAM
drinks and elaborate blue cocktail through a straw. CLIVE
sips from a Jack Daniels and Coke. Everyone else in the bar
is dressed as a HOBBIT. CLIVE winks at a girl.
7."|speech|CLIVE|M
90||INT. HOTEL. BEDROOM - NIGHT|location||
91|CLIVE|"GRAHAM and CLIVE's hotel room is filled with bags of stuff
from the convention, a laptop computer and a games console
plugged into the TV. GRAHAM lies on his bed. He is looking at
a map. Other maps are scattered about.
CLIVE (O.S.)
It was like the Prancing Pony in
there."|speech|CLIVE|M
92|GRAHAM|"Nasty Hobbitses.
CLIVE emerges from the bathroom. He is naked but for a black
towel wrapped around his waist. His hair is wet and suddenly
incredibly long. Around his neck, a large animal tooth hangs
on a black leather cord."|speech|GRAHAM|M
93|CLIVE|They think they're so cool.|speech|CLIVE|M
94|GRAHAM|"Hey, are you excited about going to
Area 51?"|speech|GRAHAM|M
95|CLIVE|Hell yes.|speech|CLIVE|M
96|GRAHAM|06.30 check out?|speech|GRAHAM|M
97|CLIVE|"A-ffirmative.
GRAHAM and CLIVE both look at their watches."|speech|CLIVE|M
98|CLIVE|Three, two, one...|speech|CLIVE|M
99|GRAHAM CLIVE|Beep. Beep.|speech|GRAHAM CLIVE|?
100|CLIVE|Good night, Graham.|speech|CLIVE|M
101|GRAHAM|"Good night, Clive.
They switch off their respective bedside lights. The room is
plunged into pitch darkness. A few seconds pass."|speech|GRAHAM|M
102|GRAHAM|Are you asleep?|speech|GRAHAM|M
103|CLIVE|"No.
8."|speech|CLIVE|M
104|GRAHAM|"Shall we try and storm the Citadel
before we nod off?"|speech|GRAHAM|M
105|CLIVE|"Couldn't hurt could it?
We hear some movement then the room is illuminated by the TV.
The boys lie on their beds holding games controllers."|speech|CLIVE|M
106|CLIVE|Cover me.|speech|CLIVE|M
107||INT. HOTEL. RECEPTION - MORNING|location||
108|CLIVE|"GRAHAM and CLIVE stand at reception. Both look extremely
sleepy. CLIVE's eyes close. GRAHAM lolls forward onto the
reception desk. His head hits the bell.
DING!"|speech|CLIVE|M
109||EXT. HOTEL - MORNING|location||
110|CLIVE|"The boys stand, waiting for their transport. We see them from
across the road. A tiny old car splutters up to the curb. A
valet gets out and hands the keys to CLIVE."|speech|CLIVE|M
111|VALET|There you go.|speech|VALET|?
112|GRAHAM|That's not ours.|speech|GRAHAM|M
113|VALET|No?|speech|VALET|?
114|CLIVE|"No, that's ours.
A large RV pulls up. A 1985 Holiday Rambler, Imperial. Top of
the range in its day. Still looks good."|speech|CLIVE|M
115|VALET|"Oh.
GRAHAM and CLIVE run off toward the RV. The four BORG from
the previous day approach the VALET and exchange the key to
the car for some small change. The BORG drive off."|speech|VALET|?
116|VALET|"Fucking Borg.
(giving the finger)
Assimilate this!
The RV speeds past the disgruntled VALET. GRAHAM and CLIVE
can be heard whooping within.
9."|speech|VALET|?
117||INT. RV - MORNING|location||
118|VALET|"CLIVE is seated behind the wheel of their RV, he now wears
black wrap-around shades. In the back of the RV, GRAHAM
fusses with maps and provisions."|speech|VALET|?
119|GRAHAM|Breakfast?|speech|GRAHAM|M
120|CLIVE|Java. Straight up.|speech|CLIVE|M
121|GRAHAM|Any solids?|speech|GRAHAM|M
122|CLIVE|"No, let's punch through. Miles make
the eggs taste sweeter."|speech|CLIVE|M
123|GRAHAM|I love eggs!|speech|GRAHAM|M
124|CLIVE|"I hear that. Now, get that ""òJoe' on
the go and jump in the Chewie seat.
I need your map skills."|speech|CLIVE|M
125|GRAHAM|"Good job I pre-pared.
GRAHAM flicks on the coffee and jumps into the co-pilot's
(Chewie) seat."|speech|GRAHAM|M
126|GRAHAM|"It's a shame I don't have some
controls on this side. That way, I
could take over if you needed the
loo."|speech|GRAHAM|M
127|CLIVE|"Yeah, I could say ""take the helm.""ù"|speech|CLIVE|M
128|GRAHAM|"""Take the helm, number one.""ù"|speech|GRAHAM|M
129|CLIVE|"Yeah, ""take the helm, number one, I
need a number two.""ù
They laugh heartily. Through this, GRAHAM has been taking out
his laptop and setting it up on the dash board."|speech|CLIVE|M
130|GRAHAM|"""òLeast I've got Cerebro, eh?
10."|speech|GRAHAM|M
131|CLIVE|"Absolutely. Real-time sat-nav multi
map and advanced geo-tagging with
continual info stream?"|speech|CLIVE|M
132|GRAHAM|Impressive.|speech|GRAHAM|M
133|CLIVE|Most impressive.|speech|CLIVE|M
134|GRAHAM|"And let's not forget, we've always
got Analogue.
GRAHAM pulls a map down. Obscuring the entire windshield."|speech|GRAHAM|M
135|CLIVE|Not when we're driving Graham.|speech|CLIVE|M
136|GRAHAM|"Sorry.
GRAHAM sends the map back up into the roller. The coffee
percolator gurgles in the galley."|speech|GRAHAM|M
137|GRAHAM|Sounds like coffee o'clock.|speech|GRAHAM|M
138|CLIVE|"Thank god. I'm a wreck until I've
had my first cup of J.
GRAHAM high fives CLIVE and heads back into the kitchen."|speech|CLIVE|M
139||INT. DINER - DAY|location||
140|CLIVE|"GRAHAM and CLIVE eat lunch. GRAHAM has finished a plate of
prawns. He inspects the shells."|speech|CLIVE|M
141|GRAHAM|"Looks like a pile of dead droids.
A perky waitress approaches. GRAHAM and CLIVE become shy and
awkward."|speech|GRAHAM|M
142|WAITRESS|"You boys all set? Can I get you
anything else?
GRAHAM spills his drink. CLIVE appears very uneasy.
INT/EXT. RV - DAY
They drive in silence, surveying the landscape.
11."|speech|WAITRESS|?
143|CLIVE|"Amazing, isn't it? There are
295,734,134 people in this country
and we haven't seen a soul for a
hundred miles. Where is everybody?"|speech|CLIVE|M
144|GRAHAM|"What about that old woman on
crutches we saw hitchhiking?"|speech|GRAHAM|M
145|CLIVE|"Apart from her. I suppose that's
why they established the Dreamland
facility out here."|speech|CLIVE|M
146|GRAHAM|Far from prying eyes.|speech|GRAHAM|M
147|CLIVE|"Did you know the site was selected
in the mid-1950s for testing of the
U-2 spyplane, due to its
remoteness, proximity to existing
facilities and presence of a dry
lake bad for landings?"|speech|CLIVE|M
148|GRAHAM|Yes.|speech|GRAHAM|M
149|CLIVE|Oh.|speech|CLIVE|M
150|GRAHAM|"Shall we have a bite before or
after we hit the Black Mailbox?"|speech|GRAHAM|M
151|CLIVE|Before.|speech|CLIVE|M
152||INT. THE LITTLE A'LE'INN. BAR - EVENING|location||
153|CLIVE|"GRAHAM and CLIVE tuck into burgers. They are the only
customers. The interior is replete with various Area 51
related memorabilia. PAT, (female, 50s) the proprietor,
speaks to them from behind the counter. She holds up two
bumper stickers."|speech|CLIVE|M
154|PAT|"""Watch The Skies""ù or ""Alien
Onboard?""ù
GRAHAM and CLIVE look at each other for a few seconds before
looking back at PAT."|speech|PAT|F
155|GRAHAM/CLIVE|"""Alien Onboard.""ù
12."|speech|GRAHAM/CLIVE|?
156|PAT|"Nice choice. So, where have you
boys come from?"|speech|PAT|F
157|"GRAHAM
(MUMBLY)"|San Diego.|speech|GRAHAM|M
158|PAT|Comic-Con?|speech|PAT|F
159|CLIVE|"How could you tell?
We see GRAHAM and CLIVE looking back at PAT. They look like
the most painfully obvious Comic-Con attendees ever."|speech|CLIVE|M
160|PAT|"Just a guess. My nephew launched a
comic down there a couple of years
ago. Sort of dramatized the
accounts of some of the folk we've
had in here."|speech|PAT|F
161|CLIVE|Encounter Briefs?|speech|CLIVE|M
162|PAT|That's it. You heard of it, huh?|speech|PAT|F
163|CLIVE|I've got all six.|speech|CLIVE|M
164|PAT|Well whaddya know? Small world.|speech|PAT|F
165|CLIVE|"Do you get a lot of UFO types round
here?
We see PAT looking back at CLIVE, surrounded by UFO and alien
paraphernalia, a slight smile on her face."|speech|CLIVE|M
166|PAT|Some.|speech|PAT|F
167|GRAHAM|Have you ever seen one?|speech|GRAHAM|M
168|PAT|A UFO? Oh, I've seen plenty.|speech|PAT|F
169|GRAHAM|"Really?! You've seen more than one
UFOs?
13."|speech|GRAHAM|M
170|PAT|"Well, I don't know what they were.
So as far as I'm concerned they're
unidentified and they were
definitely flying."|speech|PAT|F
171|CLIVE|And objects.|speech|CLIVE|M
172|PAT|"Damn straight. Whether or not they
were spaceships, I can't say.
Probably not, but I'd like to think
they were. Be a shame if we were
the only souls in the universe."|speech|PAT|F
173|CLIVE|"Did you now, it's estimated that
there are as many as 200 billion
galaxies in the observable universe
and each of those has approximately
40 billion starts, around which
orbit countless planets and moons?"|speech|CLIVE|M
174|PAT|Yes.|speech|PAT|F
175|CLIVE|Oh.|speech|CLIVE|M
176|PAT|Makes you think though, don't it?|speech|PAT|F
177|CLIVE|What?|speech|CLIVE|M
178|PAT|"Where is everybody?
GRAHAM and CLIVE ponder this."|speech|PAT|F
179|PAT|You boys all set?|speech|PAT|F
180|CLIVE|I'd like a cup of coffee please.|speech|CLIVE|M
181|PAT|Sure thing. How about you, sugar?|speech|PAT|F
182|GRAHAM|Can I have an E.T. malt please?|speech|GRAHAM|M
183|PAT|"You wanna sparkler in that?
GRAHAM smiles coyly.
14."|speech|PAT|F
184|PAT|"I'll take that as a yes.
She beams at the boys and disappears into the kitchen. GRAHAM
and CLIVE are left alone. They take it all in."|speech|PAT|F
185|CLIVE|It's nice here, isn't it?|speech|CLIVE|M
186|GRAHAM|Absolutely.|speech|GRAHAM|M
187|CLIVE|"I think I might use the loo.
CLIVE walks through a door marked ""òMaliens'. The adjacent
toilet door (GUS and JAKE) enter. GRAHAM becomes uneasy."|speech|CLIVE|M
188|PAT|Yes dear, what can I get you?|speech|PAT|F
189|JAKE|Two beers.|speech|JAKE|?
190|PAT|Coming right up.|speech|PAT|F
191||INT. THE LITTLE A'LE'INN. TOILET - EVENING|location||
192|PAT|"CLIVE washes his hands. He pumps soap from a dispenser which
is shaped like an alien's head, the soap squirts out of its
mouth. CLIVE is quite taken with this."|speech|PAT|F
193|CLIVE|That is absolutely amazing!|speech|CLIVE|M
194||INT. THE LITTLE A'LE'INN. BAR - EVENING|location||
195|CLIVE|CLIVE appears out of the toilet with his hands in the air.|speech|CLIVE|M
196|CLIVE|"Hey Graham, an alien just sicked up
into my palms.
CLIVE doesn't see the two men sat up at the counter. He
strides over to GRAHAM, full of excitement."|speech|CLIVE|M
197|CLIVE|"I'm joking, of course. They have a
soap dispenser, shaped like an
alien's head. When you pump his
jaw, soap comes out of his mouth."|speech|CLIVE|M
198|"GRAHAM
(MUMBLING)"|"Clive...
15."|speech|GRAHAM|M
199|CLIVE|"It's hilarious.
GRAHAM flicks his eyes to the counter."|speech|CLIVE|M
200|CLIVE|"What?
CLIVE looks over and sees the two men. They are glaring back.
CLIVE immediately loses his confident air.
PAT (O.S.)
Here it comes!
GRAHAM closes his yes, remembering what he ordered. The two
men turn to see PAT emerge from the kitchen with a tray of
drinks. Two bottles of beer, one cup of coffee and an absurd
looking milkshake in a tall glass with a sparkler."|speech|CLIVE|M
201|PAT|"Okay then, beers for you gentleman.
A cup of Joe and a extra thick malt
with a sparkler for the boys from
outer space.
The man snigger derisively. PAT senses the tension."|speech|PAT|F
202|PAT|So, where you boys headed?|speech|PAT|F
203|JAKE|"We're heading into Utah. Do
ourselves some hunting."|speech|JAKE|?
204|GUS|"Deer, coon, beaver, whatever steps
in front of the bangstick, right
Jake?
They throw a look back at GRAHAM and CLIVE."|speech|GUS|M
205|JAKE|You got that right, Gus.|speech|JAKE|?
206|PAT|"Well now, I heard Utah beaver puts
up quite a fight."|speech|PAT|F
207|GUS|"That's what we're counting on.
They nudge each other and laugh."|speech|GUS|M
208|PAT|"I better make you something good
and hot. Long way to The Beehive.
PAT give GRAHAM and CLIVE a look. CLIVE understands and
fumbles for hi wallet.
16.
He places a number of bills on the table. They leave. GRAHAM
comes back in and retrieves the bumper sticker. PAT gives him
a wink. He leaves.
INT/EXT. RV - EVENING
GRAHAM boards the RV. CLIVE is in the driver's seat. The
engine is running."|speech|PAT|F
209|CLIVE|What took you so long?|speech|CLIVE|M
210|GRAHAM|I was putting the sticker on.|speech|GRAHAM|M
211|CLIVE|"They were an odd pair, weren't
they?"|speech|CLIVE|M
212|GRAHAM|"Definitely didn't speak Bocci.
CLIVE fires up the engine and jams it into reverse. CRUNCH.
GRAHAM (CONT'D)
That wasn't their truck was it?"|speech|GRAHAM|M
213|CLIVE|No.|speech|CLIVE|M
214||EXT. THE LITTLE A'LE'INN - EVENING|location||
215|CLIVE|"The RV roars off, leaving the car park and the black Lincoln
Escalade, shiny, mean, dented.
INT/EXT. RV - NIGHT
GRAHAM looks at a map. CLIVE drives, continually checking his
rear view."|speech|CLIVE|M
216|GRAHAM|What's the matter?|speech|GRAHAM|M
217|CLIVE|Nothing. How we doing?|speech|CLIVE|M
218|GRAHAM|"We should be just about there.
They scan the roadside for a few seconds."|speech|GRAHAM|M
219|CLIVE|I've found it.|speech|CLIVE|M
220|GRAHAM|"Where?
17."|speech|GRAHAM|M
221|CLIVE|THERE!!!|speech|CLIVE|M
222||EXT. THE EXTRA TERRESTRIAL HIGHWAY - NIGHT|location||
223|CLIVE|"The RV comes to a screeching halt. It sits in the road for a
moment, before it trundles onto the hard shoulder. The door
opens, GRAHAM and CLIVE appear wearing head mounted torches.
They wander over to a WHITE mailbox."|speech|CLIVE|M
224|"GRAHAM/CLIVE
(REVERENTIALLY)"|"The Black Mailbox.
GRAHAM and CLIVE marvel at it. The silence of the night and
the size of the landscape dawns on them. They look up."|speech|GRAHAM/CLIVE|?
225|CLIVE|"It's amazing, isn't it? We're
actually here."|speech|CLIVE|M
226|GRAHAM|Area 51.|speech|GRAHAM|M
227|CLIVE|Dreamland.|speech|CLIVE|M
228|GRAHAM|"The Groom Lake Military Test
Facility."|speech|GRAHAM|M
229|CLIVE|MacArthur's Black Mile.|speech|CLIVE|M
230|GRAHAM|Is that a real one?|speech|GRAHAM|M
231|CLIVE|No, I made it up myself.|speech|CLIVE|M
232|GRAHAM|I like it.|speech|GRAHAM|M
233|CLIVE|Be great if we saw something.|speech|CLIVE|M
234|GRAHAM|"Yes, imagine if we got buzzed up by
a craft."|speech|GRAHAM|M
235|CLIVE|"That would be incredible. It just
sort of stops in the air and hovers
then just goes up really fast.
Whoosh.
18."|speech|CLIVE|M
236|GRAHAM|"What would you do if they actually
landed?"|speech|GRAHAM|M
237|CLIVE|"Keep it together. First contact is
a big responsibility. They come in
peace, we go to pieces? That's not
how I roll.
CLIVE looks at GRAHAM who is staring off, wide eyed."|speech|CLIVE|M
238|CLIVE|"What's wrong?
GRAHAM points off into the distance. HEADLIGHTS."|speech|CLIVE|M
239|GRAHAM|"It's them. They found us. I don't
know how but they found us."|speech|GRAHAM|M
240|CLIVE|Who? Who's found us?|speech|CLIVE|M
241|GRAHAM|The Libyans!|speech|GRAHAM|M
242|CLIVE|"Run for it Marty!
GRAHAM and CLIVE scramble for the RV."|speech|CLIVE|M
243||INT. RV - NIGHT|location||
244|CLIVE|"CLIVE drives, GRAHAM looks nervous. In the dashboard of the
RV is a rear view monitor. They look at it intently."|speech|CLIVE|M
245|GRAHAM|"Perhaps it's not them. Perhaps
whoever it was turned doff."|speech|GRAHAM|M
246|CLIVE|"Of course it's them. We're dead.
It's like Deliverance. They're
going to rape us and break our
arms."|speech|CLIVE|M
247|GRAHAM|I don't want my arms broken!|speech|GRAHAM|M
248|CLIVE|There's only one thing for it.|speech|CLIVE|M
249|GRAHAM|What?|speech|GRAHAM|M
250|CLIVE|"I'm gonna have to fly blind.
19.
CLIVE kills the headlights. They are plunged into darkness,
still travelling at 65mph. The headlights come back on."|speech|CLIVE|M
251|CLIVE|"Probably best not to do that. I
couldn't really see anything.
They stare at the monitor. Suddenly, creeping up the rear of
the RV, headlights. The front of a car becomes visible."|speech|CLIVE|M
252|CLIVE|Oh God, oh God, oh God.|speech|CLIVE|M
253|GRAHAM|I need the toilet.|speech|GRAHAM|M
254|CLIVE|"Me too.
The vehicle behind pulls out to overtake."|speech|CLIVE|M
255|CLIVE|They're trying to overtake.|speech|CLIVE|M
256|GRAHAM|Don't let them get past.|speech|GRAHAM|M
257|CLIVE|Should I ram them?|speech|CLIVE|M
258|GRAHAM|"What about the deposit?
CLIVE gingerly jerks the wheel, causing the RV to swerve. A
BLACK SEDAN car appears next to them, manoeuvering wildly to
avoid the RV. GRAHAM and CLIVE stare in horror, their eyes
widen as the car flips over and tumbles several times,
bouncing across the asphalt and sliding to a smoking stop on
its roof. GRAHAM's mouth hangs open. CLIVE blinks."|speech|GRAHAM|M
259|CLIVE|"It wasn't them.
The RV pulls up to the crashed vehicle and stops. GRAHAM and
CLIVE peer out of the window."|speech|CLIVE|M
260|CLIVE|We should see if they're okay.|speech|CLIVE|M
261|GRAHAM|I still need a wee.|speech|GRAHAM|M
262|CLIVE|"I can hold mine.
GRAHAM goes to the back of the RV and into the toilet. CLIVE
remains int he driving seat, staring out at the mangled
Sedan. The toilet flushes and GRAHAM reappears.
20."|speech|CLIVE|M
263|GRAHAM|The bulb's gone in there.|speech|GRAHAM|M
264||EXT. THE EXTRA TERRESTRIAL HIGHWAY - NIGHT|location||
265|GRAHAM|"GRAHAM and CLIVE step out of the RV and approach the car.
Inside are three unconscious men. One door is open."|speech|GRAHAM|M
266|CLIVE|"Hello?
They wait for a few seconds. Nothing."|speech|CLIVE|M
267|GRAHAM|"Maybe you should call for help.
GRAHAM pulls out a cell phone and starts to dial.
VOICE (O.S.)
I wouldn't do that if I were you.
GRAHAM and CLIVE spin round to see an indistinct figure
sitting on a rock in the nearby darkness. The glow of a
cigarette briefly lights up what appear to be two large,
black eyes. GRAHAM and CLIVE gawp."|speech|GRAHAM|M
268|CLIVE|"I rather think these men need help.
Graham, give me the phone.
GRAHAM passes the phone over."|speech|CLIVE|M
269|VOICE|"Seriously, I wouldn't do that.
GRAHAM's mouth falls open, CLIVE continues to hold the phone
to his ear. We hear the operator."|speech|VOICE|M
270|OPERATOR|"911 Emergency. How may I direct
your call? Hello? Hello?
GRAHAM and CLIVE continue to gawp. The shape stand and steps
into the light. GRAHAM and CLIVE go slack. Standing in front
of them, clad only in cut-off short and flip-flops... is an
ALIEN."|speech|OPERATOR|M
271|ALIEN|"Put - the phone - down.
Without the slightest change of expression CLIVE rocks
backwards in a dead faint. He hits the ground with a bump.
GRAHAM looks at CLIVE then back at the ALIEN. When GRAHAM
speaks his voice quivers with hysterical panic."|speech|ALIEN|M
272|GRAHAM|"What have you done to him?
21."|speech|GRAHAM|M
