|character|text|type
1420||"Algren and Bagley, in formal dress uniforms, sit in one of the rickshaws.
Bagley looks him over."|stage direction
1421||BAGLEY|unknown
1422||Oughtta shave more often, Algren. Becomes you.|location
1423||Thought I would follow the Japanese fashion.|location
1424||...Heard you were leaving, actually?|location
1425||ALGREN|unknown
1426||"Why would I do that? Omura wants me to train his
personal guard."|location
1427||"Certainly seems obsessed by you. Why do you
think that is?"|location
1428||"90.
ALGREN
Could it be my nose isn't permanently lodged up
his ass?"|unknown
1429||Bagley shakes his bead, turns away. Algren stares up at the looming aide.|stage direction
1430||EXT.                       CASTLE- MAIN GATES                               NIGHT|location
1431||"The two rickshaws stop by the heavily-guarded main gates. Guards check the occupants. Motion
to other guards atop the gates.
The main gates slowl y swing open."|stage direction
1432||EXT.                   CASTLE - COURT YARD                 NIGHT|location
1433||"The bearers lower the rickshaws. Algren and Bagley climb from one.
Ambassador Swanbeck climbs from the other."|stage direction
1434||EXT.              CASTLE -- RECEPTION CHAMBE R                         NIGHT|location
1435||"Omura waits in elegant evening clothes. A woman plays a harp. The interior
of Omura's castle is heavy, oppressive. Old Masters paintings dot the walls.
Leather-bound boob. Chippendale furniture."|stage direction
1436||"Gentlemen...
AMBASSADOR SWANBECK
Omura, you have a lovel y home. It must be very old."|unknown
1437||"Nothing is ""old"" in Japan, ever ything is ""ancient.""
... But the views are pleasant. Sit down..."|unknown
1438||"They move to chairs by the roaring fireplace as Omura turns to Algren,
noticing the cut on his face, but saying nothing."|stage direction
1439||"Do you know your Wagner, Captain? This is
the 'Leibestod' from Tristan and Isolde."|unknown
1440||"I'm surprised you enjoy it. Literally translated it
means `love/death. '
(looks at him)         .
A samurai concept, don't you think?"|unknown
1441||The two men take each other's measures. Servants appear with trays..|stage direction
1442||"OMURA
Champagne? And cigars, of course.
91."|unknown
1443||Servants light their cigars.|stage direction
1444||"BAGLEY
(re: cigar)
A gift from President Grant?
OMURA
(smiles)
Queen Victoria.
ALGREN
Mr. Omura, may I use the necessit y?
OMURA
Certainly."|unknown
1445||Omura summons a servant. The servant escorts Algren out.|stage direction
1446||"OMURA
Now, Mr. Swanbeck, regarding our agreement, I noticed
a discrepancy in paragraph seven in reference to the
investment protocols for coal."|unknown
1447||INT.                           CASTLE ­ CORRIDOR                          NIGHT|location
1448||"The servant leads Algren through a corridor, head bowed.
Then, stil1 puffing on his cigar, Algren taps the servant on the back, and as
the man turns, decks him. The servant falls.
Algren flicks hit cigar out onto the sloping roof. We FOLLOW the
BURNING EMBER as it rolls off the roof and lands at the feet of TWO
CURIOUS GUARDS."|stage direction
1449||EXT.                     CASTLE COURTYARD                        NIGHT|location
1450||"The guards look up, trying to determine where the cigar butt has come from.
But their curiosity lasts only a moment: ARROWS pierce their necks,
strangling any sound.
We REVERSE to discover that one of the rickshaw-bearers has fired the
arrows. As he peels back his hood, we SEE it is Yoritomo.
We realize the other bearers are Ujio, Nakao, and Simon Graham. They
hurry past the dead guards and up the stairs."|stage direction
1451||INT.                 CASTLE APPROACH                            NIGHT|location
1452||"The three samurai and Graham race up the winding parapets.
Three GUARDS round a corner. Swords flash as Ujio and Nakao dispatch
them without even slowing. They race on, Graham laboring to keep up."|stage direction
1453||92.|unknown
1454||INT.                    CASTLE KEEP                     NIGHT|location
1455||"Algren rounds a corner--
Ujio, Yoritomo, Nakao, and Graham are moving toward him."|stage direction
1456||ALGREN|unknown
1457|ALGREN|This wa y...|speech
1458||Clearly, this has all been Algren's plan. They move up a stairwa y.|stage direction
1459||INT.                CASTLE KEEP (SECOND FLOOR)                           NIGHT|location
1460||"The three guards are still standing at attention outside Katsumoto's cell.
His swords are next to them.
Algren keeps the others out of sight and lowers his head to whisper with
Ujio. Ujio nods, then walks into sight and calmly approaches the guards.
Still hidden, Algren gestures for the others remain to silent. After a
moment, he gestures that they can proceed.
Algren and the others round the comer to discover the bloody remains of
the three guards - whom Ujio has dispatched in absolute silence. They unlock
the cell."|stage direction
1461||INT.                   CASTLE ­ CELL                         FOLLOWING|location
1462||Katsumoto is shocked to see Algren enter. Algren tosses him his swords.|stage direction
1463||ALGREN|unknown
1464|ALGREN|How's the poem coming?|speech
1465||KATSUMOTO|unknown
1466|ALGREN|The ending is proving difficult.|speech
1467||INT.                      CASTLE -- RECEPTION CHAMBER                     NIGHT|location
1468||Omura glances up from the documents.|stage direction
1469||"OMURA
What has become of Captain Algren?"|unknown
1470||INT.                       CASTLE ­ CORRIDOR                          NIGHT|location
1471||Algren, Katsumoto, and the others race through an upper corridor.|stage direction
1472||"KATSUMOTO
(re:Graham)"|unknown
1473|ALGREN|Who is this?|speech
1474||ALGREN|unknown
1475|ALGREN|"Name's Simon Graham. Wants to write a book
about you."|speech
1476||"93.
GRAHAM"|unknown
1477|ALGREN|"An honor. I have followed your activities with
great interest. I think the European public
would be fascinated by a book about your
adventures."|speech
1478||KATSUMOTO|unknown
1479|ALGREN|Not a book. A play!|speech
1480||Suddenly, from below, the raised voices of guards. They hurry a wa y.|stage direction
1481||INT.               CASTLE ­ STAIRS                     NIGHT|location
1482||Guards carrying pikes race up the stairs--|stage direction
1483||INT.                CASTLE ­ CORRIDOR                  NIGHT|location
1484||"Algren and the others are moving swiftl y down a stone corridor.
The sound of the approaching guards is growing louder.
A silent WILD BUNCH moment of preparation as they stride down the
corridor, five abreast.
Algren pulls the cavalry saber from his dress uniform. Katsumoto prepares
his swords. Nakao stretches his huge arms. Yoritomo and Uji o draw their bows."|stage direction
1485||EXT.                   CASTLE - UPPER COURTYARD                        FOLLOWING|location
1486||"Ten guards with rifles patrol the upper battlements.
Yoritomo and Uji o crouch and fire. Arrow a fter arrow a fter arrow, as
fast as a repeating rifle, the arrows streak through the night.
Completely silent.
It is a dazzling display. They time shots to sail over walls, shoot through
tiny windows, shoot out torches. Multiple arrows. Perfect aim.
In a matter of seconds all ten guards are dead.
They continue across the courtyard, up some steps --"|stage direction
1487||INT.             CASTLE--TIGHT CORRIDOR                         FOLLOWING|location
1488||"They stride through a tight, dark stone corridor.
Suddenly, a cadre of Omura guards emerge from the shadows.
Without hesitation, they launch into battle. Algren and Katsumoto wield
their swords. Yoritomo and Ujio fire arrows.
Nakao fights with his hands, dramatic martial arts from the huge man."|stage direction
1489||94.|unknown
1490||"But this corridor is just too tight -- it is a sea of combat.. the guards and
our warriors are slammed together --the swords and pikes sending up sparks
in the darkness as they strike the stone walls.
The right corridor echoes with samurai war cries and clanging swords.
Then...
More guards appear.
These guards have rifles.
Rifle blasts thunder --startling strobe-like bursts of light in the darkness --
Algren dives in front of Katsumoto to protect him-
Yoritomo is hit-
He jerks back -- blood--
Ujio fires arrows at the guards with rifles, hitting two -- but more guards with rifles are appearing, bullets
sending showers of debris and ricochets--
Algren sees a stairway leading to a higher 1evel, barks out a command. As Nakao drags
Yoritomo toward the stairs-- the others bolt a heavy SIEGE DOOR ­
designed to keep attackers at bay."|stage direction
1491||INT.                        CASTLE SIEGE ROOM                           NIGHT|location
1492||"Ujio fires arrows through the siege ports -- momentarily delaying the guards
as Algren leads them toward a rear stairs."|stage direction
1493||INT.                       REAR STAIRS                      NIGHT|location
1494||"Algren starts down -- only to discover MORE GUARDS blocking this means
of escape. He backs out of the wa y just in time as rifle blasts SPLINTER
the wooden stairwe11.
Meanwhile, an EXPLOSION from behind them indicates that the guards
have blown the siege door.
Algren, Graham, and Ujio have no choice but to continue upwards into the
castle keep. Nakao helps the wounded Yoritomo as they climb."|stage direction
1495||INT.                UPPER KEEP                    NIGHT|location
1496||"A narrow ladder leads to the final redoubt. They start to climb but Yoritomo
leans against the wall. He is gravely wounded."|stage direction
1497||ALGREN|unknown
1498||Come on.|location
1499||"YORITOMO
(subtitled)"|unknown
1500||You go, Algren-san. I will stop them.|location
1501||95.|unknown
1502|ALGREN|No--|speech
1503|YORITOMO|...Please.|speech
1504||"Yoritomo's determination is absolute. Finally, Algren nods.
Katsumoto moves to Yoritomo, leans in for a few final words, taking his
head and pressing his forehead to Yoritomo's.
Bullets begin ricocheting around them -- Yoritomo looks to Algren:"|stage direction
1505||"YORITOMO
(subtitled)"|unknown
1506|YORITOMO|Tell my family.|speech
1507||"Algren bows his bead in respect.
Then Algren leads them up the stairs. Ujio fires a final volley, nods with
respect to Yoritomo, then follows the others.
Yoritomo pulls himself erect. Draws his two samurai swords.
A beat. He closes his eyes. Smiles.
Then he opens his eyes and hurls himself down the stairs--
The guards fire hitting Yoritomo - but still he comes -- wading into them
swords flashing -- he is hit again and again -- but still he comes.
It is a glorious death."|stage direction
1508||EXT.                      SIEGE ROOM                     NIGHT|location
1509||"Algren leads them into the highest room of the castle, the siege room. The
echoes Yoritomo's death rings in their ears.                                   .
Katsumoto glances at Ujio and Nakao. Without a word, they kneel on the
floor, open their kimonos and unsheathe their short-swords, preparing to
commit seppuku."|stage direction
1510|ALGREN|No. Wait...!|speech
1511||"Katsumoto glares at him harshly, furious to have his concentration disturbed
at such a moment."|stage direction
1512||ALGREN|unknown
1513|ALGREN|There's a wa y out. Look--!|speech
1514||Reluctantly, Katsumoto joins him at the window.|stage direction
1515||"96.
ALGREN
This place is designed to keep people from getting
in, not from getting out. We can make it
KA TSUMOTO
This was your plan?
ALGREN
Do you have a better one?"|unknown
1516||Nakao and Ujio look at Katsumoto, awaiting his response. He turns to Algren.|stage direction
1517||"ALGREN
I may die. But I'll die trying."|unknown
1518||And without another word he LAUNCHES himself out the window, onto the sloping roof.|stage direction
1519||EXT.                   CASTLE ROOF TOPS                          NIGHT|location
1520||"Like his cigar butt earlier in the sequence, he rolls, then falls, hits another
roof, rolls, slides, falls, hits again."|stage direction
1521||INT.                  UPPER KEEP                          CONTINUOUS|location
1522||"Katsumoto and the others share a look. Has he survived?
GUNFIRE begins to pepper the floorboards, bullets whistling past them."|stage direction
1523||EXT.                 CASTLE ROQF TOPS                          CONTINUOUS|location
1524||"Algren slides, bumps, rolls, falls, hits, then slides again. Until he finally plummets into the moat.
As his head rises above water, he lets out a scream of absolute joy."|stage direction
1525||INT.                  UPPER KEEP                    CONTINUOUS|location
1526||"Katsumoto hears the scream. A look of disbelief spreads over his face.
Then the beginnings of a smile. Without a second look, be leaps out the
window. Ujio follows.
Graham shrinks away in fear. Nakao lifts him bodily, throws him out, and then follows."|stage direction
1527||INT.                      CASTLE -- RECEPTION CHAMBER                        LATER|location
1528||"Omura stands, very calm, smoking a cigarette, listening to the report of his guards.
Colonel Bagley tries to apologize."|stage direction
1529||"BAGLEY
... 1 don't know what to say, sir. I never would
have thought him capable of treason.
OMURA
I would say Captain Algren's acts tonight have
assured our success.
97.
AMBASSADOR SWANBECK"|unknown
1530|ALGREN|What do you mean?|speech
1531|OMURA|"Katsumoto will rejoin his kinsmen. They will fight.
We will destroy them with your new weapons."|speech
1532|BAGLEY|"What if he just goes off to the mountains and
becomes a damn sheep-herder or some such?"|speech
1533|OMURA|"You still do not understand us ... Katsumoto can
do nothing but fight. It is his role in the drama.
He must act out his destiny. He knows it."|speech
1534||AMBASSADOR SWANBECK|unknown
1535|OMURA|You trust a lot in destiny.|speech
1536||OMURA|unknown
1537|OMURA|"This story was written years ago. From the first
sight of your warships in our harbor..."|speech
1538||(stares out the window)|unknown
1539|OMURA|It is a1l inevitable.|speech
1540||EXT.             HILLS                           SUNSET|location
1541||Algren, Katsumoto, and the others ride over rocky ground.|stage direction
1542||ALGREN (V.O.)|unknown
1543|OMURA|"June 1, 1877. Yesterday, I passed the field where
Zebulon Gant was killed by the man with whom
I now ride."|speech
1544||In the distance a steam train chugs along. Inevitable. Progress.|stage direction
1545||EXT.                 FOREST ­ MOUNTAINS                     DAY|location
1546||They climb a steep trail. Beyond, the glaciers glow pink.|stage direction
1547|ALGREN (V.O.)|"I am beset by ironies -- trained to fight rebels
now I am one. And yet 1 ask mysel f... can a man
be reborn?:"|speech
1548||"Algren, Katsumoto, and the others ride through a dense forest Katsumoto
reins his horse. The others follow suit. They wait"|stage direction
1549||ALGREN (V.O.)|unknown
1550|ALGREN (V.O.)|And if so, what would he make of it?|speech
1551||Mounted samurai emerge from the thick forest As it they were invisible.|stage direction
1552||98.|unknown
1553||"The leader leaps from his horse and bows, touching his head to the dirt.
All the other samurai follow suit."|stage direction
1554||EXT.    CHERRY TREE FOREST--NEAR THE VILLAGE                       EVENING|location
1555||"Katsumoto rides at the head of his samurai as they pass through the cherry
orchard. Then he reins his horse and falls in beside Algren."|stage direction
1556||"KATSUMOTO
(his voice troubled)"|unknown
1557|ALGREN (V.O.)|"I was prepared to die in Omura's castle. And
yet here I am. I cannot help but ask why were
you sent into my life. What is the lesson you
were meant to give me?"|speech
1558||ALGREN|unknown
1559|ALGREN (V.O.)|"Maybe that neither of us is as smart as we
thought..."|speech
1560||Katsumoto laugh. And then in a surprisingly deft imitation of Algren|stage direction
1561||KATSUMOTO|unknown
1562|ALGREN (V.O.)|You...ain't whistlin' Dixie...|speech
1563||He spurs his horse and heads off. Algren shakes his head and follows.|stage direction
1564||EXT.               VILLAGE                     EVENING|location
1565||"The returning warriors are warmly welcomed by the villagers.
Algren rides directly to Yoritomo's house, dismounts.
Taka and Toshiie are waiting.
He goes to them. His expression tells them all they need to know."|stage direction
1566||INT.          YORITOMO'S HOUSE                           NIGHT|location
1567||Algren sits with the family. The boys sit next to their mother.|stage direction
1568||"ALGREN
(subtitles)"|unknown
1569|ALGREN (V.O.)|... he gave his life to save us. He died bravel y.|speech
1570||(subtitles)|unknown
1571|TAKA|Thank you, Algren-San.|speech
1572||99.|unknown
1573||(subtitles)|unknown
1574|HIGEN|Will you fight the white men?|speech
1575||"ALGREN
(subtitles)"|unknown
1576|HIGEN|If they come here, yes.|speech
1577||"HIGEN
(subtitles)"|unknown
1578|HIGEN|Why?|speech
1579||(subtitles)|unknown
1580|ALGREN|Because they come to destroy what I have come to love.|speech
1581||"Taka looks at him, moved and surprised. Suddenly, Higen jumps up and
bolts... out of the room. Algren looks to Taka."|stage direction
1582||"TAKA
(subtitles)"|unknown
1583|ALGREN|"The wa y of Samurai is difficult for children. He
misses his father."|speech
1584||ALGREN|unknown
1585|ALGREN|And he is angry because I am the cause of that.|speech
1586||She smiles ever so slightly at his obliviousness.|stage direction
1587|TAKA|No. He it angry because he fears you will die as well.|speech
1588||EXT.             VILLAGE                    NIGHT|location
1589||Higen stands, looking up at the stars.|stage direction
1590||ALGREN|unknown
1591|TAKA|Higen.|speech
1592||(subtitles)|unknown
1593|HIGEN|My father taught me it is glorious to die in battle.|speech
1594||"ALGREN
(subtitles)"|unknown
1595|HIGEN|That is what he believed.|speech
1596||"HIGEN
(subtitles)"|unknown
1597|HIGEN|I would be afraid to die in battle.|speech
1598||(subtitles)|unknown
1599|ALGREN|So would I.|speech
1600||"100.
HIGEN
(subtitles)"|unknown
1601||But you have been in many battles.|location
1602||"ALGREN
(subtitles)"|unknown
1603||And I was always afraid.|location
1604||Higen looks at him, tears welling in his eyes.|stage direction
1605||"HIGEN
(subtitles)"|unknown
1606||I don't want you to go.|location
1607||"Algren has no answer. He can only gather the boy up in his arms and hold
him.
EXT VILLAGE DAY
Nakao is standing proudly, his massive arms folded across his chest. We
pull back: Graham is bunched behind his photographic equipment. A flash
of phosphorous and the moment is immortalized.
Meanwhile, Algren is working with Higen on the house.
Katsumoto silently watches Algren working with the boy."|stage direction
1608||KATSUMOTO|unknown
1609||Algren-san.|location
1610||Algren turns.|stage direction
1611||KATSUMOTO|unknown
1612||They are corning.|location
1613||"EXT      MOUNTAINS          DAY
Algren and Katsumoto perch on a precipice, looking down into a valley.
It is a beautiful setting. Towering peaks and peaceful valleys. It is here that
the final act of the inevitable drama will play out.
Bel ow they see the Imperial Army, thousands strong, marching across the
valley toward them. Terrifying martial columns in strict formation."|stage direction
1614||ALGREN|unknown
1615||"I call it five thousand troops. They'll come in
waves of about a thousand, a few minutes between
each wave."|location
1616||Katsumoto listens carefully to Algren's expertise.|stage direction
1617||"101.
ALGREN"|unknown
1618|ALGREN|"German formations have the infantry staggered
with on1y light flanking. They'll come straight on
with rifles and fixed bayonets. Mausers are only
accurate to about 150 yards. They'll look to
overthrow us."|speech
1619||Katsumoto takes this in.|stage direction
1620||EXT.                  VALLEY                             DAY|location
1621||"Colonel Bagley, Omura, several German advisors and Japanese officers ride
at the head of the Imperial Army.                                         .
Bagley sees something, raises a hand. The troops halt.
Algren and Katsumoto ride up to them. Stop."|stage direction
1622|ALGREN|Colonel.|speech
1623||BAGLEY|unknown
1624|ALGREN|"Captain... (to Katsumoto)... Sir, the Imperial
Army of Japan demands your surrender. If you
and your fellows lay down your arms you will
not be harmed."|speech
1625|KATSUMOTO|That is not possible. As Omura knows.|speech
1626||Omura meets Katsumoto's look, nods. Bagley turns to Algren.|stage direction
1627|BAGLEY|"Captain Algren, we will show no quarter. You
ride against us and you are the same as they are."|speech
1628||ALGREN|unknown
1629|BAGLEY|I take that as a compliment, Colonel.|speech
1630||(a deadly calm)|unknown
1631|BAGLEY|I'll look for you on the field.|speech
1632||Algren and Katsumoto wheel their horses and go.|stage direction
1633||EXT.                 MOUNTAIN RIDGE                      DAY|location
1634||Algren and Katsumoto ride.|stage direction
1635||ALGREN|unknown
1636|BAGLEY|They have the howitzers.|speech
1637|KATSUMOTO|How many?|speech
1638|ALGREN|About a dozen.|speech
1639||102.|unknown
1640||Katsumoto considers this. Algren looks up into the mountains.|stage direction
1641||ALGREN|unknown
1642||"A man could get lost up there ... Build an army.
Hold out a very long time."|location
1643||KATSUMOTO|unknown
1644||"Algren-san...Have you seen what happens to the
villages that stand In the way of the railroad?"|location
1645||Algren nods. He remembers.|stage direction
1646||KATSUMOTO|unknown
1647||"That is what will happen to my village if we do
not stand and fight."|location
1648||(looks at him)|unknown
1649||No. We serve the Emperor here.|location
1650||ALGREN|unknown
1651||By dying?|location
1652||KATSUMOTO|unknown
1653||Perhaps.|location
1654||ALGREN|unknown
1655||At least make it battle, not a suicide.|location
1656||KATSUMOTO|unknown
1657||And what would that accomplish?|location
1658||Algren lifts his head, enjoying the feeling of the sun and wind on his face.|stage direction
1659||ALGREN|unknown
1660||"It might give you one more day ... One more
fine day like this."|location
1661||"Katsumoto stares at him for a long moment, then smiles and spurs his horse. Algren follows.
They ride together, side by aide, the wind billowing their cloaks -- We enjoy the
ride as they do, the trees strobing by, the sun slanting through the leaves."|stage direction
1662||EXT.                      VILLAGE                       NIGHT|location
1663||"It is the eve of battle. And the samurai rejoice.
Katsumoto is on stage at the center of the village square, enthusiastically
performing a Noh drama. Algren sits with Toshiie and Taka in the audience,
enjoying Katsumoto's theatrics.
Other samurai can be seen around the village, eating, singing, and playing
instruments. Tonight is for celebrating life.
Elsewhere, a flash as Graham takes a photograph of some children."|stage direction
1664||103.|unknown
1665||"On the stage, Katsumoto spots Algren in the audience, points to him and
encourages him to join him. Algren resists. Toshiie prods him. Algren
surrenders and joins Katsumoto on the stage. The villagers are delighted.
Katsumoto embroils Algren in the performance. Algren does his best,
laughing at Katsumoto's antics.
It is the freest and happiest we have ever seen Algren. Time
SLOWS as we Savor his simple enjoyment
Toshiie is highly amused. Taka has a deeper response, she is moved as she
watches Algren give himself over to the part."|stage direction
1666||EXT.            VILLAGE                      LATER THAT NIGHT|location
1667||A somber mood has descended. Algren sits and writes in his journal.|stage direction
1668||ALGREN (V.O.)|unknown
1669||"July 14, 1877. For so long now, I have managed
to convince myself that there was nothing worth
believing in."|location
1670||A samurai plays a melancholy bamboo flute. The gentle sound floats through the village...|stage direction
1671||ALGREN (V.O.)|unknown
1672||Certainly nothing worth dying for.|location
1673||"We see samurai preparing for the final battle. Some check
their armor... Others meditate..."|stage direction
1674||Now I am not so sure.|location
1675||"Some make up their faces so they will look handsome when they greet death.
Some methodically polish their swords. Some sit with their families."|stage direction
1676||ALGREN (V.O.)|unknown
1677||"And so, for the first time in my life, I am truly
afraid. Not of dying. But of losing something
worth living for."|location
1678||"Ujio is performing a graceful, ritualistic sword-dance to the song of the flute.
Algren Joins Graham to watch him."|stage direction
1679||GRAHAM|unknown
1680||What is it:? .|location
1681||ALGREN|unknown
1682||The kenbu,.. his dance of death.|location
1683||Taka comes to them.|stage direction
1684||"TAKA
(subtitles)"|unknown
1685||Algren-san, will you come with me?|location
1686||104.|unknown
1687||"Algren leaves Graham and accompanies Taka toward the house.
They pass Higen and Toshiie, who sit with other children at the feet of the
massive Nakao, listening to a quiet story he tells,"|stage direction
1688||INT.                   YORITOMO'S HOUSE                     FOLLOWING|location
1689||"The gentle flute music from outside drifts in.
One of Yoritomo's beautiful kimonos is elegantly spread on a mat."|stage direction
1690||"TAKA
(subtitles)"|unknown
1691||If you wear this, it will honor us.|location
1692||"He nods.
She steps to him.
A moment. She gently reaches forward and unbuttons his collar.
A tender, silent scene as she undresses him and carefully wraps him in the"|stage direction
1693||kimono. Her hands move gracefull y around his body, never quite touching|unknown
1694||"him. His movements are gentle in response.
When he is fully dressed, then are tears in his eyes.
Suddenly, fiercely, they are holding each other."|stage direction
