|character|text|type|character_clean|gender|principal_character
1218||"Jack tries to lay a sleeping Sophie down in her bed, but she
won't let go of his neck. Finally, she releases her grasp
only to roll over and fall out of bed. Baby Tooth gives Jack
a scornful look."|stage direction|||
1219|CUT TO:|"JAMIE'S MOM (O.S.)
Sophie? Is that you?"|speech|CUT TO:|?|True
1220||"Jack and Baby Tooth's eyes widen. Sophie, asleep on the
floor, is quickly covered with a blanket and given a squeaky
stuffed animal."|stage direction|||
1221||EXT. SOPHIE'S BEDROOM WINDOW - CONTINUOUS|location|||
1222||"Jack closes the window and looks to Baby Tooth with a sign of
relief."|stage direction|||
1223|JACK|"We should get back.
Guardians Screening Script 9/6/12 Avid 86."|speech|JACK|M|True
1224||Baby Tooth nods, when...|stage direction|||
1225|JACK|VOICE FROM A MEMORY (O.S.)|speech|JACK|M|True
1226|(LAUGHING)|Jack...|speech|||
1227||"Jack stops, confused. Where is that voice coming from? He
looks out across the town, toward the woods, and the sound of
the echoed voice."|stage direction|||
1228|JACK|That voice, I know that voice...|speech|JACK|M|True
1229||Baby Tooth looks to him, worried.|stage direction|||
1230|JACK|"VOICE FROM A MEMORY (O.S.)
Jack..."|speech|JACK|M|True
1231||With that, Jack leaps off the window ledge.|stage direction|||
1232||EXT. BURGESS - A MOMENT LATER|location|||
1233||"Jack, carried by the wind, flies across town toward the sound
of the eerie voice. Baby Tooth follows, trying to keep up.
Jack takes a moment to orient himself and lands, settling on
a rotating vent; as the momentum slowly spins him around, the
voice calls out to him again."|stage direction|||
1234|JACK|"VOICE FROM A MEMORY (O.S.)
Jack..."|speech|JACK|M|True
1235||Jack turns, looks to the woods, and takes off.|stage direction|||
1236||EXT. WOODS - BURGESS - A MOMENT LATER|location|||
1237||"Jack and Baby Tooth land in the middle of a thickly wooded
area. It's spooky. Jack scans the forest when again he
hears..."|stage direction|||
1238|JACK|"VOICE FROM A MEMORY (O.S.)
Jack..."|speech|JACK|M|True
1239||"Jack gives chase. He sprints through the thickets and enters
a clearing only to find the decrepit remains of a rotting
frame from a child's bed. Very creepy. What would that be
doing in the woods, and how long has it been here?"|stage direction|||
1240|JACK|"Don't worry, there's still time.
Guardians Screening Script 9/6/12 Avid 87."|speech|JACK|M|True
1241||"Baby Tooth desperately tries to get Jack's attention by
tugging at his tunic, and tweeting desperately.
Jack takes his staff, and breaks through the damaged frame,
revealing a hole leading deep underground."|stage direction|||
1242|JACK|"VOICE FROM A MEMORY (O.S.)
Jack..."|speech|JACK|M|True
1243||"What to do? Jack jumps down the hole, reluctantly followed
by Baby Tooth."|stage direction|||
1244||SEQ. 2100 - PITCH TRICKS JACK|stage direction|||
1245||INT. PITCH'S TUNNELS|location|||
1246||"Jack continues along a long dark tunnel with Baby Tooth close
behind. Eventually the labyrinth opens up to reveal a huge
underground cavern. Baby Tooth continues to tug at Jack's
tunic."|stage direction|||
1247|JACK|"(waving Baby Tooth off)
Baby Tooth, Baby...come on!"|speech|JACK|M|True
1248|(BEAT)|I have to find out what that is.|speech|||
1249||INT. PITCH'S INNER SANCTUM - CONTINUOUS|location|||
1250||"Jack can't believe his eyes. Dozens of huge bird cages
hanging from the ceiling, and in them are the mini tooth
fairies. They see Jack, and immediately perk up, tweeting
and flitting like crazy.
Jack jumps up onto one of the cages, then quickly leaps and
holds onto the side of another one."|stage direction|||
1251|"JACK
(WHISPERS)"|"Shhhh! keep it down.
(leaps to another cage)
I'm gonna get you out of here, just
as soon as I --
VOICE FROM A MEMORY
Jack..."|speech|JACK|M|True
1252||Jack turns away from the fairies, distracted.|stage direction|||
1253|"JACK
(WHISPERS)"|"Guardians Screening Script 9/6/12 Avid 88.
VOICE FROM A MEMORY
Jack..."|speech|JACK|M|True
1254|JACK|"(under his breath)
As I can --"|speech|JACK|M|True
1255||"Jack looks down and sees the tooth drawers from Tooth's
Palace. Mounds of them heaped to the ceiling. And inside
the drawers are the missing baby teeth. He drops down to a
mound and begins rummaging through the drawers, looking at
the names on the boxes.
In an instant he forgets his duties, and the fairies, and the
Guardians and everything except those teeth, and the chance
to finally get his memory back.
The cavern suddenly goes darker than it already was. Jack
finally looks up, as a shadow of Pitch crawls up a nearby
column."|stage direction|||
1256|JACK|"PITCH (O.S.)
Looking for something?"|speech|JACK|M|True
1257||"Jack swings around with his staff, shooting off a blast of
ice, but Pitch isn't there. Jack takes off, following the
sound of Pitch's cackle as it echoes throughout the chamber.
Jack rounds a corner as he sees Pitch's shadow glide across
the walls into a shadowed corridor."|stage direction|||
1258|JACK|"PITCH (O.S.)
Don't be afraid, Jack. I'm not
going to hurt you."|speech|JACK|M|True
1259||Jack continues along a shadowed corridor.|stage direction|||
1260|JACK|Afraid?|speech|JACK|M|True
1261||"Jack sees Pitch on a bridge across the cavern and heads after
him."|stage direction|||
1262|JACK (CONT'D)|I'm not afraid of you!|speech|JACK|M|True
1263|PITCH|"Maybe not. But you are afraid of
something."|speech|PITCH|M|True
1264||Jack steadily approaches, cautious and alert.|stage direction|||
1265|JACK|"You think so, huh?
Guardians Screening Script 9/6/12 Avid 89."|speech|JACK|M|True
1266|PITCH|"I know so. It's the one thing I
always know."|speech|PITCH|M|True
1267||Pitch finally turns to face Jack.|stage direction|||
1268|PITCH (CONT'D)|"People's greatest fears. Yours is
that no one will ever believe in
you."|speech|PITCH|M|True
1269||"Panic flashes in Jack's eyes. As he backs away, the chamber
fills with shadows, and Jack is spun around. He's
disoriented as he thuds into a wall, which flips to reveal
that it's actually the ground.
Pitch, unseen now, chuckles.
Jack's unsure of where he is. He looks back to see the
cavern entrance -- he's right back where he started."|stage direction|||
1270|PITCH (CONT'D)|"PITCH (O.S.)
And worst of all, you're afraid
you'll never know why. Why you?
Why were you chosen...to be like
this?"|speech|PITCH|M|True
1271||"Jack discovers that the entrance has been blocked with bricks
as Pitch's shadow encroaches on him."|stage direction|||
1272|PITCH|"Well fear not, for the answer to
that..."|speech|PITCH|M|True
1273||"Pitch is now directly in front of Jack, holding out a tooth
box."|stage direction|||
1274|PITCH (CONT'D)|Is right here.|speech|PITCH|M|True
1275||"Jack's eyes widen at the sight - the face of a young boy
etched into the box, and under it is the name ""Jack Frost."""|stage direction|||
1276|PITCH|"Do you want them, Jack? Your
memories?"|speech|PITCH|M|True
1277||"He holds them out to Jack. Jack stares, fighting the impulse
to grab them. He closes his eyes, struggling to make a
decision, but when he opens them again, Pitch has
disappeared.
Pitch's shadow moves across the pillars of the cavern."|stage direction|||
1278|PITCH|Guardians Screening Script 9/6/12 Avid 90.|speech|PITCH|M|True
1279||"Jack heads down a corridor, cast shadows from the Mini Tooth
cages everywhere."|stage direction|||
1280|PITCH|"PITCH (O.S.)
Everything you wanted to know..."|speech|PITCH|M|True
1281||"Pitch's face moves in and out of the shadows over the
following."|stage direction|||
1282|PITCH|...in this little box.|speech|PITCH|M|True
1283||"Every time Jack turns, Pitch disappears. It's like Jack's
trapped in a fun house.
Multiple Pitch shadows have appeared on the wall around Jack.
They're closing in on him."|stage direction|||
1284|PITCH|"Why did you end up like this?
Unseen. Unable to reach out to
anyone."|speech|PITCH|M|True
1285|(BEAT)|"You want the answers so badly. You
want to grab them, and fly off with
them. But you're afraid of what
the Guardians will think."|speech|||
1286||Jack's breath quickens. He's been pushed into a corner.|stage direction|||
1287|PITCH|"You're afraid of disappointing
them."|speech|PITCH|M|True
1288|(SMILES)|"Well let me ease your mind about
one thing. They'll never accept
you. Not really."|speech|||
1289||The shadows have overcome Jack.|stage direction|||
1290|JACK|"(trying to scramble away)
Stop it! Stop it!"|speech|JACK|M|True
1291||"Almost reluctantly, the shadows back away and Pitch appears
before Jack."|stage direction|||
1292|PITCH|After all, you're not one of them.|speech|PITCH|M|True
1293||Jack aims his staff at Pitch.|stage direction|||
1294|JACK|"You don't know what I am!
Guardians Screening Script 9/6/12 Avid 91."|speech|JACK|M|True
1295|PITCH|"Of course I do. You're Jack Frost.
You make a mess wherever you go.
Why, you're doing it right now."|speech|PITCH|M|True
1296||"Pitch tosses the box to Jack, who instinctively catches it.
Jack looks up. Terror comes into Jack's eyes, as he
realizes..."|stage direction|||
1297|JACK|What did you do?|speech|JACK|M|True
1298|PITCH|"More to the point Jack, what did
you do?"|speech|PITCH|M|True
1299||"Pitch begins to back away, becoming one with the darkness,
laughing as he disappears. Jack charges towards him only to
be swallowed whole by one of Pitch's black holes."|stage direction|||
1300||SEQ. 2200 - GUARDIANS BREAK WITH JACK|stage direction|||
1301||INT. EGG TUNNEL - DAY|location|||
1302||"Jack flies out of Pitch's shadow, ready to strike. Suddenly,
Jack realizes he's forgotten something."|stage direction|||
1303|JACK|Baby Tooth!|speech|JACK|M|True
1304||"He turns to re-enter the hole in the wall only to find
himself face to face with one of Bunny's stone emblems."|stage direction|||
1305|JACK|"PITCH (O.S.)
Happy Easter, Jack."|speech|JACK|M|True
1306||"Jack turns around. Suddenly, his eyes fill with dread as he
realizes where he is. Thousands of broken egg shells lay
strewn about, forming a path toward the light at the end of
the tunnel."|stage direction|||
1307|JACK|No.|speech|JACK|M|True
1308||EXT. PARK - ENGLAND - DAY|location|||
1309||"Bunny peaks through the bushes to take in the scene - an
Easter Egg hunt."|stage direction|||
1310|JACK|Guardians Screening Script 9/6/12 Avid 92.|speech|JACK|M|True
1311|"BRITISH KIDS
(WALLA)"|"There are no eggs. There's none
anywhere. I give up. Come on,
let's go. I don't understand."|speech|BRITISH KIDS|?|
1312||"Bunny checks the eggs in his basket, then looks back toward
the kids."|stage direction|||
1313|BRITISH GIRL|"Maybe he just hid them really well
this year."|speech|BRITISH GIRL|?|
1314||"Bunny, egg basket in hand, approaches a group of kids who
seem to be wandering around searching halfheartedly,
disappointed and listless."|stage direction|||
1315|BRITISH GIRL|"BUNNYMUND (O.S.)
Kids! Oi!"|speech|BRITISH GIRL|?|
1316|BRITISH BOY|"I checked everywhere! There's
nothing!"|speech|BRITISH BOY|?|
1317|BUNNYMUND|"(steps towards them)
Yes there is! There is! I mean
these aren't my best lookin'
googies, but they'll do in a pinch!"|speech|BUNNYMUND|M|True
1318||He holds out a broken Easter egg. The kids just stare.|stage direction|||
1319|BRITISH GIRL|I can't believe it.|speech|BRITISH GIRL|?|
1320|BUNNYMUND|I know.|speech|BUNNYMUND|M|True
1321|BRITISH GIRL|"There's no such thing as the Easter
Bunny."|speech|BRITISH GIRL|?|
1322||The girl turns to leave.|stage direction|||
1323|BUNNYMUND|"What?
BRITISH KIDS (O.S.)"|speech|BUNNYMUND|M|True
1324|(WALLA)|Easter's over. Forget this.|speech|||
1325||"It's only then that we realize he's too late. The spark of
childhood has already been extinguished in all of them."|stage direction|||
1326|(WALLA)|Guardians Screening Script 9/6/12 Avid 93.|speech|||
1327|BUNNYMUND|"No! Wrong! Not, not true! I'm
right in front of ya, mate!"|speech|BUNNYMUND|M|True
1328|"BRITISH KIDS
(WALLA)"|There's no such thing. I know.|speech|BRITISH KIDS|?|
1329||"The kids walk through Bunnymund as if he were a ghost. Bunny
is stunned by this, and finally realizes..."|stage direction|||
1330|"BRITISH KIDS
(WALLA)"|BRITISH KIDS (O.S.) (CONT'D)|speech|BRITISH KIDS|?|
1331|(WALLA)|"Now come on. I don't understand.
Why wouldn't he come? Let's get
out of here. Easter Bunny, where
are you? This is the worst Easter
ever."|speech|||
1332|BUNNYMUND|They don't see me.|speech|BUNNYMUND|M|True
1333|(BEAT)|They don't see me.|speech|||
1334||"JACK's watching this all unfold and it's heartbreaking,
because he knows it's his fault. Tooth flies to Bunny's
side. Jack hears a rustle in the bushes behind him."|stage direction|||
1335|(BEAT)|"NORTH (O.S.)
Jack, where were you?"|speech|||
1336||"Jack sees North, with his scimitars drawn and having just
come from battle. He's exhausted, wild-eyed, distraught."|stage direction|||
1337|NORTH (CONT'D)|"The Nightmares attacked the
tunnels. They smashed every egg,
crushed every basket. Nothing made
it to the surface.
TOOTH (O.S.)
Jack!"|speech|NORTH|M|True
1338||Tooth rejoins the group from off screen.|stage direction|||
1339|"TOOTH (CONT'D)
(GASPS)"|Where did you get that?|speech|TOOTH|F|True
1340||"Jack looks down at the tooth box in his hand, then back to
Tooth."|stage direction|||
1341|JACK|"I was...it's...
Guardians Screening Script 9/6/12 Avid 94."|speech|JACK|M|True
1342|TOOTH|Where's Baby Tooth?|speech|TOOTH|F|True
1343|(FEELING BETRAYED)|Oh Jack, what have you done?|speech|||
1344|NORTH|That is why you weren't here?|speech|NORTH|M|True
1345||North steps forward to confront Jack.|stage direction|||
1346|NORTH (CONT'D)|You were with Pitch?|speech|NORTH|M|True
1347|JACK|"No, listen, listen...I'm sorry. I
didn't mean for this to happen.
BUNNYMUND (O.S.)"|speech|JACK|M|True
1348|(TO OTHERS)|He has to go.|speech|||
1349||Jack turns to see Bunny, disheartened.|stage direction|||
1350|"JACK
(STUNNED BEAT)"|What?|speech|JACK|M|True
1351|BUNNYMUND|We should never have trusted you!|speech|BUNNYMUND|M|True
1352|(FORLORN)|"Easter is new beginnings, new life.
Easter is about hope."|speech|||
1353|(BEAT)|And now it's gone.|speech|||
1354||"Bunny turns away and moves toward the park, looking at the
sign that reads, `Easter Egg Hunt.'
This is like a punch in Jack's gut. He looks back to Tooth
and North, both of whom look away, too hurt by Jack. He
looks at them with a pained expression. This is exactly what
Pitch said would happen.
Jack reaches into his pocket, pulls out the tiny Russian
nesting doll that North had given him, drops the doll to the
ground, and takes off.
As Jack leaves, carried off by the wind, we see the tiny
Russian nesting doll laying on the ground."|stage direction|||
1355|CUT TO:|Guardians Screening Script 9/6/12 Avid 95.|speech|CUT TO:|?|True
1356||SEQ. 2600 - JAMIE STILL BELIEVES|stage direction|||
1357||EXT. JAMIE'S HOUSE - DUSK|location|||
1358||"Jamie, atop a ladder, strains for what looks like an Easter
egg, hiding in the rain gutter. The ladder totters and Jamie
loses his balance, beginning to fall."|stage direction|||
1359|JAMIE|Whoaaa, whoa, whoa...aaaah!|speech|JAMIE|M|True
1360||"Jamie grabs the gutter but it breaks loose, sending Jamie
crashing down into a mound of snow.
As Jamie gets up off the ground, he sees that the Easter egg
was in fact a dirty old tennis ball. Jamie stands up,
bewildered, and dusts himself off as his friends LAUGH. A
few have empty EASTER BASKETS."|stage direction|||
1361|JAMIE|Let's check the park again.|speech|JAMIE|M|True
1362|CALEB|Really?|speech|CALEB|M|True
1363|"CLAUDE
(ANNOYED)"|For what, the Easter Bunny?|speech|CLAUDE|M|True
1364|JAMIE|"Guys, I told you - I saw him! He's
way bigger than I thought, and he's
got these cool boomerang-things-"|speech|JAMIE|M|True
1365|CALEB|Grow up, Jamie.|speech|CALEB|M|True
1366|"CLAUDE
(SIGHS)"|Ah man, seriously.|speech|CLAUDE|M|True
1367|JAMIE|What's happened to you guys?|speech|JAMIE|M|True
1368|CALEB|"It was a dream. You should be
happy you still get dreams like
that and not..."|speech|CALEB|M|True
1369||They begin to turn away from him.|stage direction|||
1370|CALEB|Guardians Screening Script 9/6/12 Avid 96.|speech|CALEB|M|True
1371|"CUPCAKE
(HAUNTED)"|Nightmares.|speech|CUPCAKE|M|True
1372||"Pippa's the lone straggler. She looks tired, depressed, and
hands Jamie her basket as she leaves."|stage direction|||
1373|PIPPA|"Forget it, Jamie. There's just no
Easter this year.
CALEB (O.S.)
I can't believe this."|speech|PIPPA|F|True
1374|JAMIE|He really is real!|speech|JAMIE|M|True
1375||"Pippa walks away, trailing the others. Jamie doesn't know
what to believe. He hangs his head and looks into the Easter
basket, it's empty."|stage direction|||
1376|JAMIE (CONT'D)|I know he is.|speech|JAMIE|M|True
1377||INT. NORTH POLE - GLOBE ROOM - DAY|location|||
1378||"Yetis stare at the globe of belief, in shock as more and more
lights begin to fad away. We push in toward Antarctica as we-"|stage direction|||
1379||SEQ. 2304 - JACK IN ANTARCTICA|stage direction|||
1380||EXT. ICEBERG - ANTARCTIC CIRCLE - DAY|location|||
1381||"Jack runs to the edge of a floating iceberg, ready to throw
his tooth box into the ocean. He resists, looking down at
the box as he clutches it in his hand. He's never been more
alone in his life."|stage direction|||
1382|DISSOLVE TO:|"PITCH (O.S.)
I thought this might happen."|speech|DISSOLVE TO:|?|
1383||Pitch is revealed, standing not far behind Jack.|stage direction|||
1384|PITCH (CONT'D)|"They never really believed in you.
I was just trying to show you that.
But I understand.
Guardians Screening Script 9/6/12 Avid 97."|speech|PITCH|M|True
1385||"Jack whips around and shoots a burst of frost at Pitch, but
it's quickly deflected by the Nightmare sand."|stage direction|||
1386|JACK|You don't understand anything!|speech|JACK|M|True
1387||"Jack continues to attack, lashing out with his staff. Pitch
blocks the attacks of ice and frost -- his control over the
Nightmare sand has gained considerable strength."|stage direction|||
1388|"PITCH
(SHOUTING)"|"No? I don't know what it's like to
be cast out?"|speech|PITCH|M|True
1389||"Pitch strikes back, putting Jack on the defense. Jack jumps
in the air. Their show of force escalates until they're
shrouded in a blanket of snow, ice, and wind. As the wind
and snow settle, Jack looks around stern and alert."|stage direction|||
1390|"PITCH
(SHOUTING)"|"PITCH (O.S.)(CONT'D)
To not be believed in. To long for
a family."|speech|PITCH|M|True
1391||"Jack turns around to find Pitch. There's a look of
compassion on Jack's face as he listens."|stage direction|||
1392|PITCH (CONT'D)|"All those years in the shadows I
thought, no one else knows what
this feels like. But now I see I
was wrong."|speech|PITCH|M|True
1393||They lock eyes. A moment of true connection between them.|stage direction|||
1394|PITCH (CONT'D)|We don't have to be alone, Jack.|speech|PITCH|M|True
1395||This isn't a trick Pitch is making a real offer here.|stage direction|||
1396|PITCH (CONT'D)|"I believe in you. And I know
children will too."|speech|PITCH|M|True
1397|JACK|In me?|speech|JACK|M|True
1398|PITCH|Yes! Look at what we can do!|speech|PITCH|M|True
1399||"Pitch gestures to a fantastical ice and nightmare ""sculpture""
that was created (off-screen) when Jack attacked him."|stage direction|||
1400|PITCH|Guardians Screening Script 9/6/12 Avid 98.|speech|PITCH|M|True
1401|PITCH (CONT'D)|"What goes together better than cold
and dark?"|speech|PITCH|M|True
1402||"Jack looks at the fractured reflections of themselves cast in
the icy sculpture."|stage direction|||
1403|PITCH (CONT'D)|"We can make them believe. We'll
give them a world where everything,
everything is..."|speech|PITCH|M|True
1404||Jack turns to face Pitch.|stage direction|||
1405|"JACK
(DEADPANS)"|Pitch black...|speech|JACK|M|True
1406||Pitch, realizing how this looks, clarifies...|stage direction|||
1407|PITCH|"And Jack Frost too. They'll
believe in both of us."|speech|PITCH|M|True
1408||Jack stares at him, considering the offer. Then finally...|stage direction|||
1409|JACK|"No, they'll fear both of us. And
that's not what I want."|speech|JACK|M|True
1410||Jack turns and walks away.|stage direction|||
1411|JACK (CONT'D)|"Now for the last time, leave me
alone."|speech|JACK|M|True
1412||"Pitch looks confused and hurt. This is not the response he
was expecting. Then...his eyes flame with anger. He made
himself vulnerable, and Jack rejected him. No more
negotiating now."|stage direction|||
1413|PITCH|"Very well. You want to be left
alone? Done. But first..."|speech|PITCH|M|True
1414||"Suddenly Jack hears a familiar twitter. Pitch reaches into
his coat to pull out..."|stage direction|||
1415|JACK|Baby Tooth!|speech|JACK|M|True
1416||"Jack charges forward. There's terror in Baby Tooth's eyes.
She squeaks as Pitch clenches her tight with his fist."|stage direction|||
1417|JACK|Guardians Screening Script 9/6/12 Avid 99.|speech|JACK|M|True
1418|PITCH|The staff, Jack.|speech|PITCH|M|True
1419||Jack settles and the winds and snow subsides.|stage direction|||
1420|PITCH (CONT'D)|"You have a bad habit of
interfering. Now hand it over."|speech|PITCH|M|True
1421|(BEAT)|And I'll let her go.|speech|||
1422|BABY TOOTH|(twitters - Don't give it to him!)|speech|BABY TOOTH|F|
1423||"Baby Tooth struggles to get loose, but Pitch only tightens
his grip. She can hardly breathe. Jack has no choice.
Jack...hands over...the staff.
Pitch twirls the staff."|stage direction|||
1424|JACK|"(re: Baby Tooth)
Alright, now let her go."|speech|JACK|M|True
1425|PITCH|"No. You said you wanted to be
alone."|speech|PITCH|M|True
1426|(BEAT)|So be alone!|speech|||
1427||"Baby Tooth squirms until she's finally able to peck Pitch in
the hand with her beak. Pitch shrieks and throws Baby Tooth
in the air and down into the mouth of a crevasse."|stage direction|||
1428|JACK|No!|speech|JACK|M|True
1429||"Jack, enraged, can't believe what he's seeing. Pitch lifts
the staff, and breaks it over his knee, cracking it in two.
Light EXPLODES from the staff and terror comes into Jack's
eyes, clutching his chest as if in pain.
Suddenly, Pitch sends a burst of Nightmare sand, blasting
Jack and slamming him into the iceberg wall behind him. As
the ice cracks, Jack comes loose and falls forward into the
chasm below.
Pitch looks down into the ice fissure chuckling. He throws
the broken shards of Jack's staff down into the crevasse and
casually walks away, disappearing on the horizon."|stage direction|||
1430|CUT TO:|Guardians Screening Script 9/6/12 Avid 100.|speech|CUT TO:|?|True
1431||SEQ. 2308 - JACK'S MEMORY|stage direction|||
1432||EXT. ICE FISSURE - NIGHT|location|||
1433||"It's cold and dark down here, and Jack is more alone than
he's ever been. Battered from the fall, Jack slowly looks up
and notices Baby Tooth, lying lifelessly on the ground."|stage direction|||
1434|JACK|Baby Tooth!|speech|JACK|M|True
1435||He pulls himself to her and cradles her in his hands.|stage direction|||
1436|JACK|You alright?|speech|JACK|M|True
1437||"Baby Tooth nods, but she's hurt, and cold. Jack does his
best to shield her from the cold."|stage direction|||
1438|JACK|"Sorry, all I can do is keep you
cold."|speech|JACK|M|True
1439||Jack sits up and holds Baby Tooth in his hands.|stage direction|||
1440|JACK|"Pitch was right - I make a mess of
everything."|speech|JACK|M|True
1441||"Jack is devastated. Baby Tooth's never seen him like this;
it's heart breaking...then she gets a thought. Her
expression hardens with determination.
She wriggles deep into his pocket."|stage direction|||
1442|JACK|Hey?|speech|JACK|M|True
1443||Jack leans back and begins to close his eyes when he hears|stage direction|||
1444||SOMETHING --|location|||
1445|JACK|"VOICE FROM A MEMORY
Jack... Jack...
-- and then he FEELS something. Looks down: There's a SOFT,"|speech|JACK|M|True
1446||"GOLDEN GLOW coming from his pocket.
Jack jumps, taken aback. He reaches in and pulls out the
TOOTH BOX -- it's pulsing with light."|stage direction|||
1447|JACK|"VOICE FROM A MEMORY
Jack...
Guardians Screening Script 9/6/12 Avid 101."|speech|JACK|M|True
1448||"Baby Tooth gives him a reassuring look.
Baby Tooth motions to the box, then looks back at Jack. Jack
reaches to touch the box, but as he does its top magically
UNFOLDS to reveal a handful of BABY TEETH - then the box and
everything else glows BRIGHT WITH INTENSE LIGHT -
The WALLS of the fissure seem to suddenly fall away. In
brief FLASHES we see: The COLONIAL SETTLEMENT Jack visited.
Children running playfully down a hill."|stage direction|||
1449|JACK'S MOTHER|"Come on Jack, you can't have fun
all the time."|speech|JACK'S MOTHER|?|
1450||"CHILDREN'S LAUGHING FACES as a familiar BOY hangs upside down
from a tree limb."|stage direction|||
1451|JACK'S SISTER|Jack, get down from there!|speech|JACK'S SISTER|F|True
1452||"A HAPPY FAMILY at a roaring fire as the same boy jokes around
with antlers on his head."|stage direction|||
1453|JACK'S SISTER|"COLONIAL BOY (O.S.)
You're funny, Jack."|speech|JACK'S SISTER|F|True
1454||"Jack walks toward the woods with his sister. His mother,
face unseen, calls out to him."|stage direction|||
1455|JACK'S MOTHER|Be careful.|speech|JACK'S MOTHER|?|
1456||"Jack shakes his head like he's heard it a million times but
never pays it any mind."|stage direction|||
1457|"JACK
(LAUGHING)"|We will.|speech|JACK|M|True
1458||AND THEN--|location|||
1459||"START JACK'S MEMORY
We are on an eye, a familiar eye but this one is brown not
blue. PULL BACK to reveal young JACK, brown hair, brown
eyes. He is staring directly at the camera, a look of...what
is it? It's hard to read but it's VERY intense. We keep
pulling back to reveal him dressed as we first saw him in
16th century clothes. Behind him, dark winter trees and snow
come in to focus."|stage direction|||
1460|"JACK
(LAUGHING)"|Guardians Screening Script 9/6/12 Avid 102.|speech|JACK|M|True
1461||EXT. FROZEN POND - BURGESS - DAY|location|||
