|character|text|type|character_clean|gender
932||"Yung looks at Harmsway like he's crazy. Oblivious, Harmsway looks at
his WATCH, then looks through the BINOCULARS again - and begins to
WHISTLE the opening notes of My Fair Lady's ""WOULDN'T IT BE LOVERLY.""
(""All I want is a room somewhere, far away from the cold night air"")
THE LIFEBOAT -
As the men cry for help, the Sonar Operator spots something just
below the surface, moving toward the lifeboat at great speed.
He hears the hum. His eyes follow the churning water...
And suddenly - out of nowhere - the Worm hits the lifeboat from
below, smashing it to bits, hurtling the pieces in the air.
THE SEA DOLPHIN II -
Harmsway lowers the binoculars' smiling. Stamper appears, hands
Harmsway a piece of paper."|stage direction||
933|STAMPER|We've decoded their last transmission.|speech|STAMPER|M
934||Harmsway studies it for a moment - smiles.|stage direction||
935|HARMSWAY|Perfect. They'll be searching miles from here.|speech|HARMSWAY|M
936||(then)|location||
937|HARMSWAY|"Time for phase two. You can get the
men in the water."|speech|HARMSWAY|M
938||"And with this, Harmsway turns, and walks off, jauntily whistling
""Wouldn't It Be Loverly.""
Stamper looks at Yung, re: Harmsway's glee."|stage direction||
939|YUNG|You heard him. Get the men in the water!|speech|YUNG|M
940||"NEW ANGLE - SIDE OF THE SEA DOLPHIN II - NIGHT -
In the water next to the chip, FOUR DIVERS drop the last of their
equipment in a DIVE BOAT. They cast off, motoring into the fog."|stage direction||
941||EXT. LONDON - RESTAURANT BIBENDUM - NIGHT|location||
942||The classic Michelin building on Fulham road.|stage direction||
943||INT. RESTAURANT BIBENDUM -|location||
944||"A YOUNG WOMAN is yammering away at Bond; he's trying to put a good
face on what is obviously a dreadful fix-up first date."|stage direction||
945|WOMAN|"I can't believe it took us so long to
finally get together! What exactly
do you do for the government?"|speech|WOMAN|F
946||(after a beat)|location||
947|BOND|You might say... 'Public relations.'|speech|BOND|M
948|WOMAN|"How fascinating! I bet you meet all
the most fabulous people."|speech|WOMAN|F
949||Before Bond can answer, the MAITRE D' interrupts.|stage direction||
950|MAITRE D'|Excuse me - Mr. Bond? You have a call.|speech|MAITRE D'|?
951||"Bond excuses himself.
NEW ANGLE - BOND AT PHONE -
007 picks up the receiver, without saying hello:"|stage direction||
952|BOND|"Moneypenny! You're early. You
weren't supposed to call until -"|speech|BOND|M
953||(he stiffens)|location||
954|BOND|Yes. I understand. Twenty minutes.|speech|BOND|M
955||EXT. THE BANK OF LONDON - NIGHT|location||
956||"Passing a NEWSPAPER DELIVERY TRUCK with an ad for ""TOMORROW"" (""The
Paper that Never Lies,"") Bond's DB-5 roars past the guard."|stage direction||
957||INT. CONFERENCE ROOM - BANK OF LONDON - NIGHT|location||
958||"ADMIRAL ROEBUCK glares as MINISTER JOHNSTONE enters to address M,
TANNER, A TREASURY OFFICIAL, and various UNIFORMS and SUITS."|stage direction||
959|MINISTER JOHNSTONE|"Good evening. I've just spoken with
the Prime Minister at the economic
summit in Tokyo; he's expecting a
full update within the hour."|speech|MINISTER JOHNSTONE|?
960||(beat)|location||
961|MINISTER JOHNSTONE|"For those of you still unaware, some
forty minutes ago -"|speech|MINISTER JOHNSTONE|?
962||(interrupting)|location||
963|ADMIRAL ROEBUCK|Excuse me, but -|speech|ADMIRAL ROEBUCK|?
964||(all turn to him:)|location||
965|ADMIRAL ROEBUCK|"I must formally protest this meeting.
Given the nature of what's occurred -
and the need for secrecy - I see no
reason to involve the air force, the
army, or MI-6."|speech|ADMIRAL ROEBUCK|?
966||(beat, as M and Tanner exchange a look)|location||
967|ADMIRAL ROEBUCK|"This is an internal affair that should
be handled strictly by the officers of
her Majesty's Royal Navy."|speech|ADMIRAL ROEBUCK|?
968||(furious)|location||
969|MINISTER JOHNSTONE|Admiral, are you suggesting -|speech|MINISTER JOHNSTONE|?
970||"He's distracted by the CLICK OF A DOOR OPENING. All turn to SEE BOND
entering, wearing a FULL NAVAL UNIFORM. M stifles a smile."|stage direction||
971|BOND|Sorry I'm late -|speech|BOND|M
972|M|Actually, you're just in time.|speech|M|M
973||(she turns to)|location||
974|M|"Admiral Roebuck: You know Commander
Bond, don't you?"|speech|M|M
975||(deflated)|location||
976|ADMIRAL ROEBUCK|Yes. Of course.|speech|ADMIRAL ROEBUCK|?
977|BOND|I've looked forward to meeting you.|speech|BOND|M
978||"Bond sits. M glances at Johnstone as if to say ""proceed."""|stage direction||
979|MINISTER JOHNSTONE|"As I was saying: Approximately forty-
five minutes ago, we received an abandon
ship signal from the H.M.S. Indomitable."|speech|MINISTER JOHNSTONE|?
980||(flicks on a map display)|location||
981|MINISTER JOHNSTONE|"Looking at these infrared satellite
images - provided by Mr. Tanner of
MI-6 -the ship is presumed lost here,
just south of Kuala Lumpur, where she
broadcast her last position."|speech|MINISTER JOHNSTONE|?
982||CUT TO:|unknown||
983||EXT. STRAIT OF MALACCA - FOG - NIGHT|location||
984||"Foreground, empty diving boat. Background, Sea Dolphin II, with the
""flexible hose"" hanging over the rail, down into the water."|stage direction||
985||INT. BRIDGE - SEA DOLPHIN II - NIGHT|location||
986||"Stamper works ""worm"" master control with a video joystick."|stage direction||
987|STAMPER|Divers approaching the hull.|speech|STAMPER|M
988||"Harmsway and Yung look over his shoulder at:
INSERT - VIDEO SCREEN -
Through the worm's UNDERWATER camera, FOUR DIVERS with TORCHES and
WELDING TOOLS are about to enter the HOLE in the Indomitable's hull.
(The video screen also contains lots of digital information about the
divers and the worm's functions.)
NEUTRAL POV - UNDERWATER - EXT. INDOMITABLE
The worm follows the Divers into the hull.
WORM POV - INT. ENGINE ROOM -
It trails the Divers past debris and bodies of crewman.
SAME SHOT - VIDEO SCREEN - WORM POV -"|stage direction||
989||(into microphone)|location||
990|HARMSWAY (O.S.)|To the right, towards the stern.|speech|HARMSWAY|M
991||"The Divers react, and the worm follows them into...
PASSAGEWAY - UNDERWATER - NEUTRAL POV - INT. INDOMITABLE -
The Divers and worm travel to a HATCH COVERED WITH METAL BARS.
Lighting the welding torches, they try to cut through the metal
bars... Unsuccessfully.
VIDEO SCREEN - WORM POV -
One of the Divers turns to the worm's camera. He SPEAKS into his
diving helmet's microphone:"|stage direction||
992||(through speaker)|location||
993|DIVER|It's titanium. we can't cut through.|speech|DIVER|M
994||INT. SEA DOLPHIN BRIDGE -|location||
995||Stamper turns to Harmsway:|stage direction||
996|STAMPER|I'll do it.|speech|STAMPER|M
997|HARMSWAY (into microphone)|Divers, stand aside.|speech|HARMSWAY|M
998||"NEUTRAL POV - UNDERWATER - PASSAGEWAY -
The worm moves into position to grind through the hatch. A protective
cover slides over the lens, and the grinder whorls into life.
CLOSER ON THE WORM - The grinder stalls for an instant as it
encounters the titanium bars.
STILL CLOSER - One of the URANIUM GRINDING TEETH SNAPS OFF as it hits
the titanium, and starts to grind through.
NEW ANGLE
Once past the bars, the grinder cuts easily through the steel door.
Trapped air bursts out from inside the compartment. The Divers push
the worm to one side; two of them enter the hold with lights. The
worm follows. The two other divers remain behind to feed the worm's
flexible tubing through the door."|stage direction||
999||INT. BILGE HOLD - UNDERWATER -|location||
1000||"The Divers' lights illuminate the hold: STACKS OF GOLD BARS, as far
as the eye can see."|stage direction||
1001||INT. BRIDGE - SEA DOLPHIN II -|location||
1002||Harmsway looks at the video screen.|stage direction||
1003|HARMSWAY|"Gentlemen: I do believe we've struck
gold... Four minutes ahead of schedule."|speech|HARMSWAY|M
1004||INT. BILGE HOLD - UNDERWATER -|location||
1005||"The worm closes its ""eye"", revs up its grinders, and attacks the
first pile of gold Bars. It runs through them like butter."|stage direction||
1006||INT. CONFERENCE ROOM - BANK OF ENGLAND - NIGHT|location||
1007||The bloodletting and recriminations have begun. This plays fast:|stage direction||
1008||(incredulous)|location||
1009|MINISTER JOHNSTONE|One-third of the British gold reserves?!?|speech|MINISTER JOHNSTONE|?
1010||(beat)|location||
1011|MINISTER JOHNSTONE|What kind of idiot loses -|speech|MINISTER JOHNSTONE|?
1012||(looks to the treasury officer)|location||
1013|MINISTER JOHNSTONE|"What is it? The equivalent of ten
billion US dollars???"|speech|MINISTER JOHNSTONE|?
1014||(sheepishly)|location||
1015|TREASURY OFFICIAL|"Give or take. Depending on today's
currency rates -"|speech|TREASURY OFFICIAL|?
1016||(ignoring him)|location||
1017|MINISTER JOHNSTONE|"What the hell was the gold doing on
that boat?"|speech|MINISTER JOHNSTONE|?
1018|ADMIRAL ROEBUCK|"We were bringing it back from Hong
Kong. Under orders from the Treasury."|speech|ADMIRAL ROEBUCK|?
1019|TREASURY OFFICIAL|"During the cold war, we stored a
third in America, and another third
in Hong Kong - in case of a nuclear
attack. And with the turn-over of
Hong Kong to the Chinese -"|speech|TREASURY OFFICIAL|?
1020|MINISTER JOHNSTONE|"Why wasn't the ship protected?!?!
Why was it sailing without radar?"|speech|MINISTER JOHNSTONE|?
1021|ADMIRAL ROEBUCK|"I resent your tone, sir. I have men
who are missing -"|speech|ADMIRAL ROEBUCK|?
1022|MINISTER JOHNSTONE|"And I have the entire British economy
to worry about."|speech|MINISTER JOHNSTONE|?
1023||(breaking in)|location||
1024|BOND|Minister -|speech|BOND|M
1025||(all turn to him)|location||
1026|BOND|"Obviously, MI-6 was not involved in
this operation. But I have to defend
the Admiral."|speech|BOND|M
1027||Roebuck looks at Bond with great surprise. Bond continues:|stage direction||
1028|BOND (cont'd)|"Electronic silence was the safest way
to move that gold. Otherwise, any
country - or individual - with the
crudest missile could just lock onto
our signals, and take out the boat."|speech|BOND|M
1029||(beat)|location||
1030|BOND (cont'd)|"That's what happened to the Sheffield
in the Falklands."|speech|BOND|M
1031||(beat)|location||
1032|BOND (cont'd)|"Since then, it's standard operating
procedure for any sensitive shipment."|speech|BOND|M
1033||(frowns)|location||
1034|MINISTER JOHNSTONE|"At least we know where the gold is.
When are the recovery ships due?"|speech|MINISTER JOHNSTONE|?
1035|ADMIRAL ROEBUCK|"36 hours. They've already sailed
from the Persian gulf."|speech|ADMIRAL ROEBUCK|?
1036|MINISTER JOHNSTONE|"I expect to have that gold recovered
in 36 hours. Until then, I'm
imposing my own electronic silence:
For the sake of the economy, not a
word to NATO, the press, the CIA."|speech|MINISTER JOHNSTONE|?
1037||(beat, looking at:)|location||
1038|MINISTER JOHNSTONE|"...And so long as Commander Bond here
seems to be such an expert on these
matters, I want him to go along as an
observer. Are we agreed?"|speech|MINISTER JOHNSTONE|?
1039|ROEBUCK|Yes.|speech|ROEBUCK|?
1040|BOND|Yes.|speech|BOND|M
1041|M|As you wish.|speech|M|M
1042||EXT. SEA DOLPHIN II - NIGHT|location||
1043||"Harmsway walks along the side of the ship, observing the operation:
The WORM'S DREDGING PUMP sucks up the ground-up GOLD AND WATER SLUR-
RY, (through the TUBE hanging over the side,) and dumps it into a
SERIES OF SLUICES. At each stage the gold nuggets fall to the bottom
of the sluice, and excess water flows off the side of the ship.
AT THE STERN HOLD -
where all the water has been drained off, leaving a cascade of gold
nuggets pouring into the ship's hold -
HARMSWAY reaches into the shimmering cascade, and takes a hand-full
of gold. He sees Stamper approaching."|stage direction||
1044|HARMSWAY|"Remember the golden rule, Mr.
Stamper: He who has the gold, rules."|speech|HARMSWAY|M
1045||He drops the gold back in the hold.|stage direction||
1046|HARMSWAY|Is the helicopter ready?|speech|HARMSWAY|M
1047|STAMPER|Fueled and waiting.|speech|STAMPER|M
1048|HARMSWAY|Good. We have an appointment in Hong Kong.|speech|HARMSWAY|M
1049||INT. HALLWAY - BANK OF LONDON - NIGHT -|location||
1050||M and Bond, striding down a hallway to exit the building.|stage direction||
1051|M|"...You're turning into quite the
politician, 007."|speech|M|M
1052|BOND|I have an excellent teacher.|speech|BOND|M
1053||(sideways glance)|location||
1054|BOND|'Make sure you wear the uniform'?|speech|BOND|M
1055||(ignoring his jibe)|location||
1056|M|What do you make of all this?|speech|M|M
1057|BOND|It doesn't quite add up.|speech|BOND|M
1058||They've come to a door. Pause as he opens it. He explains:|stage direction||
1059|BOND|"The infrared satellite images. No
heat, no flame, no explosion. If
that boat went down where they said
it did, there should have been some
residual heat reading on the surface."|speech|BOND|M
1060|M|Sabotage?|speech|M|M
1061|BOND|"A three-thousand ton frigate doesn't
just vanish into thin air."|speech|BOND|M
1062||She nods and pushes through the door. He follows.|stage direction||
1063||EXT. BANK OF LONDON - NIGHT - CONTINUOUS -|location||
1064|M|"I've already contacted our station in
Kuala Lumpur. They're lining up a
local contact."|speech|M|M
1065||(beat)|location||
1066|M|"I want you to find that gold, and
secure it."|speech|M|M
1067||They've arrived at her car. The door is already open.|stage direction||
1068|BOND|"... Didn't Elliot Harmsway just move
his headquarters to Kuala Lumpur?"|speech|BOND|M
1069||She turns, freezes Bond with a look:|stage direction||
1070|M|"Contrary to what you may believe,
007, the world is not filled with
mad-men who can hollow out volcanoes,
stock them with big-breasted women,
and threaten the world with nuclear
annihilation."|speech|M|M
1071||Bond reacts to the comeuppance. She continues:|stage direction||
1072|M (cont'd)|"The case is closed. The Italian
authorities ruled the girl a suicide.
We had enough trouble keeping your
name out of the media. For
everyone's sake -"|speech|M|M
1073||(beat)|location||
1074|M (cont'd)|"Your job is to find the gold. Not
settle some personal score with
Elliot Harmsway."|speech|M|M
1075||EXT. 'HARMSWAY BUILDING' (HONG KONG AND SHANGHAI BANK) - HONG KONG - DUSK|location||
1076||"Super: HONG KONG. Harmsway's helicopter is perched atop the famous
tinker-toy-styled building in the Central district."|stage direction||
1077||INT. PENTHOUSE BOARDROOM - DUSK|location||
1078||"A CHINESE CHOP comes down firmly on a legal document. GENERAL LI (of
the People's Revolutionary Army) is seated with a squad of lawyers:"|stage direction||
1079|GENERAL LI|"And that is the fifth document. With
your counter-signature, the sale will
be complete."|speech|GENERAL LI|M
1080||"The document is passed across to HARMSWAY, sitting with his own legal
counsel. One of the men is WHISPERING TO HIM, INTENSELY:"|stage direction||
1081|YOUNG CHINESE LAWYER|Are you sure? If we waited -|speech|YOUNG CHINESE LAWYER|?
1082||Harmsway waves the lawyer off, silencing him. Addresses the General:|stage direction||
1083|HARMSWAY|"General Li: My young associate here
has just informed me that if I waited
a year, I could perhaps receive a
higher price for this building."|speech|HARMSWAY|M
1084||(beat, wryly)|location||
1085|HARMSWAY|"He has great faith in Hong Kong. As did
my ancestors. With obvious results."|speech|HARMSWAY|M
1086||Nervous chuckles around the table, but the General is reserved.|stage direction||
1087|HARMSWAY (cont'd)|"Yet to sell this building for more
money - to profiteer - would run counter
to the Chinese sprit of guanchi - mutual
trust and obligation; it would violate
the ancient principles of feng shui -"|speech|HARMSWAY|M
1088||(beat)|location||
1089|HARMSWAY (cont'd)|"- the reason we sign five documents
instead of an unlucky four, and why this
building has a fifth, non-functioning
ventilation shaft on its roof."|speech|HARMSWAY|M
1090||(beat)|location||
1091|HARMSWAY (cont'd)|"Wind and water, fire and rain, earth
and sky - feng shui. All things - at
one, in balance, with nature."|speech|HARMSWAY|M
1092|GENERAL LI|...Most eloquently put, Sir Elliot.|speech|GENERAL LI|M
1093|HARMSWAY|"Thank you, General Li. Now I'll just
sign this last document -"|speech|HARMSWAY|M
1094||He puts the pen to the paper, and BREAKS THE PEN. Alarmed looks.|stage direction||
1095|HARMSWAY (cont'd)|Terribly sorry. Mr. Stamper?|speech|HARMSWAY|M
1096||"From behind, Stamper hands him a pen. Harmsway innocently starts to
sign in RED INK -"|stage direction||
1097|GENERAL LI|Sir Elliot! Red ink -|speech|GENERAL LI|M
1098|HARMSWAY|"Of course! How foolish. More bad
luck. I'll just borrow yours -"|speech|HARMSWAY|M
1099||He takes General Li's pen, and signs his name with a flourish.|stage direction||
1100||EXT. ROOF OF 'HARMSWAY BUILDING' -|location||
1101||"Under the whirring blades of the chopper, Harmsway bids farewell to
General Li. He and Stamper get in helicopter.
CLOSE ON THE HELICOPTER -
As Harmsway waves good-bye from the window, the helicopter rises,
REVEALING a METAL CABLE attached to the LANDING SKID.
WIDER -
The cable leads to a spool, which runs to the FIFTH METAL VENTILATION
SHAFT Harmsway referred to in the last scene."|stage direction||
1102||INT. HELICOPTER - AIRBORNE -|location||
1103||Harmsway pops open a bottle of champagne.|stage direction||
1104|HARMSWAY|An old Chinese toast to our friends...|speech|HARMSWAY|M
1105||"RETURN ON ROOFTOP HELIPAD -
The General SEES THE CABLE GROW TAUT AROUND THE VENTILATION SHAFT.
He reacts with horror."|stage direction||
1106||INT. HELICOPTER/HARMSWAY ROOFTOP POV -|location||
1107||"Harmsway glances down to watch the VENTILATION SHAFT TOPPLE onto the
General and his aides, scattering them like rats.
In the chopper, the pilot cuts the cable, and Harmsway lifts a
champagne glass:"|stage direction||
1108|HARMSWAY|"Confusion to the enemy. In 48 hours,
that building - and all of Hong Kong
around it - will cease to exist."|speech|HARMSWAY|M
1109||"AERIAL - SKIES ABOVE STRAIT OF MALACCA - DAY -
A BRITISH MILITARY C-130 airship is dropping sono-buoys into the
water from a low altitude. me plane veers off, revealing A BRITISH
SEA KING command and control helicopter, hovering above."|stage direction||
1110||INT. SEA KING HELICOPTER - AIRBORNE - DAY|location||
1111||"Bond holds a map of the channel. He's standing over several CREWMAN
seated at radar, sonar, and navigation consoles."|stage direction||
1112|CREWMAN 1|Sounding: Bottom is thirty fathoms.|speech|CREWMAN 1|?
1113|CREWMAN 2|Nothing. Negative bounce.|speech|CREWMAN 2|?
1114|BOND|We should be right over it.|speech|BOND|M
1115||They hear a SHARP DINGING SOUND -|stage direction||
1116|OPERATOR 2|Wait - I'm getting something.|speech|OPERATOR 2|?
1117|BOND|Where? What is it?|speech|BOND|M
1118||"The man points at one of the screens, where Bond sees a COMPUTER
GENERATED MAP OF THE SEA FLOOR, with the FAINT OUTLINE of a WARSHIP."|stage direction||
1119|OPERATOR 2|Not sure yet -|speech|OPERATOR 2|?
1120||"He types in some commands on a keyboard, and a 3-D rendering of a
boat appears on another computer screen. Lots of data:"|stage direction||
1121|OPERATOR 2|"The Shinjuku. Japanese troop
carrier. World War II."|speech|OPERATOR 2|?
1122|BOND|Let's make another pass.|speech|BOND|M
1123||(calling out)|location||
1124|CO-PILOT|We have traffic on the deck -|speech|CO-PILOT|?
1125||They look down and see an HNN (Harmsway News Network) boat.|stage direction||
1126|BOND|Get rid of them.|speech|BOND|M
1127||"NEW ANGLE - EXT. SEA RING CHOPPER & HNN BOAT -
The chopper hovers above the HNN boat -"|stage direction||
1128|PILOT (on pa speaker)|"Please leave the area. please leave
the area."|speech|PILOT|M
1129||EXT. HNN WORLD HEADQUARTERS (PETRONAS TOWERS)- KUALA LUMPUR - DAY|location||
1130||"We're looking up at the world's tallest building: The 1500' twin
Petronas Towers. (They look like an architectural collaboration
between Friz Lang and H.G. Wells.) At the 50th floor, there's a sky
bridge connecting the buildings, where -"|stage direction||
1131||INT. SKY BRIDGE - (HNN HEADQUARTERS) - DAY|location||
1132||"Elliot Harmsway strides out of an elevator (in Tower 1,) into a group
of waiting assistants. Without breaking stride -"|stage direction||
1133|YOUNG MALE ASSISTANT 1|"Good morning Sir Elliot! Welcome to
Kuala Lumpur -"|speech|YOUNG MALE ASSISTANT 1|?
1134|HARMSWAY|Morning, morning all. What have we got?|speech|HARMSWAY|M
1135||"His EXECUTIVE SECRETARY rushes to keep up, reading from a pad, as
they cross the sky bridge to HNN's main reception area, in Tower 2:"|stage direction||
1136|EXECUTIVE SECRETARY|"The Canadian Prime Minister wants to
set a lunch -"|speech|EXECUTIVE SECRETARY|?
1137|HARMSWAY|Pencil it in for the next trip -|speech|HARMSWAY|M
1138|EXECUTIVE SECRETARY|"The American presidential candidate called
to complain about that sex story -"|speech|EXECUTIVE SECRETARY|?
1139|HARMSWAY|"Send him a $10,000 campaign contribution,
and explain I have no control over
what my journalists write -"|speech|HARMSWAY|M
1140|EXECUTIVE SECRETARY|"Your bankers want an answer about the
Brazilian TV stations"|speech|EXECUTIVE SECRETARY|?
1141|HARMSWAY|No -|speech|HARMSWAY|M
1142|EXECUTIVE SECRETARY|The Queen invited you to dinner -|speech|EXECUTIVE SECRETARY|?
1143|HARMSWAY|Yes -|speech|HARMSWAY|M
1144|EXECUTIVE SECRETARY|And the 9:30 news meeting is waiting.|speech|EXECUTIVE SECRETARY|?
1145|HARMSWAY|Excellent.|speech|HARMSWAY|M
1146||They've passed from the bridge, through reception, into:|stage direction||
1147||INT. CONFERENCE ROOM - HNN HEADQUARTERS - CONTINUOUS - DAY|location||
1148||"A glass conference roam, whose PARTIALLY CLOSED BLINDS obscure the
view of the MAMMOTH HNN NEWS CENTER. (We'll see this, in full,
later.) Meanwhile, a DOZEN RAMBUNCTIOUS EDITORS react to:"|stage direction||
1149|HARMSWAY|"Morning, all my golden retrievers.
What kind of havoc shall we create in
the world today?"|speech|HARMSWAY|M
1150|NEWS EDITOR 1|"- A ferry sank and burned in
Pakistan; 457 dead."|speech|NEWS EDITOR 1|?
1151|HARMSWAY|Good.|speech|HARMSWAY|M
1152|NEWS EDITOR 2|American jetliner down in Omaha -|speech|NEWS EDITOR 2|?
1153|HARMSWAY|Better.|speech|HARMSWAY|M
1154|NEWS EDITOR 3|Economic summit ends in Tokyo -|speech|NEWS EDITOR 3|?
1155|HARMSWAY|Boring -|speech|HARMSWAY|M
1156|NEWS EDITOR 1|"Riots broke out at the World Cup soccer
finals -"|speech|NEWS EDITOR 1|?
1157|HARMSWAY|Dog bites man.|speech|HARMSWAY|M
1158||(explains)|location||
1159|HARMSWAY|"Man bites dog is a news story. Riots at
the World Cup soccer finals is a social
announcement. Next?"|speech|HARMSWAY|M
1160|NEWS EDITOR 4|"This just came in: There's something
up with the British Navy in the
Strait. Rescue planes, helicopters;
two ships supposedly sailing from the
Persian gulf. They just chased away
one of our news boats."|speech|NEWS EDITOR 4|?
1161||(feigning complete innocence)|location||
1162|HARMSWAY|Is that so?|speech|HARMSWAY|M
1163|NEWS EDITOR 4|"Yeah. Sounds like a plane went down
or something... Either way, they're
calling it - all together now:"|speech|NEWS EDITOR 4|?
1164|ALL AT TABLE|"""A routine training exercise."""|speech|ALL AT TABLE|?
1165|HARMSWAY|"I'm shocked!! Issue the usual vehement
protest: Freedom of the press, people's
right to know... Lather it up with a lot
of righteous indignation."|speech|HARMSWAY|M
1166||(off their laughter)|location||
1167|HARMSWAY|Next?|speech|HARMSWAY|M
1168||INT. SEA KING HELICOPTER - AIRBORNE - DAY|location||
1169||Frowning, Bond peers at the Sonar Operator's screen.|stage direction||
1170|BOND|Still nothing?|speech|BOND|M
1171||The operator shakes his head. The pilot calls back from the cockpit:|stage direction||
1172|CO-PILOT|"Commander Bond: They've found one of
the crewman's bodies!"|speech|CO-PILOT|?
1173||EXT. COASTAL INLET - MARSHLAND - STRAIT OF MALACCA - DAY|location||
1174||"The Sea King comes in above several police cars and boats. Bond
jumps the last ten feet, and the chopper peels off."|stage direction||
1175|MALE VOICE (O.S.)|Yo! Jimbo!|speech|MALE VOICE|?
1176||Bond turns to look: It's JACK WADE.|stage direction||
1177|BOND|Wade, what the hell are you doing here?|speech|BOND|M
1178|WADE|"I am not here, ol' buddy. The CIA has
absolutely no knowledge of the
missing ship, the missing gold, where
it was going, or when it left Hong
Kong."|speech|WADE|M
1179|BOND|That's reassuring.|speech|BOND|M
1180|WADE|Hey - the world is my office.|speech|WADE|M
1181|BOND|Let's take a look at the body.|speech|BOND|M
1182||As Bond moves off, WADE SNIFFS THE AIR, savoring the aroma:|stage direction||
1183|WADE|Smells like... Coffee plants.|speech|WADE|M
1184||"NEW ANGLE -
A POLICEMEN pulls a white sheet from the body. (We don't see it.)
Bond and Wade look down at something gruesome:"|stage direction||
1185|WADE|Colorful... Shark attack?|speech|WADE|M
1186||Bond shakes his head grimly.|stage direction||
1187|BOND|"I don't think so. The veins are
cauterized - as if they were sealed
by heat..."|speech|BOND|M
1188||(beat, confounded)|location||
1189|BOND|"But there are no burn marks on the
flesh. It doesn't make sense."|speech|BOND|M
1190||(to the policeman)|location||
1191|BOND|Who found the body?|speech|BOND|M
1192||(points to)|location||
1193|POLICE OFFICER|"Dato. Local fisherman. Says it came
in with the tide early this morning."|speech|POLICE OFFICER|?
1194|BOND|"Ask him if it could have washed in
from the west side of the Strait."|speech|BOND|M
1195||The POLICEMAN has an animated conversation with FISHERMAN. Then:|stage direction||
1196|POLICEMAN|"No. He says it's not possible. The
current could have only brought the
body in from the east."|speech|POLICEMAN|?
1197||(to Wade)|location||
1198|BOND|You have a boat?|speech|BOND|M
1199|WADE|I don't know if you'd call it a boat...|speech|WADE|M
1200|BOND|Something with an engine? Not oars?|speech|BOND|M
1201|WADE|Step into my office.|speech|WADE|M
