|character|text|type|character_clean|gender
1788||"Sidney comes out onto a floor still under construction. The elevator
doors CLOSE behind her. To the right, she sees STAMPER and a
Harmsway-blazered GUARD, with MACHINE PISTOLS."|stage direction||
1789|SIDNEY|Thank God! He's crazy!|speech|SIDNEY|F
1790|STAMPER|Does he have a gun?|speech|STAMPER|M
1791|SIDNEY|No.|speech|SIDNEY|F
1792||On Stamper's reply -|stage direction||
1793|STAMPER|Good -|speech|STAMPER|M
1794||"He lunges for her, grabs her, spins her around, overwhelming her.
She struggles, yelling:"|stage direction||
1795|SIDNEY|This is a mistake!|speech|SIDNEY|F
1796||(gun against her skull)|location||
1797|STAMPER|Shut up!|speech|STAMPER|M
1798||"Using Sidney as a HUMAN SHIELD, Stamper marches her in front of the
closed elevator doors. The guard follows. THEY POSITION THEMSELVES
FOR A MASSACRE. Reaching around Sidney, Stamper pulls out his RADIO:"|stage direction||
1799|STAMPER (into radio)|Open 14.|speech|STAMPER|M
1800||"A beat. It opens. The men unleash a HAIL OF BULLETS, then realize -
NEW ANGLE - (INT. ELEVATOR) -
The car is empty. Stamper perplexed. Pushing Sidney in front of
him, he enters the elevator, cautiously... When, suddenly:
BOND SWINGS DOWN OUT OF THE ESCAPE PANEL (like an athlete on a high-
bar) FEET FIRST - barely clearing Sidney's head as he KICKS Stamper
and the Guard in their faces. They go flying backwards.
Bond jumps down, grabs Sidney -"|stage direction||
1801|BOND|Need a lift?|speech|BOND|M
1802||And boosts her into the escape panel, following her up.|stage direction||
1803||INT. ELEVATOR SHAFT - ABOVE THE ELEVATOR - (CONTINUOUS) -|location||
1804||"Bond and Sidney rush forward to the front wall as -
STAMPER AND THE GUARD -
Recover, grab their guns, move to the threshold, and START RAKING THE
CEILING WITH GUNFIRE.
ELEVATOR SHAFT -
Bond presses his body against Sidney, on the front wall, trying to
SHIELD HER as BULLETS RIP UP THE FLOOR behind them. With his free
hand, Bond reaches up for the LATCH to open the door above them."|stage direction||
1805||INT. ELEVATOR -|location||
1806||"Stamper stops shooting. Moves to the rear of the cab, under the
escape panel. Peers up. Sees nothing. Turns to the Guard:"|stage direction||
1807|STAMPER|Help me up.|speech|STAMPER|M
1808||"ELEVATOR SHAFT -
Stamper's head pokes up through the hole just as Bond and Sidney have
disappeared into -"|stage direction||
1809||INT. HALLWAY - (ELEVATOR BANK) - 71ST FLOOR.|location||
1810||"Squeezing out from between the elevator doors, (which immediately
close behind them,) Bond and Sidney encounter a group of STUNNED
OFFICE WORKERS, waiting for the elevator."|stage direction||
1811||(to the office workers)|location||
1812|BOND|... I'd try the stairs.|speech|BOND|M
1813||"As Bond and Sidney scamper off -
RETURN ON STAMPER - IN THE ELEVATOR -"|stage direction||
1814||(rushing out)|location||
1815|STAMPER|The stairs!|speech|STAMPER|M
1816||(barking into his RADIO)|location||
1817|STAMPER|"Attention all units! They're on the
71st floor!"|speech|STAMPER|M
1818||INT. ELEGANT HALLWAY - ANOTHER PART OF THE BUILDING -|location||
1819||Harmsway is striding towards the SECURITY CENTER, RADIO in hand:|stage direction||
1820|HARMSWAY|"Stamper! They're not to leave this
building alive!"|speech|HARMSWAY|M
1821||"BOND AND SIDNEY - (INT. HALLWAY) -
Moving cautiously toward a CORNER of ANOTHER HALLWAY."|stage direction||
1822|SIDNEY|This has got to be a mistake.|speech|SIDNEY|F
1823|BOND|"The only mistake is that they didn't
kill us in the elevator."|speech|BOND|M
1824||"At the corner, Bond STOPS, SEEING A GUARD, farther down the hall (his
back to them) CHECKING DOORS."|stage direction||
1825|BOND|Wait here.|speech|BOND|M
1826|SIDNEY|No. I'm going with you.|speech|SIDNEY|F
1827||"Bond frowns, but doesn't have the time to argue. They start doing a
""DUCK AND COVER"" in and out of doorways TO SNEAK UP ON HIM."|stage direction||
1828||INT. SECURITY CENTER -|location||
1829||Harmsway bursts in on GUARDS watching a WALL OF SECURITY MONITORS.|stage direction||
1830|HARMSWAY|Where are they?|speech|HARMSWAY|M
1831|GUARD #1|I don't see them -|speech|GUARD #1|?
1832||(scanning the monitors)|location||
1833|GUARD #1|There!|speech|GUARD #1|?
1834||"INSERT VIDEO MONITOR - (SURVEILLANCE SHOT OF HALLWAY) -
Bond and Sidney have just come into frame, sneaking up on the GUARD."|stage direction||
1835|HARMSWAY (OVER)|Warn him!|speech|HARMSWAY|M
1836||CLOSE ON THE GUARD - (INT. HALLWAY) -|stage direction||
1837|VOICE ON RADIO|Porter! They're behind you -|speech|VOICE ON RADIO|?
1838||(lifting the radio to reply)|location||
1839|GUARD|Roger! Over and -|speech|GUARD|M
1840||BAM. BOND DECKS HIM.|stage direction||
1841|BOND|Out.|speech|BOND|M
1842||Bond kneels, grabs the GUARD'S MACHINE PISTOL, and CLIPS, just as -|stage direction||
1843|SIDNEY|JAMES!|speech|SIDNEY|F
1844||"TWO GUARDS have entered from a STAIRCASE DOOR, hoisting MAC-10's. In
an instant: (1) Bond lets go a BURST. (2) The Guards SHOOT back,
diving for cover in the staircase door. (3) Bond rolls, (4) Pushes
Sidney into an open DOORWAY, and (5) returns A BURST, from -"|stage direction||
1845||INT. SMALL KITCHEN/COPIER ROOM -|location||
1846||Sidney is shaken. As Bond stands in the doorway, guarding them -|stage direction||
1847|SIDNEY|Okay. So it wasn't a mistake.|speech|SIDNEY|F
1848||(Bond lets go a blast)|location||
1849|SIDNEY|"What do we do now? Offer them
dinner?!?!"|speech|SIDNEY|F
1850||"Bond glances back at the KITCHEN SUPPLIES. GETS AN IDEA. He sud-
denly TWISTS, SMASHING the BUTT OF HIS GUN down on some GLASSWARE on
the counter, then TWISTS BACK, returning a BURST OF GUNFIRE."|stage direction||
1851|BOND|Come here. You shoot. I'll cook.|speech|BOND|M
1852||She thinks he's nuts, but squeezes next to him. Handing her the gun:|stage direction||
1853|BOND|Aim that way.|speech|BOND|M
1854||"Sidney scowls - as Bond moves off-camera - when suddenly, BULLET HITS
RIP UP THE DOOR FRAME. She jumps, TERRIFIED.
Bond looks at her from the PHOTO-COPYING MACHINE, where he is YANKING
OUT the TONER CARTRIDGE. He offers a simple piece of advice:"|stage direction||
1855|BOND|Shoot back!|speech|BOND|M
1856||Sidney frowns... Turns... And as she LETS THE GUN RIP, we cut to:|stage direction||
1857||INT. STAIRWELL - (ON THE OTHER SIDE OF THE BUILDING) -|location||
1858||"Stamper, running up steps with the guard. They exit into:
A SHORT SERVICE HALLWAY - 71ST. FLOOR -
They rush though it, bursting through a door into:
THE ELEVATOR BANK HALLWAY -
Stamper and the Guard start hunting Bond.
RETURN ON SIDNEY (HALLWAY/KITCHEN) -
As she continues to exchange fire with the guards...
BOND, (having broken the toner cartridge open,) is DUMPING THE TONER
in a coffee can. He reaches for a BOX of sugar"|stage direction||
1859|BOND|One second -|speech|BOND|M
1860||"And (with GUNFIRE SFX over,) Bond sweeps the BROKEN DISH into the
can, and drops his Q LIGHTER in the mix.
He moves to Sidney, in the doorway. Kneels. In-between shots:"|stage direction||
1861|BOND|"... How did you get into marine
salvage?"|speech|BOND|M
1862||(gun burst, then)|location||
1863|SIDNEY|My father left me the business.|speech|SIDNEY|F
1864||"Bond glances at his watch, timing the bomb. The guards shoot; she
shoots back, then explains:"|stage direction||
1865|SIDNEY|"I used to be a divorce lawyer in New
York City."|speech|SIDNEY|F
1866||Bond nods, continuing to look at his watch. Glances at her:|stage direction||
1867|BOND|Not a lot of difference.|speech|BOND|M
1868|SIDNEY|What do you mean?|speech|SIDNEY|F
1869||Bond reaches forward to toss the coffee can -|stage direction||
1870|BOND|"Either way, you're taking the goods
from dead hulks."|speech|BOND|M
1871||"He tosses the can, and PULLS HER BACKWARDS, covering her.
NEW ANGLE - THE HALLWAY -
The GUARDS spring from the door, rushing forward to storm Bond's
position - just as the COFFEE CAN rolls towards them, and EXPLODES.
RETURN ON BOND AND SIDNEY IN THE KITCHEN -"|stage direction||
1872|BOND|Let's go -|speech|BOND|M
1873||"Taking the gun, the two of them start for the door when -
NEW ANGLE - OPPOSITE END OF THE HALLWAY - CORNER -
Stamper and the GUARD have arrived at the corner, BLASTING.
RETURN ON BOND AND SIDNEY IN THE KITCHEN -"|stage direction||
1874|BOND|Damn!|speech|BOND|M
1875||"Swiftly, Bond grabs a JUG of CLEANER from under the sink, moves to
the door, and ROLLS IT DOWN THE HALL in Stamper's direction.
STAMPER AND THE GUARD - (HALLWAY CORNER) -
Anticipate a bomb. They move back.
BOND AND SIDNEY (INT. KITCHEN) -"|stage direction||
1876|SIDNEY|What the hell does that do?|speech|SIDNEY|F
1877|BOND|Cleans dirt. Let's go.|speech|BOND|M
1878||INT. HALLWAY -|location||
1879||"Bond and Sidney BREAK for the STAIRCASE DOOR. (Where the first Guards
were shooting at them from.) TWISTING AROUND, Bond lets a BURST go
in Stamper's direction, as he stoops to scoop up one of the dead
guards' MAC-l0's.
INSERT - BOND'S BULLETS RIP UP THE JUG OF CLEANER.
BOND AND SIDNEY ESCAPE FROM THE HALLWAY -
STAMPER -
Cowers, waiting for the jug to blow up... Then realizes:"|stage direction||
1880|STAMPER|It's a trick! After him.|speech|STAMPER|M
1881||(into his radio, on the run)|location||
1882|STAMPER|They're in the south stairwell!|speech|STAMPER|M
1883||HARMSWAY, IN THE SECURITY CENTER -|stage direction||
1884|HARMSWAY|Get more men up there!|speech|HARMSWAY|M
1885||INT. STAIRWELL - LANDING -|location||
1886|SIDNEY|Down?|speech|SIDNEY|F
1887||Bond leans over the railing. Sees GUARDS coming UP. SHOOTS.|stage direction||
1888|BOND|Up.|speech|BOND|M
1889||They go up about three stairs, and Sidney sees GUARDS descending.|stage direction||
1890|SIDNEY|Down?|speech|SIDNEY|F
1891||(shoots, then)|location||
1892|BOND|Up.|speech|BOND|M
1893||Bond and Sidney bound up the stairs through a METAL DOOR, just as -|stage direction||
1894||INT. HALLWAY -|location||
1895||Stamper and the Guard bound down the hallway, heading for the door.|stage direction||
1896||INT. SECURITY CENTER -|location||
1897||Harmsway smiles, watching Bond on a monitor:|stage direction||
1898|HARMSWAY|... And so much for that.|speech|HARMSWAY|M
1899||(into radio)|location||
1900|HARMSWAY|They're on the 72nd floor set-back.|speech|HARMSWAY|M
1901||(explains to the guards)|location||
1902|HARMSWAY|Nowhere to go.|speech|HARMSWAY|M
1903||EXT. 72ND FLOOR - TERRACE SETBACK - TWILIGHT -|location||
1904||"It's magic hour as Bond and Sidney rush out onto the setback. Bond
sees a WINDOW WASHER'S RIG. And although Sidney asks -"|stage direction||
1905|SIDNEY|Now what?|speech|SIDNEY|F
1906||"Bond's first concern is to make sure Stamper can't get them. Amidst
a pile of CONSTRUCTION EQUIPMENT, he spots a PNEUMATIC NAIL GUN. He
grabs it, and -
BANG. BANG. BANG. He fires 3 NAILS through the door into the frame."|stage direction||
1907|BOND|That should buy us some time.|speech|BOND|M
1908||"Now, Bond moves to the WINDOW WASHER'S RIG - a two-man bucket-like
scaffold ON TRACKS, with TWO LEATHER SAFETY HARNESSES inside, and a
LARGE CABLE SPOOL/MOTOR that stays on the roof.
Approaching it, Bond looks over the side:
BOND'S POV - LOOKING DOWN FROM 72ND FLOOR -
Twenty stories below is the sky bridge. 50 stories below that, the
ground. It's a long, long, way down.
RETURN ON BOND - AT THE WINDOW WASHER'S RIG - TERRACE SET-BACK -"|stage direction||
1909|BOND|Help me move this.|speech|BOND|M
1910||INT. STAIRWELL -|location||
1911||"Darting up the few steps, Stamper and Guards arrive at the door. He
tries to open it. Won't budge."|stage direction||
1912|GUARD|I'll call for a battering ram -|speech|GUARD|M
1913|STAMPER|No. Get the fire ax.|speech|STAMPER|M
1914||"One of the guards grabs it from inside a FIRE CABINET. He hands the
AX to Stamper, who takes the first SWING AT THE DOOR.
RETURN ON BOND - TERRACE SET-BACK - EXT. 72ND FLOOR - TWILIGHT -
Bond is positioning the window washer rig. He explains:"|stage direction||
1915|BOND|"We'll go down close to the sky bridge.
We may be able to swing over and use it
for cover."|speech|BOND|M
1916||As Bond climbs into the bucket, Sidney peers over the side.|stage direction||
1917|SIDNEY|No way. I sail. I do not fly.|speech|SIDNEY|F
1918||BANG! Behind them, Stamper's AX HAS JUST PENETRATED THE DOOR.|stage direction||
1919|BOND|"... Sometimes, you just have to take
the plunge."|speech|BOND|M
1920||"Bond yanks her in, flips switches on the control pod, and starts
down, as fast as they can go."|stage direction||
1921||EXT. HARMSWAY TOWERS - AERIAL -|location||
1922||Bond and Sidney descend. Tiny specs against the sunset.|stage direction||
1923||INT. STAIRCASE -|location||
1924||Stamper gives the last few chops to the door. He kicks it open.|stage direction||
1925||EXT. TERRACE SET-BACK - 72ND FLOOR -|location||
1926||"Stamper and the guards rush to the ledge.
BOND AND SIDNEY - DESCENDING ON THE RIG - 60TH FLOOR -
Bond, looking up - for Stamper - and down - to check their progress."|stage direction||
1927|SIDNEY|"All I know is one thing: If we get
out of here alive, that gold is mine."|speech|SIDNEY|F
1928||(beat)|location||
1929|SIDNEY|I've earned it.|speech|SIDNEY|F
1930||Looking upward, Bond SEES STAMPER peering over the rail. BOND FIRES.|stage direction||
1931|BOND|One thing at a time.|speech|BOND|M
1932||EXT. TERRACE SET-BACK - TWILIGHT -|location||
1933||"Stamper jumps back from the ledge, enraged. Ax in hand, he moves to
the WINDOW WASHING RIG'S MACHINERY -
And takes a roundhouse swing at the UNSPOOLING CABLE - but instead of
cutting it, the ax BOUNCES OFF, and the RIG SLIDES ON ITS TRACKS.
THE RIG - (STILL DESCENDING) -
Swings! Sidney SCREAMS - almost falling out. Bond grabs her. They
are now 5 STORIES DIRECTLY ABOVE THE SKY BRIDGE, swaying like a giant
pendulum - although still descending.
RETURN ON STAMPER - TERRACE SET-BACK - 72ND FLOOR - TWILIGHT -
Having failed at the cable, Stamper goes at the PULLEY feeding it.
He swings. Swings again. With each blow, the pulley shaft weakens.
BOND AND SIDNEY - (WINDOW WASHER'S RIG) -
Dropping in VIOLENT SPURTS - just trying to stay in the damn bucket.
STAMPER - WIELDING THE AX -
Finally, the pulley shaft SHATTERS. THE CABLE GRINDS TO A HALT.
BOND AND SIDNEY -
are stopped about 20 feet above the sky bridge."|stage direction||
1934||(panicked, anxious, fast)|location||
1935|SIDNEY|"What now? And don't give me some
movie clich like 'trust me.'"|speech|SIDNEY|F
1936||(what the hell)|location||
1937|BOND|Trust me.|speech|BOND|M
1938||And with this, he turns, and SHOOTS OUT the adjacent WINDOW.|stage direction||
1939|BOND|Let's go -|speech|BOND|M
1940||"But as he starts to climb out - SIDNEY SCREAMS! THE CABLE SUDDENLY
DROPS THEM 10 FEET LOWER, BELOW THE WINDOW.
THE TERRACE SET-BACK -
Stamper whacks away at the side of the cable drum. It's coming loose
from its moorings.
BOND AND SIDNEY -
look down at the curved glass top of the sky bridge - facing what
(she thinks) is certain death:"|stage direction||
1941|SIDNEY|We're going to bounce off that thing!|speech|SIDNEY|F
1942||"Bond looks up - assuming they have only seconds left before Stamper
cuts the cable. HE GRABS HER:"|stage direction||
1943|BOND|Hold on!|speech|BOND|M
1944||"TERRACE SET-BACK - 72ND FLOOR - TWILIGHT -
Stamper takes a final swing at the cable drum. With a GREAT CLAT-
TERING SOUND it SNAPS FREE OF THE MOORINGS, smashes into the wall,
and the whole mechanism CAREENS OVER THE SIDE OF THE BUILDING.
THE WINDOW WASHER'S RIG -
Bond and Sidney feel the cable give way. They start to free-fall.
BOND - FIRES HIS MACHINE PISTOL at the glass top of the sky bridge.
THE BULLETS SHATTER THE GLASS -
BOND AND SIDNEY CRASH THROUGH, INTO -"|stage direction||
1945||INT. 50TH FLOOR SKY BRIDGE -|location||
1946||"Landing on the deck of the bridge. Bond rolls to his feet as -
Fifty stories of cable from above is falling onto the deck. Bond
yanks Sidney to the side of the building, just as THE CABLE DRUM,
PULLEY, AND THE REST OF THE MECHANICS CRASH ON THE WALK-WAY.
72ND FLOOR TERRACE SET-BACK -
Looking down, Stamper flips open his radio."|stage direction||
1947||(over radio)|location||
1948|STAMPER|"They're on the bridge. Seal off the
50th floor!"|speech|STAMPER|M
1949||INT. SECURITY CENTER -|location||
1950||(looking at the monitors)|location||
1951|HARMSWAY|I should have hired this man.|speech|HARMSWAY|M
1952||(to his guards)|location||
1953|HARMSWAY|Get somebody up there!|speech|HARMSWAY|M
1954||INT. SKY BRIDGE - TWILIGHT -|location||
1955||Bond is moving to the window washer rig debris.|stage direction||
1956|SIDNEY|What about the elevators?|speech|SIDNEY|F
1957||"He steps to the side of the bridge, and looks at the railings: Four
inch pipe. Bond begins to work feverishly:"|stage direction||
1958|BOND|We tried that already. Remember?|speech|BOND|M
1959||Bond picks up the cable and the leather harnesses.|stage direction||
1960|SIDNEY|"You know, this is as much your fault
as it is mine."|speech|SIDNEY|F
1961||Bond is slipping the cable around the railing pipe. One loop.|stage direction||
1962|BOND|Sidney, we don't have time for this -|speech|BOND|M
1963||He pulls on the loop to test it. Good enough. Makes a second loop.|stage direction||
1964|SIDNEY|Sure! Just when I want to talk -|speech|SIDNEY|F
1965||(beat)|location||
1966|SIDNEY|Not that I would have believed you -|speech|SIDNEY|F
1967||Bond tests the second loop. He's satisfied. Turns to her:|stage direction||
1968|BOND|"Put your back to the railing. Sit up
on it."|speech|BOND|M
1969||(doing it)|location||
1970|SIDNEY|Are you listening to me?|speech|SIDNEY|F
1971|BOND|"Put your arms around my neck. Lock
your legs around my waist."|speech|BOND|M
1972|SIDNEY|... We have time for that?|speech|SIDNEY|F
1973||"Just then, GUARDS APPEAR OUT OF FAR ELEVATOR DOOR. Running, THEY
SHOOT. BOND FIRES A BURST BACK as - A NEW ROUND OF BULLET HITS
BEGINS TO RAIN DOWN ON THEM FROM ABOVE.
BOND LOOKS UP: Stamper has commandeered a second window washer's
rig, and is descending, FIRING AT THEM.
Bond looks at Sidney -"|stage direction||
1974|BOND|Sometimes you just have to -|speech|BOND|M
1975|SIDNEY|Don't say it.|speech|SIDNEY|F
1976||"She locks her arms and legs around him, he snaps the leather harness
around her waist, and they roll over the railing Amidst gunfire."|stage direction||
1977||EXT. HARMSWAY TOWERS - TWILIGHT|location||
1978||"Bond and Sidney fall from the bridge - 50 stories up.
They go down,
And down,
And down -
RETURN ON THE RAILING - (INT. SKY BRIDGE) -
The cable looped around the railing is slowing their descent; the
PAINT ON THE RAILING IS BURNING OFF, and the STEEL itself is STARTING
TO SMOKE from the friction.
BOND AND SIDNEY - DROPPING -
Dropping -
And Dropping.
Looking to the ground, Bond sees the PRESS ROOM OBSERVATION BALCONY
coming up fast from below. It looks like they're going to get
splattered on the tile floor, when -
RETURN ON THE RAILING - SKY BRIDGE -
The cable comes to the end of its run! It DRAGS THE SPOOL, THE
BUCKET, and all the other MECHANICS to the side of the bridge,
SMASHING AGAINST THE WALL, JAMMING AGAINST THE RAILING."|stage direction||
1979||EXT. THE PRESS ROOM OBSERVATION BALCONY - TWILIGHT -|location||
1980||"Bond and Sidney jerk to a halt. They're swinging about five feet
from the balcony. There's a pause..."|stage direction||
1981|SIDNEY|Is this - like - a normal day for you?|speech|SIDNEY|F
1982|BOND|It's a lousy job, but -|speech|BOND|M
1983||(reaching for the balcony)|location||
1984|BOND|"The only reason I stay is for the
health benefits."|speech|BOND|M
1985||Bond PULLS THEM OVER TO THE BALCONY.|stage direction||
1986||INT. SKY BRIDGE - TWILIGHT -|location||
1987||"Stamper lands on bridge. He unbuckles his harness, runs to railing,
looks down and sees SIDNEY AND BOND climbing out onto the balcony,
going for the PRESS ROOM DOOR."|stage direction||
1988||(into his radio)|location||
1989|STAMPER|"They're heading for the press room.
Stop them!"|speech|STAMPER|M
1990||INT. PRESS ROOM -|location||
1991||"Bond and Sidney enter at the top of the metal stairs Bond came down
earlier to meet Harmsway.
The Presses are running full blast; the noise is deafening.
At the ""start"" end of the presses - where the paper is fed in - Bond
sees a GIANT ROLL OF NEWSPRINT on a CRANE, about to be loaded.
Directly beyond this is the door to the elevator/wash-up room where
Bond and Harmsway exited earlier. -
Coming out of that DOOR, Bond sees THREE GUARDS in Harmsway Blazers
carrying guns.
BOND shoots the HOOK on the CRANE CARRYING THE NEWSPRINT ROLL.
It CRASHES TO THE GROUND, rolling backwards on the guards. As they
start scrambling around it -
Bond and Sidney race down the stairs, turning in the opposite direc-
tion (toward the finishing end of the press, near the garage...)
They encounter a GORILLA-SIZED PRESSMAN, with an oversized crowbar.
Bond and the Pressman square off. Bond tries to get around him. The
man lifts his crowbar to smash Bond with it. Bond tries to block the
descending crowbar with his gun - but the crowbar snaps it in half.
Bond and the Pressman engage in a short, furious fight - throwing
each other against the side of the press...
Which ends when Bond finally gets the upper hand for a second, and
pushes the man back, into a pile of INK DRUMS. Momentarily stunned,
Bond forces the man's head into an OPEN INK DRUM -
And as he comes up, COVERED WITH INK, gasping for air, Sidney bops
him on the head with the crowbar.
Now, Bond and Sidney take off, toward the garage/exit -
But one of the Guards (from the crashing roll of newsprint) darts out
from between the banks of the printing press, tripping Bond.
Bond stumbles, face down - then spins over, kicking up at the Guard
as he comes to finish Bond off.
The Guard stumbles backward -
Crashing against a NEWSPAPER BALING MACHINE. (A large machine that
wraps steel or plastic bands around bundles of papers for delivery.)
Rushing the man, Bond struggles with him - and manages to FLIP the
BALING SWITCH - literally tying the man up. The only problem is that
as Bond turns -
The LAST GUARD has Sidney in a choke-hold; he's aiming a gun at Bond.
Seemingly at once, (1) Sidney bites the Guard's forearm, (2) Bond
ducks, (3) the Guard shoots wildly, (4) the gun drops, and (5) -
Bond rushes the man, KNOCKING HIM BACKWARDS INTO THE PRINTING PRESS,
pulling Sidney away at the last moment.
The Guard is sucked up in the press rollers, and...
The pages running through the newsprint web suddenly turn BRIGHT RED."|stage direction||
1992|BOND|He was bad news.|speech|BOND|M
1993||"Spotting more Guards coming down the far staircase, Bond grabs Sidney
and the gun, and runs to the NEWSPAPER DELIVERY CHUTE."|stage direction||
1994|BOND|Down there!|speech|BOND|M
1995||They jump into it, sliding down, and around an ALUMINUM CHUTE into:|stage direction||
1996||INT. GARAGE - HARMSWAY TOWERS.|location||
1997||"Bond and Sidney come out near a TROLLEY stacked with newspapers.
Hearts pounding - having left the pressroom's deafening noise -
they're ready for almost anything, except what they HEAR:
The SOUND OF ONE MAN APPLAUDING. A polite, almost bored clapping."|stage direction||
1998|HARMSWAY (O.S.)|"Vert, very, good Mr. Bond. Outstanding
performance."|speech|HARMSWAY|M
1999||"Harmsway is standing with TEN GUARDS, shoulder to shoulder, in a
straight line, all HOLDING WEAPONS on Sidney and Bond."|stage direction||
2000|HARMSWAY (continuing)|"I'm the certain the British taxpayers
would be impressed by your efforts.
Don't you agree?"|speech|HARMSWAY|M
2001|BOND|"I think they'd rather know who stole
their gold."|speech|BOND|M
2002||Harmsway can't help his ego:|stage direction||
2003||(chuckles)|location||
2004|HARMSWAY|"Why, I did, of course. It's on the
Sea Dolphin II, twenty miles outside
of Hong Kong... Not that it will do
either of you any good to know."|speech|HARMSWAY|M
2005||(beat)|location||
2006|HARMSWAY|"Now both of you: Stand up. And toss
the gun out, Mr. Bond."|speech|HARMSWAY|M
2007||"Bond SLIDES THE GUN several feet in front of him... And THROWS A LOOK
TO HIS CAR, noting THE GUARDS ARE LINED UP DIRECTLY IN ITS PATH.
Bond begins to scheme."|stage direction||
2008|SIDNEY|"Uncle Elliot: How could you do this
to me?"|speech|SIDNEY|F
2009||Bond sneaks his hand in his pocket.|stage direction||
2010|HARMSWAY|"Oh, please, Sidney. There's a
hundred billion dollars at stake."|speech|HARMSWAY|M
2011||(beat)|location||
2012|HARMSWAY|"Besides, I never really liked your
father that much. He cheated at cards."|speech|HARMSWAY|M
2013||Bond has removed the CAR REMOTE CONTROL. He palms it.|stage direction||
2014|BOND|"Are your guards really going to kill
a helpless girl?"|speech|BOND|M
2015|HARMSWAY|"My guards are from South Africa, Mr.
Bond. This is their chance to get even
with the formerly 'Great' Britain."|speech|HARMSWAY|M
2016||(beat)|location||
2017|HARMSWAY|"Now both of you. Put your hands on
your heads, and step forward."|speech|HARMSWAY|M
2018||"Holding the remote control, Bond puts his hands on his head. He's
manipulating the control into the right position to use it."|stage direction||
2019||(trying to buy time)|location||
2020|BOND|"What did you do, Harmsway? Make some
deal with the Chinese government for
the gold?.. Was the radioactive
uranium I found in Venice part of it?"|speech|BOND|M
2021||He finally has the remote control in the right position.|stage direction||
2022|HARMSWAY|"Questions, questions, Mr. Bond...
Which I'm afraid I've neither the
time, nor the inclination to answer."|speech|HARMSWAY|M
2023||(to the guards)|location||
2024|HARMSWAY|Take them out to the jungle and -|speech|HARMSWAY|M
2025||"Suddenly, BOND'S CAR ENGINE STARTS WITH A ROAR. The GUARDS TURN, in
shock TOWARDS THE CAR, as:
BOND retrieves the gun he slid out, and pulls Sidney behind the
newspaper trolley, while -
THE CAR BEGINS TO MOVE, sending the guards scrambling.
BOND takes his position with Sidney."|stage direction||
2026|BOND|"I forgot to mention: The job comes
with a car."|speech|BOND|M
