|character|text|type
0||"Written by
Sean Anders & John Morris"|unknown
1||INT. CONFERENCE ROOM|location
2||"A dozen or so shadowy people are seated in the darkened room.
A slide projector dimly lights MR. FULLER, a crew-cutted
Robert Stack type in a suit, as he addresses the group. The
current slide is a still from a security video of a blurry
figure - it could be any of about a billion people."|stage direction
3|FULLER|"...So, let's keep a steely eye out
for this bastard. (THEN) Before we
dismiss, this is your monthly
reminder of why we're here."|speech
4||"Fuller advances to a slide of the American flag. Close on
one of the group - a heavyset bald man in his mid-thirties.
He politely pays close attention to the presentation."|stage direction
5|FULLER (CONT'D)|"The American people want to travel.
(Slide: Family in front of a fake
dinosaur) They want to attend
baseball contests (Slide: Fat guys
spilling beers as they go for a
foul ball) and popular music
concerts. (Slide: John Tesh)"|speech
6||"Close on another face in the group. A doughy man with three-
day scruff and a trendily long haircut. He looks bored,
rolling his eyes at the speech."|stage direction
7|FULLER (CONT'D)|"They want to be happy. (Slide: People
line dancing) But, Security comes
first. (Slide: Army soldier with a
massive machine gun guards a play-
ground) Without security there can be
no happy. You are America's front
line in the global war on terror.
Let's hit the trenches and let's be
careful out there. (Slide: TSA logo)"|speech
8||"The lights come up and as the group files out we get a better
look at their uniforms. The TSA agents move out into the..."|stage direction
9||INT. AIRPORT - SECURITY CHECK POINT - DAY|location
10||"The agents take their places, manning the screening
equipment. We push in on the bald man as he takes up his
post next to the walk-through metal detector. This is KIRK
KETTNER. He is not a looker. His uniform only serves to
highlight his least attractive features but his eyes and
demeanor are pleasant and kind."|stage direction
11||2.|unknown
12||"The scruffy agent is STAINER. He stands at the x-ray
monitor. As the bags begin to move through, he does not pay
any attention, rather he hands Kirk a flyer."|stage direction
13||STAINER|unknown
14|FULLER (CONT'D)|Kirk, bro.     Tonight?|speech
15||"INSERT: The flyer reads, ""Wheel in the Sky - a Tribute to
Journey at Club Vertigo - Every Tuesday Night!"" Stainer is
pictured wearing a massive afro in the band photo."|stage direction
16|KIRK|I don't know, Stainer.|speech
17|STAINER|"Dude, you never come see us
anymore. It's been like four
months. Time to forget about
Marnie and get back on the whores."|speech
18||"Stainer does a sex dance that makes everyone uncomfortable.
Fuller shoots a stern look from his office."|stage direction
19|KIRK|"It's not that. It's my Grandma.
I'll probably be at the hospital
for the next few nights."|speech
20||STAINER|location
21|KIRK|"Oh, shit. I spaced that.   How's
she doing?"|speech
22|KIRK|"She's hanging in there but it
doesn't look good."|speech
23|STAINER|"Dude, I'm sorry. She's a great
lady. That sucks."|speech
24||"A Middle-Eastern man in a cowboy hat is next in line. Mr.
Fuller appears behind Kirk, taps his shoulder and subtly
motions to the Arab. Kirk smiles at the potential terrorist."|stage direction
25|KIRK|Hey there, Habib.|speech
26||"(perfect English with a
southern accent)"|unknown
27|HABIB|"Howdy Kirk. Lemme guess; I been
flagged for a random search."|speech
28||3.|unknown
29|KIRK|"Yeah, sorry. I'll get you out of
here quick. You off to Boston again?"|speech
30|HABIB|"No, sir. Pediatric convention in
Delaware."|speech
31||Kirk opens Habib's bag.|stage direction
32|HABIB (CONT'D)|"Kirk, I know you're just doing your
job but, for Pete's sake, ya'll
know me."|speech
33||KIRK|unknown
34|HABIB (CONT'D)|I'm sorry.     It's just...|speech
35||Kirk gestures to his boss as he zips the bag back up.|stage direction
36|KIRK (CONT'D)|"Okay, Habib, you're all set buddy.
Have a good trip."|speech
37|HABIB|Thanks Kirk. See you next time.|speech
38||Fuller again appears behind Kirk.|stage direction
39||"(to fuller - now in a
thick Arab accent)"|unknown
40|HABIB (CONT'D)|Praise be to Allah.|speech
41|FULLER|"You think that's funny!? You wanna
sit in first class or you wanna sit
on my gloved and jellied finger!?"|speech
42||EXT. AIRPORT CURB - DAY|location
43||"Follow a pair of perfect female legs as the woman's heels
click along the sidewalk, suitcase rolling behind. Although
we can't see the woman riding on these legs, we can see
several men stare as she passes by on her way into..."|stage direction
44||INT. AIRPORT TICKETING|location
45||"More stares from more men and even a few women as we follow
the legs to the check-in line. The legs glide to the front
and stop to wait for the next available ticket agent."|stage direction
46||4.|unknown
47||"From the slightly upward angle, we see two young male ticket
agents. (One on each side of the legs.) One is black and one
white; each are dealing with customers. They simultaneously
notice our woman. They suspiciously eye one another and the
race is on. Each agent begins typing furiously to expedite
their current customer in the hope of waiting on her next.
Angle on the WHITE AGENT as he waits on a yuppie couple."|stage direction
48||(RUSHED)|unknown
49|WHITE AGENT|"Okay, how many bags are you
checking? Any bags!?"|speech
50|YUPPIE MAN|Is this one too big to carry on?|speech
51||WHITE AGENT|unknown
52|YUPPIE MAN|No.    Carry it on. Good call.|speech
53|YUPPIE WOMAN|"Grant, you don't want to lug that
thing all over the airport."|speech
54||"The agent leans back and issues a bothered sigh. He looks to
his right to check the progress of the BLACK AGENT, who is
waiting on an old Asian woman."|stage direction
55||(RUSHED)|unknown
56|BLACK AGENT|Did you pack your bags yourself?|speech
57||"The Asian woman obviously did not understand a word of the
question but she smiles and nods along."|stage direction
58||ASIAN WOMAN|unknown
59|BLACK AGENT|Yes.|speech
60|BLACK AGENT|"Has anyone unknown to you asked you
to carry anything onto your flight?"|speech
61||More smiles and blank nods.|stage direction
62||ASIAN WOMAN|unknown
63|BLACK AGENT|Yes.|speech
64|BLACK AGENT|I think you mean NO.|speech
65|WHITE AGENT|You can't do that!|speech
66||5.|unknown
67|BLACK AGENT|"She doesn't know what the hell I'm
talking about!"|speech
68|YUPPIE MAN|Where exactly is gate F5?|speech
69|WHITE AGENT|"Just past F4. Have a day now
folks. Let's hustle it up."|speech
70||ASIAN WOMAN|unknown
71|WHITE AGENT|Sank you!|speech
72||BLACK AGENT|unknown
73|WHITE AGENT|No sweat.     Keep it moving.|speech
74||"The Asian woman is not going anywhere. The black agent leans
into her face and barks once like a dog. Her smile turns to
fear as she backs away, ending the race in a dead tie."|stage direction
75||BOTH AGENTS|unknown
76|WHITE AGENT|Next!|speech
77||"Reverse to show the woman they were competing for. She is a
classy, sophisticated, blonde around thirty. Drop dead
beautiful. She is startled by the sudden call from both men.
She laughs off her little scare and then randomly chooses the
black agent. He shoots a smug victory grin over to his co-
worker, who is being an overtly sore loser."|stage direction
78|MOLLY|"Hi, I'm booked on flight 94 to
Burbank. Molly McCall."|speech
79||(trying way too hard)|unknown
80|BLACK AGENT|"California. Fantastic. So do you
travel quite a bit?"|speech
81||"The white agent moves to loiter around the black agent's
station, just to get a better look at MOLLY."|stage direction
82|WHITE AGENT|"Hey Derek. You got the     numbers on
the (making it up as he    goes) new,
um, procedures for the,    um, airport
thing... regarding the,    ah, planes?
(to Molly) Whassup?"|speech
83||INT. AIRPORT SECURITY CHECKPOINT - DAY|location
84||Kirk is at his post.|stage direction
85||6.|unknown
86||"Stainer works the next x-ray belt, where a young rocker type
is running a guitar case through. Stainer stops the belt and
moves it back to get a better look."|stage direction
87|STAINER|Les Paul Classic re-issue?|speech
88||ROCKER|location
89||(SMUG)|unknown
90|STAINER|No, it's a sixty-five.   Mint.|speech
91||STAINER|unknown
92|STAINER|Fuck you.    No way.|speech
93||"The rocker boy looks at his watch as Stainer rolls the case
through and pops it open."|stage direction
94|ROCKER|Dude, I'm late for my flight.|speech
95|STAINER|"Sorry, I have to search this case
for, you know, explosives and such.
This thing is sweet!"|speech
96||"Stainer takes the guitar out and starts riffing on it as the
bins and bags pile up before him.
At Kirk's station, Molly (the blonde bombshell) is crossing
through. Every guy who can see her has been struck dumb but
Kirk banters with her like he would anyone else. No flirting
or stammering - just friendly and relaxed."|stage direction
97||KIRK|unknown
98|STAINER|Morning.|speech
99|MOLLY|Oh, hello again.|speech
100|KIRK|Second trip in two days?|speech
101||Molly is putting her laptop back in her bag.|stage direction
102|MOLLY|"Uggh. Yeah. It's just a short hop
to L.A. but they've got me going
back and forth three days in a row.
This client is killing me."|speech
103|KIRK|"Well hang in there kiddo and I
guess I'll see you tomorrow."|speech
104||7.|unknown
105|MOLLY|It's a date.|speech
106||"Molly's long legs carry her toward the gates as every man
except Kirk watches. Fuller saunters up and nudges Kirk."|stage direction
107|FULLER|"Did'ja see that? Boy would I ever
like to...you know...put my penis
in her vagina. (wink)"|speech
108||"Back at Stainer's station. As he puts the guitar back in its
case, he scratches it on the corner of the x-ray machine.
Stainer and rocker boy lock in shocked gazes."|stage direction
109|ROCKER|What the hell!?|speech
110||He grabs his guitar and inspects a wicked scratch.|stage direction
111|STAINER|Dude, I am so sorry.|speech
112|ROCKER|"Sorry my ass! This thing is worth
more than you make in a year, you
clumsy motherfucker!"|speech
113|STAINER|Yeah, I bet it was but...|speech
114||Stainer points to a white sign mounted in an acrylic stand.|stage direction
115|STAINER (CONT'D)|"""TSA is not responsible for items
lost or damaged in the security
screening process..."""|speech
116||"Stainer flips the sign around to reveal a few more words hand-
written on the back. He reads them aloud."|stage direction
117|STAINER (CONT'D)|"""...so fuck you."""|speech
118||INT. HOSPITAL WAITING ROOM - NIGHT|location
119||"Kirk enters to find his MOTHER, an attractive old woman,
sitting with a short, plain woman about Kirk's age."|stage direction
120||KIRK|location
121|STAINER (CONT'D)|Hey Mom.   Hey Marnie.|speech
122||8.|unknown
123|MRS. KETTNER|Oh, hi Sweetie.|speech
124||"Across the room, Kirk's father is speaking to a man who looks
a bit like Kirk. The man is telling a funny story that
cracks up MR. KETTNER. The two pretend to box for a moment."|stage direction
125|KIRK|Who's that guy Dad's with?|speech
126||MARNIE (the plain woman) stands and takes Kirk aside.|stage direction
127|MARNIE|"Kirk, you've been really great about
your mom and I staying so close
since we broke up but I know how
much Grammy meant to you... Well, is
it okay with you that I'm here?"|speech
128||KIRK|location
129|MARNIE|Sure.   It's fine.   (it's not)|speech
130|MARNIE|"Okay, good. Then can I introduce
you to my new boyfriend?"|speech
131||"She leads Kirk over to the man who is speaking with his
father. They are laughing again."|stage direction
132|MARNIE (CONT'D)|Ron, this is Kirk.|speech
133|RON|"Uh, oh - the ex. Awkward! (Ron
and Mr. Kettner laugh) No! I'm
just jack-assin' with you, pirate.
Great to meet you. How you doing?"|speech
134|KIRK|I've been better.|speech
135|RON|"Right. Of course. I'm sorry about
your grandmother. It's just so...
Well, old people, you know, what
are you gonna do?"|speech
136||KIRK|location
137|RON|Yeah.   Thanks.|speech
138||"Kirk's brother ERIC and his fiance DEBBIE enter from the
hall. They are both in their late thirties and good-looking
for trailer trash. Debbie is about seven months pregnant."|stage direction
139||9.|unknown
140|ERIC|"Little brother.   Grammy wants to
see you."|speech
141||KIRK|location
142|ERIC|Okay.   Well, I better get in there.|speech
143||Eric and Debbie walk with Kirk down the hall.|stage direction
144|ERIC|"Listen, I'm pretty sure she wants
to discuss the will. She won't
tell us dick, so we're kind of
hoping you can grease the wheels."|speech
145|KIRK|"Okay, but you know Grammy didn't
have all that much. Once the
hospital and... and the ah..."|speech
146|ERIC|"Yeah, yeah, the cremation and what
not..."|speech
147|KIRK|"Well, it's not going to leave
enough to get worked up over."|speech
148|DEBBIE|"We've got a wedding to pay for,
Kirk and..."|speech
149|ERIC|"Debbie, let me handle this. We've
got a wedding to pay for, numbnuts,
and you know Mom and Dad are going
to Branson next month. Now you
always been Grammy's favorite so
we're counting on you to get in
there and sort out what's what."|speech
150||INT. HOSPITAL - GRAMMY'S ROOM|location
151||"In a dimly lit hospital room, a very old woman lies in a bed.
She is hooked up to an I.V. and several monitors. Kirk comes
in and forces a smile. Grammy's voice is weak and shaky."|stage direction
152||GRAMMY|location
153|ERIC|"There you are Big Slick.   Did you
bring 'em?"|speech
154|KIRK|Grammy, you really shouldn't...|speech
155||10.|unknown
156|GRAMMY|"Just hand 'em over. I'm on death's
door and you know it."|speech
157||Kirk sits and reluctantly hands her a pack of cigarettes.|stage direction
158|GRAMMY (CONT'D)|Oh, for Christ's sake. Filters?|speech
159||"Grammy lights up a smoke and savors a long drag. Kirk tears
up at how slightly his grandmother clings to life."|stage direction
160|KIRK|I love you Grammy.|speech
161|GRAMMY|"Don't start that shit now. You're
looking at one lucky old broad who's
done a lot - skydiving, rollerderby,
colored fellas. I got no complaints.
So when the check comes I don't want
any blubbering or bullshit outta
you. Just enjoy your life like I
did mine and raise a glass to your
old Grammy once in a while."|speech
162||Kirk hugs her and he cries a bit.|stage direction
163|GRAMMY (CONT'D)|You know how much I love you Kirk.|speech
164||INT. AIRPORT SECURITY CHECKPOINT - DAY|location
165||"Molly is coming through Kirk's lane again. Mr. Fuller steps
in and stops her before she crosses through."|stage direction
166|FULLER|"Ma'am, could you please remove your
jacket and shoes?"|speech
167||MOLLY|unknown
168|FULLER|Oh, sure.|speech
169||"She does. Fuller is leering at her stellar body.   She's
about to go through when he stops her again."|stage direction
170|FULLER|"Why don't we go ahead and strip off
that belt too while we're at it."|speech
171||"Molly takes an exasperated breath as she removes her belt.
She starts to move through but again Fuller stops her with a
raised palm. He then motions to her breasts and crotch."|stage direction
172||11.|unknown
173|FULLER (CONT'D)|"Any piercings you'd like me to know
about?"|speech
174|KIRK|"Why don't you just come on through,
ma'am, and we'll see if anything
sets off the machine."|speech
175||"Molly steps through. The machine does not go off. She
gathers her things and mouths a silent, ""Thank You"" to Kirk
as she walks on. Fuller glares at Kirk but before he can say
anything, RANDY, a young agent, calls out from the office."|stage direction
176|RANDY|Kirk buddy! Phone call!|speech
177||Kirk walks over to take the call.|stage direction
178|FULLER|"You best hope the terrorists are
taking personal calls on the job
too, mister!"|speech
179||Kirk takes the phone from Randy.|stage direction
180|KIRK|This is Kirk Kettner.|speech
181||Kirk's expression tells us that some sad news is coming in.|stage direction
182||INT. AIRPORT COFFEE SHOP - DAY|location
183||"Kirk sits at a table with a cup of coffee. He opens his
wallet and flips to a photo of a much younger Grammy and an
eight-year-old Kirk in a casino. Grammy is smoking a
cigarette and dealing blackjack while Kirk sits at the table.
Kirk tears up and puts his face in his hands.
Molly is passing.   She sees Kirk and stops."|stage direction
184|MOLLY|"Oh Geeze. Please tell me I didn't
get you in trouble back there."|speech
185|KIRK|"No, no. It's not that.    I ah...I
lost somebody today."|speech
186||Molly sits down and puts her hand on his hand.|stage direction
187||12.|unknown
188|MOLLY|"Oh my God. I'm so sorry. I
know... I lost my grandmother a
few months ago and I..."|speech
189||Kirk tears up again and so does Molly.|stage direction
190|MOLLY (CONT'D)|"Your grandmother too? And you were
close? Oh, you poor thing."|speech
191||Kirk tries to keep it together.   Molly looks at the photo.|stage direction
192|KIRK|"She used to be a blackjack dealer
at the Horseshoe. When I was
little, she taught me and my
friends how to play poker. Turned
us into a bunch of eight-year-old
degenerate gamblers."|speech
193||They share a sad laugh.|stage direction
194|KIRK (CONT'D)|So, your grandmother too, huh?|speech
195||"Molly removes a small clear-plastic booklet of photos from
her bag and shows a picture of her grandmother."|stage direction
196|MOLLY|"My Grammy Keenan was ninety four
but independent right to the end.
She was always trying to cook for
everyone. You couldn't stop her."|speech
197|KIRK|"Oh, God, I know. Grammy used to
change her own oil. Right up until
a few months ago. She was... Do
you change your own oil?"|speech
198||(LAUGHS)|unknown
199|MOLLY|No. I wouldn't know where to begin.|speech
200|KIRK|"I know, me neither. She could
barley walk and I'd come over and
find her lying under her Cadillac
all covered in grease."|speech
201||"They share a laugh and Kirk is cheering up a bit.   An
announcement comes over the PA."|stage direction
202||13.|unknown
203|GATE AGENT|"...final boarding call for United
flight 94 to Burbank..."|speech
204|MOLLY|Oh, geeze, that's me. I'm so sorry.|speech
205||KIRK|location
206|MOLLY|No, no.   Go catch your flight.|speech
207||Molly stands and offers her hand to Kirk.|stage direction
208||MOLLY|unknown
209|MOLLY|I'm Molly.|speech
210|KIRK|Kirk Kettner.|speech
211||"Molly squeezes Kirk's hand, grabs her bags and trots off
toward her gate. A businessman near Kirk's table reaches
over and gives him a playful chuck on the shoulder."|stage direction
212|BUSINESSMAN|"Dead Grandma. (a nod and a cheek
click) Nice one."|speech
213||INT. AIRPORT GATE|location
214||Molly arrives at the gate just in time to make her flight.|stage direction
215||INT. AIRPORT COFFEE SHOP|location
216||"Kirk gathers his things and notices that Molly left her
pictures on the table. He looks through them. In the last
pouch are some business cards that read, ""Molly McCall -
Event Planner."" Her cell number is on the card."|stage direction
217||INT. AIRPLANE 737|location
218||"Molly is sitting in a window seat. The flight is mostly
empty. The two other seats in her row are unoccupied until a
CREEPY BUSINESSMAN moves from the row behind her to the seat
next to Molly. He casually smiles as though there is nothing
odd about taking the center seat while the aisle seat (and
many full rows) are open. Molly looks at the vacant seats
and then at him as if to say, ""You've got to be kidding."""|stage direction
219|CREEPY BUSINESSMAN|How you doin'?|speech
220||"Molly's phone rings and she fumbles to answer it.   A FEMALE
PASSENGER sitting two rows back looks annoyed."|stage direction
221||14.|unknown
222||INTERCUT: AIRPLANE / AIRPORT COFFEE SHOP|stage direction
223||MOLLY|unknown
224|CREEPY BUSINESSMAN|Hello?|speech
225||KIRK|location
226|CREEPY BUSINESSMAN|Oh, hi.   Molly McCall?|speech
227|MOLLY|Who's calling please?|speech
228|KIRK|"It's Kirk... From the coffee shop.
You left your pictures with me. If
you tell me which gate you're at, I
can run them right down to you."|speech
229|MOLLY|"Oh, no. I'm already on the plane
and we're pushing back right now."|speech
230|KIRK|"Okay, well I'll leave them at the
lost and found and when you get..."|speech
231|MOLLY|"Oh geeze, some of those are my only
prints. It would be such a huge
favor if you could hold on to them
for me. I'm coming back next week."|speech
232||KIRK|unknown
233|MOLLY|Oh, sure.    But how will I...|speech
234||The female passenger hails the flight attendant.|stage direction
235|FEMALE PASSENGER|She's talking on her phone.|speech
236||"The creepy businessman gives the woman the finger and then
looks to Molly for approval. He doesn't get it."|stage direction
237|MOLLY|"I have your number in my phone. As
soon as I get back I'll call you
and arrange to pick them up, okay?
Thank you so much, Kirk."|speech
238||"Molly turns off her phone and holds it up for the flight
attendant to see."|stage direction
239||MOLLY (CONT'D)|location
240|MOLLY|Thanks.   I'm really sorry.|speech
241||15.|unknown
242||CREEPY BUSINESSMAN|location
243|MOLLY|"You believe these pricks? So, what
do you do?"|speech
244||DISSOLVE TO:|unknown
245||INT. VERTIGO CLUB - NIGHT|location
246||"Kirk comes in and stops at the bar to order a beer. Two men
are waving to him from a table near the stage. Kirk gets his
bottle and snakes through the crowd toward his friends.
On stage, Stainer (in his afro wig) plays guitar as his band
finishes the last chorus of ""Lovin', Touchin' Squeezin'."""|stage direction
247|STAINER|"Thank you! We're going to take a
little breakski but we'll be back
in a few minutes to do Frontiers."|speech
248||"The band turns to put down their instruments and the house
music kicks in.
Kirk arrives where his friends are standing at a high bar
table. DEVON looks like Howdy Doody at 33. JACK is good-
looking and dressed semi-hipster. Devon gives Kirk a hug."|stage direction
249||DEVON|unknown
250|STAINER|Hey Kirk.    How you been holdin' up?|speech
251|KIRK|"It's been a rough week but, you
know, all of the services and
family stuff keep you pretty
busy... I really miss her, though."|speech
252||Jack hugs Kirk as well.|stage direction
253|JACK|She sounded like a hell of a lady.|speech
254|STAINER (O.S.)|"Oh, fuck yeah! Kirk's Grandma was
the shit."|speech
255||Stainer arrives, hugs Kirk and gives him a kiss on the head.|stage direction
256|STAINER (CONT'D)|"She's with God now, buddy - and you
just know she's bustin' his balls."|speech
257||Kirk laughs and Stainer raises his glass.|stage direction
258||"16.
STAINER (CONT'D)"|unknown
259|STAINER (CONT'D)|To Stella!|speech
260||"The guys all raise their glasses and take a drink.     This is
just what Grammy wanted and it's cheering Kirk up.
Kirk's cell phone rings.      He has to talk loud over the music."|stage direction
261|KIRK|"Hello?... Oh, Hi. I'm sorry I can
barely hear you. I'm at a club
and.... Club Vertigo? Oh, yeah -
it's right down the street from
there... Okay, sounds good."|speech
262||Kirk hangs up.|stage direction
263|JACK|What was that all about?|speech
264|KIRK|"Nothing, just a passenger. She
accidentally left something with
me. She's going to stop in and
pick it up I guess."|speech
265|DEVON|She's coming here?      She a cute gal?|speech
266||KIRK|unknown
267|DEVON|Very.|speech
268|STAINER|"Well alright dude! That's a leave-
behind. She digs you!"|speech
269|KIRK|No she doesn't.      Trust me.|speech
270|STAINER|"She does a leave behind and then
just happens to be in the
neighborhood? She practically has
her hands in your pants."|speech
271|KIRK|"No, seriously - it's nothing.      She's
way out of my league."|speech
272|STAINER|"Dude, you said Marnie was out of
your league and let's face it,
Marnie's kinda nasty."|speech
273||17.|unknown
274||Marnie is standing behind Stainer.     He doesn't miss a beat.|stage direction
275|STAINER (CONT'D)|"...Marnie...don't you think Marnie
Tomkins is kind of nasty?"|speech
276|MARNIE|I don't know who that is.|speech
277|STAINER|"Oh, you don't know Marnie Tomkins?
She's just this girl. I thought you
knew her. Anyway, she's pretty nasty
looking... but you're looking good."|speech
278|MARNIE|Kirk, I'm sorry about Grammy.|speech
279||The guys slink away to give Kirk and Marnie some privacy.|stage direction
280|MARNIE (CONT'D)|"I realize she was never that crazy
about me but I know how much you
loved her and I hope you're okay."|speech
281||KIRK|location
282|MARNIE (CONT'D)|Thanks.   Thanks, I'll be alright.|speech
283|MARNIE|"Listen, are you going to Branson
with your folks next month?"|speech
284||KIRK|location
285|MARNIE|No.   It's not really my thing.|speech
286|MARNIE|"What's wrong with Branson?     You too
good for Branson now?"|speech
287||KIRK|location
288|MARNIE|No.   Branson's...awesome.|speech
289|MARNIE|"Well, your mom invited Ron and I
along. We'd love to go but not if
it's going to be weird for you."|speech
290||Kirk considers this.   It will be weird.|stage direction
291|MARNIE (CONT'D)|"...I mean the tickets are non-
refundable but it's up to you."|speech
292||18.|unknown
293||Stainer overhears this and groans out loud.|stage direction
294|KIRK|"No. You should go. I'm sure
you'll have a great time. Totally."|speech
295||Marnie hugs Kirk.   This makes him uncomfortable.|stage direction
296|MARNIE|"Kirk, I'm sorry about what happened
with us. You're going to make
someone very happy someday, but you
have to get over me first, okay?
Is it a deal?"|speech
297||Marnie hugs him again and then departs.|stage direction
298|STAINER|"She's going to Branson with your
fucking parents? And bringing her
new fucking boyfriend!?"|speech
299||KIRK|unknown
300|STAINER|"Yeah. He seems like a good guy,
though.  He's an entrepreneur."|speech
301||Across the room they see Marnie return to Ron with a hug.|stage direction
302|JACK|"Entrepreneur? Kirk, I know that
guy. He owns a Pizza Hut."|speech
303||KIRK|location
304|JACK|So?   That's a business.|speech
