|character|text|type
305|STAINER|"It's not even a real Pizza Hut.
It's one of those strip-mall take-
out ones. They don't even have
chicken wings. The guy's a fuckin'
douche bag."|speech
306|KIRK|"He's got more going on than I do.
That's all I'm saying."|speech
307|STAINER|"Dude, you can do a hell of a lot
better than her."|speech
308|DEVON|One door closes, another door opens.|speech
309||19.|unknown
310|STAINER|"Fuck you Devon, that doesn't even
make any sense. But take this
broad that's coming here tonight -
I got a feeling about her. You're
gonna get on that."|speech
311|JACK|Absolutely. Visualize it.|speech
312|KIRK|"I appreciate what you guys are
trying to do but, I'm telling you,
I have zero chance with this one
and I'm completely okay with that."|speech
313|DEVON|That's defeatist thinking.|speech
314|KIRK|"No it isn't. It's just like saying
I'll never go to the moon and I'm
okay with that too."|speech
315|STAINER|"You're saying you don't want to go
to the moon? That's bullshit."|speech
316|KIRK|"No. I'm saying that I never will
go to the moon but I'm not going to
get down about it because, you know
- I never expected to."|speech
317|STAINER|"You don't know. Technology and
shit. You might go to the moon."|speech
318||"Kirk waves to someone at the door.   The guys look up.
The guys' POV: Molly is stepping toward them - dressed in a
beautiful gown. They laugh the way you might laugh at a
particularly brutal football tackle."|stage direction
319|DEVON|Holy Frijole.|speech
320||JACK|location
321|DEVON|Oh shit.   Yeah, you're right.|speech
322|STAINER|"Sorry, bro. You'll go to the moon
before you'll hit that. No chance."|speech
323||20.|unknown
324|KIRK|I told you.|speech
325||Molly arrives at their table.|stage direction
326||MOLLY|unknown
327|KIRK|Hey!     There you are!|speech
328||Molly hugs Kirk.    From across the bar, Marnie takes notice.|stage direction
329||KIRK|unknown
330|KIRK|Here I am.|speech
331|MOLLY|"I'm sorry I'm so overdressed. I
just came from a work thing. Are
you doing okay with...everything?"|speech
332|KIRK|"Oh, you know... Hey, these are my
best friends - Jack, Devon and
Stainer."|speech
333||The guys' I.Q.s drop like stones as they shake her hand.|stage direction
334||MOLLY|unknown
335|KIRK|Stainer?|speech
336|STAINER|"Yeah, just a nickname.    Doesn't
really mean nothin'."|speech
337|KIRK|"Oh. Here's your pictures - all
safe and sound."|speech
338||Kirk hands Molly the pictures.|stage direction
339|MOLLY|"Thank you so much for taking care of
them for me! I need to get some
copies made. If I lost these...uugh."|speech
340|KIRK|No trouble at all.|speech
341|MOLLY|Hey, have you eaten yet?|speech
342||KIRK|unknown
343|MOLLY|Um...|speech
344||21.|unknown
345|MOLLY|"I was going to go grab a bite. Let
me buy you dinner to pay you back."|speech
346|KIRK|You don't have to pay me back.|speech
347|MOLLY|"I know. I want to. Come on! The
place across the street has the
best greasy burgers in town."|speech
348|KIRK|"A burger does sound good. (then to
the guys) I'm going to just ah..."|speech
349||"Molly waves goodbye and heads for the door. Kirk starts to
follow but Stainer pulls him back for a quick huddle."|stage direction
350|STAINER|"Dude. It's cool that she's buying
you dinner but do not get your
hopes up about this one."|speech
351|KIRK|Don't worry. Believe me, I know.|speech
352||"Kirk catches up with Molly.   Marnie watches them exit.
A big guy has overheard this and leans over to Stainer."|stage direction
353|BIG GUY|"Good advice there friend. Your boy
ain't got a prayer with that chick."|speech
354|STAINER|"You talking shit about my buddy!?
'Cause I'm giving out free fuckin'
ambulance rides!"|speech
355||Big Guy assesses the crazy on Stainer's face and stands down.|stage direction
356|STAINER (CONT'D)|Yeah, I didn't think so!|speech
357||INT. BURGER JOINT - NIGHT|location
358||"Kirk and Molly sit across from one another in a booth.    The
WAITER arrives."|stage direction
359|WAITER|"Start you off with something to
drink ma'am?"|speech
360||22.|unknown
361|MOLLY|I'll have a Bass.|speech
362|WAITER|And for your... brother?|speech
363||KIRK|unknown
364|WAITER|What?     Oh, I'm not her brother.|speech
365|WAITER|Oh, I'm sorry. I just figured...|speech
366|KIRK|"You know what, a Bass sounds good.
Make that two."|speech
367||WAITER|unknown
368|KIRK|Great.    Sorry.|speech
369||The waiter exits.|stage direction
370|KIRK|"So... You know what I do, what
about you? Your card said event
planner. How'd you get into that?"|speech
371|MOLLY|"Well, it wasn't the original plan.
I went to law school. Ended up at
a big firm but I hated it. Then,
they asked me to plan the Christmas
party. It was a big hit and a few
months later I was done with law."|speech
372||KIRK|unknown
373|MOLLY|Wow.|speech
374||MOLLY|unknown
375|MOLLY|"I know.    Pernicious career move,
right?"|speech
376|KIRK|"Oh, I don't know what that word
means. What was it?"|speech
377||"Close on Molly's smile. She finds Kirk's unabashed admission
very refreshing and endearing."|stage direction
378||MOLLY|unknown
379|KIRK|I'm sorry.     Like, destructive or...|speech
380||23.|unknown
381|KIRK|"Oh, okay. No, I don't think that's
so perni...gious?"|speech
382|MOLLY|Pernicious.|speech
383|KIRK|"Good - new word. No, not pernicious
at all. Not if you enjoy the work."|speech
384|MOLLY|"I really do. We do a lot of
charity events and I get to work
with some of the most amazing human
beings on some really fun projects.
Next month I'm doing a cancer
benefit with Billy Joel."|speech
385||KIRK|location
386|MOLLY|Wow.   I love Billy Joel.|speech
387|MOLLY|"The only downside is I have to do a
lot of public speaking and I've
always struggled with stage fright."|speech
388|KIRK|"Oh man - That's my number one fear.
I'm terrified of getting up in
front of people. I'd rather get a
Kentucky root canal."|speech
389||"Molly laughs. An older GOOD-LOOKING MAN steps up to the
table and stands facing her with his back to Kirk."|stage direction
390|GOOD-LOOKING MAN|"Excuse me, I was just sitting over
at the bar and I was wondering; has
anyone told you today that you are
absolutely stunning?"|speech
391|MOLLY|"Are you seriously hitting on me
right in front of my boyfriend?"|speech
392||He turns to Kirk and both men start to laugh.|stage direction
393|GOOD-LOOKING MAN|This is your boyfriend?|speech
394||24.|unknown
395||KIRK|location
396||"Oh, yeah right! (Catches Molly's
unspoken instructions.) But, yeah.
I'm her boyfriend, I guess, so...
GOOD-LOOKING MAN
Really?   Wow. Well... sorry."|unknown
397||KIRK|location
398||Honest mistake.|unknown
399||The man gives Kirk a wink and wanders back to the bar.|stage direction
400||MOLLY|location
401||"Did you get a load of that hair-
piece? What is it with men? I
mean, look at you. You're bald and
you're fine with it. A little
dignity is all I'm saying. The
toupees and plugs and the teen-
dream sports cars... Oh geeze, I'm
sorry. Do you drive a sports car?"|unknown
402||KIRK|location
403||"I drive a 94 Taurus. It's got
AM/FM but I wouldn't call it a
sports car per se."|unknown
404||"Molly laughs and we hard cut through the following snippets
of conversation as they eat, chat and laugh."|stage direction
405||KIRK (CONT'D)|location
406||"So here's this little old lady
trying to go through security with
six pounds of weed in her girdle!"|unknown
407||Cut.   The food is being served.|stage direction
408||MOLLY|location
409||Oh, my God! I love that book!|unknown
410||Cut.   The waitress is picking up the empty plates.|stage direction
411||KIRK|location
412||So, a duck walks into a bar...|unknown
413||Cut.   Molly is laughing while she's paying the bill.|stage direction
414||MOLLY|location
415||"Well, I've got an early morning. I
should go. Thanks for coming
along. This was really fun. And
thanks again for helping me out.
25."|unknown
416|KIRK|"No, thank you for dinner. I feel
bad that you won't let me..."|speech
417|MOLLY|"Oh, stop it. Listen, I handle some
of the charity events for the
Coyotes and I've got some tickets
for the hockey game tomorrow night.
You interested?"|speech
418||"Kirk is a bit taken aback and confused.     Is she actually
asking him out on a real date?"|stage direction
419||(NERVOUSLY)|unknown
420|KIRK|"Um, sure. Yeah, great. I mean,
I'm free tomorrow night."|speech
421||She digs two tickets out of her purse and hands them over.|stage direction
422||MOLLY|unknown
423|KIRK|"Perfect. I hate to see them go to
waste. There's two so maybe bring
Stainer?"|speech
424||Kirk's expression is as much relief as disappointment.|stage direction
425||KIRK|unknown
426|KIRK|Oh, right.     Thanks!   Thank you.|speech
427||EXT. HOCKEY ARENA - NIGHT|location
428||"Kirk and Stainer are on their way through security. A huge
security guard runs a metal-detector wand over Stainer."|stage direction
429|STAINER|Whatcha runnin' there a PX-235?|speech
430|GUARD|I don't know sir.|speech
431|STAINER|"The two hundred series are dog
shit. You couldn't find a bazooka
with that thing. You should look
into the new eight fifties."|speech
432|GUARD|Can you keep it moving sir?|speech
433||26.|unknown
434||INT. HOCKEY ARENA|location
435||"Kirk and Stainer arrive at the third row to find two open
seats right next to the penalty box. To Kirk's surprise, in
the next seat - Molly! Kirk elbows Stainer."|stage direction
436|KIRK|Hey, it's Molly.       She's here.|speech
437||"STAINER
(PERPLEXED)"|unknown
438|KIRK|Huh.|speech
439|MOLLY|"Hey guys! You made it! Hooray!
Thanks for coming."|speech
440||KIRK|unknown
441|MOLLY|Oh, yeah.     Wouldn't miss it.|speech
442|STAINER|Thanks for the sweet seats!|speech
443|MOLLY|"Guys, this is my best friend in the
whole world, Patty. This is Kirk
and, um, Stainer, right?"|speech
444||"Patty is over 200 pounds with a pretty face and an edge that
comes from a lifetime of taking crap from morons."|stage direction
445||PATTY|unknown
446|MOLLY|Hey boys.     Nice to meet you.|speech
447|MOLLY|"Patty's my assistant and my go-to
gal. Whatever you need, she can
make it happen on a moments notice."|speech
448|PATTY|"You need a cock-shaped cake with a
cotton-candy bush delivered by four
o'clock? I'm your connection."|speech
449|MOLLY|"Oh, and she likes to shock people
so don't let her freak you out."|speech
450|KIRK|"How 'bout that. So, we're going to
grab some beers. Can we bring you
ladies anything? Beer? Nachos?
Patty, cotton candy?"|speech
451||27.|unknown
452||INT. HOCKEY ARENA CONCESSIONS AREA|location
453||Stainer and Kirk stand in the beer line.|stage direction
454|STAINER|"That's it. She's setting you up
with the fat chick."|speech
455|KIRK|"Ooohhh! Okay! Okay! That makes
sense, right!? When Molly was here
I was like, ""what!?"" But, okay!
Well, Patty seems cool. She's funny."|speech
456|STAINER|Well, yeah, she has to be.|speech
457|KIRK|What does that mean?|speech
458|STAINER|"Nothing. The fat chick seems
great. You never know, bro, that
fat chick could wind up being the
love of your life."|speech
459||Kirk returns a look of annoyance.|stage direction
460|STAINER (CONT'D)|"Patty, I'm saying. Patty could be
the love of your life."|speech
461||INT. HOCKEY ARENA|location
462||"The game has started. Kirk, Stainer, Molly and Patty are
cheering. The puck smacks the glass before them and another
player skates up for it. As he mucks it from the edge, he
looks up and sees Molly. He's distracted just long enough to
get brutally checked face first into the glass. A penalty is
called on the player who hit him. That player skates into
the penalty box near Molly. The name on his jersey reads,
""REESE."" He speaks with a thick Canadian accent."|stage direction
463||REESE|unknown
464|STAINER (CONT'D)|Hey Molly!     Yer lookin' good, eh!|speech
465|MOLLY|"That was a bogus call, Bobby.    Your
skates barely left the ice."|speech
466||REESE|location
467|MOLLY|I know.   What's that aboot, eh?|speech
468||28.|unknown
469||(nervously to Reese)|unknown
470|KIRK|"Yeah, that ref is like a total
blindo, man."|speech
471||STAINER|unknown
472|KIRK|Blindo?|speech
473|PATTY|Kirk, Molly's sister is blind.|speech
474|KIRK|Oh, I'm sorry. I didn't mean...|speech
475||(not offended)|unknown
476|MOLLY|Oh, I know. It's fine.|speech
477||INT. BROADCAST BOOTH|location
478||The radio announcers are calling the game.|stage direction
479|ANNOUNCER|"Forty Five seconds left on the
Power Play and the Sharks are
knocking at the door."|speech
480||INT. HOCKEY ARENA|location
481|REESE|So, after the game, you wanna party?|speech
482|MOLLY|"You know my policy on players,
Bobby. And you might have noticed
we've already got dates."|speech
483||"The penalty ends and the ref opens the box but Reese is not
paying attention."|stage direction
484|REESE|"Come on, Molly. Just give me a
chance, eh.   I'm a great guy - ask
any of these assholes."|speech
485||The crowd is booing Reese.|stage direction
486|MOLLY|Reese, you'd better...|speech
487|REESE|"You can't seriously be blowing me
off for these two hosers."|speech
488||29.|unknown
489|STAINER|"Hey! Fuck you Reese!    You suck
this year anyway!"|speech
490||"Reese raises his squirt bottle over the glass and squirts
Stainer."|stage direction
491||STAINER (CONT'D)|unknown
492|STAINER|You dick!|speech
493||"Stainer is immediately on his feet, climbing the glass and
trying to pummel the huge player. Security is on him in a
flash and dragging him, kicking & swearing, out of the arena.
Reese wakes up and skates out of the box but it's too late.
The Sharks score and the crowd revolts. A red-haired redneck
woman, sitting two rows back, calls out to Molly and company."|stage direction
494|RED-HAIRED WOMAN|"You idiots just cost us a goal!    I
hope you're happy!"|speech
495|PATTY|"You'd better check that tone, Reba!
You do NOT want me comin' up there!"|speech
496|MOLLY|"Patty! Stop it! I'll go see what
I can do about Stainer."|speech
497|KIRK|"No, this is my fault, I'll take
care of it."|speech
498|MOLLY|"No, it's okay. I know the head of
security. I'll be right back."|speech
499||Molly exits and Patty sits back down next to Kirk.|stage direction
500|KIRK|God, I'm really embarrassed.|speech
501|PATTY|"That's okay, if Reese did that to
me I'd have gone over the glass
too. But I would have landed a few
before they got me. Reese has been
all over Molly ever since she
dumped her boyfriend. I tell you,
that girl has nothing but trouble
when it comes to men."|speech
502||30.|unknown
503|PATTY|KIRK|speech
504||"What? How is that even possible?
She's so..."|stage direction
505|PATTY|PATTY|speech
506||"Tell me about it. I'm no lezbo but
sometimes she makes me want to
strap on - if know what I'm saying."|stage direction
507||KIRK|unknown
508||Yeah.   I think I do.|stage direction
509|PATTY|PATTY|speech
510||"It's a curse, looking like that.
Who has the balls to hit on her?
Just the most arrogant A-holes like
Reese out there."|stage direction
511|PATTY|KIRK|speech
512||Yeah, I suppose.|stage direction
513|PATTY|PATTY|speech
514||"Listen, Molly brought me along
tonight because, you know, she
thought I might be 'interested.'"|stage direction
515||KIRK|unknown
516||Oh.   Oh yeah?|stage direction
517|PATTY|PATTY|speech
518||"But, just for honesty's sake, I'm
not interested. No offense."|stage direction
519|PATTY|KIRK|speech
520||"No! Hey! None taken. I don't
blame you. I know I'm no Brad
Pitt. That's cool."|stage direction
521|PATTY|PATTY|speech
522||"What? You? No, I'm talking about
your pal, Stainer. I know he's your
friend but he seems like kind of a
dumbshit. (THEN) Wait. Why would
you think I was talking about you?"|stage direction
523||KIRK|unknown
524||"I'm sorry.     I didn't mean to assume
anything."|stage direction
525|PATTY|PATTY|speech
526||"Oh my God. You don't have a clue
do you? Molly's really into you."|stage direction
527||31.|unknown
528|KIRK|Oh, yeah right!|speech
529||"Kirk laughs hard until he realizes that Patty isn't laughing.
Patty's nod says, ""I'm serious."""|stage direction
530|KIRK (CONT'D)|But... why would...|speech
531|PATTY|"A knockout like Molly be interested
in a spud like you?"|speech
532|KIRK|Well, yeah.|speech
533|PATTY|"Got me. Again, no offense. But
listen, Kirk, your dream girl just
showed up. Try not to blow it."|speech
534||"Close on Kirk's terrified expression.   The SOUND of a bowling
ball demolishing ten pins..."|stage direction
535||INT. BOWLING ALLEY - NIGHT|location
536||"The place is crowded and classic rock is cranking. It's an
old alley with overhead-projection score sheets. Kirk,
Stainer and Devon sit and talk while Jack throws a strike."|stage direction
537|DEVON|Atta boy Jackers!|speech
538|STAINER|"It doesn't add up, Kirk. If
Molly's so into you, why bring her
friend and give you two tickets?"|speech
539|KIRK|"She was hoping to set Patty up with
you."|speech
540||STAINER|unknown
541|KIRK|Oh, great.|speech
542|KIRK|It's okay, she wasn't interested.|speech
543|STAINER|"So you're saying the hottest babe
in the world wants you and the fat
chick isn't into me. Will you
listen to yourself? Fuck you."|speech
544||32.|unknown
545|STAINER (CONT'D)|"What did Molly have to say about
all this?"|speech
546|KIRK|"I don't know, Stainer, somebody got
thrown out of the game and I had to
drive him home, remember?"|speech
547|DEVON|Pretty impressive catch, Kirky.|speech
548|STAINER|"There's no way. Don't get him all
worked up. Her friend was fuckin'
with him. Molly said herself that
Patty loves to mess with people."|speech
549|DEVON|"Kirk, you deserve a gal like her.
And Stainer, why don't you try to
be a little more supportive."|speech
550|STAINER|"Why don't you try a little shut the
fuck up, Devon. This week, we're
not taking dating tips from the guy
who met his wife in eighth grade."|speech
551|JACK|Are we still bowling?|speech
552||Stainer picks up a crappy, beat up ball from the ball return.|stage direction
553|STAINER|"All I'm saying is - she's just too
hot. No judgement on Kirky, the
guy's just outgunned here."|speech
554|KIRK|I can't argue with him.|speech
555||"Stainer goes to the line. The BOWLER (a pro-type with a
custom ball and glove) on the next lane is already standing
about to roll. Stainer starts to step up."|stage direction
556|BOWLER|Yo, house ball! I was up first.|speech
557|STAINER|"Oh for fucks... What is it with you
people?"|speech
558|BOWLER|Just wait your turn.|speech
559||33.|unknown
560|STAINER|"All this noise and bullshit in this
place and I'm such a distraction
over here in your god damned
peripheral vision!?"|speech
561|KIRK|Okay Stains, take it easy.|speech
562||The bowler stands glaring back.|stage direction
563||STAINER|location
564|KIRK|Well!?   Fuckin' roll then!|speech
565||"The bowler takes another minute to set. Stainer lets out a
long sigh. The bowler steps to the line and Stainer rushes
into his own delivery. Both men throw gutters. The bowler
comes at Stainer but their friends separate them."|stage direction
566|BOWLER|You're lucky motherfucker!|speech
567||STAINER|unknown
568|BOWLER|Oh yeah!?    Bring it, Brunswick!|speech
569||DEVON|unknown
570|BOWLER|Stainer!    Cool your jets, buster.|speech
571||"The bowler's friends drag him away. Stainer takes a deep
breath before he shifts right back into conversation mode."|stage direction
572|STAINER|"Okay. Anyway... I love Kirky but
let's face it, the guy's a three."|speech
573|DEVON|"Stainer, that's just dirty pool.
He's at least a four."|speech
574|STAINER|"You're outta your fuckin' mind -
four! You go ahead and pump
rainbows up his ass. I'm just
being honest."|speech
575||"Stainer moves the score sheet and then writes a three on the
glass. It projects onto the overhead scoreboard."|stage direction
576|KIRK|I can live with three.|speech
577||34.|unknown
578|STAINER|"He's a nice guy and he's funny.
Those are a half a point each."|speech
579||Stainer continues the equation on the projector.|stage direction
580|STAINER (CONT'D)|"But he drives a shit box so we
gotta deduct a point for that."|speech
581|DEVON|Kirk said she likes his Taurus.|speech
582|STAINER|"That's so fucked, I won't even
dignify it with a response. So
we're back to three. Meanwhile,
this Molly is a hard ten."|speech
583|DEVON|A hard ten?|speech
584||STAINER|location
585|DEVON|"Generally, if a broad is that hot
you can deduct a few points for dumb
or shallow but she went to law
school and her sister's blind.
That's a hard ten, friends, and that
is rare. A seven point disparity -
that's a chasm. The most you can
jump is two points. I can't even
get a ten."|speech
586|JACK|Oh, not even you, huh?|speech
587|STAINER|I'm a five, okay?|speech
588||JACK|unknown
589|STAINER|Bullshit.    Then what am I?|speech
590|STAINER|You're a seven and a half.|speech
591|JACK|Fine, you're a five then.|speech
592|STAINER|"Okay, so I get a two point bump for
being in a band. That puts me at
seven. On a good day, most I can
bag is a niner."|speech
593||35.|unknown
594|KIRK|What about your shitty car?|speech
595|STAINER|"Artist exemption. I'm expected to
have a shitty car."|speech
596|JACK|"Is there an artist exemption for
being a jag-off?"|speech
597|STAINER|Fuckin' A there is.|speech
598|KIRK|"Stainer's right. Patty was
probably just messing around. It's
not a big deal. Let's just bowl."|speech
599|DEVON|"What about Rick Ocasek?   Billy
Joel, Donald Trump..."|speech
600|STAINER|"Yeah, dumbass. Those are the wild-
cards. Money and fame."|speech
601|JACK|So, if he were a millionaire?|speech
602|STAINER|"A mil ain't what it once was,
Jackie. Devon's practically a
millionaire for Christ sake. A mil
might get you an eight but to bring
down a ten now days - two million
minimum."|speech
603||"Stainer finishes the equation by writing, ""Kirk = Fucked.""
Kirk's phone rings. He checks the ID and his eyes go wide."|stage direction
604||(into the phone)|unknown
605|KIRK|"Hey, Molly... Um, yeah, sure...
No, that sounds good. Yeah, I know
where that is. Um, okay, yeah...
see you then."|speech
606||Kirk hangs up and gapes at his friends, who wait in suspense.|stage direction
607|KIRK (CONT'D)|"Holy crap. (dazed pause) She just
asked me out for tomorrow night!"|speech
608||36.|unknown
609||"Kirk exchanges fives, fists, tips and hugs with Devon and
Jack. Stainer shakes his head, still not buying it."|stage direction
610||INT. BOWLING ALLEY MEN'S ROOM|location
611||"Kirk runs into the otherwise empty restroom. He stares into
the mirror and his smile fades into panic. He splashes water
on his face. He reaches for a paper towel but the dispenser
is empty."|stage direction
612||(to himself)|unknown
613|KIRK|"It's okay. Get it together. Guys
do this all the time. You can do
this. You can make it happen."|speech
614||(from inside a stall)|unknown
615|RANDOM MAN'S VOICE (O.S.)|"You better not be jerking off in
the sink, man!"|speech
616||EXT. AIRPORT PARKING LOT - DAY|location
617||"Kirk's Taurus pulls into a space. He climbs out and slams
the door. As it closes, he reaches but too late. He looks
through the window. The keys are hanging in the ignition."|stage direction
618||INT. AIRPORT SHUTTLE BUS|location
619||"WILLY, the Russian driver, is chipper and bubbly as he sings
along with ""I'm Like a Bird"" on the radio. Kirk is knocked
around by Willy's crazy driving. In the mirror, Willy
notices Kirk's dazed expression."|stage direction
620||(thick accent)|unknown
621|WILLY|"Kirk! You look like someone made a
second number in your breakfast
cereal. You are doing okay, yes?"|speech
622|KIRK|"You know what Willy. I honestly
don't know how I'm doing."|speech
623|WILLY|He does not know!|speech
624|KIRK|"I should be doing awesome but I
don't know. Know what I mean?"|speech
625|WILLY|Nope!|speech
626||37.|unknown
627|KIRK|How are you?|speech
628|WILLY|"Perfect! Willy is having another
kick ass of a day."|speech
629||Willy takes a hard left and some suitcases fall on Kirk.|stage direction
630||INT. AIRPORT FOOD COURT - DAY|location
631||"Kirk is picking up a coffee. As he walks on, he takes a sip.
The lid comes off and hot coffee spills on his shirt."|stage direction
632|STAINER (O.S.)|Way to go, Big Slick.|speech
633||"Stainer is now next to Kirk, who glares back at him as they
walk across the food court.
A short, plain girl behind the Orange Julius counter gives
them an apprehensive wave."|stage direction
634||STAINER (CONT'D)|unknown
635|STAINER (O.S.)|Oh, shit.    Let's go this way.|speech
636||"Stainer returns an uncomfortable smile but then redirects
their path away from her. Kirk waves."|stage direction
637|KIRK|Who's that?|speech
638|STAINER|"Nobody. Just some chick I boned
once when I was drunk. You look
like shit, bro."|speech
639|KIRK|"Thanks. I had trouble sleeping
last night. This Molly thing... I
don't want to want this, you know?
It just seems too good to be true.
I just don't get it."|speech
640|STAINER|"I know what you mean.   There has to
be some explanation."|speech
641|KIRK|"I can't think of one.   Not one that
makes any sense."|speech
642||38.|unknown
643|STAINER|"Well, let's spitball it a little.
You've got dick for money so she's
no gold digger. Oohh! Did you
ever see Double Indemnity?"|speech
644|KIRK|"Please don't say she wants me to
kill someone."|speech
645|STAINER|"Okay, then... maybe she's on a
scavenger hunt. You know, like
find a wagon wheel, a wiffle ball
bat and a fat, bald TSA agent -
that kind of thing."|speech
646||Kirk is no longer responding.|stage direction
647|STAINER (CONT'D)|"Oh, shit, dude. Al Qaeda. Think
about it. You're a TSA agent,
she's a terrorist..."|speech
648||Kirk walks away.|stage direction
649||EXT. OLD STRIP MALL - DAY|location
650||"Kirk, still in his TSA uniform, walks past a large laundromat
to a small storefront next door. The chipped and faded
lettering on the glass reads, ""Maury Hammerstein, Attorney At
Law - Aggressive, Dynamic Representation Since 1942!"" As
Kirk reaches for the door, he notices a small hand-written
sign, ""I don't make change!"" He goes inside."|stage direction
651||INT. LAW OFFICE|location
