|character|text|type
652||"Wood paneling, buzzing fluorescent lights and furniture the
Salvation Army would sell only as firewood.
Eric and Debbie sit with Kirk's parents. There are two
elderly women and another middle aged man in the room as
well. Maury, who's about a hundred years old - cute and
meek, fusses with an ancient VCR while smoking a cigarette.
Kirk sits down next to Eric. Kirk notices a free bank
calender on Maury's desk - dated 1991."|stage direction
653|ERIC|It's about time, numbnuts.|speech
654|KIRK|I came right from work.|speech
655||39.|unknown
656|MR. KETTNER|Okay Maury - we're all here.|speech
657|MAURY|"Oh! You bet! You betcha! Okay,
hi there Kirk. Firstly, let me
just say how awful sorry I am.
Stella was one heck of a gal and a
real dish. Anyhow, let me just..."|speech
658||"Maury gets the VCR going.   ""Wheel of Fortune"" comes up on the
screen."|stage direction
659|MAURY (CONT'D)|"Oh mercy. I didn't tape over her
with The Wheel did I?"|speech
660||"The picture goes to snow and then stutters into a shot of
Grammy sitting in her kitchen. She has just clicked the
video camera on with a remote control."|stage direction
661||MAURY (CONT'D)|unknown
662|MAURY (CONT'D)|Oh, good.    There she is.|speech
663|GRAMMY|"Testing. One, two, three, four.
Oh, this God damned thing!"|speech
664||She gets up and fusses with the camera.|stage direction
665|GRAMMY (CONT'D)|Jap piece of shit! Is it on!?|speech
666||Cutaway to Kirk tearing up.   Grammy sits back down.|stage direction
667|GRAMMY (CONT'D)|"Okay, my name is Stella Edith Dakin
and if you're watching this, I'm
dead as a doorknob and I ain't
spent all my money yet. I got shit
to do today so I'm going to get
right to it. This is my last will
and testament and if you miss
anything the old Jew's got the
paperwork. Okay, here's the
deal..."|speech
668||"Everyone besides Kirk leans in, excited to hear what they
might get. A phone rings. Maury looks around but the
ringing is coming from the TV. Grammy answers the phone."|stage direction
669||40.|unknown
670|GRAMMY (CONT'D)|"Hello? I'm kind of busy right now
Eric... Oh, for God's sake, boy!
How can you be sure it's even
yours? It could be practically
anybody's!... No, I'm not paying
for that!... Well, then I guess
you're going to be a daddy.
Congratulations, now I gotta go!"|speech
671||She hangs up, puts on her glasses and lights up a smoke.|stage direction
672|GRAMMY (CONT'D)|"Anyway! I love all of you, despite
some of the shit you pulled, but I
spent my life a gambler and I always
put my money on the best bet. The
odds of any of you fish doing
anything worthwhile with my stack
are slim to none. So old Grammy's
going all in on Big Slick."|speech
673||Everyone looks at Kirk who is stunned.|stage direction
674|GRAMMY (CONT'D)|"I'm proud of you, Kirk. Don't let
your old Grammy down. Do something
good with it."|speech
675||She blows a kiss, lifts the remote and aims it at the camera.|stage direction
676|GRAMMY (CONT'D)|Oh, for Christ sakes!|speech
677||She throws the remote at the lens.    The picture goes to snow.|stage direction
678|ERIC|"So Kirk gets it all!?   That is
bullshit!"|speech
679|KIRK|Eric, it can't be much.|speech
680|ERIC|Well!?|speech
681||"Maury digs into his desk and pulls out a mess of papers.    He
dons a pair of glasses that make his eyes look gigantic."|stage direction
682|MAURY|"Let's see here... Looks like she
had herself six G's in savings."|speech
683||41.|unknown
684|MAURY (CONT'D)|"Um, another three grand in bonds,
give or take. Her life insurance
will pay pert-near seventy grand."|speech
685||"He adds this up on an old adding machine (the kind with the
hand crank) and writes $77,800 on a chalk board, which is
mounted on the wall behind him."|stage direction
686|ERIC|She left him eighty grand!?|speech
687|MAURY|"Most of Stella's retirement home
expenses were covered by her reverse
mortgage. But, figure in thirty
thousand still due to Arborwood
Village. She racked up forty-seven
thousand in medical bills. And my
fee, of course, which now stands at
two thousand and change - which is
real reasonable, folks."|speech
688||"He writes ""Liabilities = $79,000    Total -$1,200."""|stage direction
689|ERIC|"So Kirk owes money!? HA! Shit,
man! That is God damn hilarious!"|speech
690||INT. FRENCH RESTAURANT - NIGHT|location
691||"The upscale restaurant is crowded. Kirk and Molly are eating
at a small table. Kirk is not relaxed like he had been the
last time they ate together. He is sweating and trying to
remain cool. The Maitre d is eyeing them suspiciously."|stage direction
692|MOLLY|"But, you can't legally be held
responsible for her debt. What
kind of hack is this attorney?"|speech
693||KIRK|unknown
694|MOLLY|It's okay.     I had it in savings.|speech
695||The waiter brings a drink to Molly.|stage direction
696||WAITER|location
697||(French accent)|unknown
698|MOLLY|"Madame. From ze gentleman in ze
grey suit."|speech
699||"From his table, a good looking man smiles and raises a drink
to Molly. She nods back - polite but annoyed."|stage direction
700||42.|unknown
701|KIRK|"Anyway... Grammy hated owing anyone
money. I'm afraid she couldn't
rest if she wasn't square with the
house. It's the least I can do.
She practically raised me."|speech
702|MOLLY|You're a good man, Kirk.|speech
703||"Molly smiles and takes his hands. The maitre d is watching
and getting angry. The waiter returns with another drink."|stage direction
704|WAITER|From ze gentleman in ze purple tie.|speech
705||"Another guy raises his glass to her from the bar. Molly is
getting irritated. Kirk is feeling smaller every minute."|stage direction
706|MOLLY|Listen, no more drinks.    Please.|speech
707||WAITER|unknown
708|MOLLY|Of course.     No more drinks, madame.|speech
709||MOLLY|unknown
710|MOLLY|I'm sorry.     This happens sometimes.|speech
711|KIRK|"Yeah, I get that a lot too. I'm
sure the next one will be for me."|speech
712||"Molly laughs. The best looking man Kirk has ever seen walks
up to the table. He and Molly hug."|stage direction
713|MOLLY|"Oh, my gosh! Talon! I didn't
realize you were in town already."|speech
714|TALON|I just flew in this morning.|speech
715|MOLLY|"Kirk, this is Talon.    This is my
good friend, Kirk."|speech
716|TALON|Great to meet you, sir.|speech
717||Talon gives Kirk a winning handshake, complete with wink.|stage direction
718||43.|unknown
719|TALON (CONT'D)|"So, do we have you for our Disabled
Angels Program again this year?"|speech
720|MOLLY|Wouldn't miss it.|speech
721|TALON|"That's fantastic. (to Kirk) Mol is
always a big hit with the kids."|speech
722||MOLLY|location
723|TALON|"Please. You're the one the kids go
crazy for."|speech
724|KIRK|So you two work together?|speech
725|MOLLY|"Only once a year. Talon is our
charity liaison at the air show."|speech
726||TALON|unknown
727|MOLLY|And?|speech
728|MOLLY|And my ex-boyfriend.|speech
729||"Kirk starts to choke. He grabs his water glass and takes a
swig but the ice collapses and the water pours all over him."|stage direction
730||KIRK|location
731|MOLLY|Oh, boy.   I guess I better...|speech
732||Kirk heads off to the bathroom, muttering to himself.|stage direction
733||KIRK (CONT'D)|unknown
734|MOLLY|Stupid.    Stupid. Stupid.|speech
735||INT. FRENCH RESTAURANT MEN'S ROOM|location
736||"Kirk is drying his shirt. A man is still zipping up as he
takes the next sink. Before washing, he offers a handshake."|stage direction
737|MAX|"Excuse me. My name is Max Fleming.
I'm a financial planner."|speech
738||"Kirk takes the handshake reluctantly and then gets a business
card. Max then starts to wash up - so does Kirk."|stage direction
739||KIRK|unknown
740|MAX|Oh, Hi.|speech
741||44.|unknown
742|MAX|"Please forgive me but I'm curious.
Who manages your portfolio?"|speech
743|KIRK|My portfolio? I don't really...|speech
744||Max takes the last paper towel - forcing Kirk to drip dry.|stage direction
745|MAX|"It's okay if you'd rather not say. I
admit that selling my services in a
men's room is a tad aggressive but
isn't that what a man of your means
requires in his financial planner?"|speech
746||KIRK|unknown
747|MAX|My means.|speech
748|MAX|"Judging by the company you're
keeping, I'd say that you're making
a handsome living. I can help you
do even better."|speech
749||INT. FRENCH RESTAURANT RESTROOM HALL|location
750||"Kirk exits reading Max's card - somewhat bewildered. The
Maitre d stops Kirk and speaks in a French accent."|stage direction
751|MAITRE D|"Excusez-moi Monsieur.   Might I have
a word?"|speech
752||KIRK|unknown
753|MAITRE D|Oh, sure.    Is everything all right?|speech
754||"The Maitre d looks around and then leans in and speaks
quietly - now without the French accent."|stage direction
755|MAITRE D|"My kids eat here. My mother's here
right now you son of a bitch."|speech
756||KIRK|location
757|MAITRE D|Okay.   Did I...|speech
758|MAITRE D|"Look, I can appreciate that this is
not some common street-walker.
You're obviously willing to pay for
the best but we can't have this
kind of thing at my place."|speech
759||45.|unknown
760|KIRK|"What? I'm not paying anyone.
We're just on a date."|speech
761|MAITRE D|"You are on a date with her? What
am I an idiot? Now, I don't wish
to embarrass you, sir, or make a
scene. So, enjoy your dinner but,
be warned, do not ever bring
another professional into my place.
(louder and back into the French
accent) Tres bien Monsieur!"|speech
762||INT. FRENCH RESTAURANT|location
763||"When Kirk rounds the corner, he sees that Molly and Talon are
still talking. Kirk hides behind a plant. Molly is beaming.
She stands to hug Talon and kiss his cheek before he exits
the restaurant. Kirk returns to the table."|stage direction
764||KIRK|location
765|MAITRE D|Oh, no.   Did I miss Talon?|speech
766|MOLLY|"He had to go but he asked me tell
you how much he enjoyed meeting you."|speech
767||KIRK|location
768|MOLLY|"Yeah. Super. He, uh, seems like a
great guy."|speech
769|MOLLY|"He is. He's wonderful. I know, I
know - the blue eyes and the rock
hard abs, right? But he's really
so much more than that. A gallery
in New York just opened an exhibit
of his photography. He's a genius."|speech
770||(to the waiter)|unknown
771|KIRK|Can we get the check?|speech
772|WAITER|"Madame, your bill has been covered
by ze woman in ze Raiders Jacket."|speech
773||A butch woman in the bar raises a glass in Molly's direction.|stage direction
774||INT. MOLLY'S CAR - NIGHT|location
775||Molly and Kirk pull into a parking lot.|stage direction
776||46.|unknown
777|MOLLY|"Oh my gosh! This is your
apartment? I used to live in this
neighborhood back in college."|speech
778|KIRK|"Yeah, I'm gonna move to a better
place pretty soon."|speech
779|MOLLY|"We used to come to parties over
here sometimes. Oooohh. Can I
come up and see your place?"|speech
780||EXT. KIRK'S APARTMENT|location
781||"It's Friday night and several college parties are raging in
the complex. Kirk leads Molly up the stairs and down the
balcony hall toward his door. They pass a few college
students on the way; a couple making out, a guy vomiting in a
bush. Two apartment windows are covered with tapestries of
Bob Marley and a giant pot leaf."|stage direction
782||INT. KIRK'S APARTMENT|location
783||"Kirk and Molly enter.   The apartment is neat, clean and
fairly sparse."|stage direction
784|KIRK|It's not much, I know.|speech
785|MOLLY|No, I like it!|speech
786||"Molly walks around and examines certain items. Kirk quietly
hides a framed picture of Marnie. Molly passes his computer
desk where she coos at a screensaver of baby polar bears.
Just as she passes it, she bumps the mouse and the computer
comes to life, revealing a ""Hot Back-Door Asians"" website.
Molly didn't see it and Kirk scrambles to turn off the
monitor. She turns to see what he's doing. He smiles. She
moves on to a rack of DVDs."|stage direction
787|MOLLY (CONT'D)|"Wow, we have a lot of the same
DVDs. Life of Brian, Cool Hand
Luke, Family Guy... Beaches, Kirk?"|speech
788||KIRK|location
789|MOLLY (CONT'D)|What?   It's a good movie.|speech
790|MOLLY|I love that movie.|speech
791||47.|unknown
792||She spots a crate full of vinyl records.|stage direction
793|MOLLY (CONT'D)|"Wow, records. No Way! Look at all
this Cheap Trick!"|speech
794|KIRK|You like Cheap Trick?|speech
795|MOLLY|"Are you kidding? Heaven Tonight is
the first album I ever owned! A
hand-me-down from my big sister.
She was the coolest person in the
whole world."|speech
796||She notices an upright piano in the corner.|stage direction
797|MOLLY (CONT'D)|You play the piano?|speech
798|KIRK|"A little. My grandma taught me.
It was kind of our thing. She was
a great player. Ragtime, show
tunes, that kind of thing. I'm
really not very good."|speech
799||She plops down on the couch.|stage direction
800|MOLLY|"Oh, I'll bet you're great.   Play
something for me."|speech
801|KIRK|"No, I can't really play in front of
people."|speech
802|MOLLY|"What, the stage fright thing?    Come
on it's just me. Please?"|speech
803|KIRK|"No, I really can't. Trust me,
you're not missing anything."|speech
804||"Kirk decides to join her on the couch but then he balks into
a little dance of almost sitting. He finally commits to sit."|stage direction
805|MOLLY|"So you've never played in front of
anyone?"|speech
806||48.|unknown
807|KIRK|"Nope. Almost did once. A talent
show in high school. I just sat up
there drenched in sweat. I really
thought I could do it but then I
made my big mistake."|speech
808|MOLLY|"Let me guess. You looked at the
audience."|speech
809|KIRK|"Yep. All these eyes on me. I'm
shaking, my head is spinning, I'm
trying to remember if I even play
the piano... and then, I puked."|speech
810|MOLLY|Right there on the stage?|speech
811|KIRK|INTO the piano actually.|speech
812|MOLLY|"Shut up! You're lying!      Why would
you do that?"|speech
813|KIRK|"It was a reflex. I was trying not
to barf on the floor. Turns out
it's a lot easier to clean puke off
a stage than out of a baby grand."|speech
814|MOLLY|"Yeah, that has to be a real bitch.
Oh, I shouldn't be laughing. You
poor thing."|speech
815||"Molly brushes his hair back with her hand. Kirk is frozen
with fear. Molly leans in. Kirk also leans in but not too
far. Molly smiles, realizing that it's up to her to make
this official. She takes him by the collar, reels him in and
kisses him. They make out for a moment. Kirk is near panic
but he does his best to keep it together."|stage direction
816|KIRK|"Sorry. I'm a little cotton-mouthed.
I'm going to get a glass of water.
How 'bout for you? Water? A nice
glass of, you know...water?"|speech
817||MOLLY|location
818|KIRK|Yeah.   That sounds good.|speech
819||49.|unknown
820||Kirk steps away from her and disappears into...|stage direction
821||INT. KIRK'S APARTMENT KITCHEN|location
822||"He pours a glass of water. He's about to return when he sees
his reflection in the window. The boner under his khakis is
not subtle. He looks down and starts to panic."|stage direction
823|KIRK|Um... You want anything to eat?|speech
824||MOLLY (O.S.)|unknown
825|KIRK|No thanks.|speech
826||"Kirk opens the fridge and thrusts his pelvis in. He takes a
few deep, calming breaths.   He closes the fridge - still at
full alert. Kirk searches the kitchen, his panic building.
He grabs a Time Magazine. He flips through frantically. He
turns to a bikini model in an ad, then a naked aboriginal
women, then bare breasts in a breast cancer article."|stage direction
827|KIRK|Oh come on!|speech
828||He is sweating like crazy.|stage direction
829|MOLLY (O.S.)|Can I give you a hand?|speech
830||KIRK|location
831|MOLLY (O.S.)|No.   I got it!|speech
832||"Kirk finally flips to a picture of Barbara Bush.   He stares
at it hard. His boner begins to retreat."|stage direction
833||INT. KIRK'S APARTMENT|location
834|MOLLY|"Listen Kirk, I want you to know
that I would really like to, you
know, to be with you tonight."|speech
835||KIRK (O.S.)|unknown
836|MOLLY|Really?|speech
837||INT. KIRK'S APARTMENT KITCHEN|location
838||"The boner pops back up. Kirk silently mouths, ""MOTHERFUCKER!""
at his mischievous little man."|stage direction
839|MOLLY (O.S.)|"Well, sure. But... I just don't
think I'm ready yet."|speech
840||50.|unknown
841||Kirk's reply is rushed with enthusiastic relief.|stage direction
842||KIRK|unknown
843|MOLLY (O.S.)|"Sure! Sure! Yeah! No problem!
Great! That's...that's great!
Ice!? You want some ice!?"|speech
844|MOLLY (O.S.)|Sure.|speech
845||"Kirk opens the freezer. He puts a few cubes in her water and
then grabs a fistful and shoves his hand in his pants."|stage direction
846||INT. KIRK'S APARTMENT|location
847||Molly gets cozy on the couch and looks even sexier.|stage direction
848|MOLLY|"I mean, don't get me wrong. I want
to! Believe me - getting naked and
crazy sounds fantastic right now."|speech
849|KIRK (O.S.)|Shit!|speech
850|MOLLY|Are you okay?|speech
851|KIRK (O.S.)|Yeah, fine.|speech
852||INT. KIRK'S APARTMENT KITCHEN|location
853||"Kirk runs the water while he digs under the sink. He finds
duct tape. He pulls some tape off the roll. It makes a loud
noise that causes Molly to pause and Kirk to tense up. Kirk
opens his pants and begins taping down the trouble-spot. He
coughs hard to cover each subsequent tug of the tape roll."|stage direction
854|MOLLY (O.S.)|"I just think we should get to know
each other first.   I'm no prude.
I mean, I'm pretty generous in bed.
Once I trust a person, I like to
experiment and get pretty wild."|speech
855|KIRK|Oh, dear God.|speech
856|MOLLY (O.S.)|"But, I just need to feel safe
first."|speech
857||51.|unknown
858||"Kirk finishes taping up, zips his pants and checks his
profile in the reflection from the window."|stage direction
859||INT. KIRK'S APARTMENT|location
860||Kirk returns with two glasses of water and no visible boner.|stage direction
861||KIRK|location
862|MOLLY (O.S.)|Hey.   I'm totally fine with that.|speech
863|MOLLY|You're the best.|speech
864||"Kirk gives an ""aw-shucks"" head tilt.    Molly stands."|stage direction
865|MOLLY (CONT'D)|Okay, well, I'd better go then.|speech
866||"They walk to the door. Molly leans in and they kiss a few
moments more. Kirk winces as the tape is getting a little
snug. She drops her keys and then goes down on one knee to
retrieve them. Suddenly she starts coughing. She puts her
fist over her mouth.
Kirk's POV:   As her head and fist bob in front of his crotch.
Kirk winces again. She hears the tape start to give way.
She looks up, slightly confused. Kirk looks around as though
he's looking for the source of the sound. Molly stands."|stage direction
867|MOLLY (CONT'D)|"I had a really nice time.    I'll
call you tomorrow."|speech
868||KIRK|unknown
869|MOLLY (CONT'D)|Great!|speech
870||Kirk opens the door for Molly.|stage direction
871||EXT. KIRK'S APARTMENT|location
872||"As Molly exits, she gives him one last kiss. Two studly male
college students are playing foosball on their patio. They
stop when one points out the hottie who's kissing Kirk.
Molly trots off."|stage direction
873||COLLEGE STUDENT #1|unknown
874|MOLLY (CONT'D)|Damn, man!     That chick is fine!|speech
875||"Kirk returns a cool ""whassup"" nod to the guys."|stage direction
876|COLLEGE STUDENT #2|All right Mr. Kettner!|speech
877||52.|unknown
878|COLLEGE STUDENT #1|You wanna play some foos!?|speech
879|KIRK|No thanks fellas.|speech
880||Kirk beams from the attention as he goes back inside.|stage direction
881||INT. KIRK'S APARTMENT|location
882||"He drifts over to his piano and sits down. The joy of what
has just happened is plastered on his face. He launches into
a furiously happy Jerry Lee Lewis style romp. Soon a
neighbor is pounding on the wall. Kirk stops playing."|stage direction
883|KIRK|Sorry, Mrs. Neusbaum!|speech
884||"Kirk continues his celebration, dancing around the apartment.
He picks up the picture of Marnie and speaks to it."|stage direction
885|KIRK (CONT'D)|"Ron seems like a swell guy. I love
Pizza Hut. What? Who's this?
Why, this is my girlfriend, Molly.
Oh, don't be that way. Oh, there,
there, now. Here's a tissue."|speech
886||He drops the picture and continues the dance.|stage direction
887||INT. KIRK'S APARTMENT BEDROOM - NIGHT|location
888||"Kirk lies in bed staring at the ceiling fan. The smile
continues as he drifts off to sleep. Time lapses as Kirk
sleeps and the sun comes up. Still smiling, his eyes open
like a shot and he reaches for his phone - ""No Missed Calls.""
MONTAGE OVER MUSIC:
1) Kirk gets up and goes into the bathroom.   He checks his
gut and hairline in the mirror.
2) From under his bed, he pulls out a Total Gym still in the
box. It is dusty, unopened and has a ribbon still attached
along with a card that reads, ""Happy Graduation - Love Mom
and Dad."" He sits in the living room bewildered as he reads
the directions. The parts are spread out all over the floor.
He works out on the machine but it soon violently collapses
underneath him. He checks his phone. ""No Missed Calls.""
3) He throws away unhealthy snacks and treats from the
cupboards."|stage direction
889||53.|unknown
890||"He opens an untouched box of Healthy Bran and fills a bowl.
He watches cartoons as he heaps sugar on the healthy cereal
and then checks his phone. ""No Missed Calls.""
3) He surfs the web. He reads info on the Hair Club For Men
site. He moves to Hot_or_Not.com. The first woman is very
pretty. He rates her a seven, the next is also pretty and
gets another seven, the next girl is very unattractive. Her
score is three. Kirk feels bad for her and rates her a ten.
He checks his phone. He moves on to ""BackDoorAsians.com.""
4) Kirk watches a Connery James Bond movie on TV. The lower
third reads, ""AMC's 24 Hours of Bond."" No Missed Calls. The
sun is setting and Bond is now Roger Moore - No Missed Calls.
Kirk digs a box of Ding Dongs out of the trash and eats them
as he watches. It's dark outside and Kirk is in bed watching
Timothy Dalton - No Missed Calls. The morning light is
creeping in as Pierce Brosnan does the driving and Kirk is
still awake looking devastated - No Missed Calls.
5) Kirk is at a convenience store buying milk. He is a mess -
tired, unshaven, wearing a frumpy sweatsuit. He passes the
magazine rack and something catches his eye. It's a gorgeous
picture of Molly on the cover of Phoenix Entrepreneur
Magazine. Kirk holds up the magazine and then catches his
own reflection in a mirror on a sunglasses rack.
6) Kirk is walking home. Every street sign, billboard and T-
shirt he sees reads, ""NO MISSED CALLS.""
MUSIC FADES OUT"|stage direction
891||INT. KIRK'S APARTMENT BATHROOM - DAY|location
892||"He stands in the shower sulking. He hears the phone ring in
the next room. He jumps out, grabs a small towel and starts
to dry off as he runs into the bedroom. He reaches the
charger base but the phone is not there. He stands and
listens hard to the ringing. He runs into the living room.
Angle on the phone. It's hiding under a pillow on the couch.
In the background, Kirk rushes around the room flipping up
papers and magazines. The phone keeps ringing and Kirk's
panic increases until he finally spots the phone. Kirk dives
for it, losing his towel in the process."|stage direction
893||KIRK|location
894|KIRK (CONT'D)|Hello!?   Hello!?|speech
895|STAINER (V.O.)|"Took you long enough. What were
you doing, taking a growler?"|speech
896||"Kirk notices a woman on the landing outside behind him.   She
can see his ass through the window. He covers up."|stage direction
897||54.|unknown
898|KIRK|Sorry, Mrs. Nuesbaum.|speech
899||EXT. DOWNTOWN SHOPPING DISTRICT - DAY|location
900||"Kirk and Stainer come out of a record store and walk past the
shops and restaurants. Kirk holds a stack of flyers for
Stainer's band. As they walk, Kirk hands flyers to Stainer
who posts them on walls and kiosks with a staple hammer."|stage direction
901|STAINER|"Kirk, it's a simple rule of life.
Look around. People are pretty
evenly matched."|speech
902||"Kirk and Stainer look at the couples that stand at the bus
stop, sit in the outdoor cafes and walk down the sidewalk.
Each couple is fairly closely matched - pretty with pretty,
ugly with ugly, heavy with heavy, fit with fit."|stage direction
903|KIRK|"Yeah, but Stainer, she was the one
who asked me out. So, why..."|speech
904|STAINER|"That first night, were you
intimidated by her?"|speech
905|KIRK|No, I didn't think I had a chance.|speech
906||STAINER|unknown
907|KIRK|"Exactly. So you were relaxed and
funny. You were on."|speech
908||"Stainer posts several ""Wheel in the Sky"" flyers on a kiosk."|stage direction
909|KIRK|So I gotta get back to that.|speech
910|STAINER|"That's just it, Kirky. Now that
she's opened the door, you can't
get back to that."|speech
911|KIRK|So I'll have to fake it?|speech
912|STAINER|"Forget it. You can't fake that
far. A broad like her - she'll
smell that horseshit a mile away."|speech
913||55.|unknown
914||Kirk and Stainer enter a...|stage direction
915||EXT. CAFE FRONT PATIO|location
916||...and take a table on the crowded patio.|stage direction
917|STAINER|"Can we get a couple of menus?
(then to Kirk) You eating?"|speech
918|KIRK|Maybe just a salad.|speech
919|STAINER|"Dude, one salad ain't going make up
for thirty years of chili dogs."|speech
920|KIRK|"I know. But I got dinner with my
folks later."|speech
921|STAINER|"Fun. Be sure and stab your brother
in the eye with a fork for me."|speech
922|KIRK|Sorry, Eric's not coming tonight.|speech
923||"Kirk motions toward a mismatched couple (nerdy guy with
knockout girl) who pass Kirk and Stainer's table on their way
to the valet stand. Stainer rolls his eyes."|stage direction
924|KIRK (CONT'D)|"You know what - this is ridiculous.
I'm just going to call her."|speech
925|STAINER|"Fuck you are! Put that thing away.
You do not call her. Don't you get
it? Talon is back in town."|speech
926|KIRK|No, she broke up with him.|speech
