|character|text|type
558||"Mona whips the chain into Max's face, CLANKING as it strikes
bone. Instantly, blood begins streaming from his mouth..."|stage direction
559|MONA|We need to talk about my sister.|speech
560||The chain CRACKS again, Max's teeth rattling from the blow.|stage direction
561||hoever killed your sister did the same|unknown
562|MAX|thing to my partner--|speech
563||(louder)|unknown
564|MAX|It was the same person.|speech
565||MONA|unknown
566|MAX|Yeah.   You.|speech
567||Mona HITS Max again, this time in the shins.    Max CRIES OUT.|stage direction
568||"M
33."|unknown
569||slurred)|unknown
570|MAX|So stupid...|speech
571||Slowly at first, Mona WHIRLS the chain into a larger loop...|stage direction
572|MONA|"You left your wallet lying beside her
body. Who's stupid?"|speech
573||M|stage direction
574||ax slumps to the side, spitting out a stream of blood...|unknown
575|MAX|"Does that sound like something a Homicide
cop would get wrong?"|speech
576||"Mona whips the chain faster, CUTTING the air...thinking...
Gasping at the pain, Max slowly straightens up again."|stage direction
577|MAX|You know somebody named Owen?|speech
578||Mona lets the chain's speed gradually slow again.|stage direction
579|MONA|Owen Green?|speech
580|MAX|"Natasha called him on her way out of my
apartment. Give me one day to--"|speech
581||Mona drops the chain with a CLANK.|stage direction
582||ONA|unknown
583|MAX|No.   Now.|speech
584||She motions for her men to haul Max to his feet.|stage direction
585||INT. OWEN'S BUILDING - HALLWAY - NIGHT|location
586||"Mona and Max storm down a dim apartment hallway in tense
silence. Max wipes the blood from the cuts on his face."|stage direction
587|MAX|Who is this guy?|speech
588||Mona lets her coat fall open, revealing a machine gun.|stage direction
589|MONA|"Somebody my sister used to hang around
with. Nice kid."|speech
590||"34.
MONA(CONT'D)
(chambering a round)"|unknown
591|(MORE)|You better hope he backs your story up.|speech
592|MAX|I have things I need to ask him, myself.|speech
593||Mona flashes Max a look before POUNDING on a door.|stage direction
594||(calling through the door)|unknown
595|MONA|Owen, open up.|speech
596||A louder, longer KNOCK.|stage direction
597|MONA|Open--|speech
598||"A muted SCREAM filters through the door, cutting her short.
Max DRIVES his boot into the door, splintering the jam..."|stage direction
599||INT. OWEN'S APARTMENT - CONTINUOUS|location
600||"Max and Mona rush into the room, breath smoking from the
cold. All of the windows are open. Gusts of snow blow
inside, drifts of white powder extending into the room..."|stage direction
601||(calling out)|unknown
602|MAX|Owen?|speech
603||"He SCREAMS his response from the next room.    They rush...
LIVING ROOM
...through the door, weapons drawn.    Both stop short:
OWEN GREEN is all alone in the room. SCREAMING, swatting at
empty air around him, each limb moving a different direction.
M"|stage direction
604||ax lowers his pistol - ready for anything, not for this.|unknown
605||"Owen's feet slip over the snow, toes curling desperately on
the ice, searching for traction as they slide closer..."|stage direction
606||(breathless, to no one)|unknown
607|OWEN|Help me.|speech
608||...to an open window on the other side of the room.|stage direction
609|MONA|Owen?|speech
610||35.|unknown
611||"He doesn't seem to hear - sweat streams down his terrified
face, snowflakes frosting the perspiration on his chest.
Owen's eyes are instead drawn through the open windows..."|stage direction
612||..where SILHOUETTES flicker against the storm-darkened sky.|unknown
613||"Oblivious to the shapes outside, Max and Mona watch Owen's
terror intensify, his dervish dance growing more frantic...
Outside every window, BLACK SHAPES float closer in the air
above the street - vaguely human, long wings POUNDING...
...sending gusts of wind ripping through the windows, kicking
up snow and ice. Max and Mona shrink back, shielding their
eyes at the blast as Owen's tortured SCREAMS fill the room...
Twisting like he's trying to pull free from invisible hands,
Owen reaches the window. As if trying to push back, his
hands and feet fly up to the trim around the window..."|stage direction
614|MAX|Owen, wait...|speech
615||"Unable to turn around, Owen's eyes find the reflected images
of Max and Mona in the window he's being pulled to...
H"|stage direction
616||is attention is torn from their reflections on top of the|unknown
617||"glass by the spectres looming beyond it outside. Their claws
reach in, raking his body, pulling him closer...
Realizing that Owen isn't stopping, Max rushes towards him."|stage direction
618||(screaming)|unknown
619|OWEN|Make them stop, tell them I can't fly...|speech
620||"Max lunges forward, trying in vain to cover yards...
...when Owen only has inches.    He's ripped into the void..."|stage direction
621||EXT. OWEN'S BUILDING - CONTINUOUS|location
622||"Max throws himself forward into the window, looking down...
...where Owen falls, looking up at Max helplessly...
... then less terrified, as the wind keeps RUSHING past...
...and then, just before impact, relieved.
Owen CRASHES into the sidewalk.
B"|stage direction
623||36.|unknown
624||"Mona races up to join Max in the window. For a stunned beat
they look down at the shattered body of Owen Green - his
unblinking eyes frozen on the heavens, collecting snowflakes."|stage direction
625||(shaken)|unknown
626|MONA|What did we just see?|speech
627||"No answer, Max studies Owen's twisted body. Long, finger-
like bruises trace out from his neck, blending with the
tattoos that lace his grey skin. Grinning skulls, the USMC
eagle/globe/anchor...
...and a pair of wings, just like Natasha's.
I"|stage direction
628||NT. TATTOO PARLOR - NIGHT|unknown
629||Max drops a Polaroid of Owen's tattoo onto a glass counter.|stage direction
630||lue water ripples through translucent pipes in the walls and|unknown
631||"floor, the air of the small room glowing like the ocean. A
mirrored ceiling repeats the tattoo parlor again above."|stage direction
632|MAX|You're sure this is the place?|speech
633|MONA|Natasha had all her work done here.|speech
634||An elderly TATTOO ARTIST moves up behind the counter.|stage direction
635|ARTIST|Something I can help you with?|speech
636||Max slides the photograph across to the Tattoo Artist.|stage direction
637|MAX|What if I wanted this tattoo?|speech
638|TATTOO ARTIST|Then you're probably in the Marine Corps.|speech
639||(pointing to the wings)|unknown
640|MAX|This one.|speech
641||"The Artist stoops closer, tensing when he sees the design.
Mona leans over the counter, locking onto the Artist's eyes."|stage direction
642|MONA|What is it?|speech
643||37.|unknown
644||As encouragement, Mona lets her coat open to reveal her gun.|stage direction
645||(intimidated)|unknown
646|TATTOO ARTIST|"It's a Norse superstition. The Vikings
used to wear them for protection."|speech
647|MONA|"Trust me, my sister had all the guardian
angels she needed."|speech
648|TATTOO ARTIST|Not angels. Valkyries.|speech
649||T|stage direction
650||he Artist goes to a shelf bulging with old books - his|unknown
651||"reference library. He searches through dusty volumes...
Just past the shelves, a doorway is cracked open. A young
APPRENTICE artist hovers in the dark and listens in on the
conversation unnoticed - sweating, his pupils drawing back...
Returning with a book, the Artist finds the page: a winged
woman led by a pack of wolves over a grizzly battlefield."|stage direction
652||TATTOO ARTIST|unknown
653|TATTOO ARTIST|"In Norse mythology, the only way you get
to go to heaven is to die in violence.
Die in your sleep, you go to hell.
Valkyries fly over the battlefields,
picking out the righteous dead. They
reward the people who draw first blood."|speech
654||(beat)|unknown
655|TATTOO ARTIST|A soldier's angel.|speech
656||Nodding, Mona lets her gun drift away from the Artist.|stage direction
657|TATTOO ARTIST|"I'm generally thrilled to have referral
business, but I tell people looking for
those wings to find ink closer to home."|speech
658|MONA|Where's home?|speech
659|TATTOO ARTIST|Some club down in Alphabet City.|speech
660||"Mona turns to leave, satisfied, but Max is stuck on the book -
the valkyrie's empty eyes, bloody bodies at her feet..."|stage direction
661|MAX|Protection from what?|speech
662||I|stage direction
663||"38.
(2)"|unknown
664||"Suddenly, all the lights go out.
T"|stage direction
665||he pipes stop glowing, blackness replacing the blue lights.|unknown
666||"Out of the corner of his eye, Max sees a DARKER SHADOW race
across the room towards them, almost too fast to be human...
Max and Mona have time to duck; the Artist isn't so lucky. A
CRACK of bone, the old man's skull taking the brutal force...
Mona's weapon BARKS, a short burst RIPPING through the air."|stage direction
667||n the momentary fire, Max can see the Shape swinging a club.|unknown
668||"The bat CUTS through the air, SMASHING open glass pipes in
the wall behind Max, the shards raining down over him...
The Figure charges at Max again.   Max's pistol CRACKS.
The room is abruptly silent.
The lights flash on.   Mona steps out of the back room...
Max is stunned to find himself standing over nothing more
monstrous than the Apprentice - one hand over the hole in his
chest, the other weakly swinging a shard of glass at Max."|stage direction
669||"A
PPRENTICE
(gurgling, to Max)"|unknown
670||They see you...they see you...|location
671||MONA|unknown
672||Do you know this guy?|location
673||"Max shakes his head, struck mute by the look in the dying
man's eyes."|stage direction
674||INT. MAX'S CAR - NIGHT|location
675||"Max pushes the car over slick streets, clothes covered in the
Artist's blood. Lost in thought, Mona looks out the window."|stage direction
676||"MONA
(without conviction)"|unknown
677||"Maybe it isn't anything new.   People get
strung out, act crazy..."|location
678||MAX|unknown
679||You think they were both on something?|location
680||M|stage direction
681||"39.
MONA"|unknown
682|MAX|"Crystal meth, maybe, some amphetamine
that raises your body temperature in an
overdose. Explains why they were both
sweating like that, trying to cool off."|speech
683||(beat)|unknown
684|MAX|"Of course, a junky won't usually jump out
the window if there's someone left in the
room to beg or rob."|speech
685||ax nods his agreement, replaying Owen's death in his mind.|unknown
686|MAX|You were standing right beside me.|speech
687||MONA|unknown
688|MAX|And?|speech
689|MAX|Jumped is not the word I'd use.|speech
690||EXT. RAGNA ROK - DUSK|location
691||"In a block of abandoned storefronts, only one retains a spark
of life, its red sign burning in the dying light: RAGNA ROK.
T"|stage direction
692||he streets are more crowded there, people shuffling towards|unknown
693||that sign and the sounds of DARK MUSIC filtering from inside.|stage direction
694||INT. MAX'S CAR - DUSK|location
695||"Max's car turns onto the block, slowly approaching Ragna Rok.
Max and Mona silently absorb the scene on the street. Even
from halfway down the block, BASS from the club reaches them."|stage direction
696|MONA|They all look...|speech
697||"Across the street, Max watches someone dragging a limp body
by one leg. Nobody he walks past seems to notice."|stage direction
698||MAX|unknown
699|MONA|Like Owen.|speech
700||Max keeps his speed slow, idling away up the block.|stage direction
701|MAX|This isn't anything I've seen before.|speech
702||40.|unknown
703||"Ragna Rok recedes in the mirror, the block between it and the
car studded with more smoldering cars and dead-eye faces,
their numbers seeming to grow even as Mona watches."|stage direction
704||ONA (CONT'D)|unknown
705|M|You ever been to Rome?|speech
706||"Max doesn't answer, the coming plague before him registering.
Mona glances up at a passing street sign - ""LITTLE ITALY."""|stage direction
707|MONA (CONT'D)|Better cities than this one have fallen.|speech
708||(pointing to the curb)|unknown
709|MONA (CONT'D)|This is far enough.|speech
710||Mona opens her car door and climbs out, leaning back inside.|stage direction
711|MONA (CONT'D)|Sorry about the chain.|speech
712||"Mona SLAMS the door and moves off down the sidewalk, blending
into the crowd. Max drops the car into gear, giving one last
glance to Ragna Rok before pulling away.
T"|stage direction
713||here's some flicker of movement on the rooftop...|unknown
714||U|stage direction
715||EXT. RAGNA ROK - ROOFTOP - DUSK|location
716||p on the roof, MUSIC inside the club RATTLES old pipes.|unknown
717||"Perched at the edge of the roof, a figure CHANTS along...
Jack Lupino - the tattooed face we caught   a glimpse of in the
candle light of Trevor's party, now fully   visible in the
failing sun and no less frightening. His    colorless eyes
absorb the street, the SCREAMS, Max's car   pulling away...
On his back, the tattoos of two elaborate black wings. Steam
rises from ink-blackened skin, snow melting before it lands."|stage direction
718||INT. MAX'S APARTMENT - NIGHT|location
719||"Max sits in his chair in the silent room, turning the pages
of Michelle's book. There's more than grief on his cut and
bruised face tonight, hands not trembling the way they were.
Fruit bowls, delicate charcoal nudes flip past...
Frustrated, Max lets the images drift by with less sentiment:
images no longer speaking to the questions he needs answered.
With an exasperated sigh, Max slams the book closed...
A faint white sliver appears in the cover.
T"|stage direction
720||41.|unknown
721||"Max leans closer. It's the corner of a piece of paper,
protruding from a razor-thin cut in the spine of the
sketchbook, invisible under all but the closest inspection.
Max runs his thumbnail into the gap, spreading glue CRACKLING
- he flinches, almost afraid to cause the book pain.
F"|stage direction
722||or a moment, Max is caught between his desire to protect the|unknown
723||"memento and to see what's hidden inside. A deep breath...
With a sharp pull, the cover of the book SHEARS away.
The pages wad and wrinkle, old paint flaking off. The cover
he'd caressed RIPS. Fluttering to the floor, a sheaf of
yellowed pages hidden in the cover flutter to the floor.
Max opens the folded pages. The first is nearly identical to
what we saw inside: a bouquet of flowers, unfinished. Max
scrutinizes the pencil strokes...suddenly, his eyes go wide:
A little pair of bat-like wings. In the corner of the page,
having nothing to do with the rest of the still life.
Max turns to the next page. There's a another drawing of
wings - larger this time, pencil strokes more energetic.
Horrified by what he's seeing, Max's hands tremble as they
turn the page. On the next, the wings are the main drawing.
On the next, they're scrawled in smeared ink."|stage direction
724||(nauseous, to himself)|unknown
725|MAX|No...|speech
726||"The wings begin to lose their shape, overlapping.
Growing together.
The last page is completely black."|stage direction
727||INT. COP BAR - NIGHT|location
728||"Even with everybody out of uniform, the builds and body
language mark this as a cop bar. BB rushes inside, hair
giving him away as having been asleep shortly before."|stage direction
729||he bar is still decorated with plastic mistletoe and fake|unknown
730||snow. BB looks at the BARTENDER, who motions to the back...|stage direction
731||42.|unknown
732||"BACK BOOTH
BB fights his way to a corner booth, where Max is slumped
over a beer and a shot. A matching set wait for BB across
the table. BB pulls off his coat and sits, forced casual."|stage direction
733||BB|unknown
734|MAX|"It was sitting at this very table that
your father told me I needed to retire."|speech
735||(beat)|unknown
736|MAX|"For about a minute, I just sat here
thinking about knocking him out of his
chair. The job was everything to me, to
the point that I couldn't see the writing
on the wall - what it was doing to my
marriage, my health. Your old man knew
if I was going to listen to reason, it"|speech
737||B            could only happen in here.|stage direction
738||B stoops down to find Max's eyes, trying for a connection.|unknown
739|BB|"There's nothing you can't say in here.
It's like hallowed ground."|speech
740||For a long beat, Max works up the nerve to speak.|stage direction
741|MAX|"I watched a guy throw himself out of a
window tonight. The things he was saying-"|speech
742|BB|"Any guy who throws himself out a window,
I wouldn't pay any attention to the
things he said."|speech
743|MAX|"The problem is, I knew what he was
talking about."|speech
744||BB tries to nod his understanding, but concern creeps in.|stage direction
745|MAX|"I haven't been really afraid of anything
since...that night."|speech
746|BB|And you are now?|speech
747|MAX|"There's something going on, and I can't
find a rational explanation for it."|speech
748||B|unknown
749||"M
B"|stage direction
750||"43.
MAX(CONT'D)"|unknown
751|(MORE)|"There's...something out there, hurting
people--"|speech
752|BB|Okay, calm down.|speech
753||MAX|unknown
754|BB|It's real.     I'm not crazy.|speech
755|BB|"Then stop acting like it. Max, you're
breaking into offices, I.A. is all over
you, you won't even show up for work..."|speech
756|MAX|"The night Alex died, there was something
else in the room with us. I saw it."|speech
757||"B
B goes a bit pale, smile fading as Max's words continue.
B"|unknown
758|MAX|"It's really important that you be careful
how you talk to people about this, okay?
You're already under suspicion--"|speech
759|MAX|"It's the same thing these people are
seeing right before they die."|speech
760||(beat, pained)|unknown
761|MAX|I think Michelle saw it, too.|speech
762|BB|For God's sake, don't drag her into this.|speech
763||ax stands up, storming towards the exit. BB pulls out a|unknown
764||thick money clip and overpays before following...|stage direction
765||EXT. COP BAR - NIGHT|location
766||BB rushes out, struggling to keep up with Max's longer legs.|stage direction
767|BB|What's really going on here?|speech
768|MAX|"Alex found something out about what
happened to her. Something new."|speech
769||B|unknown
770|MAX|There's no way.    He would have told us.|speech
771|MAX|He was trying, right before he died...|speech
772||44.|unknown
773|BB|"Listen, okay? Why don't you come back
with me, let Beth make up the guest room
for you. Just for tonight."|speech
774||Max nods, but keeps moving away from BB.|stage direction
775|BB|"You need to take some time. Get some
sleep, heal up. See if it still feels
real after that..."|speech
776||MAX|unknown
777|BB|It's real.|speech
778||"Max crosses against the light, cutting through the driving
snow. BB tries to follow, but traffic pushes him back.
H"|stage direction
779||elpless, BB can only bury his hands in his pockets and watch|unknown
780||"Max fade away. After a moment, he pulls something out...
A business card: `J. BRAVURA, I.A.'"|stage direction
781||EXT. TRAIN PLATFORM - NIGHT|location
782||"In a ticket booth, an elderly ATTENDANT shivers by a space
heater, ticket windows plugged with make-shift insulation.
The attendant looks up from his book and sees Max approaching
through the snow. Max slows as he gets closer, looking up at
the glowing threshold to the trains beyond. He stops."|stage direction
783||(via intercom)|unknown
784|ATTENDANT|You riding?|speech
785||"Max holds for a moment. For all the danger he's faced, this
is the most hesitation we've seen from him so far."|stage direction
786||via intercom)|unknown
787|ATTENDANT|"If you're coming, you better come on.
Way it's looking, might be the last train
tonight."|speech
788||"Max takes a step into the light of the ticket booth. The
attendant opens the ticket slot, letting a gust of freezing
air blow inside. Max slides a few bills through.
Ticket in hand, Max starts his solitary march to the trains."|stage direction
789||45.|unknown
790||INT. GOGNITTI'S HOTEL - BAR - NIGHT|location
791||A|stage direction
792||dingy, dark bar on the first floor of an even sleazier|unknown
793||"hotel. It's nearly empty, only the dedicated DRUNKS
venturing out in the storm. The front door swings open...
The old men shiver at the stiff blast of wind rushing in,
turning to look. Napkins flutter. Snowflakes blow inside.
From a booth in the corner, VINNIE GOGNITTI (50s, pudgy)
shoots a hard look at the open door, not immediately
recognizing the SILHOUETTE in the passage..."|stage direction
794||VINNIE|unknown
795||In or out, asshole.|location
796||"Mona steps inside, boots heavy with ice. Her MEN follow.
Flanked by MEN of his own, Vinnie freezes when he sees Mona."|stage direction
797||So?|location
798||MONA|unknown
799||We need to talk.|location
800||(beat)|unknown
801||Talk.|location
802||Gradually, Vinnie and his men relax.|stage direction
803||VINNIE|unknown
804||"Shut the door, then. You Ruskies may be
used to it, but I'm freezing my dick off
over here."|location
805||"BACK OFFICE
They've packed into a tiny back office - Russian gunmen on
one side of the desk, Italians on the other. Mona and Vinnie
represent their different sides, the only people seated."|stage direction
806||Okay.     So talk.|location
807||MONA|unknown
808||"Something was taken from me. It involves
a club in Italian territory, so I need
your blessing to go make it right."|location
809||"V
INNIE"|unknown
810||You're asking my permission?|location
811||smirking to his men)|unknown
812||Well in that case, sweetheart...|location
813||M|unknown
814||V|stage direction
815||46.|unknown
816||Mona looks Vinnie over, bored to death by the whole thing.|stage direction
817|MONA|I said `blessing.'|speech
818|VINNIE|"Oh. Well, blessing might cost extra.
Which club are we talking about?"|speech
819||MONA|unknown
820|VINNIE|Ragna Rok.|speech
821||innie tries to keep a poker face, but the name chills him.|unknown
822|MONA (CONT'D)|Over on Avenue--|speech
823|VINNIE|Yeah, I know.|speech
824||(beat, rattled)|unknown
825|VINNIE|"Sure, fine. You have my
permission...blessing, whatever."|speech
826||Mona frowns, her wishes granted a little too easily.|stage direction
827|MONA|"You do still control that block, right?
It's south of--"|speech
828|VINNIE|The guy's name is Jack Lupino.|speech
829|MONA|Well, that sounds Italian to me.|speech
830|VINNIE|"He's no kind of Italian I've ever seen.
Tattooed freak, a real sicko from what we
hear."|speech
831||"ONA
(sneering)"|unknown
832|VINNIE|You're afraid of tattoos, now?|speech
833|VINNIE|"When the club first opened, I sent
somebody down to collect the...you know,
fire insurance. A day goes by, and I
don't see him. Then I get two boxes
delivered to me. One box's got my guy's
hands and ears in it. The other box has
a quarter of a million dollars in cash."|speech
834||"E
M"|stage direction
835||"47.
(2)
MONA
This neighborhood has been your family's
forever. Two-fifty large is all it takes
to--"|unknown
836||"What got my attention, Mona, was that the
boxes were delivered by a cop car. A guy
in uniform hands them to me in broad
daylight.
(beat)
I'm not scared of tattoos, or freaks, or
mouthy Russian bitches. But whoever's
watching over Lupino, whoever it is you
really need to bless you walking inside
Ragna Rok...him, I am scared of."|unknown
837||EXT. SUBURBAN TRAIN STATION - NIGHT|location
838||"The platform is cleaner than the ones in the city - dressed
up for the tastes of the COMMUTERS who step off of the train.
Max threads his way through the handful of exhausted
BUSINESSMEN arriving home, moving out into the darkness."|stage direction
839||EXT. SUBURBAN NEIGHBORHOOD - NIGHT|location
840||"The snow's driving just as hard out here, but peaceful houses
with warm windows glowing make the storm feel comforting. In
the yards, forgotten sleds disappear under new powder, gone
for good by morning. Snowmen distort as they swell.
Max Payne trudges up the center of the street, a black streak
spoiling the peace of the evening. A trespasser.
T"|stage direction
841||HE HOUSE|unknown
842||"One house on the block stands out: there's no neatly shoveled
driveway, no colorful Christmas lights flashing from the
eaves. A black void behind every window, no life inside."|stage direction
843||"ax stands in the street, looking up at the house.
BB (V.O.)
She was thirty-five. The daughter, two
months. From what we could tell, it
started out as a robbery.
XT. HOUSE - BACK YARD"|unknown
844||"A row of footprints lead around back.
G"|stage direction
845|VINNIE|"M
B
B"|speech
846||48.|unknown
847||oth of the men had records, mostly|unknown
848|BB (V.O.)|bullshit - possession, petty theft.|speech
849||"Hanging in the overgrown hedges, an overlooked scrap of
yellow police tape shimmers in the wind."|stage direction
850||ut that day...I don't know. They had|unknown
851|BB (V.O.)|something else on their minds.|speech
852||"Max stands at the back door. He touches the unpainted wood
around the glass, repairs never fully complete."|stage direction
853||ax was maybe ten minutes late.|unknown
854||Max reaches for the handle...hesitant to actually touch...|stage direction
855||CUT TO:|unknown
856||INT. HOUSE - LATE AFTERNOON (FLASHBACK)|location
857||"A living room in the stillness of evening, golden air packed
like amber around baby bottles and toys on the coffee table.
The front door opens, and a man steps inside...
Max Payne, different in every way: the malnourishment and
neglect gone from his face, a fullness in his frame from
M
regular home-cooked meals. Shave and a haircut. Nice suit."|stage direction
858||ax picks up the mail from the floor and strolls inside...|unknown
859||"KITCHEN
Tie loosened, Max gets a beer from the fridge. Unwinding, he
takes a long sip and begins sorting through the mail."|stage direction
860||lancing up from the mail, Max sees the kitchen door...|unknown
861||"Glass smashed.    Blinds torn.   Standing open.
STAIRWAY
Max charges upstairs.    MEN'S VOICES echo down from above."|stage direction
