|character|text|type|character_clean|gender
459|PETER|"Let's keep it at five and I won't
condemn your clubhouse."|speech|PETER|M
460||"Peter hands him a couple of dollars more. The two boys
take off.
Peter removes a PENLIGHT from his pocket.
Dust covers everything. A forest of COPPER TUBING and PIPES
where the sinks used to be.
PETER
inspects the floor. It's littered with cheap objects:
chipped combs, used rubbers, soggy newspapers, smeared
heroin syringes.
Something shiny catches his eye. He picks it up."|stage direction||
461||(quietly)|location||
462|PETER|Look, a broken tooth...|speech|PETER|M
463||"Something rustles nearby.
He notices an old, rotting poster on the back wall.  It
seems ODDLY TEXTURED somehow.  He walks toward it.
SUSAN
kneeling, pushes aside a dented trash bin. Behind it, there
is a cabinet with rusty sliding doors.
A SUBWAY TRAIN RUMBLES by outside, the sound echoes off
the tile walls.
Susan forces the door back. She peeks through the opening.
Her face stares back at her from a dirty pocket mirror.
She starts pulling something out.
PETER
at the oddly texture wall.  He shines the penlight at it...
...and is met with a FLUTTER OF WINGS.  MOTHS, perfectly
camouflaged against the poster on the wall, whiz past him.
Peter recoils."|stage direction||
464|SUSAN (OS)|You okay?|speech|SUSAN|F
465||"He nods.
SUSAN
turns back to her locker.  She withdraws a cheap PLASTIC
NECKLACE from it.  As she removes it, it breaks.  A coulpe of
beads fall away...
...rolls under the locker...
...and BOUNCE -- once, twice, thrice -- each time going
deeper till they comes to a stop.
Susan peers where the beads fell."|stage direction||
466|SUSAN|There's something under here.|speech|SUSAN|F
467||"Peter comes over, kneels by her. Susan takes a handful of
beads and throws them at the base of the locker.
CAMERA TRACKS to follow one of them. It rolls all the way
under.
A moment later, from some interior space, the sound of it
BOUNCING on cement. He shines his light inside."|stage direction||
468||INT. HOLE - PETER'S HAND|location||
469||"Very dark. A highlight glints off a shell-like surface.
The light barely touches it.
THE WHOLE SURFACE BACKS AWAY.
Peter drops the penlight.  It gets stuck in a jutting piece
of concrete.
PETER"|stage direction||
470|PETER|Shit.|speech|PETER|M
471||"Peter tries to get his hand in
DEEPER
But he cannot reach the light. It is literally inches from
his fingers...
SUSAN"|stage direction||
472|SUSAN|Let me try.  My hands are smaller.|speech|SUSAN|F
473||She kneels and goes for it.|stage direction||
474||INT. HOLE - SUSAN'S HAND|location||
475||"Her hand reaches for the penlight.
She barely touches it.  The penlight spins around.  Its light
now illuminates...
THE FACE OF A MAN.  Unseen by Susan.  Terrifying in its doll-
like simplicity.  In the darkness, its features seem
indiscernable, inert, almost frozen in a perfectly
symmetrical pattern.
It regards the spiderlike movement of Susan's fingers.
SUSAN'S
face squinches with the effort."|stage direction||
476|PETER|Honey, just leave it.|speech|PETER|M
477|SUSAN|No, there's...|speech|SUSAN|F
478||INT. HOLE - SUSAN'S HAND|location||
479||"As Susan's hand moves closer, the strange Face begins to
TREMBLE.
A CLICKING SOUND.
Susan's hand is almost there.
SUSAN
reaches further.
And suddenly A BEAM OF LIGHT cuts through the darkness.
Their vision resolves. The figures of two MTA COPS stand
before them:  ERNEST, 50, burly and bull-necked; and LEONARD
-- African American, 45, more formidable than fat."|stage direction||
480||(Wearily)|location||
481|LEONARD|Now don't tell me.|speech|LEONARD|M
482||INT. HOLE|location||
483||Susan's hand withdraws.|stage direction||
484|LEONARD (OS)|You lost a token, right?|speech|LEONARD|M
485||CUT TO:|unknown||
486||INT. SUBWAY PLATFORM - LATER|location||
487||"SHH-SHH-SHH.  A felt rag is expertly being pulled across a
set of pristine black shoes.
REVEAL Leonard sitting like a king in a chair, getting his
shoes shined by Manny.  He leans back laconically while
arguing with Peter. Ernest examines the ootheca picture."|stage direction||
488|PETER|Look, I showed you my badge...|speech|PETER|M
489|LEONARD|"Yeah, and you gonna have to show me a lot
bigger one you wanna go down there.
That's the old maintenance grid, Doc.
Swiss cheese: tunnels, tracks..."|speech|LEONARD|M
490|PETER|The Department of Public Health...|speech|PETER|M
491|LEONARD|"...should know better'n to go sneakin'
around my turf..."|speech|LEONARD|M
492|PETER|"Fine.  You want me to call your
supervisor?"|speech|PETER|M
493|LEONARD|Please do.  He's a lonely guy.|speech|LEONARD|M
494||"Uninterested, Leonard looks over to Susan and Chuy.
ANGLE ON SUSAN
She leans against the wall, inspects her dirty hand. Ernest
gives her his handkerchief."|stage direction||
495|CHUY (OS)|Gucci.  Flat pump.|speech|CHUY|M
496||"She looks down at Chuy, who sits nearby, holding a PAIR OF
SPOONS."|stage direction||
497|ERNEST|Your shoes.|speech|ERNEST|M
498||"She stares down at her shoes.  Gucci flat pumps, all right.
Susan smiles.
Just then, a SUBWAY TRAIN pulls up.  The doors open,
disgorging passengers. Chuy flips into action.  He starts
playing his spoons, CLICKING them together, slapping them
against his knee.
Susan watches in wonder as the boy begins to use the spoons
to IMITATE the different rhythmical step patterns of the
VARIOUS COMMUTERS: The rolling, comical gait of A FAT MAN,
the lithe haughty step of A PRIM LADY."|stage direction||
499||(Laughs.  To Chuy.)|location||
500|SUSAN|That's wonderful!  What grade are you in?|speech|SUSAN|F
501||Chuy doesn't answer.|stage direction||
502|ERNEST|No school. Shoes're all Chuy knows about.|speech|ERNEST|M
503||Ernest discreetly points to his forehead.|stage direction||
504||(immediately)|location||
505|MANNY|He's special.|speech|MANNY|M
506|LEONARD|"He can imitate anything, you just watch
him."|speech|LEONARD|M
507||(Irritably, to Leonard)|location||
508|PETER|Excuse me, I'm talking to you.|speech|PETER|M
509|LEONARD|No, you talkin' at me.|speech|LEONARD|M
510||"Leonard hands Manny a $5.00 bill for the shine, gets up and
walks past Peter as if he were invisible."|stage direction||
511||(discreetly, to Susan)|location||
512|ERNEST|Is there some reward for this?|speech|ERNEST|M
513|SUSAN|I guess that could be arranged.|speech|SUSAN|F
514||Ernest smiles, pockets the ootheca picture.|stage direction||
515|PETER|"For Chrissakes.  You gonna lay a two-
bit bureaucratic, territorial number
on me?"|speech|PETER|M
516|LEONARD|"You wanna keep up the conversation, you
best come back with the proper permits
and the right attitude."|speech|LEONARD|M
517||"Leonard saunters away with Ernest in tow.
Peter shakes his head angrily.  He takes Susan by the arm,
heads off in another direction.
Chuy, without watching, clicks his spoons to the imitation of
their steps."|stage direction||
518||INT. SUBWAY STAIRS - DAY|location||
519||Susan and Peter walk up the stairs; Peter still fumes.|stage direction||
520|PETER|"You give someone a fucking uniform
and... Did you hear how he talked to us?"|speech|PETER|M
521|SUSAN|I heard how you talked to him.|speech|SUSAN|F
522|PETER|Oh, so I'm the bad guy now?|speech|PETER|M
523||Susan spares him an ironic look.|stage direction||
524|SUSAN|He was just doing his job.|speech|SUSAN|F
525|PETER|Fine, then I'm the bad guy. Jesus!|speech|PETER|M
526||"At the top of the stairs they're completely engulfed by
sunlight."|stage direction||
527|PETER|"He wants a permit, I'll get him a
permit."|speech|PETER|M
528||CUT TO:|unknown||
529||INT. SUBWAY TRACKS - DUSK|location||
530||"A train blurs by.
A FLASHLIGHT BEAM over dirty gravel.  TILT with the beam to
see Ernest walking his beat past TRACKS and GIRDERS.  Hulking
out-of-service SUBWAY CARS surround him. He shines his light
on the ootheca picture and then around him at the walls.
A SOUND catches his attention.  A RUSTLING.
He notices something off to a corner, walks over to it.
A SHINY BROWN LUMP in the corner, covered in garbage.
He touches the lump with his shoe.  It STIRS slightly.
He touches it again...
...and a PAIR OF LEGS suddenly LASH OUT, kicking at him
reflexively.
Ernest jumps back.
Another SET OF LEGS emerges...
Oddly enough, Ernest relaxes."|stage direction||
531|ERNEST|Chrissakes...|speech|ERNEST|M
532||"He grabs the surface of the lump, and pulls it.  We see that
it was just a SHINY BROWN TARP.
Underneath, a group of THREE HOMELESS PEOPLE -- emaciated,
toothless -- sleeping intertwined for warmth. In the dim
light, they almost seem like a single organism."|stage direction||
533|ERNEST|Guys, c'mon.|speech|ERNEST|M
534||"The Homeless People stare back at him mutely.  Ernest starts
getting annoyed."|stage direction||
535|ERNEST|"I told you to stick by the maintenance
area."|speech|ERNEST|M
536|BAG LADY|Nah... It's private property now.|speech|BAG LADY|?
537||Ernest looks at her, confused.|stage direction||
538|SKELETAL BUM|He eats down there.|speech|SKELETAL BUM|?
539|ERNEST|Who?|speech|ERNEST|M
540|HOMELESS MAN|The Stickman.|speech|HOMELESS MAN|?
541|BAG LADY|Long John.|speech|BAG LADY|?
542||"The homeless man points.  Ernest turns his light.
Another SILHOUETTE of the OVERCOAT MAN drawn on the wall. An
arrow below it points east."|stage direction||
543|ERNEST|Graffiti artist, uh?|speech|ERNEST|M
544||(To Homeless People)|location||
545|ERNEST|"Look guys, just get off my beat, you
hear?  Get moving."|speech|ERNEST|M
546||"Ernest hustles them out.  The homeless people glare at him,
pick up their things and head into the gloom.
Ernest watches them go.  He turns back to the graffiti
painting of The Stickman."|stage direction||
547||DISSOLVE TO:|unknown||
548||INT. SUBWAY TUNNEL - LATER|location||
549||"Ernest walks deeper into the tunnels. Dusklight slants in
weakly from grates above.
He stops as a RUMBLE is heard ahead of him  He ducks into a
recess in the wall.  The RUMBLE grows LOUDER, LOUDER.
A SUBWAY TRAIN curves around the bend up ahead, its
HEADLIGHTS raking the opposite wall to reveal...
A FIGURE crouched over something.
We hear CHOMPING and SWALLOWING sounds.
CU ERNEST
Squinting to see over his flashlight beam."|stage direction||
550|ERNEST|Hey, buddy!|speech|ERNEST|M
551||"No answer.  Just the wet sounds of food getting chewed and
ingested.  Ernest is revolted."|stage direction||
552|ERNEST|Get off my track...|speech|ERNEST|M
553||"The crouching figure lifts its head and looks around in a
unusually quick BLUR OF MOTION.  It's the OVERCOAT MAN.
Another distant RUMBLE. Ernest's clothes flutter in the puff
of hot wind that signals an approaching train.
Ernest pulls a CAN OF MACE from his belt, begins to advance.
The Overcoat Man stands up.
Ernest stops in his tracks.
For he sees that the Overcoat Man is holding a large OBJECT
in his arms. Something wet and shiny with blood.
A dead dog.
The Overcoat Man drops the animal.  It rolls slowly down his
chest...
...and is briefly caught BY ANOTHER SET OF ARMS EXTENDING
FROM HIS TORSO."|stage direction||
554|ERNEST|Sweet Jesus...|speech|ERNEST|M
555||"The Overcoat Man lets the animal fall to the ground.  He
begins walking toward Ernest.
Ernest backs away.
The Overcoat Man LEAPS on him just as the SUBWAY TRAIN ROARS
PAST!
CRACK! Ernest's body is twisted and crunched by powerful
arms.
Through the strobing windows we see Ernest enveloped by the
dark figure, then raised above, taken away.
TRACK
The can of mace rolls next to the track as the TRAIN CLEARS.
The track is empty again."|stage direction||
556||CUT TO:|unknown||
557||INT. EXHIBITION HALL - BANNER|location||
558||We PAN across the banner:  'ARCHITECTS OF NATURE'.|stage direction||
559||INT. EXHIBITION FLOOR|location||
560||"EXHIBITS under glass set up throughout the room: Insect
chambers and vaults of great complexity, etc.
An opening night CROWD of affluent MUSEUM PATRONS.  All
tuxedoes and painted smiles.  Some peremptorily peruse the
displays; most just camp out at the buffet table.
Peter enters, dressed in his worksuit.  He scans the
room, sees Siri leaning against a wall by the buffet
table, drinking an orange juice.  He goes over to her."|stage direction||
561|PETER|Heya.|speech|PETER|M
562||(Kisses her on the cheek.)|location||
563|PETER|Where's the boss?|speech|PETER|M
564||"Siri gestures to the far end of the room.  Susan stands
alone, sipping a chardonnay by an ANT MOUND exhibit."|stage direction||
565|SIRI|Ant mound.|speech|SIRI|F
566||"Peter notices Siri seems unusually weary. She covers one
of her eyes."|stage direction||
567|PETER|You okay?|speech|PETER|M
568|SIRI|"It's just a headache.  We were
sandblasting Trump Tower here since
four this morning."|speech|SIRI|F
569|PETER|Maybe you should sit...|speech|PETER|M
570|SIRI|"I'm fine. Go talk to Susan.  She could
use a good word right now."|speech|SIRI|F
571||"She nods for him to go ahead.  Peter leaves.
Siri closes her eyes.  She rubs the bandage around the
insect bite on her hand.
PETER
approaches Susan.  She's staring through thr glass panes
of the exhibit at the crowd of patrons.  In the
refraction, their black tuxedoes and evening gowns seem
to blend into one another."|stage direction||
572|PETER|Great crowd.|speech|PETER|M
573|SUSAN|No such thing, baby.|speech|SUSAN|F
574||"She looks over at the crowd congregated around the
buffet table."|stage direction||
575|SUSAN|"I get the feeling they came more for
the potroast than the apterids."|speech|SUSAN|F
576|PETER|"Fuck 'em.  They don't know what
they're missing."|speech|PETER|M
577||(Distantly)|location||
578|SUSAN|Right.|speech|SUSAN|F
579||Peter looks at her.|stage direction||
580|PETER|What's wrong?|speech|PETER|M
581||Susan sighs.|stage direction||
582|SUSAN|"Oh...nothing that a little
menopausal's pee daikiri couldn't
cure. Least that's what I thought."|speech|SUSAN|F
583||"Peter looks at her, notices that one of her hands is on
her stomach."|stage direction||
584||(genuinely moved)|location||
585|PETER|Oh, no, you were-|speech|PETER|M
586|SUSAN|I was just late.|speech|SUSAN|F
587||"Susan nods.  Peter takes her hand. They sit by the ant
mound."|stage direction||
588|SUSAN|"Ironic, don't you think?  These guys
can hatch hundreds of offspring in a
single clutch of eggs, right? And
here we are..."|speech|SUSAN|F
589|PETER|Susan, we're not b-|speech|PETER|M
590|SIRI (OS)|Susan?|speech|SIRI|F
591||"Susan looks up to see Siri standing on the other side of
the glass case."|stage direction||
592||(Weakly.)|location||
593|SIRI|I'm sorry.  I think...I need...|speech|SIRI|F
594||"One of her eyes is completely bloodshot. Her mouth is
bleeding. She puts her hand on the case to steady
herself.
Her fingers leave a STREAK OF BLOOD on the glass."|stage direction||
595|SUSAN|Siri...|speech|SUSAN|F
596||"Siri collapses.  The exhibit tips over.
Peter pulls Susan out of the way just as the exhibit
FALLS AND SMASHES TO THE GROUND!"|stage direction||
597|SUSAN|Siri!|speech|SUSAN|F
598||"The room erupts into COMMOTION.
Susan and Peter run to Siri, who lies unconscious on the
floor.
Peter gently turns her over.
Siri's BLEEDING from the corner of her mouth.  Just like
the Chinese workers in the sweatshop.
Tuxedoed people encircle her next to the insect mounds."|stage direction||
599||SMASH CUT TO:|unknown||
600||EXT. NEW YORK STREET - NIGHT|location||
601||"An ambulance races down the avenue toward a distant
hospital."|stage direction||
602||INT. HOSPITAL - HALLWAY|location||
603||"Siri is rushed on a gurney toward the Emergency Room.
Peter and Susan walk next to it talking to DR. CHRIS
RAYMOND, a 35-year old ER physician."|stage direction||
604|PETER|"...I think it's some kind of systemic
infection, Chris.  I saw a few cases
like it yesterday. A sweatshop in
Canal."|speech|PETER|M
605||(to Peter.)|location||
606|RAYMOND|"Okay, look.  You better come in with
me.  Help me through."|speech|RAYMOND|M
607||INT. EMERGENCY ROOM|location||
608||"Raymond, Peter, and several other ER STAFF work on Siri,
now lying on an operating table."|stage direction||
609||(To Peter)|location||
610|RAYMOND|"All hands on deck, Pete. Remember the
dril?"|speech|RAYMOND|M
611|PETER|It'll come back to me.|speech|PETER|M
612||"RAYMOND inspects Siri's wounded hand.  The bandage has
been removed.  The bite-wound is infected and
suppurating.  A large red circular RASH around it."|stage direction||
613|PETER|Looks like a Lyme disease rash.|speech|PETER|M
614|RAYMOND|"It's not consistent with the internal
bleeding. Any idea what bit her?"|speech|RAYMOND|M
615||Peter shakes his head.|stage direction||
616|RAYMOND|"I think we're gonna need to have that
specimen here."|speech|RAYMOND|M
617||"An ASSISTANT finishes inserting a catheter down her
throat.
Blood and fluid leak up through the clear tube.
ABOVE THE OPERATING THEATER.
Staring down through the circular glass deck, Susan
silently observes the procedures."|stage direction||
618||CUT TO:|unknown||
619||INT. MANNY'S APARTMENT - NIGHT|location||
620||"Salmon-colored LIGHT slants in from sodium vapor streetlight.
PAN through the shadowy room, past Manny's sleeping form to
Chuy, asleep under a tent made of an old Star Wars blanket.
A RHYTHMICAL CLICKING SOUND is heard from outside.
Chuy pops his head out from under the blanket, listening."|stage direction||
621||EXT. FIRE ESCAPE - NIGHT|location||
622||"Wearing only his pajama bottoms, Chuy steps out on the fire
escape with his spoons in hand.
The CLICKING RESUMES from the building across the street.
OVERHEAD VIEW
The barefoot little boy crosses the street, steps through the
center of the huge PAINT STAIN on the sidewalk.
The CLICKING sound comes again.
STREET LEVEL
The CLICKING comes again from inside the flophouse.  It
continues a little bit, then stops.
Chuy CLICKS his spoons together, mimicking the sound.
Beat.  A CLICKING from within again; almost an answer.
Chuy ducks under the yellow DOH tape, walks toward the front
of the building.
He comes to the boarded entrance.  There is a hole, narrow,
and low in the doorway.
Chuy squats, begins to wriggle through it."|stage direction||
623||INT. FLOPHOUSE - LOBBY|location||
624||"Chuy steps into the lobby.
The CLICKING comes again, from further inside.
Chuy moves to find it.
CHAPEL
Bits of STREETLIGHT slant in.  Chuy walks slowly, listening.
He steps into the SHADOW of a LOOMING FIGURE.  He turns...
CHUY'S POV - CRUCIFIX
We start on bleeding, nail-pierced feet, then TILT up the
twisted body to the face of Jesus, looking down.
CHUY
stares without emotion at the plaster figure.
MOVEMENT to his side.  He turns again.
A dimly-lit FIGURE stands before him.
Shapes fold and regroup in the darkness, resolving into the
tall figure of the OVERCOAT MAN.
The Man begins to emit the CLICKING NOISE from under his
chin, his whole head VIBRATING.
Chuy smiles.  He has a beautiful smile."|stage direction||
625|CHUY|Mr. Funny Shoes.|speech|CHUY|M
626||"He plays his spoons, imitating the sound the figure made.
He is answered...but this time, it's from the other side of
the room. We PAN as he turns.
ANOTHER OVERCOAT MAN appears in the shadows.
Chuy GIGGLES, delighted."|stage direction||
627||CUT TO:|unknown||
628||INT. HOSPITAL - WAITING ROOM|location||
629||Susan and Peter.|stage direction||
630|SUSAN|"...you don't even know what you're
looking for."|speech|SUSAN|F
631|PETER|"You said that thing was big as your
hand.  I don't think I'm going to
miss..."|speech|PETER|M
632|SUSAN|"Why take the chance?  Just let me go
down there with you..."|speech|SUSAN|F
633|PETER|No.|speech|PETER|M
634||Susan glares at him.  Peter sits down by her.|stage direction||
635|PETER|"Susan, listen to me:  you handled
that insect almost as much as Siri..."|speech|PETER|M
636|SUSAN|It didn't bite me.|speech|SUSAN|F
637|PETER|"I know.  But if it was carrying
something...there's a chance you
could have been exposed."|speech|PETER|M
638||Susan is silent.|stage direction||
639|PETER|"Chris is going to run some blood
tests on you.  I want you to stay here
till he's absolutely sure you're
clean.  Okay? Then you'll call me...
You'll catch up with us..."|speech|PETER|M
640||Susan looks up at him. Finally, she nods.|stage direction||
641|PETER|We'll be all right, Sus.  I promise.|speech|PETER|M
642||"He leans over, kisses her gently.  But Susan seems
hardly reassured."|stage direction||
643||CUT TO:|unknown||
644||INT. MANNY'S APARTMENT - PREDAWN|location||
645||"The blue hours before dawn. Laconic movement outside.  New
York dragging itself out of bed.
We FIND Manny fixing some melted cheese sandwiches on a hot
plate. He addresses Chuy's tented bed behind him."|stage direction||
646|MANNY|"My father saw me stay in bed, he'd go get
a pitcher. Cold water, whoosh, I tell you
that's some alarm clock, brrrrr!"|speech|MANNY|M
647||"Manny cuts the bread in four equal sections and arranges them
in a star-shaped pattern. A breakfast ritual of some kind."|stage direction||
648|MANNY|"Ah! There you go! The way you like 'em,
Chu-chu..."|speech|MANNY|M
649||(He pours a glass of milk.)|location||
650|MANNY|"We're low on milk, you remind Grampa to
pick some up tonight, okay?"|speech|MANNY|M
651||"He walks over to Chuy's tent bed. He pulls the sheets aside.
His grandson is gone."|stage direction||
652||CUT TO:|unknown||
653||EXT. SEWAGE FILTRATION PLANT - PREDAWN|location||
654||"Sewage water BUBBLES in huge tanks.
A WORKMAN walks down catwalks above the tank, disengaging the
larger pieces of debris from the filter areas with grappling
hooks.  Shoes, tires, rags...
A GRINDING SOUND is heard.  The Workman YELLS out to a
CONTROL BOOTH above."|stage direction||
655|WORKMAN|Hold up!  We gotta block on filter D.|speech|WORKMAN|M
656||"SOUND of the pump coming to a halt.
The Workman walks to the filter area.  He sinks his grappling
hook into the polluted waters.
UNDERWATER SHOT
Spooky, silent. The grappling hook moves like a scythe to the
filter...
...past long, soft filaments of RAGGED TISSUE...
...and connects with a LARGER FORM.
ABOVE WATER
The Workman feels the grappling hook connecting.  He gives a
YANK, hooking whatever it is.
He begins pulling it up.
A PALE FORM bubbles to the surface.
The Workman's face goes pale."|stage direction||
657|WORKMAN|Oh, God...|speech|WORKMAN|M
658||A grating VOICE from the control booth is heard over the P.A.|stage direction||
659|"CONTROL BOOTH
VOICE"|What's the problem?|speech|CONTROL BOOTHVOICE|?
660||It take the Workman a moment to speak.|stage direction||
661|WORKMAN|I think it's a baby!|speech|WORKMAN|M
662||"The Workman pulls the form (as if that will do any good)
toward the edge of the tank.
He bends down, and now gets his first good look at it.
The Workman SCREAMS.
His grappling hook falls from his hand, into the sewage."|stage direction||
663||CUT TO:|unknown||
664||INT. HOSPITAL - ICU WARD|location||
665||"Susan watches Siri from behind a pane of glass.  Siri is
connected to a respirator, her vital signs monitored by
several machines.
Raymond approaches Susan, two cups of coffee in his
hands."|stage direction||
666|RAYMOND|How you feeling?|speech|RAYMOND|M
667|SUSAN|You tell me.|speech|SUSAN|F
668||He smiles, gives her one of the cups.|stage direction||
669|RAYMOND|"Your blood tests were all negative.
You checked out."|speech|RAYMOND|M
670||Susan visibly relaxes.  She looks back at the ICU ward.|stage direction||
671|SUSAN|What about Siri?|speech|SUSAN|F
672|RAYMOND|"She's stable.  I don't think there's
any immediate danger, but we'll have
to keep her under observation..."|speech|RAYMOND|M
673|SUSAN|"You think it's some form of
Strickler's, don't you?"|speech|SUSAN|F
674||Beat.  Raymond shrugs.|stage direction||
675|RAYMOND|"Pathology's still working on the
tissue samples.  If it is...it must
be an errant strain.  Shorter
incubation period."|speech|RAYMOND|M
676||(Beat.)|location||
677|RAYMOND|"I'm sorry, Sue.  We just don't know
yet."|speech|RAYMOND|M
678||INT. HOSPITAL - BATHROOM|location||
679||"At the sink, Susan runs water over her hands, her face,
trying to collect herself.  She looks up in the mirror.
We see that her eyes are swollen, tear-stained."|stage direction||
680||INT. HOSPITAL - HALLWAY|location||
681||"She walks out of the ladies room, drying her face with a
paper towel.
SOUNDS of a nearby argument catch her attention."|stage direction||
682|JEREMY (OS)|"...how many times I gotta tell you,
man: we can't accept this!"|speech|JEREMY|F
683|EMT (OS)|"Well, what the hell else am I suppose
to do with it?"|speech|EMT|?
684||Susan heads in the direction of the voices.|stage direction||
685||INT. HOSPITAL - HALLWAY NEAR MORGUE|location||
686||"An ORDERLY (JEREMY) argues with an EMT.  Their point of
contention:  a small FORM lying on a stretcher."|stage direction||
687|JEREMY|"Take it out back and throw it in the
friggin' dumpster!"|speech|JEREMY|F
688|EMT|Not unless somebody signs for it.|speech|EMT|?
689||"Susan walks toward them, catches sight of the tiny form.
Her eyes go wide."|stage direction||
690|SUSAN|Oh, my God.|speech|SUSAN|F
691||Jeremy notices her.|stage direction||
692|JEREMY|Hey, you can't...|speech|JEREMY|F
693|SUSAN|What's your name?|speech|SUSAN|F
694|JEREMY|Jeremy...|speech|JEREMY|F
695|SUSAN|"Okay, Jeremy...go get Dr. Chris
Raymond, will you?"|speech|SUSAN|F
696|JEREMY|Lady...|speech|JEREMY|F
697|SUSAN|"Did you hear me?  Get Dr. Raymond!
NOW!!"|speech|SUSAN|F
698||"Jeremy hesitates.  But if her tone wasn't enough, the
stare she gives him certainly is."|stage direction||
699|JEREMY|Okay.|speech|JEREMY|F
700||"Jeremy backs away, takes off down the hall.
Susan approaches the stretcher."|stage direction||
701||(To EMT)|location||
702|SUSAN|Where'd you find it?|speech|SUSAN|F
703|EMT|"Washed up at the filtration plant on
Bank street. Some asshole there
thought it was a baby. They called
us."|speech|EMT|?
704||"Susan bends over it.  She covers her mouth and nose at
the stench."|stage direction||
705|EMT|It's a lobster, right?|speech|EMT|?
