|character|text|type|character_clean|gender
188||"He gently pulls his grandson's hand and moves briskly away.
JOSH
uses an iron bar, and breaks a padlocked cellar door. A heavy
stench emanates from inside. The cops cover their noses."|stage direction||
189||INT. CELLAR|location||
190||"Peter and Josh enter a dingy, dungeon-like cellar,
illuminated only by bug zappers and emergency lights. Every
door and window has been nailed shut or sports a heavy-duty
padlock. Peter and Josh walk through the dismal scene.
In sharp contrast with the dirt-smeared walls, we see shiny
metallic SEWING MACHINES and swatches of cloth appliqued with
a FUNNY BUNNY cartoon character.
Josh examines the label stitched into the collar. It reads:
PROUDLY MADE IN USA."|stage direction||
191|PETER|Jesus.|speech|PETER|M
192||"His light hits a group of quivering, skeletal CHINESE
IMMIGRANTS, standing in a tight group against a wall."|stage direction||
193||(from the outside)|location||
194|WOYCHEK|They look real sick, don't they?|speech|WOYCHEK|?
195||CUT TO:|unknown||
196||INT. STAIRWELL, MUSEUM - DUSK|location||
197||"Carrying boxes full of terrarium material, Susan and Siri
ride an antiquated cage-steel elevator.  No floor buttons,
just an old-fashioned hand-activated lever."|stage direction||
198|SUSAN|"...as long as they're ready for the
opening I don't care, just tell them
that."|speech|SUSAN|F
199|SIRI|I'm on it.  Don't worry.|speech|SIRI|F
200||(Beat)|location||
201|SIRI|"Look, Susan...I don't mean to pry,
but... I kinda overheard you and
Peter."|speech|SIRI|F
202||(Smiles ironically)|location||
203|SUSAN|"Watch your step, Siri.  Your grant
could be on the line here."|speech|SUSAN|F
204|SIRI|"I just...well, I had this cousin in
Delhi.  She was having problems, too.
She, ah..."|speech|SIRI|F
205|SUSAN|What?|speech|SUSAN|F
206|SIRI|She used a baster.|speech|SIRI|F
207||Susan looks at her.|stage direction||
208|SIRI|"Not a big one.  I mean, it was like a
turkey baster."|speech|SIRI|F
209|SUSAN|Oh, Jesus.|speech|SUSAN|F
210||"She tries to stop the elevator at the fourth floor, but
it rises just a little too far."|stage direction||
211|SUSAN|Come on, darlin'...|speech|SUSAN|F
212||"Susan has to jimmy the lever till the elevator falls
level to the floor."|stage direction||
213||(continues)|location||
214|SIRI|"She kept it under her bed. Thing is,
it kinda worked.  I mean, she had to
hide it from her husband, but..."|speech|SIRI|F
215||"A pair of young boys, RICKY and DAVIS, sit on the floor
outside Susan's lab door.  A crumpled paper bag and a shoe
box sit beside them."|stage direction||
216|SUSAN|What's this?|speech|SUSAN|F
217|SIRI|"Oh, right... They been here since noon.
I told them you're real busy."|speech|SIRI|F
218||Susan smiles at the boys, who stand when they see her.|stage direction||
219|SUSAN|Hello.|speech|SUSAN|F
220|RICKY|You the bug lady, right?|speech|RICKY|M
221||Siri chuckles.|stage direction||
222||(smiles)|location||
223|SUSAN|I suppose so.|speech|SUSAN|F
224||Ricky raises and shakes the paper bag.|stage direction||
225|RICKY|We're here to deal.|speech|RICKY|M
226||INT. MOUNTING ROOM - DUSK|location||
227||"SUNLIGHT slants in to illuminate an incredible array of live
and mounted dead INSECTS, trapped in turn-of-the-century
glass fronted cabinets. Davis puts his nose up against one,
fascinated."|stage direction||
228|SUSAN|"Metaxonycha Godmani, Trigonopelastes
Delta.  Field Butterflies.  Have you been
upstate?"|speech|SUSAN|F
229||"She examines the boys' findings, mostly rag-tag specimens
of battered butterflies."|stage direction||
230|DAVIS|Avenue B.|speech|DAVIS|?
231||(sadly)|location||
232|SUSAN|I guess they got lost in this city.|speech|SUSAN|F
233|RICKY|So, you wanna buy em?|speech|RICKY|M
234|DAVIS|There's extra wings in the bag.|speech|DAVIS|?
235||Siri lingers in the background.|stage direction||
236|SUSAN|"You guys have done a nice job.  How bout
five dollars?"|speech|SUSAN|F
237||(dismayed)|location||
238|RICKY|That's it?|speech|RICKY|M
239||(to Ricky)|location||
240|DAVIS|Show her the weirdbug.|speech|DAVIS|?
241||He indicates the shoebox-|stage direction||
242|RICKY|Cost a dollar just to look.|speech|RICKY|M
243|DAVIS|"It's a great bug.  We kinda broke it a
little..."|speech|DAVIS|?
244||Siri impatiently points at the wall clock-|stage direction||
245|SUSAN|"Fellas, I'll tell you what...ten dollars
for everything.  Plus a killing jar, some
tweezers and mounts so the next bunch you
catch will be in better shape."|speech|SUSAN|F
246|DAVIS|Deal!|speech|DAVIS|?
247|RICKY|You crazy! That's the best!!|speech|RICKY|M
248|DAVIS|Bug's almost dead anyway.|speech|DAVIS|?
249||"Susan holds out two five dollar bills.  The boys can't
resist.  Davis grabs the money-"|stage direction||
250|DAVIS|Thanks, lady.|speech|DAVIS|?
251||"Ricky gives a last possessive look to the shoe box, then
follows Davis out.
Siri crosses to the window and wrestles to close it."|stage direction||
252|SIRI|Ten dollars?|speech|SIRI|F
253||"Susan places all the kid's items -including the shoebox- in
a wastebasket."|stage direction||
254|SUSAN|"Alphabet City kids- there's much worse
things they could be selling."|speech|SUSAN|F
255||"Siri hits the window frame with a paperweight, gets it half
way down."|stage direction||
256|SIRI|I hate this fucking window...|speech|SIRI|F
257||EXT. ACROSS STREET FROM MUSEUM - NIGHTFALL|location||
258||"CRANE TO a nearby alley.
A GAUNT MAN IN AN OVERCOAT stands in the shadows, looking up
at Siri working on the window.
As a streetlamp lights up, he backs up into the shadows."|stage direction||
259||CUT TO:|unknown||
260||INT. FLOPHOUSE. LOBBY - NIGHTFALL|location||
261||"Religious slogans and posters are hung everywhere in what
used to be the lobby of a men's hotel.  A hand-lettered sign:
""NO LIQUOR, NO DRUGS, NO PROFANITY""
PARAMEDICS are leading a number of ill CHINESE IMMIGRANTS up
from the cellar door seen earlier.  Many are brought out on
STRETCHERS. DOH staff put tags on their wrists.
Peter examines a PALE OLD MAN on a stretcher while
simultaneously talking to Josh."|stage direction||
262||(to Josh)|location||
263|PETER|"There's plenty of systemic infection
already, so as soon as we get a
preliminary reading, start them on
anti-biotics. You saw this?"|speech|PETER|M
264||"Peter flicks on his penlight, examines the Old Man's eyes.
One of them is completely bloodshot. Then he shows Josh
the gums. They're bleeding."|stage direction||
265|PETER|"Internal hemorrage. 2 our of 5 have
it.  No definite signs of TB, but we'll
quarantine them a week just to make sure."|speech|PETER|M
266|JOSH|Immigration's gonna love you for that.|speech|JOSH|M
267|PETER|"Tell them to send flowers to the
usual address."|speech|PETER|M
268||INT. SWEAT SHOP. BASEMENT|location||
269||"Peter pushes back a sheet hung across a doorway.
BASEMENT SHOWERS
A tiled nightmare. Concentration camp-cozy. A pile of old,
rusting sewing machines clutter the floor, spilling
oxide to a central grate."|stage direction||
270|JOSH|"Two shifts, people rotating from bed to
work.  One toilet. We're in Wal-Mart
hell, here."|speech|JOSH|M
271||Josh swats a fly.|stage direction||
272|PETER|"Did they get the sleazebag who owns this
place?"|speech|PETER|M
273|JOSH|"Triad, Chinese Mafia. They bring people
from Yunan. Slave labor..."|speech|JOSH|M
274||(eyes his notebook)|location||
275|JOSH|"Reverend Harry Wong, a preacher had the
flophouse fronting for them. No sign of
him."|speech|JOSH|M
276||"An overhead door is opened. Daylight streams in. Peter spots
YANG, an Asian cop, talking to a CHINESE WOMAN lying on a
stretcher which hasn't been moved yet.  She is hollow-eyed,
near death.  Her hand weakly hangs on to the cop as if for
dear life."|stage direction||
277|PETER|"Tell her she's going to be alright.
We'll take care of her."|speech|PETER|M
278||"Peter kneels next to her, looking at her and nodding while
Yang translates. The woman mutters again, tears of fear in
her eyes.  Yang shakes his head."|stage direction||
279|YANG|"She's delirious.  Keeps saying the ""Dark
Angels"" are coming for her. She says
they took some of her people away."|speech|YANG|F
280|PETER|Dark Angels?|speech|PETER|M
281||(Shrugs.)|location||
282|YANG|"Probably a gang.  Chinese people, man.
They come up with some wacky stuff."|speech|YANG|F
283||"They pull the stretcher out through the open overhead door
and into an
ALLEY
The stretcher is rolled into a waiting vehicle, its lights
flashing. Unseen by them, on a brick wall, nearly buried by
graffiti, is a crude DRAWING.
It is of the same, odd figure Peter saw drawn earlier.  The
OVERCOAT MAN."|stage direction||
284||INT. LAB - NIGHT - MONTAGE|location||
285||"Susan and Siri, both wearing Walkman headsets, deftly mount
BUTTERFLIES and other INSECTS onto display boards for the
exhibit. Rain is blowing in through the half-open window.
Their movements are precise and lyrical, the colors and
designs of the insects are beautiful.
We understand how you can get lost in this world.  Susan
works steadily, a partially-eaten PAY-DAY BAR and the
wrappers of several others are evidence of her dinner.
A PAGER goes off in Susan's lab coat.
She takes off her headset; CLASSICAL MUSIC leaks from her
headphones.
On the PAGER's LCD screen the message reads: LATE
TONIGHT. PETE.
Susan puts the pager down. Goes to close the window.
There is a loud, angry BUZZING sound."|stage direction||
286|SUSAN|Siri?|speech|SUSAN|F
287||(louder)|location||
288|SUSAN|Siri?!|speech|SUSAN|F
289||"Siri pulls her headset off; HEAVY METAL MUSIC leaks from her
headphones.
The BUZZING sound again. We PAN across the various bugs and
mounting implements till we come to rest...
...on the SHOEBOX the boys gave Susan. Something rattles
wildly inside."|stage direction||
290|SIRI|...the fuck?|speech|SIRI|F
291||"Susan crosses to the trash bin, picks the box out. It
vibrates on her hand, then becomes quiet, something moves
inside.
She slowly opens the lid.
The bottom of the box is littered with two inches of shredded
newspaper. Crumbs of bread and some rice-krispies can be
spotted here and there: a kid's idea of a comfy critter's
nest. She moves her free hand closer."|stage direction||
292||(To Siri)|location||
293|SUSAN|Can you...?|speech|SUSAN|F
294||"Suddenly and INSECT big as her hand springs out of the
shredded paper nest and tries to grab on to her! Minute
pieces of paper fly through the air!!
Susan slaps the lid back down."|stage direction||
295||(a scared whisper)|location||
296|SUSAN|Could you...help me...?|speech|SUSAN|F
297||CUT TO:|unknown||
298||"LATER
Siri comes over as Susan grabs steel tongs and a cork
dissecting board."|stage direction||
299|SUSAN|"I'm gonna pull it out and I want you to
pin it down, okay?"|speech|SUSAN|F
300|SIRI|What is it?|speech|SIRI|F
301|SUSAN|I have no idea.  Are you ready?|speech|SUSAN|F
302||"Siri nods, pins in hand.  Susan opens the lid and grabs the
nymph with the tongs.  The creature goes berserk, flailing
its spindly limbs, BUZZING and CROAKING, a milky substance
FOAMING out of its body."|stage direction||
303|SIRI|Oh my God...|speech|SIRI|F
304||"Susan deposits the insect onto the corkboard.
Siri tries to get a hold of it; but it twists out of the
tongs and wraps its coarse legs around her hand!! A spider
trapping a sparrow."|stage direction||
305|SIRI|Shit!! Get it!  Get it!|speech|SIRI|F
306||"SNAP!  It bites her hand between index and forefinger.
Susan pins the insect into the corkboard. It spins furiously,
like a crazy LP record.
Susan gets a grip on it again with the tongs.  Siri uses more
pins to secure it down."|stage direction||
307||(Noticing Siri's hand)|location||
308|SUSAN|It bit you.|speech|SUSAN|F
309|SIRI|No shit.|speech|SIRI|F
310||"SUSAN
leans to get a closer look at the NYMPH: Deep dark brown,
flat as a pancake, one rear leg broken, lower tail smashed.
It squirms helplessly now, looking pitiful under the harsh
overhead light."|stage direction||
311|SUSAN|"This wing configuration. I've
never..."|speech|SUSAN|F
312||(looking at her injury)|location||
313|SIRI|Fuck! It broke the skin...|speech|SIRI|F
314|SUSAN|"And they're not fully developed.  This
thing's not even an adult."|speech|SUSAN|F
315||"The nymph continues to HISS and FOAM, struggling against the
steel pins. Susan looks closely at the insect's belly."|stage direction||
316|SUSAN|My God.|speech|SUSAN|F
317|SIRI|What?|speech|SIRI|F
318||"Susan gestures to look.  Siri stares down at
THE NYMPH'S TORSO
where a SET OF VALVES on its underside click in and out."|stage direction||
319|SUSAN (OS)|It's breathing.|speech|SUSAN|F
320||"SIRI
shakes her head."|stage direction||
321|SIRI|That's impossible.  Insects don't...|speech|SIRI|F
322|SUSAN|I know.|speech|SUSAN|F
323||(Picks up a SCALPEL)|location||
324|SUSAN|Help me get a sample.|speech|SUSAN|F
325||"Susan touches her scalpel to the nymph's leg.
The nymph CLICKS nervously."|stage direction||
326|SUSAN|Hold on, big guy, hold on...|speech|SUSAN|F
327||"She traps the nymph down and CUTS THE LEG OFF.
A painful, agonized BUZZ echoes around the room."|stage direction||
328||CUT TO:|unknown||
329||"MONITOR
Susan attaches the insect's leg to a samll holder. It is
frozen in a swirl of dry ice.
The brittle leg is then mounted in a LASER MICROTOME. Bit by
bit, the machine executes MICROSCOPIC WAFER CUTS. Siri is
making slides out of each section.
A series of MICROPHOTOGRAPHIC IMAGES flash onto the screen.
In the background we hear the high-pitched BUZZ-
We see the lights from the mounting room through a glass
brick wall."|stage direction||
330||INT. MOUNTING ROOM - NIGHT|location||
331||"We see the nymph slowly squirming in the FG, then RACK FOCUS
to the rain-spattered WINDOW.
Suddenly the OVERCOAT MAN is standing on the windowsill!
The window is lifted effortlesly from the outside.
SUSAN
prepares a blue solution and places two drops on each smear
slide.
Reflected in the glass brick behind her we see the man moving
across the room.
THE OVERCOAT MAN
seen only through rippled glass and reflections, moves
through the lab.
His body STEAMS lightly from the rain. His movements are
quirky, spastic.
The man observes the imprisoned insects with curiosity.
He comes to the nymph, pinned and mutilated on the worktable.
The nymph CLICKS and CHITTERS excitedly, as if communicating
with the man.
He looks up at the worklight.  It seems to bother him.
WHUMP!!! In a blur of motion, he SMASHES the light bulb.
SUSAN
watches the smear slide.  The blue droplets begin to CHANGE
COLOR once in contact with the leg section..."|stage direction||
332|SUSAN|Hold on a second...|speech|SUSAN|F
333||...slowly turning a deep green.|stage direction||
334|SIRI|What?|speech|SIRI|F
335||"Then, THREE LARGE BEETLES fly into the room.
Siri looks at Susan. Susan gets up, hesitant, signals for
Siri to stay.
We FOLLOW Susan into the mounting room.
SUSAN'S POV
She walks in, barely able to see her hand in front of her
face.
The window facing the street is wide open, rain blowing in.
Something CRUNCHES under her feet.  She bends down, looks.
She's stepped on the broken glass of the lightbulb.
The floor is alive with various INSECTS -- crawling, hopping,
flying away from their displays, which have been opened.
The nymph is gone from the board!
She looks under the work table the nymph was on.
We LOWER as we TRACK BACK with her.  Something is folded up
in the corner of the ceiling behind her, camouflaged in the
shadows, clinging impossibly to the wall.
THE OVERCOAT MAN.
He lowers himself with silent grace.
Susan whirls.
WHOOSH! A GUST OF WIND! A FLUTTERING SHADOW OFF THE WINDOW!
Silence."|stage direction||
336|SIRI (O.S.)|Susan?|speech|SIRI|F
337||Susan GASPS, startled.  We SHIFT to see Siri at the door.|stage direction||
338|SUSAN|Call security.|speech|SUSAN|F
339||CUT TO:|unknown||
340||EXT. FLOPHOUSE - NIGHT|location||
341||"The last DOH van takes off under the heavy rain.
Across the street, Chuy looks down from his apartment window."|stage direction||
342||INT. MANNY'S APARTMENT - SAME|location||
343||"Chuy sits at the window, twisting wire into a human-like
figure.  MOVING past him, we see a group of other WIRE
FIGURES on the table, backs of chairs, lamps, everywhere.
Manny sits at the kitchen table. He IGNITES a can of shoe
polish with a match, then lights a cigarette off the flame.
He puts the cigarette in his mouth and proceeds to polish a
pair of shoes. A SILLY SHOW plays over the TV."|stage direction||
344|MANNY|"Not too little, not too much. You rub it
in, around and around like this. Let the
leather take it."|speech|MANNY|M
345||"Manny leans tiredly against the table. He looks fatigued
and in pain. He takes a small pill and places it under
his tongue."|stage direction||
346|MANNY|"You watching? You should learn to
work the shoes. You're good with your
hands..."|speech|MANNY|M
347||Manny shoots a glance over to his grandson.|stage direction||
348|MANNY|Chuy...you gonna get all wet.|speech|MANNY|M
349||Chuy doesn't pay attention, just stares out at the street.|stage direction||
350|MANNY|Did you look at the story book I got you?|speech|MANNY|M
351||Manny lifts a brightly colored CHILDREN'S BOOK.|stage direction||
352|MANNY|"Our Animal Friends.  Can you say that,
Chico?  ""Friends""?"|speech|MANNY|M
353||"Nothing from Chuy.
CHUY'S POV - STREET
The building across the street. Yellow DOH tape at the
entrance."|stage direction||
354|MANNY (OS)|"A friend is the one you can trust.  When
you are with a friend, no matter where in
the world, you are at home."|speech|MANNY|M
355||"A FIGURE moves out of the shadows and totters in the rain
toward the entrance.  It is the OVERCOAT MAN, barely visible
in the rain."|stage direction||
356|MANNY|"In this city. A friend is a hard thing to
find..."|speech|MANNY|M
357||"CHUY
His face shows a bit of animation."|stage direction||
358|CHUY|Funny Shoes...|speech|CHUY|M
359||Manny looks up from the book.|stage direction||
360|CHUY|Alli.  Mr. Funny Shoes.|speech|CHUY|M
361||"Manny comes over, looks out.
THEIR POV
The figure has disappeared into the dark front of the
boarded-up building.
MANNY AND CHUY"|stage direction||
362|MANNY|No one is there. Is empty.|speech|MANNY|M
363||Chuy doesn't respond.  Manny turns the boy's face to his.|stage direction||
364|MANNY|"Chuy, listen to me.  They have Jesus on
the cross, but that is not a holy place.
You understand?"|speech|MANNY|M
365||Chuy looks at him blankly.  Manny sighs; he knows he doesn't.|stage direction||
366|MANNY|"Ah, Nino.  God only knows what goes on in
your head, eh?"|speech|MANNY|M
367||"He pats the boy on the head, then goes back to work. Chuy
turns back to stare at the street."|stage direction||
368|CHUY|Mr. Funny Shoes...|speech|CHUY|M
369||CUT TO:|unknown||
370||EXT. OUTSIDE TYLER APARTMENT BUILDING - NIGHT|location||
371||"The D.O.H. Van pulls up in front of a modest Pre-war
building. Josh and Peter climb out.
Peter is reviewing a roster."|stage direction||
372|PETER|"Josh, what was Immigration's
countdown?"|speech|PETER|M
373||"Josh hands Peter a plastic bag with his sweat clothes
and running shoes."|stage direction||
374|JOSH|Thirty-three workers.|speech|JOSH|M
375||Peter hands him the roster.|stage direction||
376|PETER|"There are thirty five listed in the
reverend Wong's roster..."|speech|PETER|M
377|JOSH|Shit.|speech|JOSH|M
378||Peter walks up the front steps.|stage direction||
379|PETER|"Remember what that woman said, about
people being taken? Check with the
copsin the area."|speech|PETER|M
380||INT. TYLER APARTMENT - NIGHT|location||
381||"Peter enters the apartment, which has long since been
remodeled with a nicer couch and a bigger TV with slightly
better reception."|stage direction||
382|PETER|Sus?|speech|PETER|M
383||"No answer.  He notices the dining room table is filled with
yellowed FILES, all marked JUDAS TRADITOR."|stage direction||
384||(Looks around once again)|location||
385|PETER|Susan?|speech|PETER|M
386||INT. LAUNDRY ROOM|location||
387||"Peter comes in to find Susan sitting in a chair before a
dryer, quietly watching laundry whirl within."|stage direction||
388||(Regarding the laundry.)|location||
389|PETER|Thought it was my week for that.|speech|PETER|M
390||(Shrugs.)|location||
391|SUSAN|"I needed to think. It was either this
or the weather channel."|speech|SUSAN|F
392||"Peter walks over, kisses her.  He notices an open book of
INSECT MORPHOLOGY on her lap. There's a FULL COLOR
PHOTOGRAPH of an OOTHECA -- an insect eggcase."|stage direction||
393||INT. LAUNDRY ROOM - LATER|location||
394||Peter folds laundry into his/her piles.  Susan paces.|stage direction||
395|SUSAN|"This thing was the size of my fist,
Peter!! That's off the charts!"|speech|SUSAN|F
396|PETER|Okay. So you lost a great specimen-|speech|PETER|M
397|SUSAN|"Don't you get it? It's more than
that."|speech|SUSAN|F
398||Peter takes a bedsheet. Susan helps him fold it.|stage direction||
399|SUSAN|"You know why insects don't grow larger?
Because they don't have a complex
respiratory system. What I saw did. It
had lungs."|speech|SUSAN|F
400||"Peter walks backward with his end of the sheet.  The two
begin to fold it together."|stage direction||
401|SUSAN|"Evolution doesn't work that fast.
Something pushed that thing to take the
leap. We need to find another specimen."|speech|SUSAN|F
402|PETER|We?|speech|PETER|M
403||As they fold the sheet, they move closer together.|stage direction||
404|SUSAN|I did a PH test on its tarsal pads.|speech|SUSAN|F
405||"The folding of the sheet has brought them almost face to
face. Susan finishes folding herself."|stage direction||
406|SUSAN|"There's only two species who match the
enzymes I found.  One's a leaf-cutter ant
in the Amazon..."|speech|SUSAN|F
407||She has his full attention now.|stage direction||
408|SUSAN|The other we released here two years ago.|speech|SUSAN|F
409||EXT. ALPHABET CITY - AVENUE B - DAY|location||
410||A TAXI CAB makes a U turn and cruises on.|stage direction||
411||INT. CAB|location||
412||"Susan ignores the yakking Armenian DRIVER as she scans
the buildings and empty lots-"|stage direction||
413|ARMENIAN DRIVER|"Avenue B... again! Maybe you got
wrong letter, uh?"|speech|ARMENIAN DRIVER|F
414||"The cabbie looks up at a Manhattan street map glued over
his head on the roof of the cab."|stage direction||
415|SUSAN|"Keep going. We'll tell you when to
stop..."|speech|SUSAN|F
416|PETER|Maybe they lied to you.|speech|PETER|M
417|SUSAN|"Even if they did... that's all we
have, isn't it?"|speech|SUSAN|F
418||"The cab cruises past the tenement buildings, nondescript
stores, junked cars and rubble-strewn lots. It stops
before a traffic light.
A LEERING HOMELESS GUY with a greasy rag and greasier
cleaning solution approaches the windshield."|stage direction||
419|ARMENIAN|No... Oh, shit. Get away, you Turk!|speech|ARMENIAN|F
420||"The Homeless guy begins wiping/smudging the windshield
with his dirty rag. The driver sends him away.
The light turns green.  The Driver accelerates, turning
on the windshield wipers to expunge the smears left by
the guy.
Susan sees something."|stage direction||
421|SUSAN|Pull over!|speech|SUSAN|F
422|ARMENIAN DRIVER|What...?|speech|ARMENIAN DRIVER|F
423||"Susan motions excitedly.  The Driver pulls over. Susan
gets out."|stage direction||
424||EXT. OUTSIDE CAR|location||
425||"Susan rushes over, removes something from the windshield
wiper.
A BUTTERFLY, its wing pinned under the rubber flapper.
She holds it in her palm, then looks up at Peter."|stage direction||
426|SUSAN|Metaxonycha Godmani.|speech|SUSAN|F
427|PETER|So?|speech|PETER|M
428||"Susan looks around.  Just ahead is an empty LOT surrounded by
a wooden fence plastered with flyers for rock bands and
performance artists.
An identical BUTTERFLY perches on the edge of a board."|stage direction||
429||EXT. EMPTY LOT|location||
430||"Susan and Peter walk through waist-high GRASS of a small
urban wilderness.  Dozens of BUTTERFLIES flutter around them
from the weeds."|stage direction||
431|RICKY (OS)|If you want your money back, forget it!|speech|RICKY|M
432||"Peter and Susan look up.  The voice comes from a RAMSHACKLE
CLUBHOUSE, built of wood scraps and cardboard."|stage direction||
433|DAVIS (OS)|We already spent it!|speech|DAVIS|?
434||Susan walks forward.|stage direction||
435|SUSAN|We're here to deal.|speech|SUSAN|F
436||Long beat.  The door to the clubhouse swings open.|stage direction||
437||CUT TO:|unknown||
438||INT. SUBWAY STATION - DAY|location||
439||"A BLUR of subway cars goes by with an ear-pulverizing SOUND.
At the end of the platform, Davis untwists a wire around the
busted lock of a locker room door. Peter paces nervously
nearby."|stage direction||
440|PETER|Here, let me...|speech|PETER|M
441||"He starts on it himself. Meanwhile, Ricky stares at a
PHOTOGRAPH Susan has given to him:  a ribbed, tortoise-
brown colored EGGCASE."|stage direction||
442|SUSAN|You sure you didn't see one of these?|speech|SUSAN|F
443|RICKY|Gross. What is it?|speech|RICKY|M
444|SUSAN|"An ""Ootheca"". An eggcase. It probably had
more, uh ""weirdbugs"" inside."|speech|SUSAN|F
445||(shakes his head)|location||
446|RICKY|No way. I see one of those, I'd puke.|speech|RICKY|M
447||Davis opens the door with a CLICK.|stage direction||
448||INT. SUBWAY LOCKER ROOM|location||
449||"A dark, abandoned LOCKER ROOM once used for transit workers.
Susan and Peter walk in with the boys, nervous in the off-
limits area."|stage direction||
450|DAVIS|It was in that corner over there.|speech|DAVIS|?
451||Davis points to a bank of dented metal LOCKERS.|stage direction||
452|RICKY|Sucker was fast, man.|speech|RICKY|M
453||(Picks up a pipe.)|location||
454|RICKY|Had to take it out with one a these.|speech|RICKY|M
455|PETER|Okay, guys.  We'll take it from here.|speech|PETER|M
456||"Peter hands Ricky some money. The boy looksdown at it
slyly."|stage direction||
457|RICKY|"Make it ten an' we won't tell the cops
you're here."|speech|RICKY|M
458||Peter regards the little scam artist dryly.|stage direction||
