|character|text|type
256|MR. WHITE|"That's the way I look at it.  A
choice between doin ten years, and
takin out some stupid
motherfucker, ain't no choice at
all.  But I ain't no madman
either.  What the fuck was Joe
thinkin?  You can't work with a
guy like that.  That mother-
fucker's unstable.  What do you
think?  Do you think he panicked,
or ya think he's just trigger-
happy?"|speech
257|MR. PINK|"I think he's a sick fuckin maniac!
We're awful goddamn lucky he
didn't tag us, when
he shot up the place.  I came this
fucking close--"|speech
258||(hold up two fingers|location
259||"and makes a tiny
space between them)"|unknown
260|MR. PINK|"--to taking his ass out myself.
Everybody panics.  When things get
tense, everybody panics.
Everybody.  I don't care what your
name is, you can't help it.  It's
human nature.  But ya panic on the
inside.
Ya panic in your head.  Ya give
yourself a couple a seconds of
panic, then you get a grip and
deal with the situation.  What you
don't do, is shoot up the place
and kill everybody."|speech
261|MR. WHITE|"What you're supposed to do is act
like a fuckin professional.  A
psychopath is not a professional.
You can't work with a psychopath,
'cause ya don't know what those
sick assholes are gonna do next.
I mean, Jesus Christ, how old do
you think that black girl was?
Twenty, maybe twenty-one?"|speech
262|MR. PINK|"Did ya see what happened to
anybody else?"|speech
263|MR. WHITE|"Me and Mr. Orange jumped in the
car and Mr. Brown floored it.
After that, I don't know what went
down."|speech
264|MR. PINK|"At that point it became every man
for himself.  As far as Mr. Blonde
or Mr. Blue are concerned, I ain't
got the foggiest.  Once
I got out, I never looked back."|speech
265|MR. WHITE|What do you think?|speech
266|MR. PINK|"What do I think?  I think the cops
caught them, or killed 'em."|speech
267|MR. WHITE|"Not even a chance they punched
through?  You found a hole."|speech
268|MR. PINK|"Yeah, and that was a fucking
miracle.  But if they did get
away, where the fuck are they?"|speech
269|MR. WHITE|"You don't think it's possible, one
of them got ahold of the diamonds
and pulled a--"|speech
270|MR. PINK|Nope.|speech
271|MR. WHITE|How can you be so sure?|speech
272|MR. PINK|I got the diamonds.|speech
273|MR. WHITE|Where?|speech
274|MR. PINK|I got 'em, all right?|speech
275|MR. WHITE|Where?  Are they out in the car?|speech
276|MR. PINK|"No, they're not in the car.  No, I
don't have them on me.  Ya wanna
go with me and get 'em?  Yes, we
can go right now.  But first
listen to what I'm telling you.
We were fuckin set up!  Somebody
is in league with the cops.  We
got a Judas in our midst.  And I'm
thinkin we should have our fuckin
heads examined for waiting around
here."|speech
277|MR. WHITE|That was the plan, we meet here.|speech
278|MR. PINK|"Then where is everybody?  I say
the plan became null and void once
we found out we got a rat in the
house.  We ain't got the slightest
fuckin idea what happened to Mr.
Blonde or Mr. Blue.  They could
both be dead
or arrested.  They could be
sweatin 'em, down at the station
house right now.  Yeah they don't
know the names, but they can sing
about this place.
I mean, that could be happening
right now.  As we speak, the cops
could be in their cars, drivin
here this minute."|speech
279|MR. WHITE|I swear to god I'm fuckin jinxed.|speech
280|MR. PINK|What?|speech
281|MR. WHITE|"Two jobs back, it was a four man
job, we discovered one of the team
was an undercover cop."|speech
282|MR. PINK|No shit?|speech
283|MR. WHITE|"Thank god, we discovered in time.
We hadda forget the whole fuckin
thing.  Just walked away from it."|speech
284|MR. PINK|"So who's the rat this time?  Mr.
Blue?  Mr. Blonde?  Joe?  It's
Joe's show, he set this whole
thing up.  Maybe he set it up to
set it up."|speech
285|MR. WHITE|"I don't buy it.  Me and Joe go
back a long time.  I can tell ya
straight up, Joe definitely didn't
have anything to do with this
bullshit."|speech
286|MR. PINK|"Oh, you and Joe go back a long
time.  I known Joe since I was a
kid.  But me saying Joe definitely
couldn't have done it is
ridiculous.  I can say I
definitely didn't do it, cause I
know what I did or didn't do.  But
I can't definitely say that about
anybody else, 'cause I don't
definitely know.  For all I know,
you're the rat."|speech
287|MR. WHITE|For all I know, you're the rat.|speech
288|MR. PINK|"Now you're using your head. For
all we know, he's the rat."|speech
289||"Mr. Pink points OFFSCREEN to Mr. Orange.  Mr. White's
expression changes."|stage direction
290|MR. WHITE|Jesus Christ!|speech
291||11     INT. WAREHOUSE - DAY|unknown
292||"They run over to Mr. Orange, who's unconscious.  The
CAMERA hovers over the action.  Mr. Pink reaches him
first."|stage direction
293|MR. PINK|Is he dead?|speech
294||"Mr. White pushes him out of the way.  He feels the pulse
on Mr. Orange's neck."|stage direction
295|MR. PINK|So, is he dead or what?|speech
296|MR. WHITE|He ain't dead.|speech
297|MR. PINK|So what is it?|speech
298|MR. WHITE|I think he's just passed out.|speech
299|MR. PINK|"He scared the fuckin shit outta
me.  I thought he was dead fer
sure."|speech
300||Mr. White stands up and walks over to a table.|stage direction
301|MR. WHITE|"He will be dead fer sure, if we
don't get him to a hospital."|speech
302|MR. PINK|We can't take him to a hospital.|speech
303|MR. WHITE|"Without medical attention, this
man won't live through the night.
That bullet in his belly is my
fault.  Now while that might not
mean jack shit to you, it means a
helluva lot to me.  And I'm not
gonna just sit around and watch
him die."|speech
304|MR. PINK|"Well, first things first, staying
here's goofy.  We gotta book up."|speech
305|MR. WHITE|"So what do you suggest, we go to a
hotel?  We got a guy who's shot in
the belly, he can't walk, he
bleeds like a stuck pig, and when
he's awake, he screams in pain."|speech
306|MR. PINK|You gotta idea, spit it out.|speech
307|MR. WHITE|"Joe could help him.  If we can get
in touch with Joe, Joe could get
him to a doctor, Joe could get a
doctor to come and see him."|speech
308||"During Mr. Pink's dialog, we slowly ZOOM in to a
C.U. of Mr. White."|stage direction
309|MR. PINK (OS)|"Assuming we can trust Joe, how we
gonna get in touch with him?  He's
supposed to be here, but he ain't,
which is making me nervous about
being here.  Even if Joe is
on the up and up, he's probably
not gonna be that happy with us.
Joe planned a robbery, but he's
got a blood bath on his hands now.
Dead cops, dead robbers, dead
civilians...Jesus Christ!  I tend
to doubt he's gonna have a lot of
sympathy for our plight.  If I was
him, I'd try and put as much
distance between me and this mess
an humanly possible."|speech
310|MR. WHITE|"Before you got here, Mr. Orange
was askin me to take him to a
hospital.  Now I don't like
turning him over to the cops, but
if we don't, he's dead.  He begged
me to do it.  I told him to hold
off till Joe got here."|speech
311|MR. PINK (OS)|"Well Joe ain't gettin here.  We're
on our own.  Now, I don't know a
goddamn body who can help him, so
if you know somebody, call 'em."|speech
312|MR. WHITE|I don't know anybody.|speech
313|MR. PINK (OS)|"Well, I guess we drop him off at
the hospital.  Since he don't know
nothin about us, I say it's his
decision."|speech
314||"MR. WHITE'S POV:
C.U. OF MR. PINK."|stage direction
315|MR. WHITE (OS)|Well, he knows a little about me.|speech
316|MR. PINK|"You didn't tell him your name, did
ya?"|speech
317|MR. WHITE (OS)|"I told him my first name, and
where I'm from."|speech
318||"There is a long silence and a blank look from Mr. Pink,
then he SCREAMS:"|stage direction
319|MR. PINK|Why!|speech
320|MR. WHITE (OS)|"I told him where I was from a few
days ago.  It was just a casual
conversation."|speech
321|MR. PINK|"And what was tellin him your name
when you weren't supposed to?"|speech
322|MR. WHITE (OS)|He asked.|speech
323||Mr. Pink looks at Mr. White like he's retarded.|stage direction
324|MR. WHITE (OS)|"We had just gotten away from the
cops.  He just got shot.  It was
my fuckin fault he got shot.  He's
a fuckin bloody mess - he's
screaming.  I swear to god, I
thought we was gonna die right
then and there.  I'm tryin to
comfort him, telling him not to
worry, he's gonna be okay, I'm
gonna take care of him.  And he
asked me what my name was.  I
mean, the man was dyin in my arms.
What the fuck was I supposed to
tell him, ""Sorry, I can't give out
that information, it's against the
rules.  I don't trust you
enough.""?  Maybe I shoulda, but I
couldn't."|speech
325|MR. PINK|"Oh, I don't doubt is was quite
beautiful--"|speech
326|MR. WHITE (OS)|Don't fuckin patronize me.|speech
327|MR. PINK|"One question: Do they have a sheet
on you, where you told him you're
from?"|speech
328|MR. WHITE (OS)|Of course.|speech
329|MR. PINK|"Well that's that, then.  I mean, I
was worried about mug shot
possibilities already.  But now he
knows: (a) what you look like, (b)
what your first name is,
(i) where you're from and (d) what
your specialty is.
They ain't gonna hafta show him a
helluva lot of pictures for him to
pick you out.  That's it right,
you didn't tell him anything else
that could narrow down the
selection?"|speech
330|MR. WHITE (OS)|"If I have to tell you again to
back off, me an you are gonna go
round and round."|speech
331||"Mr. Pink walks out of the C.U. and turns his back on Mr.
White.  Mr. White's POV PANS over to him."|stage direction
332|MR. PINK|We ain't taking him to a hospital.|speech
333|MR. WHITE (OS)|If we don't, he'll die.|speech
334|MR. PINK|"And I'm very sad about that.  But
some fellas are lucky, and some
ain't."|speech
335|MR. WHITE (OS)|That fuckin did it!|speech
336||"Mr. White's POV CHARGES toward Mr. Pink.
Mr. Pink turns toward him in time to get PUNCHED hard in
the mouth.
END OF POV
Mr. White and Mr. Pink have a very ungraceful and
realistic fight.  They go at each other like a couple of
alley cats.
As Mr. White SWINGS and PUNCHES, he SCREAMS:"|stage direction
337||MR. WHITE|unknown
338|MR. WHITE (OS)|You little motherfucker!|speech
339||Mr. Pink YELLS as he HITS:|stage direction
340|MR. PINK|"Ya wanna fuck with me?!  You wanna
fuck with me?!  I'll show you who
you're fuckin with!"|speech
341||"The two men end up on the floor KICKING and SCRATCHING.
Mr. White gets Mr. Pink in a HEADLOCK.
Mr. Pink reaches in his jacket for his gun, and pulls it
out.
Mr. White sees this, immediately lets go of Mr. Pink,
and goes for his own weapon.
The two men are on the floor, on their knees, with their
guns outstretched, aiming at one another."|stage direction
342|MR. WHITE|"You wanna shoot me, you little
piece of shit?  Take a shot!"|speech
343|MR. PINK|"Fuck you, White!  I didn't create
this situation,  I'm just dealin
with it.  You're acting like a
first-year fuckin thief.  I'm
actin like a professional.  They
get him, they can get you, they
get you, they get closer to me,
and that can't happen.  And you,
you motherfucker, are looking at
me like it's my fault.  I didn't
tell him my name.  I didn't tell
him where I was from.  I didn't
tell him what I knew better than
to tell him.  Fuck, fifteen
minutes ago, you almost told me
your name.  You, buddy, are stuck
in a situation you created.  So if
you wanna throw bad looks
somewhere, throw 'em at a mirror."|speech
344||Mr. Pink lowers his gun and walks towards White.|stage direction
345|MR. PINK|"So if you wanna shoot somebody,
put that gun in your mouth and
shoot yourself."|speech
346||Then from OFF SCREEN we hear:|stage direction
347|VOICE (OS)|"You kids don't play so rough.
Somebody's gonna start crying."|speech
348||12     INT. WAREHOUSE - DAY - MEDIUM C.U. ON MR. BLONDE|unknown
349||"The Voice belongs to the infamous Mr. Blonde.
Mr. Blonde sits on a counter, drinking a fast food coke
and eating a hot dog."|stage direction
350|MR. PINK|"Mr. Blonde!  You okay?  We thought
you might've gotten caught.  What
happened?"|speech
351||"Mr. Blonde doesn't answer, he just hops off the counter
and starts walking around the warehouse, checking the
place out.
He doesn't look at either Mr. Pink or Mr. White, he
just eats his hot dog and sips his coke.
This is making Pink and White nervous as hell.  But Mr.
Pink tries to talk through it.
We HANDHOLD follow Mr. Blonde around the warehouse."|stage direction
352|MR. PINK|Really, how did you get away?|speech
353||Mr. Blonde walks the loft.  Silent.|stage direction
354|MR. PINK|"You saw what happened to me,
I found a hole and booked."|speech
355||Silence.|stage direction
356|MR. PINK|Where's Mr. Blue?|speech
357||Blonde looks in the bathroom.|stage direction
358|MR. PINK|"We were hopin you two would be
together."|speech
359||Blonde looks out the window.|stage direction
360|MR. PINK|"That was the big question we had,
what happened to Mr.
Blue and you?"|speech
361||Blonde walks away from the window.|stage direction
362|MR. PINK|We were worried the cops got ya.|speech
363||Blonde bends down over Mr. Orange.|stage direction
364|MR. PINK|"He got it in the belly.  He's
still alive, but won't be for
long."|speech
365|MR. WHITE|"Enough!  You better start talkin
to us, asshole, cause we got shit
we need to talk about.  We're
already freaked out, we need you
actin freaky like we need a fuckin
bag on our hip."|speech
366||"Mr. Blonde looks at his two partners in crime, then moves
towards them."|stage direction
367|MR. BLONDE|So, talk.|speech
368|MR. WHITE|"We think we got a rat in the
house."|speech
369|MR. PINK|"I guarantee we got a rat in the
house."|speech
370|MR. BLONDE|"What would ever make you think
that?"|speech
371|MR. WHITE|Is that supposed to be funny?|speech
372|MR. PINK|We don't think this place is safe.|speech
373|MR. WHITE|"This place just ain't secure
anymore.  We're leaving, and you
should go with us."|speech
374|MR. BLONDE|Nobody's going anywhere.|speech
375||"Silence takes over the room.  Mr. Blonde stops moving.
After a few beats the silence is broken."|stage direction
376||(to Mr. Pink)|location
377|MR. WHITE|"Piss on this turd, we're outta
here."|speech
378||Mr. White turns to leave.|stage direction
379|MR. BLONDE|"Don't take another step, Mr.
White."|speech
380||"Mr. White explodes, raising his gun and charging towards
Mr. Blonde."|stage direction
381|MR. WHITE|"Fuck you, maniac!  It's your
fuckin fault we're in so much
trouble."|speech
382||Mr. Blonde calmly sits down.  He looks to Mr. Pink.|stage direction
383||(referring to Mr.|location
384||White)|unknown
385|MR. BLONDE|What's this guy's problem?|speech
386|MR. WHITE|"What's my problem?  Yeah, I gotta
problem.  I gotta big problem with
any trigger-happy madman who
almost gets me shot!"|speech
387|MR. BLONDE|What're you talkin about?|speech
388|MR. WHITE|"That fuckin shooting spree in the
store."|speech
389|MR. BLONDE|"Fuck 'em, they set off the alarm,
they deserve what they got."|speech
390|MR. WHITE|"You almost killed me, asshole!  If
I had any idea what type of guy
you were, I never would've agreed
to work with you."|speech
391|MR. BLONDE|"You gonna back all day, little
doggie, or are you gonna bite?"|speech
392|MR. WHITE|"What was that?  I'm sorry, I
didn't catch it.  Would you repeat
it?"|speech
393||(slowly)|location
394|MR. BLONDE|"I said: ""Are you gonna bark all
day, dog, or are you gonna bite."""|speech
395|MR. PINK|"Both of you two assholes knock it
the fuck off and calm down!"|speech
396||(to Mr. Blonde)|location
397|MR. WHITE|So you wanna git bit, huh?|speech
398|MR. PINK|"Cut the bullshit, we ain't on a
fuckin playground!"|speech
399||(pause)|location
400|MR. PINK|"I don't believe this shit, both of
you got ten years on me, and I'm
the only one actin like a
professional.  You guys act like a
bunch of fuckin niggers.  You ever
work a job with a bunch of
niggers?  They're just like you
two, always fightin, always sayin
they're gonna kill one another."|speech
401||(to Mr. Pink)|location
402|MR. WHITE|"You said yourself, you
thought about takin him out."|speech
403|MR. PINK|"Then.  That time has passed.
Right now, Mr. Blonde is the only
one I completely trust.  He's too
fuckin homicidal to be workin with
the cops."|speech
404|MR. WHITE|You takin his side?|speech
405|MR. PINK|"Fuck sides!  What we need is a
little solidarity here.
Somebody's stickin a red hot poker
up our asses and we gotta find out
whose hand's on the handle.  Now I
know I'm no piece of shit..."|speech
406||(referring to Mr.|location
407||White)|unknown
408|MR. PINK|"And I'm pretty sure you're a good
boy..."|speech
409||(referring to Mr.|location
410||Blonde)|unknown
411|MR. PINK|"And I'm fuckin positive you're on
the level.  So let's figure out
who's the bad guy."|speech
412||"Mr. White calms down and puts his gun away.
Mr. Blonde returns to the persona we saw at the beginning,
talking about Madonna."|stage direction
413|MR. BLONDE|Well, that was sure exciting.|speech
414||(to Mr. White)|location
415|MR. BLONDE|"You're a big Lee Marvin fan,
aren't you?  Me too.  I don't know
about the rest of you fellas, but
my heart's
beatin fast."|speech
416||(pause for a beat)|location
417|MR. BLONDE|Okay you guys, follow me.|speech
418||"Mr. Blonde hops out of his chair and heads for the door.
The other two men just follow him with their eyes."|stage direction
419|MR. WHITE|Follow you where?|speech
420|MR. BLONDE|Down to my car.|speech
421|MR. WHITE|Why?|speech
422|MR. BLONDE|It's a surprise.|speech
423||Mr. Blonde walks out.|stage direction
424||13     EXT. WAREHOUSE - DAY|unknown
425||"Three cars are parked out front.  Mr. Blonde is walking
towards the car he drove.  Mr. White and Mr. Pink are
walking behind.  The Camera is HANDHELD following behind
them."|stage direction
426|MR. PINK|We still gotta get out of here.|speech
427|MR. BLONDE|We're gonna sit here and wait.|speech
428|MR. WHITE|For what, the cops?|speech
429|MR. BLONDE|Nice Guy Eddie.|speech
430|MR. PINK|"Nice Guy Eddie?  What makes you
think Nice Guy's anywhere but on a
plane half way to Costa Rica?"|speech
431|MR. BLONDE|"Cause I just talked to him.  He's
on his way down here, and nobody's
going anywhere till be gets here."|speech
432|MR. WHITE|"You talked to Nice Guy Eddie?  Why
the fuck didn't you say that in
the first place?"|speech
433|MR. BLONDE|You didn't ask.|speech
434|MR. WHITE|"Hardy-fuckin-har.  What did he
say?"|speech
435|MR. BLONDE|"Stay put.  Okay, fellas, take a
look at the little surprise I
brought you."|speech
436||"Mr. Blonde opens up the truck of his car.  A handcuffed,
uniformed POLICEMAN is curled up inside the trunk."|stage direction
437|MR. BLONDE|"So while we're waitin for Nice Guy
Eddie, what say we have a little
fun finding out who the rat is."|speech
438||"INSERT: TITLE CARD ""MR. BLONDE""."|stage direction
439||14     INT. JOE CABOT'S OFFICE - DAY|unknown
440||"We're inside the office of Joe Cabot.  Joe's on the phone,
sitting behind his desk."|stage direction
441||(into phone)|location
442|JOE|"Sid, I'm tellin you don't worry
about it.  You had a bad couple of
months, it happens."|speech
443||(pause)|location
444|JOE|"Sid, Sid, Sid...Stop, you're
embarrassing me.  I don't need to
be told what I already know.  When
you have bad months, you do what
every business man in the
worlds does, I don't care if he's
Donald Trump or Irving the tailor.
Ya ride it out."|speech
445||There's a KNOCK on Cabot's office door.|stage direction
446|JOE|Come in.|speech
447||"One of Cabot's goons, TEDDY, opens the door and steps
inside.  Cabot covers the receiver with his hand and looks
towards the man."|stage direction
448|TEDDY|Vic Vega's outside.|speech
449|JOE|Tell him to come in.|speech
450||Teddy leaves.|stage direction
451||(into phone)|location
452|JOE|"Sid, a friend of mine's here.  I
gotta go."|speech
453||(pause)|location
454|JOE|Good enough, bye.|speech
455||"He hangs up the phone, stands, and walks around to the
front of the desk.
Teddy opens the office door, and TOOTHPICK VIC VEGA walks
in.
Toothpick Vic Vega is none other than our very own Mr.
Blonde.  Vic is dressed in a long black leather seventies
style jacket.
Joe stands in front of his desk with his arms open.
The two men embrace each other.  Teddy leaves, closing the
door behind him."|stage direction
456|JOE|"How's freedom kid, pretty fuckin
good, ain't it?"|speech
457|VIC|It's a change.|speech
458|JOE|"Ain't that a sad truth.  Remy
Martin?"|speech
459|VIC|Sure.|speech
460|JOE|Take a seat.|speech
461||"Joe goes over to his liquor cabinet.  Vic sits in a chair
set in front of Joe's desk."|stage direction
462||(while he pours the|location
463||drink)|unknown
464|JOE|Who's your parole officer?|speech
465|VIC|A guy named Koons.  Craig Koons.|speech
466|JOE|How is he?|speech
467|VIC|"Fuckin asshole, won't let me leave
the halfway house."|speech
468|JOE|"Never ceases to amaze me.  Fuckin
jungle bunny goes out there, slits
some old woman's throat for
twenty-five cents.  Fuckin nigger
gets Doris Day as a parole
officer.  But a good fella like
you gets stuck with a ball-bustin
prick."|speech
469||"Joe walks back around his desk and sits in his chair.
Vic swallows some Remy."|stage direction
470|VIC|"I just want you to know, Joe, how
much I appreciate your care
packages on the inside."|speech
471|JOE|"What the hell did you expect me to
do?  Just forget about you?"|speech
472|VIC|"I just wanted you to know, they
meant a lot."|speech
473|JOE|"It's the least I could do Vic.  I
wish I coulda done more."|speech
474||(Joe flashes a side|location
475||grin at Vic)|unknown
476|JOE|"Vic. Toothpick Vic.  Tell me a
story?  What're your plans?"|speech
477|VIC|"Well, what I wanna do is go back
to work.  But I got this Koons
prick deep up my ass.  He won't
let me leave the halfway house
till I get some piece of shit job.
My plans have always been to be
part of the team again."|speech
478||There's a KNOCK at the door.|stage direction
479|JOE|Come in.|speech
480||"The door opens and in walks Joe's son, Nice Guy Eddie.
Vic turns around in his seat and sees him."|stage direction
481||(to Vic)|location
482|EDDIE|"I see ya sittin here, but I don't
believe it."|speech
483||Vic gets out of his seat and hugs Eddie.|stage direction
484|EDDIE|How ya doin, Toothpick?|speech
485|VIC|Fine, now.|speech
486|EDDIE|"I'm sorry man, I shoulda picked
you up personally at the pen.
This whole week's just been crazy.
I've had my head up my ass the
entire time."|speech
487|VIC|"Funny you should mention it.
That's what your father and I been
talkin about."|speech
488|EDDIE|That I should've picked you up?|speech
489|VIC|"No.  That your head's been up your
ass.  I walk through the door and
Joe says ""Vic, you're back, thank
god.  Finally somebody who knows
what the fuck he's doing.  Vic,
Vic, Vic, Eddie, my son, is a fuck
up.""  And I say ""Well, Joe, I
coulda told you that.""  ""I'm
ruined!  He's ruining me!  My son,
I love him, but he's taking my
business and flushing it down the
fuckin toilet!"""|speech
490||(to Joe)|location
491|VIC|"I'm not tellin tales out of
school.  You tell 'im Joe.
Tell 'im yourself."|speech
492|JOE|"Eddie, I hate like hell for you to
hear it this way.  But when Vic
asked me how's business, well, you
don't lie to a man who's just done
four years in the slammer for ya."|speech
493||Eddie bobs his head up and down.|stage direction
494||Oh really, is that a fact?|unknown
495||"Eddie JUMPS Vic and they fall to the floor.
The two friends, laughing and cussing at each other,
wrestle on the floor of Joe's office.
Joe's on his feet yelling at them."|stage direction
496||(yelling)|location
497|JOE|"Okay, okay, enough, enough!
Playtime's over!  You wanna roll
around on the floor, do it in
Eddie's office, not mine!"|speech
498||"The two men break it up.  They are completely disheveled,
hair a mess, shirttails out.  As they get themselves
together, they continue to taunt one another."|stage direction
499|EDDIE|Daddy, did ya see that?|speech
500|JOE|What?|speech
501|EDDIE|"Guy got me on the ground, tried to
fuck me."|speech
502|VIC|You fuckin wish.|speech
503|EDDIE|"You tried to fuck me in my
father's office, you sick bastard.
Look, Vic, whatever you wanna do
in the privacy of your own home,
go do it.  But don't try to fuck
me.  I don't think of you that
way.  I mean, I like you a lot--"|speech
504|VIC|"Eddie, if I was a pirate, I
wouldn't throw you to the crew."|speech
505|EDDIE|"No, you'd keep me for yourself.
Four years fuckin punks in the ass
made you appreciate prime rib when
you get it."|speech
506|VIC|"I might break you, Nice Guy, but
I'd make you my dog's bitch.
You'd be suckin the dick and going
down on a mangy T-bone hound."|speech
507|EDDIE|"Now ain't that a sad sight, daddy,
walks into jail a white man, walks
out talkin like a nigger.  It's
all that black semen been shootin
up his butt.  It's backed up into
his brain and comes out of his
mouth."|speech
508|JOE|"Are you two finished?  We were
talkin about some serious shit
when you came in Eddie.  We got a
big problem we're tryin to solve.
Now Eddie, would you like to sit
down and help us solve it, or do
you two wanna piss fart around?"|speech
509||"Playtime is over and Vic and Eddie know it.  So they both
take seats in front of Joe's desk."|stage direction
510|JOE|"Now Vic was tellin me, he's got a
parole problem."|speech
511|EDDIE|Really?  Who's your P.O.?|speech
512|VIC|Craig Koons.|speech
513|EDDIE|"Koons?  Oh shit, I hear he's a
motherfucker."|speech
514|VIC|"He is a motherfucker.  He won't
let me leave the halfway house
till I get some piece of shit job."|speech
515|EDDIE|"You're coming back to work for us,
right?"|speech
516|VIC|"I wanna.  But I gotta show this
asshole I got an honest-to-
goodness job before he'll let me
move out on my own.  I can't work
for you guys and be worried about
gettin back before ten o'clock
curfew."|speech
517||(to Eddie)|location
518|JOE|We can work this out, can't we?|speech
519|EDDIE|"This isn't all that bad.  We can
give you a lot of legitimate jobs.
Put you on the rotation at Long
Beach as a dock worker."|speech
