|character|text|type
0||Quentin Tarantino's|unknown
1||R E S E R V O I R   D O G S|location
2||"October 22, 1990
This movie is dedicated to these following sources of
inspiration:"|stage direction
3||"TIMOTHY CAREY
ROGER CORMAN
ANDRE DeTOTH
CHOW YUEN FAT
JEAN LUC GODDARD
JEAN PIERRE MELVILLE
LAWRENCE TIERNEY
LIONEL WHITE
RESERVOIR DOGS
1      INT. UNCLE BOB'S PANCAKE HOUSE - MORNING"|unknown
4||"Eight men dressed in BLACK SUITS, sit around a table at a
breakfast cafe.  They are MR. WHITE, MR. PINK, MR. BLUE,
MR. BLONDE, MR. ORANGE, MR. BROWN, NICE GUY EDDIE CABOT,
and the big boss, JOE CABOT.  Most are finished eating and
are enjoying coffee and conversation.  Joe flips through a
small address book.  Mr. Pink is telling a long and
involved story about Madonna."|stage direction
5|MR. PINK|"""Like a Virgin"" is all about a
girl who digs a guy with a big
dick.  The whole song is a
metaphor for big dicks."|speech
6|MR. BLUE|"No it's not.  It's about a girl
who is very vulnerable and she's
been fucked over a few times.
Then she meets some guy who's
really sensitive--"|speech
7|MR. PINK|"--Whoa...whoa...time out Greenbay.
Tell that bullshit to the
tourists."|speech
8||(looking through his|location
9||address book)|unknown
10|JOE|"Toby...who the fuck is Toby?
Toby...Toby...think...think...
think..."|speech
11|MR. PINK|"It's not about a nice girl who
meets a sensitive boy.  Now
granted that's what ""True Blue"" is
about, no argument about that."|speech
12|MR. ORANGE|"Which one is ""True Blue?"""|speech
13|NICE GUY EDDIE|"You don't remember ""True Blue?""
That was a big ass hit for
Madonna.  Shit, I don't even
follow this Tops In Pops shit, and
I've at least heard of ""True
Blue."""|speech
14|MR. ORANGE|"Look, asshole, I didn't say I
ain't heard of it.  All I asked
was how does it go?  Excuse me
for not being the world's biggest
Madonna fan."|speech
15|MR. BROWN|I hate Madonna.|speech
16|MR. BLUE|"I like her early stuff.  You know,
""Lucky Star,"" ""Borderline"" - but
once she got into her ""Papa Don't
Preach"" phase, I don't know, I
tuned out."|speech
17|MR. PINK|"Hey, fuck all that, I'm
making a point here.  You're gonna
make me lose my train
of thought."|speech
18|JOE|"Oh fuck, Toby's that little china
girl."|speech
19|MR. WHITE|What's that?|speech
20|JOE|"I found this old address book in a
jacket I ain't worn in a coon's
age.  Toby what?  What the fuck
was her last name?"|speech
21|MR. PINK|Where was I?|speech
22|MR. ORANGE|"You said ""True Blue"" was about a
nice girl who finds a sensitive
fella.  But ""Like a Virgin"" was a
metaphor for big dicks."|speech
23|MR. PINK|"Let me tell ya what ""Like a
Virgin""'s about.  It's about some
cooze who's a regular fuck
machine.
I mean all the time, morning, day,
night, afternoon, dick, dick,
dick, dick, dick,
dick, dick, dick, dick, dick,
dick."|speech
24|MR. BLUE|How many dicks was that?|speech
25|MR. WHITE|A lot.|speech
26|MR. PINK|"Then one day she meets a John
Holmes motherfucker, and it's
like, whoa baby.  This mother
fucker's like Charles Bronson in
""The Great Escape.""  He's diggin
tunnels.  Now she's gettin this
serious dick action, she's feelin
something she ain't felt since
forever.  Pain."|speech
27|JOE|Chew?  Toby Chew?  No.|speech
28|MR. PINK|"It hurts.  It hurts her.  It
shouldn't hurt.  Her pussy should
be Bubble-Yum by now.  But when
this cat fucks her, it hurts.  It
hurts like the first time.  The
pain is reminding a fuck machine
what is was like to be a virgin.
Hence, ""Like a Virgin."""|speech
29||The fellas crack up.|stage direction
30|JOE|Wong?|speech
31|MR. PINK|"Fuck you, wrong.  I'm right!  What
the fuck do you know about it
anyway?  You're still listening to
Jerry-fucking-Vale."|speech
32|JOE|"Not wrong, dumb ass, Wong!  You
know, like the Chinese name?"|speech
33||"Mr. White snatches the address book from Joe's hand.  They
fight, but they're not really mad at each other."|stage direction
34|MR. WHITE|Give me this fucking thing.|speech
35|JOE|"What the fuck do you think you're
doin?  Give me my book back!"|speech
36|MR. WHITE|"I'm sick of fuckin hearin it Joe,
I'll give it back when we leave."|speech
37|JOE|"Whaddaya mean, give it to me when
we leave, give it back now."|speech
38|MR. WHITE|"For the past fifteen minutes now,
you've just been droning on with
names.  ""Toby...Toby...Toby...
Toby Wong...Toby Wong...Toby
Chung...fuckin Charlie Chan.""  I
got Madonna's big dick outta my
right ear, and Toby Jap I-don't-
know-what, outta my left."|speech
39|JOE|What do you care?|speech
40|MR. WHITE|"When you're annoying as hell, I
care a lot."|speech
41|JOE|Give me my book.|speech
42|MR. WHITE|You gonna put it away?|speech
43|JOE|"I'm gonna do whatever I wanna do
with it."|speech
44|MR. WHITE|"Well, then, I'm afraid I'm gonna
have to keep it."|speech
45|MR. BLONDE|"Joe, you want me to shoot him for
you?"|speech
46|MR. WHITE|"Shit, you shoot me in a dream, you
better wake up and apologize."|speech
47|NICE GUY EDDIE|"Have you guys been listening to K-
BILLY's super sounds of the
seventies weekend?"|speech
48|MR. PINK|Yeah, it's fuckin great isn't it?|speech
49|NICE GUY EDDIE|"Can you believe the songs they
been playin?"|speech
50|MR. PINK|"No, I can't.  You know what I
heard the other day?  ""Heartbeat -
It's Lovebeat,"" by little Tony
DeFranco and the DeFranco Family.
I haven't heard that since I was
in fifth fuckin grade."|speech
51|NICE GUY EDDIE|"When I was coming down here, I was
playin it.  And ""The Night the
Lights Went Out in Georgia"" came
on.  Now I ain't heard that song
since it was big, but when it was
big, I heard it a million-
trillion times.  I'm listening to
it this morning, and this was the
first time I ever realized that
the lady singing the song, was the
one who killed Andy."|speech
52|MR. BLUE|"You didn't know Vicki Lawrence
killed the guy?"|speech
53|NICE GUY EDDIE|"I thought the cheatin wife shot
Andy."|speech
54|MR. BLONDE|They say it in the song.|speech
55|NICE GUY EDDIE|"I know, I heard it.  I musta zoned
out whenever that part came on
before.  I thought when she said
that little sister stuff, she was
talkin about her sister- in-law,
the cheatin wife."|speech
56|JOE|"No, she did it.  She killed the
cheatin wife, too."|speech
57|MR. PINK|"You know the part in ""Gypsies,
Tramps and Theives,"" when she says
""Poppa woulda shot his if he knew
what he'd done?""  I could never
figure out what he did."|speech
58||"The table laughs.  The WAITRESS comes over to the table.
She has the check, and a pot of coffee."|stage direction
59|WAITRESS|"Can I get anybody more
coffee."|speech
60|JOE|"No, we're gonna be hittin it.
I'll take care of the check."|speech
61||She hands the bill to him.|stage direction
62|WAITRESS|"Here ya go.  Please pay at the
register, if you wouldn't mind."|speech
63|JOE|Sure thing.|speech
64|WAITRESS|You guys have a wonderful day.|speech
65||They all mutter equivalents.  She exits and Joe stands up.|stage direction
66|JOE|"I'll take care of this, you guys
leave the tip."|speech
67||(to Mr. White)|location
68|JOE|"And when I come back, I want my
book back."|speech
69|MR. WHITE|Sorry, it's my book now.|speech
70|JOE|"Blonde, shoot this piece of shit,
will ya?"|speech
71||"Mr. Blonde shoots Mr. White with his finger.  Mr White
acts shot.  Joe exits."|stage direction
72||"Okay, everybody cough up green for
the little lady."|unknown
73||"Everybody whips out a buck, and throws it on the table.
Everybody, that is, except Mr. White."|stage direction
74|NICE GUY EDDIE|C'mon, throw in a buck.|speech
75|MR. WHITE|Uh-uh.  I don't tip.|speech
76|NICE GUY EDDIE|Whaddaya mean you don't tip?|speech
77|MR. WHITE|I don't believe in it.|speech
78|NICE GUY EDDIE|You don't believe in tipping?|speech
79||(laughing)|location
80|MR. PINK|"I love this kid, he's a madman,
this guy."|speech
81|MR. BLONDE|"Do you have any idea what these
ladies make?  They make shit."|speech
82|MR. WHITE|"Don't give me that.  She don't
make enough money, she can quit."|speech
83||Everybody laughs.|stage direction
84|NICE GUY EDDIE|"I don't even know a Jew who'd have
the balls to say that.  So let's
get this straight. You never ever
tip?"|speech
85|MR. WHITE|"I don't tip because society says I
gotta.  I tip when somebody
deserves a tip.  When somebody
really puts forth an effort, they
deserve a little something extra.
But this tipping automatically,
that shit's for the birds.  As far
as I'm concerned, they're just
doin their job."|speech
86|MR. BLUE|Our girl was nice.|speech
87|MR. WHITE|"Our girl was okay.  She didn't do
anything special."|speech
88|MR. BLONDE|"What's something special, take ya
in the kitchen and suck your dick?"|speech
89||They all laugh.|stage direction
90|NICE GUY EDDIE|"I'd go over twelve percent for
that."|speech
91|MR. WRITE|"Look, I ordered coffee.  Now we've
been here a long fuckin time, and
she's only filled my cup three
times.  When I order coffee,  I
want it filled six times."|speech
92|MR. BLONDE|What if she's too busy?|speech
93|MR. WHITE|"The words ""too busy"" shouldn't be
in a waitress's vocabulary."|speech
94|NICE GUY EDDIE|"Excuse me, Mr. White, but the last
thing you need is another cup of
coffee."|speech
95||They all laugh.|stage direction
96|MR. WHITE|"These ladies aren't starvin to
death.  They make minimum wage.
When I worked for minimum wage, I
wasn't lucky enough to have a job
that society deemed tipworthy."|speech
97|NICE GUY EDDIE|"Ahh, now we're getting down to it.
It's not just that he's a cheap
bastard--"|speech
98|MR. ORANGE|--It is that too--|speech
99|NICE GUY EDDIE|"--It is that too.  But it's also
he couldn't get a waiter job.  You
talk like a pissed off dishwasher:
""Fuck those cunts and their
fucking tips."""|speech
100|MR. BLONDE|"So you don't care that they're
counting on your tip to live?"|speech
101||Mr. White rubs two of his fingers together.|stage direction
102|MR. WHITE|"Do you know what this is?  It's
the world's smallest violin,
playing just for the waitresses."|speech
103|MR. BLONDE|"You don't have any idea what
you're talking about.  These
people bust their ass. This
is a hard job."|speech
104|MR. WHITE|"So's working at McDonald's, but
you don't feel the need to tip
them.  They're servin ya food, you
should tip em.  But no, society
says tip these guys over here, but
not those guys over there.  That's
bullshit."|speech
105|MR. ORANGE|"They work harder than the kids at
McDonald's."|speech
106|MR. WHITE|"Oh yeah, I don't see them cleaning
fryers."|speech
107|MR. BROWN|"These people are taxed on the tips
they make.  When you stiff 'em,
you cost them money."|speech
108|MR. BLONDE|"Waitressing is the number one
occupation for female non-college
graduates in this country.  It's
the one jab basically any woman
can get, and make a living on.
The reason is because of tips."|speech
109|MR. WHITE|Fuck all that.|speech
110||They all laugh.|stage direction
111|MR. WHITE|"Hey, I'm very sorry that the
government taxes their tips.
That's fucked up.  But that ain't
my fault.  it would appear that
waitresses are just one of the
many groups the government fucks
in the ass on a regular basis.
You show me a paper says the
government shouldn't do that, I'll
sign it.  Put it to a vote, I'll
vote for it.  But what I won't do
is play ball.  And this non-
college bullshit you're telling
me, I got two words for that:
""Learn to fuckin type.""  Cause if
you're expecting me to help out
with the rent, you're in for a big
fuckin surprise."|speech
112|MR. ORANGE|"He's convinced me.  Give me my
dollar back."|speech
113||Everybody laughs.  Joe's comes back to the table.|stage direction
114|JOE|"Okay ramblers, let's get to
rambling.  Wait a minute, who
didn't throw in?"|speech
115|MR. ORANGE|Mr. White.|speech
116||(to Mr. Orange)|location
117|JOE|Mr. White?|speech
118||(to Mr. White)|location
119|JOE|Why?|speech
120|MR. ORANGE|He don't tip.|speech
121||(to Mr. Orange)|location
122|JOE|He don't tip?|speech
123||(to Mr. White)|location
124|JOE|You don't tip?  Why?|speech
125|MR. ORANGE|He don't believe in it.|speech
126||(to Mr. Orange)|location
127|JOE|He don't believe in it?|speech
128||(to Mr. White)|location
129|JOE|You don't believe in it?|speech
130|MR. ORANGE|Nope.|speech
131||(to Mr. Orange)|location
132|JOE|Shut up!|speech
133||(to Mr. White)|location
134|JOE|"Cough up the buck, ya cheap
bastard, I paid for your goddamn
breakfast."|speech
135|MR. WHITE|"Because you paid for the
breakfast, I'm gonna tip.
Normally I wouldn't."|speech
136|JOE|"Whatever.  Just throw in your
dollar, and let's move."|speech
137||(to Mr. Blonde)|location
138|JOE|"See what I'm dealing with here.
Infants.  I'm fuckin dealin with
infants."|speech
139||"The eight men get up to leave.  Mr. White's waist is in
the F.G.  As he buttons his coat, for a second we see he's
carrying a gun.  They exit Uncle Bob's Pancake House,
talking amongst themselves."|stage direction
140||2      EXT. UNCLE BOB'S PANCAKE HOUSE - DAY|unknown
141||"CREDIT SEQUENCE:
When the credit sequence is finished, we    FADE TO BLACK:
Over the BLACK we hear the sound of SOMEONE SCREAMING in
agony.
Under the screaming, we hear the sound of a car HAULING
ASS, through traffic.
Over the screams and the traffic noise, we hear SOMEBODY
ELSE SAY:"|stage direction
142|SOMEBODY ELSE (OS)|Just hold on buddy boy.|speech
143||Somebody stops screaming long enough to say:|stage direction
144||SOMEBODY (OS)|unknown
145|SOMEBODY ELSE (OS)|"I'm sorry.  I can't believe
she killed me.  Who would've
fuckin thought that?"|speech
146||"CUT TO:
3      INT. GETAWAY GAR (MOVING) - DAY"|unknown
147||"The Somebody screaming is Mr. Orange.  He lies in the
backseat.  He's been SHOT in the stomach.  BLOOD covers
both him and the backseat.
Mr. White is the Somebody Else.  He's behind the wheel of
the getaway car.  He's easily doing 80 mph, dodging in and
out of traffic.  Though he's driving for his life, he
keeps talking to his wounded passenger in the backseat.
They are the only two in the car."|stage direction
148|MR. WHITE|"Hey, just cancel that shit right
now!  You're hurt.  You're hurt
really fucking bad, but you ain't
dying."|speech
149||(crying)|location
150|MR. ORANGE|"All this blood is scaring the shit
outta me.  I'm gonna die, I know
it."|speech
151|MR. WHITE|"Oh excuse me, I didn't realize you
had a degree in medicine.  Are you
a doctor?  Are you a doctor?
Answer me please, are you a
doctor?"|speech
152|MR. ORANGE|No, I'm not!|speech
153|MR. WRITE|"Ahhhh, so you admit you don't know
what you're talking about.  So if
you're through giving me your
amateur opinion, lie back and
listen to the news.  I'm taking
you back to the rendezvous, Joe's
gonna get you a doctor, the
doctor's gonna fix you up, and
you're gonna be okay.  Now say it:
you're gonna be okay.  Say it:
you're gonna be okay!"|speech
154||"Mr. Orange doesn't respond.  Mr. White starts pounding on
the steering wheel."|stage direction
155|MR. WHITE|"Say-the-goddamn-words: you're
gonna be okay!"|speech
156|MR. ORANGE|I'm okay.|speech
157||(softly)|location
158|MR. WHITE|Correct.|speech
159||4      INT. WAREHOUSE - DAY|unknown
160||"The CAMERA does a 360 around an empty warehouse.  Then the
door swings open, and Mr. White carries the bloody body of
Mr. Orange inside.
Mr. Orange still is MOANING loudly from his bullet hit.
Mr. White lays him down upon a mattress on the floor."|stage direction
161|MR. WHITE|"Just hold on buddy boy.  Hold on,
and wait for Joe.  I can't do
anything for you, but when Joe
gets here, which should be anytime
now, he'll be able to help you.
We're just gonna sit here, and
wait for Joe.  Who are
we waiting for?"|speech
162|MR. ORANGE|Joe.|speech
163|MR. WHITE|Bet your sweet ass we are.|speech
164||"Mr. White gets up from over Mr. Orange and starts to prowl
around the warehouse."|stage direction
165||(yelling)|location
166|MR. ORANGE|Don't leave me!|speech
167||Mr White bends back over him and takes his hand.|stage direction
168|MR. WHITE|"I ain't going anywhere.  I'm right
here.  I'm not gonna leave ya."|speech
169|MR. ORANGE|"Larry, I'm so scared, would you
please hold me."|speech
170||"Mr. White very gently embraces the bloody Mr. Orange.
Cradling the young man, Mr. White whispers to him."|stage direction
171||(whispering)|location
172|MR. WHITE|"Go ahead and be scared, you've
been brave enough for one day.  I
want you to just relax now.
You're not gonna die, you're gonna
be fine.  When Joe gets here,
he'll make ya a hundred percent
again."|speech
173||"Mr. White lays Mr. Orange back down on the mattress.  He's
still holding his hand.  Mr. Orange looks up at his
friend."|stage direction
174|MR. ORANGE|"Look, I don't wanna be a fly in
the ointment, but if help doesn't
come soon, I gotta see a doctor.
I don't give a fuck about jail, I
just don't wanna die."|speech
175|MR. WHITE|"You're not gonna fucking die, all
right?"|speech
176|MR. ORANGE|"I wasn't born yesterday.  I'm
hurt, and I'm hurt bad."|speech
177|MR. WHITE|It's not good...|speech
178|MR. ORANGE|"Hey, bless your heart for what
you're trying to do.  I was
panicking for a moment, but I've
got my senses back now.  The
situation is, I'm shot in the
belly.  And without medical
attention, I'm gonna die."|speech
179|MR. WHITE|I can' take you to a hospital.|speech
180|MR. ORANGE|"Fuck jail!  I don't give a shit
about jail.  But I can't die.  You
don't have to take me in.  Just
drive me up to the front, drop me
on the sidewalk.  I'll take care
of myself.  I won't tell them
anything.  I swear to fucking god,
I won't tell 'em anything.  Look
in my eyes, look right in my eyes."|speech
181||(Mr. White does)|location
182|MR. ORANGE|"I-won't-tell-them-anything.
You'll be safe."|speech
183|MR. WHITE|Lie back down, and try to--|speech
184|MR. ORANGE|"I'm going to die!   I need a
doctor!  I'm begging you,
take me to a doctor."|speech
185||"Mr. Orange lays his head back on the mattress.  Spent from
his outburst, he quietly mutters to himself:"|stage direction
186|MR. ORANGE|"Take me to a doctor, take me to a
doctor, please."|speech
187||"Suddenly, the warehouse door BURSTS open and Mr.
Pink steps inside."|stage direction
188|MR. PINK|Was that a fucking set-up or what?|speech
189||Mr. Pink sees Mr. Orange on the floor, shot and bloody.|stage direction
190|MR. PINK|Oh fuck, Orange got tagged.|speech
191||Throughout this scene, we hear Mr. Orange moaning.|stage direction
192|MR. WHITE|Gun shot.|speech
193|MR. PINK|"Oh that's just fucking great!
Where's Brown?"|speech
194|MR. WHITE|Dead.|speech
195|MR. PINK|Goddamn, goddamn!  How did he die?|speech
196|MR. WHITE|"How the fuck do you think?  The
cops shot him."|speech
197|MR. PINK|Oh this is bad, this is so bad.|speech
198||(referring to Mr.|location
199||Orange)|unknown
200|MR. PINK|Is it bad?|speech
201|MR. WHITE|As opposed to good?|speech
202|MR. PINK|"This is so fucked up.  Somebody
fucked us big time."|speech
203|MR. WHITE|You really think we were set up?|speech
204|MR. PINK|"You even doubt it?  I don't think
we got set up, I know we got set
up!  I mean really, seriously,
where did all those cops come
from, huh?  One minute they're not
there, the next minute
they're there.  I didn't hear any
sirens.  The alarm went off, okay.
Okay, when an alarm goes off, you
got an average of four minutes
response time.  Unless a patrol
car is cruising that street, at
that particular moment, you got
four minutes before they can
realistically respond.  In one
minute there were seventeen blue
boys out there.  All loaded for
bear, all knowing exactly what the
fuck they were doing, and they
were all just there!  Remember
that second wave that showed up in
the cars? Those were the ones
responding to the alarm.  but
those other motherfuckers were
already there, they were waiting
for us."|speech
205||(pause)|location
206|MR. PINK|You haven't thought about this?|speech
207|MR. WHITE|"I haven't had a chance to think.
First I was just trying to get the
fuck outta there.  And after we
got away, I've just been dealin
with him."|speech
208|MR. PINK|"Well, you better start thinking
about it.  Cause I, sure as fuck,
am thinking about it.  In fact,
that's all I'm thinking about.  I
came this close to just driving
off.  Whoever set us up, knows
about this place.  There could've
been cops sitting here waiting for
me.  For all we know, there's
cops, driving fast, on their way
here now."|speech
209|MR. WHITE|Let's go in the other room...|speech
210||"The camera creeps along a wall, coming to a corner.  We
move past it, and see down a hall."|stage direction
211||5      INT. BATHROOM HALLWAY - DAY|unknown
212||"At the end of the hall is a bathroom.  The bathroom door
is partially closed, restricting our view.  Mr. Pink is
obscured, but Mr. White is in view."|stage direction
213|MR. PINK (OS)|"What the fuck am I doing here?  I
felt funny about this job right
off.  As soon as I felt it I
should said ""No thank you"", and
walked.  But I never fucking
listen.  Every time I ever got
burned buying weed, I always knew
the guy wasn't right.  I just felt
it.  But I wanted to believe him.
If he's not lyin to me, and it
really is Thai stick, then whoa
baby.  But it's never Thai stick.
and I always said if I felt that
way about a job, I'd walk.  And I
did, and I didn't, because of
fuckin money!"|speech
214|MR. WHITE|"What's done is done, I need you
cool.  Are you cool?"|speech
215|MR. PINK|I'm cool.|speech
216|MR. WHITE|"Splash some water on your face.
Take a breather."|speech
217||"We hear the sink running, and Mr. Pink splashing water on
his face."|stage direction
218|MR. WHITE|I'm gonna get me my smokes.|speech
219||"Mr White opens the bathroom door, walks down the hall, and
OUT OF FRAME.  We see Mr. Pink, his back turned towards
us, bent over the sink.  Then he grabs a towels, and dries
his face.  Mr White ENTERS FRAME with a pack of
Chesterfields in his hand."|stage direction
220|MR. WHITE|Want a smoke?|speech
221|MR. PINK|Why not?|speech
222||The two men light up.|stage direction
223|MR. WHITE|"Okay, let's go through what
happened.  We're in the place,
everything's going fine.  Then the
alarm gets tripped.  I turn around
and all these cops are outside.
You're right, it was like, bam!  I
blink my eyes are they're there.
Everybody starts going apeshit.
Then Mr. Blonde starts shootin all
the--"|speech
224|MR. PINK|--That's not correct.|speech
225|MR. WHITE|What's wrong with it?|speech
226|MR. PINK|"The cops didn't show up after the
alarm went off.  They didn't show
till after Mr. Blonde started
shooting everyone."|speech
227|MR. WHITE|"As soon as I heard the alarm, I
saw the cops."|speech
228|MR. PINK|"I'm telling ya, it wasn't that
soon.  They didn't let their
presence be known until after Mr.
Blonde went off.  I'm not sayin
they weren't there, I'm sayin they
were there.  But they didn't move
in till Mr. Blonde became a
madman.  That's how I know we were
set up.  You can see that,
can't you, Mr. White?"|speech
229|MR. WHITE|"Look, enough of this ""Mr White""
shit--"|speech
230|MR. PINK|"--Don't tell me your name, I don't
want to know!  I sure as hell
ain't gonna tell ya
mine."|speech
231|MR. WHITE|You're right, this is bad.|speech
232||(pause)|location
233|MR. WHITE|How did you get out?|speech
234|MR. PINK|"Shot my way out.  Everybody was
shooting, so I just blasted my way
outta there."|speech
235||"CUT TO:
6      EXT. CROWDED CITY STREET - DAY"|unknown
236||"Mr. Pink is hauling ass down a busy city sidewalk.  He has
a canvas bag with a shoulder strap in one hand, and a .357
MAGNUM in the other.  If any BYSTANDERS get in his way, he
just knocks them down.  We DOLLY at the same speed, right
along side of him.
FOUR POLICEMEN are running after Mr. Pink.  We DOLLY with
them.
We DOLLY with a young woman on roller skates.  ROLLERGIRL
is plugged into a walkman.  We hear the song she's
listening to LOUD over the SOUNDTRACK.  She's twirling and
skating backwards to the beat of the song.
Rollergirl turns a corner and COLLIDES with Mr. Pink.  The
man and woman CRASH to the ground.
Mr. Pink rolls into the street, in front of a moving car
that SCREECHES to a stop, narrowly avoiding running over
him."|stage direction
237||7      INT. CAR (STOPPED) - DAY|unknown
238||"The CAMERA is in the backseat. A SHOCKED WOMAN is the
car's driver.  Mr. Pink pulls himself up from the hood,
shakes it off, and points his magnum at the driver."|stage direction
239|MR. PINK|"Get outta the car!  Get the fuck
outta the car!"|speech
240||"The Shocked Woman starts screaming.
Mr. Pink tries to open the driver's side door, but it's
locked."|stage direction
241|MR. PINK|Open the fucking door!|speech
242||"EXTREME C.U. DRIVER'S SIDE WINDOW
Mr. Pink SMASHES it in our face."|stage direction
243||8      EXT. STREET - DAY|unknown
244||"DOLLY with Cops coming up fast.
Mr. Pink DRAGS the Shocked Woman out of the car.
The Cops reach the corner, guns aimed.
Using the car as a shield, Mr. Pink FIRES three shots at
the Cops.
Everybody HITS the ground, or scatters.
Mr. Pink HOPS in the car.
Cops FIRE."|stage direction
245||9      INT. CAR (MOVING) - DAY|unknown
246||"CAMERA in the backseat, Mr. Pink FLOORS it.  SPEEDING down
the street, with the Cops FIRING after him."|stage direction
247||"BACK TO:
10     INT. BATHROOM - DAY"|unknown
248||Mr. Pink and Mr. White still talking in the bathroom.|stage direction
249|MR. PINK|"Tagged a couple of cops.  Did you
kill anybody?"|speech
250|MR. WHITE|A few cops.|speech
251|MR. PINK|No real people?|speech
252|MR. WHITE|Uh-uh, just cops.|speech
253|MR. PINK|Could you believe Mr. Blonde?|speech
254|MR. WHITE|"That was one of the most insane
fucking things I've ever seen.
Why the fuck would Joe hire
somebody like that?"|speech
255|MR. PINK|"I don't wanna kill anybody.  But
if I gotta get out that door, and
you're standing in my way, one way
of the other, you're gettin outta
my way."|speech
