|character|text|type
1180||"Elsewhere, Elias stands silently, listens to the forest.  In the
distance the firefight can hardly be heard.  His helmet gone, his
hair hanging free, he is at his best now - alone.  He hears it.
Somebody running through the jungle, about 100 yards, boots on
leaves, coming towards him.
He begins to move lateral to the sound.  His steps unheard,
better at this than the enemy.
THREE ENEMY FIGURES now appear, crouched and moving very fast
with light equipment through the mist.
Elias swerves up in immediate foreground, his back to us, FIRING.
All three Figures fall.
A quick glimpse of Elias, not bothering to stop, moving to his
next position."|stage direction
1181||EXT. BARNES' JUNGLE - DAY|location
1182||"Barnes, moving through the jungle, reacts to the fire, resetting
his course.  Like a hunter stalking a deer.  Suddenly there's
more firing.  Then silence -"|stage direction
1183||EXT. ELIAS' JUNGLE - DAY|location
1184||"TWO MORE ENEMY lie dead in the jungle.  A rustle of movement,
then a CRY - chilling, jubilant, a war cry.
A pair of feet moving lightly over the jungle.  A glimpse of
Elias.  In his full glory.  Roaming the jungle, born to it."|stage direction
1185||EXT. BARNES' JUNGLE - DAY|location
1186||Barnes fixing on him, moving.|stage direction
1187||EXT. ELIAS' JUNGLE - DAY|location
1188||"An NVA SOLDIER, jungle-whiskered, dirty, smart, crouches,
listens, looks to his PARTNER.  What are they fighting here?  The
First One mutter something sharp and they split fast in the
direction they've come.
They get about six steps when Elias suddenly rises up from the
bush, not ten yards in front of them, his shots ripping into
them, driving the surprised life from them.  Elias is gone."|stage direction
1189||EXT. NVA JUNGLE - DAY|location
1190||"Elsewhere, another three NVA stop, turn and flee back from where
they came."|stage direction
1191||EXT. JUNGLE CHURCH - DAY|location
1192||"Chris and Rhah get Crawford back to the church grounds, lay him
down.  No activity around them.  Chris plunges back into the
jungle where they left Barnes."|stage direction
1193|RHAH|Taylor!|speech
1194||EXT. ELIAS AND BARNES' JUNGLE - DAY|location
1195||"Barnes moving, stops, listens.  Something is running towards him.
But it's hidden by the bush.  He brings his rifle up smooth and
quick, waits, then as the bush parts, Elias is standing there.
Looking at Barnes.
Barnes sees him, starts to lower his rifle, but then stops.  He
raises it back an inch, sights it.  Pause.  A cold searing look
of hatred coming over his face.
In that moment, Elias understands.  Quick as a deer, he makes his
move, trying to plunge back into the bush.
Barnes fires.  Once, twice, three times - the blast rocking the
jungle.
Elias jerking backwards into the bush, mortally wounded.  Bird
cries.  A crime against nature.
Barnes calmly lowers his rifle, and walks away from it."|stage direction
1196||EXT. CHRIS' JUNGLE - DAY|location
1197||"Chris, cutting through the jungle, hears the shots.  He stops,
listens.  Someone is moving through bush towards him, leaves and
foliage shaking.
Chris tightens, raises his rifle.
Barnes steps through into his sight - sees him.
Chris lowers his rifle.  Barnes walking past him as if he weren't
even there."|stage direction
1198|BARNES|Elias is dead.  Join up with the platoon.  Move it.|speech
1199||(shocked)|location
1200|CHRIS|He's dead!  Where?  ... You saw him?|speech
1201|BARNES|"Yeah.  Back about 100 metres.  He's dead, now get
going, the gooks are all over the fuckin' place."|speech
1202||"Moving on quickly.  Chris has no choice but to follow, looking
back one more time."|stage direction
1203||EXT. CHURCH GROUNDS - JUNGLE - DAY|location
1204||"TWO CHOPPERS are coming into a LZ in front of the Church.  The
two platoons, Second and Third, reinforcing, are being evacuated
as quickly as possible, one load (6-8 men, depending on the
wounded) after other.  The choppers are spraying dust all over
the place.  A scene of chaos, radio talk layering it.  Doc is out
of supplies, making do with improvised bandages, etc."|stage direction
1205|WOLFE|MOVE IT MOVE IT MOVE IT.|speech
1206||"Lerner goes by, horribly wounded on a makeshift litter, into the
chopper, Doc attending, holding the IV.
Chris catching a glimpse of him, waiting to get on the chopper,
turning to look as:
Hoyt and Sgt.Warren, both wounded, are hurried aboard on litters.
The chopper lifting off.
Chris and others now running to the corpses of Flash, Morehouse,
and Fu Sheng lying under dirty ponchos, their boots sticking out.
The ponchos are blown away in a burst of wind off the chopper
blades, revealing their faces - dirt stuffing their eyes and
mouths, waxen figures.
Chris and the others lifting them and carrying them towards the
next chopper now coming in.
They throw the bodies on.  Tubbs and Crawford, both wounded, now
move past Chris, into the chopper.  Chris running back, with King
carrying a litter - their eyes falling on:
Barnes talking with Wolfe and Ace, making signals under the
roaring sounds of the chopper.  Shaking his head.  No.  No Elias.
Chris and King looking at each other, mute.  They numbly start
loading Big Harold, minus his leg, onto the stretcher.
The Third Chopper is down now, waiting, roaring blades
silhouetting off the face of the cathedral.  A ROCKET BLAST
suddenly goes off not too far from the chopper, incoming fire.
The DOOR GUNNER signaling for them to hurry, laying out fire.
INT/EXT. CHOPPER - JUNGLE - DAY
Chris and King hustling Big Harold's 250 pounds into the chopper.
Climbing in with him.  Wolfe, Barnes, Ace running in with them.
The perimeter is bare.
Chris' eyes flitting over Barnes as he jumps in.  The chopper
lifting off as another explosion rocks the area.  The Door Gunner
sees something, opens up.
Big Harold, cursing, looks chalky but hog happy as he manages a
glance down at the jungle.  His right leg is gone.  Tears are
rolling out of his eyes."|stage direction
1207|KING|"Man, you gonna be in Japan this time tomorrow, Big
Harold."|speech
1208|BIG HAROLD|"Yeah, I'se lucky dis time, what's a leg to get the
fuck outta here ..."|speech
1209||(at the NVA)|location
1210|BIG HAROLD|Eat ma shit, you motherfuckers!|speech
1211||"He sinks back, sick.  Chris' eyes sudenly fix on something.  He
can't believe it.  He shoves King, points.  King sees it.  Both
stunned.
Barnes is looking.  So's Lt.Wolfe, so's Ace.  So's the Door
Gunner.
Elias is coming out of the jungle.  Staggering, blood disfiguring
his face and chest, hanging on with all his dimming strength,
looking up at them - trying to reach them.
Chris shakes Wolfe, his words drowned out by the roar.
The Chopper Captain looking down, dips.  His co-pilot pointing.
The NVA are coming out of the jungle, closing on the spot where
Elias is.
Incoming rounds are hitting the chopper.  The Door Gunner
maniacally firing.
Barnes looking down at the man, can't believe it.
Elias is on his last legs now, obviously being hit by the
incoming fire of the NVA.  He falls to his knees, still
stretching upwards for life.
The Chopper Captain shakes his head at Wolfe.
The Chopper dips one more time firing at the NVA, low and fierce
over the jungle.
Chris looking back in horror.
Elias crucified.  The NVA coming out now by the dozens from the
treeline.
Elias crumbling to the ground.  Obviously dead or dying."|stage direction
1212|HELICAPTAIN ON RADIO|"... we still got one on the deck.  Bring the gunships
in."|speech
1213||"Barnes drawing in.
Chris looking at him in revulsion.  He knows.  Barnes sees his
look, ignores it, all of them sitting there silent, living with
that final horrifying image of Elias."|stage direction
1214||EXT. UNDERGROUND HUTCH - BASE CAMP - NIGHT|location
1215||"The 'heads' are assembled - what's left of them.  Rhah, King,
Francis, Doc, Adam, a quiet black kid, and Chris, who is
impassioned tonight."|stage direction
1216|CHRIS|"He killed him.  I know he did.  I saw his eyes when
he came back in ..."|speech
1217||(puffing on his bowl)|location
1218|RADIO VOICE|"How do you know the dinks didn't get him.  You got no
proof man."|speech
1219|CHRIS|"Proof's in the eyes.  When you know you know.  You
were there Rhah - I know what you were thinking.  I
say we frag the fucker.  Tonight."|speech
1220||He looks to King who puffs on a joint, his eyes red.|stage direction
1221|KING|I go with dat, an eye for an eye man.|speech
1222|DOC|"Right on, nothing wrong with Barnes another shot in
the head wouldn't cure."|speech
1223||(to Chris)|location
1224|RHAH|"Shit boy you been out in the sun too long.  You try
that, he'll stick it right back up your ass with a
candle on it."|speech
1225|CHRIS|Then what do you suggest big shot?|speech
1226||(to Chris)|location
1227|RHAH|"I suggest you watch your own asses cause Barnes gonna
be down on ALL OF 'EM."|speech
1228|FRANCIS|How you figger that?|speech
1229|RHAH|Shit man - Human nature.|speech
1230||Flashes the old knuckle - 'HATE'.|stage direction
1231|KING|"Then you jes gonna forget 'bout Elias and all the
good times we done had?  Right in here."|speech
1232|RHAH|He dugged his own grave.|speech
1233||(correcting)|location
1234|DOC|He dug it.|speech
1235|RHAH|He DUGGED it too.|speech
1236|CHRIS|Fuck this shit!|speech
1237|RHAH|"You guys trying to cure the headache by cutting off
the head.  'Lias didn't ask you to fight his battles
and if there's a Heaven - and god, I hope so - I know
he's sitting up there drunk as a fuckin' monkey and
smokin' shit cause HIS PAINS HE DONE LEFT DOWN HERE.
Baaaaaaaaa!"|speech
1238||(a vehement movement of his head)|location
1239|CHRIS|"You're wrong man!  Any way you cut it Rhah, Barnes is
a murderer."|speech
1240|KING|Right on.|speech
1241|RHAH|"I remember first time you came in here Taylor you
telling me how much you admired that bastard."|speech
1242|CHRIS|I was wrong.|speech
1243||(snorts)|location
1244|RHAH|"Wrong?  You ain't EVER been right - 'bout nothing.
And dig this you assholes and dig it good!  Barnes
been shot 7 times and he ain't dead, that tell you
something?  Barnes ain't meant to die.  Only thing
can get Barnes ... is Barnes!"|speech
1245||"Barnes stands there, silhouetted in the trap door, looking down
at the men who are stunned to see him here.
He steps down into the hutch, his face now lit by candle light.
A bottle of whiskey in his hand, drunk, ugly, sweating, but as
always, with dignity, possessive of his silence.  He feels their
fear in the silence, enjoys it."|stage direction
1246||(soft)|location
1247|BARNES|Talking 'bout killing?|speech
1248||"He totters slightly as he circles the outer edge of the hutch.
No one talks."|stage direction
1249|BARNES (CONT'D)|Y'all experts?  Y'all know about killing?|speech
1250||He takes the bowl from Adams, smokes it.|stage direction
1251|BARNES (CONT'D)|"You pussies gotta smoke this shit so's you can hide
from reality? ..."|speech
1252||(smokes again)|location
1253|BARNES (CONT'D)|Me I don't need that shit.  I AM reality.|speech
1254||Confronting Chris, he moves on, taunting them all.|stage direction
1255|BARNES (CONT'D)|"There's the way it oughta be and there's the way it
is.  'Lias he was full of shit, 'Lias was a crusader
- I got no fight with a man does what he's told but
when he don't, the machine breaks down, and when the
machine breaks down, WE break down ... and I ain't
gonna allow that.  From none of you.  Not one ..."|speech
1256||"Walks past Rhah, past King, throws the pot bowl into the dirt of
the floor."|stage direction
1257|BARNES (CONT'D)|"Y'all loved Elias, want to kick ass, I'se here - all
by my lonesome, nobody gonna know.  Five you boys
'gainst me?"|speech
1258||(pause, very soft)|location
1259|BARNES (CONT'D)|Kill me.|speech
1260||"Almost an appeal - naked, intense.  Rhah, Francis, Doc look away.
King, the biggest one there, is about to say something, but the
moment passes.
Chris waits, his anger on the rise.
Barnes takes a swigger from the whiskey, then turns away
contemptuously."|stage direction
1261|BARNES (CONT'D)|I SHIT on all o' you.|speech
1262|CHRIS|KILL YOU MOTHERFUCKER!!!|speech
1263||"Chris slams into Barnes, rushing him off his feet.  Pounding his
face, solid blows."|stage direction
1264|KING AND OTHERS|"Get that mother, babe, go ... Kick his ass, kill that
cocksucker!!!"|speech
1265||"But Barnes is too quick and very strong and takes the blows,
getting outside Chris' arm, twisting and flipping him in a
wrestler's grip - throwing him hard onto his back on the dirt
floor.
The expression of the Men watching slumps, their hopes dashed.
Barnes springs around on Chris, straddles him, one hand pushing
his face back, hits him hard.  Once.  Twice.
Chris grimaces, groans, helpless now.  A flick of sound.
A knife whipped out of Barnes' boot and pressing against Chris'
throat.  Chris bleeding from the nose and mouth.
Rhah suddenly spinning into action, fast now, realizing what
Barnes intends to do."|stage direction
1266|RHAH|EASY BARNES, EASY MAN!!!|speech
1267||"Barnes is on the verge - about to kill again.
Chris waiting.
Rhah coaxing him, moving closer."|stage direction
1268|RHAH (CONT'D)|"You'll do dinky dau in Long Binh Barnes.  Ten years -
kill an enlisted.  Ten years, Barnes, just climb the
walls.  DON'T DO IT ..."|speech
1269||"Barnes' eyes tremble in the candle light, his scars ugly, a spasm
clenching and locking his facial muscles.  Then suddenly he is
calm again, very calm.  We sense a man of enormous self-control.
Suddenly he flicks his knife across Chris, leaving a mark below
his left eye.
Chris gasps.  Looking up at Barnes rising off him.  The boots
alongside his face.
The Men looking on, the tension lowering."|stage direction
1270||(contemptuous)|location
1271|BARNES|Death?  What do you guys know about it?|speech
1272||He walks out.  Quietly.|stage direction
1273||EXT. AIR SHOTS - JUNGLE, CHURCH - DAY|location
1274||"Chris sits at the very edge of a Huey Chopper, bandana around his
forehead, long hair blowing in the wind, Barnes' mark below his
eyes, slicked out now like a jungle veteran, looking down at the
VILLAGE where the massacre occurred.
The Village is still a smoking ruin, a few peasants and water
buffalo straggling like ants to reconstruct.
Bunny, next to Chris, pops his gum, indifferent.  Barnes, next to
him, shifts, reads a map.
Rodriguez is praying, his mouth moving without audible words,
getting ready for the drop.
King is making last minute adjustments in his pack.
Bunny now nudges Chris, points.  The Church in the Jungle where
Elias was killed is visible.  An outline of the Cemetery.
Uncomfortable memories play over Chris' face."|stage direction
1275|CHRIS (V.O.)|"They sent us back into the valley the next day -
about 2,000 metres from Cambodia - into a battalion
perimeter.  Alpha Company had been hit hard the day
before by a sizeable force and Charlie Company had
been probed that night.  There were other battalions
in the valley, we weren't the only ones but we knew
we were going to be the bait to lure them out.  And
somewhere out there was the entire 141st NVA
Regiment."|speech
1276||"The BATTALION PERIMETER now breaks in the clear ahead.  Smoke
grenades of various colors are being popped on the cleared LZ.
It's not big, its radius 200 yards, heavily sandbagged, deeply
dug, rolls of barbed wire protecting it, radio antennas sprouting
from the CP - and surrounded on all four sides by jungle.
The First Chopper rocking down, whipping up dust clouds.  Chris
jumps out, moving out fast as the Second Chopper starts in."|stage direction
1277||EXT. BATTALION CP - PERIMETER #3 - DUSK|location
1278||"At the Battalion CP, the Major confers with Captain Harris and
two other Captains.  Two NVA PRISONERS are sitting on their
knees, interrogated by Vietnamese Kit Carson scouts and a U.S.
Sergeant, their hands tied.
The Scout slaps the shit out of the NVA."|stage direction
1279||EXT. PLATOON CP - PERIMETER #3 - DUSK|location
1280||"All this is watched from a distance by Ace and Doc and Lt.Wolfe
at the Platoon CP.  Ace and Doc are digging the foxhole, the ace
of spades in Ace's helmet band, sharing the information with Tony
and Francis."|stage direction
1281|ACE|"... they caught 'em last night pulling some shit on
Charlie Company.  They found maps on 'em, man - got a
friend at Battalion says they had every fuckin'
foxhole here fixed on it.  Distances, treelines, our
claymores, trip wires, everything?  I shit you not."|speech
1282|DOC|"Shit, so what the fuck are we doing here?  Why don't
we move ..."|speech
1283||(no answer)|location
1284|DOC|"Bad vibes, man, I got bad vibes here.  Where are the
new guys they provided us anyway."|speech
1285|TONY|I heard we's in Cambodia right fuckin' NOW.|speech
1286|FRANCIS|You kidding man ...|speech
1287||"Rhah comes up, a walking stick in hand, huge pirate kerchief on
his head, semi-naked."|stage direction
1288|RHAH|You wanted to see me sir?|speech
1289|WOLFE|Jackson, looks like you got Elias' squad now.|speech
1290|RHAH|"Squad?  I didn't know we was still referring to this
platoon in terms of squads sir."|speech
1291||(with a snicker for Ace and Doc)|location
1292||(indicating a rough drawing in the dirt)|location
1293|WOLFE|These two holes are yours ...|speech
1294|RHAH|"Begging your pardon Lieutenant but my holes are far
enuff apart you could run a regiment through there
and nobody'd see them - I got five live bodies left"|speech
1295|WOLFE|"I don't want to hear your problems, Jackson.  You'll
get new men any day.  Time being you make do like
everybody else."|speech
1296|RHAH|Hey Lieutenant I didn't ask for this job, I ...|speech
1297||(leaves)|location
1298|WOLFE|I don't want to hear about it Jackson.|speech
1299||(amazed, looking off at him)|location
1300|RHAH|You don't want to hear about it?|speech
1301||(turns)|location
1302|WOLFE|"That's right.  I don't want to hear about it 'cause
to tell you the truth, I don't give a shit okay ... I
just don't give a shit anymore."|speech
1303||(shrugs, to himself)|location
1304|RHAH|Right ...|speech
1305||(passing Ace digging the CP hole)|location
1306|WOLFE|This is one time we could sure use Elias.|speech
1307||(to Doc)|location
1308|ACE|"'Some people say I'm wishy washy.  Maybe I am.  Maybe
I ain't.'"|speech
1309||EXT. PERIMETER #3 - CHRIS' FOXHOLE - DUSK|location
1310||"On the edge of the perimeter, King puts out his claymore,
unraveling it back towards his FOXHOLE, intersecting MEN form the
Third Platoon, who file out on a night ambush, skirting the trip
wires, demoralized, silent.  Eye exchanges, but no words.
Chris sits on the foxhole watching the ambush go out, smoking a
joint by himself, depressed.  King comes in with the claymore
wires, attaching them to their detonators.  Their foxhole - as
are all of the Platoon's - is positioned just inside the treeline
bordering the LZ, so that they are quite isolated from the center
of the perimeter where they first landed."|stage direction
1311|KING|"Glad I ain't going with 'em.  Somewhere out dere man
is de Beast and he hungry tonight ... Man, what a
bummer.  Ten days and a wakeup and I'm still dealing
wid this shit - fuckin' etcetera and ad infinitum man"|speech
1312||The LAST SOLDIER in the file recedes into the foliage.|stage direction
1313||(noticiing Chris' silence)|location
1314|KING (CONT'D)|"What's the matter wid you? ... How come you ain't
writing no more?  You was always writing something
home.  Looks like youse half a bubble off, Taylor."|speech
1315||He doesn't answer, makes a futile gesture.|stage direction
1316|KING (CONT'D)|"What about your folks?  That grandma you was telling
me about? ..."|speech
1317||Chris shakes his head.|stage direction
1318|KING (CONT'D)|Girl?|speech
1319||Chris' eyes answer negatively.|stage direction
1320|KING (CONT'D)|Must be somebody?|speech
1321|CHRIS|... there's nobody.|speech
1322||(shifts, uncomfortable)|location
1323|KING|"You been smoking too much shit babe.  Gotta control
that.  Takes a man down ... I remember when you first
come out to the bush, you was straight as a ..."|speech
1324|CHRIS|Who gives a shit!|speech
1325||"He shifts, annoyed, prepares his grenades along the sand bags.
King shrugs, preparing his meal, sings himself a snatch of song,
a good natured man."|stage direction
1326||(soft)|location
1327|KING|"'People say I'm the life of the party cause I tell a
joke or two although I may be laughing loud and hardy
deep inside I'm blue ...'"|speech
1328|CHRIS|"Y'ever get caught in a mistake King and you just
can't get out of it?"|speech
1329|KING|"Way out of anything, man.  Just keep your pecker up,
your powder dry, the worm WILL turn.  How many days
you short?"|speech
1330|CHRIS|"Not just me ... it's the way the whole thing works.
People like Elias get wasted and people like Barnes
just go on making up rules any way they want and what
do we do, we just sit around in the middle and suck
on it!  We just don't add up to dry shit."|speech
1331|KING|"Does a chicken have lips?  Whoever said we did, babe.
Make it outta here, it's all gravy, every day of the
rest of your life man - gravy.  Oh shit, superlifer!"|speech
1332||O'Neill comes up, jerks his thumb at King.|stage direction
1333|O'NEILL|"Get your gear together, King, your orders just come
through."|speech
1334||(speechless)|location
1335|KING|"You jokin' me man? ... shit, you ain't kidding!
Cocksucker.  Oh wowww ... the lifers made a mistake,
they cuttin' me some slack, they cutting me some
slack Taylor!"|speech
1336||(dances)|location
1337|O'NEILL|"Collect your shit and move out King.  You got 10
minutes make the last chopper.  Cee ess em oh or your
ass is mine."|speech
1338||(to Taylor)|location
1339|O'NEILL|Francis is coming over.|speech
1340||(hurries off)|location
1341||"King packing up, double time.  Chris comes over, helps him,
trying to share his happiness but not succeeding."|stage direction
1342|CHRIS|"Hey that's great King, that's great ... you take it
on home for me, you tell 'em King ... got your
address right?  You know where you can reach men,
man.  Anytime!"|speech
1343|KING|"I gotta didi man.  Don't wanna miss that chopper.
I'll send you a postcard.  After I get me some.  I'll
send you some tapes too man.  This new guy Jimi
Hendrix man, whew ... you okay Taylor?  Just 'member
take it easy now, don't think too much, don't be a
fool, no such thing as a coward cause it don't mean
nuthin.  Jes keep on keepin' on.  Okay my man ..."|speech
1344||"Chris, fighting his depression, slaps hands with King.  A brief
moment, they look at each other.  A friendship that was forever
and is now over.  They both sort of know they'll never see each
other again."|stage direction
1345|CHRIS|I'll walk you out ...|speech
1346||Francis coming up, hauling his pack.|stage direction
1347||EXT.PERIMETER #3 - JUNIOR'S FOXHOLE - DUSK|location
1348||"On another foxhole, Rodriguez positions his M-60, brings up his
ammo belts (no loaders left).  Tony eating, nervous, watches him,
shakes his head."|stage direction
1349|TONY|"Rumor goin' round is they got tanks.  Soviet shit, T-
34's ..."|speech
1350||(pause)|location
1351|TONY|Hey Rodriguez, don't you ever say nothing?|speech
1352||(a thick Mexican accent)|location
1353|RODRIGUEZ|"What do you want me to say, it's all the same ol'
shit."|speech
1354||Tony shrugs, back to his food.|stage direction
1355||EXT. PERIMETER #3 - JUNIOR'S FOXHOLE - DUSK|location
1356||"On another foxhole, Barnes in full pack checks the soles of
Junior's bare feet.  Bunny and O'Neill looking on.  Junior is
moaning as if he's dying, overdoing it by a mile."|stage direction
1357|BARNES|So what's the problem?|speech
1358|O'NEILL|Says he can't walk.|speech
1359|BARNES|"Shit.  Get your boots on Martin, next time I catch
you putting mosquito repellant on your fuckin' feet
I'm gonna courtmartial your nigger ass."|speech
1360||(cracks)|location
1361|JUNIOR|"DEN COURTMARTIAL ME MOTHERFUCKAH, bust my ass, send
me to fucking Long Binh, do your worst but I ain't
walking no more.  De white man done got his last klik
outta me.  Get some chuck dude to hump this shit."|speech
1362||(suddenly soft)|location
1363|BARNES|Get me that centipede, O'Neill.|speech
1364||O'Neill is puzzled.  What centipede?|stage direction
1365|O'NEILL|Sarge?|speech
1366|BARNES|"Yeah that long hairy orange and black bastard I found
in the ammo crate.  I'm gonna put it in this
asshole's crotch, see if he can walk."|speech
1367||"Junior's eyes bulge with suspiscion and sudden terror, his
demeanor totally alert now."|stage direction
1368||(understanding)|location
1369|O'NEILL|Oh yeah, right away Sarge.|speech
1370|JUNIOR|"No!  Wait!  I'll walk, fuck you I'll walk, I don't
need this shit!  I don't need this shit!"|speech
1371|BUNNY|"Fucking pussy, fuck it Sarge, I gotta have him on my
hole?"|speech
1372||Barnes going.  O'Neill catching up with him.|stage direction
1373|O'NEILL|Uh ... Bob.  Like to speak to you.  Take a minute.|speech
1374||(stops)|location
1375|BARNES|Yeah, what is it?|speech
1376||(shuffles, reluctant)|location
1377|O'NEILL|"Bob, I got Elias' R&R ... It's coming up in 3 days.
Going to Hawaii.  See Patsy."|speech
1378||(pause, no reaction from Barnes)|location
1379|O'NEILL|"I never asked you for a break, I was hoping you ...
you'd send me in on the chopper with King ... what do
you say Chief?"|speech
1380||(a friendly punch)|location
1381|BARNES|"I can't do that for you, Red ... We need every
swinging dick in the field.  Sorry bout that ..."|speech
1382||(starts to go)|location
1383||(pleads)|location
1384|O'NEILL|"Hey Bob, come on!  Talk to me hunh, it's your friend
Red, I'm only asking you for three days chief ..."|speech
1385|BARNES|"I'm talking to you Red and I'm telling you no.  Get
back to your position."|speech
1386||(grabs him, desperate)|location
1387|O'NEILL|"Bob, I gotta bad feeling about this, I ... I'm
telling you I got a bad feeling, man, I don't think
I'm gonna make it .. y'know what I mean?"|speech
1388||(quietly)|location
