|character|text|type
520|VIC|I don't wanna lift crates.|speech
521|EDDIE|"You don't hafta lift shit.  You
don't really work there.  But as
far as the records are concerned,
you do.  I call up Matthews, the
foreman, tell him he's got a new
guy.  You're on the schedule.  You
got a timecard, it's clocked in
and out for you everyday, and you
get a pay check at the end of the
week.  And ya know dock workers
don't do too bad.  So you can move
into a halfway decent place
without Koons thinkin ""what the
fuck.""  And if Koons ever wants to
make a surprise visit, you're gone
that day.  That day we sent you to
Tustin.  We gotta bunch of shit
you needed to unload there.
You're at the Taft airstrip pickin
up a bunch of shit and bringing it
back.  Part of your jab is goin
different places - and we got
places all over the place."|speech
522||(to Vic)|location
523|JOE|Didn't I tell ya not to worry?|speech
524||(to Eddie)|location
525|JOE|Vic was worried.|speech
526|EDDIE|"Me and you'll drive down to Long
Beach tomorrow.  I'll introduce
you to Matthews, tell him what's
going on."|speech
527|VIC|That's great, guy, thanks a bunch.|speech
528||(pause)|location
529|VIC|"When do you think you'll need me
for real work?"|speech
530|JOE|"Well, it's kinda a strange time
right now.  Things are kinda--"|speech
531|EDDIE|"--Nuts.  We got a big meeting in
Vegas coming up.  And we're kinda
just gettin ready for that right
now."|speech
532|JOE|"Let Nice Guy set you up at Long
Beach.  Give ya some cash, get
that Koons fuck off your back, and
we'll be talking to ya."|speech
533|EDDIE|"Daddy, I got an idea.  Now just
hear it out.  I know you don't
like to use any of the boys on
these jobs, but technically, Vic
ain't one of the boys.  He's been
gone for four years.  He ain't on
no one's list.  Ya know he can
handle himself, ya know you can
trust him."|speech
534||"Joe looks at Vic.
Vic has no idea what they're talking about."|stage direction
535|JOE|"How would you feel about pullin a
heist with about five other guys?"|speech
536|VIC|What's the exposure like?|speech
537|JOE|"Two minutes, tops.  It's a tough
two minutes.  It's a hold up,
daylight, during business hours,
dealing with a crowd.  But you
have the fellas to deal with the
crowd.  It's a jewelry store.
They're getting a big shipment of
South African diamonds on a
certain day.  They're like a way
station.  It's gonna get picked up
the next day and sent to Hamburg.
When you walk through the door,
you'll know right where to go for
the rich stones.
The fellas are good, me and Nice
Guy picked em.  Nobody knows
anybody else.  Nobody's connected.
I don't use connected guys for
this shit."|speech
538|VIC|What's the cut?|speech
539|JOE|Juicy, man, real juicy.|speech
540||"Toothpick Vic smiles.
So does Nice Guy Eddie."|stage direction
541||"CUT TO:
15     INT. NICE GUY EDDIE'S CAR (MOVING) - DAY"|unknown
542||"Nice Guy Eddie is driving to the rendezvous talking on his
portable car phone.  The sounds of the seventies are
coming out of his car radio in the form of ""Love Goes
Where My Rosemary Goes"" by Edison Lighthouse."|stage direction
543||(into phone)|location
544|EDDIE|"Hey Dov, we got a major situation
here."|speech
545||(pause)|location
546|EDDIE|"I know you know that.  I gotta
talk with daddy and find out what
he wants done."|speech
547||FLASH ON|stage direction
548||16     INT. WAREHOUSE - DAY|unknown
549||"The Cop is standing in the warehouse with his hands cuffed
behind his back.  Mr. White, Mr. Pink and Mr. Blonde
surround him and proceed to beat the shit out of him.
""Love Grows .."" PLAYS over the soundtrack."|stage direction
550||17     BACK TO NICE GUY EDDIE|unknown
551||(into phone)|location
552|EDDIE|"All I know is what Vic told me.
He said the place turned into a
fuckin bullet festival.  He took a
cop as hostage, just to get the
fuck out of there."|speech
553||FLASH ON|stage direction
554||18     WAREHOUSE|unknown
555||The three men are stomping the cop into the ground.|stage direction
556||19     BACK TO EDDIE|unknown
557||(into phone)|location
558|EDDIE|"Do I sound like I'm jokin?  He's
fuckin driving around with the cop
in his trunk."|speech
559||(pause)|location
560|EDDIE|"I don't know who did that.  I
don't know who has the loot, if
anybody has the loot.  Who's dead,
who's alive, who's caught, who's
not...
I will know, I'm practically
there.  But what do I tell these
guys about daddy?"|speech
561||(pause)|location
562|EDDIE|You sure that's what he said?|speech
563||(pause)|location
564|EDDIE|Okay, that's what I'll tell em.|speech
565||"CUT TO:
20     EXT.  WAREHOUSE - DAY"|unknown
566||"Three cars belonging to the other guys are parked outside
the warehouse.
Eddie drives his car up to the warehouse.  He gets out of
the car, looks at the other cars parked outside."|stage direction
567||(to himself)|location
568|EDDIE|Fucking assholes.|speech
569||"Eddie makes a beeline for the front door, BANGS it open,
and steps inside the warehouse."|stage direction
570||21     INT. WAREHOUSE - DAY|unknown
571||"The robbers have the cop tied to a chair and are still
WAILING on him.
Nice Guy Eddie walks in and everybody jumps."|stage direction
572|EDDIE|What in Sam Hill is goin on?|speech
573||Mr. Pink and Mr. White speak together.|stage direction
574||"MR. PINK                      MR. WHITE
Hey, Nice Guy, we got a     You're askin what's goin
cop.                        on?  Where the fuck is
Joe?"|unknown
575||Nice Guy sees Mr. Orange.|stage direction
576|EDDIE|"Holy shit, this guy's all fucked
up!"|speech
577|MR. WHITE|"No shit, he's gonna fuckin die on
us if we don't get him taken care
of."|speech
578|MR. PINK|"We were set up, the cops were
waiting for us."|speech
579|EDDIE|What?  Nobody set anybody up.|speech
580|MR. PINK|The cops were there waitin for us!|speech
581|EDDIE|Bullshit.|speech
582|MR. PINK|"Hey, fuck you man, you weren't
there, we were.  And I'm tellin
ya, the cops had that store staked
out."|speech
583|EDDIE|Okay, Mr. Detective, who did it?|speech
584|MR. PINK|"What the fuck d'you think we've
been askin each other?"|speech
585|EDDIE|"And what are your answers?  Was it
me?  You think I set you up?"|speech
586|MR. PINK|I don't know, but somebody did.|speech
587|EDDIE|"Nobody did.  You assholes turn the
jewelry store into a wild west
show, and you wonder why cops show
up."|speech
588|MR. BLONDE|Where's Joseph?|speech
589|EDDIE|"I ain't talked to him.  I talked
to Dov.  Dov said he's comin out
here, and he's fucking pissed."|speech
590||(to Mr. White)|location
591|MR. PINK|I told ya he'd be pissed.|speech
592||(pointing to Mr.|location
593||Orange)|unknown
594|MR. WHITE|What are you gonna do about him?|speech
595|EDDIE|"Jesus Christ, give me a fuckin
chance to breathe.  I got a few
questions of my own, ya know."|speech
596|MR. WHITE|You ain't dying, he is.|speech
597|EDDIE|I'll call somebody.|speech
598|MR. WHITE|Who?|speech
599|EDDIE|"A snake charmer, what the fuck
d'you think.  I'll call a doctor,
take care of him, fix 'm right up.
No, where's Mr. Brown and Mr.
Blue?"|speech
600|MR. PINK|"Brown's dead, we don't know about
Blue."|speech
601|EDDIE|"Nobody saw what happened to Mr.
Blue?"|speech
602|MR. BLONDE|"Well, he's either dead or he's
alive or the cops got him or they
don't."|speech
603||DOLLY to MEDIUM on the cop.|stage direction
604|EDDIE (OS)|"I take it this is the bastard you
told me about."|speech
605||(referring to the|location
606||cop)|unknown
607|EDDIE (OS)|"Why the hell are you beating on
him?"|speech
608|MR. PINK|"So he'll tell us who the fuck set
us up."|speech
609|EDDIE|"Would you stop it with that shit!
You beat on this prick enough,
he'll tell ya he started the
Chicago fire.  That don't
necessarily make it so.  Okay,
first things fucking last, where's
the shit?  Please tell me somebody
brought something
with them."|speech
610|MR. PINK|"I got a bag.  I stashed it till I
could be sure this place wasn't a
police station."|speech
611|EDDIE|"Well, let's go get it.  We also
gotta get rid of all those cars.
It looks like Sam's hot car lot
outside."|speech
612||(pointing to Mr.|location
613||Blonde)|unknown
614|EDDIE|"You stay here and babysit Orange
and the cop."|speech
615||(referring to Mr.|location
616||Pink and Mr. White)|unknown
617|EDDIE|"You two take a car each, I'll
follow ya.  You ditch it, I'll
pick you up, then we'll pick up
the stones.  And while I'm
following you, I'll arrange for
some sort of a doctor for our
friend."|speech
618|MR. WHITE|"We can't leave these guys with
him."|speech
619||Meaning Mr. Blonde.|stage direction
620|EDDIE|Why not?|speech
621||Mr. White crosses to Mr. Blonde.|stage direction
622|MR. WHITE|"Because this guy's a fucking
psycho.  And if you think
Joe's pissed at us, that
ain't nothing compared to how
pissed off I am at him, for puttin
me in the same room as this
bastard."|speech
623||(to Eddie)|location
624|MR. BLONDE|"You see what I been puttin up
with?  As soon as I walk through
the door I'm hit with this shit.
I tell 'm what you told me about
us stayin put and Mr. White whips
out his gun, sticks it in my face,
and starts screaming ""You
motherfucker, I'm gonna blow you
away, blah, blah, blah."""|speech
625|MR. WHITE|"He's the reason the place turned
into a shooting gallery."|speech
626||(to Mr. Pink)|location
627|MR. WHITE|"What are you, a silent partner?
Fuckin tell him."|speech
628|MR. PINK|"He seems all right now, but he
went crazy in the store."|speech
629|MR. WHITE|This is what he was doin.|speech
630||"Mr. White acts out Mr. Blonde shooting everybody in the
store."|stage direction
631|MR. BLONDE|"I told 'em not to touch the alarm.
They touched it.  I blew 'em full
of holes.  If they hadn't done
what I told 'em not it, they'd
still be alive."|speech
632|MR. WHITE|"That's your excuse for going on a
kill crazy rampage?"|speech
633|MR. BLONDE|I don't like alarms.|speech
634|EDDIE|"What does it matter who stays with
the cop?  We ain't lettin him go.
Not after he's seen everybody.
You should've never took him outta
your trunk in the first place."|speech
635|MR. PINK|"We were trying to find out what he
knew about the set up."|speech
636|EDDIE|There is no fuckin set up!|speech
637||(Eddie takes charge)|location
638|EDDIE|"Look, this is the news.  Blondie,
you stay here and take care of
them two.  White and Pink come
with me, 'cuz if Joe gets here and
sees all those fucking cars
parked out front, he's going to be
as mad at me as he is at you."|speech
639||"Eddie, Mr. White and Mr. Pink walk out of the warehouse
talking amongst themselves."|stage direction
640||22     INT. WAREHOUSE - DAY - MR. BLONDE AND COP|unknown
641||"Mr. Blonde closes the door after them.  He then slowly
turns his head towards the cop."|stage direction
642|MR. BLONDE|Alone at last.|speech
643||C.U. COP'S FACE.|stage direction
644|MR. BLONDE (OS)|Now where were we?|speech
645|COP|"I told you I don't know anything
about any fucking set up.  I've
only been on the force eight
months, nobody tells me anything!
I don't know anything!  You can
torture me if you want--"|speech
646|MR. BLONDE (OS)|--Thanks, don't mind if I do.|speech
647|COP|"Your boss even said there wasn't a
set up."|speech
648|MR. BLONDE (OS)|"First off, I don't have a boss.
Are you clear about that?"|speech
649||He SLAPS the cop's face.|stage direction
650|MR. BLONDE (OS)|"I asked you a question.  Are you
clear about that?"|speech
651|COP|Yes.|speech
652|MR. BLONDE (OS)|"Now I'm not gonna bullshit you.  I
don't really care about what you
know or don't know.  I'm gonna
torture you for awhile regardless.
Not to get information, but
because torturing a cop amuses me.
There's nothing you can say,
there's nothing you can do.
Except pray for death."|speech
653||"He puts a piece of tape over the cop's mouth.
COP'S POV
Mr. Blonde walks away from the cop."|stage direction
654|MR. BLONDE|"Let's see what's on K-BILLY'S
""super sounds of the seventies""
weekend."|speech
655||"He turns on the radio.
Stealer's Wheel's hit ""Stuck in the Middle with You"" PLAYS
over the speaker.
NOTE: This entire sequence is timed to the music.
Mr. Blonde slowly walks toward the cop.
He opens a large knife.
He grabs a chair, places it in front of the cop and sits
in it.
Mr. Blonde just stares into the cop's/our face, holding
the knife, singing along with the song.
Then, like a cobra, he LASHES out.
A SLASH across the face.
The cop/camera moves around wildly.
Mr. Blonde just stares into the cop's/our face, singing
along with the seventies hit.
Then he reaches out and CUTS OFF the cop's/our ear.
The cop/camera moves around wildly.
Mr. Blonde holds the ear up to the cop/us to see.
Mr. Blonde rises, kicking the chair he was sitting on out
of the way."|stage direction
656||23     INT./EXT. WAREHOUSE - DAY - HANDHELD SHOT|unknown
657||"We follow Mr Blonde as he walks out of the warehouse...
...to his car.  He opens the trunk, pulls out a large can
of gasoline.
He walks back inside the warehouse..."|stage direction
658||24     INT. WAREHOUSE - DAY|unknown
659||"...carrying the can of gas.
Mr. Blonde POURS the gasoline all over the cop, who's
BEGGING him not to do this.
Mr. Blonde just sings along with Stealer's Wheel.
Mr. Blonde LIGHTS up a match and, while mouthing:"|stage direction
660|MR. BLONDE|"""Clowns to the left of me,
Jokers to the right.  Here I am,
stuck in the middle with you."""|speech
661||"He moves the match up to the cop...
...When a bullet EXPLODES in Mr. Blonde's chest.
The HANDHELD camera WHIPS to the right and we see the
bloody Mr. Orange FIRING his gun.
We cut back and forth between Mr. Blonde taking BULLET
HITS and Mr. Orange emptying his weapon.
Mr. Blonde FALLS down dead.
Mr. Orange crawls to where the cop is, leaving a bloody
trail behind him.
When he reaches the cop's feet he looks up at him."|stage direction
662||(feebly)|location
663|MR. ORANGE|What's your name?|speech
664|COP|Jeffrey.|speech
665|MR. ORANGE|Jeffrey what?|speech
666|COP|Jeffrey Andrews.|speech
667|MR. ORANGE|"Listen to me, Jeffrey
Andrews.  I'm a cop."|speech
668|JEFFREY|I know.|speech
669||(surprised)|location
670|MR. ORANGE|You do?|speech
671|JEFFREY|Your name's Freddy something.|speech
672|MR. ORANGE|Freddy Newendyke.|speech
673|JEFFREY|"Frankie Ferchetti introduced us
once, about five months ago."|speech
674|MR. ORANGE|"Shit.  I don't remember that at
all."|speech
675|JEFFREY|I do.|speech
676||(pause)|location
677|JEFFREY|How do I look?|speech
678||"The gun-shot Mr. Orange looks at the kid's GASHED face and
the hole in the side of his head where his ear used to be."|stage direction
679|MR. ORANGE|"I don't know what to tell you
Jeffrey."|speech
680||Jeffrey starts to weep.|stage direction
681|JEFFREY|"That fucking bastard!  That
fucking sick fucking bastard!"|speech
682|MR. ORANGE|"Jeffrey, I need you to hold on.
There's officers positioned and
waiting to move in a block away."|speech
683||(screaming)|location
684|JEFFREY|"What the fuck are they waiting
for?  That motherfucker cut off my
ear!  He slashed my face!  I'm
deformed!"|speech
685|MR. ORANGE|"And I'm dying.  They don't know
that.  All they know is they're
not to make a move until Joe Cabot
shows up.  I was sent undercover
to get Cabot.  You heard 'em, they
said he's on his way.  Don't pussy
out on me now, Jeffrey.  We're
just gonna sit here and bleed
until Joe
Cabot sticks his fuckin head
through that door."|speech
686||CUT TO:|unknown
687||"INSERT: TITLE CARD  ""MR. ORANGE & MR. WHITE"""|stage direction
688||25     INT.  DENNY'S - NIGHT|unknown
689||"A tough-looking black man named HOLDAWAY, who sports a
Malcom X beard, a green Chairman Mao cap with a red star
on it, and a military flack jacket, digs into a Denny
bacon, cheese and avocado burger.  He sits in a booth all
alone.  He's waiting for somebody.  As he waits, he
practically empties an entire bottle of ketchup on his
french fries, not by mistake either--that's just how he
likes it.
We see Mr. Orange, now known as FREDDY NEWENDYKE, wearing
a high school letterman jacket, enter the coffee shop,
spot Holdaway, and head his way.  Holdaway sees Freddy bop
towards him with a wide-ass alligator grin plastered
across his face.
CAMERA DOLLIES FAST down AISLE to MEDIUM SHOT of Holdaway.
We fear Freddy OFF SCREEN."|stage direction
690|FREDDY (O.S.)|"Say ""hello"" to a motherfucker
who's inside.  Cabot's doing a job
and take a big fat guess who he
wants on the team?"|speech
691|HOLDAWAY|"This better not be some Freddy
joke."|speech
692||"LOW ANGLE
looking up at Freddy, who's standing at the table."|stage direction
693|FREDDY|"It ain't no joke, I'm in there.
I'm up his ass."|speech
694||"CU ON HOLDAWAY
Holdaway just looks at his pupil for a moment, then
smiles."|stage direction
695|HOLDAWAY|Congratulations.|speech
696||26     EXT.  DENNY'S - NIGHT|unknown
697||"We see through the window of the restaurant Freddy slide
into the booth across from Holdaway.  Freddy's doing a lot
of talking, but we can't hear what they're saying."|stage direction
698||27     INT.  DENNY'S - NIGHT|unknown
699||"FREEZE FRAME ON HOLDAWAY
We are frozen on a MEDIUM CU of Holdaway listening to
Freddy.  We HEAR RESTAURANT NOISE and Freddy OFF SCREEN."|stage direction
700|FREDDY (O.S.)|"Nice Guy Eddie tells me Joe wants
to meet me.  He says I should just
hang around my apartment and wait
for a phone call.  Well after
waiting three goddamn days by the
fuckin phone, he calls me last
night and says Joe's ready, and
he'll pick me up in fifteen
minutes."|speech
701||"The freeze frame ENDS.  Holdaway comes suddenly up to
speed and says:"|stage direction
702|HOLDAWAY|Woo all picked you up?|speech
703||From here to end we cut back and forth.|stage direction
704|FREDDY|"Nice Guy.  When we got to the
bar..."|speech
705|HOLDAWAY|...What bar?|speech
706|FREDDY|"The Boots and Socks in Gardena.
When we got there, I met Joe and a
guy named Mr. White.  It's a phony
name.  My name's Mr. Orange."|speech
707|HOLDAWAY|"You ever seen this motherfucker
before?"|speech
708|FREDDY|Who, Mr. White?|speech
709|HOLDAWAY|Yeah.|speech
710|FREDDY|"No, he ain't familiar.  He ain't
one of Cabot's soldiers either.
He's gotta be from outta town.
But Joe knows him real well."|speech
711|HOLDAWAY|How can you tell?|speech
712|FREDDY|"The way they talk to each other.
You can tell they're buddies."|speech
713|HOLDAWAY|Did the two of you talk?|speech
714|FREDDY|Me and Mr. White?|speech
715|HOLDAWAY|Yeah.|speech
716|FREDDY|A little.|speech
717|HOLDAWAY|What about?|speech
718|FREDDY|The Brewers.|speech
719|HOLDAWAY|The Milwaukee Brewers?|speech
720|FREDDY|"Yeah.  They had just won the night
before, and he made a killing off
'em."|speech
721|HOLDAWAY|"Well, if this crook's a Brewers
fan, his ass has gotta be from
Wisconsin.  And I'll bet you
everything from a diddle-eyed Joe
to a damned-if-I-know, that in
Milwaukee they got a sheet on this
Mr. White motherfucker's ass.  I
want you to go through the mugs of
guys from old Milwaukee with a
history of armed robbery, and put
a name to that face."|speech
722||Holdaway takes a big bite out of his burger.|stage direction
723||(with his mouth full)|location
724|HOLDAWAY|"What kinds questions did Cabot
ask?"|speech
725|FREDDY|"Where I was from, who I knew, how
I knew Nice Guy, had I done time,
shit like that."|speech
726||"Holdaway's talked enough, he's eating his burger now.  He
motions for Freddy to elaborate."|stage direction
727|FREDDY|"He asked me if I ever done armed
robbery before.  I read him my
credits.  I robbed a few gas and
sips, sold some weed, told him
recently I held the shotgun while
me and another guy pulled down a
poker game in Portland."|speech
728||CAMERA MOVES from a MEDIUM on Freddy to a CU.|stage direction
729|HOLDAWAY (O.S.)|Didja use the commode story?|speech
730|FREDDY|"Fuckin-A.  I tell it real good,
too."|speech
731||28     INT.  MEN'S ROOM - L.A. TRAIN STATION - NIGHT|unknown
732||"Freddy and Holdaway at one of their many rendezvous.
Holdaway wears an extra large Lakers sweatshirt.  Freddy
sits on one of the sinks, wearing his high school jacket,
looking at pieces of paper stapled together."|stage direction
733|FREDDY|What's this?|speech
734|HOLDAWAY|It's a scene.  Memorize it.|speech
735|FREDDY|What?|speech
736|HOLDAWAY|"A undercover cop has got to be
Marlon Brando.  To do this job you
got to be a great actor.  You got
to be naturalistic.  You got to be
naturalistic as hell.  If you
ain't a great actor you're a bad
actor, and bad acting is bull shit
in this job."|speech
737||(referring to the|location
738||papers)|unknown
739|FREDDY|But what is this?|speech
740|HOLDAWAY|"It's a amusing anecdote about a
drug deal."|speech
741|FREDDY|What?|speech
742|HOLDAWAY|"Something funny that happened to
you while you were doing a job."|speech
743|FREDDY|I gotta memorize all this shit?|speech
744|HOLDAWAY|"It's like a joke.  You remember
what's important, and the rest you
make your own.  The only way to
make it your own is to keep sayin
it, and sayin it, and sayin it,
and sayin it, and sayin it."|speech
745|FREDDY|I can do that.|speech
746|HOLDAWAY|"The things you gotta remember are
the details.  It's the details
that sell your story.  Now this
story takes place in this men's
room.  So you gotta know the
details about this men's room.
You gotta know they got a blower
instead of a towel to dry your
hands.  You gotta know the stalls
ain't got no doors.  You gotta
know whether they got liquid or
powdered soap, whether they got
hot water or not, 'cause if you do
your job when you tell your story,
everybody should believe it.  And
if you tell your story to somebody
who's actually taken a piss in
this men's room, and you get one
detail they remember right,
they'll swear by you."|speech
747||29     INT.  FREDDY'S APARTMENT - DAY|unknown
748||"Freddy paces back and forth, in and out of frame,
rehearsing the anecdote.  He's reading it pretty good, but
he's still reading it from the page, and every once in a
while he stumbles over his words."|stage direction
749|FREDDY|"...this was during the Los Angeles
marijuana drought of '86.  I still
had a connection.  Which was
insane, 'cause you couldn't get
weed anyfuckinwhere then.  Anyway,
I had a connection with this
hippie chick up in Santa Cruz.
All and my friends knew it.  And
they'd give me a call and say,
""Hey, Freddy, you buyin some, you
think you could buy me some too?""
They knew I smoked, so they'd ask
me to buy a little for them when I
was buyin.  But it got to be
everytime I bought some weed, I
was buyin for four or five
different people.  Finally I said,
""Fuck this shit.""  I'm makin this
bitch rich.  She didn't have to do
jack shit, she never even had to
meet these people.  I was fuckin
doin all the work.  So I got
together with her and told her,
""Hey, I'm sick of this shit.  I'm
comin through for everybody, and
nobody's comin through for me.
So, either I'm gonna tell all my
friends to find their own source,
or you give me a bunch of weed,
I'll sell it to them, give you the
money, minus ten percent, and I
get my pot for free.""  So, I did
if for awhile..."|speech
750||Freddy exits frame|stage direction
751||"CUT TO:
30     EXT.  PARKING LOT - DAY"|unknown
752||"Another empty frame, except obviously outside.  Freddy
enters frame from the same direction he exited in the
previous scene, finishing his sentence.  When we move to a
wider shot we see Freddy performing his monolog to
Holdaway in a parking lot.  Holdaway sits on the hood of
his beat-up car.  Freddy paces back and forth as he
performs his story."|stage direction
753|FREDDY|"...but then that got to be a pain
in the ass.  People called me on
the phone all the fuckin time.  I
couldn't rent a fuckin tape
without six phone calls
interrupting me.  ""Hey, Freddy,
when's the next time you're gettin
some?""  ""Motherfucker, I'm tryin
to watch 'Lost Boys'-- when I have
some, I'll let you know.""  And
then these rinky-dink pot heads
come by--there's my friends and
everything, but still.  I got all
my shit laid out in sixty dollar
bags.  Well, they don't want sixty
dollars worth.  They want ten
dollars worth.  Breaking it up is
a major fuckin pain in the ass.  I
don't even know how much ten
dollars worth is.  ""Well, fuck,
man, I don't want that much
around.  If I have that much
around I'll smoke it.""  ""Hey, if
you guys can't control your
smokin, that's not my problem.
You motherfuckers been smokin for
five years, be a adult about it.""
Finally I just told my connection,
count me out.  But as it turns
out, I'm the best guy she had, and
she depended alot on my business.
But I was still sick to death of
it.  And she's trying to talk me
into not quitin.
Now this was a very weird
situation, 'cause I don't know if
you remember back in '86, there
was a major fuckin drought.
Nobody and anything.  People were
livin on resin and smokin the wood
in their pipes for months.  And
this chick had a bunch, and was
beggin me to sell it.  So I told
her I wasn't gonna be Joe the Pot
Man anymore.  But I would take a
little bit and sell it to my
close, close, close friends.  She
agreed to that, and said we'd keep
the same arrangement as before,
ten percent and free pot for me,
as long as I helped her out that
weekend.  She had a brick of weed
she was sellin, and she didn't
want to go to the buy alone..."|speech
754||"CUT TO:
31     INT.  BOOTS AND SOCKS BAR - NIGHT"|unknown
755||"Freddy, Joe, Nice Guy Eddie and Mr. White all sit around a
table in a red-lighted smokey bar.  Freddy continues his
story.  The crooks are enjoying the hell out of it."|stage direction
756|FREDDY|"...Her brother usually goes with
her, but he's in county
unexpectedly."|speech
757|MR. WHITE|What for?|speech
