|character|text|type
758|FREDDY|"Traffic tickets gone to warrant.
They stopped him for something,
found the warrants on 'im, took
'im to jail.  She doesn't want to
walk around alone with all that
weed.  Well, I don't wanna do
this, I have a bad feeling about
it, but she keeps askin me, keeps
askin me, finally I said okay
'cause I'm sick of listening to
it.  Well, we're picking this guy
up at the train station."|speech
759|JOE|"You're picking the buyer up at the
train station?  You're carrying
the weed on you?"|speech
760|FREDDY|"Yeah, the guy needed it right
away.  Don't ask me why.  So we
get to the train station, and
we're waitin for the guy.  Now I'm
carrying the weed in one of those
carry-on bags, and I gotta take a
piss.  So I tell the connection
I'll be right back, I'm goin' to
the little boys room..."|speech
761||"CUT TO:
32     INT.  MEN'S ROOM - TRAIN STATION - DAY"|unknown
762||"MEDIUM ON FREDDY
He walks through the door with a carry-on bag over his
shoulder.  Once he's inside, he stops in his tracks.  We
move into a CU."|stage direction
763|FREDDY (V.O.)|"...So I walk into the men's room,
and who's standing there?"|speech
764||"FREEZE FRAME
on Freddy standing in front of six Los Angeles County
Sheriffs and one German Shepherd.  All of their eyes are
on Freddy.  Everyone is frozen."|stage direction
765|FREDDY (V.O.)|"...six Los Angeles County Sheriffs
and a German Shepherd."|speech
766|NICE GUY EDDIE (V.O.)|They were waiting for you?|speech
767|FREDDY (V.O.)|"No.  They were just a bunch of
cops hangin out in the men's room,
talkin.  When I walked through the
door they all stopped what they
were talking about and looked at
me."|speech
768||33     BACK TO BAR|unknown
769||ECU MR. WHITE|stage direction
770|MR. WHITE|"That's hard, man.  That's a fuckin
hard situation."|speech
771||34     BACK TO MEN'S ROOM|unknown
772||"ECU GERMAN SHEPHERD
barking his head off."|stage direction
773|FREDDY (V.O.)|"The German Shepherd starts
barkin'.  He's barkin' at me.  I
mean it's obvious he's barkin' at
me."|speech
774||"We do a slow 360 around Freddy in the men's room.  We can
hear the dog barking."|stage direction
775|FREDDY (V.O.)|"Every nerve ending, all of my
senses, the blood in my veins,
everything I has was screaming,
""Take off, man, just take off, get
the fuck outta there!""  Panic hit
me like a bucket of water.  First
there was the shock of it--BAM,
right in the face!  Then I'm just
standin there drenched in panic."|speech
776||"SLOW MOTION
CAMERA does a PAN from face to face of the sheriffs."|stage direction
777|FREDDY (V.O.)|"And all those sheriffs are lookin
at me and they know. They can
smell it.  As sure as that fuckin
dog cam, they can smell it on me."|speech
778||"FREEZE FRAME
Back to the same freeze frame shot of Freddy standing in
front of the sheriffs.  It suddenly jerks to life, and
moves to speed.  The dog is barking.  Freddy moves to his
right, out of frame.  We stay on the sheriffs.  One
sheriff yells at the dog."|stage direction
779|SHERIFF #1|Shut up!|speech
780||"The dog quiets down.  Sheriff #2 continues with his story.
A couple of the sheriffs look over at Freddy off screen,
but as Sheriff #2 talks, turn their attention to him."|stage direction
781|SHERIFF #2|"So my gun's drawn, right?  I got
it aimed right at him.  I tell
'em, ""Freeze, don't fuckin move.""
And the little idiot's lookin at
me, nodding his head ""Yes,"" sayin
""I know...I know...I know.""
Meanwhile his right hand is
creepin towards his glove box.  So
I scream at him, ""Asshole, you
better fuckin freeze right now!""
And he's still lookin right at me,
saying
""I know...I know...I know.""  And
his right hand's still going for
the glove box."|speech
782||"The CAMERA PANS away from the sheriffs to Freddy, up
against the urinal, playing possum, pretending to piss."|stage direction
783|SHERIFF #2 (O.S.)|"I tell 'im, ""Buddy, I'm gonna
shoot you in the face right now if
you don't put your hands on the
fuckin dash.""  And the guy's
girlfriend, a real sexy Oriental
bitch, starts screamin at him,
""Chuck, are you out of your mind?
Put your hands on the dash like
the officer said.""  And then like
nothing, the guy snaps out of it
and casually puts his hands on the
dash."|speech
784||"Freddy finishes his playing possum piss, and walks past
the sheriffs over to the sink.  The CAMERA PANS with him.
A sheriff is sitting on a sink.  He looks down and watches
Freddy wash his hands."|stage direction
785|SHERIFF #1|What was he goin for?|speech
786|SHERIFF #2|"His registration.  Stupid fuckin
citizen, doesn't have the
slightest idea how close he came
to gettin shot."|speech
787||"Freddy finishes washing his hands.  He goes to dry them,
but there's only those hand drying machines.  Freddy turns
on the drying machine.  He can't hear anything the
sheriffs say now.  The sound of the machine dominates the
sound track.
These following shots are SLOW MOTION.
CU OF FREDDY
CU of his HANDS, rubbing each other getting blown dry
SHOT OF SHERIFFS talking.  We can't hear them because of
the machine.
CU OF MACHINE
MEDIUM OF SHERIFF ON SINK, smoking a cigarette, glancing
over at Freddy.
CU OF GERMAN SHEPHERD
Machine turns off."|stage direction
788||"CUT TO:
35     INT. OFFICE - DAY"|unknown
789||CU MUG SHOT OF MR. WHITE|stage direction
790|FREDDY (OS)|That's him, that's Mr. White.|speech
791||"FULL SCENE
An office upstairs in the undercover division of the
police station.
TWO SHOT OF FREDDY AND HOLDAWAY
look at mug shot."|stage direction
792|HOLDAWAY|"Lawrence Dimick.  Let's see what
we got on him."|speech
793||"CU OF COMPUTER SCREEN
the name DIMICK, LAWRENCE is typed in.
C.U. ENTER BUTTON IS PRESSED
C.U. OF FEMALE COMPUTER OPERATOR, JODIE SEIGEL."|stage direction
794|JODIE|"This is your life, Lawrence
Dimick!"|speech
795||"C.U. OF COMPUTER PRINTER
printing out sheet.  The noise of the printer plays loud
over the soundtrack. Jodie's hand comes into FRAME and
tears sheet from the printer."|stage direction
796||"CUT TO:
36     INT. HOLDAWAY'S OFFICE - DAY"|unknown
797||"Holdaway sits behind his desk.  Freddy sits on the edge of
the desk eating a Double-Double with cheese.  They look
into the CAMERA.
We hear Jodie's voice OFFSCREEN."|stage direction
798|JODIE (OS)|"Lawrence ""Larry"" Dimick.  Also
known as Lawrence Jacobs and Alvin
""Al"" Jacobs.  This guy is Mr. Joe-
Armed-Robbery.  He's
a pro and he makes it a habit not
to get caught."|speech
799||"MEDIUM SHOT OF JODIE
DOLLY slowly into C.U."|stage direction
800|JODIE|"He's only been convicted twice,
which is pretty good for somebody
living a life of crime.  Once for
armed robbery, when he was twenty-
one, in Milwaukee."|speech
801||C.U. FREDDY|stage direction
802|FREDDY|What was it?|speech
803||JODIE|stage direction
804|JODIE|"Payroll office at a lumber yard.
First offense - he got eighteen
months.  He didn't get busted
again until he was thirty-two.
And then it was a backdoor bust.
A routine vice squad roust.  They
roust this bar, out buddy Lawrence
is in there knocking down a few.
He gets picked up.  He's wearing
on his person an outlaw .45
automatic, apparently his weapon
of choice.  Also, on his finger is
a diamond ring from a jewelry
store robbery a year earlier.  He
got two years back inside for
that."|speech
805||"TWO SHOT OF HOLDAWAY AND FREDDY
Freddy winces."|stage direction
806|FREDDY|Goddamn, that's hard time.|speech
807||JODIE|stage direction
808|JODIE|"So far, it's the only time he's
ever done."|speech
809||CU HOLDAWAY|stage direction
810|HOLDAWAY|"Was this vice squad bullshit in
Milwaukee?"|speech
811||JODIE|stage direction
812|JODIE|"No.  The vice squad roust was in
L.A.  He's been in Los Angeles
since '77."|speech
813||"DOLLY BEHIND HOLDAWAY'S DESK
from left to right."|stage direction
814|FREDDY|When did he do this time?|speech
815|JODIE|"Back in '83, got out late '86.  I
found something else out I think
you two should be aware of.
About a year and a half ago, up in
Sacramento, an undercover cop,
John Dolenz, worked his way into a
bank job.  Apparently before the
job they found out he was a cop.
Now picture this:  It's Dolenz's
birthday, a bunch of cops are
waiting in his apartment for a
surprise party.  The door opens,
everyone yells ""Surprise!"", and
standing in the doorway is Dolenz
and this other guy sticking a gun
in Dolenz's ribs.  Before anybody
knows what's going on, this
stranger shoots Dolenz dead and
starts firing two .45 automatics
into the crowd."|speech
816|HOLDAWAY|What happened?|speech
817||The DOLLY moves behind Jodie.|stage direction
818|JODIE|"It was a mess.  Cops got hit,
wives got hit, girlfriends got
hit, his dog got hit.  People got
glass in their faces.  Three were
killed, six were wounded."|speech
819|FREDDY|"They couldn't pin the killing on
one of the bank robbers?"|speech
820|JODIE|"They tried, but they didn't have a
positive I.D. and all those guys
had alibis.  Besides, we really
didn't have anything on them.  We
had the testimony of a dead man
that they were talking
about committing a robbery.  They
never went ahead with the bank
job."|speech
821||The DOLLY completes its circle.|stage direction
822|FREDDY|"And Larry Dimick was one of the
boys?"|speech
823|JODIE|He was probably the one.|speech
824||ON HOLDAWAY|stage direction
825|HOLDAWAY|"Just how sure are you with your
cover?"|speech
826||PAN to C.U. on Freddy.|stage direction
827|FREDDY|"Today they may know something,
tomorrow they may know something
else.  But yesterday they didn't
know anything."|speech
828||C.U. OF MR. WHITE'S MUG SHOT|stage direction
829|FREDDY (OS)|What's the next step?|speech
830|HOLDAWAY (OS)|"Do what they told ya.  Sit in your
apartment and wait for 'em to call
you.  We'll have guys posted
outside who'll follow you when
they pick you up."|speech
831||35     INT.  FREDDY'S APARTMENT - DAY|unknown
832||"C.U. TELEPHONE
It RINGS.  Freddy answers it, we FOLLOW the receiver up to
his face."|stage direction
833|FREDDY|Hello.|speech
834||(through phone)|location
835|NICE GUY EDDIE (OS)|It's time.  Grab your jacket--|speech
836||36     INT. NICE GUY EDDIE'S CAR (PARKED) - DAY|unknown
837||C.U. of Nice Guy Eddie speaking into the car phone.|stage direction
838|EDDIE|--We're parked outside.|speech
839||(through phone)|location
840|FREDDY (OS)|I'll be right down.|speech
841||"We hear the CLICK of Freddy hanging up through the phone.
Nice Guy places the receiver back in its cradle."|stage direction
842|EDDIE|He'll be right down.|speech
843||39     INT. FREDDY'S APARTMENT - DAY|unknown
844||"The CAMERA follows Freddy as he hops around the
apartment getting everything he needs.  He puts on
his jacket and slips on some sneakers.
DOLLY fast toward the front door knob.  Freddy's hand
comes into FRAME, grabs the knob, then lets go.  We MOVE
UP to his face.
Fear."|stage direction
845||(to himself)|location
846|FREDDY|"Don't pussy out on me now.  They
don't know.  They don't know shit."|speech
847||(pause)|location
848|FREDDY|"You're not gonna get hurt.  You're
fucking Baretta and they believe
every word, cuz
you're super cool."|speech
849||"He exits FRAME. We stay put and hear the door open and
close OFF SCREEN."|stage direction
850||40     EXT. FREDDY'S APARTMENT - DAY|unknown
851||"COPS' POV
From inside an unmarked car across the street, the TWO
COPS watching Freddy see him walk out of his building and
up to Eddie's parked car."|stage direction
852|COP #1 (OS)|There goes our boy.|speech
853|COP #2 (OS)|"I swear, a guy has to have rocks
in his head the size of Gibraltar
to work undercover."|speech
854|COP #1 (OS)|Do you want one of these?|speech
855|COP #2 (OS)|Yeah, gimme the bear claw.|speech
856||"Freddy gets into the car and it pulls into traffic.
Cop #1 starts the engine and follows."|stage direction
857||41     INT. NICE GUY EDDIE'S CAR (MOVING) - DAY|unknown
858||"Nice Guy Eddie is behind the wheel.  Mr. Pink is
in the passenger seat.  Freddy and Mr. White are in the
backseat together."|stage direction
859|MR. PINK|"...Hey, I know what I'm talkin
about, black women ain't the same
as white women."|speech
860||(sarcastically)|location
861|MR. WHITE|There's a slight difference.|speech
862||The car laughs.|stage direction
863|MR. PINK|"Go ahead and laugh, you know what
I mean.  What a while bitch will
put up with, a black bitch won't
put up with for a minute.  They
got a line, and if you cross it,
they fuck you up."|speech
864|EDDIE|"I gotta go along with Mr. Pink on
this.  I've seen it happen."|speech
865|MR. WHITE|"Okay, Mr. Expert. If this is such
a truism, how come every nigger I
know treats his woman like a piece
of shit?"|speech
866|MR. PINK|"I'll make you a bet that those
same damn niggers who were showin
their ass in public, when their
bitches get 'em home, they chill
the fuck out."|speech
867|MR. WHITE|Not these guys.|speech
868|MR. PINK|Yeah, those guys too.|speech
869|EDDIE|"Let me tell you guys a story.  In
one of daddy's clubs there was
this black cocktail waitress named
Elois."|speech
870|MR. WHITE|Elois?|speech
871|EDDIE|"Yeah, Elois. E and Lois.  We
called her Lady E."|speech
872|MR. WHITE|Where was she from, Compton?|speech
873|EDDIE|No.  She was from Ladora Heights.|speech
874|MR. PINK|"The black Beverly Hills.  I knew
this lady from Ladora Heights
once."|speech
875||(in a stuck up black|location
876||female voice)|unknown
877|MR. PINK|"""Hi, I'm from Ladora Heights, it's
the black Beverly Hills."""|speech
878|EDDIE|"It's not the black Beverly Hills,
it's the black Palos Verdes.
Anyway, this chick, Elois, was a
man-eater-upper.  I bet every guy
who's ever met her has jacked off
to her at least once.  You know
who she looked like?  Christie
Love.  'Member that TV show ""Get
Christie Love""?  She was a black
female cop.  She always used to
say ""You're under arrest, sugar."""|speech
879|MR. PINK|"I was in the sixth grade when that
show was on.  I totally dug it.
What the fuck was the name of the
chick who played Christie
Love?"|speech
880|EDDIE|Pam Grier.|speech
881|MR. PINK|"No, it wasn't Pan Grier, Pan Grier
was the other one.  Pan Grier made
the movies.  Christie Love was
like a Pam Grier TV show, without
Pam Grier."|speech
882|MR. PINK|"What the fuck was that chick's
name?  Oh this is just great, I'm
totally fuckin tortured now."|speech
883|EDDIE|"Well, whoever she was, Elois
looked like her.  So one night I
walk into the club, and no Elois.
Now the bartender was a wetback,
he was a friend of mine, his name
was Carlos.
So I asked him ""Hey, Carlos,
where's Lady E tonight?""  Well
apparently Lady E was married to
this real piece of dog shit.  I
mean a real animal.  And
apparently he would so things to
her."|speech
884|FREDDY|"Do things?  What would he do?  You
mean like beat her up?"|speech
885|EDDIE|"Nobody knows for sure what he did.
We just know he did something.
Anyway, Elois plays it real cool.
And waits for the next time this
bag of shit gets drunk.  So one
night the guy gets drunk and
passes out on the couch.  So while
the guy's
inebriated, she strips him naked.
Then she takes some crazy glue and
glues his dick to his belly."|speech
886||The car reacts to how horrible that would be.|stage direction
887|EDDIE|"I'm dead fuckin serious.  She put
some on his dick and some on his
belly, then stuck 'em together.
The paramedics had to come and cut
it loose."|speech
888||The car reacts badly.|stage direction
889|MR. WHITE|Jesus Christ!|speech
890|FREDDY|"You can do some crazy things with
it."|speech
891|EDDIE|"I don't know what he did to her,
but she got even."|speech
892|MR. WHITE|Was he all pissed off?|speech
893|MR. PINK|"How would you feel if you had to
do a handstand every time you took
a piss."|speech
894||The car laughs.|stage direction
895||42     EXT. WAREHOUSE - DAY|unknown
896||"Nice Guy Eddie pulls up outside the warehouse.
The four men climb out of the car and follow Eddie inside."|stage direction
897||43     INT. WAREHOUSE - DAY|unknown
898||"The four men enter the building.
At the other end of the warehouse, sitting in chairs, are
Mr. Blonde, Mr. Brown, Mr. Blue and Joe Cabot.
We shoot this from OVERHEAD, looking down on the men."|stage direction
899||(to everybody)|location
900|JOE|"...So they're talkin about how
they get their wives off, and the
French guys says:"|speech
901||(in a bad French|unknown
902||accent)|location
903|JOE|"""All I gotta do is take my pinky
and tickle my Fifi's little oo la
la  and she rises a foot off the
bed."""|speech
904||Back to Joe.|stage direction
905|JOE|So the dago says:|speech
906||CU ON JOE|stage direction
907||"(in a good Brooklyn
accent)"|unknown
908|JOE|"""That's nothin.  When I take the
tip of my tongue and wiggle it
against my Mary Louise's little
fun pimple, she rises two feet off
da bed.""  Then our friend from
Poland says:"|speech
909||(in dumb voice)|location
910|JOE|"""You guys ain't no cocksmen. When
I get through fuckin my Sophie, I
wipe my dick on the curtains and
you know what?  She hits the
roof!"""|speech
911||Joe laughs like a crazy man.|stage direction
912|JOE|Ha, ha, ha, ha, ha, ha!|speech
913||We hear a lot of laughing OFF SCREEN.|stage direction
914|JOE|"Ain't that a masterpiece?  Stupid
fuckin Polack, wipes his dick on
the drapes."|speech
915||Joe's eyes greet the new arrivals.|stage direction
916|JOE|You're here, great!|speech
917||"Joe EXITS C.U.
We now have everybody from the Uncle Bob's Pancake House
scene together again.  Some sit on folding chairs, some
stand.  Joe sits in front of them on the edge of a table.
A blackboard with a layout of the jewelry store is off to
the right.
We do a 360 around the men."|stage direction
918|EDDIE|"We woulda gotten here sooner, but
we got backed up around La Brea
and Pico."|speech
919|JOE|No hurry.|speech
920||(to the boys)|location
921|JOE|"All right, let's get to know one
another.  With the exception of
Eddie and myself, who you already
know, you'll be using aliases.
Under no circumstances are you to
tell one another your real name or
anything else about yourself.
That includes where you're from,
your wife's name, where you
might've done time, about a bank
in St. Petersburg you might've
robbed.  You guys don't say shit
about who you are, where you been
or what you've done.  Only thing
you guys can talk about is what
you're going to do.  This way the
only ones who know who the members
of the team are are Eddie and
myself.  And that's the way I like
it.  Because in the unlikely event
of one of you getting apprehended
by the cops, not that I expect
that to happen - it most
definitely should not happen - it
hasn't happened, you don't have
anything to deal with.  You don't
know any names.  You know my name,
you know Eddie's name.  That I
don't care about.  You gotta prove
it.  I ain't worried.  Besides,
this way you gotta trust me.  I
like that.  I set this up and
picked the men I wanted for it.
None of you came to me, I
approached all of you.  I know
you.  I know your work, I know
your reputation.  I know you as
men.  Except for this guy."|speech
922||"Joe points a finger at Freddy.
Freddy shits a brick."|stage direction
923|JOE|"But he's OK.  If he wasn't OK, he
wouldn't be here.  Okay, let me
introduce everybody to everybody.
But once again, at the risk of
being redundant, if I even think I
hear somebody telling or referring
to somebody by their Christian
name..."|speech
924||(Joe searches for the|location
925||right words)|unknown
926|JOE|"...you won't want to be you.
Okay, quickly."|speech
927||(pointing at the men|location
928||"as he gives them a
name)"|unknown
929|JOE|"Mr. Brown, Mr. White, Mr. Blonde,
Mr. Blue, Mr. Orange, and Mr.
Pink."|speech
930|MR. PINK|Why am I Mr. Pink?|speech
931|JOE|Cause you're a faggot.|speech
932||Everybody laughs.|stage direction
933|MR. PINK|"Why can't we pick out our own
colors?"|speech
934|JOE|"I tried that once, it don't work.
You get four guys fighting over
who's gonna be Mr. Black.  Since
nobody knows anybody else, nobody
wants to back down.  So forget it,
I pick.  Be thankful you're not
Mr. Yellow."|speech
935|MR. BROWN|"Yeah, but Mr. Brown?  That's too
close to Mr. Shit."|speech
936||Everybody laughs.|stage direction
937|MR. PINK|"Yeah, Mr. Pink sounds like Mr.
Pussy.  Tell you what, let me be
Mr. Purple.  That sounds good to
me, I'm Mr. Purple."|speech
938|JOE|"You're not Mr. Purple, somebody
from another job's Mr. Purple.
You're Mr. Pink."|speech
939|MR. WHITE|"Who cares what your name is?  Who
cares if you're Mr. Pink, Mr.
Purple, Mr. Pussy, Mr. Piss..."|speech
940|MR. PINK|"Oh that's really easy for you to
say, you're Mr. White.  You gotta
cool-sounding name.  So tell me,
Mr. White, if you think ""Mr. Pink""
is no big deal, you wanna trade?"|speech
941|JOE|"Nobody's trading with anybody!
Look, this ain't a goddamn fuckin
city counsel meeting!  Listen up
Mr. Pink.  We got two ways here,
my way or the highway.  And you
can go down either of 'em.  So
what's it gonna be, Mr. Pink?"|speech
942|MR. PINK|"Jesus Christ, Joe.  Fuckin forget
it.  This is beneath me.  I'm Mr.
Pink, let's move on."|speech
943||"CAMERA leaves the team and goes to the blackboard
with the layout of the jewelry store on it."|stage direction
944|JOE (OS)|Okay fellas, let's get into this.|speech
945||"CUT TO:
44     EXT. BLEACHERS - DAY"|unknown
946||"Freddy and Holdaway sit on some bleachers in an empty
little league baseball field."|stage direction
947|HOLDAWAY|"Okay, we're gonna station men
across the street from Karina's
Fine Jewelry.  But their orders
will be not to move in unless the
robbery gets out of control.  You
gotta make sure they don't have to
move in.  You're inside to make
sure that everything goes
according to Hoyle.  We have men
set up a block away from the
warehouse rendezvous.  They got
complete visibility of the
exterior.  So as soon as Joe Cabot
shows up, we'll see it."|speech
948|FREDDY|"What's your visibility of the
interior?"|speech
949|HOLDAWAY|"We can't see shit on the inside.
And we can't risk gettin any
closer for fear they'll spot us."|speech
950|FREDDY|"This is bullshit, Jim.  I get all
the fuckin danger of having you
guys in my back pocket but none of
the safety."|speech
951|HOLDAWAY|"What's the matter, Newendyke?  Job
too tough for ya?  No one lied to
you.  You always knew we'd hang
back until Joe Cabot showed up."|speech
952|FREDDY|"Oh this is great.  You ain't
giving me no fuckin protection
whatsoever.  But you are giving me
an attitude."|speech
953|HOLDAWAY|"Since when does an undercover cop
have protection?  Freddy, you came
into this thing with your eyes
wide open, so don't start screamin
blind man now.  I understand
you're nervous.  I wish the
warehouse had more visible
windows, but it doesn't.  We have
to make do with the cards we're
dealt."|speech
954|FREDDY|"I didn't say I wasn't gonna do it.
I'm just remarking on how shitty
the situation is!"|speech
955|HOLDAWAY|"I don't mean to be harsh with ya,
but I've found tough love works
best in these situations.  We have
to get Joe Cabot in the company of
the thieves and in the same
vicinity as the loot.
We don't care about these other
bastards.  We're willing to offer
them good deals to testify against
Cabot."|speech
956|FREDDY|Isn't this risk unorthodox?|speech
957|HOLDAWAY|What?|speech
958|FREDDY|"Letting them go ahead with the
robbery?"|speech
959|HOLDAWAY|"The whole idea behind this
operation is to catch Joe Cabot
red-handed.  We bust these hired
hands, we ain't accomplished shit.
Letting them go through with the
heist is a risk, but Cabot's jobs
are very clean.  We got people
surrounding the perimeter.  We got
a guy and a gal on the inside
posing as a couple shopping for
rings.  We could replace the
employees with cops, but we'd run
the risk of tipping 'em off."|speech
960|FREDDY|"That's out.  They know the faces
of who works what shift."|speech
961|HOLDAWAY|"These guys are professionals.
We're professionals.  It's a risk,
but I think it's a calculated
risk."|speech
962||45     EXT. KARINA'S FINE JEWELRY - DAY|unknown
963||"We see MOS SHOTS of the outside of the jewelry store.
CUSTOMERS coming and going.  STORE CLERKS waiting on
customers through the windows.
While we look at this we HEAR over the soundtrack Mr.
White and Freddy talking OFF SCREEN."|stage direction
964|MR. WHITE (VO)|Let's go over it.  Where are you?|speech
965|FREDDY (VO)|"I stand outside and guard the
door.  I don't let anybody come in
or go out."|speech
966|MR. WHITE (VO)|Mr. Brown?|speech
967|FREDDY (VO)|"Mr. Brown stays in the car.  He's
parked across the street till I
give him the signal, then he pulls
up in front of the store."|speech
968|MR. WHITE (VO)|Mr. Blonde and Mr. Blue?|speech
969|FREDDY (VO)|"Crowd control.  They handle
customers and employees in the
display area."|speech
970||46     INT. MR. WHITE'S CAR (PARKED) - DAY|unknown
971||"Mr. White and Freddy sit in a car parked across the street
from the jewelry store, staking it out."|stage direction
972|MR. WHITE|Myself and Mr. Pink?|speech
973|FREDDY|"You two take the manager in the
back and make him give you the
diamonds.  We're there for those
stones, period.  Since no display
cases are being fucked with, no
alarms should go off.  We're out
of there in two minutes, not one
second longer.  What if the
manager won't give up the
diamonds?"|speech
