|character|text|type
605||"Linda catches Matt's eye. Gives him a look. ""You coming
over?"" Matt nods, ""yes"", imperceptible to everyone but
Linda. She smiles.
DISSOLVE TO:"|stage direction
606||INT. LABORATORY - NIGHT|location
607||Deserted and dark.|stage direction
608||INT. OBSERVATION ROOM - NIGHT|location
609||"Late. Sarah rubs her temples. Her eyelids are heavy.
She's having real trouble staying awake. The buzzing
fluorescent light isn't helping either."|stage direction
610||INT. RECOVERY ROOM - NIGHT|location
611||"The sheets ruffle and the indentation disappears from the
bed. We can hear breathing and soft sound of bare feet
shuffling against linoleum.
CAMERA SLOWLY PANS toward the door, as if we, are
following someone walking.
The door handle turns and the door pushes open."|stage direction
612||INT. HALLWAY OF HABITATS - NIGHT|location
613||"WE SLOWLY TRACK DOWN the Hallway of the Habitats. We hear
the sounds of sleeping creatures. A couple of them growl
at something unseen. The growling follows the invisible
something as it passes by."|stage direction
614||INT. LABORATORY - NIGHT|location
615||"The laboratory door opens and shuts again. Ghostly. We
see papers shuffling at one of the work stations. A glass
moves slightly."|stage direction
616||INT. OBSERVATION ROOM - NIGHT|location
617||"Sarah reclines in her chair. Fast asleep, Behind her is
the glass wall, revealing the empty hallway behind it.
But a small portion of the glass fogs, as if someone had
just breathed on it. As the fogged part quickly clears,
we see the door to the observation room quietly open.
ON SARAH, still sleeping. We hear a whisper."|stage direction
618||(whispering)|location
619|SEBASTIAN'S VOICE|Sarah. Are you awake?|speech
620||Her heavy breathing mixes with Sebastian's.|stage direction
621||(barely audible)|location
622|SEBASTIAN'S VOICE (cont'd)|Hmm.|speech
623||"Sarah's hair moves slightly, as if a hand were running
through it. And then we see her shirt move, like fingers
were tracing over it. Down from the shoulder to her
breast. Around her nipple. Sarah moans slightly, as if
she were dreaming, but she doesn't stir. And then her
breasts cup slightly, as if they were being touched...
softly... gently. Her breathing becomes harder, more
labored, erotic... and then she... BOLTS AWAKE. Bar eyes
wide with fear. She jumps and cups her own breasts and
looks around the room. It's empty, of course. She jumps
over to the monitor and checks on Sebastian's room. The
heat signature isn't there."|stage direction
624|SARAH|"Dr. Caine! Goddamnit, Dr. Caine! Are
you in here?"|speech
625||"She listens. It's silent. She tries holding her breath,
listening for his breathing. But there's nothing.
Sarah reaches over to a microphone. Hits a few switches."|stage direction
626|SARAH (cont'd)|Dr. Caine?|speech
627||"VARIOUS SHOTS OF THE COMPOUND
- LABORATORY"|stage direction
628|SARAH (V.0.,LOUDSPEAKER)|Dr. Caine, please report in.|speech
629||- HALLWAY OF HABITATS|stage direction
630|SARAH (V.0.,LOUDSPEAKER)|Dr. Caine, report in please!|speech
631||INT. OBSERVATION BOOTH - CONTINUOUS|location
632||Sarah waits. No response.|stage direction
633|SARAH|Shit.|speech
634||She looks around the room. He must be in here.|stage direction
635|SARAH (cont'd)|"Dr. Caine? Sebastian? Come on, this
isn't funny. I know you're in here."|speech
636||"Nothing. No response. Sarah waves her hand around,
reaching out, trying to find him. After a few beats she
stops and rubs her head."|stage direction
637|SARAH (cont'd)|I must be going crazy.|speech
638||"Suddenly, Sarah gets an idea. She quickly exits the
observation room."|stage direction
639||EXT. CORRIDOR - NIGHT|location
640||"At a wall storage box, she removes a pair of Thermal
Goggles and slips them on."|stage direction
641||INT. OBSERVATION ROOM - NIGHT|location
642||"Sarah enters wearing the thermals. She scans the room.
THERMAL POV - The room is empty.
She pulls the goggles off in frustration, and when she
glances over at the video screen, she sees Sebastian's
thermal image lying on the bed in the recovery room.
Sarah sinks into her chair, a tad disconcerted."|stage direction
643||INT. OBSERVATION ROOM - MORNING|location
644||Linda and Matt finish listening to Sarah's story.|stage direction
645|SARAH|"I found him later in the lab, running
samples."|speech
646|LINDA|Why didn't you call me?|speech
647|SARAH|"Because I wasn't sure. I'm still not.
I mean, I could've easily been
dreaming."|speech
648|MATT|"It doesn't sound like something
Sebastian would do."|speech
649|SARAH|God, I feel so stupid.|speech
650|LINDA|I can talk to him.|speech
651|SARAH|No. I mean...|speech
652||(she torn, unsure of herself)|location
653|SARAH|"It was probably nothing. I
shouldn't've mentioned it."|speech
654|MATT|You sure?|speech
655|SARAH|"Yeah, I'm sure. I mean, y'know, why
would he do that, right? Just, this
place at night can be kinda creepy,
y'know."|speech
656||INT. RESEARCH LAB - DAY|location
657||"Sebastian, wearing surgical scrubs sits in an examination
chair. Wire leads sprout from the electrodes covering his
head and arms. The electrodes seem to outline his body."|stage direction
658|MATT|So, how was your first night?|speech
659|SEBASTIAN'S VOICE|"Restless. Hard to sleep when you can't
close your eyes."|speech
660||"As Sebastian talks, we can see the electrodes around his
jaw pump up and down."|stage direction
661|MATT|Yeah? What'd you do?|speech
662|SEBASTIAN'S VOICE|"Got up a couple of times. Knocked
about."|speech
663|MATT|"Yeah, Sarah mentioned you weren't in
your cubicle. She said she called you
over the intercom and you didn't
respond."|speech
664|SEBASTIAN|"I guess I didn't hear. I had the radio
on."|speech
665|MATT|"It'd be helpful to us if you'd tell
whoever's on duty where you're going
to. I mean, if something were to
happen, we'd want to know where to
find you."|speech
666|SEBASTIAN|I didn't think it was a problem.|speech
667|MATT|"It isn't. I just don't want it to
become one."|speech
668||Machines pump out EEG, EKG readouts. Matt studies them.|stage direction
669|MATT (cont'd)|Readings are normal.|speech
670|SEBASTIAN'S VOICE|"Next I want to run a VV and UVF
analysis of the platelets."|speech
671|MATT|We'll have to draw some more blood.|speech
672||"CUT TO:
Sarah rolls up Sebastian's sleeve, revealing empty air.
She wraps a bungee cord around the nothing, pulls it
tight and sprays the inside of his elbow with dye. She
acts very self conscious."|stage direction
673|SEBASTIAN'S VOICE|You okay?|speech
674|SARAH|Yeah. Why?|speech
675|SEBASTIAN|You just seem a little nervous.|speech
676|SARAH|"No. I...I'm fine. Hold still. This
might hurt a bit."|speech
677||"The surface of his skin sheens in the light as Linda
searches for a vein. She slaps his arm several times,
then plunges a hypodermic needle into his skin. His skin
bends and gives. The needle remains in sight after it
slips through the visible surface. Sarah presses down on
the hypo plunger, releasing a dye into his bloodstream."|stage direction
678|SARAH (cont'd)|"Dr. Caine... this might sounds stupid,
but are you... are you looking at me."|speech
679||"The red dye twists into a long snaking red tube up and
down his arm. His vein."|stage direction
680|SEBASTIAN'S VOICE|No. I was looking at the clock. Why?|speech
681||"Sarah draws the plunger back, sucking Sebastian's blood
into the hypodermic and then yanks the needle out."|stage direction
682|SARAH|"Just felt like someone was staring at
me."|speech
683||"Sarah pulls the vial off the needle and labels it with a
grease pencil. After a few beats the red dye in
Sebastian's blood stream dissolves and disappears, as
does the liquid in the vial.
TESTING MONTAGE"|stage direction
684||INT. MRI ROOM|location
685||"MATT slides Sebastian's sheet covered frame into an MRI.
Even though his head is not visible, it shown up on the
MRI scanner."|stage direction
686||INT. MAIN LABORATORY|location
687||"CARTER and SARAH lower a harness into a water tank.
SEBASTIAN'S BODY displaces the water, revealing an empty
body shaped cavity in the water."|stage direction
688||INT. OBSERVATION ROOM|location
689||"CARTER sips a BIG GULP and stares at a monitor which
shows two eat signatures in the Recovery Chamber, huddled
over a chess game."|stage direction
690||INT. RECOVER CHAMBER|location
691||"on a chessboard... A BLACK KNIGHT takes WHITE BISHOP,
seemingly all by itself.
Across the table, Matt leans back and topples his WHITE
KING acknowledging defeat."|stage direction
692||INT. SPECTRAL LAB|location
693||"Dim lights. Janice and Frank both don eye guards. Frank
switches on a low intensity laser on and it's beam shoots
across the room. The beam distorts slightly in the center
of the room. As Frank widens the spectral pattern,
suddenly the beam splits into a million different
spectral rainbows, momentary illuminating Sebastian's
entire frame in a glowing tingle of light."|stage direction
694||INT. MAIN LABORATORY|location
695||"LINDA pulls vials from the cyclotrons and props blood
sample slides. She slips them under the microscope. She
takes a sip of her Diet Coke and puts it on the table.
She pears into the microscope and analyses the blood
sample, squeezing more stain onto it. She looks up to
make notations, but when she reaches for her Diet Coke IT
ISN'T THERE. She looks around. It's on the other side of
her microscope. She shrugs it off, she takes a sip and
sets it down where it was before. She peers into the
microscope again and when she looks up... the Diet Coke
is gone. She looks around the room and sees it on another
table completely."|stage direction
696|LINDA|Sebastian? Goddamnit.|speech
697||We hear Sebastian's laughter echo in the room.|stage direction
698|SEBASTIAN'S VOICE|"You've no idea how much fun I've had.
I'm going to hate going back."|speech
699|LINDA|That's what worries me.?|speech
700|SEBASTIAN'S VOICE|How so?|speech
701|LINDA|"What happens when we turn the project
over to the Army. Ever wonder how much
fun they're gonna have?"|speech
702|SEBASTIAN'S VOICE|"Maybe we won't give it to them. His
voice comes from behind her now."|speech
703||"We see indentations on her shoulders where his fingers
press down."|stage direction
704|SEBASTIAN'S VOICE (cont'd)|"I was thinking... tonight's my last
night. Ever fantasize about making
love to an invisible man?"|speech
705||Linda pulls away from him.|stage direction
706|LINDA|Stop it, Sebastian. It's not funny.|speech
707|SEBASTIAN'S VOICE|"Well, don't do it for me. Do it for
science."|speech
708||Linda walks away. Sebastian laughs.|stage direction
709|LINDA|Grow up.|speech
710|SEBASTIAN'S VOICE|Oh well. Missed your big chance.|speech
711|LINDA|Got some sleep. Big day tomorrow.|speech
712||INT. LABORATORY - DAY|location
713||"A bevy of activity below us as the scientists prepare.
Matt slides the antigen cocktail into the centrifuge and
starts it spinning.
A sheet drapes over a Sebastian's frame, straps across
his limbs. He is fully wired.
Linda looks up to the observation booth."|stage direction
714|LINDA|Recording?|speech
715||"Frank peers down at her from the booth, his voice echoing
through the chamber."|stage direction
716|FRANK|"Recording. Subject Doctor Sebastian
Caine. Currently in phase shift...
Three days, seven hours."|speech
717|LINDA|"De-Phase protocol. Injecting Serial
Protein Caine One Two Seven."|speech
718||"Matt removes the glowing vial of orange liquid from a
centrifuge nearby. Carter hands Matt a hypo. Matt jabs it
into the vial, drawing up the colored liquid. Linda
sprays Sebastian's arm with dye."|stage direction
719|LINDA (cont'd)|Ready?|speech
720|SEBASTIAN|"Not really. I was just starting to
enjoy myself."|speech
721|LINDA|Tough.|speech
722|MATT|Okay, man. Here we go.|speech
723||"Matt inserts the hypo into the vein and presses down on
the plunger. The liquid begins to react. Small flashes of
light blip up and down the strand of color outlining the
vein.
Ba-bump.. ba-bump... the heartbeat starts to speed up."|stage direction
724|SEBASTIAN'S VOICE|"Wait... something... something doesn't
feel right."|speech
725|SARAH|Heartbeat elevated.|speech
726||INT. OBSERVATION BOOTH|location
727||Janice and Frank look over the equipment.|stage direction
728|FRANK|Vitals still nominal..|speech
729||INT. LABORATORY|location
730||"The glowing liquid turns from gold to red as the complex
webbing of a bloodstream appears.
Spreading out from the bloodstream, soon becomes visible
... the shadow of a skeletal system."|stage direction
731|SEBASTIAN|I can't br... br...|speech
732||Sebastian begins wheezing.|stage direction
733|LINDA|What's wrong?|speech
734|SARAH|He's not breathing.|speech
735||"Muscles are beginning to appear. And eyeballs. Frightened
eyeballs."|stage direction
736|MATT|Subject manifesting.|speech
737|SARAH|Pulse erratic.|speech
738||Sebastian pulls against his bonds. One set tears off.|stage direction
739|LINDA|Carter!|speech
740||"Carter grabs onto the mass of flesh and muscle, trying to
hold it back. But the restraints snap. The half-visible
man is screaming. He grabs Carter and throws him across
the room."|stage direction
741|LINDA (cont'd)|Sebastian! Sebastian!|speech
742||"And just for a second, Sebastian is fully visible. And
free. He looks around like a scared animal and rips off
all the wiring."|stage direction
743|LINDA (cont'd)|Sebastian!|speech
744|MATT|Get a tranq. Stat.|speech
745||"Sarah preps a tranquilizer. Sebastian locks eyes with
Linda. He's lost, he doesn't know where he is. And
suddenly, he crumbles to the ground. Linda rushes over to
him and puts bar hand on his shoulder. Light bleeds from
his skin and his skin begins to dissolve from sight."|stage direction
746|LINDA|He's reverting. Got him on the table.|speech
747||"Matt, Linda and Sarah pull the shifting body up and onto
an operating table. Carter pulls himself up and heads
back to the group."|stage direction
748|LINDA (cont'd)|Get me a I.V. of A.G. seven.|speech
749|SARAH|I got no pulse. No pulse.|speech
750|MATT|Start CPR.|speech
751||"Carter locates Sebastian's heart, not a difficult thing
because we can actually see it. Carter's hand pushes down
in the air inches above the heart. We see the heart being
pushed and squeezed. Sarah slaps an air bag on Sebastian
and starts pumping air into his lungs. Sebastian's heart
begins to beat again, beat on its own."|stage direction
752|CARTER|Getting a pulse.|speech
753|MATT|Holy shit. What happened?|speech
754|LINDA|"Sebastian... can you hear me? Can you
hear me? How are his pupils?"|speech
755|MATT|I can't see his goddamn pupils!|speech
756|SARAH|I think he's going into shock.|speech
757||"We slowly FADE OUT to the sights and sounds of our
scientist- doctors working on Sebastian... And the
beeping of Sebastian's erratic heartbeat."|stage direction
758||"FADE
UP ON:"|unknown
759||"A HABITAT
The heartbeat continues. In the shadows, two Rhesus
Monkeys defend themselves against an unseen attacker.
Blood splatters against the Plexiglas wall.
We FADE OUT AGAIN..."|stage direction
760||INT. CORRIDOR - NIGHT|location
761||"Linda stares through the Plexiglas walls into the
Recovery Chamber. Inside the Chamber, Sarah and Carter-
eye the various screens monitoring Sebastian's vitals.
Linda watches the hollow pocket underneath the blanket.
She watches the rhythm of its rises and falls as
Sebastian sleeps. Matt comes up behind her."|stage direction
762|MATT|"Just got the tissue sample results.
Cellular cohesion is stable."|speech
763||"Linda exhales in relief. Matt puts his hands on her
shoulder. Pulls her close to him."|stage direction
764|MATT (cont'd)|How bout you? You gonna be okay?|speech
765|LINDA|Guess so.|speech
766||(beat)|location
767|LINDA|"I was just thinking about the Apollo
missions. Y'know? Grissom, White and
Chaffee... What it was like for them
on that launch pad that day, thinking
they were gonna reach the stars only
to burn to death."|speech
768|MATT|"Sometimes the test pilots make
history. Sometimes the planes crash
and people die."|speech
769|LINDA|But he didn't die, did he?|speech
770||(beat)|location
771|LINDA|"What if we can't bring him back? What
then?"|speech
772|MATT|"It's just a little hitch is all. He'll
be the first to tell that he'll crack
it and I'm sure he will. It'll just
take time."|speech
773||(beat)|location
774|MATT|"Listen, let's got out of here. We
could drive up to the old observatory.
We'll take some wine and go count the
stars and forget all this for awhile."|speech
775||She pulls away.|stage direction
776|LINDA|No. I want to be here for him.|speech
777||"Linda pushes through the door of the recovery chamber and
takes a seat by Sebastian's bedside. A little hurt, Matt
heads down the corridor."|stage direction
778||INT. CONFERENCE ROOM|location
779||"Frank and Janice are staring into their coffee when Matt
enters. Matt crosses to the coffee machine and pours
himself a cup. He takes a seat at the table. They all
drink their coffee in silent vigil."|stage direction
780||INT. RECOVERY CHAMBER - DAY|location
781||"Linda sits by Sebastian's bedside, listening to the
constant rhythm of the machines.
The sheets shift."|stage direction
782||(weak)|location
783|SEBASTIAN'S VOICE|Hey...|speech
784|LINDA|Hey...|speech
785|SEBASTIAN|So I guess it didn't work.|speech
786||Linda shakes her head.|stage direction
787|SEBASTIAN'S VOICE|You look worried. It must've been bad.|speech
788||Sebastian's voice is weak and strained.|stage direction
789|LINDA|You almost died.|speech
790|SEBASTIAN'S VOICE|"Well, remember your Nietchze. Whatever
doesn't kill me, makes me stronger."|speech
791||Linda smiles.|stage direction
792|LINDA|"I should be making you feel better.
Not vice versa."|speech
793|SEBASTIAN'S VOICE|"I guess if I'm going to be stuck this
way for awhile, I'd better make some
adjustments."|speech
794||INT. RECOVERY CHAMBER - DAY|location
795||"In a dusty shaft of light...
A cotton swab.
is dipped by a gloved hand into a jar of flesh-colored
cream make-up. We follow the hand as it raises the cotton
swab into the darkness. The swab strokes over the black
and the rich fleshy cream spreads, revealing...
EYE LIDS of a closed eye.
The eyelids part, unveiling...
PITCH BLACK. Blink. Blink.
No eye.
Not even a trace of a eye socket. Just darkness.
A COLORED CONTACT LENS floats through mid-air... hovering
before the eyelids. It turns and fastens itself to the
darkness between the lids.
We PULL BACK slowly as Sebastian lifts a latex FACE MASK
and pulls it over his head.
He checks his reflection in the mirror. He looks almost
human. Almost. A face, eyes, hands ... the rest of him
covered by surgical scrubs.
We pull back and see the rest of the team looking on."|stage direction
796|MATT|Not too bad.|speech
797|SEBASTIAN|"The latex'll limit the amount of light
delivered to my optic nerves."|speech
798|LINDA|You could almost pass for human.|speech
799||"Sebastian rises. He looks eerily removed from reality
with his cold blank expression."|stage direction
800|SEBASTIAN'S VOICE|"Well, it gives you a face to talk to
at least, and we can all work in
normal light again."|speech
801||INT. LABORATORY - DAY|location
802||"SERIES OF SHOTS
Carter draws blood from Sebastian.
Samples are placed into the cyclotron.
Matt peers through the eyepiece of a microscope. He makes
notes.
Frank and Janice finish a computer simulation on a
protein strand. Matt looks over. They shake their heads,
no.
Sebastian slides into the MRI.
Linda examines a petri dish. She throws her pencil down
in frustration.
Sebastian is hit by the spectral radiation beams.
Matt pulls a vial of orange liquid from the cyclotron."|stage direction
803||INT. CORRIDOR - DAY|location
804||"Sebastian, still in his latex and scrubs, but looking
like he's been dragged through the nine levels of
purgatory, is escorted back to the recovery chamber by
Linda and Matt.
He crosses to his bed and collapses on it. Closes his
eyes."|stage direction
805|SEBASTIAN|The testing's making me sick.|speech
806|LINDA|Could be the barium or the radiation.|speech
807|MATT|"You're physiology has changed and,
well, all bets are off."|speech
808|SEBASTIAN|"I can't believe I have to spend
another night here."|speech
809||(to Linda)|location
810|SEBASTIAN|"Suppose you're gonna go home now, meet
up with that boyfriend of yours now."|speech
811||Linda and Matt exchange a glance. Linda quickly covers.|stage direction
812|LINDA|Do you want me to stay?|speech
813|SEBASTIAN|"No. That's okay. It's just, being a
guinea pig is more work than I
thought. I'll be fine."|speech
814||INT. RESEARCH COMPOUND - NIGHT|location
815||Various shots of the empty hallways and deserted labs.|stage direction
816||INT. OBSERVATION ROOM - NIGHT|location
817||"Carter kicks back in his chair listening to his walkman
stereo and playing gameboy."|stage direction
818||INT. RECOVERY CHAMBER - DAY|location
819||"Sebastian, in scrubs and make-up, paces back and forth.
He slams the wall in frustration. He crosses to a mirror
and examines himself. He doesn't look half bad. He pokes
his cheeks. There's something about him that's a little
off, but only if you look close."|stage direction
820||INT. OBSERVATION ROOM - NIGHT|location
821||"A shadow falls across Carter's face. He looks up. It's
Sebastian wearing street clothes - jeans and a hooded
sweatshirt over his latex mask.
Carter pulls of his earphones."|stage direction
822||(surprised)|location
823|CARTER|Dr. Caine. What's up?|speech
824|SEBASTIAN|"Just stopped by to let you know, I'm
going out for a bit."|speech
825||Sebastian turns back into the hallway.|stage direction
826|CARTER|Going out? Hey wait a sec!|speech
827||Carter scrambles to his feet.|stage direction
828||INT. CORRIDOR - NIGHT|location
829||Carter catches up with Sebastian.|stage direction
830|CARTER|What do you mean going out for a bit?|speech
831|SEBASTIAN|"If I don't get out of here, I'm gonna
go crazy."|speech
832|CARTER|"But you're not supposed to leave the
compound."|speech
833|SEBASTIAN|Why not?|speech
834|CARTER|That's the rule.|speech
835|SEBASTIAN|"Yes, but I made that rule. It's my
rule and I'm changing it."|speech
836|CARTER|You can't just change it.|speech
837||Sebastian hits the elevator button. The doors open.|stage direction
838|SEBASTIAN|"Carter, I was suppose to be like this
for three days. Three fucking days and
I'll be damned if I'm going to spend
the rest of my life as a prisoner in
this godforsaken dump. Now I'm going
out. I'll be back in a couple of
hours. Okay?"|speech
839||The elevator doors close with Sebastian inside. Shit.|stage direction
840|CARTER|Shit.|speech
841||"Carter runs down the corridor.
INT OBSERVATION ROOM - NIGHT
Carter picks up the phone and dials.
A beat then."|stage direction
842|CARTER|Yeah, it's Carter. We got a problem.|speech
843||INT. WAREHOUSE - NIGHT|location
844||"The elevator doors open and Sebastian pushes past the
Marine Guard."|stage direction
845|MARINE GUARD|Hey, Doc. Haven't seen you for awhile?|speech
846||"Sebastian keeps his face turned away as he crosses to his
Porsche."|stage direction
847|SEBASTIAN|"Yeah, well. You know how it in
sometimes."|speech
848|MARINE GUARD|"You got that right, sir. I was
beginning to worry 'cause your car
hadn't moved."|speech
849|SEBASTIAN|Thanks, but everything's cool.|speech
850||"Sebastian starts his car. It chugs a few times before
turning over and speeding out of the warehouse."|stage direction
851||INT. APARTMENT - NIGHT|location
852||"The door opens and Sebastian switches on the lights.
He looks around his apartment and sighs. It's good to be
home."|stage direction
853||INT. BEDROOM - NIGHT|location
854||"Sebastian enters the bedroom, clicking on the light. He
looks at the ceiling, ""You Should Be Working"", and
smiles."|stage direction
855||INT. LINDA'S APARTMENT BUILDING, PARKING GARAGE - NIGHT|location
856||Linda and Matt each rush to their respective cars.|stage direction
857|MATT|"He could be anywhere. Hell he could be
right behind us."|speech
858|LINDA|"I'll meet you at the lab. I'm gonna
swing by his place, just in case."|speech
859|MATT|See you there.|speech
860||Matt tries to give her a quick pack. Linda backs away.|stage direction
861||(quietly, looking around)|location
862|LINDA|I don't want him to see.|speech
863||(looking around too)|location
864|MATT|What a mess.|speech
865||They get in their cars.|stage direction
866||INT. SEBASTIAN'S BEDROOM - NIGHT|location
867||"Sebastian packs up a few personal belongings in an
overnight duffle. He crosses to his bookcase and pulls
out some books and throws them into the bag.
But as he does, he notices a light come on in the window
across the courtyard. Sebastian turns off his bedroom
light and moves toward the window. He peers across the
courtyard into the Brunette's apartment.
He watches the Brunette as she comes into the living room
from her front hallway. She drops her keys on the table
and begins unbuttoning her blouse as she crosses to the
window. Just as the blouse slips off her shoulder, she
pulls her blinds shut."|stage direction
868|SEBASTIAN|Shit.|speech
869||"Frustrated, Sebastian steps away from the window and then
stops. Something has occurred to him."|stage direction
870|SEBASTIAN (cont'd)|Don't even think it...|speech
871||"He looks down and notices his hand is trembling. His
breathing is a little heavy. A little nervous. He catches
a glimpse at himself in the mirror."|stage direction
872||(almost whispering)|location
873|SEBASTIAN (cont'd)|Once...just once.|speech
874||"The Brunette's living room light switches off and the
bathroom light switches on. We see him fighting an
internal battle and we see him lose it. He grabs a hold
of his hand and peels the latex skin off."|stage direction
875||EXT. APARTMENT BUILDING - NIGHT|location
876||"Linda drives Sebastian's apartment. She spots his black
Porsche in the parking lot. She pulls over to the curb,
jumps out of her car and heads into the building."|stage direction
