|character|text|type
1312||Reed reaches out, grabbing a folder from a box.|stage direction
1313|REED|But I'm not done with the machine --|speech
1314|VICTOR|"Which is precisely the point.
Analysis is over.  It's time for
action.  My men could have mass-
produced this by now."|speech
1315||Reed shakes his head, defending himself.|stage direction
1316|REED|"Mass-produced?  This isn't a
toaster.  You have no idea how it
works."|speech
1317||"Victor pulls the folder from Reed's hand, and whips out the
intricate DIAGRAM of the MACHINE.  He points to parts:"|stage direction
1318|VICTOR|"Re-create the storm, invert the
polarity here, reverse the mutation
there.  Don't talk to me like I'm some
schoolboy.  I've got the same Phd you
do."|speech
1319||"Reed is a little surprised that Victor is so familiar with
his machine.  He points to a SECURE CHAMBER on the blueprint."|stage direction
1320|REED|"The storm needs to be handled exactly
right, or it could make our mutations
worse, much worse, maybe even kill
us..."|speech
1321||Victor slows.  Is Reed getting to him?  Or giving him ideas?|stage direction
1322|REED (CONT'D)|"Victor, please.  We need time to
verify the data... We can't afford any
mistakes -- there's only enough ions
for two or three attempts."|speech
1323||Victor considers.  He seems to enjoy watching Reed dangle.|stage direction
1324|VICTOR|Reed.  I'm not asking permission.|speech
1325||(a final verdict)|location
1326|VICTOR|"We'll build it, while you check the
specs."|speech
1327||Victor walks out.  Reed looks unsure, as we CUT TO --|stage direction
1328||INT. BAXTER BUILDING TRANSFORMATION LAB - DAY|location
1329||"The SHIELDS slowly rise.  FIVE TECHNICIANS go to work.  They
wear the VDI jackets.  Reed watches, worried.
Sue enters.  She sees the shields, the technicians, the VDI
logo.  And she is deeply worried.  She steps over to Reed.
Sparks fly behind them.  Drills scream."|stage direction
1330|SUE|Can I talk to you?|speech
1331||INT. BAXTER BUILDING - REED'S OFFICE - DAY|location
1332||Sue steps into the office, followed by Reed.  Quiet, urgent:|stage direction
1333|SUE|"Don't let Victor push you into making
a mistake --"|speech
1334|REED|"He was going to take away all my data,
equipment --"|speech
1335|SUE|"Better than your life.  Victor's not
the one who has to get into that
thing.  We are."|speech
1336||Reed starts to snap, losing his studied cool.|stage direction
1337|REED|"Which is why I'm working twenty hours
a day, checking every variable --"|speech
1338|SUE|"Every variable but yourself.  You
don't eat, sleep.  You can't live in
your head like --"|speech
1339||(finally losing it)|location
1340|REED|"I'm not the only one in there.  I got
you, Vic, Ben, Johnny, all rattling
around in there."|speech
1341||Sue stands there, shocked by his outburst.  A beat.|stage direction
1342|SUE|"So clear it out.  Get out of your
head.  Get out of here..."|speech
1343||He looks at her, knowing what she means.  Where she means.|stage direction
1344||EXT. BROOKLYN STREETS - DAY|location
1345||"Ben nearly knocks people over as he stomps down the street,
mind tossing and turning.  People stare, point.  A LITTLE
GIRL and FRIEND run up to him."|stage direction
1346|LITTLE GIRL|"Mister, Mister!  Please help me!  My
kitty is stuck in a tree."|speech
1347||She gestures to a tree next to Ben.  Looks up.|stage direction
1348|LITTLE GIRL (CONT'D)|Please save Miss Lucy.|speech
1349||"Ben rolls his eyes.  Looks up.  Considers climbing the tree,
but thinks better of it.  He has another idea...
Ben grabs the tree with one hand, and starts shaking the crap
out of it.  MEEEEEEOOOOOOOWWWWRRRRRRR!!!!
The cat falls into frame.  At the last instant, Ben sticks
out his hand and the cat lands safely in his palm.  He hands
the cat to the girl.  Barely acknowledges her profuse thanks.
He just moves on."|stage direction
1350||EXT. ANOTHER BROOKLYN STREET - NIGHT|location
1351||"Ben passes a window in a gallery, and almost misses A LARGE
SCULPTURE of his bust.
He stops, steps back to take a look.  It's exquisitely
rendered, capturing not just brute physicality, but the
haunting anguish in his eyes.  Ben is amazed, and touched,
but..."|stage direction
1352||(under breath)|location
1353|BEN|Eyebrows are a little big...|speech
1354||A beat.  He stares at these images of himself.|stage direction
1355|VOICE (O.S.)|"I figured the only way to get you here
was to stick that in the window."|speech
1356||He turns to see...ALICIA in the doorway.|stage direction
1357|BEN|How'd you know it was me?|speech
1358|ALICIA|I'm blind, not deaf.  Wanna come in?|speech
1359||"He steps toward her.  But he sees...a PARTY in the back part
of the gallery.  Ben pauses, a little insecure."|stage direction
1360|BEN|I'm not really dressed for a party.|speech
1361|ALICIA|Relax, it's casual.|speech
1362|BEN|No, I mean...I'm a little...dusty...|speech
1363||She smiles, a thought forming, as we CUT TO --|stage direction
1364||INT. GALLERY - STUDIO - NIGHT|location
1365||"WHOOSH!  A SCULPTOR'S HOSE sprays a thin stream of water at
BEN.  Alicia cleans Ben with her hands, using thin CARVING
CHISELS for his cracks.  Intricate, intimate work.
Ben enjoys every moment.  He eyes a couple, large PUPPETS in
the corner."|stage direction
1366|BEN|Those yours too?|speech
1367|ALICIA|"My step-dad's.  I'm strictly into
stone.  I was wondering when you'd
walk by."|speech
1368|THE THING|"You know, you could'a run an ad in the
personals."|speech
1369|ALICIA|"""Sensual blind chick seeks three-ton,
rock-hard he-man for deep spiritual
relationship."""|speech
1370|THE THING|"This ain't permanent.  My friend
Reed's working on a cure...I think."|speech
1371||She gets closer, running her hands across his arm.|stage direction
1372|ALICIA|Bennie.  You feel pretty good as is.|speech
1373||Ben bristles.  He doesn't want to stay this way.|stage direction
1374|THE THING|"You don't know what it's like out
there.  Walking around like some kind
of circus freak.  People staring,
whispering --"|speech
1375|ALICIA|I wouldn't know anything about that.|speech
1376|THE THING|I mean...|speech
1377|ALICIA|"Tell me.  When you grew up in
Brooklyn, how many astronauts did you
know?"|speech
1378||(a beat)|location
1379|ALICIA|"You went your own way then.  You
didn't listen to people.  So why start
now...?"|speech
1380||As he ponders that, we hear a CROWD SWELLING on the CUT TO --|stage direction
1381||EXT. STREET - NIGHT|location
1382||"Fans swarm JOHNNY.  He signs autographs, poses for pictures.
Then his eyes move to...an incredibly long stretch LIMO.  A
tinted window rolls down.  Victor's face emerges."|stage direction
1383|VICTOR|Need a ride, Johnny?|speech
1384||EXT./INT. LIMO - NIGHT|location
1385||Johnny climbs in, sees...three impossibly gorgeous MODELS.|stage direction
1386|VICTOR|A few fans.  Hope you don't mind.|speech
1387|JOHNNY|Gotta take care of the fans, right?|speech
1388||He smiles, sitting down in the middle of them.|stage direction
1389|VICTOR|"Look, I built my business knowing what
people want.  And right now, the
people want you."|speech
1390||Johnny eyes the models, all lusting.|stage direction
1391|JOHNNY|"And we don't want to let the people
down now, do we?"|speech
1392|VICTOR|"No we don't.  Which is why we need
to strike while the iron's hot.
I'm talking action figures,
videogames, sponsors --"|speech
1393|JOHNNY|Videogames?  You serious?|speech
1394||Victor nods, knowing he has Johnny on the hook.|stage direction
1395|JOHNNY (CONT'D)|You talk to Reed and Sue about this?|speech
1396|VICTOR|"Johnny.  Let's be honest here.  Ben,
Reed, Sue.  Good people, all.  But
stars?"|speech
1397||(shaking his head, a beat)|location
1398|VICTOR|"I don't want to break up the band, but
you're the one they want.  Don't you
think it's time to go solo...?"|speech
1399||Victor subtly nods to the models.  They envelop Johnny.|stage direction
1400|VICTOR (CONT'D)|"Take the car for a spin.  Think about
it.  Is this the life you want?  Or
would you rather live in Reed's
lab...?"|speech
1401||"The car stops.  Victor gets out.  He stands on the pavement.
As he shuts the door, we see the women climbing onto Johnny.
The door shuts, and...
WHHHMMMPF!  The windows all suddenly STEAM UP!"|stage direction
1402||INT. HAYDEN PLANETARIUM - NIGHT|location
1403||"STARS on the ceiling.  A VOICE drones about the galaxy.  In
the LAST ROW, we find: Reed and Sue.  Reed is thinking about
work."|stage direction
1404|REED|"I could get Ben to tap into the
Baxter's main power to generate enough
voltage --"|speech
1405|SUE|"Reed.  Shh.  Just be quiet.  And look
up."|speech
1406||He slowly looks up.  The stars seem to calm him.|stage direction
1407|SUE (CONT'D)|"Remember our first date here...?  God,
I was so nervous."|speech
1408|REED|You were?|speech
1409|SUE|"Of course I was.  I'd read all your
papers on bioethics.  Some of them two
times just so I'd have something to
say to you."|speech
1410||Reed smiles softly, thinking back.|stage direction
1411|REED|"You know, I bribed the projectionist
ten bucks to keep it open late?"|speech
1412|SUE|I gave him twenty.|speech
1413||They laugh.  Sue looks up to the stars.  Quiet:|stage direction
1414|SUE (CONT'D)|I didn't want that night to end.|speech
1415||Reed looks at her.  Wrestles with a decision.  Then quietly:|stage direction
1416|REED|"Sue, you were right.  It wasn't
complicated.  I just wasn't ready to
be...to become..."|speech
1417||(a beat)|location
1418|REED|You can be a little intimidating.|speech
1419||She knows.  He trails off.  Sue looks at him.|stage direction
1420|REED (CONT'D)|"You always talked about how you liked
the kind of man who could approach
you...speak his mind.  One who wasn't
afraid to tell you what he wanted."|speech
1421|SUE|"I did.  I did, Reed...but I wanted
you to be that man."|speech
1422||Someone SHUSHES them.  They slump down further.  Closer.|stage direction
1423|SUE (CONT'D)|"When I walked out, I waited ten
minutes outside your door.  Ten.
Waiting for you to come find me."|speech
1424|REED|Why didn't you say something?|speech
1425|SUE|"That would have kinda defeated the
purpose.  And Reed..."|speech
1426||(closer, emotional)|location
1427|SUE|I'm saying it now.|speech
1428||"Their eyes lock.  A heated beat.  No more secrets.  Their
faces are close.  A kiss is coming.  Closer, closer.  Sue
disappears."|stage direction
1429||(quiet, playful)|location
1430|SUE (CONT'D)|Come find me.|speech
1431||Reed tentatively leans into the kiss, and...|stage direction
1432|SUE (O.S.) (CONT'D)|"That's my nose, genius... These are my
lips."|speech
1433||"Reed's face is SQUEEZED on both sides by Sue's invisible
hands.  She pulls him into a KISS.  Lips touch.  Soft,
tender.  Stars twinkle.  And we slowly DISSOLVE TO --"|stage direction
1434||EXT. KIRBY GALLERY - NIGHT|location
1435||"Ben and Alicia step out together.  The crowd quiets, turns.
A few whispers flutter.  Alicia leans close to Ben, and slips
her arm into his.  The party goes back to normal."|stage direction
1436|ALICIA|"Look around.  I'll get us drinks.
They always let blind girls cut the
line."|speech
1437||"She walks off.  He watches her go.  The way her hair moves.
The lines of her neck.  The light on her skin.  This woman is
the most beautiful thing Ben has ever seen.  He's falling
hard.
Ben steps through the crowd.  The swanky guests give strained
smiles, polite.  Ben is starting to feel comfortable here.
He keeps his eyes on Alicia, who talks to guests.
Ben hangs back, happy to watch her.  A few patrons pass him,
thinking he's just an inanimate statue."|stage direction
1438|PATRON|"I don't know about this one.  It lacks
a certain...realism."|speech
1439||"Ben keeps his eyes on Alicia.  He overhears two BOHEMIAN
GIRLS, who assume he's a statue."|stage direction
1440|BOHEMIAN GIRL #1|"She's always had a thing for runaways
and strays, but this is ridiculous."|speech
1441|BOHEMIAN GIRL #2|"I know.  Did she really think these
sculptures would sell?"|speech
1442|BOHEMIAN GIRL #1|"Like anybody would want this thing in
their house.  That girl's a one-woman
charity."|speech
1443||"Ben just stands there, frozen.  His eyes dart around the
room, paranoid now.  Aware of people staring, laughing.  He
glances at Alicia, who giggles at something else.  Ten
seconds ago, this would have been dreamy.  Now it's damning.
We stay with Alicia, who cuts through the crowd, emerging
where she left Ben.  She has a PITCHER of wine in hand for
him.  But Ben is gone.  She looks disappointed, hearing his
heavy FOOTSTEPS get softer and softer in the distance.
THUNDER booms on the CUT TO --"|stage direction
1444||EXT./INT. DINER - NIGHT|location
1445||"A pitstop in Queens.  Heavy RAIN swims down windows.  BEN
sits at the COUNTER, with his hat pulled low, coat tight.
Nobody sits within four chairs of him.  He sips coffee in a
metal bowl.  A long beat.  Then..."|stage direction
1446|VICTOR (O.S.)|This seat taken?|speech
1447||Ben turns to see...VICTOR.|stage direction
1448|BEN|What are you doing here?|speech
1449|VICTOR|I'm worried about you.|speech
1450|BEN|About me?  How sweet.|speech
1451|VICTOR|"Come on.  Let me buy you something to
eat.  Looks like you could use the
company."|speech
1452||Ben considers.  A man deeply alone.  A beat.|stage direction
1453||INT. DINER - LATER|location
1454||"Victor and Ben sit in a window booth.  A waitress sets a
foothigh stack of pancakes in front of Ben, removes huge
plates he's just cleared.  Victor's aware of the other
customers in the diner staring at Ben.  Ben burps: it rattles
the plates."|stage direction
1455|THE THING|'Scuse me.|speech
1456|VICTOR|"I know it can't be easy.  Life hasn't
changed that much for Reed, Sue and
Johnny.  At least they can go out in
public.  But for you?  People staring.
Whispering behind your back..."|speech
1457|THE THING|"If you're trying to cheer me up you're
doing a helluva job --"|speech
1458|VICTOR|"I'm just saying, I know what it's like
to lose something you love.  To see it
slip away, and know it's never coming
back."|speech
1459||The Thing shoves a huge piece of pie in his mouth.|stage direction
1460|THE THING|Reed's gonna fix me up --|speech
1461|VICTOR|"For your sake I hope you're right.
I'm sorry if that sounds a little
skeptical."|speech
1462|THE THING|Skeptical...?|speech
1463||"Ben doesn't trust him.  But Victor is hitting pressure
points."|stage direction
1464|VICTOR|"Look, he's a brilliant man, we should
trust he's working as hard as he can.
You're his best friend.  So what
possible reason could he have for
taking his time?"|speech
1465||(a beat)|location
1466|VICTOR|"I mean, other than getting close to
Sue?"|speech
1467||"Off The Thing: a seed of doubt has been planted.  He can't
help but find truth in the words.  And we CUT TO --"|stage direction
1468||INT. BAXTER BUILDING - TRANSFORMATION LAB - NIGHT|location
1469||"Reed and Sue return, laughing quietly, bodies close.  Reed
turns on the lights, and they flinch when they see...BEN.  He
sits waiting, scowling.  They stop laughing immediately."|stage direction
1470|BEN|Yeah, I have that effect on people.|speech
1471||"The construction of the TRANSFORMATION CHAMBER is complete.
The Technicians are gone now."|stage direction
1472|REED|Ben --|speech
1473|BEN|"Oh, you remember my name do you?  You
happen to remember what you swore to
do with every breath in your body?"|speech
1474|REED|We're working as hard as we can --|speech
1475|BEN|Yeah.  I can tell.  Victor was right.|speech
1476||He motions to Reed and Sue together.|stage direction
1477|REED|Come on, this is nothing.|speech
1478||Sue looks a little hurt.|stage direction
1479|BEN|"Glad ""nothing"" could take you away
from your work."|speech
1480|REED|"Ben, I don't know if this thing'll
change us back or make us worse.
I need you to be patient for a little
while longe--"|speech
1481||"He POKES his finger into Reed's chest, which INDENTS around
it like the Pillsbury Doughboy.  Ben pushes Reed back.  Hard."|stage direction
1482|BEN|Look at me, Reed.  Look at me!|speech
1483||"He grabs Reed's face, his fingers INDENTING the skin.  He
THROWS Reed back.  Reed slams down to the ground."|stage direction
1484|REED|"I am looking.  That's why I can't make
a mistake!  I've got to get it right,
and it's not right yet!  We need to
test this."|speech
1485||Ben shakes his head, looking down at Reed.|stage direction
1486|BEN|"I spent my whole life protecting you,
from the schoolyard to the stars.  For
what?  So you could play Twister with
your girlfriend while I'm the freak of
the week?"|speech
1487||"Reed tries to stand, but Ben KNOCKS him back.  Reed slams
into the wall, and stays down this time."|stage direction
1488|SUE|Ben!  Stop it!  Or I'll stop it.|speech
1489||She starts to raise her hands to throw force-fields.|stage direction
1490|BEN|Stay out of this Susie.|speech
1491||"As Ben turns to her, Reed takes this opportunity to WRAP Ben
up like a python.  They struggle.  Ben runs back into a wall
to shake Reed.  Their faces are close, heated."|stage direction
1492|BEN (CONT'D)|"Good thing you're flexible enough to
watch your own back.  'Cause you're on
your own now."|speech
1493||"Ben seems to relax and Reed lets go.  Ben walks out.  Sue
comes to Reed's side.  He's bleeding."|stage direction
1494|REED|"I'm OK.  Just go, go after him.  Stop
him."|speech
1495||"She heads out.  Reed slowly stands.  He looks at the
transformation machine.  It's not ready.  But...Reed steps
toward it.  As he walks, his image goes grainy in --"|stage direction
1496||INT. VICTOR'S OFFICE - NIGHT|location
1497||"Victor gets closer to his screens, watching Reed's every
step.  This is what Victor has been waiting for.  His screens
flicker with static -- he's too close, but he can't pull
back.  He sees: REED TURNS ON THE MACHINE.  Hits a countdown.
And he grabs his UNIFORM..."|stage direction
1498||INT. BAXTER BUILDING - HALLWAY - NIGHT|location
1499||"Sue hustles down the long hall.  Ben turns a corner, passing
the elevators, heading toward a FREIGHT ELEVATOR.  She gets
there too late.  Doors close, going down."|stage direction
1500||INT. BAXTER BUILDING - GROUND FLOOR - NIGHT|location
1501||Ben pounds across the lobby.  He sees Johnny coming in.|stage direction
1502|JOHNNY|Christmas come early!  Check it out!|speech
1503||"He holds up an ACTION FIGURE of BEN: a horribly bloated body
topped by a tiny pinhead.  Johnny pushes a button and --"|stage direction
1504|BEN ACTION FIGURE|IT'S CLOBBERIN' TIME!|speech
1505||"WITH ONE ARM, Ben shoves Johnny into a wall.  With his other
hand, Ben grabs the toy and SMASHES it into the wall, inches
from Johnny's head.  The toy lodges into the plaster."|stage direction
1506|JOHNNY|Hey!  That's a prototype!|speech
1507|BEN|Go back to the drawing board.|speech
1508||He strides away.|stage direction
1509||INT. BAXTER BUILDING - GROUND FLOOR - NIGHT|location
1510||"DING.  Sue speeds out of the elevator.  No sign of Ben.  She
runs into...JOHNNY who shakes off the encounter."|stage direction
1511|SUE|Johnny?  Did you see Ben?|speech
1512|JOHNNY|"Yeah, for the last time, I hope.  I'm
done with this freak show.  I'm moving
back to the real world."|speech
1513|SUE|"Is that what you call it?  ""Real""?"|speech
1514|JOHNNY|"At least it beats living in a lab like
somebody's science project."|speech
1515||This hits home.  Sue is quiet.  Johnny turns to go.|stage direction
1516|SUE|"Johnny, slow down.  Think.  You know
mom didn't raise us to --"|speech
1517|JOHNNY|"Look around, sis!  She's not here.  So
you can stop talking to me like I'm
your little boy --"|speech
1518|SUE|"As soon as you stop acting like one.
Come on, you're smarter than this.
You think those people out there care
about you?  You're just a fad to them."|speech
1519||He pulls away from her, taking a step out the door.|stage direction
1520|JOHNNY|"Let's try something new: you live
your life.  And I'll live mine."|speech
1521||(beat)|location
1522|JOHNNY|"And just for the record: they LOVE
me."|speech
1523||"He strides into the night, leaving Sue alone.  A dark night.
The Fantastic Four is no more.  The family is split apart."|stage direction
1524||INT. BAXTER BUILDING - TRANSFORMATION LAB - NIGHT|location
1525||"The transformation chamber is up and running.  Numbers count
down.  The storm swirls in the chamber.  Reed now wears the
UNIFORM.  He opens the door:
HE'S GOING TO USE IT ON HIMSELF.  HE IS FINALLY TAKING
ACTION."|stage direction
1526||INT. VICTOR'S OFFICE - NIGHT|location
1527||Victor sits enthralled.  He leans forward, breathless.|stage direction
1528||INT. BAXTER BUILDING - TRANSFORMATION LAB - NIGHT|location
1529||"Reed gets closer.  His heart races.  So does Victor's.  A
moment of truth for both of them.  REED STEPS INTO THE
MACHINE.
Reed looks up at the cosmic storm.  He opens his arms, ready
to risk his life.  And...WHHHM!  He JOLTS in JUMP-CUT-MOTION,
RECONFIGURING, JERKING out of control, and we CUT TO --
VICTOR'S OFFICE - NIGHT
His screens GO BLACK.  He looks out the window to see...a
flash atop the BAXTER BUILDING.  The tip of the Baxter glows.
The rest of its lights GO OUT, FLICKERING in a power surge."|stage direction
1530||INT. BAXTER BUILDING - GROUND FLOOR - NIGHT|location
1531||Lights go haywire.  Sue knows immediately...|stage direction
1532|SUE|Oh god, Reed.|speech
1533||INT. BAXTER BUILDING - TRANSFORMATION LAB - NIGHT|location
1534||"Lights flicker in darkness.  The door rips open.  Sue lunges
inside.  She sees through smoke and sparks...REED sways in
the chamber.  A beat.  Did it work?  Then...
Reed SLUMPS TO THE GROUND.  His eyes flutter back.  Dead...?
His body is warped, twisted -- one half remains tense, hard,
while the other half is loose, soft, almost melted."|stage direction
1535|SUE|"What did you do, Reed?  What did you
do?"|speech
1536||INT. VICTOR'S OFFICE - NIGHT|location
1537||Victor watches every second on his monitors.|stage direction
1538||INT. BAXTER BUILDING - TRANSFORMATION LAB - NIGHT|location
1539||"Sue struggles to lift Reed -- half of his body is STRETCHED
OUT, devoid of any semblance of bone structure.  One side of
his face looks like it's MELTING OFF."|stage direction
1540|REED|I can...make it work.|speech
1541|SUE|Reed, stop, you need to rest your --|speech
1542|REED|"The power...I need...more power...to
control...the storm --"|speech
1543|SUE|You need a doctor.|speech
1544||Reed loses consciousness.  Sue carries him out.|stage direction
1545||INT. VICTOR'S OFFICE - NIGHT|location
1546||Victor watches, his eyes narrow, looking at his hands.|stage direction
1547|VICTOR|More power...?|speech
1548||"He reaches out for his phone, and...his SPEAKERPHONE
AUTOMATICALLY TURNS ON.  His powers growing."|stage direction
1549|VICTOR (TO PHONE) (CONT'D)|Leonard.  Bring me our lab rat.|speech
1550||EXT. UNDER THE BROOKLYN BRIDGE - NIGHT|location
1551||"Ben sits alone, looking at city lights.  A man without a
home.  Without a family.  A hard beat.  HEADLIGHTS slash
across Ben.  He slowly turns, blinded in the lights of...a
LIMO."|stage direction
1552|LEONARD|"Ben!  They need you back at the Baxter
building.  It's...Reed."|speech
1553||"Ben considers.  Despite it all, he's a good friend.  And a
good man.  As he gets into the car, we hear THROBBING MUSIC
IN --"|stage direction
1554||INT. MANHATTAN NIGHT CLUB - NIGHT|location
1555||"LOUD MUSIC and PULSATING LIGHTS.  A young crowd dances and
grinds to the beat.  Among the colorful lights, STREAKS OF
FLAME swirl around the ceiling.  We follow them to:
A BALCONY, where we see JOHNNY sitting in a cozy VIP section.
He's surrounded by ""groupies"" climbing over each other to get
a look at his various parlour tricks.
He leans closer to a YOUNG WOMAN.  Closer.  Candles around
them start to melt.  Beads of sweat drip down her face."|stage direction
1556|JOHNNY|What do you say we get out of here?|speech
1557||She pauses.  And...a very LARGE MAN steps up.|stage direction
1558|JOHNNY (CONT'D)|This your boyfriend?|speech
1559||The Boyfriend doesn't look too happy.|stage direction
1560|BOYFRIEND|"Is that all you do?  Bar tricks and
stealing chicks..."|speech
1561||"Johnny does one more trick...taps the guy's drink...igniting
it into a burst of flame.  The Boyfriend drops the glass,
which SMASHES on the ground...catches the floor on fire.
The boyfriend quickly moves in and stamps it out."|stage direction
1562|GIRLFRIEND|"What are you doing?!  You could have
burned somebody!"|speech
1563||"The boyfriend takes his girlfriend's hand, they start to walk
off.  She turns back for one last comment..."|stage direction
1564|GIRLFRIEND (CONT'D)|"You know, if I had your power I'd be
doing something with it, not wasting
my time doing cheap bar tricks,
hitting on some other guy's girl."|speech
1565||"Johnny looks a little embarrassed.  The couple leaves.
Johnny glances around.  His FANS look down, away.  He sees
how quickly they can turn.  The crowd parts slightly.  He
looks very alone."|stage direction
1566||INT. TRANSFORMATION CHAMBER - NIGHT|location
1567||"Leonard leads The Thing inside.  The ominous chamber sits
with its door open.  Victor enters from the control station."|stage direction
1568|VICTOR|Ben, come in.|speech
1569|BEN|What is this?  Where's Reed?|speech
1570|VICTOR|Where do you think?  With Sue.|speech
1571||"Ben looks at the flickering lights.  Suspicious.  Victor
turns to Leonard, who looks a little scared by this dark
room."|stage direction
1572||(quiet)|location
1573|VICTOR (CONT'D)|I'll take it from here, Leonard.|speech
1574||Leonard nods, all too eager to get the hell out of here.|stage direction
1575|LEONARD|Yes sir.|speech
1576||Leonard disappears fast, as Victor turns back to Ben.|stage direction
1577|BEN|What do you want, Vic?|speech
1578|VICTOR|"To help you.  I've run every test
known to man.  And they all yield the
same result: the machine is ready."|speech
1579||Ben shakes his head, wanting to believe, but...|stage direction
1580|BEN|Reed said it'd be weeks till --|speech
