|character|text|type
1058||CUT TO:|unknown
1059||INT. A POSE HOUSE IN CHEVY CHASE - NIGHT|location
1060||"Two dozen limos and town cars line this suburban Maryland
street, their drivers waiting patiently."|stage direction
1061||CUT TO:|unknown
1062||INT. THE HOUSE IN CHEVY CHASE - NIGHT|location
1063||"A cocktail party is underway. This is a fat cat fundraiser
for the Republicans."|stage direction
1064|RUMSON (V.O.)|You're over-thinking this.|speech
1065||CUT TO:|unknown
1066||INT. THE LIBRARY - NIGHT|location
1067||"The look and feel of old money. Rumson is holding court with
a half-dozen political insiders. Some smoke cigars; others
sip their drinks."|stage direction
1068||(continuing)|location
1069|RUMSON|"Voters aren't interested in how to
achieve economic growth, and they
don't want to hear our plans to
strengthen foreign policy."|speech
1070|STAFFER #1|So it comes down to character.|speech
1071|STAFFER #2|"The press like him, Senator. The
networks, the newspapers, they're--"|speech
1072|RUMSON|"Reporters like him. Networks and
newspapers like ratings and circulation.
For all the bitching we do about liberal
bias in the press when it comes down to
a character debate..."|speech
1073|STAFFER #3|The press is an unwitting accomplice.|speech
1074|CARL|"Bob, the character debate didn't work
out for us."|speech
1075|RUMSON|"Because it couldn't. Our polling
told us that attacking his character
less than a year after he'd lost his
wife was gonna be a turn-off and was
gonna make people feel sorry for him.
We couldn't run the campaign we wanted
because the opponent was a widower."|speech
1076|CARL|"He's still a widower. Time's passed,
but--"|speech
1077||(to the rest)|location
1078|RUMSON|"You'll have to forgive my friend.
He's been on a hunting trip and cut
off from the world."|speech
1079|CARL|What's going on?|speech
1080||"And four STAFFERS grab whatever newspaper is closest to their
hand and toss them to CARL."|stage direction
1081|RUMSON|The President's got a girlfriend.|speech
1082||CUT TO:|unknown
1083||INT. PRIVATE OFFICE/THE RESIDENCE - NIGHT|location
1084||LUCY, SHEPHERD and SYDNEY are finishing up a game of Scrabble.|stage direction
1085||(to LUCY)|location
1086|SYDNEY|"Your dad says you're studying the
Constitutional Convention."|speech
1087|SHEPHERD|She's not having any fun, though.|speech
1088|LUCY|Dad--|speech
1089|SYDNEY|You're not having fun?|speech
1090||(to herself)|location
1091|LUCY|"This is a nightmare. This is a
social studies nightmare."|speech
1092|SHEPHERD|"They're doing a mock Congress. Each
kid is playing one of the original
delegates, and they debate the
Amendments. Now what's not fun about
that?"|speech
1093||LUCY gets up from the table and kisses her father.|stage direction
1094|LUCY|G'night, Dad.|speech
1095|SHEPHERD|G'night, sweetheart.|speech
1096|LUCY|It was nice meeting you, Mrs.--|speech
1097|SYDNEY|Sydney.|speech
1098|LUCY|It was nice meeting you, Sydney.|speech
1099|SYDNEY|"Thank you. It was nice meeting
you."|speech
1100|SHEPHERD|Sleep well, honey. I love you.|speech
1101|LUCY|I love you, too.|speech
1102||LUCY leaves. SHEPHERD and SYDNEY are alone now.|stage direction
1103|SYDNEY|She's wonderful.|speech
1104|SHEPHERD|She's her mother.|speech
1105|SYDNEY|She's you.|speech
1106||After a pause...|stage direction
1107|SHEPHERD|Would you like the 25-cent tour?|speech
1108||CUT TO:|unknown
1109||INT. THE EAST WING - NIGHT|location
1110||"This is the ""museum"" area of the White House, the part you
see when you take the official tour. Only a few lights are
lit, and while the SECRET SERVICE AGENTS give SHEPHERD plenty
of breathing room when he's in the residence, we'll still
catch a glimpse of one of them rounding a corner in the
distance or checking a doorway ahead."|stage direction
1111|SYDNEY|"I thought C-STAD wasn't gonna be
operational until January."|speech
1112|SHEPHERD|"It was ready ahead of schedule.
We've just been waiting for the
personnel."|speech
1113|SYDNEY|The Israelis?|speech
1114|SHEPHERD|"No, our guys. We've sent a team of
Army instructors to train the
Israelis."|speech
1115||SYDNEY and SHEPHERD enter the:|stage direction
1116||INT. THE CHINA ROOM - NIGHT|location
1117||"Named for its beautiful glass display cases featuring full
place settings of the official White House china and
silverware from every administration since Jackson."|stage direction
1118||(remembering)|location
1119|SHEPHERD:|I think this is the dish room.|speech
1120|SYDNEY|It's not the dish--|speech
1121|SHEPHERD|"Yeah, it is. It's the room with all
the dishes."|speech
1122|SYDNEY|It's the China Room.|speech
1123|SHEPHERD|"I'm more of a West Wing President.
If you're curious about the mansion,
there's probably a book you can get--"|speech
1124|SYDNEY|"There're about seven-thousand books.
I'll get one for you."|speech
1125||"SYDNEY's been walking slowly around the room, looking at the
display cases, and as she gets near one of the large windows,
she takes another step which drapes her in a shaft of
incredibly flattering moonlight.
The vision isn't lost on SHEPHERD. They stare at each other
for a moment."|stage direction
1126|SHEPHERD|Sydney.|speech
1127|SYDNEY|"Mr. President -- have you ever noticed
how similar the Van Buren flatware is
to the Buchanan flatware?"|speech
1128|SHEPHERD|"Do you think there will ever come a
time when you can stand in a room
with me and not think of me as the
President?"|speech
1129|SYDNEY|"This isn't a state of mind. You are
the President. And when I'm in a
room with you, oval or any other
shape, I'm always gonna be a
lobbyist, and you'll always be the
President."|speech
1130|SHEPHERD|"I got news for you, Sydney. As a
lobbyist, you would never be alone in
a room with the President."|speech
1131||"This last statement is not lost on SYDNEY.
He moves toward her until they are both bathed in the
moonlight. He puts his arms around her."|stage direction
1132|SYDNEY|You think this is a good idea?|speech
1133|SHEPHERD|Probably not.|speech
1134||"They lean in to kiss each other. They barely make contact
when..."|stage direction
1135|AGENT #3 (O.S.)|Mr. President...|speech
1136||"An AGENT is standing in the doorway -- SHEPHERD and SYDNEY
break apart."|stage direction
1137|AGENT #3|"We have a secure call from the sit-
room."|speech
1138||SHEPHERD knows what that means.|stage direction
1139|SHEPHERD|Excuse me.|speech
1140||"He moves out the door and into the corridor.
SYDNEY, knowing something's wrong, instinctively moves to
follow him and be with him, but the AGENT hasn't moved from
the doorway, so--"|stage direction
1141|AGENT #3|Sorry, ma'am.|speech
1142||(beat)|location
1143|SYDNEY|No...of course.|speech
1144||SHEPHERD comes back in.|stage direction
1145|SHEPHERD|Listen--|speech
1146|SYDNEY|Is anything wrong?|speech
1147|SHEPHERD|"I'm sorry, we're going to have to cut
our evening short. The Libyans have
just bombed C-STAD. I'll try to call
you tomorrow."|speech
1148||(to the AGENT)|location
1149|SHEPHERD|Can you show Ms. Wade out.|speech
1150||"SHEPHERD exits.
SYDNEY, alone for a second in the dish room, is finally
approached by a SECRET SERVICE AGENT, who starts to escort
her out."|stage direction
1151|CHAIRMAN (V.O.)|The response scenario's in place...|speech
1152||CUT TO:|unknown
1153||INT. THE SITUATION ROOM - NIGHT|location
1154||"SHEPHERD, A.J., the SECRETARY OF STATE, the SECRETARY OF
DEFENSE, and about a dozen or so Pentagon, Security Council,
and Joint Chiefs OFFICIALS are doing exactly what they're
trained for."|stage direction
1155||(continuing)|location
1156|CHAIRMAN|"...The F-18's are fired up on the
Kimitz and the Kitty Hawk. They're
just waiting for your attack order,
Mr. President."|speech
1157|SHEPHERD|"And we're gonna hit Libyan
Intelligence Headquarters?"|speech
1158|MAN|"The N.S.A. confirmed they're the ones
who planned the bombing."|speech
1159|A.J.|What's the estimate?|speech
1160|GENERAL|We'll level the building.|speech
1161|SHEPHERD|"Libyan I.H.Q's in the middle of
downtown Tripoli -- are we gonna hit
anything else?"|speech
1162|GENERAL|Only if we miss.|speech
1163|SHEPHERD|Are we gonna miss?|speech
1164|GENERAL|No, sir.|speech
1165|SHEPHERD|How many people work in that building?|speech
1166|CHAIRMAN|We've been all through--|speech
1167|SHEPHERD|"How many people work in the damn
building?"|speech
1168|DEPUTY|"I've got those number here. There
are three shifts, so it--"|speech
1169|SHEPHERD|"The fewest. What shift puts the
fewest people in the building? The
night shift, right?"|speech
1170|DEPUTY|"By far. Mostly custodial staff and
a few--"|speech
1171|SHEPHERD|What time does the night crew go on?|speech
1172|DEPUTY|They're on now, sir.|speech
1173|SHEPHERD|A.J.?|speech
1174|A.J.|"It's immediate, it's decisive, it's
low risk, and it's a proportional
response."|speech
1175|SHEPHERD|"Someday somebody's going to have to
explain to me the virtue of a
proportional response."|speech
1176||"There's a SILENCE. SHEPHERD gets up and starts to head out
the door."|stage direction
1177|CHAIRMAN|Mr. President?|speech
1178|SHEPHERD|Attack.|speech
1179||CUT TO:|unknown
1180||INT. OVAL OFFICE - NIGHT|location
1181||"SHEPHERD is with A.J., LEWIS, ROBIN, KODAK and a couple of
AIDES, all of whom look as though they've been called out of
their homes in the middle of the night."|stage direction
1182|A.J.|"Robin, as soon as our planes have
cleared Libyan airspace, you can call
the press. I don't know when we'll
have the full B.D.A.--"|speech
1183|LEWIS|"General Rork says around O-Eight
Hundred."|speech
1184|ROBIN|"Sir, what do you think about a
national address?"|speech
1185|SHEPHERD|"The last thing I want to do is put
the Lybians center stage."|speech
1186|KODAK|"I think it's a great idea, sir. You
know Rumson's gonna be talking about
your lack of military service."|speech
1187|SHEPHERD|"This isn't about Rumson. What I did
tonight was not about political gain."|speech
1188|KODAK|"But it can be, sir. What you did
tonight was very presidential."|speech
1189|SHEPHERD|"Leon, somewhere in Libyan right now
there's a janitor working the night
shift at the Libyan Intelligence
Headquarters. He's going about his
job 'cause he has no idea that in
about an hour he's gonna die in a
massive explosion. He's just going
about his job 'cause he has no idea
that an hour ago I gave an order to
have him killed. You just saw me do
the least presidential thing I do."|speech
1190|KODAK|yes, sir.|speech
1191|PRESS (V.O.)|Mr. President...Mr. President!|speech
1192||CUT TO:|unknown
1193||INT. THE WHITE HOUSE PRESS BRIEFING ROOM - DAY|location
1194||"SHEPHERD is at the podium taking questions. He's flanked by
his PENTAGON STAFF. A.J. and LEWIS stand to the side. ROBIN
stands out of the way."|stage direction
1195|SALLY|"Is there anything at all about the
C-STAD weapons system that could have
been mistaken by Libyan Intelligence
as offensive rather than defensive?"|speech
1196|SHEPHERD|"No. We did everything but show them
the blueprints. The hardware was
sitting in a airplane hangar for a
month. They didn't hit it until the"|speech
1197||American personnel got there. Leslie.|stage direction
1198|LESLIE|"Sir, there's an unconfirmed report
that you were with Sydney Wade when
you learned of the attack. Can you
comment?"|speech
1199||(sotto to ROBIN)|location
1200|A.J.|Get him off.|speech
1201|SHEPHERD|Yes, we'd just finished dinner.|speech
1202|ROBIN|Last question.|speech
1203|MARK|"Sir, would you care to comment on
the status of your relationship?"|speech
1204|SHEPHERD|"We don't have a relationship. We
just had dinner."|speech
1205|CAROL|"Can you tell us if she spent the
night at the White House or did--"|speech
1206|SHEPHERD|"Folks, a lot of people got killed
last night. Let's try to keep our
eyes on the ball, okay?"|speech
1207||"SHEPHERD is herded out of the briefing room amidst a chorus
of ""Mr. President"" 's."|stage direction
1208||CUT TO:|unknown
1209||INT. THE WHITE HOUSE CORRIDOR - DAY|location
1210||"SHEPHERD walks away from the briefing room with ROBIN. JANIE
joins him."|stage direction
1211|ROBIN|"That was my fault, sir. We should
have prepped you for that."|speech
1212|SHEPHERD|"There's nothing that needs prepping.
A.J., let's meet with the leadership
after we meet with the Security
Council."|speech
1213|ROBIN|"""Newsweek"" is begging for ten minutes
today. Any ten minutes you got."|speech
1214|SHEPHERD|Nobody gets ten minutes today.|speech
1215||DISSOLVE TO:|unknown
1216||INT. SHEPHERD'S PRIVATE OFFICE - NIGHT|location
1217||"SHEPHERD sits at his desk, is on the phone. A TELEVISION
NEWSCAST is doing a report on Congressional reaction to the
events of the day. ROB RUMSON is talking."|stage direction
1218|SHEPHERD|"Lewis, tell the speaker to wait.
I want to talk to him. No, I'll be
right down."|speech
1219|RUMSON|"...Last night, the price of his
liberal programs was raised to
include the blood of 22 American
soldiers."|speech
1220||He hangs up. On the TV, we see a quick sound bite from RUMSON.|stage direction
1221|RUMSON|"...Mr. Shepherd's read a lot of
books, but you didn't need a Harvard
degree to see this comin' a mile down
the road."|speech
1222|SHEPHERD|I went to Stanford, you blowhole.|speech
1223|RUMSON|"The fat that our Commander-in-Chief
has not served one day in uniform--"|speech
1224||"SHEPHERD clicks off the TV and then stares at
A SLIP OF PAPER THAT SAYS ""SYDNEY"""|stage direction
1225||CUT TO:|unknown
1226||EXT. SYDNEY'S APARTMENT - NIGHT|location
1227|BETH (V.O.)|"This box just says ""Miscellaneous.""
Is this bedroom miscellaneous or
kitchen miscellaneous?"|speech
1228||INT. SYDNEY'S APARTMENT - NIGHT|location
1229||"SYDNEY and BETH have been getting SYDNEY moved in. BETH is
holding a carton."|stage direction
1230|BETH|Sydney?|speech
1231|SYDNEY|Why did I have to kiss him?|speech
1232|BETH|You kissed him?|speech
1233|SYDNEY|Yeah.|speech
1234|BETH|You didn't' tell me that.|speech
1235|SYDNEY|I kissed him.|speech
1236|BETH|Where?|speech
1237|SYDNEY|On the mouth.|speech
1238||(exasperated)|location
1239|BETH|Where in the White House?!|speech
1240|SYDNEY|In the dish room.|speech
1241|BETH|The dish room?|speech
1242|SYDNEY|The China Room.|speech
1243|BETH|Then what happened?|speech
1244|SYDNEY|He had to go and attack Libya.|speech
1245|BETH|It's always something.|speech
1246|SYDNEY|"I've gotta nip this in the bud. This
has catastrophe written all over it."|speech
1247|BETH|"In what language?! Sydney, this man
is the leader of the free world.
He's brilliant, he's funny, he's
handsome, and he's an above-average
dancer. Isn't it possible our
standards are just a tad high?"|speech
1248||"The PHONE RINGS--
SYDNEY freezes.
The PHONE RINGS again."|stage direction
1249||(continuing)|location
1250|BETH|Answer the phone.|speech
1251|SYDNEY|It's him.|speech
1252|BETH|Answer the phone.|speech
1253|SYDNEY|"He's gonna ask me to come over
there."|speech
1254|BETH|Answer the phone.|speech
1255|SYDNEY|I don't want to go over there.|speech
1256|BETH|Answer the phone.|speech
1257||All right. But I'm gonna end it|stage direction
1258|SYDNEY|"on the phone. I'm not gonna go
over there."|speech
1259||CUT TO:|unknown
1260||INT. SHEPHERD'S BEDROOM - NIGHT|location
1261||"SHEPHERD opens his door, revealing SYDNEY. Agent COOPER is
letting her in."|stage direction
1262|SYDNEY|"I just came over here to tell you
why I can't see you anymore."|speech
1263||(to COOPER)|location
1264|SHEPHERD|Thanks, Coop.|speech
1265||SHEPHERD closes the door.|stage direction
1266|SYDNEY|"Look, I know you've had a tough
day."|speech
1267|SHEPHERD|"Not as tough as some. You want a
drink? Lemme take your coat."|speech
1268||But SYDNEY doesn't take her coat off.|stage direction
1269|SYDNEY|Mr. President, this isn't gonna work.|speech
1270|SHEPHERD|"Sure it will. You button the top
button, and it doesn't fall off
the hanger."|speech
1271|SYDNEY|That's not what I...|speech
1272|SHEPHERD|I didn't think so. Listen...|speech
1273|SYDNEY|"I've really enjoyed the time we've
spent together, but this has
catastrophe written all over it.
Please, Mr. President, don't pursue
me outside the political arena."|speech
1274|SHEPHERD|"Well, I have no intention of pursuing
you inside the political arena, so
that leaves everything out, and
that's unacceptable to me."|speech
1275|SYDNEY|"If I were on your staff, I would tell
you that the absolute worst thing you
can do coming into an election year
is to open yourself up to character
attacks, and the fastest way to do
that is to prance around like the
playboy of the Western world."|speech
1276|SHEPHERD|"Let's clear up a couple of things.
Number 1: I seldom prance.
Number 2: I have no intention of
engaging in a character debate, and
Number 3: You're not on my staff."|speech
1277|SYDNEY|"Yes, of course, but if you'll follow
the immutable--"|speech
1278|SHEPHERD|Why is that, by the way?|speech
1279|SYDNEY|Why's that?|speech
1280|SHEPHERD|Why aren't you on my staff?|speech
1281|SYDNEY|You can't afford me.|speech
1282|SHEPHERD|How much do you make?|speech
1283|SYDNEY|More than you do, Mr. President.|speech
1284|SHEPHERD|"The name's Andy. How much money do
you make?"|speech
1285|SYDNEY|"What the hell does it matter how
much money I--"|speech
1286|SHEPHERD|"You would raise your voice to the
President?"|speech
1287|SYDNEY|"I'm only thinking about the health
of your Presidency. You think this
morning's press conference was the
end of it? Bob Rumson's gotta be
drooling over this."|speech
1288|SHEPHERD|Are you attracted to me?|speech
1289|SYDNEY|I beg your pardon?|speech
1290|SHEPHERD|I asked if--|speech
1291||(of course she is)|unknown
1292|SYDNEY|That's not the issue--|speech
1293|SHEPHERD|"Well, I tell you what. Let's make
it the issue. Let's try something
new, 'cause I know that most couples,
when they're first getting together,
are inclined to slam on the brakes
because they're concerned about Bob
Rumson's drool."|speech
1294|SYDNEY|You're not most people.|speech
1295|SHEPHERD|You know what your problem is?|speech
1296|SYDNEY|What's my problem?|speech
1297|SHEPHERD|Sex and nervousness.|speech
1298|SYDNEY|Sex and nervousness is my problem.|speech
1299|SHEPHERD|"Yes. Last night when we were
looking at the different place
settings in the dish room, I
realized that those place settings
were provided by the First Ladies.
And I'll bet none of those First
Ladies were nervous about having
sex with their President husbands.
And you know why?"|speech
1300|SYDNEY|"No, but I'm sure you'll explain it
to me."|speech
1301|SHEPHERD|"I will. Because they weren't
presidents when they met them. Not
the case here."|speech
1302|SYDNEY|Ahhhhhh.|speech
1303|SHEPHERD|You see what I'm getting at?|speech
1304|SYDNEY|"Yes. May I use your bathroom for a
moment?"|speech
1305|SHEPHERD|Sure. It's right through there.|speech
1306|SYDNEY|I want to freshen up.|speech
1307|SHEPHERD|"As you pass through, you'll see a
large closet on your left. And if
you feel comfortable, hang up your
coat, and when you come back I'll
have fixed up a drink, we'll sit on
the couch, and I will explain to
you my plan."|speech
1308|SYDNEY|"You have a plan? Don't make me
wait. You're on a roll."|speech
1309||"SYDNEY disappears into the BATHROOM/DRESSING ROOM area.
SHEPHERD keeps talking as he goes to the bar and makes a
couple of drinks."|stage direction
1310||(speaking up)|location
1311|SHEPHERD|"Okay. You're attracted to me, but
the idea of physical intimacy is
uncomfortable because you only know
me as the President. It's not always
gonna be that way, and the reason I
know that is because there was a
moment last night when you were with
me and not the President, and I know
what a big step that was for you.
So, Sydney, I'm in no rush. Here's
my plan: We're gonna slow down.
When you're comfortable, that's
when it'll happen."|speech
1312||"SYDNEY comes back into the room...she's wearing one of
SHEPHERD's dress shirts and nothing else. She walks toward
him."|stage direction
1313||(continuing)|location
1314|SHEPHERD|"Perhaps I didn't properly explain
the fundamentals of the ""Slow Down""
plan."|speech
1315|SYDNEY|You explained it great.|speech
1316||She moves closer to him.|stage direction
1317||(pause)|location
1318|SHEPHERD|Are you nervous?|speech
1319|SYDNEY|No.|speech
1320|SHEPHERD|"Good. My nervousness exists on
several levels. Number 1 -- and
this is in no particular order --
I haven't done this in a pretty
long time. Number 2: Any expectations
you might have, due to the fact that
I'm, you know..."|speech
1321|SYDNEY|The most powerful man in the world?|speech
1322|SHEPHERD|"Exactly, thank you. Just so you
remember that's a political
distinction that comes with the
office. I mean, if Eisenhower were
here instead of me he'd be dead by
now. And number three..."|speech
1323||(gently)|location
1324|SYDNEY|Andy...|speech
1325||"They're both standing, facing each other...
They gently kiss. They just stay with it until it becomes
easier and better and exactly what they want."|stage direction
1326|RUMSON (V.O.)|"Does New Hampshire want traditional
American values back in the White
House?"|speech
1327|CROWD|Yes!!|speech
1328||CUT TO:|unknown
1329||INT. AN ELKS LODGE - NIGHT|location
1330||"A crowd of 300 or so is being whipped into a frenzy.
Rumson's bringing it home under a campaign banner
proclaiming: THE PRIDE IS BACK -- BOB RUMSON."|stage direction
1331|RUMSON|Does New Hampshire want the pride back?|speech
1332||The CROWD goes nuts upon hearing Rumson's signature phrase--|stage direction
1333|CROWD|Yeah!!!!!!!|speech
1334|RUMSON|"My name is Bob Rumson. And I'm
running for President."|speech
1335||And as the CROWD loses its mind, we|stage direction
1336||CUT TO:|unknown
1337||EXT. WHITE HOUSE - DAWN|location
1338||CUT TO:|unknown
1339||INT. SHEPHERD'S BEDROOM - MORNING|location
1340||"It is very early, and SHEPHERD is still asleep. As we PULL
BACK, WE REVEAL that he is alone in his bed. The PHONE RINGS.
SHEPHERD picks it up--"|stage direction
1341||(into phone)|location
1342|SHEPHERD|Yeah...put him through.|speech
1343||(listens)|location
1344|SHEPHERD|"Lewis, it is 5:00 a.m. You gotta
get yourself a life, man."|speech
1345||(listens)|location
1346|SHEPHERD|Yeah...all right.|speech
1347||"He hangs up the phone and looks around the room, only to
notice SYDNEY is tiptoeing around in the dim light, trying
to quietly dress herself and gather up her things. SHEPHERD
watches this odd spectacle for a moment before he says--"|stage direction
1348||(continuing)|location
1349|SHEPHERD|Sydney?|speech
1350||SYDNEY turns around.|stage direction
1351|SYDNEY|Hi.|speech
1352|SHEPHERD|What are you doing?|speech
1353|SYDNEY|"I wanted to leave the building before
the press corps got here."|speech
1354|SHEPHERD|"I have those same thoughts every day
of my life. Say, you know Lewis
Rothschild, don't you? Well, he's..."|speech
1355|SYDNEY|"Sure. Boy, Lewis'd go nuts if he
knew I'd spent the night."|speech
1356||There's a KNOCK on the door.|stage direction
1357|SHEPHERD|...on his way up.|speech
1358|SYDNEY|What?|speech
1359|SHEPHERD|Come on in, Lewis.|speech
1360||LEWIS comes in--|stage direction
1361|LEWIS|'Morning, Mr. President. Hi, Sydney.|speech
1362|SYDNEY|"Hi, Lewis. Well, Mr. President,
thank you for taking the time to go
over those fossil fuel numbers. I'll
just get my coat, and be on my way."|speech
1363||SHEPHERD laughs at SYDNEY's purposely lame try--|stage direction
1364||(to LEWIS)|location
1365|SHEPHERD|What's the situation?|speech
1366|LEWIS|They're camped out at every exit.|speech
1367|SYDNEY|Who? Who's camped out?|speech
1368|LEWIS|The press.|speech
1369|SYDNEY|The press is camped out?|speech
1370|LEWIS|You shoulda taken a cab, Sydney.|speech
1371|SYDNEY|They know my car?!|speech
1372||ROBIN enters.|stage direction
1373|ROBIN|"Good morning, Mr. President. Hi,
Sydney. I came over as soon as Lewis
called."|speech
1374|SHEPHERD|Thank God.|speech
1375|ROBIN|"I think the important thing is not
to make it look like we're panicking."|speech
1376|SHEPHERD|"See, and I think the important thing
is actually not to be panicking."|speech
1377||A.J. KNOCKS on the open door and walks in.|stage direction
1378|A.J.|"Good morning, Mr. President. Good
morning, Ms. Wade. I see everyone's
getting an early start today."|speech
1379|LEWIS|"How do we exit Sydney from the
building and what do we say to the
press at that point?"|speech
1380|ROBIN|We need a diversion.|speech
1381|SYDNEY|A diversion.|speech
1382|ROBIN|"You understand that by diversion
I'm not saying we set the White
House on fire."|speech
1383|SHEPHERD|No, please, let's do.|speech
1384|LEWIS|"Can I state very clearly that I
can't be party to anything illegal."|speech
1385|A.J.|Good for you, Lewis.|speech
1386|LEWIS|"Say what you want, but it's always
the guy in my job that ends up doing
eighteen months in Danbury Minimum
Security Prison."|speech
1387|SHEPHERD|"Rest easy, Lewis. We're not creating
a diversion."|speech
1388|ROBIN|No diversion.|speech
1389||(to SYDNEY)|location
1390|SHEPHERD|We'll have somebody take you home.|speech
1391|A.J.|"Esther's over in my office. She's
got the station wagon outside."|speech
1392||"SHEPHERD regards A.J. for a moment...clearly the man planned
ahead."|stage direction
1393|LEWIS|"Okay. Good. Now, the press
statement."|speech
1394||(to SYDNEY)|location
1395|SHEPHERD|"Sydney, when you leave here, you're
gonna run into reporters and
photographers. Your picture's gonna
be taken every day, and you're gonna
be asked questions every day. Answer
them, don't answer them -- it's
entirely up to you. The White House
has no official position except to
say ""no comment."""|speech
1396|ROBIN|No comment?|speech
1397|SHEPHERD|"The White House doesn't comment on
the President's personal life."|speech
1398|LEWIS|We can't just leave it at that, sir.|speech
1399|SHEPHERD|I tell you what, Lewis, we just did.|speech
1400|LEWIS|But, sir...|speech
1401||(the meeting's over)|location
1402|A.J.|Thank you, Mr. President.|speech
