|character|text|type
1011||"Oliver leaves Arthur with her, and Anna and Elliott and him
head off to the billboard. They climb it's structure, it's
high and a bit scary. On the top is a gang plank looking over
the city. Anna is happy she came. Elliott goes to paint the
back side of the billboard. Oliver meets up with Anna, over
looking the city."|stage direction
1012|OLIVER|You okay?|speech
1013|ANNA|"Yeah. I'm gonna stay here with my
new friend (the handrail she
holds)."|speech
1014|OLIVER|Okay.|speech
1015||"Oliver walks out and writes big letters across the billboard.
YOU MAKE ME LAUGH BUT IT'S NOT FUNNY.
He makes his way back. Anna's not where she was, he looks and
finds her in the gangways between the two billboards with a
view to downtown below her."|stage direction
1016|ANNA|C'est beau ici.|speech
1017|(CONTINUED)|10/29/07 59.|speech
1018||CONTINUED:|location
1019|OLIVER|Yeah.|speech
1020||He comes to her, wanting to get beyond the romance somehow.|stage direction
1021|OLIVER|I'm trying to impress you.|speech
1022|ANNA|(Gasps ironically) Really?|speech
1023||"She walks to him and puts her hands around his head, somehow
it's more intimate and vulnerable now."|stage direction
1024|ANNA|It's working.|speech
1025||"They kiss.
MOMENTS LATER. They're at the bottom of the ladder. They all
run back to their car."|stage direction
1026||INT. ANNA'S HOTEL - NIGHT|location
1027||"Oliver, Anna and Arthur walk down the hallway. Arthur bolts
ahead suddenly, getting free of Oliver, he runs to and OLD
MAN - wearing all black and looking just like Hal. Oliver
runs up to stop Arthur."|stage direction
1028|OLIVER|Arthur, Arthur. I'm sorry.|speech
1029||"We see the old man's face, it's not Hal, but it the
resemblance hits Oliver too. The man is struggling with his
hotel key card."|stage direction
1030|OLD MAN|"Oh. No problem. No problem. What's
with this card?"|speech
1031|OLIVER (CONT'D)|Uh, do you mind?|speech
1032||Oliver swipes the man's key, the door opens.|stage direction
1033|OLD MAN|Thank you.|speech
1034||"He disappears. Oliver looks overwhelmed by this ghost. Anna
senses what's happened. She leads Oliver to their room."|stage direction
1035||INT. ANNA'S ROOM - NIGHT|location
1036||"Oliver sits on the bed, sinking. Anna watches him. She comes
to him, hugs him."|stage direction
1037|(CONTINUED)|10/29/07 60.|speech
1038||CONTINUED:|location
1039|ANNA|He looked like your dad?|speech
1040|OLIVER|Yeah.|speech
1041||"She wants to take care of him, she lays him back on the bed,
helps him take his coat off, she's sitting on him, caressing
him - Oliver is overwhelmed by memory."|stage direction
1042|OLIVER|"Somewhere along the line, he
stopped admitting to himself that
he was sick."|speech
1043||CUT TO PAST|stage direction
1044||INT. HOSPITAL - DAY|location
1045||"A SERIES OF REPEAT ACTIONS ON DIFFERENT DAYS:
1. Camera tracks with Oliver helping Hal into the Cancer
Center. Hal is full of life.
SAME ANGLE TWO MORE TIMES, DIFFERENT DAYS, DIFFERENT CLOTHES
AND EXTRAS.
2. Hal arrives at the cookie plate in the Cancer Center
Lobby.
SAME ANGLE TWO MORE TIMES, DIFFERENT DAYS, DIFFERENT CLOTHES
AND EXTRAS.
3. CU on the cookie plate.
SAME ANGLE TWO MORE TIMES, DIFFERENT DAYS, DIFFERENT COOKIES.
4. Hal sits happily eating his cookie. He is chipper, alive,
without self-pity.
SAME ANGLE TWO MORE TIMES, DIFFERENT DAYS, DIFFERENT CLOTHES
AND COOKIES."|stage direction
1046||INT. RADIATION ROOM|location
1047||"Hal looks into camera (Oliver's perspective) as he pulls his
shirt off, the radiation machine is in the background. Hal
grandly introduces Oliver to the Technician."|stage direction
1048|HAL|"Oliver, this is Blake. He's a
wonderful man."|speech
1049||CU of the small round registration tattoos on Hal's chest|stage direction
1050|(CONTINUED)|10/29/07 61.|speech
1051||CONTINUED:|location
1052|HAL|"Look. I finally got a tattoo.
Registration purposes of course."|speech
1053||CUT BACK TO PRESENT|stage direction
1054||INT. ANNA'S HOTEL ROOM|location
1055||Anna still straddles Oliver, she's moved by his story.|stage direction
1056|ANNA|Good for him.|speech
1057||"CUT BACK TO PAST
Oliver continues to tell Anna about Hal."|stage direction
1058||INT. COUNTERPOINT BOOKSTORE|location
1059|ANNA|"OLIVER (V.O.)
He did a lot of shopping. Bought
all these books."|speech
1060||"SAME ANGLE AND LOCATION, JUMP CUT THROUGH 3 DIFFERENT DAYS OF
HAL LOOKING FOR BOOKS.
JUMP CUT THROUGH 3 DIFFERENT SETS OF BOOKS BEING PUSHED
TOWARDS THE CASH REGISTER."|stage direction
1061|ANNA|"OLIVER V.O.
And new clothes."|speech
1062||INT. MENS CLOTHING STORE DRESSING ROOM.|location
1063||"SAME ANGLE, MENS DRESSING ROOM, 3 DIFFERENT DAYS, OLIVER
BRINGS DIFFERENT CLOTHES TO HAL IN THE DRESSING ROOM."|stage direction
1064||INT. STAPLES STYLE STORE - DAY|location
1065||Hal buying more and more paper, Oliver helping him.|stage direction
1066|ANNA|"OLIVER (V.O.)
He was obsessed with Staples."|speech
1067||INT. NURSERY|location
1068||"JUMP CUT THROUGH TWO DIFFERENT DAYS, OLIVER HELPS HAL BUY
PLANTS."|stage direction
1069|(CONTINUED)|10/29/07 62.|speech
1070||CONTINUED:|location
1071|(CONTINUED)|"OLIVER (V.O.)
He bought a lot of plants."|speech
1072||CUT BACK TO PRESENT|stage direction
1073||INT. ANNA'S HOTEL ROOM|location
1074||Oliver's very emotional now, as is Anna.|stage direction
1075|OLIVER|He had a lot of parties.|speech
1076||CUT TO PAST|stage direction
1077||INT. HAL'S HOUSE - NIGHT|location
1078||"Oliver arrives at Hal's, there is a party going on, Oliver is
surprised, he carries groceries with him."|stage direction
1079|HAL|Well, glad you could make it.|speech
1080|OLIVER|I thought I was making dinner?|speech
1081|HAL|It's movie night.|speech
1082||"Oliver and Hal make their way through a crowd of Hal's gay
friends. They're in party mode."|stage direction
1083|PARTY GUEST|Hal, you look wonderful.|speech
1084|HAL|"Oh, I'm turning the corner on this
thing."|speech
1085||We loose Hal and Oliver in the group...|stage direction
1086||INT. HAL'S DINNING ROOM - ANOTHER DAY|location
1087||"Twelve of Hal's gay friends sit around the table in an
assembly line of paper folding-envelope stuffing-labeling,
stamping..."|stage direction
1088|HAL|"OLIVER (V.O.)
He had these political letter
writing parties, there was an out
gay congressman he was
supporting..."|speech
1089|(CONTINUED)|10/29/07 63.|speech
1090||CONTINUED:|location
1091||Hal leads the guys as they put the letters together.|stage direction
1092||INT. HAL'S HOUSE (BACK TO MOVIE NIGHT PARTY)|location
1093||"BACK TO Oliver and Hal, arriving in the kitchen with the
groceries."|stage direction
1094|(CONTINUED)|"OLIVER (V.O.)
He started telling everyone that he
was getting better."|speech
1095||They're finally almost alone.|stage direction
1096|OLIVER (CONT'D)|"Why're you telling them you're
""turning the corner""?"|speech
1097|HAL|Well...|speech
1098|OLIVER|You have stage 4 cancer?|speech
1099|HAL|It's not as bad as it sounds.|speech
1100|OLIVER|Pop. There is no stage 5.|speech
1101|HAL|That's not what it means.|speech
1102|OLIVER|What does it mean?|speech
1103|HAL|"It just means it's been through 3
other stages."|speech
1104||"Oliver doesn't know what to say, he looks through the door at
all of Hal's friends -- happy, laughing, partying. He looks
back at Hal, ready to fight him more, but for the first time
we can see fear and doubt in Hal's face."|stage direction
1105|OLIVER|What movie are we watching?|speech
1106|HAL|"""The Life of Harvey Milk."" He was
the first openly gay politician..."|speech
1107|OLIVER|Yeah I know who Harvey Milk is.|speech
1108|HAL|Good, good.|speech
1109|(CONTINUED)|10/29/07 64.|speech
1110||CONTINUED:|location
1111||"Hal heads back to the party, leaving Oliver alone in the
kitchen overwhelmed.
MOMENTS LATER: Everyone is crowded onto the couches, they're
watching the Harvey Milk film."|stage direction
1112||INT. HAL'S OFFICE|location
1113||Hal paces and dictates to a secretary.|stage direction
1114|(CONTINUED)|"OLIVER (V.O.)
He hired a secretary that he could
dictate to."|speech
1115||LIVE ACTION PORTRAIT OF THE SECRETARY LOOKING INTO CAMERA.|stage direction
1116|(CONTINUED)|"OLIVER (V.O.) (CONT'D)
He wrote an essay about religion..."|speech
1117||INT. HAL'S DINNING ROOM - ANOTHER DAY|location
1118||"Hal works with his secretary as Oliver looks on. Hal pulls
the lap-top to himself and reads what he has dictated..."|stage direction
1119|HAL|"Eventually Jesus grew old. He could
no longer walk far and he could no
longer preach in a loud voice. One
day he announced to his apostles
that he was departing. The three
disciples prayed with him, gave him
water, bathed and fed him. After
gasping for breath for several
days, one morning, just as dawn
came, Jesus passed away."|speech
1120|OLIVER|You re-wrote Jesus' death?|speech
1121||They all laugh.|stage direction
1122|HAL|"It was so violent, we need new
stories."|speech
1123||Oliver goes over and kisses Hal on the head.|stage direction
1124||INT. HAL'S LIVING ROOM|location
1125||"Oliver enters and sees Hal and Andy taking a nap together on
the day bed. Hal wakes up and waves at Oliver."|stage direction
1126|(CONTINUED)|10/29/07 65.|speech
1127||CONTINUED:|location
1128|(CONTINUED)|"OLIVER V.O.
For the first time I saw him really
in love."|speech
1129||Oliver waves back at his father.|stage direction
1130|(CONTINUED)|"ANNA V.O.
He sounds amazing. But that must
have been crazy for you."|speech
1131||CUT TO PRESENT|stage direction
1132||INT. ANNA'S HOTEL ROOM|location
1133||"Anna hugs and kisses Oliver. She's both overwhelmed by his
need and sympathetic to all that he's lost.
LATER THAT NIGHT: The room is dark, Oliver is asleep. Anna is
nervously awake. She quietly gets out of bed, puts her pants
on, and sneaks to the door. Arthur wakes up and hops to her
wanting to follow."|stage direction
1134|ANNA|Stay here.|speech
1135||"She starts to close the door, Arthur scratches, she tries
again, he scratches. She opens the door, Arthur trots out
into the hallway - Anna catches up with him."|stage direction
1136||INT. HOTEL HALLWAY|location
1137||A troubled Anna walks down the hallway with Arthur.|stage direction
1138||INT. HOTEL BALLROOM|location
1139||"A dark empty ballroom, filled with tables. Anna sits in the
dark and smokes."|stage direction
1140||INT. HOTEL ROOM|location
1141||Oliver wakes up, slowly figures out that Anna is not in bed.|stage direction
1142|OLIVER|Anna?|speech
1143||INT. HOTEL HALLWAY|location
1144||Oliver, now in clothes, sleepily looks for Anna.|stage direction
1145|OLIVER|10/29/07 66.|speech
1146||INT. HOTEL BALLROOM|location
1147||"Oliver enters the ballroom, Arthur trots to him. He see's
Anna across the room - full of heavy feelings. He sits by
her."|stage direction
1148|ANNA|"I couldn't sleep, I wanted to walk
around..."|speech
1149||Oliver's petting Arthur. He's confused and hurt.|stage direction
1150|ANNA|"You've lost so much. What if I
can't make up for that?"|speech
1151|OLIVER|"If this is too much, then we should
just stop."|speech
1152||"Oliver gets up and starts to leave, Anna's surprised. She
catches up with him puts her arms around him from behind."|stage direction
1153|ANNA|Wait, wait.|speech
1154||She forces him to stay there.|stage direction
1155|ANNA|I don't want to stop.|speech
1156||"They hold this pose in silence for a beat, then,
surprisingly, he hoists her over his shoulder, and carries
her back to their room. She laughs, they've made it past this
trouble.
CUT TO PAST"|stage direction
1157||EXT. LARGE PARKING LOT - DUSK|location
1158||Andy shouts...|stage direction
1159|ANDY|Ready?|speech
1160||"Andy has a set-up of large fireworks ready to go, Hal and
twelve friends stand by, Oliver's behind."|stage direction
1161|ANDY|"EVERYONE BUT OLIVER
YES!"|speech
1162||Mock enthusiasm.|stage direction
1163|OLIVER|No!|speech
1164|(CONTINUED)|10/29/07 67.|speech
1165||CONTINUED:|location
1166||"The fireworks go off.
BOOOM BOOOM BOOOM BOOOM
IT IS INCREDIBLY LOUD. Big fireworks explode, the guys laugh
and HOLLER. Hal raises his arms up in the air in celebration."|stage direction
1167|HAL|Again!|speech
1168|EVERYONE|AGAIN! AGAIN!|speech
1169||"As Andy lights up some more.
BOOOM BOOOM BOOOM BOOOM
Oliver covers his ears, he yells out..."|stage direction
1170|OLIVER|FFFFFUUUUCCCCKKKKKK!!!!!!!!|speech
1171||"He's still yelling after the explosions stop.
The guys, all sensing the insanity laugh and yell back at
him."|stage direction
1172|GUYS|FFFFFUUUUUCCCCCCKKKKKK!!!!!|speech
1173||"Oliver's laughing now - the noise, the absurdity. Hal and
Oliver make eye contact. Hal yells less strongly than the
others but trying..."|stage direction
1174|HAL|FFFFFFUUUUUCCCCKKKKK!!!!!|speech
1175||"They keep eye contact. They are bonded, happy, out of their
normal confines. Oliver comes to Hal, yelling again."|stage direction
1176|OLIVER|FFFFFUUUUUCCCCCCKKKKKK!!!!!|speech
1177|HAL|FFFFFUUUUUCCCCCCKKKKKK!!!!!|speech
1178|OLIVER|FFFFFUUUUUCCCCCCKKKKKK!!!!!|speech
1179|HAL|FFFFFUUUUUCCCCCCKKKKKK!!!!!|speech
1180||"CUT TO LATER: All the guys spread out across the parking lot
looking for Arthur who must of fled during the explosions."|stage direction
1181|(CONTINUED)|10/29/07 68.|speech
1182||CONTINUED:|location
1183|EVERYONE|Arthur! Arthur... Arthur...|speech
1184||CUT TO PRESENT|stage direction
1185||INT. ANNA'S HOTEL ROOM MORNING|location
1186||"Arthur runs towards camera chasing a tennis ball that Anna
threw for him. He runs back and jumps onto the bed, waking
Oliver. He's sleepy, she's happy, wants him to wake up."|stage direction
1187|ANNA|"Ah, you're awake! Arthur says it's
time to get up, he says he has the
day off."|speech
1188|OLIVER|He talks to you too?|speech
1189|ANNA|Yeah.|speech
1190|OLIVER|"Your English is not so perfect. And
he said ten minutes."|speech
1191||INT. MOONLIGHT ROLLER RINK - NIGHT|location
1192||"Hard cut Oliver and Anna roller-skating to carousel music.
They're having a great time being terrible at it.
Oliver and Anna join Elliott and Shauna on the side of the
rink. Arthur is half hidden in a duffle bag at their feet."|stage direction
1193|OLIVER|"You okay? (to Anna) You did really
well."|speech
1194|ELLIOTT|"Yeah, I can't believe that was your
first time."|speech
1195|OLIVER|"(To Arthur) You watching all the
humans going around and around."|speech
1196||The manager of the rink suddenly arrives, upset.|stage direction
1197|MANAGER|"Excuse me. There's no dogs allowed
in the building. You need to remove
him from the premises please."|speech
1198|(CONTINUED)|10/29/07 69.|speech
1199||CONTINUED:|location
1200|OLIVER|"If I leave him on his own, he loses
all control."|speech
1201|MANAGER|"I'm sorry. There's no dogs allowed
in the building."|speech
1202|OLIVER|"Yeah, but if I leave him in the
car, he cries, he howls. I can't
leave him in the car.
ELLIOTT AND SHAUNA
C'mon, it's her first time!"|speech
1203|"ANNA
(ANGRILY)"|A ca vas! C'est bon!|speech
1204|MANAGER|"I don't know what she's saying but
I don't like it."|speech
1205|OLIVER|"She is just talking in French.
She's saying it's OK, it is such a
small dog."|speech
1206|MANAGER|"You need to remove the dog from the
premises or I'm going to have to
call the authorities."|speech
1207|OLIVER|"You're gonna call the authorities?
ELLIOTT AND SHAUNA
Fuck it, steal the skates, just
leave."|speech
1208|ANNA|"Dans ce pays! On ne peut pas
amener un chien. On peut rien
faire. Mais c'est con..."|speech
1209||EXT. MOONLIGHT ROLLERINK BACK DOOR - CONTINUOUS|location
1210||"Oliver, Anna and Arthur make their way out the door and down
the street in their skates."|stage direction
1211||INT. MAIN HOTEL HALLWAY|location
1212||"They roll down the main lobby hallway, Arthur running behind,
dodging people as they go."|stage direction
1213|ANNA|10/29/07 70.|speech
1214||INT. UPSTAIRS HOTEL HALLWAY|location
1215||They struggle to skate down the hotel hallway, past a maid.|stage direction
1216|OLIVER|Sorry, excuse us, sorry.|speech
1217||They enter Anna's door.|stage direction
1218||INT. ANNA'S HOTEL ROOM - CONTINUOUS|location
1219||"Oliver, Anna, Arthur enter on their skates. Still very
playful, they skate around the big room. The phone rings.
Anna's face falls, they both know it must be her father. She
muster's on trying to have a good time. Oliver goes and
unplugs the phone."|stage direction
1220|OLIVER|He shouldn't do this to you.|speech
1221||"The phone in the next room keeps ringing. He awkwardly skates
to it and unplugs it. He returns.
Oliver skates to her concerned."|stage direction
1222|ANNA|"Even if we don't answer, he's still
in here (points to her head).I go
somewhere else, he's still here."|speech
1223||Oliver can relate.|stage direction
1224|OLIVER|Your leaving soon?|speech
1225|ANNA|Yeah.|speech
1226|OLIVER|"I think you should come to my house
and move in with me."|speech
1227|ANNA|"Would you want a strange girl like
me?"|speech
1228|OLIVER|Yeah, a lot.|speech
1229||She's very moved.|stage direction
1230|ANNA|Do you cook?|speech
1231|(CONTINUED)|10/29/07 71.|speech
1232||CONTINUED:|location
1233|OLIVER|Yes (not so sure).|speech
1234||"She laughs. She almost cries as she thinks this over. She
skates to him, puts her arms around him."|stage direction
1235|ANNA|I would love that.|speech
1236||They kiss.|stage direction
1237|OLIVER|"But now I'm going to have to kill
you for sure now."|speech
1238|ANNA|Why?|speech
1239|OLIVER|Cause I'm falling in love with you.|speech
1240||"The sound in the room fades down, Oliver's narration fades in
over the shot of them embracing in their skates."|stage direction
1241|OLIVER|"OLIVER V.O.
Anna and I are in a relationship in
2003."|speech
1242||"STILL PHOTOS OF THE SUN IN 2003, THE STARS, LIVE ACTION SHOT
OF OLIVER AND ANNA EATING, TALKING AT NIGHT IN BED:"|stage direction
1243|OLIVER|"OLIVER (V.O.)
This is what the sun looks like and
the stars. This is what it looks
like when we eat. When we tell each
other the stories in our heads."|speech
1244||"THEN STILL PHOTOS OF L.B.J., GEORGES POMPIDOU, THEN SUN IN
1971, ANNA'S CAT, ANNA'S PARENTS IN THE 70'S, ANNA'S
POSTCARDS OF PARIS-LONDON-BERLIN-NEW YORK CITY:"|stage direction
1245|OLIVER|"OLIVER (V.O.)
I was born in 1965. Anna was born
in 1971. This is what the sun
looked like. Her pets. Her parents.
She left home when she was 16. She
lived here and here and here."|speech
1246||NOW STILL PHOTOS OF FOUR DIFFERENT YOUNG MEN, 3 DRAWINGS OF|stage direction
1247||OLIVER'S X'S:|location
1248|OLIVER|"OLIVER(V.O.)
She had three serious
relationships. She left all of
them. I had four serious
relationships. I left them too. Or
let them fall apart."|speech
1249|(CONTINUED)|10/29/07 72.|speech
1250||CONTINUED:|location
1251||"STILL PHOTOS OF W.W.2 GI'S SEEN BEFORE, AND THE PUBLIC MENS
ROOM SEEN BEFORE. LIVE ACTION SHOT OF ANNA FEELING TROUBLED,
LIVE ACTION SHOT OF ANNA WALKING BY THE RIVER LOOKING INTO
CAMERA HAPPY."|stage direction
1252|(CONTINUED)|"OLVIER (V.O.)
We didn't go to this war. We didn't
have to hide to have sex. Our god
fortune allowed us to feel a
sadness that our parents didn't
have time for and a happiness that
I never saw with them."|speech
1253||"NOW LIVE ACTION SHOT OF OLIVER AND ANNA TALKING AT NIGHT,
LIVE ACTION SHOT OF OLIVER AND ANNA RUNNING BACKWARDS IN
PRETEND SLOW MOTION. THEN ANNA'S EYES LOOKING INTO CAMERA,
HER EAR, HER FEET, ANNA SAYING ""I LOVE YOU""."|stage direction
1254|(CONTINUED)|"OLIVER (V.O.)
We didn't know how we learned the
stories in our heads but sometimes
they stop running and I can really
see Anna's eyes in 2003. Her ears.
Her feet. This is what it looks
like when she says, I love you, in
2003."|speech
1255||"LIVE ACTION SHOT OF ANNA CRYING WITH OLIVER, LIVE ACTION SHOT
OF OLIVER HUGGING HER AND ANNA SAYING SOMETHING WE CANNOT
HEAR."|stage direction
1256|(CONTINUED)|"OLIVER (V.O.)
This is what it looks like when she
cries. When she tells me there's
always a new empty room waiting for
her. They used to make her feel
free. Now they make her feel the
opposite of free."|speech
1257||INT. OLIVER'S OFFICE - DAY|location
1258||"Oliver's at his desk, looking at photos of himself and his
mother at a museum exhibit from the 70's. We see young Oliver
and Georgia, an exhibit of stuffed animals, a quote on a
wall. Oliver goes to his notebooks, looks through them till
he finds a small rainbow sticker. He puts it on the table and
thinks...
CUT TO PAST"|stage direction
1259||EXT. HAL'S DINNING ROOM|location
1260||"Oliver's helping Hal take his medication, Hal deals with is
mail."|stage direction
1261|(CONTINUED)|10/29/07 73.|speech
1262||CONTINUED:|location
1263|OLIVER|Next one.|speech
1264|HAL|Lord.|speech
1265||"With each swallow he pings a glass with a fork. Hal opens a
letter from a gay rights organization, he hands Oliver the
rainbow sticker we just saw."|stage direction
1266|HAL (CONT'D)|Here, that means gay pride.|speech
1267|OLIVER|Yeah, everyone knows that, here.|speech
1268||"He gives Hal another pill, another reluctant difficult
swallow, another ping."|stage direction
1269|HAL|No they don't.|speech
1270|OLIVER|Everyone knows about that Pop.|speech
1271|HAL|Don't be ridiculous.|speech
1272||"Hal's hiding something, he doesn't look Oliver in the eyes
when he asks..."|stage direction
1273|HAL|Did you know, about me?|speech
1274||Oliver shakes his head no.|stage direction
1275|OLIVER|"No, I just thought you and mom
weren't in love."|speech
1276|HAL|We loved each other.|speech
1277|OLIVER|But you were gay that whole time.|speech
1278|HAL|I learned how not to be.|speech
1279|OLIVER|For 44 years?|speech
1280|HAL|"I knew I was gay, though, at dinner
parties I was looking at the
husbands not the wives."|speech
1281|"(MORE)
(CONTINUED)"|10/29/07 74.|speech
1282||CONTINUED:|location
1283|HAL (CONT'D)|"I couldn't have survived if I
didn't know that. I just chose not
to follow those instincts."|speech
1284|OLIVER|What about sex? You guys had sex?|speech
1285|HAL|"She didn't think I was the greatest
lover, but we made do. Look, I
liked my life, the museum, our
house, that's what I wanted."|speech
1286|OLIVER|And mom? You wanted mom too right?|speech
1287||"Frustrated and angry, Oliver takes the pill tray into the
kitchen, leaving Hal behind."|stage direction
1288|HAL|Yes, stop that.|speech
1289|HAL|She proposed to me you know.|speech
1290||This draws Oliver back into the room.|stage direction
1291|HAL|"I said - look I love you and we're
great buddies but you know what I
am. And then she says, that doesn't
matter. I'll fix that."|speech
1292||Oliver's never heard this part of the story before.|stage direction
1293|`HAL|"I thought. Oh, God. I'll try
anything."|speech
1294||SCREEN FILLS SOLID PINK.|stage direction
1295|`HAL|"OLIVER (V.O.)
Sex."|speech
1296||SCREEN FILLS SOLID RED.|stage direction
1297|`HAL|"OLIVER (V.O.)
Life."|speech
1298||SOLID ORANGE.|stage direction
1299|`HAL|"OLIVER (V.O.)
Healing."|speech
1300||SOLID YELLOW.|stage direction
1301|`HAL|"OLIVER (V.O.)
Sunlight."|speech
1302|(CONTINUED)|10/29/07 75.|speech
1303||CONTINUED:|location
1304||GREEN.|stage direction
1305|(CONTINUED)|OLIVER (V.O.)|speech
1306||TURQUOISE.|stage direction
1307|NATURE|"OLIVER (V.O.)
Spirit."|speech
1308||"WE SEE STILL PHOTOS OF THE FIRST GAY PRIDE FLAG, THE 1977 SAN
FRANCISCO GAY PRIDE PARADE."|stage direction
1309|NATURE|"OLIVER (V.O.)
The first Gay Pride flag was made
in 1978 by a man named Gilbert
Baker. He gave a meaning to each
color."|speech
1310||NOW STILLS PHOTOS OF CARTER, A LEGO FIGURE, SUPERMAN, PETS:|stage direction
1311|NATURE|"OLIVER (V.O.) (CONT'D)
This man was President. This was
invented, this is what movies
looked like. Pets."|speech
1312||"HISTORICAL FOOTAGE OF HARVEY MILK'S BODY BEING CARRIED AWAY
ON A STRETCHER."|stage direction
1313|NATURE|"OLIVER (V.O.) (CONT'D)
On November 27th, 1978. Harvey Milk
was shot and killed."|speech
1314||STILL PHOTOS OF THE MUSEUM EXHIBIT OF STUFFED ANIMALS.|stage direction
1315|NATURE|"OLIVER (V.O.) (CONT'D)
One week later, my father opened
his annual Museum Christmas
Exhibit. He collected stuffed
animals from people in the
community, and put them on display.
My father printed a quote from The
Velveteen Rabbit in large type on
the wall..."|speech
1316||NOW A STILL PHOTO OF THE QUOTE ON THE WALL OF THE MUSEUM.|stage direction
1317|NATURE|"OLIVER V.O.
...`The stuffed rabbit asked - What
is real? And the Horse said, ""Real
isn't how you're made. It's a thing
that happens to you. When a child
loves you for a long long time not
just to play with, but really loves
then you become real..."|speech
1318|(CONTINUED)|10/29/07 76.|speech
1319||CONTINUED:|location
1320||"NOW WE SEE HISTORICAL FOOTAGE OF GAY MEN BEING LOADED INTO
PATTY WAGONS BY THE VICE SQUAD IN THE 1950'S:"|stage direction
1321|(CONTINUED)|"OLVIER (V.O.)
...And the rabbit asked, 'Does it
hurt?' And the horse said,
'Sometimes.' 'Does it happen all at
once like being wound up, or bit by
bit?'..."|speech
1322||THEN HISTORICAL FOOTAGE OF CASTRO STREET DURING THE 1977 GAY|stage direction
1323||RIGHTS PARADE:|location
1324|(CONTINUED)|"OLIVER (V.O.)
...'It takes a long time. That's
why it doesn't happen to people who
break easily..."|speech
1325||INT. HAL'S LIVING ROOM|location
1326||"Oliver enters to find Hal and Andy dancing humorously to loud
opera music. Hal dances free, without restraint, full of
life."|stage direction
1327|(CONTINUED)|"OLIVER (V.O.)
...Generally by the time you are
real, most of your hair has been
loved off, and your eyes drop out
and you get loose in the joints.
But these things don't matter at
all because you are real and you
can't be ugly, except to people who
don't understand.'"""|speech
1328||"The music blares as Arthur greets Oliver. Hal comes to
Oliver, Andy continues to dance."|stage direction
1329|HAL|Andy's moving in.|speech
1330|OLIVER|Yeah? Is that a good idea?|speech
1331||Hal hugs Oliver.|stage direction
1332|HAL|Just be happy about it.|speech
1333||"Oliver can't just be happy about it.
CUT TO PRESENT"|stage direction
1334|HAL|10/29/07 77.|speech
