|character|text|type
309||Back to Oliver in bed, on the phone.|stage direction
310|HAL|"HAL (V.O.)
You have it easy."|speech
311||CUT TO PRESENT|stage direction
312||INT. HOUSE PARTY - NIGHT|location
313||"Oliver snaps out of his memory. He makes his way through the
crowd and delivers the drink to her. He looks at her a little
too intensely, then blurts out."|stage direction
314|OLIVER|Would you like to dance?|speech
315||"She happily nods yes. They walk to the dance floor, we think
Oliver's going to be shy, but he breaks into a kinetic,
angular, dance. She's surprised with us - she laughs, they
have a good time."|stage direction
316|(CONTINUED)|10/29/07 20.|speech
317||CONTINUED:|location
318||"JUMP CUT THROUGH THE NIGHT: Oliver, ""Julius"", Elliott and
Shauna are talking to a magician. ""Julius"" picks a card, the
magician mixes it into the full deck, pops a card into the
air, it is hers. Shauna and Elliott can see that Oliver's
coming alive.
LATER. They dance again, now they're sweaty, the dance
floor's packed - it's the pinnacle of the party."|stage direction
319||INT. PARTY BATHROOM - NIGHT|location
320||"The party's winnowing down in the background - ""Julius"" and
Oliver look at each other in the mirror for a beat, and then
simultaneously take their wigs off, revealing their true
selves."|stage direction
321|OLIVER|Hello...|speech
322||"Shes mouths a silent ""hi""..."|stage direction
323|OLIVER|Can I give you my number?|speech
324||She pulls out her pad and pen and hands them to him.|stage direction
325|OLIVER|Thanks.|speech
326||"As he writes, Oliver spies Arthur sitting in the corner of
the bathroom, staring directly at him."|stage direction
327|ARTHUR SUBTITLE|"Tell her the darkness is about to
drown us unless something drastic
happens right now."|speech
328||Oliver looks to her.|stage direction
329|OLIVER|"I feel bad dragging Arthur to the
party. I should get home. It was
really nice meeting you."|speech
330||"She writes on her pad: ""Au Revoir"""|stage direction
331|"OLIVER
(CHUCKLES)"|Au revoir. Yeah.|speech
332||He leaves.|stage direction
333||EXT. STREET OUTSIDE PARTY - NIGHT (CONTINUOUS)|location
334|(CONTINUED)|10/29/07 21.|speech
335||CONTINUED:|location
336||"Oliver and Arthur walk up the empty street - Oliver kicking
himself for missing his chance with her. His phone rings."|stage direction
337|OLIVER|Hello?|speech
338||"ON THE OTHER END: Silence. A little breathing, the party in
background."|stage direction
339|OLIVER (CONT'D)|Is that you?|speech
340||BEEP.|stage direction
341|OLIVER (CONT'D)|One beep means yes?|speech
342||BEEP.|stage direction
343|OLIVER (CONT'D)|"I've always wanted to have a phone
call with someone who doesn't
talk..."|speech
344||BEEEEEEEEEEEEP.|stage direction
345|OLIVER (CONT'D)|You want to do something?|speech
346||BEEP|location
347|OLIVER (CONT'D)|Now?|speech
348||BEEP.|stage direction
349|OLIVER (CONT'D)|"Okay, I'm parked just right up the
street."|speech
350||"BEEP. They hang up. Oliver is filled with hope.
CUT TO: ""Julius"" walking out into a pool of street light.
They smile at each other, but don't say anything. They get
into his car."|stage direction
351|OLIVER|Okay. You point - I'll drive.|speech
352||"Oliver starts the engine. She points forward and they head
off. At the light she points left, he follows. Down the
street she points right..."|stage direction
353|OLIVER|This way?|speech
354|(CONTINUED)|10/29/07 22.|speech
355||CONTINUED:|location
356||"She nods. Oliver drives up on the sidewalk before the
street, heads down it for half a block, then takes her right.
We can hear them laughing."|stage direction
357||EXT./INT. HOTEL ROOM LOBBY - NIGHT|location
358||"Oliver, Arthur and the woman enter a very fancy hotel lobby.
Oliver is impressed. She mime's giving him a tour but still
doesn't talk."|stage direction
359||INT. HOTEL ROOM - NIGHT (CONTINUOUS)|location
360||"Oliver and the woman open the door and enter her suite. They
look at each other nervously."|stage direction
361|OLIVER|Nice place.|speech
362||"They sit on her bed. She steals his pipe, put's it in her
mouth -- writes on her pad and shows it to him."|stage direction
363|OLIVER (CONT'D)|"Oh, my mother. My mother died five
years ago."|speech
364|ANNA|"(in a hoarse whisper)
Oh merd."|speech
365|OLIVER|Oh, you spoke.|speech
366|"ANNA
(A WHISPER)"|I'm not supposed to.|speech
367||She writes and present him with a new question.|stage direction
368|OLIVER|"My father died two months ago,
almost three."|speech
369||"She looks at him with sincere empathy and surprise. Oliver's
opened up, an now everything gushes out, he barely knows what
he's saying."|stage direction
370|OLIVER (CONT'D)|He, he was gay.|speech
371||She's very surprised.|stage direction
372|OLIVER (CONT'D)|"He was gay the whole time they were
married."|speech
373|"(MORE)
(CONTINUED)"|10/29/07 23.|speech
374||CONTINUED:|location
375|OLIVER (CONT'D)|"He came out after my mother died
and, uh... he was 75 years old."|speech
376||There's a quiet moment of deep connection.|stage direction
377|OLIVER (CONT'D)|Sorry.|speech
378||"She mouths ""No"" (don't say sorry). She reaches out and gently
runs a finger across Oliver's brow and the outline of his
face, he's so vulnerable, she lovingly/mischievously squishes
his face together and messes up his hair. Then she leans in,
and they kiss for the first time - delicately."|stage direction
379|"ANNA
(WHISPER)"|Can we just sleep?|speech
380|OLIVER (CONT'D)|Sure, sure.|speech
381||"They lay down, she takes his arm and pulls him into spooning
her. He pulls the covers over them."|stage direction
382||INT. HOTEL ROOM - THE NEXT MORNING|location
383||"Oliver wakes, still in his clothes. ANNA is already up. She
waves and Oliver smiles.
Anna holds up her notebook: ""Who are you?"""|stage direction
384|OLIVER|Oliver.|speech
385||"She writes again: ""Go to NY. Audition. Back Thursday."""|stage direction
386|OLIVER|"How long are you here when you get
back?"|speech
387||Anna holds up one finger.|stage direction
388|OLIVER|A year?|speech
389||Anna shakes her head and smiles. She gestures smaller.|stage direction
390|OLIVER|A month? Right. And then?...|speech
391||She pantomimes a camera rolling, and herself acting.|stage direction
392|OLIVER|You're filming here. Acting.|speech
393|(CONTINUED)|10/29/07 24.|speech
394||CONTINUED:|location
395||Oliver smiles as he interprets her gestures.|stage direction
396|OLIVER|And after?...|speech
397||She makes a casual tossing motion with her hand.|stage direction
398|OLIVER|Just somewhere else. Where?|speech
399||"Anna only shrugs. She writes more, and tosses the notepad on
his lap. Oliver reads: ""Can I see you again?""
He's very happy."|stage direction
400|OLIVER|Yes.|speech
401||INT. HOTEL HALLWAY|location
402||"They walk down the long hallway, Oliver carries her bags,
Anna holds onto Arthur's leash. Oliver reaches out and holds
her hand. They stop and kiss - gentle and comfortable with
each other."|stage direction
403||EXT. ANNA'S HOTEL, RED HALLWAY - DAY|location
404||"Oliver now alone with Arthur - heading home, he's happy.
CU on his face as he remembers...
REPEAT SCENE: Oliver and Anna's first kiss, tentative and
delicate.
CUT TO PAST"|stage direction
405||INT. HAL'S LIVING ROOM - DAY|location
406||Oliver's POV: Hal and Andy kiss lovingly.|stage direction
407||INT. HAL'S KITCHEN - DAY|location
408||"Oliver's POV: Andy comes up behind Hal doing the dishes,
kisses him. Hal smiles very happy."|stage direction
409||INT. HOSPITAL ROOM - NIGHT|location
410||"Oliver's POV: Andy kisses Hal in the Hospital.
CUT TO PRESENT"|stage direction
411|OLIVER|10/29/07 25.|speech
412||INT. OLIVER HOUSE ENTRY WAY|location
413||"Oliver and Arthur enter his home, much more alive than the
last time we saw him come through the door."|stage direction
414|OLIVER|"Hello house, (Low voice) hello
Oliver."|speech
415||INT. OLIVER'S DINING ROOM - DAY|location
416||"Oliver makes two piles of mail, one says Oliver Fields, one
has a yellow forwarding sticker that says Hal Fields. The Hal
Fields pile is much bigger."|stage direction
417|OLIVER|Jesus, Pop, you get so much mail.|speech
418||"Oliver slows and stares at his father's magazine - The
Advocate. Two attractive, shirtless men on the cover under
the title: America's Sweethearts. Oliver's lost in memory..."|stage direction
419|OLIVER|"DOCTOR LONG (O.S.)
Hal, its remarkable how well you've
recovered from being on the
ventilator."|speech
420||INT. HAL'S HOSPITAL ROOM|location
421||"Hal sit's on top of his hospital bed, wearing one of his all
black outfits, looking much healthier. A doctor sits on his
bed, Oliver listens from the side."|stage direction
422|HAL|But...?|speech
423|DOCTOR LONG|"The bronchoscopy revealed a mass
about the size of a quarter. It is
located in your lower right lung."|speech
424||CU on Hal taking this in.|stage direction
425|DOCTOR LONG|"DOCTOR LONG (CONT'D)
I'm afraid the biopsy showed it's
cancerous."|speech
426|HAL|Uh-huh. I see.|speech
427|DOCTOR LONG|"It appears to have spread... to the
large hilar lymph nodes in your
chest and liver."|speech
428|"(MORE)
(CONTINUED)"|10/29/07 26.|speech
429||CONTINUED:|location
430|"(MORE)
(CONTINUED)"|"DOCTOR LONG (cont'd)
With the already weakened state of
your heart and lungs..."|speech
431||"As Dr. Long talks about treatments, Oliver drifts back from
the conversation, slowly retreating to a window in the far
corner, as we continue to hear Dr. Long speak, we see
Oliver's thoughts, fixating on ""a mass about the size of a"|stage direction
432||"QUARTER""
WE HEAR:"|location
433|"(MORE)
(CONTINUED)"|"DR. LONG (O.S.) (CONT'D)
... Surgery isn't possible given
its location. We can start
radiation treatments and see if
you're strong enough for Chemo. You
will be able to go home."|speech
434||WE SEE:|location
435||"SHOT OF A QUARTER ON BLACK
SHOT OF TWO DIMES AND A NICKEL
SHOT OF 5 NICKELS.
SHOT OF 25 PENNIES.
We cut back to Hal's face, stoically digesting the news."|stage direction
436|DOCTOR LONG|Do you have any questions?|speech
437|HAL|No. Thank you.|speech
438||As the doctor leaves. Oliver takes his father's hand.|stage direction
439|OLIVER|I'm sorry.|speech
440|HAL|"Well, let's not rush out and tell
everyone."|speech
441|OLIVER|Andy?|speech
442|HAL|No need to get him up a tree.|speech
443||"Hal takes a moment and composes himself. In his eyes we can
see that he knows there is an end to his life."|stage direction
444|HAL (CONT'D)|Can you read me something?|speech
445|(CONTINUED)|10/29/07 27.|speech
446||CONTINUED:|location
447||"Hal hands Oliver his Advocate magazine, he begins to read
from ""Tough Guys Do Dance."""|stage direction
448|OLIVER|"The Brazilian ballet star is
already known not only as a skilled
partner, but also as a gifted and
versatile dancer, who adeptly
fields roles ranging..."|speech
449||"Camera tracks out of the room, leaving the two men alone...
CUT TO PRESENT"|stage direction
450||INT. OLIVER'S OFFICE - DAY|location
451||"SERIES OF CU JUMP CUTS: We see Oliver's hands as he draws a
series of silhouetted figures hanging from trees, others
happily beheaded, all with talking bubbles that say, ""Let's
not rush out and tell everyone""
JUMP CUTS: Oliver draws another severed head, then a woman
smoking next to the words, ""First lung cancer.""
JUMP TO LATER: Oliver tacks his drawings to the wall, looks
at them.
He looks down and pets Arthur, as we hear...
CUT TO PAST"|stage direction
452|OLIVER|"OLIVER V.O.
Yeah, he's fine. He sleeps on your
bed."|speech
453|HAL|But is he eating?|speech
454||INT. HAL'S HOSPITAL ROOM|location
455||Hal sits on his bed fully dressed, Oliver is visiting.|stage direction
456|OLIVER|Yeah, yeah, he's eating.|speech
457|HAL|Oh God, I worry so much about--|speech
458||As Andy enters, his hands mysteriously cupped together.|stage direction
459|HAL|Oh here we are...|speech
460||Andy shows Hal his cupped hands.|stage direction
461|(CONTINUED)|10/29/07 28.|speech
462||CONTINUED:|location
463|HAL (CONT'D)|What have you got in there?|speech
464|ANDY|A slug.|speech
465|HAL|"Oh, Andy, you can't bring that kind
of thing in here."|speech
466|ANDY|Oh I can look.|speech
467||"Andy flashes open his hands, revealing nothing. He snorts and
laughs."|stage direction
468|HAL|Fuck you.|speech
469||Oliver watches with amusement. NURSE SOPHIA enters...|stage direction
470|HAL|It's time for inspection...|speech
471||"The nurse works her way between Andy and Hal to take his
pulse."|stage direction
472|NURSE|Hello, Mr. Fields.|speech
473|HAL|Hello.|speech
474||"Andy feels interrupted, strangely hurt by the nurse. The
nurse begins to take Hal's vital signs."|stage direction
475|ANDY|I'm Andy. Hal's boyfriend|speech
476|NURSE|I'm Sophia.|speech
477||Andy gets more and more upset.|stage direction
478|ANDY|"You know, I have the right to be
here as much as anyone else."|speech
479||Hal lovingly cuts him off, trying to ease the tension.|stage direction
480|HAL|Go take a walk. Calm yourself.|speech
481||Andy walks out, feeling embarrassed and rejected.|stage direction
482|(CONTINUED)|10/29/07 29.|speech
483||CONTINUED:|location
484|OLIVER|What was all that?|speech
485|HAL|"Oh, Andy hasn't had it easy. Be
nice to him."|speech
486||"To everyone's surprise, Andy storms back in with a bouquet of
flowers, dumps them on Hal's chest, kisses him triumphantly
and leaves again."|stage direction
487|HAL|"(knowing he stole them)
Andy, where did you get these?"|speech
488||INT. HOSPITAL ROOM NIGHT|location
489||"JUMP CUTS: Oliver helps a group of Hal's gay friends and Andy
get settled. They're jovial, they come with drinks and
flowers, the room gets very full. Oliver hands out cups,
offers wine, Andy lifts his paper cup and makes a toast."|stage direction
490|ANDY|Guys, guys, this is to us. Cheers.|speech
491||A NURSE suddenly enters.|stage direction
492|STRICT NURSE|Drinking's not allowed in the room.|speech
493||All the guys freeze.|stage direction
494|HAL|Oh, it's not?|speech
495||"She shakes her head no, the party stops, she leaves. Oliver
instinctively polite, starts packing up their cups."|stage direction
496|OLIVER|I'm sorry.|speech
497||Moans and complaints from the group.|stage direction
498|HAL|"No, no, no. She's a wonderful
nurse. (he pauses a beat, then
raises his cup again) Here's to
health care."|speech
499||"Hal swigs back his wine. They all laugh, grab their cups and
toast."|stage direction
500|EVERYONE|To health care!|speech
501||Hal looks happy, Oliver smiles but can't believe his dad.|stage direction
502|(CONTINUED)|10/29/07 30.|speech
503||CONTINUED:|location
504|OLIVER|"What did you do with my father? He
was so polite."|speech
505|HAL|"Oh, I invited him - but he never
returns my calls."|speech
506||"The guys drink merrily. Someone shoves a cup into Oliver's
hand, pours him a drink.
CUT TO PRESENT"|stage direction
507||INT. OLD MELROSE BOOKSTORE - NIGHT|location
508||"Oliver, Elliott and Arthur are shopping in a very old and
crowded used book store. Oliver picks up a stack of magazines
as Elliott interrogates him."|stage direction
509|OLIVER|Two, four, six, eight...|speech
510|ELLIOTT|"That's it? That's all you're gonna
tell me?"|speech
511|OLIVER|"I'm gonna meet her at her hotel
again. You happy?"|speech
512|ELLIOTT|"Yeah, I'm very happy. Are you
happy?"|speech
513||Oliver drops his books on the counter to check out.|stage direction
514|OLIVER|"(to shop owner)
Here's eight..."|speech
515||Turns to Elliot.|stage direction
516|OLIVER|"We haven't actually had a
conversation yet, so, you know..."|speech
517||EXT. STREETS NIGHT - CONTINUOUS|location
518||The three are now in Oliver's car.|stage direction
519|(CONTINUED)|10/29/07 31.|speech
520||CONTINUED:|location
521|ELLIOTT|"You're thinking about her all the
time."|speech
522|OLIVER|And you know that because?|speech
523|ELLIOTT|"Because you're not talking about
it. I know you."|speech
524||There's a pause, then the truth.|stage direction
525|OLIVER|"It's true. It's embarrassing. I'm
38 and falling for a girl again..."|speech
526||CUT TO PAST|stage direction
527||INT. GEORGIA'S BEDROOM - DAY|location
528||"Georgia works at her writing table. Young Oliver, bored,
watches her."|stage direction
529|OLIVER|"OLIVER V.O. (CONT'D)
It's like I lost the instructions
or I, I never had them..."|speech
530||Young Oliver walks up to Georgia.|stage direction
531|YOUNG OLIVER|Where's Pop?|speech
532|GEORGIA|At the museum.|speech
533|YOUNG OLIVER|Is something wrong with you guys?|speech
534||Georgia is startled, she hides her feelings with humor.|stage direction
535|GEORGIA|What're you, in the FBI?|speech
536|YOUNG OLIVER|No.|speech
537|GEORGIA|The CIA?|speech
538|YOUNG OLIVER|No.|speech
539|(CONTINUED)|10/29/07 32.|speech
540||CONTINUED:|location
541|GEORGIA|"KGB? (Oliver shakes his head, no)
SLA? (no) PTA? (no) BMW?"|speech
542||Oliver sits silently.|stage direction
543|GEORGIA|"There is nothing wrong with me and
Pop."|speech
544||"Georgia's mask breaks revealing sadness. Oliver can see it,
she can see he sees it. Georgia gets up and leads Oliver out
of the room."|stage direction
545|GEORGIA (CONT'D)|C'mon.|speech
546||INT. CHILDHOOD HALLWAY - DAY|location
547||They stand in front of his bedroom door.|stage direction
548|GEORGIA|"When you feel bad, you go into a
room and scream - loud as you want,
for a minute or two, then it's out
of you. It's called catharsis."|speech
549||She opens the door, pushes him inside, and closes the door.|stage direction
550||INT. OLIVER'S CHILDHOOD ROOM - DAY|location
551||Young Oliver pauses, confused in his room. He doesn't scream.|stage direction
552||INT. CHILDHOOD HALLWAY - DAY|location
553||He comes back out. Sheepish.|stage direction
554|OLIVER|I don't feel like screaming...|speech
555||Georgia, never ruffled.|stage direction
556|GEORGIA|You will...|speech
557||CUT TO PRESENT|stage direction
558||EXT. HOLLYWOOD STREET - LATE AT NIGHT|location
559||"Oliver and Arthur watch from the car as Elliott gets a can of
spray paint, heads to a blank wall across the street and
sprays a large tag on a wall. He then runs back to the car,
looks proudly at his work."|stage direction
560|(CONTINUED)|10/29/07 33.|speech
561||CONTINUED:|location
562|OLIVER|What the fuck is that?|speech
563|ELLIOTT|L-E-IT, Elliot|speech
564|OLIVER|Well, that's ridiculous.|speech
565|ELLIOTT|"I know! (Getting his criticism
more) You're not very supportive."|speech
566|OLIVER|"Well, its just copying something
someone did, like, 30 years ago in
the Bronx."|speech
567|ELLIOTT|"Well yeah. I'm part of a tradition
of civil disobedience, something
bigger than myself."|speech
568||Oliver can't believe Elliott said that.|stage direction
569||EXT. NEW STREET|location
570||"Elliott drives along-side Oliver who's walking with a spray
paint can, terrified as he's never done this before. He
tries to spray, nothing comes out."|stage direction
571|OLIVER|How does it work?|speech
572|ELLIOTT|Shake it, you have to shake it.|speech
573||"Oliver shakes it awkwardly, then sprays across the wall:
1985 BUSH FINDS JESUS
Oliver runs back to the car, exhilarated."|stage direction
574|ELLIOTT|What was that?|speech
575|OLIVER|"Historical consciousness... you
know, something bigger than myself."|speech
576||Elliott scoffs.|stage direction
577|OLIVER|Let's do it again.|speech
578||Elliott drives off. Oliver's coming to life.|stage direction
579|(CONTINUED)|10/29/07 34.|speech
580||"CONTINUED:
WE HEAR:"|location
581|(CONTINUED)|"ELLIOTT (V.O.)
Okay, but when you see her, don't
tell her that you painted
historical consciousness on the
wall..."|speech
582||WE SEE: more of Oliver's graffiti on different buildings:|stage direction
583||1983 CHICKEN MCNUGGETS|location
584||2003 BRITNEY SPEARS MOST GOOGLED|stage direction
585||EXT. OLIVER'S HOUSE DAY|location
586||"Oliver exits his house alone, down his front stairs to the
street. Halfway down, he hears now familiar sound of Arthur
barking and howling. Oliver can't believe it."|stage direction
587||INT. ANNA'S HOTEL ROOM|location
588||Anna is sitting on the bed, gently petting Arthur.|stage direction
589|ANNA|He's sweet. He misses your Dad.|speech
590||"She stops. Gets up, nervous, and walks past Oliver into the
next room. Oliver follows her in. They pause uncomfortably,
Anna suddenly leans in and kisses him. Before it goes to
far..."|stage direction
591|OLIVER|"Maybe we, we could, um, just talk
for a second."|speech
592|ANNA|Right.|speech
593||"They awkwardly break apart. Anna goes to a chair, Oliver
follows. While nothing has really been expressed between the
two, Anna seems to understand the problem."|stage direction
594|ANNA|"Well, my name is Anna. You're
worried you can't trust me because
you don't know who I am. I get it.
That makes sense to me."|speech
595||"She falters, looks at him vulnerably. Oliver abruptly kisses
her. She pushes back. They pause. She traces his brow slowly
with her index finger, the way she did their first night.
JELLY ROLL MORTON'S ""SWEET JAZZ MUSIC"" PLAYS"|stage direction
596|(CONTINUED)|10/29/07 35.|speech
597||CONTINUED:|location
598||"CUT TO POST SEX:
The music carries us, they lie in bed, naked. Anna innocently
leans over and takes Oliver's arm and bites down hard. He
grimaces. She stops and kisses it, admiring her teeth marks.
She gets up, sits at a side table and finds her cigarettes.
Oliver watches her.
The music seems to bend and slow down, this continues as we
fall into memory...
CUT TO PAST"|stage direction
599||INT. GEORGIA'S BEDROOM|location
600||"CU on young Oliver's hand pushing on a record making the
bending, slowing sounds."|stage direction
601|GEORGIA|Oliver, stop it.|speech
602||"Oliver stands up bored, Georgia's in the connecting bathroom
getting ready to go out."|stage direction
603|OLIVER|This music's old.|speech
604|GEORGIA|"It's black, black music is the
deepest cause they suffered the
most, them and the Jews."|speech
605||Oliver plops down on the bed, listening to her.|stage direction
606|GEORGIA|"In my next life I'm gonna marry a
good hot blooded Jew - someone full
of emotion."|speech
607|OLIVER|I'm Jewish right?|speech
608||"Georgia comes and sits with him, caresses his hair as she
talks with him."|stage direction
609|GEORGIA AT 50|"You're a quarter, I'm a half, your
father's none. He has the least
emotions, You'll have more emotions
than him, but I'll have the most
emotions."|speech
610||She likes that she has the most emotions. They head out.|stage direction
611|(CONTINUED)|10/29/07 36.|speech
612||CONTINUED:|location
613|GEORGIA AT 50|"You get to play chauffeur but just
to the bottom of the hill."|speech
614||EXT. OLIVER'S CHILDHOOD CAR|location
615||"10 year old Oliver's in the driving sear, Georgia smokes and
admires his handling of the car."|stage direction
616|GEORGIA|"You're turning into a wonderful
driver."|speech
617||Oliver's proud.|stage direction
618||INT. LACMA ART MUSEUM STEPS DAY|location
619||"Oliver escorts Georgia up the large steps of the museum. The
crowd from an opening gathers at the top."|stage direction
620||INT. DAVID SMITH GALLERY LACMA DAY|location
621||"Georgia and Oliver approach a David Smith sculpture. After
staring at it's angels for a beat, Georgia begins to do an
angular modern-dance-pantomime of the sculpture, imitating
it's shapes with her body. Oliver locks up with
embarrassment. A confused and concerned museum guard
approaches."|stage direction
622|SECURITY GUARD|Excuse me Mrs. Fields....|speech
623|GEORGIA|"What? You're not allowed to
interact with the art?"|speech
624|SECURITY GUARD|It's just that...|speech
625|OLIVER|C'mon.|speech
626||"Still embarrassed, Oliver takes Georgia's hand and walks her
away from the guard."|stage direction
627|GEORGIA|"You too? You like being a good
citizen?"|speech
628|OLIVER|No.|speech
629||CUT TO PRESENT|stage direction
630|OLIVER|10/29/07 37.|speech
631||INT. ANNA'S HOTEL ROOM - LATER|location
632||Anna's sits in her kimono. Oliver's buttoning his shirt.|stage direction
633|ANNA|Can you toss me my camisole.|speech
634||Oliver throws a sweater.|stage direction
635|ANNA (CONT'D)|No, my camisole.|speech
636||"She throws the sweater back at him. Oliver looks around
helplessly. He grabs a flower out of a vase and hands it to
her."|stage direction
637|OLIVER|Camisole?|speech
638||Anna laughs.|stage direction
639|ANNA|You don't know what a camisole is?|speech
640|OLIVER|"I was brought up by these animals
and they didn't like questions."|speech
641||They're both smiling now.|stage direction
642|OLIVER|"They were very frowned upon. So I
had to guess."|speech
643||Anna takes this in.|stage direction
644|ANNA|You can ask me anything.|speech
645|OLIVER|Anything?|speech
646||CUT TO: Oliver and Anna at the window.|stage direction
647|OLIVER|What's out there?|speech
648||She points.|stage direction
649|ANNA|That's a tree.|speech
650|OLIVER|Yeah.|speech
651|(CONTINUED)|10/29/07 38.|speech
652||CONTINUED:|location
653|ANNA|And cars.|speech
654|OLIVER|Uh-huh.|speech
655|ANNA|Another building like this one.|speech
656|OLIVER|Right.|speech
657|ANNA|"People in the building like us.
Half of them think things will
never work out. The other half
believe in magic. It's like a war
between them."|speech
658||Oliver smiles. He moves away from the window.|stage direction
659|OLIVER|"How do you know so much about
people?"|speech
660|ANNA|"Oh. Well, you have to learn how to
read their faces."|speech
661||She climbs onto his lap, straddles him.|stage direction
662|ANNA|For example... here is mad.|speech
663||"Anna passes her hand across her face, and she's ""mad""."|stage direction
664|ANNA|Happy...|speech
665||"Her hand passes again and she's ""happy""."|stage direction
666|ANNA|Sometimes its just nothing.|speech
667|OLIVER|Oh yeah?|speech
668||She points at her blank face.|stage direction
669|ANNA|"This is nothing... And they are
good at looking one way and being
another way."|speech
670||Her playfulness is very meaningful to Oliver, he's in love.|stage direction
671|ANNA|10/29/07 39.|speech
