|character|text|type
0||"T H E   A M E R I C A N   P R E S I D E N T
Screenplay by Aaron Sorkin
FADE IN:
As the OPENING TTTLES ROLL against a series of shots of
statues and paintings of former presidents, we HEAR shards of
dialogue from various presidential speeches.
MAIN TITLES END ON"|stage direction
1||EXT. BEAUTIFUL ESTABLISHING SHOT OF THE WHITE HOUSE - DAY|location
2||"It's an early November morning, and the sun has just come
over this extraordinary building. WE HOLD on this for a moment
before we"|stage direction
3||CUT TO:|unknown
4||INT. A CORRIDOR IN THE RESIDENCE - DAY|location
5||"A SECRET SERVICE AGENT presses the button by the private
elevator as he talks into his shirt cuff."|stage direction
6|AGENT COOPER|Liberty's moving.|speech
7||"Another AGENT rounds the corner into the corridor and is
followed a step or two later by
PRESIDENT ANDREW BENJAMIN SHEPHERD.
SHEPHERD's walking with his personal assistant, JANIE, a shy,
professional and incredibly efficient 25-year-old."|stage direction
8|JANIE|"The 10:15 event's been moved inside
to the Indian Treaty Room."|speech
9||(to Janie)|location
10|SHEPHERD|The 10:15 is American Fisheries?|speech
11|JANIE|"Yes, sir. They're giving you a
200-pound halibut."|speech
12|SHEPHERD|"Janie, make a note. We need to
schedule more events where somebody
gives me a really big fish."|speech
13||JANIE starts to make a note.|stage direction
14|JANIE|Yes, sir.|speech
15|SHEPHERD|Janie, I was kidding.|speech
16|JANIE|Of course, sir.|speech
17||"(to the AGENT at the
elevator)"|unknown
18|SHEPHERD|Hey, Cooper.|speech
19|AGENT COOPER|'Morning, Mr. President.|speech
20||SHEPHERD and JANIE enter the elevator. As the doors close...|stage direction
21|JANIE|"Mr. Rothschild asked to have a moment
with you this morning."|speech
22|SHEPHERD|Is he upset about the speech last night?|speech
23|JANIE|He seemed concerned.|speech
24|SHEPHERD|"Well, it wouldn't be a Monday morning
unless Lewis was concerned about
something I did Sunday night."|speech
25||"The elevator doors open, revealing LEWIS ROTHSCHILD. At 32,
LEWIS is the President's chief domestic policy advisor. It
would appear that he averages about two hours sleep a night,
though that doesn't seem to slow him down."|stage direction
26|LEWIS|You skipped the whole paragraph.|speech
27||(to Janie)|location
28|SHEPHERD|And Monday morning it is.|speech
29||"LEWIS falls into the pace as the three of them head for the
double doors leading to the South Lawn."|stage direction
30|LEWIS|"""American can no longer afford to
pretend that they live in a great
society""...and then nothing. You
dumped the whole handguns paragraph."|speech
31|SHEPHERD|This is a time for prudence, Lewis.|speech
32|LEWIS|That was the kick-ass section.|speech
33||"The three of them are now OUTSIDE and making their way down
the COVERED WALKWAY that runs from the East Wing to the West
Wing."|stage direction
34|SHEPHERD|"I thought what with being the
President and all..."|speech
35|LEWIS|"Sir, of course I didn't mean to
imply--"|speech
36|SHEPHERD|"I thought you'd be turning cartwheels
this morning, Lewis -- 63 percent job
approval."|speech
37|LEWIS|That's great news, sir, but...|speech
38||They walk past a GROUNDKEEPER who's at work at a patch of grass.|stage direction
39|GROUNDKEEPER|'Morning, Mr. President.|speech
40||"Before he's even completed the last syllable of the greeting,
JANIE quickly and quietly said--"|stage direction
41|JANIE|Charlie.|speech
42|SHEPHERD|'Morning, Charlie.|speech
43|LEWIS|"Sir, the press is gonna need an
explanation."|speech
44|SHEPHERD|For what?|speech
45||"SHEPHERD, LEWIS and JANIE walk through the door being held
open by an AGENT. The conversation continues as they make
their way through the corridors of"|stage direction
46||INT. THE WEST WING - DAY|location
47||"They walk quickly down a hallway teeming with STAFFERS, AIDES
AND OFFICE WORKERS."|stage direction
48|LEWIS|"Because you dropped the whole kick-ass
section, now we've got this thing hanging
out there."|speech
49|SHEPHERD|There's a thing hanging out there?|speech
50|LEWIS|"""Americans can no longer afford to
pretend that they live in a great
society."" Then ...nothing. No
explanation. No context. So now it's
just this thing."|speech
51|SHEPHERD|And it's hanging out there?|speech
52|LEWIS|Yes, sir.|speech
53||SHEPHERD stops at an open doorway, calls to a STAFFER--|stage direction
54|SHEPHERD|Maria--|speech
55|STAFFER (MARIA)|Good morning, sir.|speech
56|SHEPHERD|Did they tell you I'm gonna need--|speech
57|STAFFER (MARIA)|"--overall consumer spending and not
just first homes. Yes, sir. We'll have
it for you in 15 minutes."|speech
58|SHEPHERD|Thanks.|speech
59||SHEPHERD moves on. LEWIS and JANIE stay with him.|stage direction
60|LEWIS|"Mr. President, I really feel we need
to focus on..."|speech
61|SHEPHERD|"Lewis, however much coffee you drink
in the morning, I want you to reduce it
by half."|speech
62|LEWIS|I don't drink coffee.|speech
63|SHEPHERD|"Then hit yourself over the head with
a baseball bat, would you please?"|speech
64||Another STAFFER crosses their path--|stage direction
65|JANIE|Happy birthday, Laura.|speech
66|SHEPHERD|Hey, Laura, happy birthday.|speech
67|STAFFER (LAURA)|Thank you, sir.|speech
68||Once out of earshot--|stage direction
69||(to JANIE)|unknown
70|SHEPHERD|I should send her some flowers.|speech
71|JANIE|You already did, sir.|speech
72||And, with that, they walk through a doorway and into|stage direction
73||INT. THE OVAL OFFICE - DAY|location
74||"In the OUTER OFFICE, MRS. CHAPIL, the President's secretary,
is hard at work on a word processor. She stands as SHEPHERD
walks in--"|stage direction
75|MRS. CHAPIL|Good morning, Mr. President.|speech
76|SHEPHERD|How're you, Mrs. Chapil?|speech
77|MRS. CHAPIL|"Fine, thank you, sir. Mr. Kodak left
the detailed breakdown of the approval
poll for you. He seemed to indicate that
it was very good news."|speech
78|SHEPHERD|Sixty-three percent of it, at any rate.|speech
79||"And by now they're in the OVAL OFFICE itself. SHEPHERD has
gone to his desk and is looking over the various overnight
briefing memos that have been left for him. As someone used
to doing six things at once, he has no trouble reading,
listening, and talking at the same time."|stage direction
80|MRS. CHAPIL|"Lucy called just a moment ago. You
forgot to sign her permission slip
for her class--"|speech
81|JANIE|--the museum trip. I'll go get it.|speech
82||(to JANIE)|location
83|SHEPHERD|What time does she get home today?|speech
84|JANIE|Three-twenty.|speech
85|SHEPHERD|How's my afternoon look?|speech
86|JANIE|Very crowded.|speech
87|SHEPHERD|Schedule some time for me at 3:30.|speech
88|WOMAN (O.S.)|Buenos dias, Senor Presidente.|speech
89||"This from ROBIN McCALL, a strikingly tall black woman and the
President's press secretary, as she strides into the room."|stage direction
90|SHEPHERD|Too-tall McCall, how was Mexico?|speech
91|ROBIN|"I didn't truly appreciate it until I
came back and discovered that America
isn't a great society."|speech
92||(to ROBIN)|location
93|LEWIS|He dumped a whole section.|speech
94|SHEPHERD|Now there's a thing hanging out there.|speech
95|ROBIN|Not a great society, sir?|speech
96|SHEPHERD|"Well, with you out of the country, it
wasn't, Robin. Now that you're back,
we're great again."|speech
97|ROBIN|"There's a press room full of people
saying ""What did he mean by that?"""|speech
98|LEWIS|See?|speech
99||(re: a memo he's been|location
100||looking at)|unknown
101|SHEPHERD|A.J., did you get one of these?|speech
102||"This is said to A. J. MACINERNEY as he walks through a
separate entrance on the left side of the room. In addition
to being the President's Chief of Staff and closest advisor,
he's the President's closest and oldest friend."|stage direction
103|A.J.|"Is that the letter from Solomon at
the GDC?"|speech
104|SHEPHERD|"It would appear to be a letter from
the entire environmental community.
These people are outta control."|speech
105|A.J.|"I think they're just frustrated,
Mr. President."|speech
106|ROBIN|"Are they blaming the President for
global warming?"|speech
107|A.J.|"Well, they don't think he caused it,
if that's what you mean."|speech
108||(continuing;|location
109||to SHEPHERD)|unknown
110|A.J.|"Sir, I'm on the phone with these
people twice a week. I honestly
don't know what they want at this
point."|speech
111|LEWIS|"What they want is a 20 percent reduction in
fossil fuel emissions."|speech
112|A.J.|It won't pass at 20 percent.|speech
113|LEWIS|We haven't really tried.|speech
114|A.J.|"Lewis, McSorley, McCluskey and Shane
hold too many markers. If we try to
push this through and lose, there will
be a very loud thud when we hit the
ground, and that's not what you want in
an election year."|speech
115|SHEPHERD|"Talk to the GDC again, A.J. Tell them
the President resents the implication
that he's turned his back on the
environment. Tell them I'll send 455 to
the floor. But we're gonna ask for a
10 percent reduction. If they want to pull
their support, fine. At 63 percent job
approval rating. I don't need their help
getting a bill passed. We gotta get going--
where's Leon?"|speech
116||(to an AIDE)|location
117|A.J.|"Would you call Mr. Kodak and tell him
the President's--"|speech
118||"A.J.'s sentence is cut short by the sound of a head-on
pedestrian collision in the outer office--"|stage direction
119|MRS. CHAPIL (O.S.)|Aaagh!|speech
120|KODAK (O.S.)|Sorry! Sorry, my fault.|speech
121||(to the AIDE)|location
122|A.J.|Never mind.|speech
123||"LEON KODAK comes into the oval office. The White House
pollster is a likable, if clumsy, numbers whiz. He, along
with A.J., LEWIS, and ROBIN, are regarded as the President's
Starting Team. The people in this room have grown very close
over the past few years."|stage direction
124|KODAK|Excuse me. Good morning, Mr. President.|speech
125|SHEPHERD|You all right?|speech
126|KODAK|They keep moving that big ficus plant.|speech
127|A.J.|We're all here, Mr. President.|speech
128|SHEPHERD|"Okay. First, I wanted to say
congratulations. Three years ago, we
were elected to the White House by
one of the narrowest margins in history,
and today Kodak tells us 63 percent of
registered voters think we're doing a
good job."|speech
129|KODAK|"Wait a second. You wanted me to poll
registered voters?"|speech
130||Everyone LAUGHS... even SHEPHERD smiles...|stage direction
131|SHEPHERD|"But the poll also tells us what we
already knew: We don't get this
crime bill of ours through Congress
and these numbers are gonna be a
memory. So, starting today, we're
shifting it into gear."|speech
132|ROBIN|"Can I tell my morning press gaggle
that gun control--"|speech
133|A.J.|"Crime control, Robin. Gun control
means we're wimps and we're soft on
crime."|speech
134|LEWIS|Hang on, are we not--|speech
135|A.J.|Lewis--|speech
136|LEWIS|"Are we not putting back the handgun
restrictions?!"|speech
137|A.J.|We're leaving 'em out.|speech
138|LEWIS|"Sir, we campaigned on this issue.
Now, I understand we took it out when
we were in the low forties, but we
can push it through now."|speech
139|SHEPHERD|After the elections.|speech
140|LEWIS|"Sir, we may never have an opportunity
like this again. Let's take this 63
percent out for a spin and see what
it can do."|speech
141|SHEPHERD|"We can't take it out for a spin, Lewis.
We need it to get re-elected. For
reasons passing understanding, people
do not relate guns to gun-related crime."|speech
142|A.J.|"Robin, you can brief the press this
afternoon. As of today, the crime
bill's priority one on the President's
domestic agenda."|speech
143|ROBIN|Got it.|speech
144|A.J.|"Leon, you're gonna run the war room.
We're gonna need detailed projections
for all the target districts by the
end of the week. And, Leon, don't be
a nice, sweet guy from Brooklyn. Do
what the N.R.A. does."|speech
145|KODAK|Scare the shit out of 'em?|speech
146|A.J.|Yeah.|speech
147|KODAK|I can do that.|speech
148|A.J.|"Lewis, we want you to be legislative
liaison on this. You're gonna run
the show on the hill."|speech
149|LEWIS|"Can I just say, to return to the
subject for one moment, that it might
be easier to fight a war on drugs if
we weren't arming drug dealers."|speech
150||"SHEPHERD responds a little too quickly -- we see a spark of a
temper."|stage direction
151|SHEPHERD|"Lewis, we've gotta fight the fights
we can win."|speech
152|LEWIS|Yes, sir.|speech
153|A.J.|"We want to announce the crime bill at
the State of the Union, which is 72
days from today. The last nose count
put us 18 votes short."|speech
154|SHEPHERD|"Eighteen votes in 72 days. Thank you,
everyone. Janie, what's next?"|speech
155|A.J.|Thank you, Mr. President.|speech
156||"The meeting's over. LEWIS, ROBIN, and KODAK say their ""Thank
you, Mr. President""'s as they exit."|stage direction
157|JANIE|Security briefing, sir.|speech
158||CUT TO:|unknown
159||EXT. THE WASHINGTON BUSINESS DISTRICT - DAY|location
160||"It's around 10 o'clock the same morning as the capital district,
in its own way, is showing signs of the approaching Thanksgiving
and Christmas holidays."|stage direction
161||EXT. A CHROME AND GLASS BUILDING - DAY|location
162||"On the seventh floor of the building. A RECEPTIONIST tells us
where we are by answering the phone--"|stage direction
163|RECEPTIONIST (V.O.)|Global Defense Council...|speech
164|SUSAN (V.O.)|You wanted to see me?|speech
165|LEO (V.O.)|"I just got off the phone with A.J.
MacInerney."|speech
166||CUT TO:|unknown
167||INT. LEO SOLOMON'S OFFICE - DAY|location
168||"LEO, a white-haired man in his early 60's is meeting with
SUSAN SLOAN, a 40'ish lawyer who seems to go out of her way
to create an issue where none exists."|stage direction
169|SUSAN|Did the President read the letter?|speech
170|LEO|"The President's pissed as hell,
Susan. That letter was a stupid move."|speech
171|SUSAN|"It was aggressive, and we should
stand by every--"|speech
172|LEO|"This isn't the guy who needed us four
years ago, Susan. He's incredibly
popular. He's gonna win re-election
in a walk, and he could give a shit
what we stand by! If the President
passes the most important piece of
environmental legislation in history,
and does it despite our negative
endorsement, our political weight in
the future will rank somewhere below
the Save the Spotted Owl Society."|speech
173||(beat)|location
174|LEO|I'm bringing in some help.|speech
175|SUSAN|"We don't need another environmental
expert to confirm what every other
environmental expert--"|speech
176|LEO|"Not an environmental expert, a
professional political strategist.
We're playing hardball with Andrew
Shepherd, and we need a heavy bat."|speech
177|SUSAN|Who?|speech
178|LEO|Sydney Ellen Wade.|speech
179|SUSAN|"Oh Christ. That woman doesn't know
the first thing about the
environmental lobby."|speech
180|LEO|"She's a closer, Susan. She gets the
job done."|speech
181||CUT TO:|unknown
182||INT. THE OVAL OFFICE - DAY|location
183||SHEPHERD and LEWIS -- working on a speech.|stage direction
184|SHEPHERD|Try it like this and lose that.|speech
185||(entering)|location
186|ROBIN|"David Sasser from the Times called
and wanted to know what the White
House felt was a great society."|speech
187|LEWIS|What did you tell him?|speech
188|ROBIN|"I told him I couldn't speak for the
President, but for my money: Bermuda."|speech
189|SHEPHERD|Perfect.|speech
190||JANIE steps in--|stage direction
191|JANIE|"Mr. President, your cousin Judith's
come down with the flu and won't be
able to join you Thursday night."|speech
192|SHEPHERD|"That's too bad. Remind me to give
her a call later."|speech
193|JANIE|Yes, sir.|speech
194|ROBIN|You gonna go stag?|speech
195|SHEPHERD|That's not a problem.|speech
196|ROBIN|"No. We've never gone wrong parading
you around as the lonely widower."|speech
197||The words came out casually, but they instantly freeze everyone.|stage direction
198||(continuing)|location
199|ROBIN|My God.|speech
200||(beat)|unknown
201|ROBIN|I can't believe I said that.|speech
202||(beat)|location
203|ROBIN|"Mr. President, that was an incredibly
thoughtless remark. I would never
dream of insulting you or the memory
of your wife."|speech
204|SHEPHERD|That's okay, forget it.|speech
205||(to JANIE)|unknown
206|SHEPHERD|What time is it?|speech
207|JANIE|It's 3:45, sir.|speech
208|SHEPHERD|I'm gonna go over and say hi to Lucy.|speech
209|JANIE|"You have the Attorney General at 4:00
and the trade representative at 4:30.
Somewhere in there you promised NPR
five minutes."|speech
210|ROBIN|Mr. President--|speech
211|SHEPHERD|Robin, don't worry about it.|speech
212||CUT TO:|unknown
213||INT. THE RESIDENCE - DAY|location
214||"We HEAR the sound of a TROMBONE being played--not well--from
one of the rooms. SHEPHERD comes around and down the corridor.
He walks into--"|stage direction
215||INT. LUCY'S ROOM - DAY|location
216||LUCY, Shepherd's 12-year-old daughter, stops playing.|stage direction
217|SHEPHERD|"No, keep going. I liked what you
were playing? What's it called?"|speech
218|LUCY|Scales.|speech
219|SHEPHERD|Well... you play it with gusto!|speech
220|LUCY|Are my lips swollen?|speech
221|SHEPHERD|Are they supposed to be?|speech
222|LUCY|Yeah.|speech
223|SHEPHERD|Then you're doing fine.|speech
224|LUCY|Whatcha got behind your back?|speech
225|SHEPHERD|A little gift.|speech
226|LUCY|Is it a dirt bike?|speech
227|SHEPHERD|Nope.|speech
228||He hands her an old textbook ...|stage direction
229|LUCY|"Is it a really old seventh-grade
textbook of yours that you're gonna
make me read cover to cover and
discuss at dinner and drive me crazy
with?"|speech
230|SHEPHERD|"I'm not comfortable with the ""really
old"" part, but everything else you
said was true."|speech
231||(reading the cover)|location
232|LUCY|"""Understanding the Constitution."""|speech
233|SHEPHERD|"Your social studies teacher said your
class would be starting on the
Constitution this week."|speech
234|LUCY|You talked to Mr. Linder?|speech
235|SHEPHERD|"Yes. It's called a Parent-Teacher
Conference. Mr. Linder and I were
the key player in that discussion.
Why don't you like social studies,
Luce?"|speech
236|LUCY|I like it fine, Dad.|speech
237|SHEPHERD|"All your other teachers say you're
happy, you're enthusiastic, you've
always got your hand up...Mr. Linder
says you don't participate unless he
calls on you, and even then it's a
one-word answer."|speech
238|LUCY|"I don't know what to say, Dad. I
guess I'm just not...I don't know."|speech
239|SHEPHERD|"Luce, take a look at this book. This
is exciting stuff. It's about who we
are and what we want. Read what it
says on the first page."|speech
240||(reading)|location
241|LUCY|"""Property of Gilmore Junior High
School."""|speech
242|SHEPHERD|The next page.|speech
243||(reading)|location
244|LUCY|"""We, the People, of the United States,
in order to form a more perfect union..."""|speech
245|SHEPHERD|"See? Grabs you right off the bat.
It's a page-turner."|speech
246|LUCY|I can't wait.|speech
247|SHEPHERD|"Good, 'cause it's possible the subject
might come up at dinner tonight."|speech
248|LUCY|"Do you see it as part of your job to
torture me?"|speech
249|SHEPHERD|"No, it's just one of the perks. See
you tonight."|speech
250||"He gives her a kiss on the head and heads out the door.
Behind him, he hears Lucy's rendition of ""Hail to the Chief.""
SHEPHERD shoots her a look as we"|stage direction
251||CUT TO:|unknown
252||INT. CABINET ROOM - NIGHT|location
253||"Where SHEPHERD is finishing a meeting with the DEFENSE
SECRETARY, CHAIRMAN OF THE JOINT CHIEFS and a NATIONAL
SECURITY ADVISOR, each of whom is accompanied by at least one
DEPUTY or AIDE. A.J. is also present."|stage direction
254|DEFENSE SECRETARY|"The C-STAD hardware's been in place
for a month. We've got 22 instructors
from the Army Air Defense School waiting
to go down and train the Israelis."|speech
255|A.J.|How soon can you deploy them?|speech
256|CHAIRMAN|"We can airlift 'em in the morning.
They'll have C-STAD operational in 20
days."|speech
257|A.J.|Any security concerns?|speech
258|SECURITY ADVISOR|"If anybody wanted to hit it, they'd
have hit it by now."|speech
259|SHEPHERD|"Okay. Let's move on it. Thank you,
gentlemen."|speech
260||"SHEPHERD and A.J. leave the Cabinet Room amidst a volley of
""good-bye"" 's and ""Thank you, Mr. President""'s.
They pass MRS. CHAPIL and JANIE."|stage direction
261||(continuing)|location
262|SHEPHERD|Have a good evening, Mrs. Chapil.|speech
263|MRS. CHAPIL|You too, Mr. President.|speech
264||"SHEPHERD starts his walk from the West Wing back to the
residence.
It is the exact reverse of the path he took to the OVAL OFFICE
in the morning."|stage direction
265|SHEPHERD|I'll see you in the morning, Janie.|speech
266|JANIE|You will, Mr. President.|speech
267||A SECRET SERVICE AGENT follows at a distance.|stage direction
268||(sotto)|location
269|AGENT #2|Liberty is moving.|speech
270|A.J.|"Leo Solomon brought in a hired gun
at the GDC."|speech
271|SHEPHERD|It's about time.|speech
272|A.J.|"She's a lawyer from Virginia named
Sydney Ellen Wade. I know this woman
well. She's had a lot of success
getting congressmen elected."|speech
273|SHEPHERD|"Maybe we should try to steal her.
Ten percent, A.J. Don't let them
leave the room till they're clear
about that."|speech
274|A.J.|"You know, if you've got a free second,
maybe you could stop in and say hello.
It might smooth the way."|speech
275|SHEPHERD|Mention it to Janie.|speech
276|A.J.|Good.|speech
277|SHEPHERD|"Then let's clear this off the table
and get everybody focused on the
crime bill. I don't want to win
this. I want to win it by a couple of
touchdowns."|speech
278|A.J.|We will, Mr. President.|speech
279||SHEPHERD|unknown
280|A.J.|Good.|speech
281||A.J. starts to leave. SHEPHERD stops him.|stage direction
282||(continuing)|location
283|SHEPHERD|A.J.?|speech
284|A.J.|Yes?|speech
285|SHEPHERD|"Listen, Robin said something to me
today that I'm sure she wouldn't have
said it if...I mean, she wasn't saying
it to me, I realize..."|speech
286||(beat)|location
287|SHEPHERD|Ah, never mind. Have a good night.|speech
288|A.J.|Good night, Mr. President.|speech
289|SHEPHERD|"A.J., when we're out of the office
and we're alone, you can call me Andy."|speech
290|A.J.|I beg your pardon?|speech
291|SHEPHERD|"I mean you were the best man at my
wedding, for crying out loud. Call
me Andy."|speech
292||(laughing off the|location
293||suggestion)|unknown
294|A.J.|Whatever you say, Mr. President.|speech
295||They have reached the south entrance to the White House.|stage direction
296||(continuing)|location
297|A.J.|Have a good night, sir.|speech
298|SHEPHERD|Good night, A.J.|speech
299||SHEPHERD enters the White House.|stage direction
300||CUT TO:|unknown
301||EXT. THE WHITE HOUSE - NIGHT|location
302||DISSOLVE TO:|unknown
303||EXT. THE WHITE HOUSE - DAY|location
304||"It's early morning of the following day, and the grounds
outside are in full swing."|stage direction
305||EXT. THE NORTHWEST EXECUTIVE ENTRANCE - DAY|location
306||"In front of the guardhouse, Susan and her new colleague,
SYDNEY ELLEN WADE, are being cleared."|stage direction
307||(to the GUARD)|location
308|SYDNEY|Hi, my name's Sydney Ellen Wade.|speech
309|SUSAN|He just needs your driver's license.|speech
310||SUSAN hands the guard her license.|stage direction
311||(handing him her|location
312||license)|unknown
313|SYDNEY|I'm from Virginia.|speech
314|SUSAN|He doesn't care.|speech
315||(to the GUARD)|location
316|SYDNEY|"I'm here for a meeting with Mr.
MacInerney."|speech
317|SUSAN|He doesn't need to know that.|speech
318||The GUARD BUZZES her through the gate.|stage direction
319||(to the GUARD)|location
320|SYDNEY|"Forgive me, this is my first time at
the White House. I'm trying to savor
the Capra-esque quality."|speech
321|SUSAN|"He doesn't know what Capra-esque
means."|speech
322||(to SUSAN)|location
323|GUARD|"Yeah, I do. Frank Capra, great
American director -- It's a Wonderful
Life, Mr. Smith Goes to Washington."|speech
324||(handing SYDNEY and SUSAN|location
325||their laminated passes)|unknown
326|GUARD|"Sydney Ellen Wade of Virginia. Knock
'em dead."|speech
327|SYDNEY|Thanks.|speech
328||"SYDNEY and SUSAN begin to walk up the path toward the entrance
to the West Wing."|stage direction
329||CUT TO:|unknown
330||INT. THE OVAL OFFICE - DAY|location
331||"A meeting with the EDUCATION SECRETARY, the HUD SECRETARY,
several AIDES and LEWIS is breaking up. SHEPHERD is ushering
people out."|stage direction
332|SHEPHERD|"The day the government starts
subsidizing private schools is the
day we give up on public education."|speech
333||EDUCATION SECRETARY|unknown
334|SHEPHERD|"I know the proposal only scratches
the surface, but it's the least we
can do."|speech
335|SHEPHERD|"We're already doing the least we can
do, but I can't think of anything
better, so we'll go with this for now."|speech
336||(to HUD SECRETARY)|location
337|SHEPHERD|"Jerry, say hello to Linda for me.
And if I don't see you again, have a
good Thanksgiving."|speech
338|HUD SECRETARY|Thank you, Mr. President.|speech
339||"The room has cleared...JANIE is arranging new papers on the
President's desk."|stage direction
340|SHEPHERD|How're we doing?|speech
341|JANIE|"You're running four minutes ahead of
schedule."|speech
342|SHEPHERD|Ahead?|speech
343|JANIE|Yes, sir.|speech
344||(exited)|location
345|SHEPHERD|"Janie, this is unprecedented. I don't
know what to do with myself."|speech
346|JANIE|"Mr. MacInerney asked me to remind you
to pop your head in on--"|speech
347|SHEPHERD|The GDC meeting. Right.|speech
348||CUT TO:|unknown
349||INT. A.J.'s OFFICE - DAY|location
350|A.J.|"Your concerns are not falling on deaf
ears. The environmental lobby has
known no greater alley in the White
House than President Shepherd."|speech
351|SYDNEY|Hardly an impressive distinction, A.J.|speech
352||SUSAN is trying to avert the inevitable--|stage direction
353|SUSAN|"Sydney, we should leave Mr. MacInerney
alone now. He's already given us more
time than--"|speech
