|character|text|type
672||EXT. FREEWAY PEDESTRIAN OVERPASS|location
673||"They walk through a caged-in freeway overpass - Oliver is
carrying Arthur while blindfolding Anna with his hands. Over
this we hear the sounds of the quiet hotel room and an
intimate conversation between them."|stage direction
674|ANNA|"ANNA (V.O.)
You don't know me. I like that.
OLIVER (V.O.)
No, that's not true.
ANNA (V.O.)
Oh yeah?
OLIVER (V.O.)
Yeah, you have blonde hair that
goes down to about here. You smoke
in non-smoking rooms."|speech
675||"Oliver is still covering her eyes, leading her to a certain
point, the busy sound of the freeway fading up..."|stage direction
676|OLIVER|Okay, open your eyes...|speech
677||"HIGH ANGLE on huge trucks and traffic racing just beneath
Oliver and Anna's feet under the overpass. The trucks lay on
their horns as they pass, scaring and thrilling them.
MOMENTS LATER: they walk alongside the LA river together, arm
in arm, happy. The intimate conversation continues in voice
over."|stage direction
678|OLIVER|"ANNA (V.O.)
Oh yeah? You drive on the sidewalk.
You were raised by animals.
Sometimes you look very alone, like
you just got here."|speech
679||They meet up with friends on the banks of the river.|stage direction
680|OLIVER|"OLIVER (V.O.)
Yeah, you see, you don't know me at
all."|speech
681||INT. ANNA'S HOTEL HALLWAY|location
682||"Oliver and Arthur are leaving, walking down the long hallway
together. Arthur seems to stop and look up at Oliver."|stage direction
683|ARTHUR SUBTITLE|"She's unlike any girl I've ever
met."|speech
684|(CONTINUED)|10/29/07 40.|speech
685||CONTINUED:|location
686||Oliver stops and looks at Arthur.|stage direction
687|OLIVER|"Someone flashy walks into your life
and you're just gonna fall for it?"|speech
688|ARTHUR SUBTITLE|Are we married yet?|speech
689|OLIVER|"No, uh, it doesn't work like that.
There are other steps, it's
complicated."|speech
690||They look at each other a beat and then walk on together.|stage direction
691|ARTHUR SUBTITLE|I hope this feeling lasts.|speech
692||CUT TO PAST|stage direction
693||INT. HAL'S HOSPITAL BATHROOM - DAY|location
694||Oliver is shaving Hal's face.|stage direction
695|HAL|What happened with Michelle?|speech
696|OLIVER|You know... I don't know.|speech
697|HAL|She seemed great.|speech
698|OLIVER|She was great.|speech
699|HAL|"Maybe you should take out a
personal ad, where you explain your
situation?"|speech
700|OLIVER|My situation?|speech
701|HAL|"Yeah, I mean, you want to be in a
relationship but you can't stay in
one."|speech
702|OLIVER|"That's your fatherly advice?
Personal ads?"|speech
703|(CONTINUED)|10/29/07 41.|speech
704||CONTINUED:|location
705|HAL|"Well, a lot of people use them... I
did."|speech
706|OLIVER|What?|speech
707|HAL|"If Andy wasn't going to be
monogamous, why should I be?"|speech
708|OLIVER|Jesus, Pop.|speech
709|HAL|Jesus yourself.|speech
710||INT. HAL FIELD'S HOUSE- DAY|location
711||"Hal's friends hold up a hand-made ""WELCOME HOME"" sign in the
living room. Oliver helps Hal walk to his crew, Andy at the
center holding Arthur."|stage direction
712|HAL|"Hello house (Answers back in deep
voice) Hello Hal."|speech
713||"Andy holds Arthur. Hal and Arthur kiss. They've clearly
missed each other.
JUMP CUTS: Oliver takes bottles of pills and syrups and
inhalers out of a Sav-On bag. He makes a chart of the
medicine, the dosage, and puts the pills in a dish. It's
emotional job for him."|stage direction
714||INT. HAL'S DINING/KITCHEN|location
715||"Oliver watches as Andy sneaks up behind Hal with his hands
cupped closed. Hal turns and smiles."|stage direction
716|HAL|"Oh God, what have you got this
time?"|speech
717|ANDY|It's a green caterpillar.|speech
718|HAL|"No, no, no, you don't have a green
caterpillar."|speech
719|ANDY|Oh yeah I do.|speech
720|(CONTINUED)|10/29/07 42.|speech
721||CONTINUED:|location
722||"Andy opens his hands to reveal he actually does have a green
caterpillar."|stage direction
723|HAL|Oh my God. Gross! Oh, Jesus...|speech
724||"Andy puts the caterpillar down on the saucer of Hal's tea
cup, gives him a big kiss, and starts to leave..."|stage direction
725|HAL|Hey, you going?|speech
726|ANDY|Yeah, Michael's in town.|speech
727|HAL|Oh. Right.|speech
728||"Andy waves goodbye and leaves. Hal is sad but covering it
up. He catches Oliver watching."|stage direction
729|OLIVER|I thought he was your boyfriend?|speech
730|HAL|"Well, at least I'm the number one
boyfriend."|speech
731||Hal grimaces in pain, doubles over.|stage direction
732|OLIVER|Pop.|speech
733|HAL|Oh, my stomach.|speech
734|OLIVER|Alright, come on. Come on.|speech
735||"Oliver tries to clear the couch of books and dogs for Hal to
sit down."|stage direction
736|OLIVER|Arthur, down.|speech
737|HAL|"Well, let's say, when you were
little, you always dreamed of some
day getting a lion?"|speech
738||Oliver eases Hal down onto the couch.|stage direction
739|(CONTINUED)|10/29/07 43.|speech
740||CONTINUED:|location
741|HAL|"And you wait and you wait and you
wait and you wait and the lion
doesn't come. Then along comes a
giraffe."|speech
742||Oliver helps Hal get his feet up.|stage direction
743|HAL|"You can be alone or you can be with
the giraffe."|speech
744|OLIVER|I'd wait for the lion.|speech
745||Oliver grabs the oxygen tubes and puts them on Hal's face.|stage direction
746|HAL|That's why I worry about you.|speech
747||"Hal looks at Oliver with love and concern.
CUT TO PRESENT"|stage direction
748||INT. OLIVER'S OFFICE - DAY|location
749||"CU on Oliver's hands as he writes ""THE HISTORY OF SADNESS"".
CUT TO him drawing an explosion with the caption: ""EARTH
BEGINS (SADNESS NOT YET INVENTED)"". He draws a man and a
woman with the caption: ""FIRST COUPLE TO MARRY FOR WRONG
REASONS."" He draws a spilled glass - ""INVENTION OF ALCOHOL,
ANCIENT EGYPT."" He draws a man's face and torso: ""FIRST GAY
MAN ACCUSED OF BEING MENTALLY ILL."" He draws a man labelled
""PRESENT"" having been crushed by a giant boulder labelled
""PAST.""
Oliver stops drawing, thinking of a conversation with his
father. CUT TO: Hal on his couch (previous scene) talking to
Oliver."|stage direction
750|HAL|"You want me to be with someone like
me. I like Andy cause he's not like
me... he's fun."|speech
751||INT. ANNA'S HOTEL HALLWAY|location
752||"Arthur runs down the hotel hallway, followed by Oliver, they
come to a corner and Anna jumps out, scaring them, they laugh
and continue on together."|stage direction
753|HAL|10/29/07 44.|speech
754||INT. MELROSE BOOK STORE NIGHT|location
755||"Oliver and Anna are in the overcrowded used book store we saw
earlier. Oliver sees her down the aisle."|stage direction
756|OLIVER|Hey, what did you get?|speech
757||"She puts the cover of Liv Ullman's ""Changing"" over her face -
Ullman's face on the cover becomes Anna's."|stage direction
758|OLIVER (CONT'D)|Liv Ullman. Very serious.|speech
759|ANNA|And I found this crazy book.|speech
760||She holds an old copy of THE JOY OF SEX in front of her face.|stage direction
761|OLIVER|"That's kind of a classic American
thing."|speech
762||"Anna opens the book to a large drawing of a couple having
sex."|stage direction
763|ANNA|"Maybe we can figure out some
classic American things to do."|speech
764||Oliver takes the book and flips through the pages.|stage direction
765|OLIVER|Yeah, Like page 75?|speech
766|ANNA|Uh-huh.|speech
767|OLIVER|"Or 75 all the way through, through
80."|speech
768||"LATER...
Oliver, Anna and Arthur sit at the end of an aisle looking at
a book on ""Old Hollywood"". The book has a photo of Louise
Brooks from the Twenties."|stage direction
769|"OLIVER
(READING)"|"Louise Brooks, star of silent
screen... effectively banned from
Hollywood in early Thirties, ended
up working as a salesgirl at Saks
Fifth Avenue."|speech
770|(CONTINUED)|10/29/07 45.|speech
771||CONTINUED:|location
772||"Anna listens. Oliver turns the page, we see a photo of
Veronica Lake."|stage direction
773|OLIVER|Veronica Lake.|speech
774|ANNA|Oh I love her.|speech
775|OLIVER|"She was a pin-up model and a film
star... Success was short-lived...
series of broken marriages... She
struggled with mental illness and
alcoholism. She died of hepatitis
at the age of 53."|speech
776|ANNA|"All these actor stories end sad. I
can tell you that already. It's
not a good life."|speech
777||"Oliver closes the book, they share a look, and something
vulnerable. Anna changes the mood, pulls out The Joy Of Sex,
skips through the pages as she talks."|stage direction
778|ANNA (CONT'D)|So. Now I want real Mexican food.|speech
779||She stops on an illustration she likes.|stage direction
780|ANNA (CONT'D)|And I want to try page... 46.|speech
781||EXT. STREET TACO TRUCK - NIGHT|location
782||"Oliver, Anna and Arthur walk up to a typical L.A. Taco truck
on the side of the street. There is nothing fancy looking
about it."|stage direction
783|ANNA|No.|speech
784|OLIVER|Yeah.|speech
785|ANNA|Really?|speech
786|OLIVER|It's really good.|speech
787||"JUMP CUT: They're sitting on milk crates by the truck, ready
to take their first bite, Anna dives in un-selfconsciously,
we're not sure what she thinks."|stage direction
788|(CONTINUED)|10/29/07 46.|speech
789||CONTINUED:|location
790|OLIVER|What do you think?|speech
791|ANNA|It's so good.|speech
792||Oliver's so relieved.|stage direction
793|OLIVER|"It's good? Oh, I wasn't sure you'd
like it."|speech
794|ANNA|Why?|speech
795|OLIVER|"You're an actress and staying in
that fancy hotel."|speech
796||Anna can barely swallow her huge bite...|stage direction
797|ANNA|I like this place.|speech
798||INT. ANNA'S HOTEL ROOM|location
799||"They lie on the bed, continuing their conversation, side by
side, looking up at the ceiling together."|stage direction
800|ANNA|"I used to love hotels. But now I'm
always in a new apartment or... in
another hotel somewhere."|speech
801|OLIVER|"How do you keep hold of friends...
or boyfriends?"|speech
802|ANNA|"It makes it very easy to end up
alone - to leave people."|speech
803|OLIVER|"You can stay in the same place and
still find ways to leave people."|speech
804||She reaches up with her hand, their fingers intertwine.|stage direction
805|ANNA|You are like that? Its what you do?|speech
806||"Oliver nods yes. They know each other much better than either
one knew."|stage direction
807|ANNA|So we are the same?|speech
808|(CONTINUED)|10/29/07 47.|speech
809||CONTINUED:|location
810|OLIVER|Yeah, I guess so.|speech
811||"The look to each other.
CUT TO PAST"|stage direction
812||INT. HAL'S HOUSE - OLIVER'S ROOM - NIGHT|location
813||"Thumps and loud 1920's music wakes Oliver in the middle of
the night. He turns the lights on, discombobulated.
He gets up, works his way through the dark house. Turning on
lights."|stage direction
814|OLIVER|Pop?|speech
815||INT. HAL'S LIVING ROOM - NIGHT|location
816||"Hal's awake, he's taken down dozens of books from a wall to
wall bookshelf. A huge physical task. MARIA a nurse is with
him. Oliver's dumbfounded."|stage direction
817|HAL|"Oh, did I wake you? Yeah. (Handing
Maria some books) Thank you Maria.
(to Oliver) And now that you're
here, uh, would you please put
those up there?"|speech
818|OLIVER|What are you--? Pop. What?|speech
819|HAL|I'm reorganizing.|speech
820|OLIVER|Prednisone makes you crazy.|speech
821|HAL|I'm just not sleepy. I feel great.|speech
822||INT. HAL'S OFFICE|location
823||"Oliver and Hal are sitting at either side of his desk, Arthur
is in hal's lap. The sound from last scene bleeds over..."|stage direction
824|HAL|"OLIVER (V.O.)
Pop, you should rest."|speech
825||Hal looks sick but energized, he shuffles his desk of papers.|stage direction
826|(CONTINUED)|10/29/07 48.|speech
827||CONTINUED:|location
828|HAL|"As soon as I finish these papers.
Right, papers? (In a different
voice) Right, Hal. As soon as
you're done, you can rest."|speech
829||"Oliver can only sit and worry.
CUT TO PRESENT"|stage direction
830||EXT. ELYSIAN PARK|location
831||"Anna, Oliver and Arthur are walking in Elysian park, a view
of downtown behind them. Oliver's looking at her face, she
notices."|stage direction
832|ANNA|What?|speech
833|OLIVER|Nothing, you're pretty.|speech
834|ANNA|No...|speech
835|OLIVER|Yeah.|speech
836|ANNA|"Jewish girls are not pretty. They
can be ""interesting"", or cute, but
not pretty."|speech
837|OLIVER|You're kidding right?|speech
838|ANNA|That's what my mom told me.|speech
839|OLIVER|She did not.|speech
840||"Anna laughs. As Anna continues to explain, the sound begins
to fade down..."|stage direction
841|ANNA|"No, you're right, this girl at
school told me that. And I went
home and my mom said, `Anna, who
told you that?"|speech
842||And Oliver's narration fades in over them walking...|stage direction
843|(CONTINUED)|10/29/07 49.|speech
844||CONTINUED:|location
845|(CONTINUED)|"OLIVER (V.O.)
This is what it looks like when
Anna tells me about being Jewish in
2003. And when I tell her that my
mother was Jewish. And then my
father turned in his gay badge when
my mother turned in her Jewish
badge. And they got married in
1955."|speech
846||"CUT TO NARRATED SEQUENCE
STILL PHOTOGRAPHS FLASH BEFORE US:
PHOTOS OF GEORGIA IN 1938, F.D.R., BUSINESS MEN..."|stage direction
847|(CONTINUED)|"OLIVER (V.O.)
My mother didn't know she was
Jewish until she was 13. It was
1938. This is what people looked
like."|speech
848||"THEN LIONS AND GIRAFFES FROM 1938. THEN ADOLF HITLER ON TIME
MAGAZINE COVER."|stage direction
849|(CONTINUED)|"OLIVER (V.O.)
And lions and giraffes. This man
was Man of the Year."|speech
850||THEN GEORGIA'S FATHER IN 1938, GEORGIA'S SWIM TEAM PHOTO.|stage direction
851|(CONTINUED)|"OLIVER (V.O.)
Her father tried to hide that they
were Jewish. This is the swim team
that asked her to leave once they
discovered that she was Jewish."|speech
852||"THEN A QUICK SERIES OF ANGLO LOOKING FEMALE MODELS AND PIN-
UP'S FROM 1938."|stage direction
853|(CONTINUED)|"OLIVER (V.O.)
This is what pretty looked like in
1938."|speech
854||NOW A STILL PHOTO OF HAL IN 1938.|stage direction
855|(CONTINUED)|"OLIVER (V.O.)
My father realized he was gay when
he was 13. It was 1938."|speech
856||"THEN A SERIES OF PHOTOS OF MALE MODELS IN SWIM SUITS AND
EXERCISING."|stage direction
857|(CONTINUED)|"OLIVER (V.O.)
This is what pretty looked like."|speech
858|(CONTINUED)|10/29/07 50.|speech
859||CONTINUED:|location
860||"THEN PHOTOS OF THEIR HIGH SCHOOL, G.I.'S FROM W.W.2, AND
JAMES DEAN."|stage direction
861|(CONTINUED)|"This is the high school where they
first met. This is the war they
both went to. And this man was
popular when they met again."|speech
862||NOW A PHOTO OF A PUBLIC RESTROOM.|stage direction
863|(CONTINUED)|"OLIVER (V.O.)
This is the only place my father
could hide and have sex in the
Fifties."|speech
864||"NOW HISTORICAL FILM FOOTAGE OF GAY MEN BEING BUSTED BY THE
VICE SQUAD IN THE 1950'S AND BEING LOADED INTO PATTY-WAGONS."|stage direction
865|(CONTINUED)|"OLIVER (V.O.)
My father said if you got caught my
the Vice Squad you could lose
everything...
This is everything."|speech
866||"A RAPID-FIRE SEQUENCE OF FACES AND PEOPLE FROM 1950'S
ADVERTISEMENTS - EVERYONE HAPPY AND ENJOYING THEIR CARS,
FAMILIES, MEALS AND HAIR PRODUCTS.
NOW A STILL PHOTOGRAPH OF A PSYCHIATRISTS COUCH."|stage direction
867|(CONTINUED)|"OLIVER (V.O.)
My father laid down on a couch like
this and told the psychiatrist all
his problems in 1955. The doctor
told him that homosexuality was a
mental illness, but it could be
cured."|speech
868||AND THEN A MEDICAL MODEL OF A HUMAN BRAIN.|stage direction
869|(CONTINUED)|"OLIVER (V.O.)
Not everyone got cured."|speech
870||A MAP OF 1950'S LA, WITH SMALL ARROW POINTING TO THEIR HOME|stage direction
871|(CONTINUED)|"OLIVER (V.O.)
This is where my parents lived in
1955."|speech
872||"ANOTHER ARROW SUPERS ON VERY CLOSE TO THEIR HOME.
TITLE: THE MATTACHINE SOCIETY"|stage direction
873|(CONTINUED)|10/29/07 51.|speech
874||CONTINUED:|location
875|(CONTINUED)|"OLIVER (V.O.)
And this is the home where the
first gay rights group was secretly
meeting."|speech
876||NOW A STILL PHOTO OF AN EMPTY CHURCH FROM THE 1950'S.|stage direction
877|(CONTINUED)|"OLIVER (V.O.)
While they were reciting their
vows, here in this church..."|speech
878||AND THEN A STILL FROM ALLEN GINSBERG'S 1955 APARTMENT.|stage direction
879|(CONTINUED)|"OLIVER (V.O.)
Allen Ginsburg was writing his
famous poem, Howl, blocks away in
this room."|speech
880||"AS WE SLOWLY ZOOM INTO GINSBERG'S APARTMENT, HISTORICAL
RECORDING OF HIM READING HOWL FADES UP AND OVER THE NEXT
SCENE."|stage direction
881|(CONTINUED)|"ALLEN GINSBERG (V.O.)
Who let themselves be fucked in the
ass by saintly motorcyclists and
screamed with joy. Who blew and
were blown..."|speech
882||CUT TO PRESENT|stage direction
883||INT. OLIVER'S OFFICE - DAY|location
884||"GINSBERG'S READING CONTINUES OVER: Oliver flips through a
mock-up he made for ""The Sads"" - it's all the happy faces
from 1950's advertising that we saw in the last scene. One
face per-panel.
LATER: the three members of ""The Sads"" and a RECORD COMPANY
REP arrive. Jelly Roll Morton piano plays, we see but do not
hear the meeting take place. The Sads look at the designs,
which include many of the ""History Of Sadness"" drawings we
have seen now in CD cover format - and no portraits of the
band. It's clear that The Sads are not into Oliver's work.
CUT TO: After the meeting, the RECORD COMPANY REP talks to
Oliver alone."|stage direction
885|(CONTINUED)|"RECORD COMPANY LADY
Just do the portrait of them, it's
an album cover, right? That's what
they want. Yeah?"|speech
886||Oliver's very disappointed but polite.|stage direction
887|(CONTINUED)|10/29/07 52.|speech
888||CONTINUED:|location
889|OLIVER|Yeah. Right.|speech
890||"EXT OFFICE BUILDING - CONTINUOUS
Oliver and Arthur leave the office, defeated.
CUT TO PAST"|stage direction
891||INT. HAL'S LIVING ROOM - DAY|location
892||"Oliver walks into Hal's living room, carrying his full tray
of medication."|stage direction
893|OLIVER|Here, Pop.|speech
894|HAL|Oh, God.|speech
895|OLIVER|I know, I know. Come on.|speech
896||"Hal begins taking his many pills, with each one he pings his
glass with a teaspoon as he swallows. The room is cluttered
with books. Oliver picks up a toppling pile of files from a
paper-filled side table."|stage direction
897|HAL|"Hey, no, no, no. That's the Gay
Pride Day stuff. Just leave those."|speech
898|OLIVER|Alright.|speech
899||"Oliver begins to neaten a messy pile of books on top of a
chair."|stage direction
900|HAL|"And that's for gay book club. You
better leave those too."|speech
901|OLIVER|"But what about this chair? Is it
gay?"|speech
902|HAL|The chair's not gay. Obviously.|speech
903||"Hal gets up and walks to the kitchen, his oxygen cannon cord
is attached to the pump behind him, stopping him short."|stage direction
904|(CONTINUED)|10/29/07 53.|speech
905||CONTINUED:|location
906|OLIVER|"Pop, Pop, the cord won't go that
far."|speech
907|HAL|Oh, to hell with it.|speech
908||"Hal pulls off the oxygen and keeps walking, frail but
determined. Andy enters with a large pilates ball."|stage direction
909|HAL|Oh, hey what's that?|speech
910|ANDY|"Now that you're out of the
hospital, you'll have to exercise,
get you back into shape."|speech
911||Oliver can't believe it.|stage direction
912|HAL|That's a great idea.|speech
913|ANDY|"Okay, let's try it. I'll, I'll show
you how."|speech
914||Hal's still heading to the sink.|stage direction
915|HAL|"Yeah, later on, I'm gonna make
myself some tea."|speech
916|ANDY|"Okay, I'll clean it up. It's a
little - yech."|speech
917||"Andy walks out, Hal pours water into a kettle, in front of
him on the window sill is the same vase from the first scene
of the film, with some dead daisies in it."|stage direction
918|HAL|"Your mother's vase needs some
flowers."|speech
919||Oliver looks at them frustrated and uneasy...|stage direction
920||INT. STAPLES - DAY|location
921||"Oliver and Hal walk amongst all the products. Hal wears his
portable oxygen and grabs different kinds of papers, dumping
them in the basket Oliver holds."|stage direction
922|OLIVER|"Pop, you just got out of the
hospital, you should take it easy."|speech
923|(CONTINUED)|10/29/07 54.|speech
924||CONTINUED:|location
925||They're in a new isle, Hal continues his march.|stage direction
926|OLIVER|"You need to tell Andy that
you're... not well."|speech
927||Hal, continues on, avoiding looking at Oliver.|stage direction
928|HAL|You'll tell him, won't you?|speech
929||"Oliver's flabbergasted, but his dad's vulnerability is clear
to him."|stage direction
930|OLIVER|Me?|speech
931|HAL|Please?|speech
932||INT. HAL'S GUEST HOUSE - DAY|location
933||"Andy's on an elliptical trainer, through a window we can see
Oliver approaching with the weight of the world on his
shoulders. Andy see's him, can immediately sense that
something is wrong."|stage direction
934|OLIVER|Hey.|speech
935||"Oliver approaches seriously, this makes Andy nervous, he
stops his workout. Oliver tries to find his words."|stage direction
936|ANDY|"You know that I tried to have sex
with women?"|speech
937|OLIVER|Yeah?|speech
938|ANDY|"Yeah. I wanted you to know I
tried, it just, it didn't work."|speech
939|OLIVER|"Hey, I don't have a problem with
gay guys."|speech
940|ANDY|Have you ever had sex with a man?|speech
941|OLIVER|No.|speech
942|(CONTINUED)|10/29/07 55.|speech
943||CONTINUED:|location
944|ANDY|"I heard that if a man hasn't had
sex with another man, he's always
afraid of gay men. You know,
they're a threat."|speech
945||Oliver's blown away by the logic.|stage direction
946|OLIVER|I don't know Andy.|speech
947|ANDY|"I didn't want you to feel
threatened, I don't want to have
sex with you. What I do, most
people wouldn't even call it sex."|speech
948||"Andy's relieved he got this off his chest, all tension is
relieved for him, Oliver is just confused."|stage direction
949|OLIVER|Okay, okay.|speech
950|ANDY|Hey...|speech
951||Andy gives Oliver a big sweaty hug. Oliver leaves.|stage direction
952||INT. HAL'S KITCHEN - CONTINUOUS|location
953||Oliver enters as Hal's finishing the dishes.|stage direction
954|OLIVER|I couldn't tell him.|speech
955|HAL|That's okay.|speech
956|OLIVER|"No it's not. You can't hide this
from him. He loves you."|speech
957|HAL|"For someone with so much
relationship advice, you seem
awfully alone."|speech
958||"Oliver, angry but at a loss for words, takes the flower vase
and leaves, Arthur follows."|stage direction
959||EXT. HAL'S HOUSE - CONTINUOUS|location
960||"Oliver and Arthur exit a side door, go to a planter full of
daisies and cuts some for his mother's vase. He looks back
Arthur."|stage direction
961|(CONTINUED)|10/29/07 56.|speech
962||CONTINUED:|location
963|OLIVER|"Just act natural. When he's not
looking, we'll make a run for it,
okay?"|speech
964||CUT TO PRESENT|stage direction
965||EXT. GRIFFITH PARK|location
966||"We cut to Arthur sprinting up a trail in Elysian park. Oliver
and Anna chase after him. In contrast to the previous scene
there is lightness and laughter here."|stage direction
967||INT. ANNA'S HOTEL ROOM NIGHT|location
968||"The three enter, the phone is ringing, Anna is staring at it
with dread. Oliver looks at her, he finally moves to pick it
up."|stage direction
969|ANNA|Don't, don't.|speech
970||It keeps ringing.|stage direction
971|ANNA|It's my dad.|speech
972||They both watch the phone as it rings and stops.|stage direction
973|OLIVER|He's that bad?|speech
974||"She picks up the phone, and gestures for Oliver to pick up
the line next to him."|stage direction
975|ANNA (CONT'D)|I'll be my dad, you be me.|speech
976|OLIVER|OK.|speech
977|ANNA|(In a deep man's voice) Honey?|speech
978||"She gestures again, Oliver picks up the phone on his side of
the bed. Anna turns away, he can only see her back across the
bed. He turns away too."|stage direction
979|OLIVER|Oui?|speech
980||Anna continues to talk in a different voice.|stage direction
981|ANNA|C'est toi, cheri?|speech
982|(CONTINUED)|10/29/07 57.|speech
983||CONTINUED:|location
984|OLIVER|Oui Papa.|speech
985|ANNA|You never call me back.|speech
986|ANNA|"You know, I can't stop thinking
about, you know, about it. Doing
it."|speech
987|OLIVER|Doing what?|speech
988|ANNA|"Killing myself. You are the only
one I can tell that to."|speech
989||Oliver breaks role, turns around looks at her.|stage direction
990|OLIVER|"You should tell mom about that, not
me."|speech
991||She just looks at him. Back into phone.|stage direction
992|ANNA|You are my girl.|speech
993||"They hang up. She's embarrassed, she lightens the mood to get
out of this intimacy."|stage direction
994|ANNA|Now I have to kill you.|speech
995|OLIVER|Just as it was going so well.|speech
996|ANNA|I know. I'm sorry.|speech
997||"She tosses a pillow over his face and pretends to shoot him
twice. She pulls the pillow back tentatively, he's smiling."|stage direction
998|OLIVER|Hey Anna?|speech
999|ANNA|Hey Oliver?|speech
1000|OLIVER|How do you feel about vandalism?|speech
1001||It's the last question she thought he'd ask. She's amused.|stage direction
1002|(CONTINUED)|10/29/07 58.|speech
1003||CONTINUED:|location
1004|ANNA|I don't know. Pretty okay.|speech
1005||EXT. LOS ANGELES STREETS/INT. CAR - NIGHT|location
1006||"Anna, Oliver, Elliott, Shauna and Arthur drive up Sunset
Blvd. They arrive at Alvarado, park and get out. Above them a
well lit large blank/white billboard. As Oliver and Elliott
get spray paint cans from the back of the car..."|stage direction
1007|ELLIOTT|"Oliver, don't write any of that
serious stuff, okay? Just write
something funny. Girls like funny."|speech
1008||EXT. ROOFTOP|location
1009||"The gang get to the top of the stairs, on to the roof where
they can see the large blank billboard towering in front of
them."|stage direction
1010|SHAUNA|"You know what? Here, give me
Arthur. We'll just stay here and
get arrested. You know, that's
good."|speech
