|character|text|type
668|REPORTER (LLOYD)|"I'm standing here with Senate
Minority Leader Robert Rumson, just
one of the many guests arriving at
what, for a few hours at least, is a
non-partisan White House. Senator,
the latest public opinion survey
shows the President with approval
ratings that would make him all but
unbeatable, come next November. Is
there a Republican who can mount a
serious challenge, and are you that
candidate?"|speech
669|RUMSON|"Lloyd, it's a long time till next
November. Right now, I'm just
looking forward to a pleasant evening."|speech
670||CUT TO:|unknown
671||INT. SHEPHERD'S BEDROOM - NIGHT|location
672||Lucy is standing behind her father, tying his bow tie.|stage direction
673|SHEPHERD|That's a little tight, Luce.|speech
674|LUCY|"It's supposed to be tight. It's
supposed to make you look regal."|speech
675|SHEPHERD|"Is it supposed to cut off the blood
flow to my face?"|speech
676|LUCY|All done.|speech
677||He looks in the mirror.|stage direction
678|SHEPHERD|"Not bad. Where did you learn how to
do this?"|speech
679|LUCY|Social studies.|speech
680|SHEPHERD|Very funny.|speech
681||(smiles)|unknown
682|SHEPHERD|Really, where did you learn?|speech
683|LUCY|I don't know...I just guess...|speech
684|SHEPHERD|"Sweetie, did Mom teach you how to do
this?"|speech
685|LUCY|Yeah.|speech
686||(pause)|unknown
687|SHEPHERD|"Lucy, is this okay with you? My
having dinner with a woman?"|speech
688|LUCY|It's totally okay.|speech
689|SHEPHERD|"Are you sure? Because if you want to
talk about it..."|speech
690|LUCY|Dad, it's cool. Go for it.|speech
691|SHEPHERD|You know, I'm a little nervous.|speech
692|LUCY|You'll be fine. Just be yourself.|speech
693|SHEPHERD|Be myself.|speech
694|LUCY|And compliment her shoes.|speech
695|SHEPHERD|Her shoes?|speech
696|LUCY|Girls like that.|speech
697||CUT TO:|unknown
698||INT. EAST WING ENTRANCE - NIGHT|location
699||"Dressed in formal, but not festive, clothes and holding, as
always, her notepad, JANIE waits by the door.
A SECRET SERVICE AGENT sits alone behind a small desk.
The door opens and SYDNEY walks in. She's, needless to say,
stunning."|stage direction
700|JANIE|"Miss Wade? The President wants you
to join him upstairs in the
residence. May I show you the way?"|speech
701||CUT TO:|unknown
702||INT. SITTING HALL/THE RESIDENCE - NIGHT|location
703||"This formal reception area is filled with special GUESTS. As
SYDNEY walks in, A.J. goes to her immediately."|stage direction
704|A.J.|"Sydney, come on in. You look
beautiful."|speech
705|SYDNEY|"Thank you. I have no idea what I'm
doing here."|speech
706|A.J.|"I promise you there's no hidden
agenda."|speech
707||SHEPHERD approaches SYDNEY.|stage direction
708|SHEPHERD|"Sydney. Andrew Shepherd. We spoke on
the phone."|speech
709|SYDNEY|Yes, sir. I remember.|speech
710||ESTHER, MACINERNERY, A.J.'S wife, joins them.|stage direction
711|A.J.|You know my wife, Esther.|speech
712|SYDNEY|Sure. It's nice to see you again.|speech
713||(affectionately)|location
714|ESTHER|"Sydney, the President told me about
how you two met. I think it's
priceless."|speech
715|SYDNEY|"I don't know what happened. One
minute I was calling him a mockery of
an environmental leader. The next
minute I had a date."|speech
716|ESTHER|"Men like being insulted by women.
It makes them feel loved. Don't ask
me why."|speech
717|A.J.|"Sydney, when you meet the French
President, don't make him feel too
loved, all right? We just signed a
new trade agreement."|speech
718|SYDNEY|Got it.|speech
719||The French President, D'ASTIER, and his WIFE approach.|stage direction
720||(to D'Astier)|location
721|SHEPHERD|"Mr. President, would allow me to
introduce Sydney Ellen Wade of the
Commonwealth of Virginia. Sydney,
this is President Rene-Jean D'Astier
and his wife Monique Danielle
D'Astier of France."|speech
722|SYDNEY|An honor to meet you both.|speech
723|JANIE|"Mr. President, I'm sorry to
interrupt. The receiving line is in
place."|speech
724|SHEPHERD|"Sydney, it sounds like our table's
ready."|speech
725||"SHEPHERD's guests make their way out of the residence,
leaving SHEPHERD with SYDNEY and the FRENCH PRESIDENT and
MDME. D'ASTIER."|stage direction
726||CUT TO:|unknown
727||INT. STAIRCASE - NIGHT|location
728||"SHEPHERD and SYDNEY are walking down the staircase that leads
to the red-carpeted hall through which the President enters
the East Room.
The GROUP escorting the President gives them wide berth so
that the two of them can have some privacy."|stage direction
729|SHEPHERD|"Once we hit the bottom of the
stairs, I gotta do a thing.
You'll be escorted..."|speech
730|SYDNEY|They took me through it.|speech
731||After a slight pause--|stage direction
732||(continuing)|location
733|SYDNEY|Do you do this often, sir?|speech
734||(beat)|location
735|SHEPHERD|"This is, actually, only our second
State Dinner. The first was for the
Emperor of Japan, who died shortly
after that, so we stopped having them
for a while, just in case."|speech
736|SYDNEY|"I meant do you go out on...do you--
often--do you--"|speech
737|SHEPHERD|Do I date a lot?|speech
738|SYDNEY|Well, yeah.|speech
739|SHEPHERD|No. How 'bout you?|speech
740|SYDNEY|"Me? Lately, I seem to be going out
on a lot of first dates."|speech
741|SHEPHERD|Then you're experienced at this.|speech
742|SYDNEY|Oh yeah, you can ask me anything.|speech
743|SHEPHERD|How are we doing so far?|speech
744|SYDNEY|"It's hard to say at this point. So
far it's just your typical first date
stuff."|speech
745||"And all of a sudden an INCREDIBLE SOUND from inside the East
Room--
--The Marine Corps Brass and Percussion Ensemble plays four
ruffles and flourishes."|stage direction
746|SHEPHERD|"Damn. And I wanted to find a way to
be different from the other guys."|speech
747||A BOOMING VOICE over the P.A. announces--|stage direction
748|VOICE (O.S.)|"Ladies and gentlemen, the President
of the United States."|speech
749||And now -- the whole walk timing out with incredible precision --|stage direction
750|SHEPHERD|By the way, nice shoes.|speech
751||"--SHEPHERD walks into the hall as the Brass and Percussion
Ensemble plays HAIL TO THE CHIEF.
The 180 GUESTS come to their feet and applaud long and loud.
The GROUP following the President catches up to the spot
where SYDNEY has stopped walking. They all join in the
applause. We can see in SYDNEY's face that she's been quite
swept up."|stage direction
752||DISSOLVE TO:|unknown
753||INT. EAST ROOM - NIGHT|location
754||"The room is beautifully appointed, with the Marine Corps
Dance Band playing dinner music -- and the SECRET SERVICE
strategically positioned."|stage direction
755||CUT TO:|unknown
756||"AT SHEPHERD'S TABLE
STEWARDS are clearing away the main course and refilling wine
glasses.
In addition to the two main couples, and ESTHER MacINERNEY
and TWO OTHER COUPLES are seated at the President's table."|stage direction
757|SYDNEY|"Mr. President, the President and Mrs.
D'Astier look bored. They're not
talking to anybody."|speech
758|SHEPHERD|"They're hammered. Esther, do you speak
French?"|speech
759|ESTHER|Latin.|speech
760|SHEPHERD|I thought you spoke French.|speech
761|ESTHER|No, Latin.|speech
762|SHEPHERD|"Great, next time Julius Caesar comes
to town, you're our gal. Sydney, I
don't suppose that you speak any--"|speech
763||"(taking over--
to D'Astier)"|unknown
764|SYDNEY|"Monsieur le President, nous sommes
tous habilles, nous avons ce
merveilleux orchestre, une piece
magnifique...comment se fait-il que
les invites ne dansent pas?"|speech
765||(proudly to A.J. and|location
766||Esther)|unknown
767|SHEPHERD|That's my date.|speech
768|D'ASTIER|"Je ne connais pas la tradition en
Amerique, mais dans mon pays, si les
invites de Louis XVI et Marie
Antoinette avaient ose danser devant
le roi et la reine, ils auraient
perdu la tete."|speech
769|SYDNEY|Really?|speech
770|MADAME D'ASTIER|Absolument.|speech
771|SHEPHERD|"Sydney, you didn't dissolve the NATO
treaty, did you?"|speech
772|SYDNEY|"I just said that we're sitting in this
beautiful room, listening to the music
of this wonderful orchestra, and I
wondered why nobody was dancing."|speech
773|D'ASTIER|"And I informed Ms. Wade that in my
country, a guest at the palace of
Louis XVI and Marie Antoinette would
soon find their head in a guillotine
if they made the impertinent gesture
of dancing without so much as a
by-your-leave from the King and the Queen."|speech
774|A.J.|"I'll bet no one accused Louis of
being soft on crime."|speech
775|SYDNEY|There's a lesson there, Mr. President.|speech
776|SHEPHERD|More beheadings at the White House?|speech
777|A.J.|Bob Rumson would embrace it.|speech
778|SHEPHERD|"I'm sure he would, but I have a
better idea."|speech
779||SHEPHERD stands, holds out his hand to SYDNEY.|stage direction
780||(continuing)|location
781|SHEPHERD|Would you like to dance?|speech
782|SYDNEY|"Uh, yeah, I guess. I mean, yes, sir,
I'd love to."|speech
783||"SHEPHERD and SYDNEY move to the dance floor, accompanied by
the appreciative ""oooh's"" and ""ahh's"" of the GUESTS.
The dance band begins, and SYDNEY and SHEPHERD dance...
...beautifully."|stage direction
784||CUT TO:|unknown
785||"THE GUESTS
each and every one of them, have stopped all conversation and
are fixating on this captivating sight. As we go around the
room, we can observe the subtle reactions of, at first,
various anonymous GUESTS, then"|stage direction
786||CUT TO:|unknown
787||"A.J. AND ESTHER MACINERNEY,
holding hands smiling as they watch their old friend, and we"|stage direction
788||CUT TO:|unknown
789||"RUMSON'S TABLE
where the Minority Leader's game face can barely conceal the
gears that have slowly begun to turn in his head, as we"|stage direction
790||CUT TO:|unknown
791||SHEPHERD AND SYDNEY DANCING|stage direction
792|SYDNEY|I don't know how you do it.|speech
793|SHEPHERD|Arthur Murray. Six lessons.|speech
794|SYDNEY|"That's not what I mean. Two hundred
pairs of eyes are focused on you
right now, with two questions:
""Who's this girl, and why's our
president dancing with her?"""|speech
795|SHEPHERD|"First of all, the 200 pairs of eyes
aren't focused on me. They're
focused on you. And the answers are
""Sydney Ellen Wade"" and ""Because she
said 'yes.'"""|speech
796||"LEWIS AND ROBIN
looking on from the back of the room."|stage direction
797|LEWIS|They make a nice couple.|speech
798|ROBIN|Lovely.|speech
799|LEWIS|We've got troubles.|speech
800|ROBIN|Huge.|speech
801||As PEOPLE start onto dance floor, we|stage direction
802||CUT TO:|unknown
803||INT. A BLACK LIMOUSINE - NIGHT|location
804||"as it pulls away from the White House and into the night. In
the back, SYDNEY slips a shoe off and rubs her foot.
She smiles, then turns around to look out the back window as
the White House slips out of view."|stage direction
805||CUT TO:|unknown
806||INT. WHITE HOUSE - MORNING|location
807||SERIES OF SHOTS - DAY IN THE LIFE|stage direction
808||CUT TO:|unknown
809||INT. OUTER OFFICE OF THE OVAL OFFICE - DAY|location
810||"MRS. CHAPIL and JANIE are at their respective desks as
SHEPHERD walks in."|stage direction
811|SHEPHERD|Good morning, Mrs. Chapil.|speech
812|MRS. CHAPIL|"Good morning, Mr. President. Mr.
Rothschild and Miss McCall are in the
office, sir. They said they needed to
speak with you before scheduling."|speech
813|SHEPHERD|"Fine. Janie, can you get me the
number of a local florist?"|speech
814|JANIE|"I'll take care of it, sir. Where do
you want them sent?"|speech
815|SHEPHERD|"I want to do it myself. I just need
the phone number."|speech
816|JANIE|I don't understand.|speech
817|SHEPHERD|I want the phone number of a florist.|speech
818|JANIE|You just want the phone number?|speech
819|SHEPHERD|Yeah.|speech
820||(beat)|location
821|JANIE|I don't understand, sir, is there--|speech
822|SHEPHERD|"I want to send some flowers, Janie.
I want to do it myself. I don't want
to staff it out, and I don't want to
issue an Executive Order. I just
want a phone number."|speech
823|JANIE|I'll get it for you right away, sir.|speech
824|SHEPHERD|Thank you.|speech
825||He heads into the office.|stage direction
826||CUT TO:|unknown
827||INT. THE OVAL OFFICE - DAY|location
828||where LEWIS and ROBIN are waiting anxiously.|stage direction
829|ROBIN|"Mr. President, we need five minutes
before scheduling if you can spare it."|speech
830||(to Robin)|location
831|SHEPHERD|"I just need two minutes to make a
call and I'll be right with you."|speech
832||JANIE enters and hands SHEPHERD a piece of paper.|stage direction
833||(continuing)|location
834|SHEPHERD|Thank you, Janie.|speech
835||She exits.|stage direction
836|LEWIS|Who are we calling, sir?|speech
837|SHEPHERD|"I'm calling the Organization of the
United Brotherhood of It's-None-of-
Your-Damn-Business, Lewis. I'll be
with you in a minute."|speech
838|LEWIS|Yes, sir.|speech
839||"LEWIS and ROBIN exit the Oval Office. SHEPHERD picks up the
phone."|stage direction
840||(to the OPERATOR)|location
841|SHEPHERD|"Yeah, good morning. How do I get an
outside line? Really? That's simple.
Thank you."|speech
842||SHEPHERD dials the phone number JANIE's given him.|stage direction
843||CUT TO:|unknown
844||"LEWIS and ROBIN
hovering near the outer office."|stage direction
845|LEWIS|Janie?|speech
846|JANIE|Yes?|speech
847|LEWIS|What's the President doing?|speech
848|JANIE|"I'm sorry, I'm really not at liberty
to say."|speech
849||CUT TO:|unknown
850||SHEPHERD ON THE PHONE|stage direction
851||(into phone)|location
852|SHEPHERD|"Tell me something. What is the state
flower of Virginia?"|speech
853||CUT TO:|unknown
854||THE OUTER OFFICE|stage direction
855|ROBIN|"Does this have something to do with
Sydney Wade?"|speech
856|JANIE|I'm really not at liberty to say.|speech
857||CUT TO:|unknown
858||SHEPHERD AT HIS DESK|stage direction
859||(into phone)|location
860|SHEPHERD|"Is there someone else there who might
know?"|speech
861||(beat)|location
862|SHEPHERD|"No, I'm not trying to five you a hard
time, I was--hold on please."|speech
863||"THE OUTER OFFICE
SHEPHERD'S VOICE comes through on INTERCOM."|stage direction
864||(through intercom)|location
865|SHEPHERD (O.S.)|"Janie, what's the state flower of
Virginia?"|speech
866||(turning to MRS.|location
867||CHAPIL)|unknown
868|JANIE|"Mrs. Chapil. State flower of
Virginia."|speech
869|MRS. CHAPIL|The dogwood.|speech
870||CUT TO:|unknown
871||SHEPHERD AT HIS DESK|stage direction
872||(through intercom)|location
873|JANIE (O.S.)|The dogwood, sir.|speech
874||(to JANIE)|location
875|SHEPHERD|Thank you.|speech
876||(into phone)|location
877|SHEPHERD|It's the dogwood.|speech
878||(pause)|location
879|SHEPHERD|What? Hold on please.|speech
880||(to JANIE, through|location
881||intercom)|unknown
882|SHEPHERD|"Janie, the dogwood is a tree, not a
flower."|speech
883||CUT TO:|unknown
884||"THE OUTER OFFICE
LEON KODAK walks by."|stage direction
885|KODAK|It's a tree and a flower.|speech
886|JANIE|Are you sure?|speech
887|KODAK|Yes. What's going on?|speech
888||CUT TO:|unknown
889||OVAL OFFICE|stage direction
890||(through intercom)|location
891|JANIE (O.S.)|Sir, it's a tree and a flower.|speech
892||(into phone)|location
893|SHEPHERD|"The dogwood is both a tree and a
flower. I'd like a dozen, please.
Really? No dogwoods? How 'bout
roses? Simple. Classic. Two dozen
roses."|speech
894||CUT TO:|unknown
895||THE OUTER OFFICE|stage direction
896|LEWIS|"Janie, I'm the President senior
domestic policy advisor. It's
important that I have a full
understanding of--"|speech
897|SHEPHERD (O.S.)|"Janie! Do you have any idea where
my credit cards might be?"|speech
898||CUT TO:|unknown
899||SHEPHERD AT HIS DESK|stage direction
900|JANIE|"They're in storage in Wisconsin with
the rest of your personal items."|speech
901|SHEPHERD|Ah.|speech
902||(into phone)|location
903|SHEPHERD|"Listen, what might be better is if
you just bill me for the flowers.
I'm sure it'll be okay with your
boss. Well, I don't know if you
recognize my voice, but this is the
President."|speech
904||(beat)|location
905|SHEPHERD|The United States.|speech
906||(they've hung up)|location
907|SHEPHERD|Hello, hello...|speech
908||CUT TO:|unknown
909||INT. LEO SOLOMON'S OFFICE - DAY|location
910||SYDNEY enters.|stage direction
911|SYDNEY|Leo, you wanted to see me?|speech
912|LEO|"So there I was, thinking maybe I
should give Sydney a call. She's
new in town, doesn't know many
people..."|speech
913||"LEO produces a copy of the morning paper, which has a photo
of SHEPHERD and SYDNEY dancing."|stage direction
914|SYDNEY|Leo--|speech
915|LEO|Then I picked up the Times--|speech
916|SYDNEY|It was crazy. He called me at home.|speech
917|LEO|What's going on?|speech
918|SYDNEY|"Nothing. It was innocent. His
cousin got the flu at the last
minute."|speech
919|LEO|Did you sleep with him?|speech
920|SYDNEY|What?|speech
921|LEO|Did you sleep--|speech
922|SYDNEY|That's none of your business, Leo.|speech
923|LEO|Yeah, it is, Sydney.|speech
924|SYDNEY|"You wanna tell me how my personal
life in any way--"|speech
925|LEO|"Because when it's the President, it's
not personal. Sydney, I hired your
reputation. I hired a pit bull, not
a prom queen."|speech
926|SYDNEY|That's unfair.|speech
927|LEO|"It's incredibly unfair. But you've
spent a lot of time over the year
telling me the trouble with the
environmental lobby is that we don't
understand the fundamental truth that
politics is perception. This is a
bad time to develop ignorance."|speech
928|SYDNEY|You're making way too much of this.|speech
929|LEO|"Am I? This is your time, Sydney.
You're sitting at the grown-ups'
table. You have a chance to get
everything you want -- run a national
campaign, be a major player inside
the party. But this relationship had
better go all the way, because with
the leader of the free world there is
no halfway. Politics is perception,
and if thing don't work out, the
amount of time it'll take you to go
from being a hired gun to a cocktail
party joke can be clocked with an egg
timer."|speech
930||"There's a quick knock at the door -- Leo's SECRETARY steps in
with a strange-looking package."|stage direction
931|SYDNEY|"Leo, there is no relationship. It
was one night. It's done."|speech
932|LEO'S SECRETARY|"Mr. Solomon, this was just delivered
by White House messenger. It's
marked ""Perishable."""|speech
933|LEO|"The White House has sent me something
perishable?"|speech
934|LEO'S SECRETARY|It's for Ms. Wade.|speech
935|LEO|Here we go...|speech
936||SYDNEY begins unwrapping the package.|stage direction
937|SYDNEY|"Relax, Leo. I'm sure it's just a
formality."|speech
938||(exited)|location
939|LEO'S SECRETARY|It's from him.|speech
940|LEO|Of course it's from him.|speech
941|SYDNEY|"So he had some staff flunky send
me a fruit basket."|speech
942|LEO'S SECRETARY|He wrote the note himself.|speech
943|SYDNEY|I'm sure he didn't take the time to--|speech
944|LEO'S SECRETARY|"The messenger said he was waiting in
the Oval Office for ten minutes while
the President wrote the card."|speech
945|SYDNEY|Okay, listen, so he--|speech
946||(to LEO'S SECRETARY)|location
947|SYDNEY|"--it took him ten minutes to write a
card?!"|speech
948|LEO'S SECRETARY|"Apparently he went through several
drafts."|speech
949||SYDNEY can't stifle her laugh -- she sees what the gift is.|stage direction
950|LEO|What is it...what is it?|speech
951|SYDNEY|A ham.|speech
952||(beat)|location
953|LEO|A ham?|speech
954|SYDNEY|He sent me a Virginia ham.|speech
955|LEO'S SECRETARY|"Dig it, Ms. Wade. You're the
President's girlfriend."|speech
956||SYDNEY's smile fades away...she looks at LEO.|stage direction
957|LEO|"There's never an egg timer around
when you need one."|speech
958||CUT TO:|unknown
959||EXT. THE NORTHWEST EXECUTIVE ENTRANCE - DAY|location
960||"as the white-gloved MARINE snaps the door open for SYDNEY,
and we"|stage direction
961||CUT TO:|unknown
962||INT. THE OVAL OFFICE - DAY|location
963||SHEPHERD is conferring with LEWIS and ROBIN.|stage direction
964|ROBIN|"Sir, they're gonna be pressing today
about whether the White House is
prepared to soften the assault
weapons section of the crime bill."|speech
965|LEWIS|"There is no need to entertain that
at this point."|speech
966|ROBIN|"How do you want me to handle the
Sydney issue?"|speech
967|SHEPHERD|The Sydney issue?|speech
968|LEWIS|"We should have a consensus on how the
White House is going to handle it."|speech
969|SHEPHERD|"I sure hope the Sydney issue refers
in some way to a problem we're having
with Australia, because if it's
anything else..."|speech
970||JANIE pokes her head in.|stage direction
971|JANIE|"Mr. President, Ms. Wade is here to
see you."|speech
972|SHEPHERD|"Tell her she can come right in. I'm
finished here."|speech
973|JANIE|Yes, sir.|speech
974|"SHEPHERD
(to LEWIS and ROBIN)"|There is no Sydney issue.|speech
975||"SYDNEY enters, crossing paths with LEWIS and ROBIN. They
exchange pleasantries."|stage direction
976||(to SHEPHERD)|location
977|SYDNEY|"Thanks for seeing me on such short
notice."|speech
978|SHEPHERD|No problem. Did you get the ham?|speech
979|SYDNEY|"I got the ham, yes. Thank you very
much."|speech
980|SHEPHERD|"I wanted to send you flowers, but
there seem to be some kinks in the
system. I'm really glad you stopped
by. I had such a good time last
night."|speech
981|SYDNEY|So did I. It's just that...|speech
982||JANIE enters.|stage direction
983|JANIE|They're 45 seconds away, sir.|speech
984||"During the following, JANIE will go to the desk, pick up two
briefing books and stick them in a briefcase and gather up
his things -- all without interrupting the conversation a beat."|stage direction
985|SHEPHERD|"I'm delivering a luncheon speech at
the Governor's Conference this
morning. I'm sorry to--"|speech
986|SYDNEY|"No, no, that's fine. I just stopped
by to..."|speech
987|SHEPHERD|Are you free for dinner tomorrow night?|speech
988|SYDNEY|Dinner?|speech
989|SHEPHERD|"Casual. In the Residence. Without
the United Nations. My daughter'll
be with us, so it may seem like the
United--"|speech
990|SYDNEY|I'd love to meet Lucy, but...|speech
991||An AIDE has slipped in and hands SHEPHERD a note.|stage direction
992||"(reading to himself
as he talks SYDNEY)"|location
993|SHEPHERD|She's gonna like you.|speech
994||(calling to the AIDE)|location
995|SHEPHERD|Excuse me -- Jeff!|speech
996|SYDNEY|Actually, I have some concerns that--|speech
997||The AIDE (JEFF) steps back in--|stage direction
998|JEFF|Yes, sir.|speech
999||(reading the note)|location
1000|SHEPHERD|I can't do this.|speech
1001|JEFF|Which? Robbins or Stackhouse?|speech
1002|SHEPHERD|Either one. I have to be in and out.|speech
1003|JEFF|"Sir, Governor Stackhouse said he just
needed 10 minutes. I think he wants
to talk about the assault weapons."|speech
1004|SHEPHERD|"Stackhouse wants to talk about
grazing rights. Trust me."|speech
1005|JEFF|Got it.|speech
1006||And he's gone.|stage direction
1007||(to Sydney)|location
1008|SHEPHERD|Sorry. You have concerns.|speech
1009|SYDNEY|"Yes. Not many. A few. One. I have
one concern."|speech
1010|SHEPHERD|"Does it having anything to do with
one of us being the President?"|speech
1011|SYDNEY|"You like to make jokes about this,
but--"|speech
1012|SHEPHERD|"I am not mocking you, honest. I'm
just a guy asking a girl over for a
meal."|speech
1013||"And, as if from out of nowhere, a LOUD CLAAAMMERING, like the
sound of a jackhammer against cement, comes from somewhere
outside -- growing louder and closer --"|stage direction
1014|SYDNEY|What's that?|speech
1015|SHEPHERD|My ride's here.|speech
1016||"And, sure enough, coming into view outside the windows of the
Oval Office, is MARINE-1, the President's helicopter. JANIE
comes back in and helps him on with his coat and scarf."|stage direction
1017|SYDNEY|"Leo Solomon has serious concerns
about my exploring a social, you
know, scenario, with the President
of the United States."|speech
1018|SHEPHERD|"Yeah, well, when you put it that
way, it doesn't sound that great
to me either."|speech
1019|SYDNEY|It's just not--|speech
1020|SHEPHERD|"Have dinner with Lucy and me. It's
meat loaf night -- how presidential
can it be?"|speech
1021||As SHEPHERD rushes out...|stage direction
1022||(continuing)|location
1023|SHEPHERD|Seven-thirty.|speech
1024||"SYDNEY now stands alone in the OVAL OFFICE, trying to figure
out what just happened."|stage direction
1025||CUT TO:|unknown
1026||INT. WHITE HOUSE - SOUTH LAWN - DAY|location
1027||"Marine 1 lifting off the south lawn. TILT DOWN off night sky
to reveal"|stage direction
1028||EXT. WHITE HOUSE - NIGHT|location
1029||CUT TO:|unknown
1030||INT. SITTING HALL/THE RESIDENCE - NIGHT|location
1031||"A room designed more for comfort than for show, with its
overstuffed couches.
Lucy enters."|stage direction
1032|LUCY|Are you Ms. Wade?|speech
1033||(standing up, smiling)|unknown
1034|SYDNEY|Sydney.|speech
1035|LUCY|Lucy Shepherd.|speech
1036|SYDNEY|Nice to meet you.|speech
1037|LUCY|"My dad told me to tell you he's on
the phone with his dentist and that
I should behave myself and entertain
you till he gets here."|speech
1038|SYDNEY|"Your father's on the phone with his
dentist?"|speech
1039|LUCY|"No. He told me to tell you he's on
the phone with his dentist. He wants
you to think he's a regular guy."|speech
1040|SYDNEY|Who is he on the phone with?|speech
1041|LUCY|The Prime Minister of Israel.|speech
1042|SYDNEY|"They're probably not discussing his
teeth."|speech
1043|LUCY|"No. They're talking about that
abbreviation I can never remember."|speech
1044|SYDNEY|C-STAD?|speech
1045|LUCY|Yeah.|speech
1046|SYDNEY|Capricorn Surface To Air Defense.|speech
1047|LUCY|Right.|speech
1048||SHEPHERD enters.|stage direction
1049|SHEPHERD|Let meat loaf night begin.|speech
1050|SYDNEY|Everything all right with your teeth?|speech
1051|SHEPHERD|My teeth?|speech
1052|SYDNEY|The dentist.|speech
1053|SHEPHERD|"Oh, right. I've got a cavity in my
upper bicuspid region."|speech
1054|SYDNEY|"You've got a short-range weapons
system outside Tel Aviv."|speech
1055||(to LUCY)|location
1056|SHEPHERD|You turned on me.|speech
1057|LUCY|Can we eat?|speech
